[I 2024-11-06 21:06:25,688] Trial 704 finished with value: 0.5984003822725799 and parameters: {'n_estimators': 87, 'max_depth': 3, 'min_samples_split': 4, 'min_samples_leaf': 7}. Best is trial 406 with value: 0.5986570551043842.
[I 2024-11-06 21:06:27,951] Trial 705 finished with value: 0.5918513869487873 and parameters: {'n_estimators': 76, 'max_depth': 1, 'min_samples_split': 5, 'min_samples_leaf': 8}. Best is trial 406 with value: 0.5986570551043842.
[I 2024-11-06 21:06:30,547] Trial 706 finished with value: 0.5921026234911293 and parameters: {'n_estimators': 71, 'max_depth': 2, 'min_samples_split': 9, 'min_samples_leaf': 8}. Best is trial 406 with value: 0.5986570551043842.
[I 2024-11-06 21:06:34,452] Trial 707 finished with value: 0.5923026182677521 and parameters: {'n_estimators': 80, 'max_depth': 4, 'min_samples_split': 19, 'min_samples_leaf': 7}. Best is trial 406 with value: 0.5986570551043842.
[I 2024-11-06 21:06:39,683] Trial 708 finished with value: 0.5915103156980198 and parameters: {'n_estimators': 84, 'max_depth': 6, 'min_samples_split': 5, 'min_samples_leaf': 3}. Best is trial 406 with value: 0.5986570551043842.
[I 2024-11-06 21:06:42,829] Trial 709 finished with value: 0.5986432228361309 and parameters: {'n_estimators': 74, 'max_depth': 3, 'min_samples_split': 4, 'min_samples_leaf': 13}. Best is trial 406 with value: 0.5986570551043842.
[I 2024-11-06 21:06:46,262] Trial 710 finished with value: 0.5929259771868066 and parameters: {'n_estimators': 67, 'max_depth': 4, 'min_samples_split': 4, 'min_samples_leaf': 14}. Best is trial 406 with value: 0.5986570551043842.
[I 2024-11-06 21:06:50,338] Trial 711 finished with value: 0.591775028002993 and parameters: {'n_estimators': 71, 'max_depth': 5, 'min_samples_split': 4, 'min_samples_leaf': 13}. Best is trial 406 with value: 0.5986570551043842.
[I 2024-11-06 21:06:53,590] Trial 712 finished with value: 0.5983775815389942 and parameters: {'n_estimators': 78, 'max_depth': 3, 'min_samples_split': 4, 'min_samples_leaf': 13}. Best is trial 406 with value: 0.5986570551043842.
[I 2024-11-06 21:06:55,841] Trial 713 finished with value: 0.5918361125730843 and parameters: {'n_estimators': 74, 'max_depth': 1, 'min_samples_split': 4, 'min_samples_leaf': 13}. Best is trial 406 with value: 0.5986570551043842.
[I 2024-11-06 21:06:59,698] Trial 714 finished with value: 0.598246594495018 and parameters: {'n_estimators': 92, 'max_depth': 3, 'min_samples_split': 4, 'min_samples_leaf': 13}. Best is trial 406 with value: 0.5986570551043842.
[I 2024-11-06 21:07:02,871] Trial 715 finished with value: 0.5912818339088736 and parameters: {'n_estimators': 84, 'max_depth': 2, 'min_samples_split': 3, 'min_samples_leaf': 13}. Best is trial 406 with value: 0.5986570551043842.
[I 2024-11-06 21:07:12,499] Trial 716 finished with value: 0.5902370938303891 and parameters: {'n_estimators': 64, 'max_depth': 29, 'min_samples_split': 4, 'min_samples_leaf': 12}. Best is trial 406 with value: 0.5986570551043842.
[I 2024-11-06 21:07:15,965] Trial 717 finished with value: 0.5921568912025773 and parameters: {'n_estimators': 69, 'max_depth': 4, 'min_samples_split': 3, 'min_samples_leaf': 12}. Best is trial 406 with value: 0.5986570551043842.
[I 2024-11-06 21:07:19,409] Trial 718 finished with value: 0.5983032468968086 and parameters: {'n_estimators': 79, 'max_depth': 3, 'min_samples_split': 4, 'min_samples_leaf': 14}. Best is trial 406 with value: 0.5986570551043842.
[I 2024-11-06 21:07:22,133] Trial 719 finished with value: 0.592437301835236 and parameters: {'n_estimators': 74, 'max_depth': 2, 'min_samples_split': 3, 'min_samples_leaf': 8}. Best is trial 406 with value: 0.5986570551043842.
[I 2024-11-06 21:07:26,467] Trial 720 finished with value: 0.5937320028583633 and parameters: {'n_estimators': 89, 'max_depth': 4, 'min_samples_split': 4, 'min_samples_leaf': 12}. Best is trial 406 with value: 0.5986570551043842.
[I 2024-11-06 21:07:30,963] Trial 721 finished with value: 0.5915792135416547 and parameters: {'n_estimators': 83, 'max_depth': 5, 'min_samples_split': 3, 'min_samples_leaf': 13}. Best is trial 406 with value: 0.5986570551043842.
[I 2024-11-06 21:07:33,509] Trial 722 finished with value: 0.5918067507377837 and parameters: {'n_estimators': 70, 'max_depth': 2, 'min_samples_split': 4, 'min_samples_leaf': 14}. Best is trial 406 with value: 0.5986570551043842.
[I 2024-11-06 21:07:38,351] Trial 723 finished with value: 0.5933573909784313 and parameters: {'n_estimators': 78, 'max_depth': 6, 'min_samples_split': 4, 'min_samples_leaf': 9}. Best is trial 406 with value: 0.5986570551043842.
[I 2024-11-06 21:07:40,848] Trial 724 finished with value: 0.5917638218633813 and parameters: {'n_estimators': 86, 'max_depth': 1, 'min_samples_split': 3, 'min_samples_leaf': 13}. Best is trial 406 with value: 0.5986570551043842.
[I 2024-11-06 21:07:44,466] Trial 725 finished with value: 0.5926120556777914 and parameters: {'n_estimators': 74, 'max_depth': 4, 'min_samples_split': 10, 'min_samples_leaf': 13}. Best is trial 406 with value: 0.5986570551043842.
[I 2024-11-06 21:07:48,090] Trial 726 finished with value: 0.5983996657447802 and parameters: {'n_estimators': 81, 'max_depth': 3, 'min_samples_split': 3, 'min_samples_leaf': 8}. Best is trial 406 with value: 0.5986570551043842.
[I 2024-11-06 21:07:52,740] Trial 727 finished with value: 0.5934776490181333 and parameters: {'n_estimators': 67, 'max_depth': 7, 'min_samples_split': 4, 'min_samples_leaf': 9}. Best is trial 406 with value: 0.5986570551043842.
[I 2024-11-06 21:07:56,028] Trial 728 finished with value: 0.5984890156785799 and parameters: {'n_estimators': 77, 'max_depth': 3, 'min_samples_split': 3, 'min_samples_leaf': 8}. Best is trial 406 with value: 0.5986570551043842.
[I 2024-11-06 21:07:58,630] Trial 729 finished with value: 0.5921668994755558 and parameters: {'n_estimators': 72, 'max_depth': 2, 'min_samples_split': 4, 'min_samples_leaf': 7}. Best is trial 406 with value: 0.5986570551043842.
[I 2024-11-06 21:08:04,013] Trial 730 finished with value: 0.5902431640876953 and parameters: {'n_estimators': 97, 'max_depth': 5, 'min_samples_split': 5, 'min_samples_leaf': 12}. Best is trial 406 with value: 0.5986570551043842.
[I 2024-11-06 21:08:06,789] Trial 731 finished with value: 0.5962965806530335 and parameters: {'n_estimators': 60, 'max_depth': 3, 'min_samples_split': 3, 'min_samples_leaf': 17}. Best is trial 406 with value: 0.5986570551043842.
[I 2024-11-06 21:08:09,247] Trial 732 finished with value: 0.5917128890235319 and parameters: {'n_estimators': 80, 'max_depth': 1, 'min_samples_split': 4, 'min_samples_leaf': 8}. Best is trial 406 with value: 0.5986570551043842.
[I 2024-11-06 21:08:13,387] Trial 733 finished with value: 0.5925605082412024 and parameters: {'n_estimators': 87, 'max_depth': 4, 'min_samples_split': 5, 'min_samples_leaf': 9}. Best is trial 406 with value: 0.5986570551043842.
[I 2024-11-06 21:08:16,046] Trial 734 finished with value: 0.5923512189710275 and parameters: {'n_estimators': 75, 'max_depth': 2, 'min_samples_split': 3, 'min_samples_leaf': 8}. Best is trial 406 with value: 0.5986570551043842.
[I 2024-11-06 21:08:22,032] Trial 735 finished with value: 0.5927624442472679 and parameters: {'n_estimators': 70, 'max_depth': 10, 'min_samples_split': 4, 'min_samples_leaf': 7}. Best is trial 406 with value: 0.5986570551043842.
[I 2024-11-06 21:08:26,029] Trial 736 finished with value: 0.5923882322662303 and parameters: {'n_estimators': 83, 'max_depth': 4, 'min_samples_split': 6, 'min_samples_leaf': 9}. Best is trial 406 with value: 0.5986570551043842.
[I 2024-11-06 21:08:30,196] Trial 737 finished with value: 0.5919566786380401 and parameters: {'n_estimators': 76, 'max_depth': 5, 'min_samples_split': 5, 'min_samples_leaf': 13}. Best is trial 406 with value: 0.5986570551043842.
[I 2024-11-06 21:08:33,676] Trial 738 finished with value: 0.5982672842421276 and parameters: {'n_estimators': 80, 'max_depth': 3, 'min_samples_split': 3, 'min_samples_leaf': 7}. Best is trial 406 with value: 0.5986570551043842.
[I 2024-11-06 21:08:35,659] Trial 739 finished with value: 0.5918904436469393 and parameters: {'n_estimators': 66, 'max_depth': 1, 'min_samples_split': 4, 'min_samples_leaf': 8}. Best is trial 406 with value: 0.5986570551043842.
[I 2024-11-06 21:08:39,506] Trial 740 finished with value: 0.5984378153021179 and parameters: {'n_estimators': 93, 'max_depth': 3, 'min_samples_split': 3, 'min_samples_leaf': 8}. Best is trial 406 with value: 0.5986570551043842.
[I 2024-11-06 21:08:43,910] Trial 741 finished with value: 0.594125678644619 and parameters: {'n_estimators': 72, 'max_depth': 6, 'min_samples_split': 5, 'min_samples_leaf': 12}. Best is trial 406 with value: 0.5986570551043842.
[I 2024-11-06 21:08:46,950] Trial 742 finished with value: 0.5912714220394817 and parameters: {'n_estimators': 85, 'max_depth': 2, 'min_samples_split': 3, 'min_samples_leaf': 9}. Best is trial 406 with value: 0.5986570551043842.
[I 2024-11-06 21:08:50,836] Trial 743 finished with value: 0.5925285955087782 and parameters: {'n_estimators': 76, 'max_depth': 4, 'min_samples_split': 4, 'min_samples_leaf': 7}. Best is trial 406 with value: 0.5986570551043842.
[I 2024-11-06 21:08:54,624] Trial 744 finished with value: 0.5916632435655916 and parameters: {'n_estimators': 108, 'max_depth': 2, 'min_samples_split': 4, 'min_samples_leaf': 3}. Best is trial 406 with value: 0.5986570551043842.
[I 2024-11-06 21:09:07,178] Trial 745 finished with value: 0.5888875943969929 and parameters: {'n_estimators': 81, 'max_depth': 45, 'min_samples_split': 6, 'min_samples_leaf': 9}. Best is trial 406 with value: 0.5986570551043842.
[I 2024-11-06 21:09:10,354] Trial 746 finished with value: 0.5929666763417016 and parameters: {'n_estimators': 64, 'max_depth': 4, 'min_samples_split': 5, 'min_samples_leaf': 8}. Best is trial 406 with value: 0.5986570551043842.
[I 2024-11-06 21:09:13,356] Trial 747 finished with value: 0.597914310340087 and parameters: {'n_estimators': 69, 'max_depth': 3, 'min_samples_split': 3, 'min_samples_leaf': 7}. Best is trial 406 with value: 0.5986570551043842.
[I 2024-11-06 21:09:18,153] Trial 748 finished with value: 0.5906385377326085 and parameters: {'n_estimators': 90, 'max_depth': 5, 'min_samples_split': 4, 'min_samples_leaf': 12}. Best is trial 406 with value: 0.5986570551043842.
[I 2024-11-06 21:09:20,926] Trial 749 finished with value: 0.5914596874309176 and parameters: {'n_estimators': 78, 'max_depth': 2, 'min_samples_split': 3, 'min_samples_leaf': 15}. Best is trial 406 with value: 0.5986570551043842.
[I 2024-11-06 21:09:24,022] Trial 750 finished with value: 0.5985993269372238 and parameters: {'n_estimators': 72, 'max_depth': 3, 'min_samples_split': 6, 'min_samples_leaf': 8}. Best is trial 406 with value: 0.5986570551043842.
[I 2024-11-06 21:09:26,528] Trial 751 finished with value: 0.5917571992963908 and parameters: {'n_estimators': 83, 'max_depth': 1, 'min_samples_split': 7, 'min_samples_leaf': 14}. Best is trial 406 with value: 0.5986570551043842.
[I 2024-11-06 21:09:30,272] Trial 752 finished with value: 0.5926530105464356 and parameters: {'n_estimators': 74, 'max_depth': 4, 'min_samples_split': 4, 'min_samples_leaf': 7}. Best is trial 406 with value: 0.5986570551043842.
[I 2024-11-06 21:09:34,909] Trial 753 finished with value: 0.5912703595584068 and parameters: {'n_estimators': 87, 'max_depth': 5, 'min_samples_split': 3, 'min_samples_leaf': 13}. Best is trial 406 with value: 0.5986570551043842.
[I 2024-11-06 21:09:38,221] Trial 754 finished with value: 0.5984890156785799 and parameters: {'n_estimators': 77, 'max_depth': 3, 'min_samples_split': 5, 'min_samples_leaf': 9}. Best is trial 406 with value: 0.5986570551043842.
[I 2024-11-06 21:09:40,656] Trial 755 finished with value: 0.5921656749015044 and parameters: {'n_estimators': 68, 'max_depth': 2, 'min_samples_split': 4, 'min_samples_leaf': 8}. Best is trial 406 with value: 0.5986570551043842.
[I 2024-11-06 21:09:44,657] Trial 756 finished with value: 0.5922612238789295 and parameters: {'n_estimators': 81, 'max_depth': 4, 'min_samples_split': 3, 'min_samples_leaf': 9}. Best is trial 406 with value: 0.5986570551043842.
[I 2024-11-06 21:09:49,172] Trial 757 finished with value: 0.5931544393363984 and parameters: {'n_estimators': 73, 'max_depth': 6, 'min_samples_split': 4, 'min_samples_leaf': 2}. Best is trial 406 with value: 0.5986570551043842.
[I 2024-11-06 21:09:52,024] Trial 758 finished with value: 0.5909627079043318 and parameters: {'n_estimators': 79, 'max_depth': 2, 'min_samples_split': 5, 'min_samples_leaf': 7}. Best is trial 406 with value: 0.5986570551043842.
[I 2024-11-06 21:09:54,742] Trial 759 finished with value: 0.5969662075311392 and parameters: {'n_estimators': 63, 'max_depth': 3, 'min_samples_split': 5, 'min_samples_leaf': 8}. Best is trial 406 with value: 0.5986570551043842.
[I 2024-11-06 21:09:57,233] Trial 760 finished with value: 0.5917455597271795 and parameters: {'n_estimators': 85, 'max_depth': 1, 'min_samples_split': 3, 'min_samples_leaf': 19}. Best is trial 406 with value: 0.5986570551043842.
[I 2024-11-06 21:10:01,351] Trial 761 finished with value: 0.5920461212444488 and parameters: {'n_estimators': 76, 'max_depth': 5, 'min_samples_split': 4, 'min_samples_leaf': 9}. Best is trial 406 with value: 0.5986570551043842.
[I 2024-11-06 21:10:12,733] Trial 762 finished with value: 0.5860661286552673 and parameters: {'n_estimators': 69, 'max_depth': 33, 'min_samples_split': 3, 'min_samples_leaf': 7}. Best is trial 406 with value: 0.5986570551043842.
[I 2024-11-06 21:10:16,888] Trial 763 finished with value: 0.592572979194369 and parameters: {'n_estimators': 88, 'max_depth': 4, 'min_samples_split': 4, 'min_samples_leaf': 8}. Best is trial 406 with value: 0.5986570551043842.
[I 2024-11-06 21:10:19,050] Trial 764 finished with value: 0.5920286126514093 and parameters: {'n_estimators': 57, 'max_depth': 2, 'min_samples_split': 5, 'min_samples_leaf': 13}. Best is trial 406 with value: 0.5986570551043842.
[I 2024-11-06 21:10:22,632] Trial 765 finished with value: 0.5986536853401386 and parameters: {'n_estimators': 82, 'max_depth': 3, 'min_samples_split': 3, 'min_samples_leaf': 12}. Best is trial 406 with value: 0.5986570551043842.
[I 2024-11-06 21:10:25,788] Trial 766 finished with value: 0.5986461995548318 and parameters: {'n_estimators': 73, 'max_depth': 3, 'min_samples_split': 3, 'min_samples_leaf': 12}. Best is trial 406 with value: 0.5986570551043842.
[I 2024-11-06 21:10:29,773] Trial 767 finished with value: 0.5916235129202959 and parameters: {'n_estimators': 72, 'max_depth': 5, 'min_samples_split': 3, 'min_samples_leaf': 12}. Best is trial 406 with value: 0.5986570551043842.
[I 2024-11-06 21:10:32,227] Trial 768 finished with value: 0.5923708604952941 and parameters: {'n_estimators': 66, 'max_depth': 2, 'min_samples_split': 3, 'min_samples_leaf': 11}. Best is trial 406 with value: 0.5986570551043842.
[I 2024-11-06 21:10:35,715] Trial 769 finished with value: 0.593177716034121 and parameters: {'n_estimators': 72, 'max_depth': 4, 'min_samples_split': 3, 'min_samples_leaf': 12}. Best is trial 406 with value: 0.5986570551043842.
[I 2024-11-06 21:10:37,238] Trial 770 finished with value: 0.5909591655567997 and parameters: {'n_estimators': 46, 'max_depth': 1, 'min_samples_split': 3, 'min_samples_leaf': 12}. Best is trial 406 with value: 0.5986570551043842.
[I 2024-11-06 21:10:40,341] Trial 771 finished with value: 0.597939034699422 and parameters: {'n_estimators': 69, 'max_depth': 3, 'min_samples_split': 3, 'min_samples_leaf': 12}. Best is trial 406 with value: 0.5986570551043842.
[I 2024-11-06 21:10:43,593] Trial 772 finished with value: 0.5986390859855748 and parameters: {'n_estimators': 75, 'max_depth': 3, 'min_samples_split': 3, 'min_samples_leaf': 12}. Best is trial 406 with value: 0.5986570551043842.
[I 2024-11-06 21:10:47,258] Trial 773 finished with value: 0.5912429434304597 and parameters: {'n_estimators': 67, 'max_depth': 5, 'min_samples_split': 3, 'min_samples_leaf': 12}. Best is trial 406 with value: 0.5986570551043842.
[I 2024-11-06 21:10:58,293] Trial 774 finished with value: 0.5897887826962489 and parameters: {'n_estimators': 74, 'max_depth': 41, 'min_samples_split': 3, 'min_samples_leaf': 12}. Best is trial 406 with value: 0.5986570551043842.
[I 2024-11-06 21:11:01,956] Trial 775 finished with value: 0.5933840920846254 and parameters: {'n_estimators': 71, 'max_depth': 4, 'min_samples_split': 3, 'min_samples_leaf': 12}. Best is trial 406 with value: 0.5986570551043842.
[I 2024-11-06 21:11:04,868] Trial 776 finished with value: 0.592437301835236 and parameters: {'n_estimators': 74, 'max_depth': 2, 'min_samples_split': 3, 'min_samples_leaf': 12}. Best is trial 406 with value: 0.5986570551043842.
[I 2024-11-06 21:11:09,406] Trial 777 finished with value: 0.5936187431797968 and parameters: {'n_estimators': 65, 'max_depth': 7, 'min_samples_split': 3, 'min_samples_leaf': 12}. Best is trial 406 with value: 0.5986570551043842.
[I 2024-11-06 21:11:11,543] Trial 778 finished with value: 0.5916950430541796 and parameters: {'n_estimators': 70, 'max_depth': 1, 'min_samples_split': 3, 'min_samples_leaf': 12}. Best is trial 406 with value: 0.5986570551043842.
[I 2024-11-06 21:11:15,265] Trial 779 finished with value: 0.5925417528618953 and parameters: {'n_estimators': 76, 'max_depth': 4, 'min_samples_split': 3, 'min_samples_leaf': 12}. Best is trial 406 with value: 0.5986570551043842.
[I 2024-11-06 21:11:20,064] Trial 780 finished with value: 0.5936200343614465 and parameters: {'n_estimators': 76, 'max_depth': 6, 'min_samples_split': 3, 'min_samples_leaf': 11}. Best is trial 406 with value: 0.5986570551043842.
[I 2024-11-06 21:11:22,749] Trial 781 finished with value: 0.5966383319867933 and parameters: {'n_estimators': 62, 'max_depth': 3, 'min_samples_split': 3, 'min_samples_leaf': 11}. Best is trial 406 with value: 0.5986570551043842.
[I 2024-11-06 21:11:25,211] Trial 782 finished with value: 0.5918262554401501 and parameters: {'n_estimators': 69, 'max_depth': 2, 'min_samples_split': 3, 'min_samples_leaf': 12}. Best is trial 406 with value: 0.5986570551043842.
[I 2024-11-06 21:11:28,815] Trial 783 finished with value: 0.5930398176259397 and parameters: {'n_estimators': 73, 'max_depth': 4, 'min_samples_split': 10, 'min_samples_leaf': 11}. Best is trial 406 with value: 0.5986570551043842.
[I 2024-11-06 21:11:31,499] Trial 784 finished with value: 0.592437301835236 and parameters: {'n_estimators': 74, 'max_depth': 2, 'min_samples_split': 4, 'min_samples_leaf': 12}. Best is trial 406 with value: 0.5986570551043842.
[I 2024-11-06 21:11:35,715] Trial 785 finished with value: 0.591202690159209 and parameters: {'n_estimators': 78, 'max_depth': 5, 'min_samples_split': 3, 'min_samples_leaf': 11}. Best is trial 406 with value: 0.5986570551043842.
[I 2024-11-06 21:11:38,676] Trial 786 finished with value: 0.5983581410018073 and parameters: {'n_estimators': 70, 'max_depth': 3, 'min_samples_split': 3, 'min_samples_leaf': 12}. Best is trial 406 with value: 0.5986570551043842.
[I 2024-11-06 21:11:40,675] Trial 787 finished with value: 0.5918072696048966 and parameters: {'n_estimators': 65, 'max_depth': 1, 'min_samples_split': 4, 'min_samples_leaf': 13}. Best is trial 406 with value: 0.5986570551043842.
[I 2024-11-06 21:11:44,096] Trial 788 finished with value: 0.5983250697326877 and parameters: {'n_estimators': 79, 'max_depth': 3, 'min_samples_split': 13, 'min_samples_leaf': 11}. Best is trial 406 with value: 0.5986570551043842.
[I 2024-11-06 21:11:55,257] Trial 789 finished with value: 0.5894903282529341 and parameters: {'n_estimators': 76, 'max_depth': 36, 'min_samples_split': 4, 'min_samples_leaf': 12}. Best is trial 406 with value: 0.5986570551043842.
[I 2024-11-06 21:11:58,751] Trial 790 finished with value: 0.5933840920846254 and parameters: {'n_estimators': 71, 'max_depth': 4, 'min_samples_split': 3, 'min_samples_leaf': 12}. Best is trial 406 with value: 0.5986570551043842.
[I 2024-11-06 21:12:01,640] Trial 791 finished with value: 0.5978121709975637 and parameters: {'n_estimators': 67, 'max_depth': 3, 'min_samples_split': 8, 'min_samples_leaf': 11}. Best is trial 406 with value: 0.5986570551043842.
[I 2024-11-06 21:12:08,318] Trial 792 finished with value: 0.5902426318354007 and parameters: {'n_estimators': 125, 'max_depth': 5, 'min_samples_split': 3, 'min_samples_leaf': 11}. Best is trial 406 with value: 0.5986570551043842.
[I 2024-11-06 21:12:11,019] Trial 793 finished with value: 0.5918129964131911 and parameters: {'n_estimators': 77, 'max_depth': 2, 'min_samples_split': 4, 'min_samples_leaf': 12}. Best is trial 406 with value: 0.5986570551043842.
[I 2024-11-06 21:12:13,355] Trial 794 finished with value: 0.5918361125730843 and parameters: {'n_estimators': 74, 'max_depth': 1, 'min_samples_split': 3, 'min_samples_leaf': 1}. Best is trial 406 with value: 0.5986570551043842.
[I 2024-11-06 21:12:16,448] Trial 795 finished with value: 0.5929506881981558 and parameters: {'n_estimators': 62, 'max_depth': 4, 'min_samples_split': 4, 'min_samples_leaf': 13}. Best is trial 406 with value: 0.5986570551043842.
[I 2024-11-06 21:12:19,910] Trial 796 finished with value: 0.5933840920846254 and parameters: {'n_estimators': 71, 'max_depth': 4, 'min_samples_split': 3, 'min_samples_leaf': 12}. Best is trial 406 with value: 0.5986570551043842.
[I 2024-11-06 21:12:24,611] Trial 797 finished with value: 0.593587433527587 and parameters: {'n_estimators': 77, 'max_depth': 6, 'min_samples_split': 4, 'min_samples_leaf': 11}. Best is trial 406 with value: 0.5986570551043842.
[I 2024-11-06 21:12:27,586] Trial 798 finished with value: 0.5910571071304002 and parameters: {'n_estimators': 80, 'max_depth': 2, 'min_samples_split': 3, 'min_samples_leaf': 2}. Best is trial 406 with value: 0.5986570551043842.
