[I 2024-11-06 20:46:43,409] Trial 418 finished with value: 0.5986239824188043 and parameters: {'n_estimators': 75, 'max_depth': 3, 'min_samples_split': 4, 'min_samples_leaf': 10}. Best is trial 406 with value: 0.5986570551043842.
[I 2024-11-06 20:46:45,430] Trial 419 finished with value: 0.5918904436469393 and parameters: {'n_estimators': 66, 'max_depth': 1, 'min_samples_split': 5, 'min_samples_leaf': 10}. Best is trial 406 with value: 0.5986570551043842.
[I 2024-11-06 20:46:57,759] Trial 420 finished with value: 0.5872969253004451 and parameters: {'n_estimators': 81, 'max_depth': 32, 'min_samples_split': 4, 'min_samples_leaf': 10}. Best is trial 406 with value: 0.5986570551043842.
[I 2024-11-06 20:47:00,839] Trial 421 finished with value: 0.5986418242162632 and parameters: {'n_estimators': 74, 'max_depth': 3, 'min_samples_split': 5, 'min_samples_leaf': 10}. Best is trial 406 with value: 0.5986570551043842.
[I 2024-11-06 20:47:04,109] Trial 422 finished with value: 0.5983430707667774 and parameters: {'n_estimators': 70, 'max_depth': 3, 'min_samples_split': 4, 'min_samples_leaf': 10}. Best is trial 406 with value: 0.5986570551043842.
[I 2024-11-06 20:47:07,308] Trial 423 finished with value: 0.5921293589210245 and parameters: {'n_estimators': 57, 'max_depth': 5, 'min_samples_split': 5, 'min_samples_leaf': 11}. Best is trial 406 with value: 0.5986570551043842.
[I 2024-11-06 20:47:10,004] Trial 424 finished with value: 0.592437301835236 and parameters: {'n_estimators': 74, 'max_depth': 2, 'min_samples_split': 3, 'min_samples_leaf': 9}. Best is trial 406 with value: 0.5986570551043842.
[I 2024-11-06 20:47:12,667] Trial 425 finished with value: 0.5917155349109559 and parameters: {'n_estimators': 51, 'max_depth': 4, 'min_samples_split': 4, 'min_samples_leaf': 11}. Best is trial 406 with value: 0.5986570551043842.
[I 2024-11-06 20:47:14,899] Trial 426 finished with value: 0.5918686077264141 and parameters: {'n_estimators': 75, 'max_depth': 1, 'min_samples_split': 3, 'min_samples_leaf': 10}. Best is trial 406 with value: 0.5986570551043842.
[I 2024-11-06 20:47:17,751] Trial 427 finished with value: 0.5977929803375573 and parameters: {'n_estimators': 67, 'max_depth': 3, 'min_samples_split': 5, 'min_samples_leaf': 9}. Best is trial 406 with value: 0.5986570551043842.
[I 2024-11-06 20:47:21,291] Trial 428 finished with value: 0.5932906208347285 and parameters: {'n_estimators': 71, 'max_depth': 4, 'min_samples_split': 4, 'min_samples_leaf': 10}. Best is trial 406 with value: 0.5986570551043842.
[I 2024-11-06 20:47:24,614] Trial 429 finished with value: 0.5985002100679678 and parameters: {'n_estimators': 77, 'max_depth': 3, 'min_samples_split': 3, 'min_samples_leaf': 12}. Best is trial 406 with value: 0.5986570551043842.
[I 2024-11-06 20:47:26,910] Trial 430 finished with value: 0.5921304222459618 and parameters: {'n_estimators': 63, 'max_depth': 2, 'min_samples_split': 3, 'min_samples_leaf': 10}. Best is trial 406 with value: 0.5986570551043842.
[I 2024-11-06 20:47:31,440] Trial 431 finished with value: 0.5932646174364151 and parameters: {'n_estimators': 72, 'max_depth': 6, 'min_samples_split': 4, 'min_samples_leaf': 2}. Best is trial 406 with value: 0.5986570551043842.
[I 2024-11-06 20:47:35,350] Trial 432 finished with value: 0.5921819454239708 and parameters: {'n_estimators': 79, 'max_depth': 4, 'min_samples_split': 4, 'min_samples_leaf': 2}. Best is trial 406 with value: 0.5986570551043842.
[I 2024-11-06 20:47:39,280] Trial 433 finished with value: 0.5916791482758539 and parameters: {'n_estimators': 69, 'max_depth': 5, 'min_samples_split': 19, 'min_samples_leaf': 9}. Best is trial 406 with value: 0.5986570551043842.
[I 2024-11-06 20:47:41,939] Trial 434 finished with value: 0.5923512189710275 and parameters: {'n_estimators': 75, 'max_depth': 2, 'min_samples_split': 5, 'min_samples_leaf': 10}. Best is trial 406 with value: 0.5986570551043842.
[I 2024-11-06 20:47:45,231] Trial 435 finished with value: 0.5983816573855721 and parameters: {'n_estimators': 78, 'max_depth': 3, 'min_samples_split': 3, 'min_samples_leaf': 11}. Best is trial 406 with value: 0.5986570551043842.
[I 2024-11-06 20:47:47,448] Trial 436 finished with value: 0.5919598878858062 and parameters: {'n_estimators': 73, 'max_depth': 1, 'min_samples_split': 3, 'min_samples_leaf': 3}. Best is trial 406 with value: 0.5986570551043842.
[I 2024-11-06 20:47:50,799] Trial 437 finished with value: 0.5929230433872339 and parameters: {'n_estimators': 66, 'max_depth': 4, 'min_samples_split': 6, 'min_samples_leaf': 15}. Best is trial 406 with value: 0.5986570551043842.
[I 2024-11-06 20:47:54,323] Trial 438 finished with value: 0.5986153128337834 and parameters: {'n_estimators': 82, 'max_depth': 3, 'min_samples_split': 4, 'min_samples_leaf': 2}. Best is trial 406 with value: 0.5986570551043842.
[I 2024-11-06 20:47:58,864] Trial 439 finished with value: 0.5913822948961943 and parameters: {'n_estimators': 82, 'max_depth': 5, 'min_samples_split': 5, 'min_samples_leaf': 10}. Best is trial 406 with value: 0.5986570551043842.
[I 2024-11-06 20:48:01,372] Trial 440 finished with value: 0.5917386691253739 and parameters: {'n_estimators': 82, 'max_depth': 1, 'min_samples_split': 4, 'min_samples_leaf': 2}. Best is trial 406 with value: 0.5986570551043842.
[I 2024-11-06 20:48:04,441] Trial 441 finished with value: 0.5910571071304002 and parameters: {'n_estimators': 80, 'max_depth': 2, 'min_samples_split': 5, 'min_samples_leaf': 9}. Best is trial 406 with value: 0.5986570551043842.
[I 2024-11-06 20:48:07,862] Trial 442 finished with value: 0.5931463522906733 and parameters: {'n_estimators': 70, 'max_depth': 4, 'min_samples_split': 4, 'min_samples_leaf': 1}. Best is trial 406 with value: 0.5986570551043842.
[I 2024-11-06 20:48:13,074] Trial 443 finished with value: 0.5934840641522301 and parameters: {'n_estimators': 75, 'max_depth': 7, 'min_samples_split': 14, 'min_samples_leaf': 12}. Best is trial 406 with value: 0.5986570551043842.
[I 2024-11-06 20:48:15,786] Trial 444 finished with value: 0.5966429696888389 and parameters: {'n_estimators': 62, 'max_depth': 3, 'min_samples_split': 4, 'min_samples_leaf': 4}. Best is trial 406 with value: 0.5986570551043842.
[I 2024-11-06 20:48:20,170] Trial 445 finished with value: 0.5914969851974957 and parameters: {'n_estimators': 79, 'max_depth': 5, 'min_samples_split': 5, 'min_samples_leaf': 1}. Best is trial 406 with value: 0.5986570551043842.
[I 2024-11-06 20:48:23,365] Trial 446 finished with value: 0.597744730396067 and parameters: {'n_estimators': 69, 'max_depth': 3, 'min_samples_split': 4, 'min_samples_leaf': 19}. Best is trial 406 with value: 0.5986570551043842.
[I 2024-11-06 20:48:26,013] Trial 447 finished with value: 0.5922251752300065 and parameters: {'n_estimators': 73, 'max_depth': 2, 'min_samples_split': 4, 'min_samples_leaf': 2}. Best is trial 406 with value: 0.5986570551043842.
[I 2024-11-06 20:48:30,021] Trial 448 finished with value: 0.5921618708169383 and parameters: {'n_estimators': 82, 'max_depth': 4, 'min_samples_split': 4, 'min_samples_leaf': 8}. Best is trial 406 with value: 0.5986570551043842.
[I 2024-11-06 20:48:32,276] Trial 449 finished with value: 0.5918772194346223 and parameters: {'n_estimators': 77, 'max_depth': 1, 'min_samples_split': 5, 'min_samples_leaf': 10}. Best is trial 406 with value: 0.5986570551043842.
[I 2024-11-06 20:48:43,749] Trial 450 finished with value: 0.5848889597495226 and parameters: {'n_estimators': 66, 'max_depth': 24, 'min_samples_split': 6, 'min_samples_leaf': 1}. Best is trial 406 with value: 0.5986570551043842.
[I 2024-11-06 20:48:54,710] Trial 451 finished with value: 0.5886980421276721 and parameters: {'n_estimators': 74, 'max_depth': 28, 'min_samples_split': 5, 'min_samples_leaf': 11}. Best is trial 406 with value: 0.5986570551043842.
[I 2024-11-06 20:48:57,813] Trial 452 finished with value: 0.598512638772427 and parameters: {'n_estimators': 71, 'max_depth': 3, 'min_samples_split': 2, 'min_samples_leaf': 1}. Best is trial 406 with value: 0.5986570551043842.
[I 2024-11-06 20:49:00,678] Trial 453 finished with value: 0.5909627079043318 and parameters: {'n_estimators': 79, 'max_depth': 2, 'min_samples_split': 4, 'min_samples_leaf': 2}. Best is trial 406 with value: 0.5986570551043842.
[I 2024-11-06 20:49:05,666] Trial 454 finished with value: 0.5937154553327132 and parameters: {'n_estimators': 77, 'max_depth': 6, 'min_samples_split': 4, 'min_samples_leaf': 9}. Best is trial 406 with value: 0.5986570551043842.
[I 2024-11-06 20:49:09,666] Trial 455 finished with value: 0.5929595666285683 and parameters: {'n_estimators': 82, 'max_depth': 4, 'min_samples_split': 3, 'min_samples_leaf': 1}. Best is trial 406 with value: 0.5986570551043842.
[I 2024-11-06 20:49:13,442] Trial 456 finished with value: 0.5924592956353635 and parameters: {'n_estimators': 68, 'max_depth': 5, 'min_samples_split': 2, 'min_samples_leaf': 5}. Best is trial 406 with value: 0.5986570551043842.
[I 2024-11-06 20:49:16,079] Trial 457 finished with value: 0.5922251752300065 and parameters: {'n_estimators': 73, 'max_depth': 2, 'min_samples_split': 12, 'min_samples_leaf': 1}. Best is trial 406 with value: 0.5986570551043842.
[I 2024-11-06 20:49:18,744] Trial 458 finished with value: 0.5965608945494247 and parameters: {'n_estimators': 60, 'max_depth': 3, 'min_samples_split': 4, 'min_samples_leaf': 10}. Best is trial 406 with value: 0.5986570551043842.
[I 2024-11-06 20:49:22,511] Trial 459 finished with value: 0.5928658968250418 and parameters: {'n_estimators': 76, 'max_depth': 4, 'min_samples_split': 5, 'min_samples_leaf': 3}. Best is trial 406 with value: 0.5986570551043842.
[I 2024-11-06 20:49:25,483] Trial 460 finished with value: 0.5913878577048239 and parameters: {'n_estimators': 81, 'max_depth': 2, 'min_samples_split': 3, 'min_samples_leaf': 1}. Best is trial 406 with value: 0.5986570551043842.
[I 2024-11-06 20:49:28,558] Trial 461 finished with value: 0.5983374562540338 and parameters: {'n_estimators': 70, 'max_depth': 3, 'min_samples_split': 2, 'min_samples_leaf': 2}. Best is trial 406 with value: 0.5986570551043842.
[I 2024-11-06 20:49:30,796] Trial 462 finished with value: 0.5918361125730843 and parameters: {'n_estimators': 74, 'max_depth': 1, 'min_samples_split': 3, 'min_samples_leaf': 9}. Best is trial 406 with value: 0.5986570551043842.
[I 2024-11-06 20:49:34,428] Trial 463 finished with value: 0.5919993266541336 and parameters: {'n_estimators': 65, 'max_depth': 5, 'min_samples_split': 4, 'min_samples_leaf': 1}. Best is trial 406 with value: 0.5986570551043842.
[I 2024-11-06 20:49:38,386] Trial 464 finished with value: 0.5918973360492513 and parameters: {'n_estimators': 79, 'max_depth': 4, 'min_samples_split': 5, 'min_samples_leaf': 8}. Best is trial 406 with value: 0.5986570551043842.
[I 2024-11-06 20:49:41,929] Trial 465 finished with value: 0.5986456553535178 and parameters: {'n_estimators': 83, 'max_depth': 3, 'min_samples_split': 4, 'min_samples_leaf': 10}. Best is trial 406 with value: 0.5986570551043842.
[I 2024-11-06 20:49:45,737] Trial 466 finished with value: 0.5984967361840647 and parameters: {'n_estimators': 87, 'max_depth': 3, 'min_samples_split': 4, 'min_samples_leaf': 10}. Best is trial 406 with value: 0.5986570551043842.
[I 2024-11-06 20:49:48,648] Trial 467 finished with value: 0.5913809716906681 and parameters: {'n_estimators': 83, 'max_depth': 2, 'min_samples_split': 4, 'min_samples_leaf': 11}. Best is trial 406 with value: 0.5986570551043842.
[I 2024-11-06 20:49:51,196] Trial 468 finished with value: 0.5917571992963908 and parameters: {'n_estimators': 83, 'max_depth': 1, 'min_samples_split': 4, 'min_samples_leaf': 10}. Best is trial 406 with value: 0.5986570551043842.
[I 2024-11-06 20:49:54,780] Trial 469 finished with value: 0.5932906208347285 and parameters: {'n_estimators': 71, 'max_depth': 4, 'min_samples_split': 5, 'min_samples_leaf': 10}. Best is trial 406 with value: 0.5986570551043842.
[I 2024-11-06 20:49:57,675] Trial 470 finished with value: 0.5909627079043318 and parameters: {'n_estimators': 79, 'max_depth': 2, 'min_samples_split': 4, 'min_samples_leaf': 9}. Best is trial 406 with value: 0.5986570551043842.
[I 2024-11-06 20:50:02,985] Trial 471 finished with value: 0.5931677306450956 and parameters: {'n_estimators': 83, 'max_depth': 6, 'min_samples_split': 5, 'min_samples_leaf': 10}. Best is trial 406 with value: 0.5986570551043842.
[I 2024-11-06 20:50:07,286] Trial 472 finished with value: 0.5920461212444488 and parameters: {'n_estimators': 76, 'max_depth': 5, 'min_samples_split': 6, 'min_samples_leaf': 9}. Best is trial 406 with value: 0.5986570551043842.
[I 2024-11-06 20:50:10,142] Trial 473 finished with value: 0.5978121709975637 and parameters: {'n_estimators': 67, 'max_depth': 3, 'min_samples_split': 4, 'min_samples_leaf': 11}. Best is trial 406 with value: 0.5986570551043842.
[I 2024-11-06 20:50:14,456] Trial 474 finished with value: 0.5933095121541334 and parameters: {'n_estimators': 89, 'max_depth': 4, 'min_samples_split': 8, 'min_samples_leaf': 10}. Best is trial 406 with value: 0.5986570551043842.
[I 2024-11-06 20:50:17,094] Trial 475 finished with value: 0.5922251752300065 and parameters: {'n_estimators': 73, 'max_depth': 2, 'min_samples_split': 4, 'min_samples_leaf': 11}. Best is trial 406 with value: 0.5986570551043842.
[I 2024-11-06 20:50:20,425] Trial 476 finished with value: 0.5983291874523319 and parameters: {'n_estimators': 79, 'max_depth': 3, 'min_samples_split': 5, 'min_samples_leaf': 10}. Best is trial 406 with value: 0.5986570551043842.
[I 2024-11-06 20:50:23,950] Trial 477 finished with value: 0.592608246893309 and parameters: {'n_estimators': 70, 'max_depth': 4, 'min_samples_split': 3, 'min_samples_leaf': 14}. Best is trial 406 with value: 0.5986570551043842.
[I 2024-11-06 20:50:26,253] Trial 478 finished with value: 0.5918513869487873 and parameters: {'n_estimators': 76, 'max_depth': 1, 'min_samples_split': 4, 'min_samples_leaf': 9}. Best is trial 406 with value: 0.5986570551043842.
[I 2024-11-06 20:50:29,737] Trial 479 finished with value: 0.598627917486591 and parameters: {'n_estimators': 83, 'max_depth': 3, 'min_samples_split': 3, 'min_samples_leaf': 1}. Best is trial 406 with value: 0.5986570551043842.
[I 2024-11-06 20:50:33,289] Trial 480 finished with value: 0.5986039647925503 and parameters: {'n_estimators': 86, 'max_depth': 3, 'min_samples_split': 3, 'min_samples_leaf': 13}. Best is trial 406 with value: 0.5986570551043842.
[I 2024-11-06 20:50:40,161] Trial 481 finished with value: 0.5932189721683276 and parameters: {'n_estimators': 103, 'max_depth': 7, 'min_samples_split': 3, 'min_samples_leaf': 12}. Best is trial 406 with value: 0.5986570551043842.
[I 2024-11-06 20:50:45,084] Trial 482 finished with value: 0.5910098733245545 and parameters: {'n_estimators': 88, 'max_depth': 5, 'min_samples_split': 3, 'min_samples_leaf': 14}. Best is trial 406 with value: 0.5986570551043842.
[I 2024-11-06 20:50:48,239] Trial 483 finished with value: 0.5903277534613821 and parameters: {'n_estimators': 92, 'max_depth': 2, 'min_samples_split': 3, 'min_samples_leaf': 12}. Best is trial 406 with value: 0.5986570551043842.
[I 2024-11-06 20:50:52,802] Trial 484 finished with value: 0.59134242101723 and parameters: {'n_estimators': 85, 'max_depth': 5, 'min_samples_split': 3, 'min_samples_leaf': 13}. Best is trial 406 with value: 0.5986570551043842.
[I 2024-11-06 20:50:57,121] Trial 485 finished with value: 0.593835499269691 and parameters: {'n_estimators': 90, 'max_depth': 4, 'min_samples_split': 3, 'min_samples_leaf': 12}. Best is trial 406 with value: 0.5986570551043842.
[I 2024-11-06 20:50:58,747] Trial 486 finished with value: 0.5940211986880328 and parameters: {'n_estimators': 32, 'max_depth': 3, 'min_samples_split': 3, 'min_samples_leaf': 10}. Best is trial 406 with value: 0.5986570551043842.
[I 2024-11-06 20:51:04,414] Trial 487 finished with value: 0.588934258271402 and parameters: {'n_estimators': 199, 'max_depth': 1, 'min_samples_split': 3, 'min_samples_leaf': 11}. Best is trial 406 with value: 0.5986570551043842.
[I 2024-11-06 20:51:07,668] Trial 488 finished with value: 0.5912818339088736 and parameters: {'n_estimators': 84, 'max_depth': 2, 'min_samples_split': 3, 'min_samples_leaf': 13}. Best is trial 406 with value: 0.5986570551043842.
[I 2024-11-06 20:51:11,705] Trial 489 finished with value: 0.5931245366481971 and parameters: {'n_estimators': 85, 'max_depth': 4, 'min_samples_split': 3, 'min_samples_leaf': 13}. Best is trial 406 with value: 0.5986570551043842.
[I 2024-11-06 20:51:15,437] Trial 490 finished with value: 0.5984329988157497 and parameters: {'n_estimators': 89, 'max_depth': 3, 'min_samples_split': 3, 'min_samples_leaf': 13}. Best is trial 406 with value: 0.5986570551043842.
[I 2024-11-06 20:51:20,337] Trial 491 finished with value: 0.5952424710538663 and parameters: {'n_estimators': 82, 'max_depth': 6, 'min_samples_split': 4, 'min_samples_leaf': 14}. Best is trial 406 with value: 0.5986570551043842.
[I 2024-11-06 20:51:23,783] Trial 492 finished with value: 0.5916352754296609 and parameters: {'n_estimators': 97, 'max_depth': 2, 'min_samples_split': 3, 'min_samples_leaf': 13}. Best is trial 406 with value: 0.5986570551043842.
[I 2024-11-06 20:51:36,792] Trial 493 finished with value: 0.5873111835617946 and parameters: {'n_estimators': 82, 'max_depth': 43, 'min_samples_split': 4, 'min_samples_leaf': 8}. Best is trial 406 with value: 0.5986570551043842.
[I 2024-11-06 20:51:40,339] Trial 494 finished with value: 0.5985971490992686 and parameters: {'n_estimators': 86, 'max_depth': 3, 'min_samples_split': 2, 'min_samples_leaf': 10}. Best is trial 406 with value: 0.5986570551043842.
[I 2024-11-06 20:51:44,732] Trial 495 finished with value: 0.5934272576691256 and parameters: {'n_estimators': 90, 'max_depth': 4, 'min_samples_split': 2, 'min_samples_leaf': 10}. Best is trial 406 with value: 0.5986570551043842.
[I 2024-11-06 20:51:48,615] Trial 496 finished with value: 0.5984363702157878 and parameters: {'n_estimators': 93, 'max_depth': 3, 'min_samples_split': 2, 'min_samples_leaf': 9}. Best is trial 406 with value: 0.5986570551043842.
[I 2024-11-06 20:51:53,291] Trial 497 finished with value: 0.5904896654081814 and parameters: {'n_estimators': 87, 'max_depth': 5, 'min_samples_split': 2, 'min_samples_leaf': 10}. Best is trial 406 with value: 0.5986570551043842.
[I 2024-11-06 20:51:55,942] Trial 498 finished with value: 0.5917638218633813 and parameters: {'n_estimators': 86, 'max_depth': 1, 'min_samples_split': 2, 'min_samples_leaf': 9}. Best is trial 406 with value: 0.5986570551043842.
[I 2024-11-06 20:51:59,643] Trial 499 finished with value: 0.5915583225366173 and parameters: {'n_estimators': 110, 'max_depth': 2, 'min_samples_split': 2, 'min_samples_leaf': 10}. Best is trial 406 with value: 0.5986570551043842.
[I 2024-11-06 20:52:03,434] Trial 500 finished with value: 0.5986441035386654 and parameters: {'n_estimators': 82, 'max_depth': 3, 'min_samples_split': 2, 'min_samples_leaf': 11}. Best is trial 406 with value: 0.5986570551043842.
[I 2024-11-06 20:52:07,899] Trial 501 finished with value: 0.5934233014778421 and parameters: {'n_estimators': 90, 'max_depth': 4, 'min_samples_split': 2, 'min_samples_leaf': 11}. Best is trial 406 with value: 0.5986570551043842.
[I 2024-11-06 20:52:10,913] Trial 502 finished with value: 0.5912714220394817 and parameters: {'n_estimators': 85, 'max_depth': 2, 'min_samples_split': 2, 'min_samples_leaf': 11}. Best is trial 406 with value: 0.5986570551043842.
[I 2024-11-06 20:52:14,825] Trial 503 finished with value: 0.5985729664684505 and parameters: {'n_estimators': 95, 'max_depth': 3, 'min_samples_split': 2, 'min_samples_leaf': 11}. Best is trial 406 with value: 0.5986570551043842.
[I 2024-11-06 20:52:18,860] Trial 504 finished with value: 0.5923325397817437 and parameters: {'n_estimators': 82, 'max_depth': 4, 'min_samples_split': 2, 'min_samples_leaf': 11}. Best is trial 406 with value: 0.5986570551043842.
[I 2024-11-06 20:52:23,992] Trial 505 finished with value: 0.5938401671355393 and parameters: {'n_estimators': 86, 'max_depth': 6, 'min_samples_split': 2, 'min_samples_leaf': 12}. Best is trial 406 with value: 0.5986570551043842.
[I 2024-11-06 20:52:26,475] Trial 506 finished with value: 0.5917359383146273 and parameters: {'n_estimators': 81, 'max_depth': 1, 'min_samples_split': 2, 'min_samples_leaf': 10}. Best is trial 406 with value: 0.5986570551043842.
[I 2024-11-06 20:52:30,242] Trial 507 finished with value: 0.5984548082477309 and parameters: {'n_estimators': 90, 'max_depth': 3, 'min_samples_split': 2, 'min_samples_leaf': 10}. Best is trial 406 with value: 0.5986570551043842.
[I 2024-11-06 20:52:34,698] Trial 508 finished with value: 0.5910208426712787 and parameters: {'n_estimators': 81, 'max_depth': 5, 'min_samples_split': 3, 'min_samples_leaf': 11}. Best is trial 406 with value: 0.5986570551043842.
[I 2024-11-06 20:52:37,627] Trial 509 finished with value: 0.5909627079043318 and parameters: {'n_estimators': 79, 'max_depth': 2, 'min_samples_split': 2, 'min_samples_leaf': 9}. Best is trial 406 with value: 0.5986570551043842.
[I 2024-11-06 20:52:41,071] Trial 510 finished with value: 0.5985586684444715 and parameters: {'n_estimators': 84, 'max_depth': 3, 'min_samples_split': 3, 'min_samples_leaf': 10}. Best is trial 406 with value: 0.5986570551043842.
[I 2024-11-06 20:52:45,899] Trial 511 finished with value: 0.5906771112483508 and parameters: {'n_estimators': 88, 'max_depth': 5, 'min_samples_split': 2, 'min_samples_leaf': 11}. Best is trial 406 with value: 0.5986570551043842.
[I 2024-11-06 20:52:49,888] Trial 512 finished with value: 0.5921800230016921 and parameters: {'n_estimators': 79, 'max_depth': 4, 'min_samples_split': 9, 'min_samples_leaf': 10}. Best is trial 406 with value: 0.5986570551043842.
