[I 2024-11-06 21:29:12,887] Trial 47 finished with value: 0.5927883156838715 and parameters: {'n_estimators': 178, 'max_depth': 9, 'learning_rate': 0.03229777060481696, 'gamma': 4.7479064938808255, 'min_child_weight': 5, 'subsample': 0.9627634053948865, 'colsample_bytree': 0.6060694398614141, 'reg_alpha': 0.05552391657976668, 'reg_lambda': 0.8408964462083972}. Best is trial 35 with value: 0.5936215356095056.
[I 2024-11-06 21:29:17,933] Trial 48 finished with value: 0.5922836257429718 and parameters: {'n_estimators': 200, 'max_depth': 9, 'learning_rate': 0.04306675104312699, 'gamma': 4.536976940570509, 'min_child_weight': 3, 'subsample': 0.992228479598974, 'colsample_bytree': 0.535946370800573, 'reg_alpha': 0.11670103910832066, 'reg_lambda': 0.9429492441948446}. Best is trial 35 with value: 0.5936215356095056.
[I 2024-11-06 21:29:23,752] Trial 49 finished with value: 0.5926717294185047 and parameters: {'n_estimators': 167, 'max_depth': 10, 'learning_rate': 0.020547021943425055, 'gamma': 4.849458765141498, 'min_child_weight': 5, 'subsample': 0.9589686055468959, 'colsample_bytree': 0.5277986704227072, 'reg_alpha': 0.20120691889460424, 'reg_lambda': 0.6535988239753906}. Best is trial 35 with value: 0.5936215356095056.
[I 2024-11-06 21:29:28,426] Trial 50 finished with value: 0.5921147342996773 and parameters: {'n_estimators': 222, 'max_depth': 8, 'learning_rate': 0.07078354329049442, 'gamma': 4.47199437071356, 'min_child_weight': 4, 'subsample': 0.686922943282518, 'colsample_bytree': 0.6275994548360959, 'reg_alpha': 0.04538193345897907, 'reg_lambda': 0.7534792786343328}. Best is trial 35 with value: 0.5936215356095056.
[I 2024-11-06 21:29:35,120] Trial 51 finished with value: 0.592555942093092 and parameters: {'n_estimators': 157, 'max_depth': 9, 'learning_rate': 0.010450418850196045, 'gamma': 4.16208933166302, 'min_child_weight': 5, 'subsample': 0.9168426567476798, 'colsample_bytree': 0.5079162409423962, 'reg_alpha': 0.011393075168480996, 'reg_lambda': 0.7013455412974912}. Best is trial 35 with value: 0.5936215356095056.
[I 2024-11-06 21:29:39,171] Trial 52 finished with value: 0.5933048719739423 and parameters: {'n_estimators': 116, 'max_depth': 10, 'learning_rate': 0.051712237319429456, 'gamma': 3.9167677812259254, 'min_child_weight': 7, 'subsample': 0.8869423481807421, 'colsample_bytree': 0.5008784702349135, 'reg_alpha': 0.09059646415428196, 'reg_lambda': 0.532570906631688}. Best is trial 35 with value: 0.5936215356095056.
[I 2024-11-06 21:29:43,728] Trial 53 finished with value: 0.5913271668032098 and parameters: {'n_estimators': 115, 'max_depth': 10, 'learning_rate': 0.03542799235789755, 'gamma': 3.933970599841298, 'min_child_weight': 8, 'subsample': 0.5058827487616018, 'colsample_bytree': 0.5464067818183489, 'reg_alpha': 0.10950412873537027, 'reg_lambda': 0.49846206628734147}. Best is trial 35 with value: 0.5936215356095056.
[I 2024-11-06 21:29:47,771] Trial 54 finished with value: 0.5930871355017847 and parameters: {'n_estimators': 144, 'max_depth': 10, 'learning_rate': 0.05319951072964196, 'gamma': 4.384048873003455, 'min_child_weight': 7, 'subsample': 0.8911010096011769, 'colsample_bytree': 0.5172774107127922, 'reg_alpha': 0.07591973694246647, 'reg_lambda': 0.5327627692809627}. Best is trial 35 with value: 0.5936215356095056.
[I 2024-11-06 21:29:50,669] Trial 55 finished with value: 0.5915159520064408 and parameters: {'n_estimators': 180, 'max_depth': 9, 'learning_rate': 0.29647760548149416, 'gamma': 4.970219256038193, 'min_child_weight': 5, 'subsample': 0.9526029452475269, 'colsample_bytree': 0.580763419380049, 'reg_alpha': 0.13830236654423378, 'reg_lambda': 0.587937157107258}. Best is trial 35 with value: 0.5936215356095056.
[I 2024-11-06 21:29:54,503] Trial 56 finished with value: 0.5923189149176008 and parameters: {'n_estimators': 132, 'max_depth': 9, 'learning_rate': 0.0636174026481052, 'gamma': 3.912388554948811, 'min_child_weight': 7, 'subsample': 0.9242568734403136, 'colsample_bytree': 0.5628979138033353, 'reg_alpha': 0.21455356730522834, 'reg_lambda': 0.6583944579300592}. Best is trial 35 with value: 0.5936215356095056.
[I 2024-11-06 21:29:58,555] Trial 57 finished with value: 0.5921599986543366 and parameters: {'n_estimators': 170, 'max_depth': 10, 'learning_rate': 0.048173990268374295, 'gamma': 4.794766775569201, 'min_child_weight': 8, 'subsample': 0.9990411471294653, 'colsample_bytree': 0.9708997933673433, 'reg_alpha': 0.5243202400835267, 'reg_lambda': 0.22156845403839787}. Best is trial 35 with value: 0.5936215356095056.
[I 2024-11-06 21:30:04,239] Trial 58 finished with value: 0.5925717801735649 and parameters: {'n_estimators': 119, 'max_depth': 8, 'learning_rate': 0.025614866355340115, 'gamma': 3.5542732558645693, 'min_child_weight': 4, 'subsample': 0.9791379264931375, 'colsample_bytree': 0.517231393131253, 'reg_alpha': 0.02714824009821526, 'reg_lambda': 0.8165942864245336}. Best is trial 35 with value: 0.5936215356095056.
[I 2024-11-06 21:30:08,954] Trial 59 finished with value: 0.5929679470376052 and parameters: {'n_estimators': 146, 'max_depth': 10, 'learning_rate': 0.03810341280229123, 'gamma': 4.255289179124158, 'min_child_weight': 6, 'subsample': 0.8826181362629063, 'colsample_bytree': 0.7478837761854582, 'reg_alpha': 0.310155354596904, 'reg_lambda': 0.8856862695101249}. Best is trial 35 with value: 0.5936215356095056.
[I 2024-11-06 21:30:12,938] Trial 60 finished with value: 0.592288239699753 and parameters: {'n_estimators': 161, 'max_depth': 9, 'learning_rate': 0.07717192385038872, 'gamma': 4.437356303631336, 'min_child_weight': 7, 'subsample': 0.6475380268293847, 'colsample_bytree': 0.5420891312852348, 'reg_alpha': 0.07331974977865426, 'reg_lambda': 0.530373368220425}. Best is trial 35 with value: 0.5936215356095056.
[I 2024-11-06 21:30:17,702] Trial 61 finished with value: 0.5929601175370427 and parameters: {'n_estimators': 195, 'max_depth': 8, 'learning_rate': 0.09271028350714114, 'gamma': 3.2841062865544948, 'min_child_weight': 6, 'subsample': 0.8425024996040691, 'colsample_bytree': 0.5077134860298218, 'reg_alpha': 0.6468289029978713, 'reg_lambda': 0.6378511827713655}. Best is trial 35 with value: 0.5936215356095056.
[I 2024-11-06 21:30:20,987] Trial 62 finished with value: 0.5924268755943156 and parameters: {'n_estimators': 66, 'max_depth': 10, 'learning_rate': 0.053806760801710235, 'gamma': 2.962398680522324, 'min_child_weight': 5, 'subsample': 0.8595488296812297, 'colsample_bytree': 0.5042247778735347, 'reg_alpha': 0.1315879405899531, 'reg_lambda': 0.7037235204645997}. Best is trial 35 with value: 0.5936215356095056.
[I 2024-11-06 21:30:23,839] Trial 63 finished with value: 0.5932223348242645 and parameters: {'n_estimators': 94, 'max_depth': 7, 'learning_rate': 0.07867673442886146, 'gamma': 3.8516168831854993, 'min_child_weight': 6, 'subsample': 0.9078215370152989, 'colsample_bytree': 0.5350966132126266, 'reg_alpha': 0.09142219684198914, 'reg_lambda': 0.7633073068342576}. Best is trial 35 with value: 0.5936215356095056.
[I 2024-11-06 21:30:26,604] Trial 64 finished with value: 0.5929843176931285 and parameters: {'n_estimators': 101, 'max_depth': 7, 'learning_rate': 0.07964249820773957, 'gamma': 3.874941196976092, 'min_child_weight': 6, 'subsample': 0.9039119904362722, 'colsample_bytree': 0.5645794115304057, 'reg_alpha': 0.03766005860070812, 'reg_lambda': 0.8177202069920371}. Best is trial 35 with value: 0.5936215356095056.
[I 2024-11-06 21:30:32,830] Trial 65 finished with value: 0.5928012029400541 and parameters: {'n_estimators': 210, 'max_depth': 6, 'learning_rate': 0.019381292221236468, 'gamma': 4.107148271665502, 'min_child_weight': 7, 'subsample': 0.9359762015383004, 'colsample_bytree': 0.5983958886254547, 'reg_alpha': 0.17228649506575677, 'reg_lambda': 0.7652865673866138}. Best is trial 35 with value: 0.5936215356095056.
[I 2024-11-06 21:30:34,859] Trial 66 finished with value: 0.5902330825008629 and parameters: {'n_estimators': 85, 'max_depth': 9, 'learning_rate': 0.26140808686730016, 'gamma': 3.584801961186038, 'min_child_weight': 8, 'subsample': 0.8683875654418225, 'colsample_bytree': 0.5340037441097721, 'reg_alpha': 0.08380699635854047, 'reg_lambda': 0.7292014838882216}. Best is trial 35 with value: 0.5936215356095056.
[I 2024-11-06 21:30:39,056] Trial 67 finished with value: 0.592591610195097 and parameters: {'n_estimators': 136, 'max_depth': 7, 'learning_rate': 0.04841537315552999, 'gamma': 3.826888915468114, 'min_child_weight': 6, 'subsample': 0.6935703777791025, 'colsample_bytree': 0.9154236629526846, 'reg_alpha': 0.002952772107656804, 'reg_lambda': 0.7857946378251662}. Best is trial 35 with value: 0.5936215356095056.
[I 2024-11-06 21:30:42,479] Trial 68 finished with value: 0.5931421649952348 and parameters: {'n_estimators': 121, 'max_depth': 7, 'learning_rate': 0.066854100337068, 'gamma': 4.278465581245409, 'min_child_weight': 4, 'subsample': 0.9181045174685848, 'colsample_bytree': 0.5752862047943985, 'reg_alpha': 0.20830501175861765, 'reg_lambda': 0.5946115957715132}. Best is trial 35 with value: 0.5936215356095056.
[I 2024-11-06 21:30:45,292] Trial 69 finished with value: 0.5909278008709343 and parameters: {'n_estimators': 149, 'max_depth': 8, 'learning_rate': 0.2331136947057898, 'gamma': 4.030051029004672, 'min_child_weight': 5, 'subsample': 0.8909316677046757, 'colsample_bytree': 0.5191725825864122, 'reg_alpha': 0.10520903576979222, 'reg_lambda': 0.9028763140220355}. Best is trial 35 with value: 0.5936215356095056.
[I 2024-11-06 21:30:50,535] Trial 70 finished with value: 0.5924474220399081 and parameters: {'n_estimators': 176, 'max_depth': 6, 'learning_rate': 0.03317416492624941, 'gamma': 0.18810690563341304, 'min_child_weight': 7, 'subsample': 0.8346709362077561, 'colsample_bytree': 0.5459842892697793, 'reg_alpha': 0.14155580556862835, 'reg_lambda': 0.8624629573812128}. Best is trial 35 with value: 0.5936215356095056.
[I 2024-11-06 21:30:53,421] Trial 71 finished with value: 0.5923126746235966 and parameters: {'n_estimators': 100, 'max_depth': 7, 'learning_rate': 0.10115678937181932, 'gamma': 3.479962822344051, 'min_child_weight': 6, 'subsample': 0.949173520018384, 'colsample_bytree': 0.5010899984362434, 'reg_alpha': 0.05037564214706049, 'reg_lambda': 0.6924068443242415}. Best is trial 35 with value: 0.5936215356095056.
[I 2024-11-06 21:30:55,912] Trial 72 finished with value: 0.5919386316472806 and parameters: {'n_estimators': 91, 'max_depth': 5, 'learning_rate': 0.059252337370557955, 'gamma': 4.857557882387974, 'min_child_weight': 5, 'subsample': 0.6075327653708229, 'colsample_bytree': 0.5197502607755251, 'reg_alpha': 0.09774072768614625, 'reg_lambda': 0.45409632976372893}. Best is trial 35 with value: 0.5936215356095056.
[I 2024-11-06 21:30:59,915] Trial 73 finished with value: 0.5911669685991164 and parameters: {'n_estimators': 77, 'max_depth': 9, 'learning_rate': 0.044969002285473486, 'gamma': 0.897506882788135, 'min_child_weight': 6, 'subsample': 0.8476763056740044, 'colsample_bytree': 0.5351250630995611, 'reg_alpha': 0.32886684120090415, 'reg_lambda': 0.804049852758012}. Best is trial 35 with value: 0.5936215356095056.
[I 2024-11-06 21:31:04,662] Trial 74 finished with value: 0.5922230632670098 and parameters: {'n_estimators': 162, 'max_depth': 8, 'learning_rate': 0.11600127826013182, 'gamma': 4.584676717339064, 'min_child_weight': 6, 'subsample': 0.9006147057950012, 'colsample_bytree': 0.5596353286536735, 'reg_alpha': 0.16760708305827607, 'reg_lambda': 0.6228801931745201}. Best is trial 35 with value: 0.5936215356095056.
[I 2024-11-06 21:31:07,405] Trial 75 finished with value: 0.5913886049837884 and parameters: {'n_estimators': 64, 'max_depth': 10, 'learning_rate': 0.08915121964831742, 'gamma': 3.7416827415649268, 'min_child_weight': 7, 'subsample': 0.8145166456521075, 'colsample_bytree': 0.7116780807107684, 'reg_alpha': 0.027197240345515464, 'reg_lambda': 0.5527815638781222}. Best is trial 35 with value: 0.5936215356095056.
[I 2024-11-06 21:31:08,981] Trial 76 finished with value: 0.5925503586703582 and parameters: {'n_estimators': 55, 'max_depth': 3, 'learning_rate': 0.15652782183949251, 'gamma': 4.215870502571059, 'min_child_weight': 4, 'subsample': 0.92792289527306, 'colsample_bytree': 0.789422355830272, 'reg_alpha': 0.65318039027748, 'reg_lambda': 0.6495160087864121}. Best is trial 35 with value: 0.5936215356095056.
[I 2024-11-06 21:31:13,710] Trial 77 finished with value: 0.5900920700402057 and parameters: {'n_estimators': 128, 'max_depth': 10, 'learning_rate': 0.08281935075901425, 'gamma': 1.824714317952716, 'min_child_weight': 5, 'subsample': 0.8818869790567643, 'colsample_bytree': 0.5162355373873921, 'reg_alpha': 0.2501822368020663, 'reg_lambda': 0.760691539619877}. Best is trial 35 with value: 0.5936215356095056.
[I 2024-11-06 21:31:16,652] Trial 78 finished with value: 0.5921818613733973 and parameters: {'n_estimators': 82, 'max_depth': 5, 'learning_rate': 0.02505090427539545, 'gamma': 2.825830136097588, 'min_child_weight': 5, 'subsample': 0.7386476590806658, 'colsample_bytree': 0.5539379833055498, 'reg_alpha': 0.06214101232574577, 'reg_lambda': 0.7091916219110478}. Best is trial 35 with value: 0.5936215356095056.
[I 2024-11-06 21:31:20,522] Trial 79 finished with value: 0.59274845774759 and parameters: {'n_estimators': 94, 'max_depth': 8, 'learning_rate': 0.03828879535337966, 'gamma': 3.1095114165338718, 'min_child_weight': 6, 'subsample': 0.9714988132711306, 'colsample_bytree': 0.5004139400553559, 'reg_alpha': 0.4551810056475506, 'reg_lambda': 0.6734879694444807}. Best is trial 35 with value: 0.5936215356095056.
[I 2024-11-06 21:31:24,580] Trial 80 finished with value: 0.5920351621074045 and parameters: {'n_estimators': 105, 'max_depth': 7, 'learning_rate': 0.011320429644942568, 'gamma': 3.2928652694060414, 'min_child_weight': 7, 'subsample': 0.9081405458084789, 'colsample_bytree': 0.5852890470922293, 'reg_alpha': 0.7585827398513131, 'reg_lambda': 0.728461294684767}. Best is trial 35 with value: 0.5936215356095056.
[I 2024-11-06 21:31:30,671] Trial 81 finished with value: 0.5931555112096987 and parameters: {'n_estimators': 184, 'max_depth': 10, 'learning_rate': 0.0269105371006097, 'gamma': 4.6528146769580605, 'min_child_weight': 3, 'subsample': 0.871430407987049, 'colsample_bytree': 0.5737577618707409, 'reg_alpha': 0.020469172515361123, 'reg_lambda': 0.5850065618861461}. Best is trial 35 with value: 0.5936215356095056.
[I 2024-11-06 21:31:34,995] Trial 82 finished with value: 0.5928480135546299 and parameters: {'n_estimators': 154, 'max_depth': 10, 'learning_rate': 0.055464896732359575, 'gamma': 4.5376935866824475, 'min_child_weight': 4, 'subsample': 0.8682281483001597, 'colsample_bytree': 0.537203274729647, 'reg_alpha': 0.012534731845679867, 'reg_lambda': 0.5714069316252463}. Best is trial 35 with value: 0.5936215356095056.
[I 2024-11-06 21:31:41,112] Trial 83 finished with value: 0.5923202365694517 and parameters: {'n_estimators': 193, 'max_depth': 10, 'learning_rate': 0.03132442225797157, 'gamma': 4.391990329876535, 'min_child_weight': 2, 'subsample': 0.8905195771403753, 'colsample_bytree': 0.6122920381952647, 'reg_alpha': 0.05956696069898282, 'reg_lambda': 0.6157629590015737}. Best is trial 35 with value: 0.5936215356095056.
[I 2024-11-06 21:31:45,295] Trial 84 finished with value: 0.5928839474376072 and parameters: {'n_estimators': 183, 'max_depth': 9, 'learning_rate': 0.06428006832004601, 'gamma': 4.726767338893578, 'min_child_weight': 5, 'subsample': 0.829560713192335, 'colsample_bytree': 0.53094376558145, 'reg_alpha': 0.12062122980157168, 'reg_lambda': 0.4711845908742719}. Best is trial 35 with value: 0.5936215356095056.
[I 2024-11-06 21:31:50,316] Trial 85 finished with value: 0.5919765260242723 and parameters: {'n_estimators': 169, 'max_depth': 10, 'learning_rate': 0.04135239354696292, 'gamma': 4.483522940384649, 'min_child_weight': 4, 'subsample': 0.9397400454590927, 'colsample_bytree': 0.555123320795002, 'reg_alpha': 0.002151546749361157, 'reg_lambda': 0.5107355649760941}. Best is trial 35 with value: 0.5936215356095056.
[I 2024-11-06 21:31:55,145] Trial 86 finished with value: 0.5928279275521787 and parameters: {'n_estimators': 111, 'max_depth': 9, 'learning_rate': 0.01847613844504182, 'gamma': 4.932693295130658, 'min_child_weight': 5, 'subsample': 0.8557172504421158, 'colsample_bytree': 0.6012360434602769, 'reg_alpha': 0.09131408233561668, 'reg_lambda': 0.5641916476513126}. Best is trial 35 with value: 0.5936215356095056.
[I 2024-11-06 21:31:58,973] Trial 87 finished with value: 0.5925059920663105 and parameters: {'n_estimators': 189, 'max_depth': 6, 'learning_rate': 0.07423349983778058, 'gamma': 3.6591675118630502, 'min_child_weight': 4, 'subsample': 0.9246483627263641, 'colsample_bytree': 0.634727889894493, 'reg_alpha': 0.04289830537581708, 'reg_lambda': 0.6709356499994843}. Best is trial 35 with value: 0.5936215356095056.
[I 2024-11-06 21:32:05,167] Trial 88 finished with value: 0.592424232367075 and parameters: {'n_estimators': 174, 'max_depth': 10, 'learning_rate': 0.04757191979723431, 'gamma': 4.024279032379056, 'min_child_weight': 6, 'subsample': 0.8773989027590294, 'colsample_bytree': 0.5808032290792038, 'reg_alpha': 0.15240604248946787, 'reg_lambda': 0.08711544146910277}. Best is trial 35 with value: 0.5936215356095056.
[I 2024-11-06 21:32:10,739] Trial 89 finished with value: 0.5926853678531139 and parameters: {'n_estimators': 161, 'max_depth': 9, 'learning_rate': 0.029404924803012145, 'gamma': 4.320292355916186, 'min_child_weight': 5, 'subsample': 0.6657422335406257, 'colsample_bytree': 0.5690981788245807, 'reg_alpha': 0.0732409722834185, 'reg_lambda': 0.6389881840359056}. Best is trial 35 with value: 0.5936215356095056.
[I 2024-11-06 21:32:14,379] Trial 90 finished with value: 0.5930126792835934 and parameters: {'n_estimators': 134, 'max_depth': 7, 'learning_rate': 0.05531401047262395, 'gamma': 4.648179983169112, 'min_child_weight': 3, 'subsample': 0.986581040111281, 'colsample_bytree': 0.514961101552535, 'reg_alpha': 0.6086662696228943, 'reg_lambda': 0.5990493755962062}. Best is trial 35 with value: 0.5936215356095056.
[I 2024-11-06 21:32:21,028] Trial 91 finished with value: 0.5931262280608095 and parameters: {'n_estimators': 181, 'max_depth': 10, 'learning_rate': 0.023777724008714515, 'gamma': 4.656371422606766, 'min_child_weight': 2, 'subsample': 0.8739292539077355, 'colsample_bytree': 0.5438258027725297, 'reg_alpha': 0.03171608409211732, 'reg_lambda': 0.5146336138152254}. Best is trial 35 with value: 0.5936215356095056.
[I 2024-11-06 21:32:26,623] Trial 92 finished with value: 0.592728614492018 and parameters: {'n_estimators': 184, 'max_depth': 10, 'learning_rate': 0.029722445426803475, 'gamma': 4.990319826155537, 'min_child_weight': 3, 'subsample': 0.9095037945194386, 'colsample_bytree': 0.5770607884171179, 'reg_alpha': 6.97366376146008e-05, 'reg_lambda': 0.5895806006890087}. Best is trial 35 with value: 0.5936215356095056.
[I 2024-11-06 21:32:33,583] Trial 93 finished with value: 0.5928489721527473 and parameters: {'n_estimators': 196, 'max_depth': 10, 'learning_rate': 0.015581862958324902, 'gamma': 4.841465292955952, 'min_child_weight': 3, 'subsample': 0.8949865824178651, 'colsample_bytree': 0.5232923896160688, 'reg_alpha': 0.021454091296666047, 'reg_lambda': 0.7485125931514074}. Best is trial 35 with value: 0.5936215356095056.
[I 2024-11-06 21:32:39,732] Trial 94 finished with value: 0.593164476014597 and parameters: {'n_estimators': 214, 'max_depth': 10, 'learning_rate': 0.03548709023904714, 'gamma': 4.1987573282508315, 'min_child_weight': 4, 'subsample': 0.8418811125324421, 'colsample_bytree': 0.5898441662045231, 'reg_alpha': 0.09474376084772429, 'reg_lambda': 0.4246132778493907}. Best is trial 35 with value: 0.5936215356095056.
[I 2024-11-06 21:32:45,934] Trial 95 finished with value: 0.5914896400323765 and parameters: {'n_estimators': 209, 'max_depth': 10, 'learning_rate': 0.03930954657680756, 'gamma': 3.98690259677352, 'min_child_weight': 4, 'subsample': 0.7957899517102163, 'colsample_bytree': 0.5609249761447397, 'reg_alpha': 0.18403543028747382, 'reg_lambda': 0.4297070959299637}. Best is trial 35 with value: 0.5936215356095056.
[I 2024-11-06 21:32:52,074] Trial 96 finished with value: 0.5925525581825525 and parameters: {'n_estimators': 250, 'max_depth': 9, 'learning_rate': 0.050873517217692975, 'gamma': 4.166190358105286, 'min_child_weight': 5, 'subsample': 0.7746619293133288, 'colsample_bytree': 0.5906093803651458, 'reg_alpha': 0.22887616992330212, 'reg_lambda': 0.82901482920763}. Best is trial 35 with value: 0.5936215356095056.
[I 2024-11-06 21:32:56,257] Trial 97 finished with value: 0.5927019773870708 and parameters: {'n_estimators': 148, 'max_depth': 10, 'learning_rate': 0.06294177474380655, 'gamma': 3.7917110524075683, 'min_child_weight': 8, 'subsample': 0.8470184041784761, 'colsample_bytree': 0.6630018724348463, 'reg_alpha': 0.09017012903491482, 'reg_lambda': 0.4170128775188355}. Best is trial 35 with value: 0.5936215356095056.
[I 2024-11-06 21:33:02,930] Trial 98 finished with value: 0.592577593009518 and parameters: {'n_estimators': 277, 'max_depth': 4, 'learning_rate': 0.036668809446513774, 'gamma': 2.3647755896961873, 'min_child_weight': 4, 'subsample': 0.8203338215745012, 'colsample_bytree': 0.6884739827872812, 'reg_alpha': 0.27614352741017956, 'reg_lambda': 0.32589870994524617}. Best is trial 35 with value: 0.5936215356095056.
[I 2024-11-06 21:33:07,959] Trial 99 finished with value: 0.5924218166644095 and parameters: {'n_estimators': 217, 'max_depth': 9, 'learning_rate': 0.07392711205567686, 'gamma': 4.361438176982609, 'min_child_weight': 6, 'subsample': 0.9535266966163302, 'colsample_bytree': 0.510707496613889, 'reg_alpha': 0.5255427919055512, 'reg_lambda': 0.47723470651438993}. Best is trial 35 with value: 0.5936215356095056.
