[I 2024-11-06 21:25:06,448] Trial 989 finished with value: 0.5984885000863509 and parameters: {'n_estimators': 87, 'max_depth': 3, 'min_samples_split': 5, 'min_samples_leaf': 11}. Best is trial 916 with value: 0.5986894683732882.
[I 2024-11-06 21:25:09,150] Trial 990 finished with value: 0.5970838054919823 and parameters: {'n_estimators': 64, 'max_depth': 3, 'min_samples_split': 3, 'min_samples_leaf': 10}. Best is trial 916 with value: 0.5986894683732882.
[I 2024-11-06 21:25:11,285] Trial 991 finished with value: 0.5916950430541796 and parameters: {'n_estimators': 70, 'max_depth': 1, 'min_samples_split': 4, 'min_samples_leaf': 9}. Best is trial 916 with value: 0.5986894683732882.
[I 2024-11-06 21:25:15,189] Trial 992 finished with value: 0.5921755286985261 and parameters: {'n_estimators': 79, 'max_depth': 4, 'min_samples_split': 4, 'min_samples_leaf': 12}. Best is trial 916 with value: 0.5986894683732882.
[I 2024-11-06 21:25:17,888] Trial 993 finished with value: 0.5923512189710275 and parameters: {'n_estimators': 75, 'max_depth': 2, 'min_samples_split': 3, 'min_samples_leaf': 8}. Best is trial 916 with value: 0.5986894683732882.
[I 2024-11-06 21:25:22,801] Trial 994 finished with value: 0.594826191788619 and parameters: {'n_estimators': 82, 'max_depth': 6, 'min_samples_split': 6, 'min_samples_leaf': 13}. Best is trial 916 with value: 0.5986894683732882.
[I 2024-11-06 21:25:25,904] Trial 995 finished with value: 0.5985250773600217 and parameters: {'n_estimators': 71, 'max_depth': 3, 'min_samples_split': 5, 'min_samples_leaf': 9}. Best is trial 916 with value: 0.5986894683732882.
[I 2024-11-06 21:25:29,743] Trial 996 finished with value: 0.5922069860985504 and parameters: {'n_estimators': 77, 'max_depth': 4, 'min_samples_split': 10, 'min_samples_leaf': 8}. Best is trial 916 with value: 0.5986894683732882.
[I 2024-11-06 21:25:32,198] Trial 997 finished with value: 0.5923166101256573 and parameters: {'n_estimators': 67, 'max_depth': 2, 'min_samples_split': 3, 'min_samples_leaf': 11}. Best is trial 916 with value: 0.5986894683732882.
[I 2024-11-06 21:25:35,579] Trial 998 finished with value: 0.5914218350408479 and parameters: {'n_estimators': 60, 'max_depth': 5, 'min_samples_split': 4, 'min_samples_leaf': 10}. Best is trial 916 with value: 0.5986894683732882.
[I 2024-11-06 21:25:39,071] Trial 999 finished with value: 0.5985641364564567 and parameters: {'n_estimators': 84, 'max_depth': 3, 'min_samples_split': 4, 'min_samples_leaf': 12}. Best is trial 916 with value: 0.5986894683732882.
[I 2024-11-06 21:25:42,981] A new study created in memory with name: no-name-5bca62b4-59e8-40d8-83d6-2bc18636019e
[I 2024-11-06 21:25:45,951] Trial 0 finished with value: 0.588270195592918 and parameters: {'n_estimators': 124, 'max_depth': 9, 'learning_rate': 0.2911842308171783, 'gamma': 3.1591281043316055, 'min_child_weight': 10, 'subsample': 0.7505734762038812, 'colsample_bytree': 0.5193398706613921, 'reg_alpha': 0.5902471351700392, 'reg_lambda': 0.12259922375593546}. Best is trial 0 with value: 0.588270195592918.
[I 2024-11-06 21:25:48,705] Trial 1 finished with value: 0.5865309820666342 and parameters: {'n_estimators': 98, 'max_depth': 7, 'learning_rate': 0.28976941840270654, 'gamma': 0.6094986578195799, 'min_child_weight': 3, 'subsample': 0.9687161779179507, 'colsample_bytree': 0.5968065916895864, 'reg_alpha': 0.4962620807368445, 'reg_lambda': 0.1710126108835811}. Best is trial 0 with value: 0.588270195592918.
[I 2024-11-06 21:25:52,870] Trial 2 finished with value: 0.592720085754158 and parameters: {'n_estimators': 149, 'max_depth': 5, 'learning_rate': 0.027166533195085454, 'gamma': 2.020544960833019, 'min_child_weight': 10, 'subsample': 0.7720704470122803, 'colsample_bytree': 0.527602282881314, 'reg_alpha': 0.06599574737266789, 'reg_lambda': 0.542899601377476}. Best is trial 2 with value: 0.592720085754158.
[I 2024-11-06 21:25:56,523] Trial 3 finished with value: 0.588572262610884 and parameters: {'n_estimators': 123, 'max_depth': 5, 'learning_rate': 0.27515770100526193, 'gamma': 0.15012980568179568, 'min_child_weight': 8, 'subsample': 0.8356027015596399, 'colsample_bytree': 0.9482839640568899, 'reg_alpha': 0.9781366041053121, 'reg_lambda': 0.45874031682722827}. Best is trial 2 with value: 0.592720085754158.
[I 2024-11-06 21:26:06,767] Trial 4 finished with value: 0.5697134651183287 and parameters: {'n_estimators': 187, 'max_depth': 10, 'learning_rate': 0.16808337955254213, 'gamma': 0.6816474103311282, 'min_child_weight': 5, 'subsample': 0.5351412095460313, 'colsample_bytree': 0.5398760325698722, 'reg_alpha': 0.4828792199848554, 'reg_lambda': 0.28632354860431586}. Best is trial 2 with value: 0.592720085754158.
[I 2024-11-06 21:26:10,870] Trial 5 finished with value: 0.5742585740874209 and parameters: {'n_estimators': 87, 'max_depth': 9, 'learning_rate': 0.2527045425339572, 'gamma': 0.5932941800434771, 'min_child_weight': 8, 'subsample': 0.5471311199096547, 'colsample_bytree': 0.596677166041412, 'reg_alpha': 0.7021612863247273, 'reg_lambda': 0.6957504026250017}. Best is trial 2 with value: 0.592720085754158.
[I 2024-11-06 21:26:16,091] Trial 6 finished with value: 0.5930478834787765 and parameters: {'n_estimators': 266, 'max_depth': 9, 'learning_rate': 0.057153923586286126, 'gamma': 4.267964429772378, 'min_child_weight': 10, 'subsample': 0.9309010972405223, 'colsample_bytree': 0.5306670789025536, 'reg_alpha': 0.400536130435975, 'reg_lambda': 0.7136291857936342}. Best is trial 6 with value: 0.5930478834787765.
[I 2024-11-06 21:26:19,947] Trial 7 finished with value: 0.591337481855705 and parameters: {'n_estimators': 281, 'max_depth': 5, 'learning_rate': 0.24853078289456343, 'gamma': 2.9325092431979782, 'min_child_weight': 5, 'subsample': 0.8444059802576039, 'colsample_bytree': 0.8211126730154467, 'reg_alpha': 0.48864049097531403, 'reg_lambda': 0.27785056020208365}. Best is trial 6 with value: 0.5930478834787765.
[I 2024-11-06 21:26:26,721] Trial 8 finished with value: 0.5733658773227497 and parameters: {'n_estimators': 189, 'max_depth': 7, 'learning_rate': 0.24504412884617907, 'gamma': 0.45719441108968195, 'min_child_weight': 5, 'subsample': 0.5489223644957387, 'colsample_bytree': 0.9928380599686037, 'reg_alpha': 0.42748140549024427, 'reg_lambda': 0.9802758661431876}. Best is trial 6 with value: 0.5930478834787765.
[I 2024-11-06 21:26:33,687] Trial 9 finished with value: 0.5840531978318586 and parameters: {'n_estimators': 175, 'max_depth': 9, 'learning_rate': 0.10740890853317887, 'gamma': 1.9945914649686998, 'min_child_weight': 8, 'subsample': 0.5429985162440041, 'colsample_bytree': 0.7343075037823921, 'reg_alpha': 0.16440397517343652, 'reg_lambda': 0.15050168996652968}. Best is trial 6 with value: 0.5930478834787765.
[I 2024-11-06 21:26:39,821] Trial 10 finished with value: 0.5924350279411128 and parameters: {'n_estimators': 300, 'max_depth': 3, 'learning_rate': 0.01585485700183, 'gamma': 4.9515109070458605, 'min_child_weight': 3, 'subsample': 0.9947941419466586, 'colsample_bytree': 0.7028695507328707, 'reg_alpha': 0.2572392252192288, 'reg_lambda': 0.8755258918044773}. Best is trial 6 with value: 0.5930478834787765.
[I 2024-11-06 21:26:46,944] Trial 11 finished with value: 0.591959082979968 and parameters: {'n_estimators': 239, 'max_depth': 5, 'learning_rate': 0.01262936686048756, 'gamma': 4.377209723662213, 'min_child_weight': 10, 'subsample': 0.6833050502980571, 'colsample_bytree': 0.6491816301240814, 'reg_alpha': 0.03243525094913201, 'reg_lambda': 0.6312965764765184}. Best is trial 6 with value: 0.5930478834787765.
[I 2024-11-06 21:26:50,908] Trial 12 finished with value: 0.5918903034655749 and parameters: {'n_estimators': 224, 'max_depth': 3, 'learning_rate': 0.08386082756339118, 'gamma': 1.9457400632090323, 'min_child_weight': 10, 'subsample': 0.8923107315689283, 'colsample_bytree': 0.79075698462473, 'reg_alpha': 0.2740011084528515, 'reg_lambda': 0.543676609795257}. Best is trial 6 with value: 0.5930478834787765.
[I 2024-11-06 21:26:54,599] Trial 13 finished with value: 0.5933343155798431 and parameters: {'n_estimators': 150, 'max_depth': 6, 'learning_rate': 0.06291210959350271, 'gamma': 3.690866079494279, 'min_child_weight': 7, 'subsample': 0.6893007899588486, 'colsample_bytree': 0.5196350516689874, 'reg_alpha': 0.04701804731747482, 'reg_lambda': 0.7615501873056696}. Best is trial 13 with value: 0.5933343155798431.
[I 2024-11-06 21:26:57,036] Trial 14 finished with value: 0.5928525729748774 and parameters: {'n_estimators': 53, 'max_depth': 8, 'learning_rate': 0.07402402030871931, 'gamma': 3.9135889384470612, 'min_child_weight': 1, 'subsample': 0.6645996518145331, 'colsample_bytree': 0.6124424643089341, 'reg_alpha': 0.7668139458514731, 'reg_lambda': 0.7869906835029424}. Best is trial 13 with value: 0.5933343155798431.
[I 2024-11-06 21:27:01,348] Trial 15 finished with value: 0.5913872143771416 and parameters: {'n_estimators': 244, 'max_depth': 6, 'learning_rate': 0.16417022423664668, 'gamma': 3.9269557052499, 'min_child_weight': 7, 'subsample': 0.6421739713511249, 'colsample_bytree': 0.6787128823576366, 'reg_alpha': 0.3201295381555633, 'reg_lambda': 0.7789074867035014}. Best is trial 13 with value: 0.5933343155798431.
[I 2024-11-06 21:27:06,712] Trial 16 finished with value: 0.592276866392393 and parameters: {'n_estimators': 213, 'max_depth': 8, 'learning_rate': 0.11819780764707917, 'gamma': 3.4563834332028796, 'min_child_weight': 7, 'subsample': 0.9050510187494607, 'colsample_bytree': 0.5077582675209433, 'reg_alpha': 0.15264259818061596, 'reg_lambda': 0.9040100148477508}. Best is trial 13 with value: 0.5933343155798431.
[I 2024-11-06 21:27:12,399] Trial 17 finished with value: 0.5923169910701787 and parameters: {'n_estimators': 263, 'max_depth': 10, 'learning_rate': 0.05570031581655411, 'gamma': 4.967351015406295, 'min_child_weight': 7, 'subsample': 0.6213823008225553, 'colsample_bytree': 0.8910154673892852, 'reg_alpha': 0.3626495023050115, 'reg_lambda': 0.6865506957756207}. Best is trial 13 with value: 0.5933343155798431.
[I 2024-11-06 21:27:15,229] Trial 18 finished with value: 0.591824153299281 and parameters: {'n_estimators': 163, 'max_depth': 6, 'learning_rate': 0.19514394313131905, 'gamma': 4.33658155968146, 'min_child_weight': 9, 'subsample': 0.7154459698100962, 'colsample_bytree': 0.5666180840934762, 'reg_alpha': 0.643014341149607, 'reg_lambda': 0.35486758424660597}. Best is trial 13 with value: 0.5933343155798431.
[I 2024-11-06 21:27:18,427] Trial 19 finished with value: 0.5931502893577116 and parameters: {'n_estimators': 139, 'max_depth': 4, 'learning_rate': 0.1295072337205856, 'gamma': 2.5667338843410605, 'min_child_weight': 6, 'subsample': 0.8010186690096599, 'colsample_bytree': 0.656770419772968, 'reg_alpha': 0.8468647962577939, 'reg_lambda': 0.7922285791565808}. Best is trial 13 with value: 0.5933343155798431.
[I 2024-11-06 21:27:21,574] Trial 20 finished with value: 0.5926342647692981 and parameters: {'n_estimators': 142, 'max_depth': 4, 'learning_rate': 0.12790781525558592, 'gamma': 2.475171714856427, 'min_child_weight': 6, 'subsample': 0.7973885016986526, 'colsample_bytree': 0.641141990569744, 'reg_alpha': 0.8819118894410154, 'reg_lambda': 0.8818878253117073}. Best is trial 13 with value: 0.5933343155798431.
[I 2024-11-06 21:27:25,821] Trial 21 finished with value: 0.5928193231857065 and parameters: {'n_estimators': 200, 'max_depth': 4, 'learning_rate': 0.04857996917636236, 'gamma': 1.302456696166678, 'min_child_weight': 4, 'subsample': 0.9321984727920076, 'colsample_bytree': 0.5683919030249897, 'reg_alpha': 0.7875819914008805, 'reg_lambda': 0.77419260981333}. Best is trial 13 with value: 0.5933343155798431.
[I 2024-11-06 21:27:28,825] Trial 22 finished with value: 0.5931681191297097 and parameters: {'n_estimators': 98, 'max_depth': 4, 'learning_rate': 0.09025275597239188, 'gamma': 2.671062913115441, 'min_child_weight': 6, 'subsample': 0.8467137598480077, 'colsample_bytree': 0.5005860546757472, 'reg_alpha': 0.9899203821076002, 'reg_lambda': 0.6246240419942634}. Best is trial 13 with value: 0.5933343155798431.
[I 2024-11-06 21:27:31,179] Trial 23 finished with value: 0.5918680335582371 and parameters: {'n_estimators': 97, 'max_depth': 4, 'learning_rate': 0.09656223225010041, 'gamma': 2.8055640842434686, 'min_child_weight': 6, 'subsample': 0.8257864163086086, 'colsample_bytree': 0.7948699409982446, 'reg_alpha': 0.9691081412353918, 'reg_lambda': 0.613868270836612}. Best is trial 13 with value: 0.5933343155798431.
[I 2024-11-06 21:27:33,302] Trial 24 finished with value: 0.5921488827099626 and parameters: {'n_estimators': 70, 'max_depth': 3, 'learning_rate': 0.1418556911168946, 'gamma': 3.4003983806916738, 'min_child_weight': 6, 'subsample': 0.721834256178316, 'colsample_bytree': 0.6449803483229457, 'reg_alpha': 0.8832638279706501, 'reg_lambda': 0.012756328013643792}. Best is trial 13 with value: 0.5933343155798431.
[I 2024-11-06 21:27:35,807] Trial 25 finished with value: 0.5922862904178947 and parameters: {'n_estimators': 127, 'max_depth': 4, 'learning_rate': 0.18430293783435292, 'gamma': 2.496525263839819, 'min_child_weight': 4, 'subsample': 0.8618884792968051, 'colsample_bytree': 0.5012454479368657, 'reg_alpha': 0.8373803165593036, 'reg_lambda': 0.9826712134720678}. Best is trial 13 with value: 0.5933343155798431.
[I 2024-11-06 21:27:39,641] Trial 26 finished with value: 0.5915258070952083 and parameters: {'n_estimators': 111, 'max_depth': 6, 'learning_rate': 0.14112906327307087, 'gamma': 1.558831752682034, 'min_child_weight': 7, 'subsample': 0.7881015769970627, 'colsample_bytree': 0.5727559547898283, 'reg_alpha': 0.5988977794196251, 'reg_lambda': 0.4692458335912294}. Best is trial 13 with value: 0.5933343155798431.
[I 2024-11-06 21:27:43,118] Trial 27 finished with value: 0.5929322982738745 and parameters: {'n_estimators': 151, 'max_depth': 4, 'learning_rate': 0.08408631100968927, 'gamma': 3.7148992112457515, 'min_child_weight': 4, 'subsample': 0.711690325434251, 'colsample_bytree': 0.705487459125772, 'reg_alpha': 0.9894954316146497, 'reg_lambda': 0.6091948594818878}. Best is trial 13 with value: 0.5933343155798431.
[I 2024-11-06 21:27:45,839] Trial 28 finished with value: 0.5928028075534761 and parameters: {'n_estimators': 78, 'max_depth': 5, 'learning_rate': 0.04270197651472815, 'gamma': 3.0706587121209528, 'min_child_weight': 6, 'subsample': 0.8062054674246608, 'colsample_bytree': 0.8648587567061539, 'reg_alpha': 0.8886843680312305, 'reg_lambda': 0.8150389299234988}. Best is trial 13 with value: 0.5933343155798431.
[I 2024-11-06 21:27:48,406] Trial 29 finished with value: 0.5920735161471564 and parameters: {'n_estimators': 124, 'max_depth': 3, 'learning_rate': 0.20310841120752973, 'gamma': 2.679023578078522, 'min_child_weight': 9, 'subsample': 0.7334060785718671, 'colsample_bytree': 0.552509289231695, 'reg_alpha': 0.7086240566966671, 'reg_lambda': 0.380635348279982}. Best is trial 13 with value: 0.5933343155798431.
[I 2024-11-06 21:27:52,710] Trial 30 finished with value: 0.5928413407141699 and parameters: {'n_estimators': 166, 'max_depth': 7, 'learning_rate': 0.069882366037939, 'gamma': 3.3781896379738536, 'min_child_weight': 8, 'subsample': 0.590262664677308, 'colsample_bytree': 0.6255241504372517, 'reg_alpha': 0.5788212684571626, 'reg_lambda': 0.7230818982652018}. Best is trial 13 with value: 0.5933343155798431.
[I 2024-11-06 21:27:55,884] Trial 31 finished with value: 0.5921858268432145 and parameters: {'n_estimators': 131, 'max_depth': 8, 'learning_rate': 0.10760947538990354, 'gamma': 4.274182261708945, 'min_child_weight': 7, 'subsample': 0.8787435428795449, 'colsample_bytree': 0.5304895900326235, 'reg_alpha': 0.17796826481368744, 'reg_lambda': 0.6778768471604966}. Best is trial 13 with value: 0.5933343155798431.
[I 2024-11-06 21:27:59,795] Trial 32 finished with value: 0.5927406372924591 and parameters: {'n_estimators': 108, 'max_depth': 6, 'learning_rate': 0.06094723295781669, 'gamma': 2.284339824861031, 'min_child_weight': 9, 'subsample': 0.7626372904172273, 'colsample_bytree': 0.5050080289212474, 'reg_alpha': 0.3904126177444147, 'reg_lambda': 0.8446030378251503}. Best is trial 13 with value: 0.5933343155798431.
[I 2024-11-06 21:28:03,676] Trial 33 finished with value: 0.5914678382348081 and parameters: {'n_estimators': 142, 'max_depth': 8, 'learning_rate': 0.0892715354196986, 'gamma': 3.1937572146041275, 'min_child_weight': 3, 'subsample': 0.9377790975354953, 'colsample_bytree': 0.5899384234188618, 'reg_alpha': 0.11151040208731489, 'reg_lambda': 0.5603129517145806}. Best is trial 13 with value: 0.5933343155798431.
[I 2024-11-06 21:28:07,123] Trial 34 finished with value: 0.5920560282643941 and parameters: {'n_estimators': 107, 'max_depth': 5, 'learning_rate': 0.04226717787106912, 'gamma': 4.599336643020206, 'min_child_weight': 1, 'subsample': 0.9444351882130652, 'colsample_bytree': 0.5263909280062297, 'reg_alpha': 0.9202917727787855, 'reg_lambda': 0.7384984224224302}. Best is trial 13 with value: 0.5933343155798431.
[I 2024-11-06 21:28:11,932] Trial 35 finished with value: 0.5936215356095056 and parameters: {'n_estimators': 156, 'max_depth': 7, 'learning_rate': 0.03698602633555923, 'gamma': 3.9448937093593135, 'min_child_weight': 5, 'subsample': 0.914808638514517, 'colsample_bytree': 0.5515585702395104, 'reg_alpha': 0.5535742503239749, 'reg_lambda': 0.6487793287995746}. Best is trial 35 with value: 0.5936215356095056.
[I 2024-11-06 21:28:16,825] Trial 36 finished with value: 0.5928609071117474 and parameters: {'n_estimators': 154, 'max_depth': 7, 'learning_rate': 0.03398196458486526, 'gamma': 3.753935507334843, 'min_child_weight': 5, 'subsample': 0.7541098208474791, 'colsample_bytree': 0.6683860717803896, 'reg_alpha': 0.8079964880534909, 'reg_lambda': 0.6216705043358997}. Best is trial 35 with value: 0.5936215356095056.
[I 2024-11-06 21:28:21,161] Trial 37 finished with value: 0.5904425513372973 and parameters: {'n_estimators': 173, 'max_depth': 7, 'learning_rate': 0.1337755211217338, 'gamma': 1.5271066332618206, 'min_child_weight': 6, 'subsample': 0.8547131954393201, 'colsample_bytree': 0.5913384750190638, 'reg_alpha': 0.5617737770465359, 'reg_lambda': 0.9333144070836622}. Best is trial 35 with value: 0.5936215356095056.
[I 2024-11-06 21:28:25,104] Trial 38 finished with value: 0.592992211062905 and parameters: {'n_estimators': 187, 'max_depth': 5, 'learning_rate': 0.1052580038855396, 'gamma': 2.182307280230093, 'min_child_weight': 5, 'subsample': 0.8186119161747734, 'colsample_bytree': 0.550004155440856, 'reg_alpha': 0.7197337992544686, 'reg_lambda': 0.4974228394398263}. Best is trial 35 with value: 0.5936215356095056.
[I 2024-11-06 21:28:29,935] Trial 39 finished with value: 0.5926806981347412 and parameters: {'n_estimators': 138, 'max_depth': 6, 'learning_rate': 0.02417722377281338, 'gamma': 3.637499808399955, 'min_child_weight': 4, 'subsample': 0.9751270202109594, 'colsample_bytree': 0.6129907456505393, 'reg_alpha': 0.9400060821888283, 'reg_lambda': 0.672553338901093}. Best is trial 35 with value: 0.5936215356095056.
[I 2024-11-06 21:28:32,443] Trial 40 finished with value: 0.592359408624046 and parameters: {'n_estimators': 90, 'max_depth': 4, 'learning_rate': 0.0701380246343536, 'gamma': 4.068942936784224, 'min_child_weight': 6, 'subsample': 0.781071651647791, 'colsample_bytree': 0.5459554721707811, 'reg_alpha': 0.45282643275121587, 'reg_lambda': 0.4177957512625399}. Best is trial 35 with value: 0.5936215356095056.
[I 2024-11-06 21:28:35,940] Trial 41 finished with value: 0.5930563630634944 and parameters: {'n_estimators': 156, 'max_depth': 9, 'learning_rate': 0.058579553231026066, 'gamma': 4.697095889158767, 'min_child_weight': 5, 'subsample': 0.9142838411813666, 'colsample_bytree': 0.5253292383299932, 'reg_alpha': 0.24662595412184396, 'reg_lambda': 0.7403644280923781}. Best is trial 35 with value: 0.5936215356095056.
[I 2024-11-06 21:28:40,847] Trial 42 finished with value: 0.5935814689857593 and parameters: {'n_estimators': 157, 'max_depth': 9, 'learning_rate': 0.03149956473834535, 'gamma': 4.6052979076735845, 'min_child_weight': 5, 'subsample': 0.9093401201574329, 'colsample_bytree': 0.522394672532218, 'reg_alpha': 0.006937514571475054, 'reg_lambda': 0.7620156528281317}. Best is trial 35 with value: 0.5936215356095056.
[I 2024-11-06 21:28:46,489] Trial 43 finished with value: 0.593586824545995 and parameters: {'n_estimators': 178, 'max_depth': 10, 'learning_rate': 0.029246050251211977, 'gamma': 4.656234965156613, 'min_child_weight': 5, 'subsample': 0.8802634876344854, 'colsample_bytree': 0.5827326005370035, 'reg_alpha': 0.07050721449823685, 'reg_lambda': 0.8400842759357233}. Best is trial 35 with value: 0.5936215356095056.
[I 2024-11-06 21:28:52,743] Trial 44 finished with value: 0.5931565011742173 and parameters: {'n_estimators': 185, 'max_depth': 10, 'learning_rate': 0.02808377532763552, 'gamma': 4.619727533536501, 'min_child_weight': 4, 'subsample': 0.873112886882289, 'colsample_bytree': 0.5792012663409501, 'reg_alpha': 0.0009851659530695916, 'reg_lambda': 0.5744156704578168}. Best is trial 35 with value: 0.5936215356095056.
[I 2024-11-06 21:29:01,118] Trial 45 finished with value: 0.5930665777588133 and parameters: {'n_estimators': 202, 'max_depth': 10, 'learning_rate': 0.015638095638059207, 'gamma': 4.109640338601694, 'min_child_weight': 2, 'subsample': 0.9005594894910693, 'colsample_bytree': 0.5566385251127182, 'reg_alpha': 0.08093995508890225, 'reg_lambda': 0.8455379961764762}. Best is trial 35 with value: 0.5936215356095056.
[I 2024-11-06 21:29:06,978] Trial 46 finished with value: 0.5934633183726782 and parameters: {'n_estimators': 166, 'max_depth': 9, 'learning_rate': 0.03728491301271824, 'gamma': 4.761319075650734, 'min_child_weight': 5, 'subsample': 0.9595185660873472, 'colsample_bytree': 0.5209737321174776, 'reg_alpha': 0.0530358042894986, 'reg_lambda': 0.6598288684037323}. Best is trial 35 with value: 0.5936215356095056.
