[I 2024-11-06 20:33:41,119] Trial 227 finished with value: 0.5913878577048239 and parameters: {'n_estimators': 81, 'max_depth': 2, 'min_samples_split': 2, 'min_samples_leaf': 1}. Best is trial 113 with value: 0.5986452919600942.
[I 2024-11-06 20:33:43,080] Trial 228 finished with value: 0.5918072696048966 and parameters: {'n_estimators': 65, 'max_depth': 1, 'min_samples_split': 3, 'min_samples_leaf': 1}. Best is trial 113 with value: 0.5986452919600942.
[I 2024-11-06 20:33:47,620] Trial 229 finished with value: 0.5907005008507629 and parameters: {'n_estimators': 84, 'max_depth': 5, 'min_samples_split': 4, 'min_samples_leaf': 1}. Best is trial 113 with value: 0.5986452919600942.
[I 2024-11-06 20:33:50,826] Trial 230 finished with value: 0.5985496647084861 and parameters: {'n_estimators': 76, 'max_depth': 3, 'min_samples_split': 5, 'min_samples_leaf': 1}. Best is trial 113 with value: 0.5986452919600942.
[I 2024-11-06 20:33:54,054] Trial 231 finished with value: 0.5985496647084861 and parameters: {'n_estimators': 76, 'max_depth': 3, 'min_samples_split': 5, 'min_samples_leaf': 1}. Best is trial 113 with value: 0.5986452919600942.
[I 2024-11-06 20:33:57,086] Trial 232 finished with value: 0.5983374562540338 and parameters: {'n_estimators': 70, 'max_depth': 3, 'min_samples_split': 5, 'min_samples_leaf': 1}. Best is trial 113 with value: 0.5986452919600942.
[I 2024-11-06 20:33:59,803] Trial 233 finished with value: 0.5923512189710275 and parameters: {'n_estimators': 75, 'max_depth': 2, 'min_samples_split': 5, 'min_samples_leaf': 1}. Best is trial 113 with value: 0.5986452919600942.
[I 2024-11-06 20:34:03,414] Trial 234 finished with value: 0.5983456976319746 and parameters: {'n_estimators': 81, 'max_depth': 3, 'min_samples_split': 19, 'min_samples_leaf': 1}. Best is trial 113 with value: 0.5986452919600942.
[I 2024-11-06 20:34:07,575] Trial 235 finished with value: 0.5934837474396212 and parameters: {'n_estimators': 84, 'max_depth': 4, 'min_samples_split': 5, 'min_samples_leaf': 1}. Best is trial 113 with value: 0.5986452919600942.
[I 2024-11-06 20:34:10,449] Trial 236 finished with value: 0.5910571071304002 and parameters: {'n_estimators': 80, 'max_depth': 2, 'min_samples_split': 5, 'min_samples_leaf': 2}. Best is trial 113 with value: 0.5986452919600942.
[I 2024-11-06 20:34:13,965] Trial 237 finished with value: 0.5937019492606057 and parameters: {'n_estimators': 72, 'max_depth': 4, 'min_samples_split': 4, 'min_samples_leaf': 1}. Best is trial 113 with value: 0.5986452919600942.
[I 2024-11-06 20:34:16,279] Trial 238 finished with value: 0.5918513869487873 and parameters: {'n_estimators': 76, 'max_depth': 1, 'min_samples_split': 4, 'min_samples_leaf': 2}. Best is trial 113 with value: 0.5986452919600942.
[I 2024-11-06 20:34:19,827] Trial 239 finished with value: 0.598517576756202 and parameters: {'n_estimators': 85, 'max_depth': 3, 'min_samples_split': 4, 'min_samples_leaf': 1}. Best is trial 113 with value: 0.5986452919600942.
[I 2024-11-06 20:34:24,397] Trial 240 finished with value: 0.590873710594026 and parameters: {'n_estimators': 85, 'max_depth': 5, 'min_samples_split': 5, 'min_samples_leaf': 1}. Best is trial 113 with value: 0.5986452919600942.
[I 2024-11-06 20:34:28,275] Trial 241 finished with value: 0.5984490013341649 and parameters: {'n_estimators': 94, 'max_depth': 3, 'min_samples_split': 4, 'min_samples_leaf': 1}. Best is trial 113 with value: 0.5986452919600942.
[I 2024-11-06 20:34:31,742] Trial 242 finished with value: 0.5982878027620789 and parameters: {'n_estimators': 79, 'max_depth': 3, 'min_samples_split': 4, 'min_samples_leaf': 1}. Best is trial 113 with value: 0.5986452919600942.
[I 2024-11-06 20:34:34,992] Trial 243 finished with value: 0.5913311118386629 and parameters: {'n_estimators': 91, 'max_depth': 2, 'min_samples_split': 5, 'min_samples_leaf': 2}. Best is trial 113 with value: 0.5986452919600942.
[I 2024-11-06 20:34:38,590] Trial 244 finished with value: 0.5985119589070883 and parameters: {'n_estimators': 86, 'max_depth': 3, 'min_samples_split': 4, 'min_samples_leaf': 1}. Best is trial 113 with value: 0.5986452919600942.
[I 2024-11-06 20:34:42,690] Trial 245 finished with value: 0.5932321512519036 and parameters: {'n_estimators': 86, 'max_depth': 4, 'min_samples_split': 4, 'min_samples_leaf': 1}. Best is trial 113 with value: 0.5986452919600942.
[I 2024-11-06 20:34:46,768] Trial 246 finished with value: 0.5927727154127417 and parameters: {'n_estimators': 83, 'max_depth': 4, 'min_samples_split': 4, 'min_samples_leaf': 2}. Best is trial 113 with value: 0.5986452919600942.
[I 2024-11-06 20:34:49,476] Trial 247 finished with value: 0.5921729033109402 and parameters: {'n_estimators': 76, 'max_depth': 2, 'min_samples_split': 11, 'min_samples_leaf': 1}. Best is trial 113 with value: 0.5986452919600942.
[I 2024-11-06 20:34:58,460] Trial 248 finished with value: 0.5933211549958869 and parameters: {'n_estimators': 80, 'max_depth': 14, 'min_samples_split': 5, 'min_samples_leaf': 2}. Best is trial 113 with value: 0.5986452919600942.
[I 2024-11-06 20:35:02,129] Trial 249 finished with value: 0.5984004201952674 and parameters: {'n_estimators': 87, 'max_depth': 3, 'min_samples_split': 4, 'min_samples_leaf': 1}. Best is trial 113 with value: 0.5986452919600942.
[I 2024-11-06 20:35:04,869] Trial 250 finished with value: 0.5918262554401501 and parameters: {'n_estimators': 69, 'max_depth': 2, 'min_samples_split': 5, 'min_samples_leaf': 1}. Best is trial 113 with value: 0.5986452919600942.
[I 2024-11-06 20:35:08,761] Trial 251 finished with value: 0.5924951666704041 and parameters: {'n_estimators': 81, 'max_depth': 4, 'min_samples_split': 4, 'min_samples_leaf': 3}. Best is trial 113 with value: 0.5986452919600942.
[I 2024-11-06 20:35:13,559] Trial 252 finished with value: 0.5906534078490369 and parameters: {'n_estimators': 90, 'max_depth': 5, 'min_samples_split': 2, 'min_samples_leaf': 1}. Best is trial 113 with value: 0.5986452919600942.
[I 2024-11-06 20:35:28,138] Trial 253 finished with value: 0.5761244947459352 and parameters: {'n_estimators': 74, 'max_depth': 32, 'min_samples_split': 3, 'min_samples_leaf': 1}. Best is trial 113 with value: 0.5986452919600942.
[I 2024-11-06 20:35:30,639] Trial 254 finished with value: 0.5917455597271795 and parameters: {'n_estimators': 85, 'max_depth': 1, 'min_samples_split': 4, 'min_samples_leaf': 2}. Best is trial 113 with value: 0.5986452919600942.
[I 2024-11-06 20:35:33,910] Trial 255 finished with value: 0.5983334913956256 and parameters: {'n_estimators': 78, 'max_depth': 3, 'min_samples_split': 3, 'min_samples_leaf': 2}. Best is trial 113 with value: 0.5986452919600942.
[I 2024-11-06 20:35:51,180] Trial 256 finished with value: 0.5767434649426232 and parameters: {'n_estimators': 88, 'max_depth': 41, 'min_samples_split': 5, 'min_samples_leaf': 1}. Best is trial 113 with value: 0.5986452919600942.
[I 2024-11-06 20:35:54,100] Trial 257 finished with value: 0.5912678422012257 and parameters: {'n_estimators': 82, 'max_depth': 2, 'min_samples_split': 4, 'min_samples_leaf': 1}. Best is trial 113 with value: 0.5986452919600942.
[I 2024-11-06 20:35:58,547] Trial 258 finished with value: 0.5931061590406563 and parameters: {'n_estimators': 71, 'max_depth': 6, 'min_samples_split': 3, 'min_samples_leaf': 1}. Best is trial 113 with value: 0.5986452919600942.
[I 2024-11-06 20:36:01,794] Trial 259 finished with value: 0.5985496647084861 and parameters: {'n_estimators': 76, 'max_depth': 3, 'min_samples_split': 2, 'min_samples_leaf': 2}. Best is trial 113 with value: 0.5986452919600942.
[I 2024-11-06 20:36:06,351] Trial 260 finished with value: 0.5921385321019084 and parameters: {'n_estimators': 77, 'max_depth': 5, 'min_samples_split': 2, 'min_samples_leaf': 1}. Best is trial 113 with value: 0.5986452919600942.
[I 2024-11-06 20:36:09,590] Trial 261 finished with value: 0.5931528915461883 and parameters: {'n_estimators': 65, 'max_depth': 4, 'min_samples_split': 2, 'min_samples_leaf': 2}. Best is trial 113 with value: 0.5986452919600942.
[I 2024-11-06 20:36:11,826] Trial 262 finished with value: 0.5919598878858062 and parameters: {'n_estimators': 73, 'max_depth': 1, 'min_samples_split': 2, 'min_samples_leaf': 5}. Best is trial 113 with value: 0.5986452919600942.
[I 2024-11-06 20:36:15,269] Trial 263 finished with value: 0.5982672842421276 and parameters: {'n_estimators': 80, 'max_depth': 3, 'min_samples_split': 5, 'min_samples_leaf': 1}. Best is trial 113 with value: 0.5986452919600942.
[I 2024-11-06 20:36:19,307] Trial 264 finished with value: 0.5934446841142302 and parameters: {'n_estimators': 84, 'max_depth': 4, 'min_samples_split': 4, 'min_samples_leaf': 1}. Best is trial 113 with value: 0.5986452919600942.
[I 2024-11-06 20:36:22,202] Trial 265 finished with value: 0.5921729033109402 and parameters: {'n_estimators': 76, 'max_depth': 2, 'min_samples_split': 2, 'min_samples_leaf': 2}. Best is trial 113 with value: 0.5986452919600942.
[I 2024-11-06 20:36:26,649] Trial 266 finished with value: 0.59109757004625 and parameters: {'n_estimators': 81, 'max_depth': 5, 'min_samples_split': 4, 'min_samples_leaf': 1}. Best is trial 113 with value: 0.5986452919600942.
[I 2024-11-06 20:36:29,842] Trial 267 finished with value: 0.5986432987743928 and parameters: {'n_estimators': 73, 'max_depth': 3, 'min_samples_split': 3, 'min_samples_leaf': 1}. Best is trial 113 with value: 0.5986452919600942.
[I 2024-11-06 20:36:31,831] Trial 268 finished with value: 0.5918904436469393 and parameters: {'n_estimators': 66, 'max_depth': 1, 'min_samples_split': 4, 'min_samples_leaf': 1}. Best is trial 113 with value: 0.5986452919600942.
[I 2024-11-06 20:36:34,876] Trial 269 finished with value: 0.5978989004753974 and parameters: {'n_estimators': 69, 'max_depth': 3, 'min_samples_split': 5, 'min_samples_leaf': 1}. Best is trial 113 with value: 0.5986452919600942.
[I 2024-11-06 20:36:38,459] Trial 270 finished with value: 0.5936726794772667 and parameters: {'n_estimators': 72, 'max_depth': 4, 'min_samples_split': 2, 'min_samples_leaf': 1}. Best is trial 113 with value: 0.5986452919600942.
[I 2024-11-06 20:36:41,218] Trial 271 finished with value: 0.592437301835236 and parameters: {'n_estimators': 74, 'max_depth': 2, 'min_samples_split': 3, 'min_samples_leaf': 1}. Best is trial 113 with value: 0.5986452919600942.
[I 2024-11-06 20:36:45,505] Trial 272 finished with value: 0.5937170392699176 and parameters: {'n_estimators': 89, 'max_depth': 4, 'min_samples_split': 5, 'min_samples_leaf': 1}. Best is trial 113 with value: 0.5986452919600942.
[I 2024-11-06 20:36:49,408] Trial 273 finished with value: 0.5927527510503441 and parameters: {'n_estimators': 62, 'max_depth': 6, 'min_samples_split': 4, 'min_samples_leaf': 1}. Best is trial 113 with value: 0.5986452919600942.
[I 2024-11-06 20:36:52,138] Trial 274 finished with value: 0.5918129964131911 and parameters: {'n_estimators': 77, 'max_depth': 2, 'min_samples_split': 3, 'min_samples_leaf': 6}. Best is trial 113 with value: 0.5986452919600942.
[I 2024-11-06 20:36:55,458] Trial 275 finished with value: 0.5983334913956256 and parameters: {'n_estimators': 78, 'max_depth': 3, 'min_samples_split': 12, 'min_samples_leaf': 2}. Best is trial 113 with value: 0.5986452919600942.
[I 2024-11-06 20:36:59,357] Trial 276 finished with value: 0.5913302400730608 and parameters: {'n_estimators': 70, 'max_depth': 5, 'min_samples_split': 4, 'min_samples_leaf': 1}. Best is trial 113 with value: 0.5986452919600942.
[I 2024-11-06 20:37:03,180] Trial 277 finished with value: 0.5984004201952674 and parameters: {'n_estimators': 87, 'max_depth': 3, 'min_samples_split': 2, 'min_samples_leaf': 1}. Best is trial 113 with value: 0.5986452919600942.
[I 2024-11-06 20:37:05,743] Trial 278 finished with value: 0.5917359383146273 and parameters: {'n_estimators': 81, 'max_depth': 1, 'min_samples_split': 3, 'min_samples_leaf': 2}. Best is trial 113 with value: 0.5986452919600942.
[I 2024-11-06 20:37:08,350] Trial 279 finished with value: 0.5922251752300065 and parameters: {'n_estimators': 73, 'max_depth': 2, 'min_samples_split': 15, 'min_samples_leaf': 1}. Best is trial 113 with value: 0.5986452919600942.
[I 2024-11-06 20:37:12,124] Trial 280 finished with value: 0.592737781653341 and parameters: {'n_estimators': 77, 'max_depth': 4, 'min_samples_split': 3, 'min_samples_leaf': 2}. Best is trial 113 with value: 0.5986452919600942.
[I 2024-11-06 20:37:16,553] Trial 281 finished with value: 0.5935167294780397 and parameters: {'n_estimators': 91, 'max_depth': 4, 'min_samples_split': 4, 'min_samples_leaf': 1}. Best is trial 113 with value: 0.5986452919600942.
[I 2024-11-06 20:37:19,532] Trial 282 finished with value: 0.5912574944963328 and parameters: {'n_estimators': 85, 'max_depth': 2, 'min_samples_split': 5, 'min_samples_leaf': 1}. Best is trial 113 with value: 0.5986452919600942.
[I 2024-11-06 20:37:23,116] Trial 283 finished with value: 0.5981735928289339 and parameters: {'n_estimators': 81, 'max_depth': 3, 'min_samples_split': 5, 'min_samples_leaf': 18}. Best is trial 113 with value: 0.5986452919600942.
[I 2024-11-06 20:37:27,243] Trial 284 finished with value: 0.5915326408719823 and parameters: {'n_estimators': 74, 'max_depth': 5, 'min_samples_split': 4, 'min_samples_leaf': 1}. Best is trial 113 with value: 0.5986452919600942.
[I 2024-11-06 20:37:32,538] Trial 285 finished with value: 0.5941255266539656 and parameters: {'n_estimators': 86, 'max_depth': 6, 'min_samples_split': 2, 'min_samples_leaf': 8}. Best is trial 113 with value: 0.5986452919600942.
[I 2024-11-06 20:37:35,558] Trial 286 finished with value: 0.5983118661649461 and parameters: {'n_estimators': 68, 'max_depth': 3, 'min_samples_split': 3, 'min_samples_leaf': 12}. Best is trial 113 with value: 0.5986452919600942.
[I 2024-11-06 20:37:38,817] Trial 287 finished with value: 0.5903277534613821 and parameters: {'n_estimators': 92, 'max_depth': 2, 'min_samples_split': 4, 'min_samples_leaf': 7}. Best is trial 113 with value: 0.5986452919600942.
[I 2024-11-06 20:37:42,697] Trial 288 finished with value: 0.5921729096782694 and parameters: {'n_estimators': 78, 'max_depth': 4, 'min_samples_split': 13, 'min_samples_leaf': 2}. Best is trial 113 with value: 0.5986452919600942.
[I 2024-11-06 20:37:45,146] Trial 289 finished with value: 0.5917571992963908 and parameters: {'n_estimators': 83, 'max_depth': 1, 'min_samples_split': 3, 'min_samples_leaf': 1}. Best is trial 113 with value: 0.5986452919600942.
[I 2024-11-06 20:37:49,181] Trial 290 finished with value: 0.5981286017390733 and parameters: {'n_estimators': 99, 'max_depth': 3, 'min_samples_split': 6, 'min_samples_leaf': 13}. Best is trial 113 with value: 0.5986452919600942.
[I 2024-11-06 20:37:53,376] Trial 291 finished with value: 0.5916727129403853 and parameters: {'n_estimators': 76, 'max_depth': 5, 'min_samples_split': 2, 'min_samples_leaf': 2}. Best is trial 113 with value: 0.5986452919600942.
[I 2024-11-06 20:37:55,985] Trial 292 finished with value: 0.5917232621615163 and parameters: {'n_estimators': 88, 'max_depth': 1, 'min_samples_split': 4, 'min_samples_leaf': 1}. Best is trial 113 with value: 0.5986452919600942.
[I 2024-11-06 20:38:12,362] Trial 293 finished with value: 0.575838615065399 and parameters: {'n_estimators': 82, 'max_depth': 36, 'min_samples_split': 5, 'min_samples_leaf': 1}. Best is trial 113 with value: 0.5986452919600942.
[I 2024-11-06 20:38:15,516] Trial 294 finished with value: 0.5985993443281663 and parameters: {'n_estimators': 72, 'max_depth': 3, 'min_samples_split': 2, 'min_samples_leaf': 1}. Best is trial 113 with value: 0.5986452919600942.
[I 2024-11-06 20:38:18,137] Trial 295 finished with value: 0.5921026234911293 and parameters: {'n_estimators': 71, 'max_depth': 2, 'min_samples_split': 2, 'min_samples_leaf': 1}. Best is trial 113 with value: 0.5986452919600942.
[I 2024-11-06 20:38:21,511] Trial 296 finished with value: 0.59216683715395 and parameters: {'n_estimators': 69, 'max_depth': 4, 'min_samples_split': 2, 'min_samples_leaf': 2}. Best is trial 113 with value: 0.5986452919600942.
[I 2024-11-06 20:38:24,720] Trial 297 finished with value: 0.5986474135090558 and parameters: {'n_estimators': 74, 'max_depth': 3, 'min_samples_split': 2, 'min_samples_leaf': 1}. Best is trial 297 with value: 0.5986474135090558.
[I 2024-11-06 20:38:28,453] Trial 298 finished with value: 0.5921307962012181 and parameters: {'n_estimators': 66, 'max_depth': 5, 'min_samples_split': 2, 'min_samples_leaf': 1}. Best is trial 297 with value: 0.5986474135090558.
[I 2024-11-06 20:38:31,069] Trial 299 finished with value: 0.592437301835236 and parameters: {'n_estimators': 74, 'max_depth': 2, 'min_samples_split': 2, 'min_samples_leaf': 1}. Best is trial 297 with value: 0.5986474135090558.
[I 2024-11-06 20:38:36,465] Trial 300 finished with value: 0.5937516669336091 and parameters: {'n_estimators': 79, 'max_depth': 7, 'min_samples_split': 2, 'min_samples_leaf': 1}. Best is trial 297 with value: 0.5986474135090558.
[I 2024-11-06 20:38:39,512] Trial 301 finished with value: 0.5921626410027997 and parameters: {'n_estimators': 60, 'max_depth': 4, 'min_samples_split': 2, 'min_samples_leaf': 2}. Best is trial 297 with value: 0.5986474135090558.
[I 2024-11-06 20:38:42,583] Trial 302 finished with value: 0.5985993443281663 and parameters: {'n_estimators': 72, 'max_depth': 3, 'min_samples_split': 2, 'min_samples_leaf': 1}. Best is trial 297 with value: 0.5986474135090558.
[I 2024-11-06 20:38:46,153] Trial 303 finished with value: 0.5936726794772667 and parameters: {'n_estimators': 72, 'max_depth': 4, 'min_samples_split': 2, 'min_samples_leaf': 1}. Best is trial 297 with value: 0.5986474135090558.
[I 2024-11-06 20:38:49,021] Trial 304 finished with value: 0.5978082500941654 and parameters: {'n_estimators': 67, 'max_depth': 3, 'min_samples_split': 2, 'min_samples_leaf': 2}. Best is trial 297 with value: 0.5986474135090558.
[I 2024-11-06 20:38:51,291] Trial 305 finished with value: 0.5921304222459618 and parameters: {'n_estimators': 63, 'max_depth': 2, 'min_samples_split': 2, 'min_samples_leaf': 1}. Best is trial 297 with value: 0.5986474135090558.
[I 2024-11-06 20:38:53,581] Trial 306 finished with value: 0.5918686077264141 and parameters: {'n_estimators': 75, 'max_depth': 1, 'min_samples_split': 2, 'min_samples_leaf': 1}. Best is trial 297 with value: 0.5986474135090558.
[I 2024-11-06 20:38:57,485] Trial 307 finished with value: 0.5918410976593315 and parameters: {'n_estimators': 70, 'max_depth': 5, 'min_samples_split': 3, 'min_samples_leaf': 3}. Best is trial 297 with value: 0.5986474135090558.
[I 2024-11-06 20:39:00,054] Trial 308 finished with value: 0.5965487425216868 and parameters: {'n_estimators': 59, 'max_depth': 3, 'min_samples_split': 3, 'min_samples_leaf': 1}. Best is trial 297 with value: 0.5986474135090558.
[I 2024-11-06 20:39:05,146] Trial 309 finished with value: 0.5931488179909818 and parameters: {'n_estimators': 79, 'max_depth': 6, 'min_samples_split': 2, 'min_samples_leaf': 2}. Best is trial 297 with value: 0.5986474135090558.
[I 2024-11-06 20:39:08,819] Trial 310 finished with value: 0.593016827626083 and parameters: {'n_estimators': 74, 'max_depth': 4, 'min_samples_split': 2, 'min_samples_leaf': 1}. Best is trial 297 with value: 0.5986474135090558.
[I 2024-11-06 20:39:11,708] Trial 311 finished with value: 0.5913878577048239 and parameters: {'n_estimators': 81, 'max_depth': 2, 'min_samples_split': 3, 'min_samples_leaf': 1}. Best is trial 297 with value: 0.5986474135090558.
[I 2024-11-06 20:39:13,944] Trial 312 finished with value: 0.5918349008137124 and parameters: {'n_estimators': 71, 'max_depth': 1, 'min_samples_split': 3, 'min_samples_leaf': 2}. Best is trial 297 with value: 0.5986474135090558.
[I 2024-11-06 20:39:17,190] Trial 313 finished with value: 0.5984698599692941 and parameters: {'n_estimators': 77, 'max_depth': 3, 'min_samples_split': 2, 'min_samples_leaf': 1}. Best is trial 297 with value: 0.5986474135090558.
[I 2024-11-06 20:39:21,184] Trial 314 finished with value: 0.592991466645421 and parameters: {'n_estimators': 83, 'max_depth': 4, 'min_samples_split': 16, 'min_samples_leaf': 1}. Best is trial 297 with value: 0.5986474135090558.
[I 2024-11-06 20:39:30,940] Trial 315 finished with value: 0.5910203521752908 and parameters: {'n_estimators': 188, 'max_depth': 5, 'min_samples_split': 3, 'min_samples_leaf': 2}. Best is trial 297 with value: 0.5986474135090558.
[I 2024-11-06 20:39:33,593] Trial 316 finished with value: 0.5921729033109402 and parameters: {'n_estimators': 76, 'max_depth': 2, 'min_samples_split': 6, 'min_samples_leaf': 1}. Best is trial 297 with value: 0.5986474135090558.
[I 2024-11-06 20:39:36,510] Trial 317 finished with value: 0.5978082500941654 and parameters: {'n_estimators': 67, 'max_depth': 3, 'min_samples_split': 2, 'min_samples_leaf': 1}. Best is trial 297 with value: 0.5986474135090558.
[I 2024-11-06 20:39:40,067] Trial 318 finished with value: 0.598517576756202 and parameters: {'n_estimators': 85, 'max_depth': 3, 'min_samples_split': 3, 'min_samples_leaf': 1}. Best is trial 297 with value: 0.5986474135090558.
[I 2024-11-06 20:39:55,497] Trial 319 finished with value: 0.5795722035167141 and parameters: {'n_estimators': 80, 'max_depth': 44, 'min_samples_split': 3, 'min_samples_leaf': 2}. Best is trial 297 with value: 0.5986474135090558.
[I 2024-11-06 20:39:57,735] Trial 320 finished with value: 0.5918548791124849 and parameters: {'n_estimators': 72, 'max_depth': 1, 'min_samples_split': 3, 'min_samples_leaf': 1}. Best is trial 297 with value: 0.5986474135090558.
[I 2024-11-06 20:40:01,887] Trial 321 finished with value: 0.5932428703811217 and parameters: {'n_estimators': 84, 'max_depth': 4, 'min_samples_split': 2, 'min_samples_leaf': 2}. Best is trial 297 with value: 0.5986474135090558.
[I 2024-11-06 20:40:04,830] Trial 322 finished with value: 0.5923512189710275 and parameters: {'n_estimators': 75, 'max_depth': 2, 'min_samples_split': 3, 'min_samples_leaf': 1}. Best is trial 297 with value: 0.5986474135090558.
