[I 2024-11-06 21:54:15,064] Trial 365 finished with value: 0.5927034144227853 and parameters: {'n_estimators': 125, 'max_depth': 7, 'learning_rate': 0.05990931738294317, 'gamma': 3.506351017334952, 'min_child_weight': 7, 'subsample': 0.9068498039393487, 'colsample_bytree': 0.5151180122353456, 'reg_alpha': 0.779906793475882, 'reg_lambda': 0.7328394817467321}. Best is trial 244 with value: 0.5939527867949647.
[I 2024-11-06 21:54:17,895] Trial 366 finished with value: 0.5921567884224025 and parameters: {'n_estimators': 133, 'max_depth': 6, 'learning_rate': 0.10815446781283787, 'gamma': 3.5769747661227487, 'min_child_weight': 7, 'subsample': 0.8921755101517823, 'colsample_bytree': 0.5044068162264764, 'reg_alpha': 0.7417698166638219, 'reg_lambda': 0.7094118029811289}. Best is trial 244 with value: 0.5939527867949647.
[I 2024-11-06 21:54:22,188] Trial 367 finished with value: 0.5935495784994336 and parameters: {'n_estimators': 138, 'max_depth': 7, 'learning_rate': 0.05526838642805018, 'gamma': 3.412503608885516, 'min_child_weight': 7, 'subsample': 0.8854535074416396, 'colsample_bytree': 0.5140798938444885, 'reg_alpha': 0.76487429604604, 'reg_lambda': 0.7721701395645583}. Best is trial 244 with value: 0.5939527867949647.
[I 2024-11-06 21:54:25,674] Trial 368 finished with value: 0.5934877239846376 and parameters: {'n_estimators': 116, 'max_depth': 7, 'learning_rate': 0.06371826879766049, 'gamma': 3.6151973727753544, 'min_child_weight': 6, 'subsample': 0.9002613707771502, 'colsample_bytree': 0.5259389375227491, 'reg_alpha': 0.8362314175879275, 'reg_lambda': 0.7223604622280613}. Best is trial 244 with value: 0.5939527867949647.
[I 2024-11-06 21:54:29,542] Trial 369 finished with value: 0.5930884264969947 and parameters: {'n_estimators': 135, 'max_depth': 7, 'learning_rate': 0.06017022530814986, 'gamma': 3.699169647665441, 'min_child_weight': 7, 'subsample': 0.882487120997196, 'colsample_bytree': 0.5206566638514697, 'reg_alpha': 0.80393919899523, 'reg_lambda': 0.7009702598091108}. Best is trial 244 with value: 0.5939527867949647.
[I 2024-11-06 21:54:33,491] Trial 370 finished with value: 0.5926944719229751 and parameters: {'n_estimators': 139, 'max_depth': 8, 'learning_rate': 0.054989009654560606, 'gamma': 3.8082408537085137, 'min_child_weight': 7, 'subsample': 0.918544222690749, 'colsample_bytree': 0.5869055517136829, 'reg_alpha': 0.6692433068594399, 'reg_lambda': 0.7387238915288591}. Best is trial 244 with value: 0.5939527867949647.
[I 2024-11-06 21:54:36,595] Trial 371 finished with value: 0.5929330357973219 and parameters: {'n_estimators': 129, 'max_depth': 3, 'learning_rate': 0.048298815194443206, 'gamma': 3.8632789084223504, 'min_child_weight': 4, 'subsample': 0.8245845739071023, 'colsample_bytree': 0.5094044678019859, 'reg_alpha': 0.6940111832975833, 'reg_lambda': 0.7104423582966843}. Best is trial 244 with value: 0.5939527867949647.
[I 2024-11-06 21:54:39,962] Trial 372 finished with value: 0.5932009918378388 and parameters: {'n_estimators': 142, 'max_depth': 7, 'learning_rate': 0.07024043515493467, 'gamma': 4.84719889305994, 'min_child_weight': 7, 'subsample': 0.8937933307140381, 'colsample_bytree': 0.5769830463218085, 'reg_alpha': 0.7452690262091045, 'reg_lambda': 0.6910005835770348}. Best is trial 244 with value: 0.5939527867949647.
[I 2024-11-06 21:54:44,135] Trial 373 finished with value: 0.593325403145888 and parameters: {'n_estimators': 144, 'max_depth': 7, 'learning_rate': 0.05867996952210899, 'gamma': 3.4838793957071044, 'min_child_weight': 7, 'subsample': 0.8804860530772038, 'colsample_bytree': 0.5305748235572487, 'reg_alpha': 0.7859536934379383, 'reg_lambda': 0.8314427175516441}. Best is trial 244 with value: 0.5939527867949647.
[I 2024-11-06 21:54:48,382] Trial 374 finished with value: 0.5934815926226994 and parameters: {'n_estimators': 136, 'max_depth': 7, 'learning_rate': 0.04629427600553526, 'gamma': 3.7167842559758593, 'min_child_weight': 7, 'subsample': 0.8530290612897393, 'colsample_bytree': 0.5216365721058953, 'reg_alpha': 0.6178508350922177, 'reg_lambda': 0.7189972986679731}. Best is trial 244 with value: 0.5939527867949647.
[I 2024-11-06 21:54:52,349] Trial 375 finished with value: 0.5933570870120491 and parameters: {'n_estimators': 141, 'max_depth': 7, 'learning_rate': 0.053382350651793684, 'gamma': 3.595089764340722, 'min_child_weight': 7, 'subsample': 0.9103130036996737, 'colsample_bytree': 0.5908897928873521, 'reg_alpha': 0.7071924580124026, 'reg_lambda': 0.7568304752763848}. Best is trial 244 with value: 0.5939527867949647.
[I 2024-11-06 21:54:57,602] Trial 376 finished with value: 0.5930278875066775 and parameters: {'n_estimators': 145, 'max_depth': 9, 'learning_rate': 0.023497224819278982, 'gamma': 4.986379993606917, 'min_child_weight': 7, 'subsample': 0.8872152641566022, 'colsample_bytree': 0.5672751450793131, 'reg_alpha': 0.7564616257150816, 'reg_lambda': 0.6918334240771956}. Best is trial 244 with value: 0.5939527867949647.
[I 2024-11-06 21:55:01,451] Trial 377 finished with value: 0.5930747368267132 and parameters: {'n_estimators': 186, 'max_depth': 7, 'learning_rate': 0.06347031009790488, 'gamma': 4.691211760899815, 'min_child_weight': 6, 'subsample': 0.8732077166108592, 'colsample_bytree': 0.5376338425210304, 'reg_alpha': 0.6421104301233259, 'reg_lambda': 0.7883164305056396}. Best is trial 244 with value: 0.5939527867949647.
[I 2024-11-06 21:55:05,413] Trial 378 finished with value: 0.5929209137855468 and parameters: {'n_estimators': 149, 'max_depth': 4, 'learning_rate': 0.17265385231069164, 'gamma': 3.3831220034927028, 'min_child_weight': 7, 'subsample': 0.8600338652432542, 'colsample_bytree': 0.5550070939443984, 'reg_alpha': 0.6856281973449513, 'reg_lambda': 0.6576962402259836}. Best is trial 244 with value: 0.5939527867949647.
[I 2024-11-06 21:55:09,763] Trial 379 finished with value: 0.5932702175965356 and parameters: {'n_estimators': 134, 'max_depth': 7, 'learning_rate': 0.04436756040889675, 'gamma': 3.742722710792142, 'min_child_weight': 7, 'subsample': 0.9028062661116052, 'colsample_bytree': 0.5111188597372136, 'reg_alpha': 0.7717109540668058, 'reg_lambda': 0.6338374947592778}. Best is trial 244 with value: 0.5939527867949647.
[I 2024-11-06 21:55:15,491] Trial 380 finished with value: 0.5921620652299454 and parameters: {'n_estimators': 175, 'max_depth': 7, 'learning_rate': 0.016831237083198038, 'gamma': 3.082223553707266, 'min_child_weight': 7, 'subsample': 0.8391453165963071, 'colsample_bytree': 0.5001588080753505, 'reg_alpha': 0.7354518778297069, 'reg_lambda': 0.9945566283960565}. Best is trial 244 with value: 0.5939527867949647.
[I 2024-11-06 21:55:20,418] Trial 381 finished with value: 0.592550319931967 and parameters: {'n_estimators': 169, 'max_depth': 6, 'learning_rate': 0.031164722001575777, 'gamma': 3.9281398742263987, 'min_child_weight': 4, 'subsample': 0.9331499791355361, 'colsample_bytree': 0.5801443252468726, 'reg_alpha': 0.8079939440939101, 'reg_lambda': 0.7342704228819346}. Best is trial 244 with value: 0.5939527867949647.
[I 2024-11-06 21:55:24,477] Trial 382 finished with value: 0.5933118713088295 and parameters: {'n_estimators': 148, 'max_depth': 7, 'learning_rate': 0.05101103080112087, 'gamma': 4.564497436469718, 'min_child_weight': 3, 'subsample': 0.8778895232131539, 'colsample_bytree': 0.5657309486543179, 'reg_alpha': 0.7143737762400786, 'reg_lambda': 0.7058880989245573}. Best is trial 244 with value: 0.5939527867949647.
[I 2024-11-06 21:55:28,950] Trial 383 finished with value: 0.5924902797931282 and parameters: {'n_estimators': 122, 'max_depth': 8, 'learning_rate': 0.04252406339306471, 'gamma': 3.6637132278487927, 'min_child_weight': 8, 'subsample': 0.8923323375171984, 'colsample_bytree': 0.6046765094770244, 'reg_alpha': 0.6000345575897713, 'reg_lambda': 0.8850024411410665}. Best is trial 244 with value: 0.5939527867949647.
[I 2024-11-06 21:55:33,720] Trial 384 finished with value: 0.5932395199225837 and parameters: {'n_estimators': 142, 'max_depth': 7, 'learning_rate': 0.028609319941295005, 'gamma': 4.732435107485707, 'min_child_weight': 6, 'subsample': 0.9247275115707508, 'colsample_bytree': 0.5417687155660537, 'reg_alpha': 0.7499078823831166, 'reg_lambda': 0.6209141410299571}. Best is trial 244 with value: 0.5939527867949647.
[I 2024-11-06 21:55:37,511] Trial 385 finished with value: 0.5934418808528025 and parameters: {'n_estimators': 129, 'max_depth': 7, 'learning_rate': 0.03881329481559756, 'gamma': 4.9989472372100545, 'min_child_weight': 7, 'subsample': 0.8641741463199722, 'colsample_bytree': 0.5207809644678316, 'reg_alpha': 0.4439939346125141, 'reg_lambda': 0.6762760190026198}. Best is trial 244 with value: 0.5939527867949647.
[I 2024-11-06 21:55:42,319] Trial 386 finished with value: 0.5934584835402636 and parameters: {'n_estimators': 152, 'max_depth': 7, 'learning_rate': 0.034107363424963566, 'gamma': 4.4542775031108395, 'min_child_weight': 5, 'subsample': 0.8721202266591497, 'colsample_bytree': 0.53133258491796, 'reg_alpha': 0.6579064448528334, 'reg_lambda': 0.7157641822462003}. Best is trial 244 with value: 0.5939527867949647.
[I 2024-11-06 21:55:47,793] Trial 387 finished with value: 0.5923851488632736 and parameters: {'n_estimators': 164, 'max_depth': 7, 'learning_rate': 0.02229518843186424, 'gamma': 3.8025506528392055, 'min_child_weight': 7, 'subsample': 0.8858206405545983, 'colsample_bytree': 0.558893144004507, 'reg_alpha': 0.7903635029323058, 'reg_lambda': 0.7482922439049668}. Best is trial 244 with value: 0.5939527867949647.
[I 2024-11-06 21:55:51,038] Trial 388 finished with value: 0.5936778609528486 and parameters: {'n_estimators': 157, 'max_depth': 7, 'learning_rate': 0.05774643686012964, 'gamma': 4.8430329236621725, 'min_child_weight': 7, 'subsample': 0.8511306834343354, 'colsample_bytree': 0.5483006708217433, 'reg_alpha': 0.532297125023184, 'reg_lambda': 0.6872777270267868}. Best is trial 244 with value: 0.5939527867949647.
[I 2024-11-06 21:55:54,550] Trial 389 finished with value: 0.5931379301456052 and parameters: {'n_estimators': 149, 'max_depth': 7, 'learning_rate': 0.0659141828491182, 'gamma': 4.89602134600269, 'min_child_weight': 7, 'subsample': 0.8513484062652478, 'colsample_bytree': 0.5489684744205342, 'reg_alpha': 0.575463778389332, 'reg_lambda': 0.6723992060518184}. Best is trial 244 with value: 0.5939527867949647.
[I 2024-11-06 21:55:58,556] Trial 390 finished with value: 0.592990547120667 and parameters: {'n_estimators': 156, 'max_depth': 7, 'learning_rate': 0.05967168886908433, 'gamma': 4.845091849451529, 'min_child_weight': 7, 'subsample': 0.8442564149931402, 'colsample_bytree': 0.5733074650741051, 'reg_alpha': 0.526011857908005, 'reg_lambda': 0.6578306905149476}. Best is trial 244 with value: 0.5939527867949647.
[I 2024-11-06 21:56:03,437] Trial 391 finished with value: 0.592948490651541 and parameters: {'n_estimators': 181, 'max_depth': 7, 'learning_rate': 0.05572454495094718, 'gamma': 4.773169311440986, 'min_child_weight': 7, 'subsample': 0.8328239068445703, 'colsample_bytree': 0.5576112581833422, 'reg_alpha': 0.5438628209013269, 'reg_lambda': 0.6921297630367813}. Best is trial 244 with value: 0.5939527867949647.
[I 2024-11-06 21:56:07,784] Trial 392 finished with value: 0.5934485712866222 and parameters: {'n_estimators': 138, 'max_depth': 7, 'learning_rate': 0.052873641598618966, 'gamma': 4.909740019847974, 'min_child_weight': 7, 'subsample': 0.8573199869507968, 'colsample_bytree': 0.5460472960492204, 'reg_alpha': 0.5577059204162793, 'reg_lambda': 0.6422356639600058}. Best is trial 244 with value: 0.5939527867949647.
[I 2024-11-06 21:56:12,637] Trial 393 finished with value: 0.5934607390663058 and parameters: {'n_estimators': 170, 'max_depth': 7, 'learning_rate': 0.049609232538353754, 'gamma': 3.977099009777574, 'min_child_weight': 7, 'subsample': 0.8637222605288678, 'colsample_bytree': 0.5920208716443592, 'reg_alpha': 0.5120137177805536, 'reg_lambda': 0.6104874712049297}. Best is trial 244 with value: 0.5939527867949647.
[I 2024-11-06 21:56:16,290] Trial 394 finished with value: 0.5927549450107785 and parameters: {'n_estimators': 144, 'max_depth': 7, 'learning_rate': 0.07101973162209836, 'gamma': 4.7843855231671615, 'min_child_weight': 7, 'subsample': 0.8072891448422972, 'colsample_bytree': 0.5665098303189089, 'reg_alpha': 0.5725621087133527, 'reg_lambda': 0.9644480883244483}. Best is trial 244 with value: 0.5939527867949647.
[I 2024-11-06 21:56:20,945] Trial 395 finished with value: 0.5930484960469247 and parameters: {'n_estimators': 159, 'max_depth': 7, 'learning_rate': 0.05863056295336626, 'gamma': 2.2923048313880967, 'min_child_weight': 8, 'subsample': 0.6750248118307374, 'colsample_bytree': 0.5830191580506168, 'reg_alpha': 0.5360508394483374, 'reg_lambda': 0.6857441280713115}. Best is trial 244 with value: 0.5939527867949647.
[I 2024-11-06 21:56:23,791] Trial 396 finished with value: 0.5908745416341123 and parameters: {'n_estimators': 153, 'max_depth': 7, 'learning_rate': 0.2886625689438729, 'gamma': 4.646962315731196, 'min_child_weight': 6, 'subsample': 0.8519401778973569, 'colsample_bytree': 0.5527445014982979, 'reg_alpha': 0.7167234483910367, 'reg_lambda': 0.6614625935885637}. Best is trial 244 with value: 0.5939527867949647.
[I 2024-11-06 21:56:28,429] Trial 397 finished with value: 0.593032339924306 and parameters: {'n_estimators': 166, 'max_depth': 7, 'learning_rate': 0.06391034019543475, 'gamma': 4.05488739693385, 'min_child_weight': 7, 'subsample': 0.8207547422009032, 'colsample_bytree': 0.5372844014319103, 'reg_alpha': 0.6810866056745385, 'reg_lambda': 0.6935723997091789}. Best is trial 244 with value: 0.5939527867949647.
[I 2024-11-06 21:56:32,468] Trial 398 finished with value: 0.5938831723985502 and parameters: {'n_estimators': 148, 'max_depth': 7, 'learning_rate': 0.04515368049459629, 'gamma': 4.8962404500267125, 'min_child_weight': 7, 'subsample': 0.8751217514761943, 'colsample_bytree': 0.5723351652971173, 'reg_alpha': 0.7358975789323531, 'reg_lambda': 0.6317785266630783}. Best is trial 244 with value: 0.5939527867949647.
[I 2024-11-06 21:56:36,635] Trial 399 finished with value: 0.5925635737736761 and parameters: {'n_estimators': 146, 'max_depth': 7, 'learning_rate': 0.04649321532056033, 'gamma': 0.9891437159615051, 'min_child_weight': 7, 'subsample': 0.8697113154055852, 'colsample_bytree': 0.5611566172054175, 'reg_alpha': 0.7385273077365623, 'reg_lambda': 0.6255583134899706}. Best is trial 244 with value: 0.5939527867949647.
[I 2024-11-06 21:56:40,210] Trial 400 finished with value: 0.5936635588032446 and parameters: {'n_estimators': 140, 'max_depth': 7, 'learning_rate': 0.05408240059574993, 'gamma': 4.9209880726392194, 'min_child_weight': 7, 'subsample': 0.8386181570169113, 'colsample_bytree': 0.5718951779875104, 'reg_alpha': 0.7721290790405371, 'reg_lambda': 0.5982818725510035}. Best is trial 244 with value: 0.5939527867949647.
[I 2024-11-06 21:56:43,870] Trial 401 finished with value: 0.5934048157271772 and parameters: {'n_estimators': 138, 'max_depth': 7, 'learning_rate': 0.053633925045392924, 'gamma': 4.994349348958485, 'min_child_weight': 7, 'subsample': 0.8438301986053625, 'colsample_bytree': 0.5471289128229696, 'reg_alpha': 0.7610599326980494, 'reg_lambda': 0.5912479767573285}. Best is trial 244 with value: 0.5939527867949647.
[I 2024-11-06 21:56:46,911] Trial 402 finished with value: 0.593479550562952 and parameters: {'n_estimators': 127, 'max_depth': 7, 'learning_rate': 0.06597850850998611, 'gamma': 4.906593304676089, 'min_child_weight': 7, 'subsample': 0.8285842295302901, 'colsample_bytree': 0.5688253847453955, 'reg_alpha': 0.8219879561647991, 'reg_lambda': 0.6327906015366346}. Best is trial 244 with value: 0.5939527867949647.
[I 2024-11-06 21:56:51,183] Trial 403 finished with value: 0.5933798029972313 and parameters: {'n_estimators': 135, 'max_depth': 7, 'learning_rate': 0.04765333034452428, 'gamma': 4.905390012831554, 'min_child_weight': 7, 'subsample': 0.838587948462124, 'colsample_bytree': 0.5566318978480276, 'reg_alpha': 0.7800628547449642, 'reg_lambda': 0.6130700630880198}. Best is trial 244 with value: 0.5939527867949647.
[I 2024-11-06 21:56:55,306] Trial 404 finished with value: 0.5927683361036802 and parameters: {'n_estimators': 140, 'max_depth': 7, 'learning_rate': 0.06132087206608928, 'gamma': 2.4462373243630573, 'min_child_weight': 7, 'subsample': 0.849615726487036, 'colsample_bytree': 0.5349797167157601, 'reg_alpha': 0.7741006799307805, 'reg_lambda': 0.6005607565363288}. Best is trial 244 with value: 0.5939527867949647.
[I 2024-11-06 21:56:59,297] Trial 405 finished with value: 0.5933909134131856 and parameters: {'n_estimators': 144, 'max_depth': 7, 'learning_rate': 0.058060639531624346, 'gamma': 4.809053164345803, 'min_child_weight': 7, 'subsample': 0.8355591054697874, 'colsample_bytree': 0.5435201901347643, 'reg_alpha': 0.46071284444611804, 'reg_lambda': 0.5971283539376973}. Best is trial 244 with value: 0.5939527867949647.
[I 2024-11-06 21:57:01,111] Trial 406 finished with value: 0.5922800757394622 and parameters: {'n_estimators': 50, 'max_depth': 7, 'learning_rate': 0.12722037011430265, 'gamma': 4.978266165970587, 'min_child_weight': 7, 'subsample': 0.8557713318234488, 'colsample_bytree': 0.5710419150960638, 'reg_alpha': 0.7956991019119996, 'reg_lambda': 0.6445715181563725}. Best is trial 244 with value: 0.5939527867949647.
[I 2024-11-06 21:57:05,201] Trial 407 finished with value: 0.5927446319568812 and parameters: {'n_estimators': 130, 'max_depth': 7, 'learning_rate': 0.05160295494523548, 'gamma': 4.848887239086215, 'min_child_weight': 7, 'subsample': 0.8562900741638834, 'colsample_bytree': 0.5534028612719872, 'reg_alpha': 0.7006668752536639, 'reg_lambda': 0.6273819017192985}. Best is trial 244 with value: 0.5939527867949647.
[I 2024-11-06 21:57:09,364] Trial 408 finished with value: 0.593641081893448 and parameters: {'n_estimators': 148, 'max_depth': 7, 'learning_rate': 0.045811350986970145, 'gamma': 4.811115324499742, 'min_child_weight': 7, 'subsample': 0.8437930831862421, 'colsample_bytree': 0.562137254196176, 'reg_alpha': 0.7537502785854395, 'reg_lambda': 0.6481877473925901}. Best is trial 244 with value: 0.5939527867949647.
[I 2024-11-06 21:57:13,789] Trial 409 finished with value: 0.593197873512818 and parameters: {'n_estimators': 148, 'max_depth': 7, 'learning_rate': 0.04543455536182368, 'gamma': 4.82900282426526, 'min_child_weight': 7, 'subsample': 0.833748614895618, 'colsample_bytree': 0.5659322301151314, 'reg_alpha': 0.7706689640103527, 'reg_lambda': 0.6623744195482846}. Best is trial 244 with value: 0.5939527867949647.
[I 2024-11-06 21:57:17,603] Trial 410 finished with value: 0.5929754067300136 and parameters: {'n_estimators': 142, 'max_depth': 7, 'learning_rate': 0.05519897698188675, 'gamma': 4.769008482690459, 'min_child_weight': 8, 'subsample': 0.825159139062384, 'colsample_bytree': 0.5758907149018222, 'reg_alpha': 0.8082606295099951, 'reg_lambda': 0.6446588631958777}. Best is trial 244 with value: 0.5939527867949647.
[I 2024-11-06 21:57:22,144] Trial 411 finished with value: 0.5934121635339101 and parameters: {'n_estimators': 149, 'max_depth': 7, 'learning_rate': 0.04636220504713698, 'gamma': 4.912575138146086, 'min_child_weight': 7, 'subsample': 0.8447050049259248, 'colsample_bytree': 0.5615458713914588, 'reg_alpha': 0.8408820700549282, 'reg_lambda': 0.5743036620980458}. Best is trial 244 with value: 0.5939527867949647.
[I 2024-11-06 21:57:25,883] Trial 412 finished with value: 0.5933784957652317 and parameters: {'n_estimators': 136, 'max_depth': 7, 'learning_rate': 0.05121602787217386, 'gamma': 4.709402199054433, 'min_child_weight': 7, 'subsample': 0.8438201917131725, 'colsample_bytree': 0.5572224026735658, 'reg_alpha': 0.7240219944283228, 'reg_lambda': 0.6138676816625837}. Best is trial 244 with value: 0.5939527867949647.
[I 2024-11-06 21:57:30,375] Trial 413 finished with value: 0.593394556442149 and parameters: {'n_estimators': 152, 'max_depth': 7, 'learning_rate': 0.0429146381320739, 'gamma': 4.989870994735425, 'min_child_weight': 7, 'subsample': 0.8620192284828454, 'colsample_bytree': 0.5754740449487368, 'reg_alpha': 0.40161576252163717, 'reg_lambda': 0.6470381534350687}. Best is trial 244 with value: 0.5939527867949647.
[I 2024-11-06 21:57:34,212] Trial 414 finished with value: 0.5930557064419368 and parameters: {'n_estimators': 141, 'max_depth': 7, 'learning_rate': 0.053960976021200514, 'gamma': 4.828590044019081, 'min_child_weight': 7, 'subsample': 0.8125434518621829, 'colsample_bytree': 0.5493461363297281, 'reg_alpha': 0.5538651868284693, 'reg_lambda': 0.5533104632521723}. Best is trial 244 with value: 0.5939527867949647.
[I 2024-11-06 21:57:38,462] Trial 415 finished with value: 0.5930699315904685 and parameters: {'n_estimators': 145, 'max_depth': 7, 'learning_rate': 0.04240518947792778, 'gamma': 4.88410245917638, 'min_child_weight': 6, 'subsample': 0.8188814550835565, 'colsample_bytree': 0.5647981275174636, 'reg_alpha': 0.5240405127281177, 'reg_lambda': 0.6685057432460374}. Best is trial 244 with value: 0.5939527867949647.
[I 2024-11-06 21:57:42,122] Trial 416 finished with value: 0.5932664590332045 and parameters: {'n_estimators': 133, 'max_depth': 7, 'learning_rate': 0.06012646551143354, 'gamma': 4.676719960569937, 'min_child_weight': 7, 'subsample': 0.7048972521744723, 'colsample_bytree': 0.5836172929175446, 'reg_alpha': 0.7583929780749156, 'reg_lambda': 0.5965642380405473}. Best is trial 244 with value: 0.5939527867949647.
[I 2024-11-06 21:57:45,308] Trial 417 finished with value: 0.5925712743816474 and parameters: {'n_estimators': 151, 'max_depth': 7, 'learning_rate': 0.07413474611917911, 'gamma': 4.730676127149976, 'min_child_weight': 7, 'subsample': 0.8407178200303309, 'colsample_bytree': 0.664668268146979, 'reg_alpha': 0.785476696981589, 'reg_lambda': 0.6253222191004353}. Best is trial 244 with value: 0.5939527867949647.
