[I 2024-11-06 20:03:27,377] Trial 817 finished with value: 0.5944283946020199 and parameters: {'C': 0.7847640027352223, 'solver': 'liblinear'}. Best is trial 236 with value: 0.5945206794543682.
[I 2024-11-06 20:03:28,889] Trial 818 finished with value: 0.5941333853232755 and parameters: {'C': 0.14530044283068716, 'solver': 'liblinear'}. Best is trial 236 with value: 0.5945206794543682.
[I 2024-11-06 20:03:30,574] Trial 819 finished with value: 0.5944840977210006 and parameters: {'C': 0.373883471419645, 'solver': 'liblinear'}. Best is trial 236 with value: 0.5945206794543682.
[I 2024-11-06 20:03:32,317] Trial 820 finished with value: 0.5944564825190385 and parameters: {'C': 0.5912617873512246, 'solver': 'liblinear'}. Best is trial 236 with value: 0.5945206794543682.
[I 2024-11-06 20:03:33,843] Trial 821 finished with value: 0.5943550128177442 and parameters: {'C': 0.29544629784973775, 'solver': 'liblinear'}. Best is trial 236 with value: 0.5945206794543682.
[I 2024-11-06 20:03:35,107] Trial 822 finished with value: 0.5942882241802465 and parameters: {'C': 1.077134381443855, 'solver': 'lbfgs'}. Best is trial 236 with value: 0.5945206794543682.
[I 2024-11-06 20:03:36,866] Trial 823 finished with value: 0.5943853074808157 and parameters: {'C': 9.063787670670074, 'solver': 'liblinear'}. Best is trial 236 with value: 0.5945206794543682.
[I 2024-11-06 20:03:38,762] Trial 824 finished with value: 0.5944524591081727 and parameters: {'C': 0.5341181550565162, 'solver': 'liblinear'}. Best is trial 236 with value: 0.5945206794543682.
[I 2024-11-06 20:03:40,186] Trial 825 finished with value: 0.588269149522545 and parameters: {'C': 0.005273063604500139, 'solver': 'liblinear'}. Best is trial 236 with value: 0.5945206794543682.
[I 2024-11-06 20:03:42,137] Trial 826 finished with value: 0.5944480137801269 and parameters: {'C': 0.7861811650725123, 'solver': 'liblinear'}. Best is trial 236 with value: 0.5945206794543682.
[I 2024-11-06 20:03:43,966] Trial 827 finished with value: 0.5944996217185112 and parameters: {'C': 0.3888399251021136, 'solver': 'liblinear'}. Best is trial 236 with value: 0.5945206794543682.
[I 2024-11-06 20:03:45,570] Trial 828 finished with value: 0.5941614872224484 and parameters: {'C': 0.17374911448281824, 'solver': 'liblinear'}. Best is trial 236 with value: 0.5945206794543682.
[I 2024-11-06 20:03:47,394] Trial 829 finished with value: 0.5944368942992051 and parameters: {'C': 0.6239574856317475, 'solver': 'liblinear'}. Best is trial 236 with value: 0.5945206794543682.
[I 2024-11-06 20:03:49,256] Trial 830 finished with value: 0.594400328171304 and parameters: {'C': 1.1999429995235151, 'solver': 'liblinear'}. Best is trial 236 with value: 0.5945206794543682.
[I 2024-11-06 20:03:51,119] Trial 831 finished with value: 0.594400523374502 and parameters: {'C': 0.8947564381896344, 'solver': 'liblinear'}. Best is trial 236 with value: 0.5945206794543682.
[I 2024-11-06 20:03:52,837] Trial 832 finished with value: 0.5944629786163811 and parameters: {'C': 0.3462675944218937, 'solver': 'liblinear'}. Best is trial 236 with value: 0.5945206794543682.
[I 2024-11-06 20:03:54,688] Trial 833 finished with value: 0.5944581611204107 and parameters: {'C': 0.5135279974622436, 'solver': 'liblinear'}. Best is trial 236 with value: 0.5945206794543682.
[I 2024-11-06 20:03:56,381] Trial 834 finished with value: 0.5941614872224484 and parameters: {'C': 0.17181345391097172, 'solver': 'liblinear'}. Best is trial 236 with value: 0.5945206794543682.
[I 2024-11-06 20:03:58,442] Trial 835 finished with value: 0.5944438545384958 and parameters: {'C': 0.7523567414481045, 'solver': 'liblinear'}. Best is trial 236 with value: 0.5945206794543682.
[I 2024-11-06 20:04:00,180] Trial 836 finished with value: 0.594458151416214 and parameters: {'C': 0.48993494489506156, 'solver': 'liblinear'}. Best is trial 236 with value: 0.5945206794543682.
[I 2024-11-06 20:04:01,817] Trial 837 finished with value: 0.5944531849151042 and parameters: {'C': 0.33111840859704633, 'solver': 'liblinear'}. Best is trial 236 with value: 0.5945206794543682.
[I 2024-11-06 20:04:03,954] Trial 838 finished with value: 0.5944424619582916 and parameters: {'C': 0.6333160985957011, 'solver': 'liblinear'}. Best is trial 236 with value: 0.5945206794543682.
[I 2024-11-06 20:04:05,800] Trial 839 finished with value: 0.5941296159916997 and parameters: {'C': 0.18522085694161153, 'solver': 'liblinear'}. Best is trial 236 with value: 0.5945206794543682.
[I 2024-11-06 20:04:07,560] Trial 840 finished with value: 0.5945165657501879 and parameters: {'C': 0.4342419416389578, 'solver': 'liblinear'}. Best is trial 236 with value: 0.5945206794543682.
[I 2024-11-06 20:04:08,823] Trial 841 finished with value: 0.5944585033891963 and parameters: {'C': 0.9306320689164967, 'solver': 'lbfgs'}. Best is trial 236 with value: 0.5945206794543682.
[I 2024-11-06 20:04:10,637] Trial 842 finished with value: 0.5944465036747404 and parameters: {'C': 0.7107044878831158, 'solver': 'liblinear'}. Best is trial 236 with value: 0.5945206794543682.
[I 2024-11-06 20:04:12,171] Trial 843 finished with value: 0.5941475919992161 and parameters: {'C': 0.16011409129232373, 'solver': 'liblinear'}. Best is trial 236 with value: 0.5945206794543682.
[I 2024-11-06 20:04:13,941] Trial 844 finished with value: 0.5944664660859237 and parameters: {'C': 0.5021539101408327, 'solver': 'liblinear'}. Best is trial 236 with value: 0.5945206794543682.
[I 2024-11-06 20:04:15,445] Trial 845 finished with value: 0.5943018131007919 and parameters: {'C': 0.28061901902839925, 'solver': 'liblinear'}. Best is trial 236 with value: 0.5945206794543682.
[I 2024-11-06 20:04:16,769] Trial 846 finished with value: 0.5877978598475229 and parameters: {'C': 0.004682533456209059, 'solver': 'liblinear'}. Best is trial 236 with value: 0.5945206794543682.
[I 2024-11-06 20:04:18,598] Trial 847 finished with value: 0.5944507362778312 and parameters: {'C': 0.6644646572393095, 'solver': 'liblinear'}. Best is trial 236 with value: 0.5945206794543682.
[I 2024-11-06 20:04:20,323] Trial 848 finished with value: 0.594506685611659 and parameters: {'C': 0.4011595166268239, 'solver': 'liblinear'}. Best is trial 236 with value: 0.5945206794543682.
[I 2024-11-06 20:04:22,259] Trial 849 finished with value: 0.5943947796287112 and parameters: {'C': 1.0268997151715606, 'solver': 'liblinear'}. Best is trial 236 with value: 0.5945206794543682.
[I 2024-11-06 20:04:24,192] Trial 850 finished with value: 0.5944719394321811 and parameters: {'C': 0.5706777578102403, 'solver': 'liblinear'}. Best is trial 236 with value: 0.5945206794543682.
[I 2024-11-06 20:04:26,239] Trial 851 finished with value: 0.5944340458365576 and parameters: {'C': 0.8205313908637167, 'solver': 'liblinear'}. Best is trial 236 with value: 0.5945206794543682.
[I 2024-11-06 20:04:27,980] Trial 852 finished with value: 0.5944433941781605 and parameters: {'C': 0.33227502705435336, 'solver': 'liblinear'}. Best is trial 236 with value: 0.5945206794543682.
[I 2024-11-06 20:04:29,581] Trial 853 finished with value: 0.5941614872224484 and parameters: {'C': 0.17030887409219814, 'solver': 'liblinear'}. Best is trial 236 with value: 0.5945206794543682.
[I 2024-11-06 20:04:31,279] Trial 854 finished with value: 0.5944524591081727 and parameters: {'C': 0.5264808954354865, 'solver': 'liblinear'}. Best is trial 236 with value: 0.5945206794543682.
[I 2024-11-06 20:04:33,196] Trial 855 finished with value: 0.5944465341390418 and parameters: {'C': 0.6866822466166935, 'solver': 'liblinear'}. Best is trial 236 with value: 0.5945206794543682.
[I 2024-11-06 20:04:34,521] Trial 856 finished with value: 0.5902144531466469 and parameters: {'C': 0.008810780145447061, 'solver': 'liblinear'}. Best is trial 236 with value: 0.5945206794543682.
[I 2024-11-06 20:04:36,244] Trial 857 finished with value: 0.5944629786163811 and parameters: {'C': 0.3463900548382426, 'solver': 'liblinear'}. Best is trial 236 with value: 0.5945206794543682.
[I 2024-11-06 20:04:38,120] Trial 858 finished with value: 0.594458151416214 and parameters: {'C': 0.48137788716154023, 'solver': 'liblinear'}. Best is trial 236 with value: 0.5945206794543682.
[I 2024-11-06 20:04:39,737] Trial 859 finished with value: 0.5942600051953528 and parameters: {'C': 0.2528512135445782, 'solver': 'liblinear'}. Best is trial 236 with value: 0.5945206794543682.
[I 2024-11-06 20:04:41,713] Trial 860 finished with value: 0.5944479887832321 and parameters: {'C': 0.7606662320802786, 'solver': 'liblinear'}. Best is trial 236 with value: 0.5945206794543682.
[I 2024-11-06 20:04:43,104] Trial 861 finished with value: 0.5941077753423228 and parameters: {'C': 0.46229041047669567, 'solver': 'lbfgs'}. Best is trial 236 with value: 0.5945206794543682.
[I 2024-11-06 20:04:44,782] Trial 862 finished with value: 0.5943977600835995 and parameters: {'C': 4.426819129323733, 'solver': 'liblinear'}. Best is trial 236 with value: 0.5945206794543682.
[I 2024-11-06 20:04:46,611] Trial 863 finished with value: 0.5943848993387026 and parameters: {'C': 0.9908375564143146, 'solver': 'liblinear'}. Best is trial 236 with value: 0.5945206794543682.
[I 2024-11-06 20:04:48,281] Trial 864 finished with value: 0.5941613849819449 and parameters: {'C': 0.1663669971998446, 'solver': 'liblinear'}. Best is trial 236 with value: 0.5945206794543682.
[I 2024-11-06 20:04:50,095] Trial 865 finished with value: 0.5944465743982909 and parameters: {'C': 0.6368120737397927, 'solver': 'liblinear'}. Best is trial 236 with value: 0.5945206794543682.
[I 2024-11-06 20:04:51,758] Trial 866 finished with value: 0.5944418926928379 and parameters: {'C': 0.3190985281053653, 'solver': 'liblinear'}. Best is trial 236 with value: 0.5945206794543682.
[I 2024-11-06 20:04:53,704] Trial 867 finished with value: 0.5944341071243737 and parameters: {'C': 0.7466828134053324, 'solver': 'liblinear'}. Best is trial 236 with value: 0.5945206794543682.
[I 2024-11-06 20:04:55,755] Trial 868 finished with value: 0.594458151416214 and parameters: {'C': 0.48973430709806026, 'solver': 'liblinear'}. Best is trial 236 with value: 0.5945206794543682.
[I 2024-11-06 20:04:57,235] Trial 869 finished with value: 0.5907921444119847 and parameters: {'C': 0.010798276785608574, 'solver': 'liblinear'}. Best is trial 236 with value: 0.5945206794543682.
[I 2024-11-06 20:04:58,913] Trial 870 finished with value: 0.5944335599525086 and parameters: {'C': 0.3256837614093446, 'solver': 'liblinear'}. Best is trial 236 with value: 0.5945206794543682.
[I 2024-11-06 20:05:00,646] Trial 871 finished with value: 0.594400523374502 and parameters: {'C': 0.8879776927935659, 'solver': 'liblinear'}. Best is trial 236 with value: 0.5945206794543682.
[I 2024-11-06 20:05:02,464] Trial 872 finished with value: 0.5944564825190385 and parameters: {'C': 0.5926241481437254, 'solver': 'liblinear'}. Best is trial 236 with value: 0.5945206794543682.
[I 2024-11-06 20:05:04,298] Trial 873 finished with value: 0.594400328171304 and parameters: {'C': 1.162958188582265, 'solver': 'liblinear'}. Best is trial 236 with value: 0.5945206794543682.
[I 2024-11-06 20:05:05,962] Trial 874 finished with value: 0.5941435245933754 and parameters: {'C': 0.1831289062957795, 'solver': 'liblinear'}. Best is trial 236 with value: 0.5945206794543682.
[I 2024-11-06 20:05:07,722] Trial 875 finished with value: 0.5944840977210006 and parameters: {'C': 0.3731896095132424, 'solver': 'liblinear'}. Best is trial 236 with value: 0.5945206794543682.
[I 2024-11-06 20:05:09,511] Trial 876 finished with value: 0.5944229713756195 and parameters: {'C': 0.6095265963962061, 'solver': 'liblinear'}. Best is trial 236 with value: 0.5945206794543682.
[I 2024-11-06 20:05:11,358] Trial 877 finished with value: 0.594161515627971 and parameters: {'C': 0.17510060422051232, 'solver': 'liblinear'}. Best is trial 236 with value: 0.5945206794543682.
[I 2024-11-06 20:05:13,140] Trial 878 finished with value: 0.5944075915572162 and parameters: {'C': 3.6326639623697625, 'solver': 'liblinear'}. Best is trial 236 with value: 0.5945206794543682.
[I 2024-11-06 20:05:14,917] Trial 879 finished with value: 0.5944381827960278 and parameters: {'C': 0.7797373365107878, 'solver': 'liblinear'}. Best is trial 236 with value: 0.5945206794543682.
[I 2024-11-06 20:05:16,659] Trial 880 finished with value: 0.5944746354238873 and parameters: {'C': 0.45080955146839763, 'solver': 'liblinear'}. Best is trial 236 with value: 0.5945206794543682.
[I 2024-11-06 20:05:17,895] Trial 881 finished with value: 0.569353200539957 and parameters: {'C': 0.0010770945436560098, 'solver': 'liblinear'}. Best is trial 236 with value: 0.5945206794543682.
[I 2024-11-06 20:05:19,290] Trial 882 finished with value: 0.5942967916719318 and parameters: {'C': 5.471747277867439, 'solver': 'lbfgs'}. Best is trial 236 with value: 0.5945206794543682.
[I 2024-11-06 20:05:20,842] Trial 883 finished with value: 0.5943648779104642 and parameters: {'C': 0.2972398869774438, 'solver': 'liblinear'}. Best is trial 236 with value: 0.5945206794543682.
[I 2024-11-06 20:05:22,641] Trial 884 finished with value: 0.5944719394321811 and parameters: {'C': 0.5625802105875062, 'solver': 'liblinear'}. Best is trial 236 with value: 0.5945206794543682.
[I 2024-11-06 20:05:24,570] Trial 885 finished with value: 0.594400523374502 and parameters: {'C': 0.8876653189890209, 'solver': 'liblinear'}. Best is trial 236 with value: 0.5945206794543682.
[I 2024-11-06 20:05:26,274] Trial 886 finished with value: 0.5944784820183935 and parameters: {'C': 0.36066265523602764, 'solver': 'liblinear'}. Best is trial 236 with value: 0.5945206794543682.
[I 2024-11-06 20:05:28,038] Trial 887 finished with value: 0.5944382411743031 and parameters: {'C': 0.6824034407981533, 'solver': 'liblinear'}. Best is trial 236 with value: 0.5945206794543682.
[I 2024-11-06 20:05:29,715] Trial 888 finished with value: 0.5944033476557997 and parameters: {'C': 6.195259225003769, 'solver': 'liblinear'}. Best is trial 236 with value: 0.5945206794543682.
[I 2024-11-06 20:05:31,369] Trial 889 finished with value: 0.5941941592929504 and parameters: {'C': 0.19514782730647293, 'solver': 'liblinear'}. Best is trial 236 with value: 0.5945206794543682.
[I 2024-11-06 20:05:33,091] Trial 890 finished with value: 0.594458151416214 and parameters: {'C': 0.4836976812501964, 'solver': 'liblinear'}. Best is trial 236 with value: 0.5945206794543682.
[I 2024-11-06 20:05:34,995] Trial 891 finished with value: 0.5944507362778312 and parameters: {'C': 0.663525181302242, 'solver': 'liblinear'}. Best is trial 236 with value: 0.5945206794543682.
[I 2024-11-06 20:05:36,866] Trial 892 finished with value: 0.5944165760213188 and parameters: {'C': 0.3104684263778281, 'solver': 'liblinear'}. Best is trial 236 with value: 0.5945206794543682.
[I 2024-11-06 20:05:38,853] Trial 893 finished with value: 0.594458151416214 and parameters: {'C': 0.4786511003124514, 'solver': 'liblinear'}. Best is trial 236 with value: 0.5945206794543682.
[I 2024-11-06 20:05:40,887] Trial 894 finished with value: 0.5943849397349453 and parameters: {'C': 0.9526685466912962, 'solver': 'liblinear'}. Best is trial 236 with value: 0.5945206794543682.
[I 2024-11-06 20:05:42,564] Trial 895 finished with value: 0.594230791861874 and parameters: {'C': 0.23853337715396913, 'solver': 'liblinear'}. Best is trial 236 with value: 0.5945206794543682.
[I 2024-11-06 20:05:44,424] Trial 896 finished with value: 0.5944480137801269 and parameters: {'C': 0.788225065444063, 'solver': 'liblinear'}. Best is trial 236 with value: 0.5945206794543682.
[I 2024-11-06 20:05:45,443] Trial 897 finished with value: 0.5232521014845893 and parameters: {'C': 0.00036729123501888505, 'solver': 'liblinear'}. Best is trial 236 with value: 0.5945206794543682.
[I 2024-11-06 20:05:47,265] Trial 898 finished with value: 0.5944622851684469 and parameters: {'C': 0.49983658128187763, 'solver': 'liblinear'}. Best is trial 236 with value: 0.5945206794543682.
[I 2024-11-06 20:05:48,918] Trial 899 finished with value: 0.5944264109351601 and parameters: {'C': 0.3148853066285492, 'solver': 'liblinear'}. Best is trial 236 with value: 0.5945206794543682.
[I 2024-11-06 20:05:50,763] Trial 900 finished with value: 0.594400328171304 and parameters: {'C': 1.2114619119782604, 'solver': 'liblinear'}. Best is trial 236 with value: 0.5945206794543682.
[I 2024-11-06 20:05:52,594] Trial 901 finished with value: 0.5944229713756195 and parameters: {'C': 0.6155219455772568, 'solver': 'liblinear'}. Best is trial 236 with value: 0.5945206794543682.
[I 2024-11-06 20:05:54,359] Trial 902 finished with value: 0.5944033476557997 and parameters: {'C': 6.621286122378749, 'solver': 'liblinear'}. Best is trial 236 with value: 0.5945206794543682.
[I 2024-11-06 20:05:55,641] Trial 903 finished with value: 0.5941928115233667 and parameters: {'C': 8.399556623053513, 'solver': 'lbfgs'}. Best is trial 236 with value: 0.5945206794543682.
[I 2024-11-06 20:05:57,358] Trial 904 finished with value: 0.5941434756212238 and parameters: {'C': 0.15701392603270375, 'solver': 'liblinear'}. Best is trial 236 with value: 0.5945206794543682.
[I 2024-11-06 20:05:59,196] Trial 905 finished with value: 0.5944829311442884 and parameters: {'C': 0.4475432767730275, 'solver': 'liblinear'}. Best is trial 236 with value: 0.5945206794543682.
[I 2024-11-06 20:06:01,128] Trial 906 finished with value: 0.5944382255861191 and parameters: {'C': 0.7966930806319357, 'solver': 'liblinear'}. Best is trial 236 with value: 0.5945206794543682.
[I 2024-11-06 20:06:02,977] Trial 907 finished with value: 0.5944368725971654 and parameters: {'C': 0.602429851426802, 'solver': 'liblinear'}. Best is trial 236 with value: 0.5945206794543682.
[I 2024-11-06 20:06:04,825] Trial 908 finished with value: 0.5942292030490468 and parameters: {'C': 0.22397918269933342, 'solver': 'liblinear'}. Best is trial 236 with value: 0.5945206794543682.
[I 2024-11-06 20:06:06,692] Trial 909 finished with value: 0.594506685611659 and parameters: {'C': 0.39866335386688206, 'solver': 'liblinear'}. Best is trial 236 with value: 0.5945206794543682.
[I 2024-11-06 20:06:08,673] Trial 910 finished with value: 0.5944200192689717 and parameters: {'C': 0.8508762434290391, 'solver': 'liblinear'}. Best is trial 236 with value: 0.5945206794543682.
[I 2024-11-06 20:06:10,636] Trial 911 finished with value: 0.5944368725971654 and parameters: {'C': 0.6039341902918101, 'solver': 'liblinear'}. Best is trial 236 with value: 0.5945206794543682.
[I 2024-11-06 20:06:12,709] Trial 912 finished with value: 0.5944045676268799 and parameters: {'C': 1.074500376834856, 'solver': 'liblinear'}. Best is trial 236 with value: 0.5945206794543682.
[I 2024-11-06 20:06:14,403] Trial 913 finished with value: 0.5944075915572162 and parameters: {'C': 3.908332377004972, 'solver': 'liblinear'}. Best is trial 236 with value: 0.5945206794543682.
[I 2024-11-06 20:06:16,137] Trial 914 finished with value: 0.5944033476557997 and parameters: {'C': 7.446031352036888, 'solver': 'liblinear'}. Best is trial 236 with value: 0.5945206794543682.
[I 2024-11-06 20:06:17,809] Trial 915 finished with value: 0.5941419704378671 and parameters: {'C': 0.18058813664115647, 'solver': 'liblinear'}. Best is trial 236 with value: 0.5945206794543682.
[I 2024-11-06 20:06:19,631] Trial 916 finished with value: 0.5945206794543682 and parameters: {'C': 0.4157413458427999, 'solver': 'liblinear'}. Best is trial 236 with value: 0.5945206794543682.
[I 2024-11-06 20:06:21,537] Trial 917 finished with value: 0.5944264109351601 and parameters: {'C': 0.3151557776165004, 'solver': 'liblinear'}. Best is trial 236 with value: 0.5945206794543682.
[I 2024-11-06 20:06:23,501] Trial 918 finished with value: 0.5944623222192947 and parameters: {'C': 0.5228446504676607, 'solver': 'liblinear'}. Best is trial 236 with value: 0.5945206794543682.
[I 2024-11-06 20:06:25,171] Trial 919 finished with value: 0.5941137454947647 and parameters: {'C': 0.13985069619634982, 'solver': 'liblinear'}. Best is trial 236 with value: 0.5945206794543682.
[I 2024-11-06 20:06:26,966] Trial 920 finished with value: 0.5944075090458225 and parameters: {'C': 2.37722148970681, 'solver': 'liblinear'}. Best is trial 236 with value: 0.5945206794543682.
[I 2024-11-06 20:06:28,871] Trial 921 finished with value: 0.5944465036747404 and parameters: {'C': 0.7139861596027857, 'solver': 'liblinear'}. Best is trial 236 with value: 0.5945206794543682.
[I 2024-11-06 20:06:30,666] Trial 922 finished with value: 0.5945037726748497 and parameters: {'C': 0.38358679427861525, 'solver': 'liblinear'}. Best is trial 236 with value: 0.5945206794543682.
[I 2024-11-06 20:06:32,108] Trial 923 finished with value: 0.5911021227458673 and parameters: {'C': 0.011646369083012253, 'solver': 'liblinear'}. Best is trial 236 with value: 0.5945206794543682.
[I 2024-11-06 20:06:33,886] Trial 924 finished with value: 0.5943853074808157 and parameters: {'C': 9.670706935328218, 'solver': 'liblinear'}. Best is trial 236 with value: 0.5945206794543682.
[I 2024-11-06 20:06:35,422] Trial 925 finished with value: 0.5943182839290928 and parameters: {'C': 4.879279981643396, 'solver': 'lbfgs'}. Best is trial 236 with value: 0.5945206794543682.
[I 2024-11-06 20:06:37,319] Trial 926 finished with value: 0.5945025209280864 and parameters: {'C': 0.4392025367027077, 'solver': 'liblinear'}. Best is trial 236 with value: 0.5945206794543682.
[I 2024-11-06 20:06:39,016] Trial 927 finished with value: 0.5943808274095643 and parameters: {'C': 0.9068103801312395, 'solver': 'liblinear'}. Best is trial 236 with value: 0.5945206794543682.
[I 2024-11-06 20:06:40,762] Trial 928 finished with value: 0.5944507362778312 and parameters: {'C': 0.6699483495454353, 'solver': 'liblinear'}. Best is trial 236 with value: 0.5945206794543682.
[I 2024-11-06 20:06:42,245] Trial 929 finished with value: 0.5943312140629275 and parameters: {'C': 0.2820613756354752, 'solver': 'liblinear'}. Best is trial 236 with value: 0.5945206794543682.
