[I 2024-11-06 21:45:51,148] Trial 259 finished with value: 0.593619944760196 and parameters: {'n_estimators': 157, 'max_depth': 7, 'learning_rate': 0.04426450840261868, 'gamma': 4.816366433481611, 'min_child_weight': 7, 'subsample': 0.8849090466335203, 'colsample_bytree': 0.5672531955865424, 'reg_alpha': 0.8237160965668795, 'reg_lambda': 0.6716413677571312}. Best is trial 244 with value: 0.5939527867949647.
[I 2024-11-06 21:45:55,718] Trial 260 finished with value: 0.5925444189181097 and parameters: {'n_estimators': 158, 'max_depth': 7, 'learning_rate': 0.04274682280030674, 'gamma': 4.416097053860348, 'min_child_weight': 7, 'subsample': 0.8863291451964626, 'colsample_bytree': 0.9860605494633659, 'reg_alpha': 0.8294181896998749, 'reg_lambda': 0.6764467866777223}. Best is trial 244 with value: 0.5939527867949647.
[I 2024-11-06 21:46:02,149] Trial 261 finished with value: 0.5920590058066604 and parameters: {'n_estimators': 171, 'max_depth': 7, 'learning_rate': 0.03005766471033571, 'gamma': 0.4330846650095914, 'min_child_weight': 7, 'subsample': 0.8545303268882387, 'colsample_bytree': 0.5625859238268536, 'reg_alpha': 0.6742067617229479, 'reg_lambda': 0.6633942741318475}. Best is trial 244 with value: 0.5939527867949647.
[I 2024-11-06 21:46:07,373] Trial 262 finished with value: 0.593303656600032 and parameters: {'n_estimators': 162, 'max_depth': 7, 'learning_rate': 0.03669579807729785, 'gamma': 4.352107588953875, 'min_child_weight': 7, 'subsample': 0.9005990047508743, 'colsample_bytree': 0.5325321716802504, 'reg_alpha': 0.818157185374086, 'reg_lambda': 0.6385875269903039}. Best is trial 244 with value: 0.5939527867949647.
[I 2024-11-06 21:46:14,770] Trial 263 finished with value: 0.5933919303164943 and parameters: {'n_estimators': 297, 'max_depth': 7, 'learning_rate': 0.025565105804652433, 'gamma': 4.657685175435679, 'min_child_weight': 7, 'subsample': 0.874459857371677, 'colsample_bytree': 0.5462977071359101, 'reg_alpha': 0.6984522489712804, 'reg_lambda': 0.7016806080385778}. Best is trial 244 with value: 0.5939527867949647.
[I 2024-11-06 21:46:17,536] Trial 264 finished with value: 0.5928289002654751 and parameters: {'n_estimators': 156, 'max_depth': 7, 'learning_rate': 0.1824046251988021, 'gamma': 4.799531742792229, 'min_child_weight': 5, 'subsample': 0.8680304503791928, 'colsample_bytree': 0.5670921069740357, 'reg_alpha': 0.7294806159263519, 'reg_lambda': 0.6361001755478494}. Best is trial 244 with value: 0.5939527867949647.
[I 2024-11-06 21:46:21,214] Trial 265 finished with value: 0.593880717653597 and parameters: {'n_estimators': 150, 'max_depth': 7, 'learning_rate': 0.04569532692967232, 'gamma': 4.994698753149209, 'min_child_weight': 7, 'subsample': 0.8882220072144467, 'colsample_bytree': 0.5274268196552986, 'reg_alpha': 0.7688308384412563, 'reg_lambda': 0.6904237276480757}. Best is trial 244 with value: 0.5939527867949647.
[I 2024-11-06 21:46:25,533] Trial 266 finished with value: 0.5928722886480052 and parameters: {'n_estimators': 167, 'max_depth': 7, 'learning_rate': 0.044207009088382244, 'gamma': 4.907270578047232, 'min_child_weight': 7, 'subsample': 0.8841297832299944, 'colsample_bytree': 0.5568253472010156, 'reg_alpha': 0.762973423856015, 'reg_lambda': 0.6949529513244984}. Best is trial 244 with value: 0.5939527867949647.
[I 2024-11-06 21:46:29,856] Trial 267 finished with value: 0.5930157546384162 and parameters: {'n_estimators': 154, 'max_depth': 7, 'learning_rate': 0.036425152250470307, 'gamma': 4.8202163663178785, 'min_child_weight': 7, 'subsample': 0.9018065514356421, 'colsample_bytree': 0.5210761648079842, 'reg_alpha': 0.7482722026359759, 'reg_lambda': 0.6814412010293269}. Best is trial 244 with value: 0.5939527867949647.
[I 2024-11-06 21:46:35,068] Trial 268 finished with value: 0.5934249516996722 and parameters: {'n_estimators': 161, 'max_depth': 7, 'learning_rate': 0.020384593439832562, 'gamma': 4.917377264673446, 'min_child_weight': 6, 'subsample': 0.8884123514234991, 'colsample_bytree': 0.5817970179962598, 'reg_alpha': 0.7731159660443295, 'reg_lambda': 0.9649889489279792}. Best is trial 244 with value: 0.5939527867949647.
[I 2024-11-06 21:46:39,974] Trial 269 finished with value: 0.5931268969878903 and parameters: {'n_estimators': 149, 'max_depth': 7, 'learning_rate': 0.031245187460214124, 'gamma': 4.984313196976351, 'min_child_weight': 7, 'subsample': 0.8593349262589336, 'colsample_bytree': 0.6133559625670189, 'reg_alpha': 0.8458515517140988, 'reg_lambda': 0.711730914135057}. Best is trial 244 with value: 0.5939527867949647.
[I 2024-11-06 21:46:44,225] Trial 270 finished with value: 0.5926161163364194 and parameters: {'n_estimators': 158, 'max_depth': 7, 'learning_rate': 0.039874515702569606, 'gamma': 4.689011578713924, 'min_child_weight': 7, 'subsample': 0.9065847751395648, 'colsample_bytree': 0.7632819630203089, 'reg_alpha': 0.7242038726796658, 'reg_lambda': 0.6698212460822313}. Best is trial 244 with value: 0.5939527867949647.
[I 2024-11-06 21:46:48,285] Trial 271 finished with value: 0.5930800213095759 and parameters: {'n_estimators': 165, 'max_depth': 7, 'learning_rate': 0.04550912781365181, 'gamma': 4.993357863898101, 'min_child_weight': 7, 'subsample': 0.8916726458077842, 'colsample_bytree': 0.5399198762999778, 'reg_alpha': 0.6892158243652254, 'reg_lambda': 0.6921237068074183}. Best is trial 244 with value: 0.5939527867949647.
[I 2024-11-06 21:46:52,834] Trial 272 finished with value: 0.5932079537928192 and parameters: {'n_estimators': 138, 'max_depth': 7, 'learning_rate': 0.03431254285005024, 'gamma': 4.513195233510206, 'min_child_weight': 7, 'subsample': 0.8502977828900983, 'colsample_bytree': 0.5684106574687987, 'reg_alpha': 0.7862040091734926, 'reg_lambda': 0.730538036618815}. Best is trial 244 with value: 0.5939527867949647.
[I 2024-11-06 21:46:57,931] Trial 273 finished with value: 0.5925581724081902 and parameters: {'n_estimators': 171, 'max_depth': 7, 'learning_rate': 0.03001709768822945, 'gamma': 4.828195947886899, 'min_child_weight': 7, 'subsample': 0.8354476902712069, 'colsample_bytree': 0.5972818145825812, 'reg_alpha': 0.6560354392341404, 'reg_lambda': 0.6653694529618057}. Best is trial 244 with value: 0.5939527867949647.
[I 2024-11-06 21:47:02,840] Trial 274 finished with value: 0.5938497327263658 and parameters: {'n_estimators': 153, 'max_depth': 7, 'learning_rate': 0.03941065021009524, 'gamma': 4.064633731122544, 'min_child_weight': 5, 'subsample': 0.8798172676503663, 'colsample_bytree': 0.5534779629425987, 'reg_alpha': 0.7087050365901094, 'reg_lambda': 0.7159861033410136}. Best is trial 244 with value: 0.5939527867949647.
[I 2024-11-06 21:47:08,900] Trial 275 finished with value: 0.5932694499690367 and parameters: {'n_estimators': 156, 'max_depth': 7, 'learning_rate': 0.02488396720492763, 'gamma': 3.987163993147415, 'min_child_weight': 5, 'subsample': 0.8832710219187792, 'colsample_bytree': 0.5506775256853959, 'reg_alpha': 0.7083769737592147, 'reg_lambda': 0.7081523573692061}. Best is trial 244 with value: 0.5939527867949647.
[I 2024-11-06 21:47:13,556] Trial 276 finished with value: 0.5935615194241011 and parameters: {'n_estimators': 161, 'max_depth': 7, 'learning_rate': 0.03942358965102704, 'gamma': 4.137407132020229, 'min_child_weight': 5, 'subsample': 0.8669544609568116, 'colsample_bytree': 0.5398091958139792, 'reg_alpha': 0.3584097128311933, 'reg_lambda': 0.10986168922482598}. Best is trial 244 with value: 0.5939527867949647.
[I 2024-11-06 21:47:18,225] Trial 277 finished with value: 0.5933604523793551 and parameters: {'n_estimators': 176, 'max_depth': 7, 'learning_rate': 0.03868934669957236, 'gamma': 4.083487931566775, 'min_child_weight': 5, 'subsample': 0.8639650971753365, 'colsample_bytree': 0.5251942739549083, 'reg_alpha': 0.6788154236076931, 'reg_lambda': 0.07219204354856937}. Best is trial 244 with value: 0.5939527867949647.
[I 2024-11-06 21:47:23,140] Trial 278 finished with value: 0.5930091609114589 and parameters: {'n_estimators': 164, 'max_depth': 7, 'learning_rate': 0.03292081029536129, 'gamma': 3.892441015352474, 'min_child_weight': 5, 'subsample': 0.8698889663729874, 'colsample_bytree': 0.540816499282647, 'reg_alpha': 0.7376460775572093, 'reg_lambda': 0.6895721229921186}. Best is trial 244 with value: 0.5939527867949647.
[I 2024-11-06 21:47:28,511] Trial 279 finished with value: 0.5932569102333505 and parameters: {'n_estimators': 159, 'max_depth': 7, 'learning_rate': 0.019650392252731283, 'gamma': 4.148102403381987, 'min_child_weight': 5, 'subsample': 0.8775819996175127, 'colsample_bytree': 0.5310249073057149, 'reg_alpha': 0.7103308294784945, 'reg_lambda': 0.16315346804173025}. Best is trial 244 with value: 0.5939527867949647.
[I 2024-11-06 21:47:33,763] Trial 280 finished with value: 0.5929286854522755 and parameters: {'n_estimators': 166, 'max_depth': 8, 'learning_rate': 0.04020328586138673, 'gamma': 4.070209212866386, 'min_child_weight': 5, 'subsample': 0.8564490103199823, 'colsample_bytree': 0.5426443943305229, 'reg_alpha': 0.2761450011037055, 'reg_lambda': 0.35841551305755226}. Best is trial 244 with value: 0.5939527867949647.
[I 2024-11-06 21:47:39,007] Trial 281 finished with value: 0.5923517435475925 and parameters: {'n_estimators': 154, 'max_depth': 7, 'learning_rate': 0.011682853710010634, 'gamma': 4.219677004079043, 'min_child_weight': 5, 'subsample': 0.5141949818258649, 'colsample_bytree': 0.5522339670496834, 'reg_alpha': 0.7236175468199166, 'reg_lambda': 0.7251209439778437}. Best is trial 244 with value: 0.5939527867949647.
[I 2024-11-06 21:47:44,482] Trial 282 finished with value: 0.5929164391397466 and parameters: {'n_estimators': 170, 'max_depth': 7, 'learning_rate': 0.026347144324074322, 'gamma': 3.989300452325106, 'min_child_weight': 5, 'subsample': 0.8642464514650491, 'colsample_bytree': 0.513565092293339, 'reg_alpha': 0.44625308149987153, 'reg_lambda': 0.7053573076882576}. Best is trial 244 with value: 0.5939527867949647.
[I 2024-11-06 21:47:48,940] Trial 283 finished with value: 0.5934026582765415 and parameters: {'n_estimators': 161, 'max_depth': 6, 'learning_rate': 0.03557488326625387, 'gamma': 4.219650778391476, 'min_child_weight': 5, 'subsample': 0.8418446425132279, 'colsample_bytree': 0.5321093230075388, 'reg_alpha': 0.3645392518503323, 'reg_lambda': 0.6849458036171701}. Best is trial 244 with value: 0.5939527867949647.
[I 2024-11-06 21:47:54,118] Trial 284 finished with value: 0.5920775389431775 and parameters: {'n_estimators': 153, 'max_depth': 7, 'learning_rate': 0.03075652771005248, 'gamma': 1.7129376891819346, 'min_child_weight': 6, 'subsample': 0.8775269797600296, 'colsample_bytree': 0.5181335794178793, 'reg_alpha': 0.6941317287703805, 'reg_lambda': 0.01173828460643532}. Best is trial 244 with value: 0.5939527867949647.
[I 2024-11-06 21:47:58,341] Trial 285 finished with value: 0.5935164222412493 and parameters: {'n_estimators': 158, 'max_depth': 7, 'learning_rate': 0.0419717218444386, 'gamma': 4.142695183511434, 'min_child_weight': 5, 'subsample': 0.887873336633581, 'colsample_bytree': 0.5699823109201985, 'reg_alpha': 0.7511758313810459, 'reg_lambda': 0.11849056281135205}. Best is trial 244 with value: 0.5939527867949647.
[I 2024-11-06 21:48:04,995] Trial 286 finished with value: 0.5928211127690656 and parameters: {'n_estimators': 163, 'max_depth': 7, 'learning_rate': 0.0218843271325059, 'gamma': 4.278786911387481, 'min_child_weight': 6, 'subsample': 0.8488519414923761, 'colsample_bytree': 0.5542288356700602, 'reg_alpha': 0.68295980762197, 'reg_lambda': 0.7331661186069363}. Best is trial 244 with value: 0.5939527867949647.
[I 2024-11-06 21:48:09,355] Trial 287 finished with value: 0.5935403385898608 and parameters: {'n_estimators': 150, 'max_depth': 7, 'learning_rate': 0.03622245462204128, 'gamma': 4.445850300850315, 'min_child_weight': 5, 'subsample': 0.8661199609575454, 'colsample_bytree': 0.5426488800157556, 'reg_alpha': 0.5072360057999319, 'reg_lambda': 0.6311421756617301}. Best is trial 244 with value: 0.5939527867949647.
[I 2024-11-06 21:48:14,519] Trial 288 finished with value: 0.5933113678430273 and parameters: {'n_estimators': 181, 'max_depth': 7, 'learning_rate': 0.04541143156151102, 'gamma': 4.408246135834669, 'min_child_weight': 5, 'subsample': 0.8651595567187639, 'colsample_bytree': 0.5409367790570482, 'reg_alpha': 0.48021673757207617, 'reg_lambda': 0.7113867838951731}. Best is trial 244 with value: 0.5939527867949647.
[I 2024-11-06 21:48:18,665] Trial 289 finished with value: 0.5935542502803538 and parameters: {'n_estimators': 142, 'max_depth': 8, 'learning_rate': 0.04040400170898794, 'gamma': 4.060691430457794, 'min_child_weight': 5, 'subsample': 0.8754108421474273, 'colsample_bytree': 0.548200331534795, 'reg_alpha': 0.49482800141679933, 'reg_lambda': 0.6776157085662151}. Best is trial 244 with value: 0.5939527867949647.
[I 2024-11-06 21:48:23,083] Trial 290 finished with value: 0.5928250525574336 and parameters: {'n_estimators': 143, 'max_depth': 8, 'learning_rate': 0.04933524342855999, 'gamma': 3.8769947175566664, 'min_child_weight': 5, 'subsample': 0.859350104581296, 'colsample_bytree': 0.5448455346121457, 'reg_alpha': 0.5021534720176932, 'reg_lambda': 0.6618991843395647}. Best is trial 244 with value: 0.5939527867949647.
[I 2024-11-06 21:48:27,953] Trial 291 finished with value: 0.5924814996937525 and parameters: {'n_estimators': 133, 'max_depth': 8, 'learning_rate': 0.03986703738071671, 'gamma': 2.948542366893448, 'min_child_weight': 5, 'subsample': 0.8819151646714692, 'colsample_bytree': 0.5277363908539822, 'reg_alpha': 0.5423363007810562, 'reg_lambda': 0.3086885088989942}. Best is trial 244 with value: 0.5939527867949647.
[I 2024-11-06 21:48:32,571] Trial 292 finished with value: 0.5926908885081886 and parameters: {'n_estimators': 142, 'max_depth': 8, 'learning_rate': 0.03843587090201851, 'gamma': 4.0273012804349095, 'min_child_weight': 5, 'subsample': 0.9037856294397304, 'colsample_bytree': 0.5345447104169357, 'reg_alpha': 0.4574395547371857, 'reg_lambda': 0.6374039590569183}. Best is trial 244 with value: 0.5939527867949647.
[I 2024-11-06 21:48:37,674] Trial 293 finished with value: 0.5934007269916937 and parameters: {'n_estimators': 148, 'max_depth': 9, 'learning_rate': 0.04698048564474624, 'gamma': 3.94612775139026, 'min_child_weight': 5, 'subsample': 0.8696435387120092, 'colsample_bytree': 0.5496524814795377, 'reg_alpha': 0.5327344654276837, 'reg_lambda': 0.7008261445768988}. Best is trial 244 with value: 0.5939527867949647.
[I 2024-11-06 21:48:42,547] Trial 294 finished with value: 0.5930648091873548 and parameters: {'n_estimators': 146, 'max_depth': 7, 'learning_rate': 0.027511252767795563, 'gamma': 4.101410974753268, 'min_child_weight': 5, 'subsample': 0.8921818314234973, 'colsample_bytree': 0.8561442089275819, 'reg_alpha': 0.30206665300607605, 'reg_lambda': 0.7429194516512589}. Best is trial 244 with value: 0.5939527867949647.
[I 2024-11-06 21:48:46,836] Trial 295 finished with value: 0.5937375525854296 and parameters: {'n_estimators': 138, 'max_depth': 7, 'learning_rate': 0.04332697244383143, 'gamma': 4.171175930025368, 'min_child_weight': 5, 'subsample': 0.8496203300010219, 'colsample_bytree': 0.5614962256533073, 'reg_alpha': 0.49174249780924106, 'reg_lambda': 0.6746256798636794}. Best is trial 244 with value: 0.5939527867949647.
[I 2024-11-06 21:48:49,542] Trial 296 finished with value: 0.5916270990735334 and parameters: {'n_estimators': 130, 'max_depth': 9, 'learning_rate': 0.15957535940139747, 'gamma': 4.189051443985741, 'min_child_weight': 5, 'subsample': 0.8176493712599185, 'colsample_bytree': 0.5611360051048552, 'reg_alpha': 0.6401921462093507, 'reg_lambda': 0.27165099507960555}. Best is trial 244 with value: 0.5939527867949647.
[I 2024-11-06 21:48:53,596] Trial 297 finished with value: 0.593916180029681 and parameters: {'n_estimators': 136, 'max_depth': 7, 'learning_rate': 0.056084120601546314, 'gamma': 3.765021921962929, 'min_child_weight': 5, 'subsample': 0.842522200756022, 'colsample_bytree': 0.5595404209946256, 'reg_alpha': 0.584398285131504, 'reg_lambda': 0.6687288791310919}. Best is trial 244 with value: 0.5939527867949647.
[I 2024-11-06 21:48:57,872] Trial 298 finished with value: 0.59315290220439 and parameters: {'n_estimators': 137, 'max_depth': 7, 'learning_rate': 0.05590079789109434, 'gamma': 3.7717640654469218, 'min_child_weight': 5, 'subsample': 0.828216707372368, 'colsample_bytree': 0.559701139161403, 'reg_alpha': 0.573105286679361, 'reg_lambda': 0.6732749205156081}. Best is trial 244 with value: 0.5939527867949647.
[I 2024-11-06 21:49:01,646] Trial 299 finished with value: 0.5933369002563615 and parameters: {'n_estimators': 128, 'max_depth': 7, 'learning_rate': 0.051425331776086755, 'gamma': 3.8977506916718414, 'min_child_weight': 5, 'subsample': 0.8448271459451965, 'colsample_bytree': 0.5534895737449046, 'reg_alpha': 0.6204938606322217, 'reg_lambda': 0.6564035581960782}. Best is trial 244 with value: 0.5939527867949647.
[I 2024-11-06 21:49:05,126] Trial 300 finished with value: 0.5925114910490515 and parameters: {'n_estimators': 134, 'max_depth': 7, 'learning_rate': 0.22516986436043535, 'gamma': 4.031703162070974, 'min_child_weight': 5, 'subsample': 0.8326647390196696, 'colsample_bytree': 0.5644163701152274, 'reg_alpha': 0.5714162916267564, 'reg_lambda': 0.6807470835254784}. Best is trial 244 with value: 0.5939527867949647.
[I 2024-11-06 21:49:09,506] Trial 301 finished with value: 0.5933511062276257 and parameters: {'n_estimators': 139, 'max_depth': 6, 'learning_rate': 0.045690868279327765, 'gamma': 4.075349318756681, 'min_child_weight': 5, 'subsample': 0.8519152767631762, 'colsample_bytree': 0.5251122939196972, 'reg_alpha': 0.5965425955346383, 'reg_lambda': 0.7121845854362793}. Best is trial 244 with value: 0.5939527867949647.
[I 2024-11-06 21:49:13,429] Trial 302 finished with value: 0.592734656266136 and parameters: {'n_estimators': 141, 'max_depth': 8, 'learning_rate': 0.055992258029539096, 'gamma': 3.913213931550387, 'min_child_weight': 6, 'subsample': 0.917717356796339, 'colsample_bytree': 0.546442538709591, 'reg_alpha': 0.4937158663018062, 'reg_lambda': 0.6548388222385588}. Best is trial 244 with value: 0.5939527867949647.
[I 2024-11-06 21:49:17,853] Trial 303 finished with value: 0.5926625852052263 and parameters: {'n_estimators': 144, 'max_depth': 7, 'learning_rate': 0.043025555280463645, 'gamma': 4.1861073788621965, 'min_child_weight': 5, 'subsample': 0.8402031976267306, 'colsample_bytree': 0.5553825907392229, 'reg_alpha': 0.42039504906399583, 'reg_lambda': 0.7207882898136865}. Best is trial 244 with value: 0.5939527867949647.
[I 2024-11-06 21:49:21,444] Trial 304 finished with value: 0.5934959231583474 and parameters: {'n_estimators': 135, 'max_depth': 7, 'learning_rate': 0.05112163115732558, 'gamma': 4.104020997877124, 'min_child_weight': 5, 'subsample': 0.8522284299834375, 'colsample_bytree': 0.5371888591376928, 'reg_alpha': 0.655531142630237, 'reg_lambda': 0.6743595681699331}. Best is trial 244 with value: 0.5939527867949647.
[I 2024-11-06 21:49:25,283] Trial 305 finished with value: 0.5934390808012858 and parameters: {'n_estimators': 126, 'max_depth': 7, 'learning_rate': 0.04269565344685564, 'gamma': 3.8168582666572988, 'min_child_weight': 7, 'subsample': 0.8771444299673692, 'colsample_bytree': 0.5137896175413449, 'reg_alpha': 0.6132490111069153, 'reg_lambda': 0.7749166125944464}. Best is trial 244 with value: 0.5939527867949647.
[I 2024-11-06 21:49:29,938] Trial 306 finished with value: 0.5935426848313454 and parameters: {'n_estimators': 176, 'max_depth': 7, 'learning_rate': 0.04832760621065696, 'gamma': 4.289351586099194, 'min_child_weight': 6, 'subsample': 0.8584802569266522, 'colsample_bytree': 0.5604939964195008, 'reg_alpha': 0.5361501988710042, 'reg_lambda': 0.6987674616983458}. Best is trial 244 with value: 0.5939527867949647.
[I 2024-11-06 21:49:35,456] Trial 307 finished with value: 0.592408606038241 and parameters: {'n_estimators': 169, 'max_depth': 7, 'learning_rate': 0.02964935116728162, 'gamma': 3.979540226587096, 'min_child_weight': 5, 'subsample': 0.7963833730653493, 'colsample_bytree': 0.5716400155093283, 'reg_alpha': 0.47418993587925806, 'reg_lambda': 0.7506310912072198}. Best is trial 244 with value: 0.5939527867949647.
[I 2024-11-06 21:49:40,490] Trial 308 finished with value: 0.5931164868953982 and parameters: {'n_estimators': 150, 'max_depth': 7, 'learning_rate': 0.015775114676300554, 'gamma': 4.206873483096947, 'min_child_weight': 7, 'subsample': 0.9098809979295285, 'colsample_bytree': 0.5472859751258267, 'reg_alpha': 0.7041958425000225, 'reg_lambda': 0.7245007193177229}. Best is trial 244 with value: 0.5939527867949647.
[I 2024-11-06 21:49:44,868] Trial 309 finished with value: 0.5931330795779535 and parameters: {'n_estimators': 141, 'max_depth': 7, 'learning_rate': 0.04021028547308744, 'gamma': 4.118295665844031, 'min_child_weight': 7, 'subsample': 0.8885547097534131, 'colsample_bytree': 0.5366086718727874, 'reg_alpha': 0.6794570525018966, 'reg_lambda': 0.6551121718671499}. Best is trial 244 with value: 0.5939527867949647.
[I 2024-11-06 21:49:49,730] Trial 310 finished with value: 0.5926436540818877 and parameters: {'n_estimators': 154, 'max_depth': 7, 'learning_rate': 0.03505995362034381, 'gamma': 3.713925584621134, 'min_child_weight': 6, 'subsample': 0.8407816503662977, 'colsample_bytree': 0.5682085911886362, 'reg_alpha': 0.37355304677018564, 'reg_lambda': 0.6853664689439729}. Best is trial 244 with value: 0.5939527867949647.
[I 2024-11-06 21:49:54,377] Trial 311 finished with value: 0.5930572243268555 and parameters: {'n_estimators': 146, 'max_depth': 8, 'learning_rate': 0.02342636868594181, 'gamma': 4.311160307402056, 'min_child_weight': 7, 'subsample': 0.8994182896804849, 'colsample_bytree': 0.5247380528495489, 'reg_alpha': 0.5860916394310174, 'reg_lambda': 0.6087857240896217}. Best is trial 244 with value: 0.5939527867949647.
