[I 2024-11-06 21:49:57,183] Trial 312 finished with value: 0.5915208310412646 and parameters: {'n_estimators': 137, 'max_depth': 7, 'learning_rate': 0.2466359926954056, 'gamma': 4.038085026290345, 'min_child_weight': 5, 'subsample': 0.8750831140077745, 'colsample_bytree': 0.5566220413412203, 'reg_alpha': 0.7396854554812976, 'reg_lambda': 0.6702109942045261}. Best is trial 244 with value: 0.5939527867949647.
[I 2024-11-06 21:50:01,955] Trial 313 finished with value: 0.5930740368149323 and parameters: {'n_estimators': 165, 'max_depth': 7, 'learning_rate': 0.046974357132428306, 'gamma': 4.247825110441276, 'min_child_weight': 7, 'subsample': 0.9240380821308474, 'colsample_bytree': 0.54859755976178, 'reg_alpha': 0.663652857463786, 'reg_lambda': 0.8461052434982043}. Best is trial 244 with value: 0.5939527867949647.
[I 2024-11-06 21:50:06,578] Trial 314 finished with value: 0.5933067167954034 and parameters: {'n_estimators': 151, 'max_depth': 7, 'learning_rate': 0.05656365595853291, 'gamma': 4.173063613914186, 'min_child_weight': 7, 'subsample': 0.8578743677505727, 'colsample_bytree': 0.5669394709523068, 'reg_alpha': 0.7131417732919256, 'reg_lambda': 0.6352446694311319}. Best is trial 244 with value: 0.5939527867949647.
[I 2024-11-06 21:50:11,304] Trial 315 finished with value: 0.5930769479346254 and parameters: {'n_estimators': 172, 'max_depth': 6, 'learning_rate': 0.04206783087527936, 'gamma': 3.9950301548062552, 'min_child_weight': 5, 'subsample': 0.8681136602303824, 'colsample_bytree': 0.5335894638264507, 'reg_alpha': 0.3373766366978856, 'reg_lambda': 0.6997860978501379}. Best is trial 244 with value: 0.5939527867949647.
[I 2024-11-06 21:50:16,767] Trial 316 finished with value: 0.5926371785156611 and parameters: {'n_estimators': 156, 'max_depth': 7, 'learning_rate': 0.028640001319105803, 'gamma': 2.777553011275596, 'min_child_weight': 7, 'subsample': 0.8838508858308972, 'colsample_bytree': 0.5755202624034251, 'reg_alpha': 0.7249686744617647, 'reg_lambda': 0.7330796095993708}. Best is trial 244 with value: 0.5939527867949647.
[I 2024-11-06 21:50:21,592] Trial 317 finished with value: 0.5932062614386426 and parameters: {'n_estimators': 160, 'max_depth': 7, 'learning_rate': 0.035424361086368046, 'gamma': 4.310619802492675, 'min_child_weight': 7, 'subsample': 0.8475777483666745, 'colsample_bytree': 0.7336193304389454, 'reg_alpha': 0.55152753117883, 'reg_lambda': 0.6496305872457272}. Best is trial 244 with value: 0.5939527867949647.
[I 2024-11-06 21:50:26,117] Trial 318 finished with value: 0.5927411679610726 and parameters: {'n_estimators': 149, 'max_depth': 7, 'learning_rate': 0.04899916736385186, 'gamma': 4.089970728506571, 'min_child_weight': 5, 'subsample': 0.8943921388914791, 'colsample_bytree': 0.5109204378017203, 'reg_alpha': 0.5176435490878405, 'reg_lambda': 0.682629160549082}. Best is trial 244 with value: 0.5939527867949647.
[I 2024-11-06 21:50:30,935] Trial 319 finished with value: 0.5929367518796502 and parameters: {'n_estimators': 131, 'max_depth': 7, 'learning_rate': 0.03955916197953853, 'gamma': 3.196879732824547, 'min_child_weight': 7, 'subsample': 0.8302702062791115, 'colsample_bytree': 0.5405152393264108, 'reg_alpha': 0.6990774759308085, 'reg_lambda': 0.7080149288165213}. Best is trial 244 with value: 0.5939527867949647.
[I 2024-11-06 21:50:36,594] Trial 320 finished with value: 0.5924279841706078 and parameters: {'n_estimators': 144, 'max_depth': 7, 'learning_rate': 0.02015191138353213, 'gamma': 1.229152098808866, 'min_child_weight': 7, 'subsample': 0.9094878339124325, 'colsample_bytree': 0.5548926859515078, 'reg_alpha': 0.6358285604954991, 'reg_lambda': 0.6192732284973852}. Best is trial 244 with value: 0.5939527867949647.
[I 2024-11-06 21:50:41,778] Trial 321 finished with value: 0.5937335836489905 and parameters: {'n_estimators': 166, 'max_depth': 7, 'learning_rate': 0.032344670690281824, 'gamma': 4.240256360814906, 'min_child_weight': 4, 'subsample': 0.8716750991974137, 'colsample_bytree': 0.5215926162499196, 'reg_alpha': 0.7889906432665459, 'reg_lambda': 0.889319404673852}. Best is trial 244 with value: 0.5939527867949647.
[I 2024-11-06 21:50:47,292] Trial 322 finished with value: 0.5936050094335632 and parameters: {'n_estimators': 180, 'max_depth': 7, 'learning_rate': 0.027414604017089006, 'gamma': 4.236470867976319, 'min_child_weight': 4, 'subsample': 0.8729957275217785, 'colsample_bytree': 0.5218202433467828, 'reg_alpha': 0.7447694651522679, 'reg_lambda': 0.8731667980884845}. Best is trial 244 with value: 0.5939527867949647.
[I 2024-11-06 21:50:53,480] Trial 323 finished with value: 0.5924975135955869 and parameters: {'n_estimators': 174, 'max_depth': 7, 'learning_rate': 0.017346541708497587, 'gamma': 4.256820299108323, 'min_child_weight': 4, 'subsample': 0.8639963426379218, 'colsample_bytree': 0.5159818577403936, 'reg_alpha': 0.7451007745928007, 'reg_lambda': 0.8776311280810977}. Best is trial 244 with value: 0.5939527867949647.
[I 2024-11-06 21:50:58,725] Trial 324 finished with value: 0.5928360185120887 and parameters: {'n_estimators': 183, 'max_depth': 7, 'learning_rate': 0.026151315512891963, 'gamma': 4.354003247111154, 'min_child_weight': 4, 'subsample': 0.855020641220939, 'colsample_bytree': 0.5097028754670013, 'reg_alpha': 0.7683155687056723, 'reg_lambda': 0.8982498362327015}. Best is trial 244 with value: 0.5939527867949647.
[I 2024-11-06 21:51:05,184] Trial 325 finished with value: 0.5934154089452763 and parameters: {'n_estimators': 181, 'max_depth': 7, 'learning_rate': 0.03086687573583656, 'gamma': 4.197314925879284, 'min_child_weight': 4, 'subsample': 0.879913902676544, 'colsample_bytree': 0.5192219359583002, 'reg_alpha': 0.788696714113745, 'reg_lambda': 0.8806404683469379}. Best is trial 244 with value: 0.5939527867949647.
[I 2024-11-06 21:51:08,232] Trial 326 finished with value: 0.5916348545060794 and parameters: {'n_estimators': 177, 'max_depth': 7, 'learning_rate': 0.26271169687440266, 'gamma': 4.347179368376874, 'min_child_weight': 4, 'subsample': 0.8696700883360713, 'colsample_bytree': 0.5249843915246168, 'reg_alpha': 0.7200364239197369, 'reg_lambda': 0.8456835133114602}. Best is trial 244 with value: 0.5939527867949647.
[I 2024-11-06 21:51:13,633] Trial 327 finished with value: 0.592727217998857 and parameters: {'n_estimators': 169, 'max_depth': 7, 'learning_rate': 0.02374103883420627, 'gamma': 4.270503131546671, 'min_child_weight': 7, 'subsample': 0.8848967076453735, 'colsample_bytree': 0.5246875306536943, 'reg_alpha': 0.7327302490125588, 'reg_lambda': 0.7547406796607972}. Best is trial 244 with value: 0.5939527867949647.
[I 2024-11-06 21:51:19,638] Trial 328 finished with value: 0.5928382742695376 and parameters: {'n_estimators': 193, 'max_depth': 7, 'learning_rate': 0.03280086978372775, 'gamma': 4.202404636914329, 'min_child_weight': 4, 'subsample': 0.8604278279091481, 'colsample_bytree': 0.5305867086369254, 'reg_alpha': 0.6705469091124983, 'reg_lambda': 0.9181983049437406}. Best is trial 244 with value: 0.5939527867949647.
[I 2024-11-06 21:51:24,527] Trial 329 finished with value: 0.5931483852967228 and parameters: {'n_estimators': 162, 'max_depth': 7, 'learning_rate': 0.02581307107849505, 'gamma': 4.403905640232859, 'min_child_weight': 4, 'subsample': 0.8464979068966076, 'colsample_bytree': 0.5117769206345958, 'reg_alpha': 0.747818659529207, 'reg_lambda': 0.8679732443538497}. Best is trial 244 with value: 0.5939527867949647.
[I 2024-11-06 21:51:30,226] Trial 330 finished with value: 0.5928366769480862 and parameters: {'n_estimators': 155, 'max_depth': 7, 'learning_rate': 0.016528665504170197, 'gamma': 4.501083148496296, 'min_child_weight': 4, 'subsample': 0.8699396440557431, 'colsample_bytree': 0.6949235204279213, 'reg_alpha': 0.23393841844907626, 'reg_lambda': 0.8949171705558695}. Best is trial 244 with value: 0.5939527867949647.
[I 2024-11-06 21:51:34,749] Trial 331 finished with value: 0.5933299885861973 and parameters: {'n_estimators': 166, 'max_depth': 6, 'learning_rate': 0.031911215903419526, 'gamma': 4.334731200376836, 'min_child_weight': 7, 'subsample': 0.8887678493380465, 'colsample_bytree': 0.5001823341891527, 'reg_alpha': 0.6864469199000138, 'reg_lambda': 0.8639761882641893}. Best is trial 244 with value: 0.5939527867949647.
[I 2024-11-06 21:51:39,559] Trial 332 finished with value: 0.592587599248833 and parameters: {'n_estimators': 160, 'max_depth': 7, 'learning_rate': 0.03615270789788469, 'gamma': 4.16940045509902, 'min_child_weight': 7, 'subsample': 0.7835941432224796, 'colsample_bytree': 0.5337784922644176, 'reg_alpha': 0.7654827065153101, 'reg_lambda': 0.8124071577509785}. Best is trial 244 with value: 0.5939527867949647.
[I 2024-11-06 21:51:44,700] Trial 333 finished with value: 0.5932631322043425 and parameters: {'n_estimators': 154, 'max_depth': 7, 'learning_rate': 0.02254521865741888, 'gamma': 3.93786940126602, 'min_child_weight': 7, 'subsample': 0.8796794489325209, 'colsample_bytree': 0.5260101976266123, 'reg_alpha': 0.7891071961737773, 'reg_lambda': 0.9461417588200699}. Best is trial 244 with value: 0.5939527867949647.
[I 2024-11-06 21:51:50,211] Trial 334 finished with value: 0.5929087950190285 and parameters: {'n_estimators': 189, 'max_depth': 7, 'learning_rate': 0.02963413419347452, 'gamma': 4.130389379946917, 'min_child_weight': 6, 'subsample': 0.8590920091012714, 'colsample_bytree': 0.5384899516902508, 'reg_alpha': 0.7074889046719804, 'reg_lambda': 0.7868028247750394}. Best is trial 244 with value: 0.5939527867949647.
[I 2024-11-06 21:51:53,136] Trial 335 finished with value: 0.5928195958809248 and parameters: {'n_estimators': 173, 'max_depth': 5, 'learning_rate': 0.14919871909504184, 'gamma': 4.272471542857068, 'min_child_weight': 4, 'subsample': 0.8967798832899719, 'colsample_bytree': 0.5232950580324098, 'reg_alpha': 0.738153592286828, 'reg_lambda': 0.882638264766969}. Best is trial 244 with value: 0.5939527867949647.
[I 2024-11-06 21:51:58,158] Trial 336 finished with value: 0.5922876767986398 and parameters: {'n_estimators': 178, 'max_depth': 7, 'learning_rate': 0.03570804939579102, 'gamma': 4.501420267239027, 'min_child_weight': 7, 'subsample': 0.8346008867501413, 'colsample_bytree': 0.5426590629278386, 'reg_alpha': 0.7217681830990873, 'reg_lambda': 0.926994859907733}. Best is trial 244 with value: 0.5939527867949647.
[I 2024-11-06 21:52:02,554] Trial 337 finished with value: 0.5929683148684138 and parameters: {'n_estimators': 162, 'max_depth': 7, 'learning_rate': 0.044486515071110934, 'gamma': 4.393121322722462, 'min_child_weight': 4, 'subsample': 0.8216551161445629, 'colsample_bytree': 0.576962434797672, 'reg_alpha': 0.6576744754842727, 'reg_lambda': 0.7369222379823805}. Best is trial 244 with value: 0.5939527867949647.
[I 2024-11-06 21:52:12,097] Trial 338 finished with value: 0.5922532384942067 and parameters: {'n_estimators': 259, 'max_depth': 7, 'learning_rate': 0.011439567266770027, 'gamma': 4.607250585681727, 'min_child_weight': 7, 'subsample': 0.8689307542092519, 'colsample_bytree': 0.5601442976562857, 'reg_alpha': 0.69780236484062, 'reg_lambda': 0.8270801366637869}. Best is trial 244 with value: 0.5939527867949647.
[I 2024-11-06 21:52:17,097] Trial 339 finished with value: 0.5931710227767887 and parameters: {'n_estimators': 151, 'max_depth': 7, 'learning_rate': 0.027427002446939814, 'gamma': 4.232091375250236, 'min_child_weight': 7, 'subsample': 0.8500125244634464, 'colsample_bytree': 0.5057223536047666, 'reg_alpha': 0.7518433943496007, 'reg_lambda': 0.9010980148667701}. Best is trial 244 with value: 0.5939527867949647.
[I 2024-11-06 21:52:21,031] Trial 340 finished with value: 0.5935521475088482 and parameters: {'n_estimators': 155, 'max_depth': 7, 'learning_rate': 0.0521903139093377, 'gamma': 4.153951003364069, 'min_child_weight': 7, 'subsample': 0.8730844963707326, 'colsample_bytree': 0.533735970711266, 'reg_alpha': 0.6050826859177744, 'reg_lambda': 0.06745980407582633}. Best is trial 244 with value: 0.5939527867949647.
[I 2024-11-06 21:52:25,889] Trial 341 finished with value: 0.5932426549098512 and parameters: {'n_estimators': 168, 'max_depth': 7, 'learning_rate': 0.03633434937004994, 'gamma': 3.8497899678813323, 'min_child_weight': 6, 'subsample': 0.8844952545945172, 'colsample_bytree': 0.5149631181491217, 'reg_alpha': 0.7745142178621841, 'reg_lambda': 0.7205678802339929}. Best is trial 244 with value: 0.5939527867949647.
[I 2024-11-06 21:52:30,740] Trial 342 finished with value: 0.5932888911424719 and parameters: {'n_estimators': 184, 'max_depth': 7, 'learning_rate': 0.04263522798398112, 'gamma': 4.021094706173399, 'min_child_weight': 7, 'subsample': 0.8619947729150768, 'colsample_bytree': 0.5890746326488768, 'reg_alpha': 0.6820878322680197, 'reg_lambda': 0.24087223268306981}. Best is trial 244 with value: 0.5939527867949647.
[I 2024-11-06 21:52:35,753] Trial 343 finished with value: 0.5933933812419119 and parameters: {'n_estimators': 148, 'max_depth': 7, 'learning_rate': 0.019707003465256098, 'gamma': 4.397333722385495, 'min_child_weight': 7, 'subsample': 0.877366204222189, 'colsample_bytree': 0.794732748537647, 'reg_alpha': 0.8155533001662632, 'reg_lambda': 0.6985313419488801}. Best is trial 244 with value: 0.5939527867949647.
[I 2024-11-06 21:52:40,660] Trial 344 finished with value: 0.5930497782020404 and parameters: {'n_estimators': 158, 'max_depth': 7, 'learning_rate': 0.03120155306649206, 'gamma': 4.2773612577134354, 'min_child_weight': 7, 'subsample': 0.8414414924543344, 'colsample_bytree': 0.549134468032512, 'reg_alpha': 0.7259352313119224, 'reg_lambda': 0.765824774718852}. Best is trial 244 with value: 0.5939527867949647.
[I 2024-11-06 21:52:46,116] Trial 345 finished with value: 0.5914403352498265 and parameters: {'n_estimators': 164, 'max_depth': 7, 'learning_rate': 0.057158882768532274, 'gamma': 0.03286908823980683, 'min_child_weight': 7, 'subsample': 0.9006916259010375, 'colsample_bytree': 0.5703456363633949, 'reg_alpha': 0.7531340491863109, 'reg_lambda': 0.8607703886369807}. Best is trial 244 with value: 0.5939527867949647.
[I 2024-11-06 21:52:50,745] Trial 346 finished with value: 0.5928896906708669 and parameters: {'n_estimators': 156, 'max_depth': 7, 'learning_rate': 0.037562271100930834, 'gamma': 4.497501327302639, 'min_child_weight': 7, 'subsample': 0.8537077661895475, 'colsample_bytree': 0.81460370426956, 'reg_alpha': 0.702767173412633, 'reg_lambda': 0.6603969255225431}. Best is trial 244 with value: 0.5939527867949647.
[I 2024-11-06 21:52:54,819] Trial 347 finished with value: 0.5934282398144354 and parameters: {'n_estimators': 148, 'max_depth': 6, 'learning_rate': 0.04942106412969249, 'gamma': 4.106551636558648, 'min_child_weight': 6, 'subsample': 0.8898211712048161, 'colsample_bytree': 0.542413201835008, 'reg_alpha': 0.7971320261517145, 'reg_lambda': 0.7184353170548324}. Best is trial 244 with value: 0.5939527867949647.
[I 2024-11-06 21:52:59,943] Trial 348 finished with value: 0.5932865358792525 and parameters: {'n_estimators': 161, 'max_depth': 7, 'learning_rate': 0.02544747384817237, 'gamma': 4.624897122026063, 'min_child_weight': 7, 'subsample': 0.8670715702954602, 'colsample_bytree': 0.5569844188162197, 'reg_alpha': 0.6790490733845574, 'reg_lambda': 0.6980774665849873}. Best is trial 244 with value: 0.5939527867949647.
[I 2024-11-06 21:53:06,061] Trial 349 finished with value: 0.5929765687210393 and parameters: {'n_estimators': 152, 'max_depth': 7, 'learning_rate': 0.041866848796922304, 'gamma': 4.347041061129849, 'min_child_weight': 5, 'subsample': 0.8114601480856852, 'colsample_bytree': 0.5201355784330988, 'reg_alpha': 0.6325952490595623, 'reg_lambda': 0.7463239942101488}. Best is trial 244 with value: 0.5939527867949647.
[I 2024-11-06 21:53:10,508] Trial 350 finished with value: 0.5934794624200022 and parameters: {'n_estimators': 145, 'max_depth': 7, 'learning_rate': 0.03283802154003655, 'gamma': 4.188571030932126, 'min_child_weight': 7, 'subsample': 0.8770515025900693, 'colsample_bytree': 0.572431607909883, 'reg_alpha': 0.7338744309264874, 'reg_lambda': 0.6738861746875769}. Best is trial 244 with value: 0.5939527867949647.
[I 2024-11-06 21:53:16,488] Trial 351 finished with value: 0.5925316942104784 and parameters: {'n_estimators': 171, 'max_depth': 7, 'learning_rate': 0.020617077632822535, 'gamma': 3.9575666551746784, 'min_child_weight': 7, 'subsample': 0.7653730740143452, 'colsample_bytree': 0.5316386724688867, 'reg_alpha': 0.7784237762973176, 'reg_lambda': 0.6471283281119284}. Best is trial 244 with value: 0.5939527867949647.
[I 2024-11-06 21:53:20,890] Trial 352 finished with value: 0.5935408837718812 and parameters: {'n_estimators': 158, 'max_depth': 7, 'learning_rate': 0.046526174953953725, 'gamma': 4.527089596173186, 'min_child_weight': 4, 'subsample': 0.8591066223400342, 'colsample_bytree': 0.5841127205672871, 'reg_alpha': 0.6506167656948163, 'reg_lambda': 0.6861304951275983}. Best is trial 244 with value: 0.5939527867949647.
[I 2024-11-06 21:53:26,332] Trial 353 finished with value: 0.592383986985306 and parameters: {'n_estimators': 138, 'max_depth': 7, 'learning_rate': 0.010078586358067132, 'gamma': 4.292155484218812, 'min_child_weight': 5, 'subsample': 0.8938367534682803, 'colsample_bytree': 0.8792073202179209, 'reg_alpha': 0.5618216433315211, 'reg_lambda': 0.7200594253939343}. Best is trial 244 with value: 0.5939527867949647.
[I 2024-11-06 21:53:30,878] Trial 354 finished with value: 0.5932400202959567 and parameters: {'n_estimators': 165, 'max_depth': 7, 'learning_rate': 0.03845983062033081, 'gamma': 4.767128207165018, 'min_child_weight': 6, 'subsample': 0.9033192809074909, 'colsample_bytree': 0.562417515273054, 'reg_alpha': 0.7061782999952653, 'reg_lambda': 0.9150037344664476}. Best is trial 244 with value: 0.5939527867949647.
[I 2024-11-06 21:53:36,094] Trial 355 finished with value: 0.592802960800731 and parameters: {'n_estimators': 153, 'max_depth': 7, 'learning_rate': 0.027911820205137446, 'gamma': 4.0671823623239725, 'min_child_weight': 7, 'subsample': 0.9300888748499809, 'colsample_bytree': 0.5494076945054174, 'reg_alpha': 0.7598616043835399, 'reg_lambda': 0.6994250145239623}. Best is trial 244 with value: 0.5939527867949647.
[I 2024-11-06 21:53:39,471] Trial 356 finished with value: 0.5937640602819811 and parameters: {'n_estimators': 159, 'max_depth': 7, 'learning_rate': 0.05333291908962297, 'gamma': 4.689597317917516, 'min_child_weight': 7, 'subsample': 0.8452980380547299, 'colsample_bytree': 0.5395517369035415, 'reg_alpha': 0.4103020199638133, 'reg_lambda': 0.6616913619583515}. Best is trial 244 with value: 0.5939527867949647.
[I 2024-11-06 21:53:42,725] Trial 357 finished with value: 0.5934145183869324 and parameters: {'n_estimators': 122, 'max_depth': 7, 'learning_rate': 0.06153583091779415, 'gamma': 4.64152989328245, 'min_child_weight': 7, 'subsample': 0.831205334781176, 'colsample_bytree': 0.5763515330045226, 'reg_alpha': 0.7224850120600165, 'reg_lambda': 0.6641973070012177}. Best is trial 244 with value: 0.5939527867949647.
[I 2024-11-06 21:53:46,597] Trial 358 finished with value: 0.5932248993215052 and parameters: {'n_estimators': 147, 'max_depth': 7, 'learning_rate': 0.05149346400684039, 'gamma': 4.696960395501553, 'min_child_weight': 7, 'subsample': 0.8382331826986666, 'colsample_bytree': 0.9497245115583641, 'reg_alpha': 0.8237559821920407, 'reg_lambda': 0.6372527620129778}. Best is trial 244 with value: 0.5939527867949647.
[I 2024-11-06 21:53:50,456] Trial 359 finished with value: 0.5930651688535006 and parameters: {'n_estimators': 152, 'max_depth': 7, 'learning_rate': 0.05652419865772047, 'gamma': 4.564233746238185, 'min_child_weight': 7, 'subsample': 0.8483713510714361, 'colsample_bytree': 0.5981088282611988, 'reg_alpha': 0.4093204746927035, 'reg_lambda': 0.6749973703760795}. Best is trial 244 with value: 0.5939527867949647.
[I 2024-11-06 21:53:54,325] Trial 360 finished with value: 0.5935256920275831 and parameters: {'n_estimators': 157, 'max_depth': 7, 'learning_rate': 0.048670122181013055, 'gamma': 4.870778969697624, 'min_child_weight': 7, 'subsample': 0.8452281604728941, 'colsample_bytree': 0.5653622940618114, 'reg_alpha': 0.5850215209700003, 'reg_lambda': 0.6517365724706237}. Best is trial 244 with value: 0.5939527867949647.
[I 2024-11-06 21:53:58,357] Trial 361 finished with value: 0.5931518052392722 and parameters: {'n_estimators': 178, 'max_depth': 7, 'learning_rate': 0.06759890314477643, 'gamma': 4.788761037873716, 'min_child_weight': 7, 'subsample': 0.9170625490854074, 'colsample_bytree': 0.5524133286508321, 'reg_alpha': 0.7971272832529988, 'reg_lambda': 0.734062689194491}. Best is trial 244 with value: 0.5939527867949647.
[I 2024-11-06 21:54:03,172] Trial 362 finished with value: 0.5938645798188978 and parameters: {'n_estimators': 140, 'max_depth': 7, 'learning_rate': 0.054994734964709996, 'gamma': 3.5602886402957505, 'min_child_weight': 7, 'subsample': 0.8861171179693126, 'colsample_bytree': 0.5280270609862476, 'reg_alpha': 0.7405541996227024, 'reg_lambda': 0.7098111818051558}. Best is trial 244 with value: 0.5939527867949647.
[I 2024-11-06 21:54:07,431] Trial 363 finished with value: 0.5936315145076246 and parameters: {'n_estimators': 132, 'max_depth': 7, 'learning_rate': 0.0622755900170764, 'gamma': 3.554595197738785, 'min_child_weight': 7, 'subsample': 0.8858176403248674, 'colsample_bytree': 0.5071862045675708, 'reg_alpha': 0.7502109503583149, 'reg_lambda': 0.7119785350306247}. Best is trial 244 with value: 0.5939527867949647.
[I 2024-11-06 21:54:11,182] Trial 364 finished with value: 0.5929752052753402 and parameters: {'n_estimators': 131, 'max_depth': 5, 'learning_rate': 0.05186907807147259, 'gamma': 3.3136945351105807, 'min_child_weight': 7, 'subsample': 0.5563029594365474, 'colsample_bytree': 0.5024375094318325, 'reg_alpha': 0.7609104790423432, 'reg_lambda': 0.7531454238536874}. Best is trial 244 with value: 0.5939527867949647.
