[I 2024-11-06 22:15:27,948] Trial 683 finished with value: 0.5931214628137604 and parameters: {'n_estimators': 146, 'max_depth': 7, 'learning_rate': 0.04459782430607808, 'gamma': 4.476515940825384, 'min_child_weight': 7, 'subsample': 0.8946214252911183, 'colsample_bytree': 0.5643684544939708, 'reg_alpha': 0.5633281898558791, 'reg_lambda': 0.705561951595663}. Best is trial 625 with value: 0.5940826637391339.
[I 2024-11-06 22:15:31,992] Trial 684 finished with value: 0.5932953453434456 and parameters: {'n_estimators': 134, 'max_depth': 7, 'learning_rate': 0.0668878908069081, 'gamma': 4.315328092205573, 'min_child_weight': 7, 'subsample': 0.8721604042319938, 'colsample_bytree': 0.5753806366681349, 'reg_alpha': 0.6556734538855145, 'reg_lambda': 0.7293302144480086}. Best is trial 625 with value: 0.5940826637391339.
[I 2024-11-06 22:15:36,394] Trial 685 finished with value: 0.5935819347425894 and parameters: {'n_estimators': 157, 'max_depth': 7, 'learning_rate': 0.0539426471941621, 'gamma': 3.941313279884919, 'min_child_weight': 7, 'subsample': 0.8619534208087627, 'colsample_bytree': 0.5890637733003067, 'reg_alpha': 0.6328698313229675, 'reg_lambda': 0.700478278732582}. Best is trial 625 with value: 0.5940826637391339.
[I 2024-11-06 22:15:41,048] Trial 686 finished with value: 0.5933317701251632 and parameters: {'n_estimators': 151, 'max_depth': 7, 'learning_rate': 0.04971134327425109, 'gamma': 4.089767658616183, 'min_child_weight': 7, 'subsample': 0.8505652337994992, 'colsample_bytree': 0.6089055477129101, 'reg_alpha': 0.7482333986540842, 'reg_lambda': 0.6697957762941734}. Best is trial 625 with value: 0.5940826637391339.
[I 2024-11-06 22:15:44,679] Trial 687 finished with value: 0.5929723115603214 and parameters: {'n_estimators': 143, 'max_depth': 7, 'learning_rate': 0.060939436218884084, 'gamma': 4.3490893101015935, 'min_child_weight': 7, 'subsample': 0.8837752463429771, 'colsample_bytree': 0.5768137820316487, 'reg_alpha': 0.6784927528964358, 'reg_lambda': 0.7600219787962604}. Best is trial 625 with value: 0.5940826637391339.
[I 2024-11-06 22:15:49,290] Trial 688 finished with value: 0.593889502249354 and parameters: {'n_estimators': 138, 'max_depth': 7, 'learning_rate': 0.03932407929960809, 'gamma': 3.550140054625585, 'min_child_weight': 7, 'subsample': 0.8731050576603774, 'colsample_bytree': 0.5624150085157231, 'reg_alpha': 0.7265480611548967, 'reg_lambda': 0.7262942658606583}. Best is trial 625 with value: 0.5940826637391339.
[I 2024-11-06 22:15:53,247] Trial 689 finished with value: 0.5929700956013686 and parameters: {'n_estimators': 129, 'max_depth': 7, 'learning_rate': 0.05676428935071889, 'gamma': 3.40139581444016, 'min_child_weight': 7, 'subsample': 0.8732095649003784, 'colsample_bytree': 0.5635407364015121, 'reg_alpha': 0.7201540991378396, 'reg_lambda': 0.7321978512712836}. Best is trial 625 with value: 0.5940826637391339.
[I 2024-11-06 22:15:57,367] Trial 690 finished with value: 0.5940183725829432 and parameters: {'n_estimators': 136, 'max_depth': 7, 'learning_rate': 0.04448272243770459, 'gamma': 3.5539196880347026, 'min_child_weight': 7, 'subsample': 0.8794069954136572, 'colsample_bytree': 0.5842016915041572, 'reg_alpha': 0.6984902398026195, 'reg_lambda': 0.7477955490476527}. Best is trial 625 with value: 0.5940826637391339.
[I 2024-11-06 22:16:01,667] Trial 691 finished with value: 0.5932183807747711 and parameters: {'n_estimators': 126, 'max_depth': 7, 'learning_rate': 0.04235089595609682, 'gamma': 3.3539671364907733, 'min_child_weight': 7, 'subsample': 0.8647952370066436, 'colsample_bytree': 0.5844229683490998, 'reg_alpha': 0.7053554852782439, 'reg_lambda': 0.7504469800663782}. Best is trial 625 with value: 0.5940826637391339.
[I 2024-11-06 22:16:06,910] Trial 692 finished with value: 0.5935282909829706 and parameters: {'n_estimators': 133, 'max_depth': 7, 'learning_rate': 0.04494854551411031, 'gamma': 3.307884226211198, 'min_child_weight': 7, 'subsample': 0.8738789323662688, 'colsample_bytree': 0.5959738703694201, 'reg_alpha': 0.6986743489221772, 'reg_lambda': 0.7684694812217872}. Best is trial 625 with value: 0.5940826637391339.
[I 2024-11-06 22:16:11,907] Trial 693 finished with value: 0.5922074432973913 and parameters: {'n_estimators': 134, 'max_depth': 9, 'learning_rate': 0.03954659831659691, 'gamma': 3.660081017292551, 'min_child_weight': 7, 'subsample': 0.7540048304303159, 'colsample_bytree': 0.576348576339074, 'reg_alpha': 0.7298095990318535, 'reg_lambda': 0.739348621990855}. Best is trial 625 with value: 0.5940826637391339.
[I 2024-11-06 22:16:15,896] Trial 694 finished with value: 0.5936097519742642 and parameters: {'n_estimators': 118, 'max_depth': 7, 'learning_rate': 0.0474373367093413, 'gamma': 3.5046140248133053, 'min_child_weight': 7, 'subsample': 0.8586563923292914, 'colsample_bytree': 0.5842133195408471, 'reg_alpha': 0.6889644127802713, 'reg_lambda': 0.773169858130427}. Best is trial 625 with value: 0.5940826637391339.
[I 2024-11-06 22:16:20,883] Trial 695 finished with value: 0.5919709137039606 and parameters: {'n_estimators': 135, 'max_depth': 10, 'learning_rate': 0.049411653352169134, 'gamma': 3.5723017364174168, 'min_child_weight': 7, 'subsample': 0.8814672010450829, 'colsample_bytree': 0.5709891475102271, 'reg_alpha': 0.7128783703608992, 'reg_lambda': 0.7219298767664062}. Best is trial 625 with value: 0.5940826637391339.
[I 2024-11-06 22:16:23,651] Trial 696 finished with value: 0.592973510573488 and parameters: {'n_estimators': 128, 'max_depth': 7, 'learning_rate': 0.11569206496402903, 'gamma': 3.5287296973919653, 'min_child_weight': 7, 'subsample': 0.867489650799386, 'colsample_bytree': 0.593392541508993, 'reg_alpha': 0.6691278253842137, 'reg_lambda': 0.7443573930699473}. Best is trial 625 with value: 0.5940826637391339.
[I 2024-11-06 22:16:28,158] Trial 697 finished with value: 0.5933054577596243 and parameters: {'n_estimators': 137, 'max_depth': 7, 'learning_rate': 0.03855929662805314, 'gamma': 3.47576055421078, 'min_child_weight': 7, 'subsample': 0.7188610934379195, 'colsample_bytree': 0.6032323727428899, 'reg_alpha': 0.6950549879125292, 'reg_lambda': 0.724289239882177}. Best is trial 625 with value: 0.5940826637391339.
[I 2024-11-06 22:16:32,789] Trial 698 finished with value: 0.5935746402288707 and parameters: {'n_estimators': 139, 'max_depth': 7, 'learning_rate': 0.04460196492189315, 'gamma': 3.9824629189504988, 'min_child_weight': 7, 'subsample': 0.857413045136534, 'colsample_bytree': 0.583713855853883, 'reg_alpha': 0.7214321965550107, 'reg_lambda': 0.7512135994654279}. Best is trial 625 with value: 0.5940826637391339.
[I 2024-11-06 22:16:36,655] Trial 699 finished with value: 0.5928670393653246 and parameters: {'n_estimators': 134, 'max_depth': 7, 'learning_rate': 0.05275098599095909, 'gamma': 3.2349197779033236, 'min_child_weight': 7, 'subsample': 0.8791631127166327, 'colsample_bytree': 0.6242645878093157, 'reg_alpha': 0.6628418656205407, 'reg_lambda': 0.7137318650490349}. Best is trial 625 with value: 0.5940826637391339.
[I 2024-11-06 22:16:40,912] Trial 700 finished with value: 0.593471748104427 and parameters: {'n_estimators': 121, 'max_depth': 7, 'learning_rate': 0.037038557142696736, 'gamma': 3.5815499329185148, 'min_child_weight': 7, 'subsample': 0.8481618001354644, 'colsample_bytree': 0.5710382479209701, 'reg_alpha': 0.7423255638940016, 'reg_lambda': 0.7773593391790575}. Best is trial 625 with value: 0.5940826637391339.
[I 2024-11-06 22:16:44,839] Trial 701 finished with value: 0.5930757271254941 and parameters: {'n_estimators': 129, 'max_depth': 7, 'learning_rate': 0.04763573660334751, 'gamma': 3.422225724272559, 'min_child_weight': 7, 'subsample': 0.8700113347584738, 'colsample_bytree': 0.5927154142915894, 'reg_alpha': 0.6814401073866483, 'reg_lambda': 0.7613165907239896}. Best is trial 625 with value: 0.5940826637391339.
[I 2024-11-06 22:16:48,649] Trial 702 finished with value: 0.59324619193552 and parameters: {'n_estimators': 138, 'max_depth': 7, 'learning_rate': 0.05343938641434636, 'gamma': 3.6532136918203575, 'min_child_weight': 10, 'subsample': 0.8833129375660956, 'colsample_bytree': 0.5833063901830484, 'reg_alpha': 0.7011748179565197, 'reg_lambda': 0.733899433068914}. Best is trial 625 with value: 0.5940826637391339.
[I 2024-11-06 22:16:53,398] Trial 703 finished with value: 0.5928908944191085 and parameters: {'n_estimators': 131, 'max_depth': 7, 'learning_rate': 0.04129611275087222, 'gamma': 3.512896042313396, 'min_child_weight': 8, 'subsample': 0.8608291058858549, 'colsample_bytree': 0.6073933551638607, 'reg_alpha': 0.6516413484723355, 'reg_lambda': 0.708367971491639}. Best is trial 625 with value: 0.5940826637391339.
[I 2024-11-06 22:16:57,809] Trial 704 finished with value: 0.5931378373772023 and parameters: {'n_estimators': 140, 'max_depth': 7, 'learning_rate': 0.050347028220663906, 'gamma': 3.4278190695103445, 'min_child_weight': 7, 'subsample': 0.8429386995389798, 'colsample_bytree': 0.5647746329140573, 'reg_alpha': 0.7222594894975174, 'reg_lambda': 0.725243643943771}. Best is trial 625 with value: 0.5940826637391339.
[I 2024-11-06 22:17:00,598] Trial 705 finished with value: 0.5931990320657435 and parameters: {'n_estimators': 142, 'max_depth': 7, 'learning_rate': 0.1396353314356395, 'gamma': 3.589437290016187, 'min_child_weight': 7, 'subsample': 0.8739049657880811, 'colsample_bytree': 0.6727029085320055, 'reg_alpha': 0.6789755607643567, 'reg_lambda': 0.7453877757426565}. Best is trial 625 with value: 0.5940826637391339.
[I 2024-11-06 22:17:06,154] Trial 706 finished with value: 0.5939393166343132 and parameters: {'n_estimators': 127, 'max_depth': 7, 'learning_rate': 0.04538176624744627, 'gamma': 3.6956327711099375, 'min_child_weight': 7, 'subsample': 0.8868942528206706, 'colsample_bytree': 0.5759180229095667, 'reg_alpha': 0.7397359372637242, 'reg_lambda': 0.7078899319237757}. Best is trial 625 with value: 0.5940826637391339.
[I 2024-11-06 22:17:10,276] Trial 707 finished with value: 0.5931601095626415 and parameters: {'n_estimators': 124, 'max_depth': 7, 'learning_rate': 0.035845612380707916, 'gamma': 3.6974299789824188, 'min_child_weight': 8, 'subsample': 0.8955070416467636, 'colsample_bytree': 0.5696660553606664, 'reg_alpha': 0.7555732944933409, 'reg_lambda': 0.7821917678351819}. Best is trial 625 with value: 0.5940826637391339.
[I 2024-11-06 22:17:14,131] Trial 708 finished with value: 0.5932747127033341 and parameters: {'n_estimators': 120, 'max_depth': 7, 'learning_rate': 0.042816027811513155, 'gamma': 3.608263498061014, 'min_child_weight': 7, 'subsample': 0.890103174766631, 'colsample_bytree': 0.5618247982107745, 'reg_alpha': 0.7444988150295911, 'reg_lambda': 0.7626351026136161}. Best is trial 625 with value: 0.5940826637391339.
[I 2024-11-06 22:17:17,923] Trial 709 finished with value: 0.5929403491227974 and parameters: {'n_estimators': 124, 'max_depth': 7, 'learning_rate': 0.044992276767975826, 'gamma': 3.477660696900652, 'min_child_weight': 7, 'subsample': 0.8356929130266588, 'colsample_bytree': 0.5780496270384403, 'reg_alpha': 0.735399012253527, 'reg_lambda': 0.7192143087305015}. Best is trial 625 with value: 0.5940826637391339.
[I 2024-11-06 22:17:22,387] Trial 710 finished with value: 0.5933719172342087 and parameters: {'n_estimators': 125, 'max_depth': 9, 'learning_rate': 0.04013591910065888, 'gamma': 3.7227674537484208, 'min_child_weight': 6, 'subsample': 0.853307242286709, 'colsample_bytree': 0.5744399291987654, 'reg_alpha': 0.7604862411452469, 'reg_lambda': 0.7410943541968341}. Best is trial 625 with value: 0.5940826637391339.
[I 2024-11-06 22:17:24,870] Trial 711 finished with value: 0.5922030933037808 and parameters: {'n_estimators': 110, 'max_depth': 7, 'learning_rate': 0.2353952383914214, 'gamma': 3.5620648106875605, 'min_child_weight': 7, 'subsample': 0.8657723180159729, 'colsample_bytree': 0.9999842991194894, 'reg_alpha': 0.7302395220694693, 'reg_lambda': 0.3530602734229223}. Best is trial 625 with value: 0.5940826637391339.
[I 2024-11-06 22:17:28,984] Trial 712 finished with value: 0.5936286984207951 and parameters: {'n_estimators': 115, 'max_depth': 7, 'learning_rate': 0.03236425124854289, 'gamma': 3.7442421640537114, 'min_child_weight': 7, 'subsample': 0.87578494250943, 'colsample_bytree': 0.5974886248436762, 'reg_alpha': 0.6184913187827189, 'reg_lambda': 0.7052431047022767}. Best is trial 625 with value: 0.5940826637391339.
[I 2024-11-06 22:17:33,209] Trial 713 finished with value: 0.5937270894331708 and parameters: {'n_estimators': 126, 'max_depth': 7, 'learning_rate': 0.047551932074115864, 'gamma': 3.632724819852911, 'min_child_weight': 6, 'subsample': 0.8884686247553406, 'colsample_bytree': 0.5580894111345117, 'reg_alpha': 0.7130931947642764, 'reg_lambda': 0.7307800936318198}. Best is trial 625 with value: 0.5940826637391339.
[I 2024-11-06 22:17:37,054] Trial 714 finished with value: 0.5935080444118087 and parameters: {'n_estimators': 130, 'max_depth': 6, 'learning_rate': 0.05290297097659929, 'gamma': 3.2934608909734666, 'min_child_weight': 7, 'subsample': 0.8609689176046593, 'colsample_bytree': 0.5751400300104359, 'reg_alpha': 0.7649181438140403, 'reg_lambda': 0.7055618613439987}. Best is trial 625 with value: 0.5940826637391339.
[I 2024-11-06 22:17:41,335] Trial 715 finished with value: 0.5931430611084104 and parameters: {'n_estimators': 132, 'max_depth': 7, 'learning_rate': 0.037112688395216926, 'gamma': 3.4133015569940515, 'min_child_weight': 7, 'subsample': 0.8497607470789248, 'colsample_bytree': 0.5843945495684264, 'reg_alpha': 0.7351170273084021, 'reg_lambda': 0.7568577504613861}. Best is trial 625 with value: 0.5940826637391339.
[I 2024-11-06 22:17:45,532] Trial 716 finished with value: 0.5940039554493207 and parameters: {'n_estimators': 135, 'max_depth': 7, 'learning_rate': 0.04783237945396687, 'gamma': 3.7505908433834168, 'min_child_weight': 5, 'subsample': 0.8732439949818344, 'colsample_bytree': 0.5667107345132495, 'reg_alpha': 0.6368003455959661, 'reg_lambda': 0.789320188175293}. Best is trial 625 with value: 0.5940826637391339.
[I 2024-11-06 22:17:50,419] Trial 717 finished with value: 0.59312084356354 and parameters: {'n_estimators': 136, 'max_depth': 7, 'learning_rate': 0.028026278953441727, 'gamma': 3.761526434841446, 'min_child_weight': 5, 'subsample': 0.8685586924220976, 'colsample_bytree': 0.5658777529067366, 'reg_alpha': 0.5984201545190989, 'reg_lambda': 0.7798243708075755}. Best is trial 625 with value: 0.5940826637391339.
[I 2024-11-06 22:17:54,715] Trial 718 finished with value: 0.5932390127684053 and parameters: {'n_estimators': 129, 'max_depth': 7, 'learning_rate': 0.04391286305609866, 'gamma': 3.6576606249079844, 'min_child_weight': 5, 'subsample': 0.8575157200346419, 'colsample_bytree': 0.5588730472169894, 'reg_alpha': 0.5892764092706897, 'reg_lambda': 0.8004397304306559}. Best is trial 625 with value: 0.5940826637391339.
[I 2024-11-06 22:17:59,149] Trial 719 finished with value: 0.5930495974871733 and parameters: {'n_estimators': 138, 'max_depth': 7, 'learning_rate': 0.039794244243359395, 'gamma': 3.5194693867313775, 'min_child_weight': 5, 'subsample': 0.8717747966340625, 'colsample_bytree': 0.737221678776528, 'reg_alpha': 0.6348408011898684, 'reg_lambda': 0.8131540902894006}. Best is trial 625 with value: 0.5940826637391339.
[I 2024-11-06 22:18:04,423] Trial 720 finished with value: 0.5931897655866749 and parameters: {'n_estimators': 141, 'max_depth': 6, 'learning_rate': 0.0464088760600488, 'gamma': 3.6948533590942376, 'min_child_weight': 5, 'subsample': 0.8403351613768212, 'colsample_bytree': 0.5594474200117227, 'reg_alpha': 0.6407114112399731, 'reg_lambda': 0.7922862620778924}. Best is trial 625 with value: 0.5940826637391339.
[I 2024-11-06 22:18:08,793] Trial 721 finished with value: 0.5933756764668584 and parameters: {'n_estimators': 134, 'max_depth': 7, 'learning_rate': 0.033843693601252584, 'gamma': 3.8216201585192944, 'min_child_weight': 5, 'subsample': 0.8549578862585016, 'colsample_bytree': 0.5662561470178882, 'reg_alpha': 0.6119801373183718, 'reg_lambda': 0.7905612616148702}. Best is trial 625 with value: 0.5940826637391339.
[I 2024-11-06 22:18:13,199] Trial 722 finished with value: 0.5926752851349187 and parameters: {'n_estimators': 120, 'max_depth': 7, 'learning_rate': 0.010503373503278018, 'gamma': 3.8047651493981025, 'min_child_weight': 5, 'subsample': 0.8655479366334731, 'colsample_bytree': 0.5727216882433906, 'reg_alpha': 0.7498208947472538, 'reg_lambda': 0.8278144461092152}. Best is trial 625 with value: 0.5940826637391339.
[I 2024-11-06 22:18:17,660] Trial 723 finished with value: 0.5939009858683567 and parameters: {'n_estimators': 142, 'max_depth': 7, 'learning_rate': 0.04871819012748907, 'gamma': 3.623789736927463, 'min_child_weight': 5, 'subsample': 0.8789996080065309, 'colsample_bytree': 0.5576538802938437, 'reg_alpha': 0.6121522379428402, 'reg_lambda': 0.7690395591113093}. Best is trial 625 with value: 0.5940826637391339.
[I 2024-11-06 22:18:21,905] Trial 724 finished with value: 0.593695458628053 and parameters: {'n_estimators': 142, 'max_depth': 7, 'learning_rate': 0.053955484053750995, 'gamma': 3.6396237827010975, 'min_child_weight': 5, 'subsample': 0.8761997297507582, 'colsample_bytree': 0.556344755342008, 'reg_alpha': 0.5690840886249523, 'reg_lambda': 0.77190379435975}. Best is trial 625 with value: 0.5940826637391339.
[I 2024-11-06 22:18:26,172] Trial 725 finished with value: 0.5934280686925584 and parameters: {'n_estimators': 144, 'max_depth': 7, 'learning_rate': 0.049717638869464995, 'gamma': 3.5616669098087264, 'min_child_weight': 5, 'subsample': 0.8484423239062584, 'colsample_bytree': 0.55686282082615, 'reg_alpha': 0.6269449510054431, 'reg_lambda': 0.7902416166216467}. Best is trial 625 with value: 0.5940826637391339.
[I 2024-11-06 22:18:30,084] Trial 726 finished with value: 0.5935606020497535 and parameters: {'n_estimators': 138, 'max_depth': 7, 'learning_rate': 0.055573393173427126, 'gamma': 3.4156698616332357, 'min_child_weight': 5, 'subsample': 0.8611301731407087, 'colsample_bytree': 0.5638568066021971, 'reg_alpha': 0.5879878045900919, 'reg_lambda': 0.8073505686484652}. Best is trial 625 with value: 0.5940826637391339.
[I 2024-11-06 22:18:34,341] Trial 727 finished with value: 0.5927258881648231 and parameters: {'n_estimators': 145, 'max_depth': 7, 'learning_rate': 0.04049337651079732, 'gamma': 3.5691639161197406, 'min_child_weight': 5, 'subsample': 0.8318529077564929, 'colsample_bytree': 0.5538253900071138, 'reg_alpha': 0.6055245765385081, 'reg_lambda': 0.7734355671692948}. Best is trial 625 with value: 0.5940826637391339.
[I 2024-11-06 22:18:38,563] Trial 728 finished with value: 0.5935504133598015 and parameters: {'n_estimators': 140, 'max_depth': 7, 'learning_rate': 0.04949794465349852, 'gamma': 3.7385463208737573, 'min_child_weight': 5, 'subsample': 0.8697722126671107, 'colsample_bytree': 0.567814433163093, 'reg_alpha': 0.6161909292028052, 'reg_lambda': 0.7644743800720573}. Best is trial 625 with value: 0.5940826637391339.
[I 2024-11-06 22:18:42,475] Trial 729 finished with value: 0.5933417464087877 and parameters: {'n_estimators': 148, 'max_depth': 7, 'learning_rate': 0.055829508493128475, 'gamma': 3.511001335736423, 'min_child_weight': 5, 'subsample': 0.8781538913488287, 'colsample_bytree': 0.5584600432693948, 'reg_alpha': 0.5562305610477674, 'reg_lambda': 0.7527768582894214}. Best is trial 625 with value: 0.5940826637391339.
[I 2024-11-06 22:18:46,626] Trial 730 finished with value: 0.5936240167882093 and parameters: {'n_estimators': 136, 'max_depth': 7, 'learning_rate': 0.04685767067007455, 'gamma': 3.6725859561018375, 'min_child_weight': 5, 'subsample': 0.851129852799522, 'colsample_bytree': 0.5686553625781497, 'reg_alpha': 0.6032108064334258, 'reg_lambda': 0.8030894577164214}. Best is trial 625 with value: 0.5940826637391339.
[I 2024-11-06 22:18:51,410] Trial 731 finished with value: 0.5928564341043787 and parameters: {'n_estimators': 141, 'max_depth': 6, 'learning_rate': 0.017144498652718623, 'gamma': 1.0194365825084517, 'min_child_weight': 5, 'subsample': 0.8585341590502871, 'colsample_bytree': 0.5785776449089612, 'reg_alpha': 0.729773140743108, 'reg_lambda': 0.19572247584975933}. Best is trial 625 with value: 0.5940826637391339.
[I 2024-11-06 22:18:56,448] Trial 732 finished with value: 0.5932405217385255 and parameters: {'n_estimators': 151, 'max_depth': 7, 'learning_rate': 0.03624350432105848, 'gamma': 3.7558438513384846, 'min_child_weight': 5, 'subsample': 0.867270865153842, 'colsample_bytree': 0.6312376464922314, 'reg_alpha': 0.7071989216602738, 'reg_lambda': 0.7771784938088642}. Best is trial 625 with value: 0.5940826637391339.
[I 2024-11-06 22:19:01,497] Trial 733 finished with value: 0.5918957038472156 and parameters: {'n_estimators': 161, 'max_depth': 9, 'learning_rate': 0.043398508825600125, 'gamma': 3.6509279233327643, 'min_child_weight': 5, 'subsample': 0.8848618548584549, 'colsample_bytree': 0.5536549006907112, 'reg_alpha': 0.5798147659639304, 'reg_lambda': 0.7468595035239063}. Best is trial 625 with value: 0.5940826637391339.
[I 2024-11-06 22:19:07,751] Trial 734 finished with value: 0.5924181985015476 and parameters: {'n_estimators': 146, 'max_depth': 7, 'learning_rate': 0.028108711880024156, 'gamma': 3.341985833636455, 'min_child_weight': 5, 'subsample': 0.8432340271175097, 'colsample_bytree': 0.6157615612496692, 'reg_alpha': 0.7506666066000097, 'reg_lambda': 0.8339083265395538}. Best is trial 625 with value: 0.5940826637391339.
[I 2024-11-06 22:19:12,135] Trial 735 finished with value: 0.5928818451413275 and parameters: {'n_estimators': 156, 'max_depth': 7, 'learning_rate': 0.05801189842409929, 'gamma': 3.5286778421803087, 'min_child_weight': 5, 'subsample': 0.8740253101280638, 'colsample_bytree': 0.5717056280535189, 'reg_alpha': 0.7730130740885461, 'reg_lambda': 0.7535596247014911}. Best is trial 625 with value: 0.5940826637391339.
