[I 2024-11-06 21:57:49,455] Trial 418 finished with value: 0.5930206106767135 and parameters: {'n_estimators': 147, 'max_depth': 7, 'learning_rate': 0.048507426922832664, 'gamma': 4.879640007472807, 'min_child_weight': 7, 'subsample': 0.8507931469306814, 'colsample_bytree': 0.5433595043052516, 'reg_alpha': 0.6649476602695643, 'reg_lambda': 0.6535982537542361}. Best is trial 244 with value: 0.5939527867949647.
[I 2024-11-06 21:57:54,147] Trial 419 finished with value: 0.5927635252075243 and parameters: {'n_estimators': 155, 'max_depth': 7, 'learning_rate': 0.04059399751316682, 'gamma': 3.5486555911248177, 'min_child_weight': 7, 'subsample': 0.830241953465268, 'colsample_bytree': 0.557492537213624, 'reg_alpha': 0.6933428976024513, 'reg_lambda': 0.679366876658641}. Best is trial 244 with value: 0.5939527867949647.
[I 2024-11-06 21:57:57,867] Trial 420 finished with value: 0.5936794899695521 and parameters: {'n_estimators': 140, 'max_depth': 7, 'learning_rate': 0.05579844011860596, 'gamma': 4.999605731158494, 'min_child_weight': 7, 'subsample': 0.8626234384729173, 'colsample_bytree': 0.5953816867562818, 'reg_alpha': 0.7390980761603991, 'reg_lambda': 0.6435512686468682}. Best is trial 244 with value: 0.5939527867949647.
[I 2024-11-06 21:58:01,257] Trial 421 finished with value: 0.5934700716917563 and parameters: {'n_estimators': 139, 'max_depth': 7, 'learning_rate': 0.06858098375436071, 'gamma': 4.979844868119332, 'min_child_weight': 8, 'subsample': 0.856286980752555, 'colsample_bytree': 0.6036512874891503, 'reg_alpha': 0.741874830656522, 'reg_lambda': 0.6399370947758373}. Best is trial 244 with value: 0.5939527867949647.
[I 2024-11-06 21:58:05,792] Trial 422 finished with value: 0.5934983543356525 and parameters: {'n_estimators': 133, 'max_depth': 7, 'learning_rate': 0.057660420053032256, 'gamma': 4.997371463906198, 'min_child_weight': 7, 'subsample': 0.8640114666609123, 'colsample_bytree': 0.5930740736817535, 'reg_alpha': 0.7145969630105694, 'reg_lambda': 0.616074770034526}. Best is trial 244 with value: 0.5939527867949647.
[I 2024-11-06 21:58:10,729] Trial 423 finished with value: 0.5934328059472217 and parameters: {'n_estimators': 139, 'max_depth': 7, 'learning_rate': 0.05611343707375286, 'gamma': 2.0440512934751744, 'min_child_weight': 7, 'subsample': 0.8409247727055915, 'colsample_bytree': 0.5392143407558186, 'reg_alpha': 0.752134900045017, 'reg_lambda': 0.6312921998634176}. Best is trial 244 with value: 0.5939527867949647.
[I 2024-11-06 21:58:14,071] Trial 424 finished with value: 0.5932613927707254 and parameters: {'n_estimators': 125, 'max_depth': 7, 'learning_rate': 0.06648304237601396, 'gamma': 4.904230218823654, 'min_child_weight': 7, 'subsample': 0.8499279687120594, 'colsample_bytree': 0.5524030399976975, 'reg_alpha': 0.7287537467188645, 'reg_lambda': 0.5045300598510163}. Best is trial 244 with value: 0.5939527867949647.
[I 2024-11-06 21:58:18,220] Trial 425 finished with value: 0.5938344138796339 and parameters: {'n_estimators': 144, 'max_depth': 7, 'learning_rate': 0.05106781461931138, 'gamma': 3.8501980866028402, 'min_child_weight': 7, 'subsample': 0.8631076140175792, 'colsample_bytree': 0.5668501447674646, 'reg_alpha': 0.7057815693093035, 'reg_lambda': 0.6634867058854128}. Best is trial 244 with value: 0.5939527867949647.
[I 2024-11-06 21:58:22,137] Trial 426 finished with value: 0.5936383688072728 and parameters: {'n_estimators': 142, 'max_depth': 7, 'learning_rate': 0.06197206338847448, 'gamma': 3.9185048674301535, 'min_child_weight': 6, 'subsample': 0.8648063086989873, 'colsample_bytree': 0.5989371441144407, 'reg_alpha': 0.7106142429147713, 'reg_lambda': 0.6427633906072117}. Best is trial 244 with value: 0.5939527867949647.
[I 2024-11-06 21:58:25,903] Trial 427 finished with value: 0.5937540251930615 and parameters: {'n_estimators': 142, 'max_depth': 7, 'learning_rate': 0.06534229178288836, 'gamma': 3.7860927513078777, 'min_child_weight': 6, 'subsample': 0.8640041577706373, 'colsample_bytree': 0.6169023931927683, 'reg_alpha': 0.7068347317214416, 'reg_lambda': 0.5966483777441778}. Best is trial 244 with value: 0.5939527867949647.
[I 2024-11-06 21:58:29,614] Trial 428 finished with value: 0.5933239365982803 and parameters: {'n_estimators': 133, 'max_depth': 7, 'learning_rate': 0.0672181756767215, 'gamma': 3.7051076097364444, 'min_child_weight': 6, 'subsample': 0.8639743432813718, 'colsample_bytree': 0.6076020379115504, 'reg_alpha': 0.7159111879992891, 'reg_lambda': 0.5842949313899553}. Best is trial 244 with value: 0.5939527867949647.
[I 2024-11-06 21:58:33,074] Trial 429 finished with value: 0.5935533631912928 and parameters: {'n_estimators': 141, 'max_depth': 7, 'learning_rate': 0.06393523362252992, 'gamma': 3.7969719148008396, 'min_child_weight': 6, 'subsample': 0.8652753262116473, 'colsample_bytree': 0.617681394819055, 'reg_alpha': 0.7088349981927801, 'reg_lambda': 0.5615578649478838}. Best is trial 244 with value: 0.5939527867949647.
[I 2024-11-06 21:58:35,902] Trial 430 finished with value: 0.5931743776159373 and parameters: {'n_estimators': 135, 'max_depth': 7, 'learning_rate': 0.08120334130982347, 'gamma': 3.621438702708165, 'min_child_weight': 6, 'subsample': 0.8535587158943639, 'colsample_bytree': 0.6131845435175073, 'reg_alpha': 0.6989934952209258, 'reg_lambda': 0.5983451421191516}. Best is trial 244 with value: 0.5939527867949647.
[I 2024-11-06 21:58:39,315] Trial 431 finished with value: 0.5933588352751512 and parameters: {'n_estimators': 141, 'max_depth': 7, 'learning_rate': 0.06252546850432178, 'gamma': 3.8143368254720933, 'min_child_weight': 6, 'subsample': 0.8737408503802863, 'colsample_bytree': 0.5989454487534831, 'reg_alpha': 0.7336564035603533, 'reg_lambda': 0.6069098656280391}. Best is trial 244 with value: 0.5939527867949647.
[I 2024-11-06 21:58:42,570] Trial 432 finished with value: 0.593039469531245 and parameters: {'n_estimators': 129, 'max_depth': 7, 'learning_rate': 0.0733631409178677, 'gamma': 3.88981065000357, 'min_child_weight': 6, 'subsample': 0.8478282914082522, 'colsample_bytree': 0.6212779176124363, 'reg_alpha': 0.6955336701490633, 'reg_lambda': 0.625134841533582}. Best is trial 244 with value: 0.5939527867949647.
[I 2024-11-06 21:58:46,373] Trial 433 finished with value: 0.5932391765528637 and parameters: {'n_estimators': 143, 'max_depth': 7, 'learning_rate': 0.0759600336185671, 'gamma': 3.7491481430983646, 'min_child_weight': 6, 'subsample': 0.8620043773935195, 'colsample_bytree': 0.6021915236247397, 'reg_alpha': 0.6752928879243673, 'reg_lambda': 0.6074246091724341}. Best is trial 244 with value: 0.5939527867949647.
[I 2024-11-06 21:58:49,888] Trial 434 finished with value: 0.5939689980626236 and parameters: {'n_estimators': 135, 'max_depth': 6, 'learning_rate': 0.05948987233716546, 'gamma': 3.7027550555155195, 'min_child_weight': 6, 'subsample': 0.8391370987123411, 'colsample_bytree': 0.587045473253161, 'reg_alpha': 0.7200570171248427, 'reg_lambda': 0.6473377048973511}. Best is trial 434 with value: 0.5939689980626236.
[I 2024-11-06 21:58:53,622] Trial 435 finished with value: 0.5929526868262783 and parameters: {'n_estimators': 135, 'max_depth': 6, 'learning_rate': 0.06867404652774248, 'gamma': 3.6517593765120173, 'min_child_weight': 6, 'subsample': 0.8357057816606915, 'colsample_bytree': 0.590288183023928, 'reg_alpha': 0.7247498016468391, 'reg_lambda': 0.5905597457620945}. Best is trial 434 with value: 0.5939689980626236.
[I 2024-11-06 21:58:57,477] Trial 436 finished with value: 0.5936786450095327 and parameters: {'n_estimators': 131, 'max_depth': 7, 'learning_rate': 0.06122529606542641, 'gamma': 3.5045706994439754, 'min_child_weight': 6, 'subsample': 0.8276594809508486, 'colsample_bytree': 0.6110169849882993, 'reg_alpha': 0.739482345986676, 'reg_lambda': 0.6423623114604299}. Best is trial 434 with value: 0.5939689980626236.
[I 2024-11-06 21:59:01,153] Trial 437 finished with value: 0.5929104312578226 and parameters: {'n_estimators': 120, 'max_depth': 6, 'learning_rate': 0.05861613737796665, 'gamma': 3.756148917848282, 'min_child_weight': 6, 'subsample': 0.822285222698841, 'colsample_bytree': 0.612440559211831, 'reg_alpha': 0.7061779461432628, 'reg_lambda': 0.626955954967595}. Best is trial 434 with value: 0.5939689980626236.
[I 2024-11-06 21:59:05,631] Trial 438 finished with value: 0.5928000587289712 and parameters: {'n_estimators': 124, 'max_depth': 6, 'learning_rate': 0.06069410783462885, 'gamma': 3.8323587462013777, 'min_child_weight': 6, 'subsample': 0.8321006269715777, 'colsample_bytree': 0.61978747757047, 'reg_alpha': 0.6869664408711721, 'reg_lambda': 0.5815682209334148}. Best is trial 434 with value: 0.5939689980626236.
[I 2024-11-06 21:59:09,803] Trial 439 finished with value: 0.5935961799665694 and parameters: {'n_estimators': 137, 'max_depth': 7, 'learning_rate': 0.0567372856317323, 'gamma': 3.6762949638380436, 'min_child_weight': 6, 'subsample': 0.8283885468138783, 'colsample_bytree': 0.6353747772213938, 'reg_alpha': 0.650596311147976, 'reg_lambda': 0.641023355132206}. Best is trial 434 with value: 0.5939689980626236.
[I 2024-11-06 21:59:13,680] Trial 440 finished with value: 0.5930125304093494 and parameters: {'n_estimators': 129, 'max_depth': 7, 'learning_rate': 0.06383213874992247, 'gamma': 3.4585067943363357, 'min_child_weight': 6, 'subsample': 0.8397445920136113, 'colsample_bytree': 0.5986297946635106, 'reg_alpha': 0.7300885803965509, 'reg_lambda': 0.6535633297949429}. Best is trial 434 with value: 0.5939689980626236.
[I 2024-11-06 21:59:17,756] Trial 441 finished with value: 0.593518654466011 and parameters: {'n_estimators': 138, 'max_depth': 7, 'learning_rate': 0.05296910748401669, 'gamma': 3.589987253342931, 'min_child_weight': 6, 'subsample': 0.8185878450770132, 'colsample_bytree': 0.6090551503403678, 'reg_alpha': 0.7430882934838938, 'reg_lambda': 0.45992119023915357}. Best is trial 434 with value: 0.5939689980626236.
[I 2024-11-06 21:59:20,999] Trial 442 finished with value: 0.5933337206433477 and parameters: {'n_estimators': 144, 'max_depth': 6, 'learning_rate': 0.07170291348670052, 'gamma': 3.92428596379261, 'min_child_weight': 6, 'subsample': 0.8447232582996875, 'colsample_bytree': 0.5946300084891829, 'reg_alpha': 0.3847556064084757, 'reg_lambda': 0.6131967115403187}. Best is trial 434 with value: 0.5939689980626236.
[I 2024-11-06 21:59:24,521] Trial 443 finished with value: 0.5932956134333152 and parameters: {'n_estimators': 112, 'max_depth': 6, 'learning_rate': 0.05592388546740057, 'gamma': 3.8427334607351478, 'min_child_weight': 6, 'subsample': 0.8379292974043443, 'colsample_bytree': 0.5875346645164001, 'reg_alpha': 0.7081574482305368, 'reg_lambda': 0.6357168058290494}. Best is trial 434 with value: 0.5939689980626236.
[I 2024-11-06 21:59:28,432] Trial 444 finished with value: 0.5928775162142467 and parameters: {'n_estimators': 142, 'max_depth': 6, 'learning_rate': 0.0537614293419546, 'gamma': 3.6565399497299995, 'min_child_weight': 6, 'subsample': 0.8062908813209033, 'colsample_bytree': 0.5959641851841813, 'reg_alpha': 0.686708873965746, 'reg_lambda': 0.6505560468945492}. Best is trial 434 with value: 0.5939689980626236.
[I 2024-11-06 21:59:31,772] Trial 445 finished with value: 0.5922099153569944 and parameters: {'n_estimators': 130, 'max_depth': 7, 'learning_rate': 0.08658249900659817, 'gamma': 3.2429710329613917, 'min_child_weight': 6, 'subsample': 0.8512385737340098, 'colsample_bytree': 0.6278010859231924, 'reg_alpha': 0.7489788959275209, 'reg_lambda': 0.5714403273872883}. Best is trial 434 with value: 0.5939689980626236.
[I 2024-11-06 21:59:35,499] Trial 446 finished with value: 0.5929108910754648 and parameters: {'n_estimators': 138, 'max_depth': 7, 'learning_rate': 0.06705897376101519, 'gamma': 3.8925172225541407, 'min_child_weight': 6, 'subsample': 0.828144130086563, 'colsample_bytree': 0.606600386760743, 'reg_alpha': 0.7199724025521568, 'reg_lambda': 0.620959212754135}. Best is trial 434 with value: 0.5939689980626236.
[I 2024-11-06 21:59:39,107] Trial 447 finished with value: 0.5929952901369246 and parameters: {'n_estimators': 145, 'max_depth': 7, 'learning_rate': 0.06261487745465134, 'gamma': 3.7442612207797037, 'min_child_weight': 6, 'subsample': 0.8422524687250947, 'colsample_bytree': 0.6303624963307807, 'reg_alpha': 0.6657837289817552, 'reg_lambda': 0.6580635390453436}. Best is trial 434 with value: 0.5939689980626236.
[I 2024-11-06 21:59:43,035] Trial 448 finished with value: 0.5934078307650955 and parameters: {'n_estimators': 134, 'max_depth': 7, 'learning_rate': 0.05102135143247387, 'gamma': 3.518021087135689, 'min_child_weight': 6, 'subsample': 0.8552224078745904, 'colsample_bytree': 0.5828879463093225, 'reg_alpha': 0.7625949580053347, 'reg_lambda': 0.539879072806935}. Best is trial 434 with value: 0.5939689980626236.
[I 2024-11-06 21:59:46,843] Trial 449 finished with value: 0.5928041380237108 and parameters: {'n_estimators': 146, 'max_depth': 6, 'learning_rate': 0.0595545907087819, 'gamma': 3.9528268213687783, 'min_child_weight': 6, 'subsample': 0.8500072816334411, 'colsample_bytree': 0.6157851788504274, 'reg_alpha': 0.7326613885698111, 'reg_lambda': 0.6417670477955985}. Best is trial 434 with value: 0.5939689980626236.
[I 2024-11-06 21:59:50,357] Trial 450 finished with value: 0.5934247705778928 and parameters: {'n_estimators': 140, 'max_depth': 7, 'learning_rate': 0.05084044041549798, 'gamma': 4.996557018479665, 'min_child_weight': 6, 'subsample': 0.8357865048925193, 'colsample_bytree': 0.598447284497307, 'reg_alpha': 0.7015623120327806, 'reg_lambda': 0.608030403416855}. Best is trial 434 with value: 0.5939689980626236.
[I 2024-11-06 21:59:54,173] Trial 451 finished with value: 0.5933236820273722 and parameters: {'n_estimators': 146, 'max_depth': 7, 'learning_rate': 0.05753077058736452, 'gamma': 3.785651705609524, 'min_child_weight': 8, 'subsample': 0.860460308962197, 'colsample_bytree': 0.5798258193666791, 'reg_alpha': 0.44127704821833913, 'reg_lambda': 0.6645760018429383}. Best is trial 434 with value: 0.5939689980626236.
[I 2024-11-06 21:59:57,780] Trial 452 finished with value: 0.5936374208334847 and parameters: {'n_estimators': 138, 'max_depth': 7, 'learning_rate': 0.05300551219298119, 'gamma': 4.886102240011326, 'min_child_weight': 7, 'subsample': 0.8463382656843423, 'colsample_bytree': 0.5868757748240409, 'reg_alpha': 0.7157363254474869, 'reg_lambda': 0.6302774021732185}. Best is trial 434 with value: 0.5939689980626236.
[I 2024-11-06 22:00:01,700] Trial 453 finished with value: 0.592979990361045 and parameters: {'n_estimators': 127, 'max_depth': 7, 'learning_rate': 0.07070364839861813, 'gamma': 3.3381689020038197, 'min_child_weight': 6, 'subsample': 0.8249688681502533, 'colsample_bytree': 0.6431806971408861, 'reg_alpha': 0.4847236738040517, 'reg_lambda': 0.6601971774709167}. Best is trial 434 with value: 0.5939689980626236.
[I 2024-11-06 22:00:06,992] Trial 454 finished with value: 0.5936335088642739 and parameters: {'n_estimators': 149, 'max_depth': 7, 'learning_rate': 0.04910082912298755, 'gamma': 3.995404045007692, 'min_child_weight': 7, 'subsample': 0.7971509089566556, 'colsample_bytree': 0.606462152210504, 'reg_alpha': 0.6243760668305858, 'reg_lambda': 0.6414057180906766}. Best is trial 434 with value: 0.5939689980626236.
[I 2024-11-06 22:00:09,763] Trial 455 finished with value: 0.5914345606689827 and parameters: {'n_estimators': 132, 'max_depth': 7, 'learning_rate': 0.1851400839831395, 'gamma': 3.8493265410878528, 'min_child_weight': 7, 'subsample': 0.8607755807033645, 'colsample_bytree': 0.5895470605369699, 'reg_alpha': 0.6811133295225618, 'reg_lambda': 0.6091338473724607}. Best is trial 434 with value: 0.5939689980626236.
[I 2024-11-06 22:00:13,885] Trial 456 finished with value: 0.5938614889627892 and parameters: {'n_estimators': 142, 'max_depth': 7, 'learning_rate': 0.058660478350620375, 'gamma': 3.6290175780964753, 'min_child_weight': 7, 'subsample': 0.8731933806840579, 'colsample_bytree': 0.5979537885556988, 'reg_alpha': 0.7552212509350915, 'reg_lambda': 0.5892421577111414}. Best is trial 434 with value: 0.5939689980626236.
[I 2024-11-06 22:00:16,946] Trial 457 finished with value: 0.5900116585156482 and parameters: {'n_estimators': 148, 'max_depth': 7, 'learning_rate': 0.23718137227395336, 'gamma': 3.6027685640581684, 'min_child_weight': 7, 'subsample': 0.635997332023847, 'colsample_bytree': 0.5758817961941421, 'reg_alpha': 0.767924201516746, 'reg_lambda': 0.6011473639725186}. Best is trial 434 with value: 0.5939689980626236.
[I 2024-11-06 22:00:21,027] Trial 458 finished with value: 0.593591956796542 and parameters: {'n_estimators': 135, 'max_depth': 7, 'learning_rate': 0.048339167473628854, 'gamma': 3.5099929410184587, 'min_child_weight': 7, 'subsample': 0.8766356211558707, 'colsample_bytree': 0.5886418124289158, 'reg_alpha': 0.7539171782415899, 'reg_lambda': 0.5664433215553499}. Best is trial 434 with value: 0.5939689980626236.
[I 2024-11-06 22:00:25,487] Trial 459 finished with value: 0.5937011978470916 and parameters: {'n_estimators': 142, 'max_depth': 7, 'learning_rate': 0.05489239766044226, 'gamma': 3.6833326661107844, 'min_child_weight': 7, 'subsample': 0.8559409581294183, 'colsample_bytree': 0.5732770008127159, 'reg_alpha': 0.7733957759071026, 'reg_lambda': 0.5852523374191352}. Best is trial 434 with value: 0.5939689980626236.
[I 2024-11-06 22:00:29,793] Trial 460 finished with value: 0.5927896267249606 and parameters: {'n_estimators': 139, 'max_depth': 7, 'learning_rate': 0.05789863545068764, 'gamma': 3.4489231891006646, 'min_child_weight': 7, 'subsample': 0.7467098205900122, 'colsample_bytree': 0.58039609463851, 'reg_alpha': 0.7783184509379757, 'reg_lambda': 0.5450119759906541}. Best is trial 434 with value: 0.5939689980626236.
[I 2024-11-06 22:00:33,595] Trial 461 finished with value: 0.5933707541546923 and parameters: {'n_estimators': 144, 'max_depth': 6, 'learning_rate': 0.05510291731169142, 'gamma': 3.6142012234489744, 'min_child_weight': 7, 'subsample': 0.8352124111105333, 'colsample_bytree': 0.5727311013245154, 'reg_alpha': 0.33715915362465837, 'reg_lambda': 0.5987106464481841}. Best is trial 434 with value: 0.5939689980626236.
[I 2024-11-06 22:00:37,248] Trial 462 finished with value: 0.5934097631283949 and parameters: {'n_estimators': 136, 'max_depth': 7, 'learning_rate': 0.06818164783764909, 'gamma': 3.6556321401744087, 'min_child_weight': 7, 'subsample': 0.845964168497238, 'colsample_bytree': 0.5966112847169653, 'reg_alpha': 0.7426447047253877, 'reg_lambda': 0.5732613909153678}. Best is trial 434 with value: 0.5939689980626236.
[I 2024-11-06 22:00:41,113] Trial 463 finished with value: 0.5927773523526252 and parameters: {'n_estimators': 143, 'max_depth': 8, 'learning_rate': 0.06420427955584848, 'gamma': 3.717523908851544, 'min_child_weight': 8, 'subsample': 0.8171813826199497, 'colsample_bytree': 0.5787144257166752, 'reg_alpha': 0.7408099940877447, 'reg_lambda': 0.5881628262501191}. Best is trial 434 with value: 0.5939689980626236.
[I 2024-11-06 22:00:45,131] Trial 464 finished with value: 0.593343602620716 and parameters: {'n_estimators': 125, 'max_depth': 7, 'learning_rate': 0.05408600207757242, 'gamma': 3.5039552697443606, 'min_child_weight': 7, 'subsample': 0.8535244477830917, 'colsample_bytree': 0.590296732913629, 'reg_alpha': 0.7720910673876089, 'reg_lambda': 0.5623980706112774}. Best is trial 434 with value: 0.5939689980626236.
[I 2024-11-06 22:00:49,709] Trial 465 finished with value: 0.5933923333892056 and parameters: {'n_estimators': 149, 'max_depth': 7, 'learning_rate': 0.04978724386772794, 'gamma': 3.7088520690122686, 'min_child_weight': 7, 'subsample': 0.8405509888177297, 'colsample_bytree': 0.7453467529706753, 'reg_alpha': 0.7254890241655284, 'reg_lambda': 0.5832196405938698}. Best is trial 434 with value: 0.5939689980626236.
[I 2024-11-06 22:00:53,397] Trial 466 finished with value: 0.5933074361925256 and parameters: {'n_estimators': 142, 'max_depth': 7, 'learning_rate': 0.07853053462498348, 'gamma': 3.5846395383410607, 'min_child_weight': 7, 'subsample': 0.8559645247525766, 'colsample_bytree': 0.5712300545513134, 'reg_alpha': 0.7558463922351882, 'reg_lambda': 0.5859943374242251}. Best is trial 434 with value: 0.5939689980626236.
[I 2024-11-06 22:00:57,034] Trial 467 finished with value: 0.5928954613046025 and parameters: {'n_estimators': 131, 'max_depth': 7, 'learning_rate': 0.05981542267081687, 'gamma': 3.669900693578111, 'min_child_weight': 7, 'subsample': 0.8705134610258255, 'colsample_bytree': 0.6107325617221379, 'reg_alpha': 0.6448667611192191, 'reg_lambda': 0.6130090293998113}. Best is trial 434 with value: 0.5939689980626236.
[I 2024-11-06 22:01:01,328] Trial 468 finished with value: 0.5927013854473938 and parameters: {'n_estimators': 137, 'max_depth': 7, 'learning_rate': 0.047763678414650804, 'gamma': 3.4148612767811177, 'min_child_weight': 8, 'subsample': 0.831133750570235, 'colsample_bytree': 0.6221836949554332, 'reg_alpha': 0.7851113334477483, 'reg_lambda': 0.6240984249479465}. Best is trial 434 with value: 0.5939689980626236.
[I 2024-11-06 22:01:05,292] Trial 469 finished with value: 0.5915237751026201 and parameters: {'n_estimators': 150, 'max_depth': 7, 'learning_rate': 0.21167311978628056, 'gamma': 3.7687004477525945, 'min_child_weight': 7, 'subsample': 0.8472435717069358, 'colsample_bytree': 0.5857570731921892, 'reg_alpha': 0.7382579409467795, 'reg_lambda': 0.6222184098766691}. Best is trial 434 with value: 0.5939689980626236.
[I 2024-11-06 22:01:09,045] Trial 470 finished with value: 0.5931251738876091 and parameters: {'n_estimators': 146, 'max_depth': 7, 'learning_rate': 0.05551430757009771, 'gamma': 4.776305792300878, 'min_child_weight': 7, 'subsample': 0.8617037408303809, 'colsample_bytree': 0.709531666453008, 'reg_alpha': 0.6925590468448098, 'reg_lambda': 0.5987706509073093}. Best is trial 434 with value: 0.5939689980626236.
