[I 2024-11-07 02:22:34,957] Trial 119 finished with value: 0.5940706464059413 and parameters: {'iterations': 751, 'learning_rate': 0.21583544255525716, 'depth': 8, 'l2_leaf_reg': 9.986920630880821}. Best is trial 56 with value: 0.5955351412315192.
/anaconda/envs/py38_default/lib/python3.9/site-packages/catboost/core.py:1102: FutureWarning: iteritems is deprecated and will be removed in a future version. Use .items instead.
  self._init_pool(data, label, cat_features, text_features, embedding_features, pairs, weight, group_id, group_weight, subgroup_id, pairs_weight, baseline, feature_names, thread_count)
/anaconda/envs/py38_default/lib/python3.9/site-packages/catboost/core.py:1102: FutureWarning: iteritems is deprecated and will be removed in a future version. Use .items instead.
  self._init_pool(data, label, cat_features, text_features, embedding_features, pairs, weight, group_id, group_weight, subgroup_id, pairs_weight, baseline, feature_names, thread_count)
/anaconda/envs/py38_default/lib/python3.9/site-packages/catboost/core.py:1102: FutureWarning: iteritems is deprecated and will be removed in a future version. Use .items instead.
  self._init_pool(data, label, cat_features, text_features, embedding_features, pairs, weight, group_id, group_weight, subgroup_id, pairs_weight, baseline, feature_names, thread_count)
/anaconda/envs/py38_default/lib/python3.9/site-packages/catboost/core.py:1102: FutureWarning: iteritems is deprecated and will be removed in a future version. Use .items instead.
  self._init_pool(data, label, cat_features, text_features, embedding_features, pairs, weight, group_id, group_weight, subgroup_id, pairs_weight, baseline, feature_names, thread_count)
/anaconda/envs/py38_default/lib/python3.9/site-packages/catboost/core.py:1102: FutureWarning: iteritems is deprecated and will be removed in a future version. Use .items instead.
  self._init_pool(data, label, cat_features, text_features, embedding_features, pairs, weight, group_id, group_weight, subgroup_id, pairs_weight, baseline, feature_names, thread_count)
[I 2024-11-07 02:25:11,236] Trial 120 finished with value: 0.592515254116311 and parameters: {'iterations': 716, 'learning_rate': 0.2564380701419282, 'depth': 8, 'l2_leaf_reg': 1.1619880292716431}. Best is trial 56 with value: 0.5955351412315192.
/anaconda/envs/py38_default/lib/python3.9/site-packages/catboost/core.py:1102: FutureWarning: iteritems is deprecated and will be removed in a future version. Use .items instead.
  self._init_pool(data, label, cat_features, text_features, embedding_features, pairs, weight, group_id, group_weight, subgroup_id, pairs_weight, baseline, feature_names, thread_count)
/anaconda/envs/py38_default/lib/python3.9/site-packages/catboost/core.py:1102: FutureWarning: iteritems is deprecated and will be removed in a future version. Use .items instead.
  self._init_pool(data, label, cat_features, text_features, embedding_features, pairs, weight, group_id, group_weight, subgroup_id, pairs_weight, baseline, feature_names, thread_count)
/anaconda/envs/py38_default/lib/python3.9/site-packages/catboost/core.py:1102: FutureWarning: iteritems is deprecated and will be removed in a future version. Use .items instead.
  self._init_pool(data, label, cat_features, text_features, embedding_features, pairs, weight, group_id, group_weight, subgroup_id, pairs_weight, baseline, feature_names, thread_count)
/anaconda/envs/py38_default/lib/python3.9/site-packages/catboost/core.py:1102: FutureWarning: iteritems is deprecated and will be removed in a future version. Use .items instead.
  self._init_pool(data, label, cat_features, text_features, embedding_features, pairs, weight, group_id, group_weight, subgroup_id, pairs_weight, baseline, feature_names, thread_count)
/anaconda/envs/py38_default/lib/python3.9/site-packages/catboost/core.py:1102: FutureWarning: iteritems is deprecated and will be removed in a future version. Use .items instead.
  self._init_pool(data, label, cat_features, text_features, embedding_features, pairs, weight, group_id, group_weight, subgroup_id, pairs_weight, baseline, feature_names, thread_count)
[I 2024-11-07 02:27:34,850] Trial 121 finished with value: 0.5928214685542154 and parameters: {'iterations': 817, 'learning_rate': 0.22654364345741398, 'depth': 7, 'l2_leaf_reg': 1.8875655748962608}. Best is trial 56 with value: 0.5955351412315192.
/anaconda/envs/py38_default/lib/python3.9/site-packages/catboost/core.py:1102: FutureWarning: iteritems is deprecated and will be removed in a future version. Use .items instead.
  self._init_pool(data, label, cat_features, text_features, embedding_features, pairs, weight, group_id, group_weight, subgroup_id, pairs_weight, baseline, feature_names, thread_count)
/anaconda/envs/py38_default/lib/python3.9/site-packages/catboost/core.py:1102: FutureWarning: iteritems is deprecated and will be removed in a future version. Use .items instead.
  self._init_pool(data, label, cat_features, text_features, embedding_features, pairs, weight, group_id, group_weight, subgroup_id, pairs_weight, baseline, feature_names, thread_count)
/anaconda/envs/py38_default/lib/python3.9/site-packages/catboost/core.py:1102: FutureWarning: iteritems is deprecated and will be removed in a future version. Use .items instead.
  self._init_pool(data, label, cat_features, text_features, embedding_features, pairs, weight, group_id, group_weight, subgroup_id, pairs_weight, baseline, feature_names, thread_count)
/anaconda/envs/py38_default/lib/python3.9/site-packages/catboost/core.py:1102: FutureWarning: iteritems is deprecated and will be removed in a future version. Use .items instead.
  self._init_pool(data, label, cat_features, text_features, embedding_features, pairs, weight, group_id, group_weight, subgroup_id, pairs_weight, baseline, feature_names, thread_count)
/anaconda/envs/py38_default/lib/python3.9/site-packages/catboost/core.py:1102: FutureWarning: iteritems is deprecated and will be removed in a future version. Use .items instead.
  self._init_pool(data, label, cat_features, text_features, embedding_features, pairs, weight, group_id, group_weight, subgroup_id, pairs_weight, baseline, feature_names, thread_count)
[I 2024-11-07 02:29:00,563] Trial 122 finished with value: 0.5940018443154901 and parameters: {'iterations': 678, 'learning_rate': 0.23532625173160984, 'depth': 5, 'l2_leaf_reg': 6.0073596753721406}. Best is trial 56 with value: 0.5955351412315192.
/anaconda/envs/py38_default/lib/python3.9/site-packages/catboost/core.py:1102: FutureWarning: iteritems is deprecated and will be removed in a future version. Use .items instead.
  self._init_pool(data, label, cat_features, text_features, embedding_features, pairs, weight, group_id, group_weight, subgroup_id, pairs_weight, baseline, feature_names, thread_count)
/anaconda/envs/py38_default/lib/python3.9/site-packages/catboost/core.py:1102: FutureWarning: iteritems is deprecated and will be removed in a future version. Use .items instead.
  self._init_pool(data, label, cat_features, text_features, embedding_features, pairs, weight, group_id, group_weight, subgroup_id, pairs_weight, baseline, feature_names, thread_count)
/anaconda/envs/py38_default/lib/python3.9/site-packages/catboost/core.py:1102: FutureWarning: iteritems is deprecated and will be removed in a future version. Use .items instead.
  self._init_pool(data, label, cat_features, text_features, embedding_features, pairs, weight, group_id, group_weight, subgroup_id, pairs_weight, baseline, feature_names, thread_count)
/anaconda/envs/py38_default/lib/python3.9/site-packages/catboost/core.py:1102: FutureWarning: iteritems is deprecated and will be removed in a future version. Use .items instead.
  self._init_pool(data, label, cat_features, text_features, embedding_features, pairs, weight, group_id, group_weight, subgroup_id, pairs_weight, baseline, feature_names, thread_count)
/anaconda/envs/py38_default/lib/python3.9/site-packages/catboost/core.py:1102: FutureWarning: iteritems is deprecated and will be removed in a future version. Use .items instead.
  self._init_pool(data, label, cat_features, text_features, embedding_features, pairs, weight, group_id, group_weight, subgroup_id, pairs_weight, baseline, feature_names, thread_count)
[I 2024-11-07 02:33:23,173] Trial 123 finished with value: 0.5919156277736335 and parameters: {'iterations': 870, 'learning_rate': 0.220138878071408, 'depth': 9, 'l2_leaf_reg': 1.5418384029081378}. Best is trial 56 with value: 0.5955351412315192.
/anaconda/envs/py38_default/lib/python3.9/site-packages/catboost/core.py:1102: FutureWarning: iteritems is deprecated and will be removed in a future version. Use .items instead.
  self._init_pool(data, label, cat_features, text_features, embedding_features, pairs, weight, group_id, group_weight, subgroup_id, pairs_weight, baseline, feature_names, thread_count)
/anaconda/envs/py38_default/lib/python3.9/site-packages/catboost/core.py:1102: FutureWarning: iteritems is deprecated and will be removed in a future version. Use .items instead.
  self._init_pool(data, label, cat_features, text_features, embedding_features, pairs, weight, group_id, group_weight, subgroup_id, pairs_weight, baseline, feature_names, thread_count)
/anaconda/envs/py38_default/lib/python3.9/site-packages/catboost/core.py:1102: FutureWarning: iteritems is deprecated and will be removed in a future version. Use .items instead.
  self._init_pool(data, label, cat_features, text_features, embedding_features, pairs, weight, group_id, group_weight, subgroup_id, pairs_weight, baseline, feature_names, thread_count)
/anaconda/envs/py38_default/lib/python3.9/site-packages/catboost/core.py:1102: FutureWarning: iteritems is deprecated and will be removed in a future version. Use .items instead.
  self._init_pool(data, label, cat_features, text_features, embedding_features, pairs, weight, group_id, group_weight, subgroup_id, pairs_weight, baseline, feature_names, thread_count)
/anaconda/envs/py38_default/lib/python3.9/site-packages/catboost/core.py:1102: FutureWarning: iteritems is deprecated and will be removed in a future version. Use .items instead.
  self._init_pool(data, label, cat_features, text_features, embedding_features, pairs, weight, group_id, group_weight, subgroup_id, pairs_weight, baseline, feature_names, thread_count)
[I 2024-11-07 02:35:09,835] Trial 124 finished with value: 0.5932460666876813 and parameters: {'iterations': 837, 'learning_rate': 0.20669394165910496, 'depth': 5, 'l2_leaf_reg': 1.2479705281500983}. Best is trial 56 with value: 0.5955351412315192.
/anaconda/envs/py38_default/lib/python3.9/site-packages/catboost/core.py:1102: FutureWarning: iteritems is deprecated and will be removed in a future version. Use .items instead.
  self._init_pool(data, label, cat_features, text_features, embedding_features, pairs, weight, group_id, group_weight, subgroup_id, pairs_weight, baseline, feature_names, thread_count)
/anaconda/envs/py38_default/lib/python3.9/site-packages/catboost/core.py:1102: FutureWarning: iteritems is deprecated and will be removed in a future version. Use .items instead.
  self._init_pool(data, label, cat_features, text_features, embedding_features, pairs, weight, group_id, group_weight, subgroup_id, pairs_weight, baseline, feature_names, thread_count)
/anaconda/envs/py38_default/lib/python3.9/site-packages/catboost/core.py:1102: FutureWarning: iteritems is deprecated and will be removed in a future version. Use .items instead.
  self._init_pool(data, label, cat_features, text_features, embedding_features, pairs, weight, group_id, group_weight, subgroup_id, pairs_weight, baseline, feature_names, thread_count)
/anaconda/envs/py38_default/lib/python3.9/site-packages/catboost/core.py:1102: FutureWarning: iteritems is deprecated and will be removed in a future version. Use .items instead.
  self._init_pool(data, label, cat_features, text_features, embedding_features, pairs, weight, group_id, group_weight, subgroup_id, pairs_weight, baseline, feature_names, thread_count)
/anaconda/envs/py38_default/lib/python3.9/site-packages/catboost/core.py:1102: FutureWarning: iteritems is deprecated and will be removed in a future version. Use .items instead.
  self._init_pool(data, label, cat_features, text_features, embedding_features, pairs, weight, group_id, group_weight, subgroup_id, pairs_weight, baseline, feature_names, thread_count)
[I 2024-11-07 02:41:46,359] Trial 125 finished with value: 0.5922243661544584 and parameters: {'iterations': 782, 'learning_rate': 0.19860292568755386, 'depth': 10, 'l2_leaf_reg': 3.9439095349376707}. Best is trial 56 with value: 0.5955351412315192.
/anaconda/envs/py38_default/lib/python3.9/site-packages/catboost/core.py:1102: FutureWarning: iteritems is deprecated and will be removed in a future version. Use .items instead.
  self._init_pool(data, label, cat_features, text_features, embedding_features, pairs, weight, group_id, group_weight, subgroup_id, pairs_weight, baseline, feature_names, thread_count)
/anaconda/envs/py38_default/lib/python3.9/site-packages/catboost/core.py:1102: FutureWarning: iteritems is deprecated and will be removed in a future version. Use .items instead.
  self._init_pool(data, label, cat_features, text_features, embedding_features, pairs, weight, group_id, group_weight, subgroup_id, pairs_weight, baseline, feature_names, thread_count)
/anaconda/envs/py38_default/lib/python3.9/site-packages/catboost/core.py:1102: FutureWarning: iteritems is deprecated and will be removed in a future version. Use .items instead.
  self._init_pool(data, label, cat_features, text_features, embedding_features, pairs, weight, group_id, group_weight, subgroup_id, pairs_weight, baseline, feature_names, thread_count)
/anaconda/envs/py38_default/lib/python3.9/site-packages/catboost/core.py:1102: FutureWarning: iteritems is deprecated and will be removed in a future version. Use .items instead.
  self._init_pool(data, label, cat_features, text_features, embedding_features, pairs, weight, group_id, group_weight, subgroup_id, pairs_weight, baseline, feature_names, thread_count)
/anaconda/envs/py38_default/lib/python3.9/site-packages/catboost/core.py:1102: FutureWarning: iteritems is deprecated and will be removed in a future version. Use .items instead.
  self._init_pool(data, label, cat_features, text_features, embedding_features, pairs, weight, group_id, group_weight, subgroup_id, pairs_weight, baseline, feature_names, thread_count)
[I 2024-11-07 02:43:41,873] Trial 126 finished with value: 0.594128593735146 and parameters: {'iterations': 897, 'learning_rate': 0.19034725667308328, 'depth': 5, 'l2_leaf_reg': 2.6175799536118927}. Best is trial 56 with value: 0.5955351412315192.
/anaconda/envs/py38_default/lib/python3.9/site-packages/catboost/core.py:1102: FutureWarning: iteritems is deprecated and will be removed in a future version. Use .items instead.
  self._init_pool(data, label, cat_features, text_features, embedding_features, pairs, weight, group_id, group_weight, subgroup_id, pairs_weight, baseline, feature_names, thread_count)
/anaconda/envs/py38_default/lib/python3.9/site-packages/catboost/core.py:1102: FutureWarning: iteritems is deprecated and will be removed in a future version. Use .items instead.
  self._init_pool(data, label, cat_features, text_features, embedding_features, pairs, weight, group_id, group_weight, subgroup_id, pairs_weight, baseline, feature_names, thread_count)
/anaconda/envs/py38_default/lib/python3.9/site-packages/catboost/core.py:1102: FutureWarning: iteritems is deprecated and will be removed in a future version. Use .items instead.
  self._init_pool(data, label, cat_features, text_features, embedding_features, pairs, weight, group_id, group_weight, subgroup_id, pairs_weight, baseline, feature_names, thread_count)
/anaconda/envs/py38_default/lib/python3.9/site-packages/catboost/core.py:1102: FutureWarning: iteritems is deprecated and will be removed in a future version. Use .items instead.
  self._init_pool(data, label, cat_features, text_features, embedding_features, pairs, weight, group_id, group_weight, subgroup_id, pairs_weight, baseline, feature_names, thread_count)
/anaconda/envs/py38_default/lib/python3.9/site-packages/catboost/core.py:1102: FutureWarning: iteritems is deprecated and will be removed in a future version. Use .items instead.
  self._init_pool(data, label, cat_features, text_features, embedding_features, pairs, weight, group_id, group_weight, subgroup_id, pairs_weight, baseline, feature_names, thread_count)
[I 2024-11-07 02:45:42,050] Trial 127 finished with value: 0.5942349892878543 and parameters: {'iterations': 924, 'learning_rate': 0.21200446137087467, 'depth': 5, 'l2_leaf_reg': 5.49453996748441}. Best is trial 56 with value: 0.5955351412315192.
/anaconda/envs/py38_default/lib/python3.9/site-packages/catboost/core.py:1102: FutureWarning: iteritems is deprecated and will be removed in a future version. Use .items instead.
  self._init_pool(data, label, cat_features, text_features, embedding_features, pairs, weight, group_id, group_weight, subgroup_id, pairs_weight, baseline, feature_names, thread_count)
/anaconda/envs/py38_default/lib/python3.9/site-packages/catboost/core.py:1102: FutureWarning: iteritems is deprecated and will be removed in a future version. Use .items instead.
  self._init_pool(data, label, cat_features, text_features, embedding_features, pairs, weight, group_id, group_weight, subgroup_id, pairs_weight, baseline, feature_names, thread_count)
/anaconda/envs/py38_default/lib/python3.9/site-packages/catboost/core.py:1102: FutureWarning: iteritems is deprecated and will be removed in a future version. Use .items instead.
  self._init_pool(data, label, cat_features, text_features, embedding_features, pairs, weight, group_id, group_weight, subgroup_id, pairs_weight, baseline, feature_names, thread_count)
/anaconda/envs/py38_default/lib/python3.9/site-packages/catboost/core.py:1102: FutureWarning: iteritems is deprecated and will be removed in a future version. Use .items instead.
  self._init_pool(data, label, cat_features, text_features, embedding_features, pairs, weight, group_id, group_weight, subgroup_id, pairs_weight, baseline, feature_names, thread_count)
/anaconda/envs/py38_default/lib/python3.9/site-packages/catboost/core.py:1102: FutureWarning: iteritems is deprecated and will be removed in a future version. Use .items instead.
  self._init_pool(data, label, cat_features, text_features, embedding_features, pairs, weight, group_id, group_weight, subgroup_id, pairs_weight, baseline, feature_names, thread_count)
[I 2024-11-07 02:47:05,559] Trial 128 finished with value: 0.593831175279774 and parameters: {'iterations': 652, 'learning_rate': 0.2386115879714532, 'depth': 5, 'l2_leaf_reg': 1.4569329206665502}. Best is trial 56 with value: 0.5955351412315192.
/anaconda/envs/py38_default/lib/python3.9/site-packages/catboost/core.py:1102: FutureWarning: iteritems is deprecated and will be removed in a future version. Use .items instead.
  self._init_pool(data, label, cat_features, text_features, embedding_features, pairs, weight, group_id, group_weight, subgroup_id, pairs_weight, baseline, feature_names, thread_count)
/anaconda/envs/py38_default/lib/python3.9/site-packages/catboost/core.py:1102: FutureWarning: iteritems is deprecated and will be removed in a future version. Use .items instead.
  self._init_pool(data, label, cat_features, text_features, embedding_features, pairs, weight, group_id, group_weight, subgroup_id, pairs_weight, baseline, feature_names, thread_count)
/anaconda/envs/py38_default/lib/python3.9/site-packages/catboost/core.py:1102: FutureWarning: iteritems is deprecated and will be removed in a future version. Use .items instead.
  self._init_pool(data, label, cat_features, text_features, embedding_features, pairs, weight, group_id, group_weight, subgroup_id, pairs_weight, baseline, feature_names, thread_count)
/anaconda/envs/py38_default/lib/python3.9/site-packages/catboost/core.py:1102: FutureWarning: iteritems is deprecated and will be removed in a future version. Use .items instead.
  self._init_pool(data, label, cat_features, text_features, embedding_features, pairs, weight, group_id, group_weight, subgroup_id, pairs_weight, baseline, feature_names, thread_count)
/anaconda/envs/py38_default/lib/python3.9/site-packages/catboost/core.py:1102: FutureWarning: iteritems is deprecated and will be removed in a future version. Use .items instead.
  self._init_pool(data, label, cat_features, text_features, embedding_features, pairs, weight, group_id, group_weight, subgroup_id, pairs_weight, baseline, feature_names, thread_count)
