[I 2024-11-06 19:19:23,171] Trial 65 finished with value: 0.5944106336648237 and parameters: {'C': 1.9952665193359125, 'solver': 'saga'}. Best is trial 0 with value: 0.5944622851684469.
[I 2024-11-06 19:19:24,805] Trial 66 finished with value: 0.5943894864545646 and parameters: {'C': 9.667966288952183, 'solver': 'liblinear'}. Best is trial 0 with value: 0.5944622851684469.
[I 2024-11-06 19:19:34,129] Trial 67 finished with value: 0.5944035662287324 and parameters: {'C': 0.7721114887406717, 'solver': 'saga'}. Best is trial 0 with value: 0.5944622851684469.
[I 2024-11-06 19:19:35,783] Trial 68 finished with value: 0.5943977600835995 and parameters: {'C': 4.342872466060508, 'solver': 'liblinear'}. Best is trial 0 with value: 0.5944622851684469.
/anaconda/envs/py38_default/lib/python3.9/site-packages/sklearn/linear_model/_sag.py:350: ConvergenceWarning: The max_iter was reached which means the coef_ did not converge
  warnings.warn(
/anaconda/envs/py38_default/lib/python3.9/site-packages/sklearn/linear_model/_sag.py:350: ConvergenceWarning: The max_iter was reached which means the coef_ did not converge
  warnings.warn(
/anaconda/envs/py38_default/lib/python3.9/site-packages/sklearn/linear_model/_sag.py:350: ConvergenceWarning: The max_iter was reached which means the coef_ did not converge
  warnings.warn(
/anaconda/envs/py38_default/lib/python3.9/site-packages/sklearn/linear_model/_sag.py:350: ConvergenceWarning: The max_iter was reached which means the coef_ did not converge
  warnings.warn(
/anaconda/envs/py38_default/lib/python3.9/site-packages/sklearn/linear_model/_sag.py:350: ConvergenceWarning: The max_iter was reached which means the coef_ did not converge
  warnings.warn(
[I 2024-11-06 19:19:54,648] Trial 69 finished with value: 0.5944106490062745 and parameters: {'C': 3.0307287680884243, 'solver': 'saga'}. Best is trial 0 with value: 0.5944622851684469.
/anaconda/envs/py38_default/lib/python3.9/site-packages/sklearn/linear_model/_sag.py:350: ConvergenceWarning: The max_iter was reached which means the coef_ did not converge
  warnings.warn(
/anaconda/envs/py38_default/lib/python3.9/site-packages/sklearn/linear_model/_sag.py:350: ConvergenceWarning: The max_iter was reached which means the coef_ did not converge
  warnings.warn(
/anaconda/envs/py38_default/lib/python3.9/site-packages/sklearn/linear_model/_sag.py:350: ConvergenceWarning: The max_iter was reached which means the coef_ did not converge
  warnings.warn(
/anaconda/envs/py38_default/lib/python3.9/site-packages/sklearn/linear_model/_sag.py:350: ConvergenceWarning: The max_iter was reached which means the coef_ did not converge
  warnings.warn(
/anaconda/envs/py38_default/lib/python3.9/site-packages/sklearn/linear_model/_sag.py:350: ConvergenceWarning: The max_iter was reached which means the coef_ did not converge
  warnings.warn(
[I 2024-11-06 19:20:13,400] Trial 70 finished with value: 0.5944106490062745 and parameters: {'C': 2.4420477841645485, 'solver': 'saga'}. Best is trial 0 with value: 0.5944622851684469.
[I 2024-11-06 19:20:28,323] Trial 71 finished with value: 0.5944147831483135 and parameters: {'C': 1.5752036697237224, 'solver': 'saga'}. Best is trial 0 with value: 0.5944622851684469.
[I 2024-11-06 19:20:41,576] Trial 72 finished with value: 0.5944329368196948 and parameters: {'C': 1.3662126637204473, 'solver': 'saga'}. Best is trial 0 with value: 0.5944622851684469.
[I 2024-11-06 19:20:54,293] Trial 73 finished with value: 0.5944329368196948 and parameters: {'C': 1.264403872167261, 'solver': 'saga'}. Best is trial 0 with value: 0.5944622851684469.
[I 2024-11-06 19:20:59,703] Trial 74 finished with value: 0.5943771449936177 and parameters: {'C': 0.3657502086058928, 'solver': 'saga'}. Best is trial 0 with value: 0.5944622851684469.
[I 2024-11-06 19:21:01,491] Trial 75 finished with value: 0.5943961423558287 and parameters: {'C': 1.8576940142816918, 'solver': 'liblinear'}. Best is trial 0 with value: 0.5944622851684469.
[I 2024-11-06 19:21:09,951] Trial 76 finished with value: 0.5944133968162141 and parameters: {'C': 0.6564894569995816, 'solver': 'saga'}. Best is trial 0 with value: 0.5944622851684469.
[I 2024-11-06 19:21:21,692] Trial 77 finished with value: 0.5944231726540832 and parameters: {'C': 1.0250795835313695, 'solver': 'saga'}. Best is trial 0 with value: 0.5944622851684469.
[I 2024-11-06 19:21:23,369] Trial 78 finished with value: 0.5942152287617354 and parameters: {'C': 0.2320484722554747, 'solver': 'liblinear'}. Best is trial 0 with value: 0.5944622851684469.
[I 2024-11-06 19:21:36,562] Trial 79 finished with value: 0.5944329368196948 and parameters: {'C': 1.2503629205348172, 'solver': 'saga'}. Best is trial 0 with value: 0.5944622851684469.
[I 2024-11-06 19:21:55,038] Trial 80 finished with value: 0.5944106490062745 and parameters: {'C': 2.3096226234403945, 'solver': 'saga'}. Best is trial 0 with value: 0.5944622851684469.
[I 2024-11-06 19:22:08,248] Trial 81 finished with value: 0.5944329368196948 and parameters: {'C': 1.271321795370788, 'solver': 'saga'}. Best is trial 0 with value: 0.5944622851684469.
[I 2024-11-06 19:22:17,924] Trial 82 finished with value: 0.5944035662287324 and parameters: {'C': 0.8104697567184782, 'solver': 'saga'}. Best is trial 0 with value: 0.5944622851684469.
[I 2024-11-06 19:22:31,761] Trial 83 finished with value: 0.5944246135374919 and parameters: {'C': 1.481341923310101, 'solver': 'saga'}. Best is trial 0 with value: 0.5944622851684469.
/anaconda/envs/py38_default/lib/python3.9/site-packages/sklearn/linear_model/_sag.py:350: ConvergenceWarning: The max_iter was reached which means the coef_ did not converge
  warnings.warn(
/anaconda/envs/py38_default/lib/python3.9/site-packages/sklearn/linear_model/_sag.py:350: ConvergenceWarning: The max_iter was reached which means the coef_ did not converge
  warnings.warn(
/anaconda/envs/py38_default/lib/python3.9/site-packages/sklearn/linear_model/_sag.py:350: ConvergenceWarning: The max_iter was reached which means the coef_ did not converge
  warnings.warn(
/anaconda/envs/py38_default/lib/python3.9/site-packages/sklearn/linear_model/_sag.py:350: ConvergenceWarning: The max_iter was reached which means the coef_ did not converge
  warnings.warn(
/anaconda/envs/py38_default/lib/python3.9/site-packages/sklearn/linear_model/_sag.py:350: ConvergenceWarning: The max_iter was reached which means the coef_ did not converge
  warnings.warn(
[I 2024-11-06 19:22:50,204] Trial 84 finished with value: 0.5943951154287845 and parameters: {'C': 6.070312568841472, 'solver': 'saga'}. Best is trial 0 with value: 0.5944622851684469.
[I 2024-11-06 19:22:52,102] Trial 85 finished with value: 0.5943961423558287 and parameters: {'C': 1.7851765710692962, 'solver': 'liblinear'}. Best is trial 0 with value: 0.5944622851684469.
[I 2024-11-06 19:22:58,943] Trial 86 finished with value: 0.5944133968162141 and parameters: {'C': 0.5276322335834284, 'solver': 'saga'}. Best is trial 0 with value: 0.5944622851684469.
[I 2024-11-06 19:23:11,243] Trial 87 finished with value: 0.5944371157934436 and parameters: {'C': 1.0822818530608598, 'solver': 'saga'}. Best is trial 0 with value: 0.5944622851684469.
[I 2024-11-06 19:23:13,186] Trial 88 finished with value: 0.5944241813468227 and parameters: {'C': 0.8300057751047666, 'solver': 'liblinear'}. Best is trial 0 with value: 0.5944622851684469.
[I 2024-11-06 19:23:24,838] Trial 89 finished with value: 0.5944231726540832 and parameters: {'C': 1.0731723928050754, 'solver': 'saga'}. Best is trial 0 with value: 0.5944622851684469.
[I 2024-11-06 19:23:29,023] Trial 90 finished with value: 0.5943562956243043 and parameters: {'C': 0.2522185613128355, 'solver': 'saga'}. Best is trial 0 with value: 0.5944622851684469.
[I 2024-11-06 19:23:42,123] Trial 91 finished with value: 0.5944329368196948 and parameters: {'C': 1.294961516393131, 'solver': 'saga'}. Best is trial 0 with value: 0.5944622851684469.
[I 2024-11-06 19:23:59,457] Trial 92 finished with value: 0.5944106336648237 and parameters: {'C': 2.1292843627624203, 'solver': 'saga'}. Best is trial 0 with value: 0.5944622851684469.
[I 2024-11-06 19:24:07,661] Trial 93 finished with value: 0.5944133636911626 and parameters: {'C': 0.6052686764676982, 'solver': 'saga'}. Best is trial 0 with value: 0.5944622851684469.
[I 2024-11-06 19:24:22,399] Trial 94 finished with value: 0.5944106336648237 and parameters: {'C': 1.7250231761950086, 'solver': 'saga'}. Best is trial 0 with value: 0.5944622851684469.
[I 2024-11-06 19:24:34,138] Trial 95 finished with value: 0.5944329368196948 and parameters: {'C': 1.1689577143317347, 'solver': 'saga'}. Best is trial 0 with value: 0.5944622851684469.
[I 2024-11-06 19:24:43,922] Trial 96 finished with value: 0.5944133151909555 and parameters: {'C': 0.8448383959594103, 'solver': 'saga'}. Best is trial 0 with value: 0.5944622851684469.
[I 2024-11-06 19:24:45,327] Trial 97 finished with value: 0.5943637370069748 and parameters: {'C': 1.4294474633440144, 'solver': 'lbfgs'}. Best is trial 0 with value: 0.5944622851684469.
[I 2024-11-06 19:24:47,138] Trial 98 finished with value: 0.5944059290830698 and parameters: {'C': 1.971378272960552, 'solver': 'liblinear'}. Best is trial 0 with value: 0.5944622851684469.
[I 2024-11-06 19:24:52,866] Trial 99 finished with value: 0.5943911178500125 and parameters: {'C': 0.412256596187208, 'solver': 'saga'}. Best is trial 0 with value: 0.5944622851684469.
[I 2024-11-06 19:25:04,066] Trial 100 finished with value: 0.5944231726540832 and parameters: {'C': 1.0022299754746662, 'solver': 'saga'}. Best is trial 0 with value: 0.5944622851684469.
[I 2024-11-06 19:25:16,228] Trial 101 finished with value: 0.5944329368196948 and parameters: {'C': 1.194755145964493, 'solver': 'saga'}. Best is trial 0 with value: 0.5944622851684469.
[I 2024-11-06 19:25:30,324] Trial 102 finished with value: 0.5944147831483135 and parameters: {'C': 1.5839918809553173, 'solver': 'saga'}. Best is trial 0 with value: 0.5944622851684469.
[I 2024-11-06 19:25:43,145] Trial 103 finished with value: 0.5944329368196948 and parameters: {'C': 1.3206448141796439, 'solver': 'saga'}. Best is trial 0 with value: 0.5944622851684469.
[I 2024-11-06 19:25:46,976] Trial 104 finished with value: 0.5943604199219704 and parameters: {'C': 0.22744997913988962, 'solver': 'saga'}. Best is trial 0 with value: 0.5944622851684469.
[I 2024-11-06 19:25:54,548] Trial 105 finished with value: 0.5944133636911626 and parameters: {'C': 0.5892465504252026, 'solver': 'saga'}. Best is trial 0 with value: 0.5944622851684469.
[I 2024-11-06 19:25:56,320] Trial 106 finished with value: 0.5944075915572162 and parameters: {'C': 2.7089395393842954, 'solver': 'liblinear'}. Best is trial 0 with value: 0.5944622851684469.
/anaconda/envs/py38_default/lib/python3.9/site-packages/sklearn/linear_model/_sag.py:350: ConvergenceWarning: The max_iter was reached which means the coef_ did not converge
  warnings.warn(
/anaconda/envs/py38_default/lib/python3.9/site-packages/sklearn/linear_model/_sag.py:350: ConvergenceWarning: The max_iter was reached which means the coef_ did not converge
  warnings.warn(
/anaconda/envs/py38_default/lib/python3.9/site-packages/sklearn/linear_model/_sag.py:350: ConvergenceWarning: The max_iter was reached which means the coef_ did not converge
  warnings.warn(
/anaconda/envs/py38_default/lib/python3.9/site-packages/sklearn/linear_model/_sag.py:350: ConvergenceWarning: The max_iter was reached which means the coef_ did not converge
  warnings.warn(
/anaconda/envs/py38_default/lib/python3.9/site-packages/sklearn/linear_model/_sag.py:350: ConvergenceWarning: The max_iter was reached which means the coef_ did not converge
  warnings.warn(
[I 2024-11-06 19:26:14,095] Trial 107 finished with value: 0.5943812543139344 and parameters: {'C': 7.49521974178695, 'solver': 'saga'}. Best is trial 0 with value: 0.5944622851684469.
[I 2024-11-06 19:26:24,330] Trial 108 finished with value: 0.5944133151909555 and parameters: {'C': 0.9184611688411374, 'solver': 'saga'}. Best is trial 0 with value: 0.5944622851684469.
[I 2024-11-06 19:26:38,700] Trial 109 finished with value: 0.5944147831483135 and parameters: {'C': 1.664929165730693, 'solver': 'saga'}. Best is trial 0 with value: 0.5944622851684469.
[I 2024-11-06 19:26:40,242] Trial 110 finished with value: 0.5905855926842258 and parameters: {'C': 0.00959473822098511, 'solver': 'liblinear'}. Best is trial 0 with value: 0.5944622851684469.
[I 2024-11-06 19:26:52,193] Trial 111 finished with value: 0.5944329368196948 and parameters: {'C': 1.237864939605947, 'solver': 'saga'}. Best is trial 0 with value: 0.5944622851684469.
[I 2024-11-06 19:27:04,140] Trial 112 finished with value: 0.5944329368196948 and parameters: {'C': 1.2008522378196602, 'solver': 'saga'}. Best is trial 0 with value: 0.5944622851684469.
[I 2024-11-06 19:27:18,037] Trial 113 finished with value: 0.5944147831483135 and parameters: {'C': 1.5386553129553209, 'solver': 'saga'}. Best is trial 0 with value: 0.5944622851684469.
[I 2024-11-06 19:27:26,768] Trial 114 finished with value: 0.5944133968162141 and parameters: {'C': 0.7079008294729328, 'solver': 'saga'}. Best is trial 0 with value: 0.5944622851684469.
[I 2024-11-06 19:27:42,305] Trial 115 finished with value: 0.5944106336648237 and parameters: {'C': 1.9017995775732928, 'solver': 'saga'}. Best is trial 0 with value: 0.5944622851684469.
[I 2024-11-06 19:27:43,629] Trial 116 finished with value: 0.5941970719046632 and parameters: {'C': 1.3726377607244982, 'solver': 'lbfgs'}. Best is trial 0 with value: 0.5944622851684469.
[I 2024-11-06 19:27:54,339] Trial 117 finished with value: 0.5944231726540832 and parameters: {'C': 0.9876931243050137, 'solver': 'saga'}. Best is trial 0 with value: 0.5944622851684469.
[I 2024-11-06 19:28:00,276] Trial 118 finished with value: 0.594409218038253 and parameters: {'C': 0.4581275066103908, 'solver': 'saga'}. Best is trial 0 with value: 0.5944622851684469.
[I 2024-11-06 19:28:02,017] Trial 119 finished with value: 0.5944116215722328 and parameters: {'C': 2.1615143945537554, 'solver': 'liblinear'}. Best is trial 0 with value: 0.5944622851684469.
[I 2024-11-06 19:28:11,718] Trial 120 finished with value: 0.5944035662287324 and parameters: {'C': 0.8241931631785064, 'solver': 'saga'}. Best is trial 0 with value: 0.5944622851684469.
[I 2024-11-06 19:28:24,170] Trial 121 finished with value: 0.5944329368196948 and parameters: {'C': 1.3043474802526696, 'solver': 'saga'}. Best is trial 0 with value: 0.5944622851684469.
/anaconda/envs/py38_default/lib/python3.9/site-packages/sklearn/linear_model/_sag.py:350: ConvergenceWarning: The max_iter was reached which means the coef_ did not converge
  warnings.warn(
/anaconda/envs/py38_default/lib/python3.9/site-packages/sklearn/linear_model/_sag.py:350: ConvergenceWarning: The max_iter was reached which means the coef_ did not converge
  warnings.warn(
/anaconda/envs/py38_default/lib/python3.9/site-packages/sklearn/linear_model/_sag.py:350: ConvergenceWarning: The max_iter was reached which means the coef_ did not converge
  warnings.warn(
/anaconda/envs/py38_default/lib/python3.9/site-packages/sklearn/linear_model/_sag.py:350: ConvergenceWarning: The max_iter was reached which means the coef_ did not converge
  warnings.warn(
/anaconda/envs/py38_default/lib/python3.9/site-packages/sklearn/linear_model/_sag.py:350: ConvergenceWarning: The max_iter was reached which means the coef_ did not converge
  warnings.warn(
[I 2024-11-06 19:28:41,584] Trial 122 finished with value: 0.59437139022617 and parameters: {'C': 9.159278316499872, 'solver': 'saga'}. Best is trial 0 with value: 0.5944622851684469.
[I 2024-11-06 19:28:52,842] Trial 123 finished with value: 0.5944371157934436 and parameters: {'C': 1.0828551642134538, 'solver': 'saga'}. Best is trial 0 with value: 0.5944622851684469.
[I 2024-11-06 19:29:04,662] Trial 124 finished with value: 0.5944329368196948 and parameters: {'C': 1.1295073632361154, 'solver': 'saga'}. Best is trial 0 with value: 0.5944622851684469.
[I 2024-11-06 19:29:12,386] Trial 125 finished with value: 0.5944134293398544 and parameters: {'C': 0.6183610178975181, 'solver': 'saga'}. Best is trial 0 with value: 0.5944622851684469.
[I 2024-11-06 19:29:27,036] Trial 126 finished with value: 0.5944106336648237 and parameters: {'C': 1.7859566025512965, 'solver': 'saga'}. Best is trial 0 with value: 0.5944622851684469.
[I 2024-11-06 19:29:37,559] Trial 127 finished with value: 0.5944231726540832 and parameters: {'C': 0.9751234922365175, 'solver': 'saga'}. Best is trial 0 with value: 0.5944622851684469.
[I 2024-11-06 19:29:50,676] Trial 128 finished with value: 0.5944246135374919 and parameters: {'C': 1.4653890235177862, 'solver': 'saga'}. Best is trial 0 with value: 0.5944622851684469.
[I 2024-11-06 19:29:52,242] Trial 129 finished with value: 0.5942291921090719 and parameters: {'C': 0.23660235150130587, 'solver': 'liblinear'}. Best is trial 0 with value: 0.5944622851684469.
[I 2024-11-06 19:30:00,846] Trial 130 finished with value: 0.5944035662287324 and parameters: {'C': 0.7554187341572114, 'solver': 'saga'}. Best is trial 0 with value: 0.5944622851684469.
[I 2024-11-06 19:30:13,665] Trial 131 finished with value: 0.5944329368196948 and parameters: {'C': 1.3377429559715013, 'solver': 'saga'}. Best is trial 0 with value: 0.5944622851684469.
[I 2024-11-06 19:30:25,413] Trial 132 finished with value: 0.5944329368196948 and parameters: {'C': 1.1585608345682488, 'solver': 'saga'}. Best is trial 0 with value: 0.5944622851684469.
[I 2024-11-06 19:30:39,224] Trial 133 finished with value: 0.5944147831483135 and parameters: {'C': 1.6447667848502299, 'solver': 'saga'}. Best is trial 0 with value: 0.5944622851684469.
[I 2024-11-06 19:30:49,473] Trial 134 finished with value: 0.5944133151909555 and parameters: {'C': 0.9107694713053385, 'solver': 'saga'}. Best is trial 0 with value: 0.5944622851684469.
[I 2024-11-06 19:31:02,608] Trial 135 finished with value: 0.5944287750330204 and parameters: {'C': 1.4087642314592623, 'solver': 'saga'}. Best is trial 0 with value: 0.5944622851684469.
[I 2024-11-06 19:31:14,694] Trial 136 finished with value: 0.5944329368196948 and parameters: {'C': 1.1734349373598831, 'solver': 'saga'}. Best is trial 0 with value: 0.5944622851684469.
[I 2024-11-06 19:31:16,135] Trial 137 finished with value: 0.594249526103303 and parameters: {'C': 0.5413643245240298, 'solver': 'lbfgs'}. Best is trial 0 with value: 0.5944622851684469.
[I 2024-11-06 19:31:31,631] Trial 138 finished with value: 0.5944106336648237 and parameters: {'C': 1.9396127544867066, 'solver': 'saga'}. Best is trial 0 with value: 0.5944622851684469.
[I 2024-11-06 19:31:33,473] Trial 139 finished with value: 0.5943904442274052 and parameters: {'C': 1.584323822649624, 'solver': 'liblinear'}. Best is trial 0 with value: 0.5944622851684469.
/anaconda/envs/py38_default/lib/python3.9/site-packages/sklearn/linear_model/_sag.py:350: ConvergenceWarning: The max_iter was reached which means the coef_ did not converge
  warnings.warn(
/anaconda/envs/py38_default/lib/python3.9/site-packages/sklearn/linear_model/_sag.py:350: ConvergenceWarning: The max_iter was reached which means the coef_ did not converge
  warnings.warn(
/anaconda/envs/py38_default/lib/python3.9/site-packages/sklearn/linear_model/_sag.py:350: ConvergenceWarning: The max_iter was reached which means the coef_ did not converge
  warnings.warn(
/anaconda/envs/py38_default/lib/python3.9/site-packages/sklearn/linear_model/_sag.py:350: ConvergenceWarning: The max_iter was reached which means the coef_ did not converge
  warnings.warn(
/anaconda/envs/py38_default/lib/python3.9/site-packages/sklearn/linear_model/_sag.py:350: ConvergenceWarning: The max_iter was reached which means the coef_ did not converge
  warnings.warn(
[I 2024-11-06 19:31:51,303] Trial 140 finished with value: 0.5944008179293435 and parameters: {'C': 4.911710543499726, 'solver': 'saga'}. Best is trial 0 with value: 0.5944622851684469.
[I 2024-11-06 19:32:02,419] Trial 141 finished with value: 0.5944231726540832 and parameters: {'C': 1.0279042278755015, 'solver': 'saga'}. Best is trial 0 with value: 0.5944622851684469.
[I 2024-11-06 19:32:14,461] Trial 142 finished with value: 0.5944329368196948 and parameters: {'C': 1.1960567097929256, 'solver': 'saga'}. Best is trial 0 with value: 0.5944622851684469.
[I 2024-11-06 19:32:22,995] Trial 143 finished with value: 0.5944035662287324 and parameters: {'C': 0.7207465452292926, 'solver': 'saga'}. Best is trial 0 with value: 0.5944622851684469.
[I 2024-11-06 19:32:35,843] Trial 144 finished with value: 0.5944329368196948 and parameters: {'C': 1.3700514128947319, 'solver': 'saga'}. Best is trial 0 with value: 0.5944622851684469.
[I 2024-11-06 19:32:41,289] Trial 145 finished with value: 0.5943911294669993 and parameters: {'C': 0.3858670098736665, 'solver': 'saga'}. Best is trial 0 with value: 0.5944622851684469.
/anaconda/envs/py38_default/lib/python3.9/site-packages/sklearn/linear_model/_sag.py:350: ConvergenceWarning: The max_iter was reached which means the coef_ did not converge
  warnings.warn(
/anaconda/envs/py38_default/lib/python3.9/site-packages/sklearn/linear_model/_sag.py:350: ConvergenceWarning: The max_iter was reached which means the coef_ did not converge
  warnings.warn(
/anaconda/envs/py38_default/lib/python3.9/site-packages/sklearn/linear_model/_sag.py:350: ConvergenceWarning: The max_iter was reached which means the coef_ did not converge
  warnings.warn(
/anaconda/envs/py38_default/lib/python3.9/site-packages/sklearn/linear_model/_sag.py:350: ConvergenceWarning: The max_iter was reached which means the coef_ did not converge
  warnings.warn(
/anaconda/envs/py38_default/lib/python3.9/site-packages/sklearn/linear_model/_sag.py:350: ConvergenceWarning: The max_iter was reached which means the coef_ did not converge
  warnings.warn(
