[I 2024-11-06 20:26:46,842] Trial 132 finished with value: 0.5893152735967122 and parameters: {'n_estimators': 144, 'max_depth': 1, 'min_samples_split': 4, 'min_samples_leaf': 10}. Best is trial 113 with value: 0.5986452919600942.
[I 2024-11-06 20:26:53,318] Trial 133 finished with value: 0.5935832498635403 and parameters: {'n_estimators': 140, 'max_depth': 4, 'min_samples_split': 7, 'min_samples_leaf': 9}. Best is trial 113 with value: 0.5986452919600942.
[I 2024-11-06 20:26:57,681] Trial 134 finished with value: 0.5905147031349117 and parameters: {'n_estimators': 131, 'max_depth': 2, 'min_samples_split': 5, 'min_samples_leaf': 10}. Best is trial 113 with value: 0.5986452919600942.
[I 2024-11-06 20:27:01,219] Trial 135 finished with value: 0.5985971490992686 and parameters: {'n_estimators': 86, 'max_depth': 3, 'min_samples_split': 5, 'min_samples_leaf': 10}. Best is trial 113 with value: 0.5986452919600942.
[I 2024-11-06 20:27:05,619] Trial 136 finished with value: 0.5927584054433439 and parameters: {'n_estimators': 86, 'max_depth': 4, 'min_samples_split': 6, 'min_samples_leaf': 11}. Best is trial 113 with value: 0.5986452919600942.
[I 2024-11-06 20:27:20,093] Trial 137 finished with value: 0.5883283552089118 and parameters: {'n_estimators': 96, 'max_depth': 35, 'min_samples_split': 5, 'min_samples_leaf': 10}. Best is trial 113 with value: 0.5986452919600942.
[I 2024-11-06 20:27:23,967] Trial 138 finished with value: 0.5909764813993327 and parameters: {'n_estimators': 69, 'max_depth': 5, 'min_samples_split': 6, 'min_samples_leaf': 12}. Best is trial 113 with value: 0.5986452919600942.
[I 2024-11-06 20:27:27,710] Trial 139 finished with value: 0.5916088229219387 and parameters: {'n_estimators': 107, 'max_depth': 2, 'min_samples_split': 5, 'min_samples_leaf': 11}. Best is trial 113 with value: 0.5986452919600942.
[I 2024-11-06 20:27:31,227] Trial 140 finished with value: 0.5983100279683935 and parameters: {'n_estimators': 80, 'max_depth': 3, 'min_samples_split': 4, 'min_samples_leaf': 9}. Best is trial 113 with value: 0.5986452919600942.
[I 2024-11-06 20:27:34,480] Trial 141 finished with value: 0.5984890156785799 and parameters: {'n_estimators': 77, 'max_depth': 3, 'min_samples_split': 4, 'min_samples_leaf': 9}. Best is trial 113 with value: 0.5986452919600942.
[I 2024-11-06 20:27:38,618] Trial 142 finished with value: 0.5927512127971366 and parameters: {'n_estimators': 86, 'max_depth': 4, 'min_samples_split': 3, 'min_samples_leaf': 10}. Best is trial 113 with value: 0.5986452919600942.
[I 2024-11-06 20:27:42,086] Trial 143 finished with value: 0.5986371742674595 and parameters: {'n_estimators': 82, 'max_depth': 3, 'min_samples_split': 4, 'min_samples_leaf': 9}. Best is trial 113 with value: 0.5986452919600942.
[I 2024-11-06 20:27:44,028] Trial 144 finished with value: 0.5918218969427128 and parameters: {'n_estimators': 62, 'max_depth': 1, 'min_samples_split': 4, 'min_samples_leaf': 9}. Best is trial 113 with value: 0.5986452919600942.
[I 2024-11-06 20:27:49,025] Trial 145 finished with value: 0.5936684138274589 and parameters: {'n_estimators': 82, 'max_depth': 6, 'min_samples_split': 4, 'min_samples_leaf': 9}. Best is trial 113 with value: 0.5986452919600942.
[I 2024-11-06 20:27:51,883] Trial 146 finished with value: 0.5910571071304002 and parameters: {'n_estimators': 80, 'max_depth': 2, 'min_samples_split': 3, 'min_samples_leaf': 10}. Best is trial 113 with value: 0.5986452919600942.
[I 2024-11-06 20:27:55,123] Trial 147 finished with value: 0.598535792948306 and parameters: {'n_estimators': 76, 'max_depth': 3, 'min_samples_split': 4, 'min_samples_leaf': 7}. Best is trial 113 with value: 0.5986452919600942.
[I 2024-11-06 20:27:58,762] Trial 148 finished with value: 0.5927168421318832 and parameters: {'n_estimators': 75, 'max_depth': 4, 'min_samples_split': 3, 'min_samples_leaf': 5}. Best is trial 113 with value: 0.5986452919600942.
[I 2024-11-06 20:28:02,900] Trial 149 finished with value: 0.5928017984217269 and parameters: {'n_estimators': 71, 'max_depth': 5, 'min_samples_split': 4, 'min_samples_leaf': 7}. Best is trial 113 with value: 0.5986452919600942.
[I 2024-11-06 20:28:06,302] Trial 150 finished with value: 0.5985686828374368 and parameters: {'n_estimators': 76, 'max_depth': 3, 'min_samples_split': 4, 'min_samples_leaf': 13}. Best is trial 113 with value: 0.5986452919600942.
[I 2024-11-06 20:28:09,077] Trial 151 finished with value: 0.5978029259215071 and parameters: {'n_estimators': 67, 'max_depth': 3, 'min_samples_split': 4, 'min_samples_leaf': 13}. Best is trial 113 with value: 0.5986452919600942.
[I 2024-11-06 20:28:11,097] Trial 152 finished with value: 0.5918904436469393 and parameters: {'n_estimators': 66, 'max_depth': 1, 'min_samples_split': 4, 'min_samples_leaf': 14}. Best is trial 113 with value: 0.5986452919600942.
[I 2024-11-06 20:28:13,451] Trial 153 finished with value: 0.5922035389665794 and parameters: {'n_estimators': 65, 'max_depth': 2, 'min_samples_split': 4, 'min_samples_leaf': 13}. Best is trial 113 with value: 0.5986452919600942.
[I 2024-11-06 20:28:16,698] Trial 154 finished with value: 0.5983775815389942 and parameters: {'n_estimators': 78, 'max_depth': 3, 'min_samples_split': 3, 'min_samples_leaf': 14}. Best is trial 113 with value: 0.5986452919600942.
[I 2024-11-06 20:28:20,012] Trial 155 finished with value: 0.5984657232469455 and parameters: {'n_estimators': 77, 'max_depth': 3, 'min_samples_split': 3, 'min_samples_leaf': 4}. Best is trial 113 with value: 0.5986452919600942.
[I 2024-11-06 20:28:34,837] Trial 156 finished with value: 0.5777514672616455 and parameters: {'n_estimators': 78, 'max_depth': 28, 'min_samples_split': 2, 'min_samples_leaf': 1}. Best is trial 113 with value: 0.5986452919600942.
[I 2024-11-06 20:28:38,351] Trial 157 finished with value: 0.5948514935848183 and parameters: {'n_estimators': 55, 'max_depth': 6, 'min_samples_split': 3, 'min_samples_leaf': 15}. Best is trial 113 with value: 0.5986452919600942.
[I 2024-11-06 20:28:42,543] Trial 158 finished with value: 0.5916858632599613 and parameters: {'n_estimators': 76, 'max_depth': 5, 'min_samples_split': 3, 'min_samples_leaf': 16}. Best is trial 113 with value: 0.5986452919600942.
[I 2024-11-06 20:28:48,026] Trial 159 finished with value: 0.5944058761625877 and parameters: {'n_estimators': 82, 'max_depth': 7, 'min_samples_split': 2, 'min_samples_leaf': 4}. Best is trial 113 with value: 0.5986452919600942.
[I 2024-11-06 20:28:51,574] Trial 160 finished with value: 0.5928719871825873 and parameters: {'n_estimators': 72, 'max_depth': 4, 'min_samples_split': 4, 'min_samples_leaf': 6}. Best is trial 113 with value: 0.5986452919600942.
[I 2024-11-06 20:28:55,281] Trial 161 finished with value: 0.5984506186950472 and parameters: {'n_estimators': 90, 'max_depth': 3, 'min_samples_split': 3, 'min_samples_leaf': 13}. Best is trial 113 with value: 0.5986452919600942.
[I 2024-11-06 20:28:58,332] Trial 162 finished with value: 0.5914249400857393 and parameters: {'n_estimators': 89, 'max_depth': 2, 'min_samples_split': 3, 'min_samples_leaf': 14}. Best is trial 113 with value: 0.5986452919600942.
[I 2024-11-06 20:29:01,742] Trial 163 finished with value: 0.5983775815389942 and parameters: {'n_estimators': 78, 'max_depth': 3, 'min_samples_split': 3, 'min_samples_leaf': 14}. Best is trial 113 with value: 0.5986452919600942.
[I 2024-11-06 20:29:11,945] Trial 164 finished with value: 0.5922676617906276 and parameters: {'n_estimators': 85, 'max_depth': 16, 'min_samples_split': 3, 'min_samples_leaf': 15}. Best is trial 113 with value: 0.5986452919600942.
[I 2024-11-06 20:29:14,324] Trial 165 finished with value: 0.5917145536290467 and parameters: {'n_estimators': 78, 'max_depth': 1, 'min_samples_split': 2, 'min_samples_leaf': 14}. Best is trial 113 with value: 0.5986452919600942.
[I 2024-11-06 20:29:17,168] Trial 166 finished with value: 0.5925927396476605 and parameters: {'n_estimators': 55, 'max_depth': 4, 'min_samples_split': 3, 'min_samples_leaf': 14}. Best is trial 113 with value: 0.5986452919600942.
[I 2024-11-06 20:29:20,994] Trial 167 finished with value: 0.5984900000186254 and parameters: {'n_estimators': 93, 'max_depth': 3, 'min_samples_split': 4, 'min_samples_leaf': 13}. Best is trial 113 with value: 0.5986452919600942.
[I 2024-11-06 20:29:24,769] Trial 168 finished with value: 0.5981846462588163 and parameters: {'n_estimators': 91, 'max_depth': 3, 'min_samples_split': 3, 'min_samples_leaf': 13}. Best is trial 113 with value: 0.5986452919600942.
[I 2024-11-06 20:29:29,840] Trial 169 finished with value: 0.5906773059809097 and parameters: {'n_estimators': 92, 'max_depth': 5, 'min_samples_split': 3, 'min_samples_leaf': 13}. Best is trial 113 with value: 0.5986452919600942.
[I 2024-11-06 20:29:32,820] Trial 170 finished with value: 0.5913809716906681 and parameters: {'n_estimators': 83, 'max_depth': 2, 'min_samples_split': 2, 'min_samples_leaf': 13}. Best is trial 113 with value: 0.5986452919600942.
[I 2024-11-06 20:29:36,428] Trial 171 finished with value: 0.5984799261679379 and parameters: {'n_estimators': 88, 'max_depth': 3, 'min_samples_split': 4, 'min_samples_leaf': 13}. Best is trial 113 with value: 0.5986452919600942.
[I 2024-11-06 20:29:40,953] Trial 172 finished with value: 0.5937661995080645 and parameters: {'n_estimators': 94, 'max_depth': 4, 'min_samples_split': 4, 'min_samples_leaf': 13}. Best is trial 113 with value: 0.5986452919600942.
[I 2024-11-06 20:29:44,365] Trial 173 finished with value: 0.5914159898764424 and parameters: {'n_estimators': 100, 'max_depth': 2, 'min_samples_split': 3, 'min_samples_leaf': 14}. Best is trial 113 with value: 0.5986452919600942.
[I 2024-11-06 20:29:46,903] Trial 174 finished with value: 0.5917232621615163 and parameters: {'n_estimators': 88, 'max_depth': 1, 'min_samples_split': 4, 'min_samples_leaf': 13}. Best is trial 113 with value: 0.5986452919600942.
[I 2024-11-06 20:29:50,489] Trial 175 finished with value: 0.5928962053299115 and parameters: {'n_estimators': 74, 'max_depth': 4, 'min_samples_split': 3, 'min_samples_leaf': 14}. Best is trial 113 with value: 0.5986452919600942.
[I 2024-11-06 20:29:53,882] Trial 176 finished with value: 0.5982672842421276 and parameters: {'n_estimators': 80, 'max_depth': 3, 'min_samples_split': 4, 'min_samples_leaf': 2}. Best is trial 113 with value: 0.5986452919600942.
[I 2024-11-06 20:29:57,278] Trial 177 finished with value: 0.5982878027620789 and parameters: {'n_estimators': 79, 'max_depth': 3, 'min_samples_split': 4, 'min_samples_leaf': 2}. Best is trial 113 with value: 0.5986452919600942.
[I 2024-11-06 20:30:01,481] Trial 178 finished with value: 0.5911630822236514 and parameters: {'n_estimators': 78, 'max_depth': 5, 'min_samples_split': 4, 'min_samples_leaf': 2}. Best is trial 113 with value: 0.5986452919600942.
[I 2024-11-06 20:30:12,849] Trial 179 finished with value: 0.5899455686212274 and parameters: {'n_estimators': 81, 'max_depth': 18, 'min_samples_split': 3, 'min_samples_leaf': 2}. Best is trial 113 with value: 0.5986452919600942.
[I 2024-11-06 20:30:17,940] Trial 180 finished with value: 0.5917462633839093 and parameters: {'n_estimators': 84, 'max_depth': 6, 'min_samples_split': 3, 'min_samples_leaf': 4}. Best is trial 113 with value: 0.5986452919600942.
[I 2024-11-06 20:30:20,875] Trial 181 finished with value: 0.5978989004753974 and parameters: {'n_estimators': 69, 'max_depth': 3, 'min_samples_split': 4, 'min_samples_leaf': 3}. Best is trial 113 with value: 0.5986452919600942.
[I 2024-11-06 20:30:23,466] Trial 182 finished with value: 0.5921026234911293 and parameters: {'n_estimators': 71, 'max_depth': 2, 'min_samples_split': 4, 'min_samples_leaf': 13}. Best is trial 113 with value: 0.5986452919600942.
[I 2024-11-06 20:30:27,841] Trial 183 finished with value: 0.5935386659043175 and parameters: {'n_estimators': 90, 'max_depth': 4, 'min_samples_split': 4, 'min_samples_leaf': 3}. Best is trial 113 with value: 0.5986452919600942.
[I 2024-11-06 20:30:31,736] Trial 184 finished with value: 0.5984672361934378 and parameters: {'n_estimators': 95, 'max_depth': 3, 'min_samples_split': 3, 'min_samples_leaf': 2}. Best is trial 113 with value: 0.5986452919600942.
[I 2024-11-06 20:30:34,500] Trial 185 finished with value: 0.5914642189228052 and parameters: {'n_estimators': 95, 'max_depth': 1, 'min_samples_split': 3, 'min_samples_leaf': 2}. Best is trial 113 with value: 0.5986452919600942.
[I 2024-11-06 20:30:38,083] Trial 186 finished with value: 0.598517576756202 and parameters: {'n_estimators': 85, 'max_depth': 3, 'min_samples_split': 2, 'min_samples_leaf': 1}. Best is trial 113 with value: 0.5986452919600942.
[I 2024-11-06 20:30:41,129] Trial 187 finished with value: 0.5909050615045738 and parameters: {'n_estimators': 87, 'max_depth': 2, 'min_samples_split': 2, 'min_samples_leaf': 2}. Best is trial 113 with value: 0.5986452919600942.
[I 2024-11-06 20:30:45,061] Trial 188 finished with value: 0.5923686030904152 and parameters: {'n_estimators': 79, 'max_depth': 4, 'min_samples_split': 2, 'min_samples_leaf': 1}. Best is trial 113 with value: 0.5986452919600942.
[I 2024-11-06 20:30:49,607] Trial 189 finished with value: 0.5908561040823934 and parameters: {'n_estimators': 83, 'max_depth': 5, 'min_samples_split': 3, 'min_samples_leaf': 2}. Best is trial 113 with value: 0.5986452919600942.
[I 2024-11-06 20:31:04,764] Trial 190 finished with value: 0.5848489762461542 and parameters: {'n_estimators': 92, 'max_depth': 22, 'min_samples_split': 2, 'min_samples_leaf': 1}. Best is trial 113 with value: 0.5986452919600942.
[I 2024-11-06 20:31:08,017] Trial 191 finished with value: 0.5985908547962862 and parameters: {'n_estimators': 75, 'max_depth': 3, 'min_samples_split': 4, 'min_samples_leaf': 1}. Best is trial 113 with value: 0.5986452919600942.
[I 2024-11-06 20:31:11,311] Trial 192 finished with value: 0.5985496647084861 and parameters: {'n_estimators': 76, 'max_depth': 3, 'min_samples_split': 3, 'min_samples_leaf': 1}. Best is trial 113 with value: 0.5986452919600942.
[I 2024-11-06 20:31:14,555] Trial 193 finished with value: 0.5985908547962862 and parameters: {'n_estimators': 75, 'max_depth': 3, 'min_samples_split': 4, 'min_samples_leaf': 1}. Best is trial 113 with value: 0.5986452919600942.
[I 2024-11-06 20:31:16,773] Trial 194 finished with value: 0.5918686077264141 and parameters: {'n_estimators': 75, 'max_depth': 1, 'min_samples_split': 3, 'min_samples_leaf': 1}. Best is trial 113 with value: 0.5986452919600942.
[I 2024-11-06 20:31:20,323] Trial 195 finished with value: 0.593703147057933 and parameters: {'n_estimators': 73, 'max_depth': 4, 'min_samples_split': 4, 'min_samples_leaf': 1}. Best is trial 113 with value: 0.5986452919600942.
[I 2024-11-06 20:31:23,050] Trial 196 finished with value: 0.5918129964131911 and parameters: {'n_estimators': 77, 'max_depth': 2, 'min_samples_split': 2, 'min_samples_leaf': 1}. Best is trial 113 with value: 0.5986452919600942.
[I 2024-11-06 20:31:27,183] Trial 197 finished with value: 0.5931565348779113 and parameters: {'n_estimators': 85, 'max_depth': 4, 'min_samples_split': 3, 'min_samples_leaf': 1}. Best is trial 113 with value: 0.5986452919600942.
[I 2024-11-06 20:31:29,890] Trial 198 finished with value: 0.5918129964131911 and parameters: {'n_estimators': 77, 'max_depth': 2, 'min_samples_split': 4, 'min_samples_leaf': 1}. Best is trial 113 with value: 0.5986452919600942.
[I 2024-11-06 20:31:34,283] Trial 199 finished with value: 0.5911865260561184 and parameters: {'n_estimators': 82, 'max_depth': 5, 'min_samples_split': 4, 'min_samples_leaf': 2}. Best is trial 113 with value: 0.5986452919600942.
[I 2024-11-06 20:31:37,929] Trial 200 finished with value: 0.5983781139340757 and parameters: {'n_estimators': 88, 'max_depth': 3, 'min_samples_split': 3, 'min_samples_leaf': 2}. Best is trial 113 with value: 0.5986452919600942.
[I 2024-11-06 20:31:41,508] Trial 201 finished with value: 0.5983781139340757 and parameters: {'n_estimators': 88, 'max_depth': 3, 'min_samples_split': 3, 'min_samples_leaf': 2}. Best is trial 113 with value: 0.5986452919600942.
[I 2024-11-06 20:31:45,454] Trial 202 finished with value: 0.5984672361934378 and parameters: {'n_estimators': 95, 'max_depth': 3, 'min_samples_split': 3, 'min_samples_leaf': 1}. Best is trial 113 with value: 0.5986452919600942.
[I 2024-11-06 20:31:48,000] Trial 203 finished with value: 0.5917232621615163 and parameters: {'n_estimators': 88, 'max_depth': 1, 'min_samples_split': 3, 'min_samples_leaf': 1}. Best is trial 113 with value: 0.5986452919600942.
[I 2024-11-06 20:32:04,017] Trial 204 finished with value: 0.5837856764831704 and parameters: {'n_estimators': 93, 'max_depth': 25, 'min_samples_split': 2, 'min_samples_leaf': 2}. Best is trial 113 with value: 0.5986452919600942.
[I 2024-11-06 20:32:08,375] Trial 205 finished with value: 0.5932958123074241 and parameters: {'n_estimators': 88, 'max_depth': 4, 'min_samples_split': 3, 'min_samples_leaf': 1}. Best is trial 113 with value: 0.5986452919600942.
[I 2024-11-06 20:32:11,708] Trial 206 finished with value: 0.5915987009165378 and parameters: {'n_estimators': 96, 'max_depth': 2, 'min_samples_split': 2, 'min_samples_leaf': 3}. Best is trial 113 with value: 0.5986452919600942.
[I 2024-11-06 20:32:15,360] Trial 207 finished with value: 0.598517576756202 and parameters: {'n_estimators': 85, 'max_depth': 3, 'min_samples_split': 3, 'min_samples_leaf': 1}. Best is trial 113 with value: 0.5986452919600942.
[I 2024-11-06 20:32:19,971] Trial 208 finished with value: 0.5906665568675997 and parameters: {'n_estimators': 84, 'max_depth': 5, 'min_samples_split': 3, 'min_samples_leaf': 1}. Best is trial 113 with value: 0.5986452919600942.
[I 2024-11-06 20:32:23,369] Trial 209 finished with value: 0.5921244566900118 and parameters: {'n_estimators': 99, 'max_depth': 2, 'min_samples_split': 3, 'min_samples_leaf': 1}. Best is trial 113 with value: 0.5986452919600942.
[I 2024-11-06 20:32:27,038] Trial 210 finished with value: 0.5985119589070883 and parameters: {'n_estimators': 86, 'max_depth': 3, 'min_samples_split': 2, 'min_samples_leaf': 1}. Best is trial 113 with value: 0.5986452919600942.
[I 2024-11-06 20:32:30,733] Trial 211 finished with value: 0.5985119589070883 and parameters: {'n_estimators': 86, 'max_depth': 3, 'min_samples_split': 2, 'min_samples_leaf': 1}. Best is trial 113 with value: 0.5986452919600942.
[I 2024-11-06 20:32:34,886] Trial 212 finished with value: 0.593063865802261 and parameters: {'n_estimators': 87, 'max_depth': 4, 'min_samples_split': 2, 'min_samples_leaf': 1}. Best is trial 113 with value: 0.5986452919600942.
[I 2024-11-06 20:32:38,556] Trial 213 finished with value: 0.5983016133932442 and parameters: {'n_estimators': 90, 'max_depth': 3, 'min_samples_split': 2, 'min_samples_leaf': 2}. Best is trial 113 with value: 0.5986452919600942.
[I 2024-11-06 20:32:41,312] Trial 214 finished with value: 0.5914642189228052 and parameters: {'n_estimators': 95, 'max_depth': 1, 'min_samples_split': 2, 'min_samples_leaf': 1}. Best is trial 113 with value: 0.5986452919600942.
[I 2024-11-06 20:32:45,411] Trial 215 finished with value: 0.5930612970396546 and parameters: {'n_estimators': 86, 'max_depth': 4, 'min_samples_split': 2, 'min_samples_leaf': 4}. Best is trial 113 with value: 0.5986452919600942.
[I 2024-11-06 20:32:48,407] Trial 216 finished with value: 0.591371237145655 and parameters: {'n_estimators': 83, 'max_depth': 2, 'min_samples_split': 2, 'min_samples_leaf': 2}. Best is trial 113 with value: 0.5986452919600942.
[I 2024-11-06 20:32:53,814] Trial 217 finished with value: 0.5927171547250145 and parameters: {'n_estimators': 92, 'max_depth': 6, 'min_samples_split': 3, 'min_samples_leaf': 1}. Best is trial 113 with value: 0.5986452919600942.
[I 2024-11-06 20:32:56,954] Trial 218 finished with value: 0.5986432987743928 and parameters: {'n_estimators': 73, 'max_depth': 3, 'min_samples_split': 3, 'min_samples_leaf': 1}. Best is trial 113 with value: 0.5986452919600942.
[I 2024-11-06 20:33:01,075] Trial 219 finished with value: 0.5915326408719823 and parameters: {'n_estimators': 74, 'max_depth': 5, 'min_samples_split': 4, 'min_samples_leaf': 1}. Best is trial 113 with value: 0.5986452919600942.
[I 2024-11-06 20:33:03,690] Trial 220 finished with value: 0.5921656749015044 and parameters: {'n_estimators': 68, 'max_depth': 2, 'min_samples_split': 3, 'min_samples_leaf': 1}. Best is trial 113 with value: 0.5986452919600942.
[I 2024-11-06 20:33:07,281] Trial 221 finished with value: 0.5984747127508995 and parameters: {'n_estimators': 84, 'max_depth': 3, 'min_samples_split': 3, 'min_samples_leaf': 2}. Best is trial 113 with value: 0.5986452919600942.
[I 2024-11-06 20:33:10,903] Trial 222 finished with value: 0.5934819013128821 and parameters: {'n_estimators': 72, 'max_depth': 4, 'min_samples_split': 2, 'min_samples_leaf': 2}. Best is trial 113 with value: 0.5986452919600942.
[I 2024-11-06 20:33:27,513] Trial 223 finished with value: 0.5774011261850146 and parameters: {'n_estimators': 83, 'max_depth': 47, 'min_samples_split': 4, 'min_samples_leaf': 1}. Best is trial 113 with value: 0.5986452919600942.
[I 2024-11-06 20:33:31,077] Trial 224 finished with value: 0.598517576756202 and parameters: {'n_estimators': 85, 'max_depth': 3, 'min_samples_split': 3, 'min_samples_leaf': 1}. Best is trial 113 with value: 0.5986452919600942.
[I 2024-11-06 20:33:34,595] Trial 225 finished with value: 0.5986153128337834 and parameters: {'n_estimators': 82, 'max_depth': 3, 'min_samples_split': 3, 'min_samples_leaf': 1}. Best is trial 113 with value: 0.5986452919600942.
[I 2024-11-06 20:33:38,194] Trial 226 finished with value: 0.5930910012145963 and parameters: {'n_estimators': 74, 'max_depth': 4, 'min_samples_split': 4, 'min_samples_leaf': 1}. Best is trial 113 with value: 0.5986452919600942.
