[I 2024-11-06 22:30:42,932] Trial 895 finished with value: 0.5927472866869267 and parameters: {'n_estimators': 161, 'max_depth': 7, 'learning_rate': 0.0913371232719361, 'gamma': 4.775281915530034, 'min_child_weight': 7, 'subsample': 0.8908220477178241, 'colsample_bytree': 0.568651221988967, 'reg_alpha': 0.5286524001094038, 'reg_lambda': 0.8534661583040807}. Best is trial 829 with value: 0.5942795917588232.
[I 2024-11-06 22:30:46,406] Trial 896 finished with value: 0.5933171032594865 and parameters: {'n_estimators': 163, 'max_depth': 7, 'learning_rate': 0.07877276580614177, 'gamma': 4.881391045626111, 'min_child_weight': 7, 'subsample': 0.8722023158934185, 'colsample_bytree': 0.5802226429925881, 'reg_alpha': 0.5703374889332412, 'reg_lambda': 0.8463735000003461}. Best is trial 829 with value: 0.5942795917588232.
[I 2024-11-06 22:30:49,872] Trial 897 finished with value: 0.592824494404252 and parameters: {'n_estimators': 167, 'max_depth': 7, 'learning_rate': 0.08777223048757972, 'gamma': 4.796000493828508, 'min_child_weight': 8, 'subsample': 0.882978091073285, 'colsample_bytree': 0.5555220977563335, 'reg_alpha': 0.4935807569211376, 'reg_lambda': 0.806473968240847}. Best is trial 829 with value: 0.5942795917588232.
[I 2024-11-06 22:30:53,105] Trial 898 finished with value: 0.5931915739423876 and parameters: {'n_estimators': 161, 'max_depth': 7, 'learning_rate': 0.08335599110472426, 'gamma': 4.695996660938155, 'min_child_weight': 9, 'subsample': 0.8681344610292524, 'colsample_bytree': 0.5686413675716163, 'reg_alpha': 0.5342272796119056, 'reg_lambda': 0.8197460703931095}. Best is trial 829 with value: 0.5942795917588232.
[I 2024-11-06 22:30:56,643] Trial 899 finished with value: 0.5927922422202496 and parameters: {'n_estimators': 171, 'max_depth': 7, 'learning_rate': 0.09907381597827776, 'gamma': 4.792412850205855, 'min_child_weight': 7, 'subsample': 0.9031742262678598, 'colsample_bytree': 0.5856059402047622, 'reg_alpha': 0.4939318915083881, 'reg_lambda': 0.8133585722278057}. Best is trial 829 with value: 0.5942795917588232.
[I 2024-11-06 22:30:59,711] Trial 900 finished with value: 0.5928436029690646 and parameters: {'n_estimators': 159, 'max_depth': 7, 'learning_rate': 0.14297203578676496, 'gamma': 4.9040140662070515, 'min_child_weight': 7, 'subsample': 0.8567937119124392, 'colsample_bytree': 0.6631122864604567, 'reg_alpha': 0.533883258418111, 'reg_lambda': 0.8325895931998495}. Best is trial 829 with value: 0.5942795917588232.
[I 2024-11-06 22:31:05,124] Trial 901 finished with value: 0.5925204669782015 and parameters: {'n_estimators': 187, 'max_depth': 7, 'learning_rate': 0.07776067508001173, 'gamma': 4.900982735280183, 'min_child_weight': 7, 'subsample': 0.804071251517595, 'colsample_bytree': 0.5735026301785559, 'reg_alpha': 0.5474993114910967, 'reg_lambda': 0.8735162991632685}. Best is trial 829 with value: 0.5942795917588232.
[I 2024-11-06 22:31:09,020] Trial 902 finished with value: 0.5932591492190811 and parameters: {'n_estimators': 197, 'max_depth': 7, 'learning_rate': 0.08478096348930378, 'gamma': 4.799229503700716, 'min_child_weight': 7, 'subsample': 0.8789524347871197, 'colsample_bytree': 0.5623547806863625, 'reg_alpha': 0.526144433717187, 'reg_lambda': 0.824106869843146}. Best is trial 829 with value: 0.5942795917588232.
[I 2024-11-06 22:31:12,494] Trial 903 finished with value: 0.5929173221334542 and parameters: {'n_estimators': 168, 'max_depth': 7, 'learning_rate': 0.08001464458780892, 'gamma': 4.671945333435091, 'min_child_weight': 7, 'subsample': 0.8907395011609779, 'colsample_bytree': 0.5858071576538058, 'reg_alpha': 0.5501815952923063, 'reg_lambda': 0.7891803228986425}. Best is trial 829 with value: 0.5942795917588232.
[I 2024-11-06 22:31:17,521] Trial 904 finished with value: 0.5928152657941332 and parameters: {'n_estimators': 160, 'max_depth': 6, 'learning_rate': 0.07735120036846382, 'gamma': 0.2387879463811977, 'min_child_weight': 7, 'subsample': 0.8674548148593314, 'colsample_bytree': 0.5434920485053912, 'reg_alpha': 0.5433010664607909, 'reg_lambda': 0.8096281221513821}. Best is trial 829 with value: 0.5942795917588232.
[I 2024-11-06 22:31:20,782] Trial 905 finished with value: 0.5918939273262229 and parameters: {'n_estimators': 177, 'max_depth': 7, 'learning_rate': 0.17066873040685113, 'gamma': 4.620013774612229, 'min_child_weight': 9, 'subsample': 0.8533701039818467, 'colsample_bytree': 0.5787134420340815, 'reg_alpha': 0.5578587625185082, 'reg_lambda': 0.7977233659323024}. Best is trial 829 with value: 0.5942795917588232.
[I 2024-11-06 22:31:24,359] Trial 906 finished with value: 0.5934239885529119 and parameters: {'n_estimators': 161, 'max_depth': 7, 'learning_rate': 0.07340429211149357, 'gamma': 4.658868129424569, 'min_child_weight': 7, 'subsample': 0.8783745297474533, 'colsample_bytree': 0.5505614112441435, 'reg_alpha': 0.5236395833571211, 'reg_lambda': 0.7882334728122018}. Best is trial 829 with value: 0.5942795917588232.
[I 2024-11-06 22:31:28,062] Trial 907 finished with value: 0.5927025850033472 and parameters: {'n_estimators': 174, 'max_depth': 7, 'learning_rate': 0.07146325723094456, 'gamma': 4.492275907213035, 'min_child_weight': 8, 'subsample': 0.7911431291868712, 'colsample_bytree': 0.5653441746975691, 'reg_alpha': 0.5087469156441272, 'reg_lambda': 0.8390563999081088}. Best is trial 829 with value: 0.5942795917588232.
[I 2024-11-06 22:31:31,813] Trial 908 finished with value: 0.5935400390663732 and parameters: {'n_estimators': 167, 'max_depth': 7, 'learning_rate': 0.07502728667928454, 'gamma': 4.586666663271296, 'min_child_weight': 7, 'subsample': 0.8647153541532206, 'colsample_bytree': 0.5885689219801438, 'reg_alpha': 0.5903435809202829, 'reg_lambda': 0.857270500810198}. Best is trial 829 with value: 0.5942795917588232.
[I 2024-11-06 22:31:35,561] Trial 909 finished with value: 0.5928583913758276 and parameters: {'n_estimators': 159, 'max_depth': 7, 'learning_rate': 0.08308521647916567, 'gamma': 4.762751164785673, 'min_child_weight': 7, 'subsample': 0.8294615602302379, 'colsample_bytree': 0.5768504550576267, 'reg_alpha': 0.5752816311413326, 'reg_lambda': 0.7629961260243852}. Best is trial 829 with value: 0.5942795917588232.
[I 2024-11-06 22:31:39,658] Trial 910 finished with value: 0.593943949941305 and parameters: {'n_estimators': 169, 'max_depth': 7, 'learning_rate': 0.06721067961781287, 'gamma': 4.939588542913432, 'min_child_weight': 7, 'subsample': 0.8746877980405535, 'colsample_bytree': 0.5991087011857997, 'reg_alpha': 0.5065194865106234, 'reg_lambda': 0.49782897690887196}. Best is trial 829 with value: 0.5942795917588232.
[I 2024-11-06 22:31:43,296] Trial 911 finished with value: 0.5924242393536969 and parameters: {'n_estimators': 175, 'max_depth': 6, 'learning_rate': 0.08011115611329483, 'gamma': 4.953826462223428, 'min_child_weight': 7, 'subsample': 0.8903422718021042, 'colsample_bytree': 0.7501184722892107, 'reg_alpha': 0.579671246234892, 'reg_lambda': 0.4768896654283179}. Best is trial 829 with value: 0.5942795917588232.
[I 2024-11-06 22:31:46,877] Trial 912 finished with value: 0.5927968481570869 and parameters: {'n_estimators': 170, 'max_depth': 7, 'learning_rate': 0.07016824200616069, 'gamma': 4.822786580638457, 'min_child_weight': 7, 'subsample': 0.9025183283002899, 'colsample_bytree': 0.5292446837622967, 'reg_alpha': 0.5167300246081323, 'reg_lambda': 0.5288819245552367}. Best is trial 829 with value: 0.5942795917588232.
[I 2024-11-06 22:31:50,760] Trial 913 finished with value: 0.5921993850257982 and parameters: {'n_estimators': 178, 'max_depth': 4, 'learning_rate': 0.07323612285385155, 'gamma': 4.987522163470993, 'min_child_weight': 8, 'subsample': 0.8795408244479211, 'colsample_bytree': 0.5586182234001783, 'reg_alpha': 0.4875536687547496, 'reg_lambda': 0.8019372656164846}. Best is trial 829 with value: 0.5942795917588232.
[I 2024-11-06 22:31:55,531] Trial 914 finished with value: 0.5924725986972846 and parameters: {'n_estimators': 298, 'max_depth': 7, 'learning_rate': 0.0854878142114917, 'gamma': 4.922874820485966, 'min_child_weight': 4, 'subsample': 0.8431001351338425, 'colsample_bytree': 0.5005192290537958, 'reg_alpha': 0.5054535816603116, 'reg_lambda': 0.8161849543068985}. Best is trial 829 with value: 0.5942795917588232.
[I 2024-11-06 22:31:58,951] Trial 915 finished with value: 0.5923600751420001 and parameters: {'n_estimators': 183, 'max_depth': 7, 'learning_rate': 0.11415493826292879, 'gamma': 4.769990232981738, 'min_child_weight': 7, 'subsample': 0.8599298004835488, 'colsample_bytree': 0.5987640333368349, 'reg_alpha': 0.5053882739881943, 'reg_lambda': 0.4978822985779039}. Best is trial 829 with value: 0.5942795917588232.
[I 2024-11-06 22:32:02,671] Trial 916 finished with value: 0.5927171013206248 and parameters: {'n_estimators': 171, 'max_depth': 7, 'learning_rate': 0.09134715553998121, 'gamma': 4.884628080317415, 'min_child_weight': 7, 'subsample': 0.869347995391393, 'colsample_bytree': 0.5723738333449743, 'reg_alpha': 0.5210418662665854, 'reg_lambda': 0.46092155590278605}. Best is trial 829 with value: 0.5942795917588232.
[I 2024-11-06 22:32:07,371] Trial 917 finished with value: 0.5935617776534869 and parameters: {'n_estimators': 166, 'max_depth': 7, 'learning_rate': 0.06685104354126722, 'gamma': 4.9628531452849085, 'min_child_weight': 7, 'subsample': 0.8854786650544602, 'colsample_bytree': 0.5922127063425794, 'reg_alpha': 0.5350810889559606, 'reg_lambda': 0.7751903096987899}. Best is trial 829 with value: 0.5942795917588232.
[I 2024-11-06 22:32:10,999] Trial 918 finished with value: 0.5927701581523941 and parameters: {'n_estimators': 164, 'max_depth': 7, 'learning_rate': 0.07482156909100951, 'gamma': 4.9133855273323395, 'min_child_weight': 9, 'subsample': 0.7257174678747031, 'colsample_bytree': 0.5834578918074399, 'reg_alpha': 0.498697677043876, 'reg_lambda': 0.8238572009345744}. Best is trial 829 with value: 0.5942795917588232.
[I 2024-11-06 22:32:14,552] Trial 919 finished with value: 0.5932138620843076 and parameters: {'n_estimators': 164, 'max_depth': 7, 'learning_rate': 0.06778165914420237, 'gamma': 4.841190849372305, 'min_child_weight': 7, 'subsample': 0.8549537062597405, 'colsample_bytree': 0.5662704943945118, 'reg_alpha': 0.5396525572805286, 'reg_lambda': 0.5004021030847333}. Best is trial 829 with value: 0.5942795917588232.
[I 2024-11-06 22:32:17,860] Trial 920 finished with value: 0.5921122341340791 and parameters: {'n_estimators': 171, 'max_depth': 7, 'learning_rate': 0.08029908923603024, 'gamma': 4.758610346983978, 'min_child_weight': 7, 'subsample': 0.8955230630748897, 'colsample_bytree': 0.5475680073688783, 'reg_alpha': 0.472631624727695, 'reg_lambda': 0.7651910636516426}. Best is trial 829 with value: 0.5942795917588232.
[I 2024-11-06 22:32:21,850] Trial 921 finished with value: 0.5931345387520792 and parameters: {'n_estimators': 177, 'max_depth': 7, 'learning_rate': 0.06081165103026444, 'gamma': 4.746605966784057, 'min_child_weight': 7, 'subsample': 0.8748830783198227, 'colsample_bytree': 0.5774969026553044, 'reg_alpha': 0.4904479155916477, 'reg_lambda': 0.5113519058320506}. Best is trial 829 with value: 0.5942795917588232.
[I 2024-11-06 22:32:24,831] Trial 922 finished with value: 0.591942891341875 and parameters: {'n_estimators': 169, 'max_depth': 7, 'learning_rate': 0.2877137756067718, 'gamma': 4.846750652916115, 'min_child_weight': 8, 'subsample': 0.8146050094538393, 'colsample_bytree': 0.5896041467392014, 'reg_alpha': 0.5524272811092787, 'reg_lambda': 0.7929495085920751}. Best is trial 829 with value: 0.5942795917588232.
[I 2024-11-06 22:32:30,003] Trial 923 finished with value: 0.5931171772501311 and parameters: {'n_estimators': 257, 'max_depth': 6, 'learning_rate': 0.06810840968127949, 'gamma': 4.685347473749317, 'min_child_weight': 7, 'subsample': 0.691239510079664, 'colsample_bytree': 0.5996759236436442, 'reg_alpha': 0.5146564345903595, 'reg_lambda': 0.5104512797805316}. Best is trial 829 with value: 0.5942795917588232.
[I 2024-11-06 22:32:32,878] Trial 924 finished with value: 0.5924354768897035 and parameters: {'n_estimators': 160, 'max_depth': 7, 'learning_rate': 0.15808829489669557, 'gamma': 4.966555428484145, 'min_child_weight': 7, 'subsample': 0.8667601267482455, 'colsample_bytree': 0.5564771988780959, 'reg_alpha': 0.47500261929929244, 'reg_lambda': 0.8375462856302226}. Best is trial 829 with value: 0.5942795917588232.
[I 2024-11-06 22:32:36,932] Trial 925 finished with value: 0.5933277411626903 and parameters: {'n_estimators': 174, 'max_depth': 7, 'learning_rate': 0.06363255044702235, 'gamma': 4.548135616129758, 'min_child_weight': 7, 'subsample': 0.8469218215029226, 'colsample_bytree': 0.5698519065843408, 'reg_alpha': 0.5651897056557512, 'reg_lambda': 0.7541853802601738}. Best is trial 829 with value: 0.5942795917588232.
[I 2024-11-06 22:32:40,605] Trial 926 finished with value: 0.5928914293241647 and parameters: {'n_estimators': 167, 'max_depth': 7, 'learning_rate': 0.07486614511192291, 'gamma': 4.715513427275012, 'min_child_weight': 7, 'subsample': 0.885876563991657, 'colsample_bytree': 0.5842469983229255, 'reg_alpha': 0.5568886298922422, 'reg_lambda': 0.8082478839295612}. Best is trial 829 with value: 0.5942795917588232.
[I 2024-11-06 22:32:44,545] Trial 927 finished with value: 0.5929481161846185 and parameters: {'n_estimators': 180, 'max_depth': 7, 'learning_rate': 0.06925012122244323, 'gamma': 4.974558941520165, 'min_child_weight': 10, 'subsample': 0.9127743609654018, 'colsample_bytree': 0.8788345807222484, 'reg_alpha': 0.540987497653632, 'reg_lambda': 0.8703932898951786}. Best is trial 829 with value: 0.5942795917588232.
[I 2024-11-06 22:32:48,044] Trial 928 finished with value: 0.5929041182527056 and parameters: {'n_estimators': 162, 'max_depth': 7, 'learning_rate': 0.08176872664595533, 'gamma': 4.844476094800372, 'min_child_weight': 7, 'subsample': 0.8587470580855686, 'colsample_bytree': 0.5390451753909288, 'reg_alpha': 0.5765684130270285, 'reg_lambda': 0.773144926924282}. Best is trial 829 with value: 0.5942795917588232.
[I 2024-11-06 22:32:51,808] Trial 929 finished with value: 0.5931375438059565 and parameters: {'n_estimators': 157, 'max_depth': 7, 'learning_rate': 0.062072250002270096, 'gamma': 4.99641970301948, 'min_child_weight': 8, 'subsample': 0.8756770151130766, 'colsample_bytree': 0.5758016266318046, 'reg_alpha': 0.5943164062609332, 'reg_lambda': 0.7859827467583677}. Best is trial 829 with value: 0.5942795917588232.
[I 2024-11-06 22:32:58,296] Trial 930 finished with value: 0.5921672910895849 and parameters: {'n_estimators': 173, 'max_depth': 7, 'learning_rate': 0.014355119156143875, 'gamma': 4.6629388441172885, 'min_child_weight': 7, 'subsample': 0.8968479214410238, 'colsample_bytree': 0.89454668650608, 'reg_alpha': 0.5276462411601991, 'reg_lambda': 0.4946957783154289}. Best is trial 829 with value: 0.5942795917588232.
[I 2024-11-06 22:33:02,519] Trial 931 finished with value: 0.5933922143674419 and parameters: {'n_estimators': 158, 'max_depth': 7, 'learning_rate': 0.061524441123199575, 'gamma': 4.543535067608647, 'min_child_weight': 7, 'subsample': 0.8696483386216517, 'colsample_bytree': 0.5573422398140391, 'reg_alpha': 0.45933278475658834, 'reg_lambda': 0.7540901752781809}. Best is trial 829 with value: 0.5942795917588232.
[I 2024-11-06 22:33:07,155] Trial 932 finished with value: 0.5929271322367697 and parameters: {'n_estimators': 166, 'max_depth': 7, 'learning_rate': 0.07502706905117369, 'gamma': 4.444933185103338, 'min_child_weight': 7, 'subsample': 0.8365402711045318, 'colsample_bytree': 0.8478602340473325, 'reg_alpha': 0.6026205032424802, 'reg_lambda': 0.7844662221150633}. Best is trial 829 with value: 0.5942795917588232.
[I 2024-11-06 22:33:10,667] Trial 933 finished with value: 0.5925842679104532 and parameters: {'n_estimators': 184, 'max_depth': 7, 'learning_rate': 0.12336257155853977, 'gamma': 4.867149842185707, 'min_child_weight': 7, 'subsample': 0.8822983609828702, 'colsample_bytree': 0.5983426008015621, 'reg_alpha': 0.5138022824085262, 'reg_lambda': 0.8209829744139971}. Best is trial 829 with value: 0.5942795917588232.
[I 2024-11-06 22:33:14,522] Trial 934 finished with value: 0.5936333781067695 and parameters: {'n_estimators': 163, 'max_depth': 6, 'learning_rate': 0.06742357772639371, 'gamma': 4.404586540566775, 'min_child_weight': 9, 'subsample': 0.8519232522603438, 'colsample_bytree': 0.5656323846666156, 'reg_alpha': 0.5588631001366202, 'reg_lambda': 0.5100055016799784}. Best is trial 829 with value: 0.5942795917588232.
[I 2024-11-06 22:33:19,531] Trial 935 finished with value: 0.5940294270168044 and parameters: {'n_estimators': 157, 'max_depth': 7, 'learning_rate': 0.026061152785646944, 'gamma': 4.5853108545704355, 'min_child_weight': 8, 'subsample': 0.8633965791326561, 'colsample_bytree': 0.5872351617590469, 'reg_alpha': 0.6162955612878568, 'reg_lambda': 0.7576324590079349}. Best is trial 829 with value: 0.5942795917588232.
[I 2024-11-06 22:33:24,995] Trial 936 finished with value: 0.592688790405776 and parameters: {'n_estimators': 158, 'max_depth': 7, 'learning_rate': 0.01907445720061333, 'gamma': 4.623408494549222, 'min_child_weight': 8, 'subsample': 0.8439433699158698, 'colsample_bytree': 0.5895491563535736, 'reg_alpha': 0.6127387907151227, 'reg_lambda': 0.7684391547048669}. Best is trial 829 with value: 0.5942795917588232.
[I 2024-11-06 22:33:30,811] Trial 937 finished with value: 0.5926618940929563 and parameters: {'n_estimators': 161, 'max_depth': 7, 'learning_rate': 0.01992601335705872, 'gamma': 4.578299254541982, 'min_child_weight': 9, 'subsample': 0.8567831765536937, 'colsample_bytree': 0.6028519385481006, 'reg_alpha': 0.599982316646259, 'reg_lambda': 0.7569239843931534}. Best is trial 829 with value: 0.5942795917588232.
[I 2024-11-06 22:33:36,180] Trial 938 finished with value: 0.5926066167655266 and parameters: {'n_estimators': 170, 'max_depth': 7, 'learning_rate': 0.025156162654995394, 'gamma': 4.697149180254849, 'min_child_weight': 8, 'subsample': 0.8311514308789792, 'colsample_bytree': 0.5867480851821357, 'reg_alpha': 0.5807762335396673, 'reg_lambda': 0.5276093902353689}. Best is trial 829 with value: 0.5942795917588232.
[I 2024-11-06 22:33:41,459] Trial 939 finished with value: 0.5932214532788934 and parameters: {'n_estimators': 159, 'max_depth': 7, 'learning_rate': 0.025837177137493346, 'gamma': 4.516742113730316, 'min_child_weight': 9, 'subsample': 0.8619512588364939, 'colsample_bytree': 0.5792084041095341, 'reg_alpha': 0.6271944446375214, 'reg_lambda': 0.7925474140849434}. Best is trial 829 with value: 0.5942795917588232.
[I 2024-11-06 22:33:46,771] Trial 940 finished with value: 0.5929025391481743 and parameters: {'n_estimators': 156, 'max_depth': 7, 'learning_rate': 0.018344823313845293, 'gamma': 4.578173816366288, 'min_child_weight': 8, 'subsample': 0.8519144396018199, 'colsample_bytree': 0.6044730872376416, 'reg_alpha': 0.6232995500084161, 'reg_lambda': 0.4700346177309639}. Best is trial 829 with value: 0.5942795917588232.
[I 2024-11-06 22:33:51,868] Trial 941 finished with value: 0.5932128771275006 and parameters: {'n_estimators': 167, 'max_depth': 7, 'learning_rate': 0.025040687521846475, 'gamma': 4.723927399611945, 'min_child_weight': 8, 'subsample': 0.8624013470532865, 'colsample_bytree': 0.5926158657514897, 'reg_alpha': 0.5959629907880697, 'reg_lambda': 0.466311963964965}. Best is trial 829 with value: 0.5942795917588232.
[I 2024-11-06 22:33:57,695] Trial 942 finished with value: 0.5922451005924827 and parameters: {'n_estimators': 164, 'max_depth': 7, 'learning_rate': 0.015493104777190868, 'gamma': 4.474492381957098, 'min_child_weight': 9, 'subsample': 0.8427458363227399, 'colsample_bytree': 0.5785598513226202, 'reg_alpha': 0.6379895556042552, 'reg_lambda': 0.7760066563409015}. Best is trial 829 with value: 0.5942795917588232.
[I 2024-11-06 22:34:03,149] Trial 943 finished with value: 0.5931615486479324 and parameters: {'n_estimators': 157, 'max_depth': 6, 'learning_rate': 0.028349385277660143, 'gamma': 4.608825123580577, 'min_child_weight': 10, 'subsample': 0.8681555824932138, 'colsample_bytree': 0.5886581640942007, 'reg_alpha': 0.6185739971270544, 'reg_lambda': 0.4380117487649975}. Best is trial 829 with value: 0.5942795917588232.
[I 2024-11-06 22:34:08,614] Trial 944 finished with value: 0.5928258471063859 and parameters: {'n_estimators': 177, 'max_depth': 7, 'learning_rate': 0.03133266979116603, 'gamma': 4.816807358256996, 'min_child_weight': 9, 'subsample': 0.8533628582178842, 'colsample_bytree': 0.5717988433107996, 'reg_alpha': 0.5817670941902416, 'reg_lambda': 0.7496136410827772}. Best is trial 829 with value: 0.5942795917588232.
[I 2024-11-06 22:34:13,922] Trial 945 finished with value: 0.5929842293410882 and parameters: {'n_estimators': 162, 'max_depth': 7, 'learning_rate': 0.027807810570994365, 'gamma': 4.356518920702951, 'min_child_weight': 8, 'subsample': 0.8724031282426986, 'colsample_bytree': 0.5979875588096151, 'reg_alpha': 0.6042606417132762, 'reg_lambda': 0.49127761333146197}. Best is trial 829 with value: 0.5942795917588232.
[I 2024-11-06 22:34:19,000] Trial 946 finished with value: 0.5929925864383897 and parameters: {'n_estimators': 170, 'max_depth': 7, 'learning_rate': 0.02259904877992735, 'gamma': 4.674171968930834, 'min_child_weight': 8, 'subsample': 0.8619145328419745, 'colsample_bytree': 0.5825360562302997, 'reg_alpha': 0.643715469301631, 'reg_lambda': 0.8023279981610903}. Best is trial 829 with value: 0.5942795917588232.
[I 2024-11-06 22:34:23,759] Trial 947 finished with value: 0.5926997505089201 and parameters: {'n_estimators': 155, 'max_depth': 7, 'learning_rate': 0.022332047910727605, 'gamma': 4.472385712031337, 'min_child_weight': 5, 'subsample': 0.8454974923546908, 'colsample_bytree': 0.608451706508762, 'reg_alpha': 0.5603940514258258, 'reg_lambda': 0.7747672126643286}. Best is trial 829 with value: 0.5942795917588232.
