[I 2024-11-06 21:12:30,566] Trial 799 finished with value: 0.5982717441008788 and parameters: {'n_estimators': 68, 'max_depth': 3, 'min_samples_split': 2, 'min_samples_leaf': 1}. Best is trial 406 with value: 0.5986570551043842.
[I 2024-11-06 21:12:35,890] Trial 800 finished with value: 0.5942254335218348 and parameters: {'n_estimators': 73, 'max_depth': 8, 'min_samples_split': 4, 'min_samples_leaf': 13}. Best is trial 406 with value: 0.5986570551043842.
[I 2024-11-06 21:12:39,257] Trial 801 finished with value: 0.5982878027620789 and parameters: {'n_estimators': 79, 'max_depth': 3, 'min_samples_split': 2, 'min_samples_leaf': 2}. Best is trial 406 with value: 0.5986570551043842.
[I 2024-11-06 21:12:43,303] Trial 802 finished with value: 0.5914416926601018 and parameters: {'n_estimators': 74, 'max_depth': 5, 'min_samples_split': 3, 'min_samples_leaf': 1}. Best is trial 406 with value: 0.5986570551043842.
[I 2024-11-06 21:12:45,361] Trial 803 finished with value: 0.5918904436469393 and parameters: {'n_estimators': 66, 'max_depth': 1, 'min_samples_split': 3, 'min_samples_leaf': 12}. Best is trial 406 with value: 0.5986570551043842.
[I 2024-11-06 21:12:48,128] Trial 804 finished with value: 0.5914596874309176 and parameters: {'n_estimators': 78, 'max_depth': 2, 'min_samples_split': 17, 'min_samples_leaf': 18}. Best is trial 406 with value: 0.5986570551043842.
[I 2024-11-06 21:12:51,016] Trial 805 finished with value: 0.5919179889066216 and parameters: {'n_estimators': 58, 'max_depth': 4, 'min_samples_split': 9, 'min_samples_leaf': 11}. Best is trial 406 with value: 0.5986570551043842.
[I 2024-11-06 21:12:54,156] Trial 806 finished with value: 0.598512638772427 and parameters: {'n_estimators': 71, 'max_depth': 3, 'min_samples_split': 4, 'min_samples_leaf': 1}. Best is trial 406 with value: 0.5986570551043842.
[I 2024-11-06 21:13:02,746] Trial 807 finished with value: 0.5940671039489995 and parameters: {'n_estimators': 81, 'max_depth': 13, 'min_samples_split': 4, 'min_samples_leaf': 3}. Best is trial 406 with value: 0.5986570551043842.
[I 2024-11-06 21:13:06,566] Trial 808 finished with value: 0.5925954266262059 and parameters: {'n_estimators': 75, 'max_depth': 4, 'min_samples_split': 12, 'min_samples_leaf': 11}. Best is trial 406 with value: 0.5986570551043842.
[I 2024-11-06 21:13:09,041] Trial 809 finished with value: 0.5921656749015044 and parameters: {'n_estimators': 68, 'max_depth': 2, 'min_samples_split': 2, 'min_samples_leaf': 12}. Best is trial 406 with value: 0.5986570551043842.
[I 2024-11-06 21:13:13,235] Trial 810 finished with value: 0.5916247711689536 and parameters: {'n_estimators': 77, 'max_depth': 5, 'min_samples_split': 3, 'min_samples_leaf': 1}. Best is trial 406 with value: 0.5986570551043842.
[I 2024-11-06 21:13:23,127] Trial 811 finished with value: 0.5924117387989363 and parameters: {'n_estimators': 81, 'max_depth': 17, 'min_samples_split': 4, 'min_samples_leaf': 13}. Best is trial 406 with value: 0.5986570551043842.
[I 2024-11-06 21:13:24,050] Trial 812 finished with value: 0.597726750931195 and parameters: {'n_estimators': 13, 'max_depth': 3, 'min_samples_split': 3, 'min_samples_leaf': 2}. Best is trial 406 with value: 0.5986570551043842.
[I 2024-11-06 21:13:26,233] Trial 813 finished with value: 0.5918548791124849 and parameters: {'n_estimators': 72, 'max_depth': 1, 'min_samples_split': 2, 'min_samples_leaf': 9}. Best is trial 406 with value: 0.5986570551043842.
[I 2024-11-06 21:13:28,922] Trial 814 finished with value: 0.592437301835236 and parameters: {'n_estimators': 74, 'max_depth': 2, 'min_samples_split': 3, 'min_samples_leaf': 1}. Best is trial 406 with value: 0.5986570551043842.
[I 2024-11-06 21:13:32,237] Trial 815 finished with value: 0.5932979990428151 and parameters: {'n_estimators': 65, 'max_depth': 4, 'min_samples_split': 3, 'min_samples_leaf': 11}. Best is trial 406 with value: 0.5986570551043842.
[I 2024-11-06 21:13:36,616] Trial 816 finished with value: 0.5929221793150137 and parameters: {'n_estimators': 70, 'max_depth': 6, 'min_samples_split': 4, 'min_samples_leaf': 2}. Best is trial 406 with value: 0.5986570551043842.
[I 2024-11-06 21:13:39,861] Trial 817 finished with value: 0.5983775815389942 and parameters: {'n_estimators': 78, 'max_depth': 3, 'min_samples_split': 2, 'min_samples_leaf': 13}. Best is trial 406 with value: 0.5986570551043842.
[I 2024-11-06 21:13:42,792] Trial 818 finished with value: 0.5912775839902931 and parameters: {'n_estimators': 82, 'max_depth': 2, 'min_samples_split': 3, 'min_samples_leaf': 12}. Best is trial 406 with value: 0.5986570551043842.
[I 2024-11-06 21:13:46,484] Trial 819 finished with value: 0.5926152114738387 and parameters: {'n_estimators': 75, 'max_depth': 4, 'min_samples_split': 4, 'min_samples_leaf': 9}. Best is trial 406 with value: 0.5986570551043842.
[I 2024-11-06 21:13:50,424] Trial 820 finished with value: 0.5918231815222983 and parameters: {'n_estimators': 70, 'max_depth': 5, 'min_samples_split': 2, 'min_samples_leaf': 1}. Best is trial 406 with value: 0.5986570551043842.
[I 2024-11-06 21:13:53,744] Trial 821 finished with value: 0.5983775815389942 and parameters: {'n_estimators': 78, 'max_depth': 3, 'min_samples_split': 4, 'min_samples_leaf': 12}. Best is trial 406 with value: 0.5986570551043842.
[I 2024-11-06 21:13:55,660] Trial 822 finished with value: 0.5917838966141673 and parameters: {'n_estimators': 63, 'max_depth': 1, 'min_samples_split': 3, 'min_samples_leaf': 11}. Best is trial 406 with value: 0.5986570551043842.
[I 2024-11-06 21:13:58,823] Trial 823 finished with value: 0.5986500599336075 and parameters: {'n_estimators': 74, 'max_depth': 3, 'min_samples_split': 4, 'min_samples_leaf': 9}. Best is trial 406 with value: 0.5986570551043842.
[I 2024-11-06 21:14:09,403] Trial 824 finished with value: 0.587267496956666 and parameters: {'n_estimators': 67, 'max_depth': 50, 'min_samples_split': 3, 'min_samples_leaf': 9}. Best is trial 406 with value: 0.5986570551043842.
[I 2024-11-06 21:14:12,931] Trial 825 finished with value: 0.592884919429682 and parameters: {'n_estimators': 72, 'max_depth': 4, 'min_samples_split': 4, 'min_samples_leaf': 9}. Best is trial 406 with value: 0.5986570551043842.
[I 2024-11-06 21:14:15,437] Trial 826 finished with value: 0.5918262554401501 and parameters: {'n_estimators': 69, 'max_depth': 2, 'min_samples_split': 3, 'min_samples_leaf': 9}. Best is trial 406 with value: 0.5986570551043842.
[I 2024-11-06 21:14:19,512] Trial 827 finished with value: 0.5918168993209209 and parameters: {'n_estimators': 73, 'max_depth': 5, 'min_samples_split': 2, 'min_samples_leaf': 9}. Best is trial 406 with value: 0.5986570551043842.
[I 2024-11-06 21:14:22,259] Trial 828 finished with value: 0.5969495074448238 and parameters: {'n_estimators': 63, 'max_depth': 3, 'min_samples_split': 4, 'min_samples_leaf': 9}. Best is trial 406 with value: 0.5986570551043842.
[I 2024-11-06 21:14:24,472] Trial 829 finished with value: 0.5918686077264141 and parameters: {'n_estimators': 75, 'max_depth': 1, 'min_samples_split': 3, 'min_samples_leaf': 9}. Best is trial 406 with value: 0.5986570551043842.
[I 2024-11-06 21:14:29,144] Trial 830 finished with value: 0.5941610421772217 and parameters: {'n_estimators': 69, 'max_depth': 7, 'min_samples_split': 2, 'min_samples_leaf': 20}. Best is trial 406 with value: 0.5986570551043842.
[I 2024-11-06 21:14:32,287] Trial 831 finished with value: 0.5985993269372238 and parameters: {'n_estimators': 72, 'max_depth': 3, 'min_samples_split': 4, 'min_samples_leaf': 9}. Best is trial 406 with value: 0.5986570551043842.
[I 2024-11-06 21:14:43,612] Trial 832 finished with value: 0.58876177872809 and parameters: {'n_estimators': 76, 'max_depth': 28, 'min_samples_split': 4, 'min_samples_leaf': 9}. Best is trial 406 with value: 0.5986570551043842.
[I 2024-11-06 21:14:47,041] Trial 833 finished with value: 0.5929380445111866 and parameters: {'n_estimators': 66, 'max_depth': 4, 'min_samples_split': 3, 'min_samples_leaf': 10}. Best is trial 406 with value: 0.5986570551043842.
[I 2024-11-06 21:14:50,891] Trial 834 finished with value: 0.591076257211584 and parameters: {'n_estimators': 112, 'max_depth': 2, 'min_samples_split': 20, 'min_samples_leaf': 8}. Best is trial 406 with value: 0.5986570551043842.
[I 2024-11-06 21:14:55,623] Trial 835 finished with value: 0.5933979747726156 and parameters: {'n_estimators': 78, 'max_depth': 6, 'min_samples_split': 2, 'min_samples_leaf': 11}. Best is trial 406 with value: 0.5986570551043842.
[I 2024-11-06 21:14:59,213] Trial 836 finished with value: 0.5929338755342398 and parameters: {'n_estimators': 73, 'max_depth': 4, 'min_samples_split': 3, 'min_samples_leaf': 9}. Best is trial 406 with value: 0.5986570551043842.
[I 2024-11-06 21:15:01,779] Trial 837 finished with value: 0.5918067507377837 and parameters: {'n_estimators': 70, 'max_depth': 2, 'min_samples_split': 3, 'min_samples_leaf': 12}. Best is trial 406 with value: 0.5986570551043842.
[I 2024-11-06 21:15:04,728] Trial 838 finished with value: 0.5966022910023174 and parameters: {'n_estimators': 60, 'max_depth': 3, 'min_samples_split': 4, 'min_samples_leaf': 14}. Best is trial 406 with value: 0.5986570551043842.
[I 2024-11-06 21:15:08,885] Trial 839 finished with value: 0.5919566786380401 and parameters: {'n_estimators': 76, 'max_depth': 5, 'min_samples_split': 2, 'min_samples_leaf': 13}. Best is trial 406 with value: 0.5986570551043842.
[I 2024-11-06 21:15:11,758] Trial 840 finished with value: 0.5910471516659278 and parameters: {'n_estimators': 80, 'max_depth': 2, 'min_samples_split': 3, 'min_samples_leaf': 18}. Best is trial 406 with value: 0.5986570551043842.
[I 2024-11-06 21:15:14,664] Trial 841 finished with value: 0.5977929803375573 and parameters: {'n_estimators': 67, 'max_depth': 3, 'min_samples_split': 8, 'min_samples_leaf': 10}. Best is trial 406 with value: 0.5986570551043842.
[I 2024-11-06 21:15:16,879] Trial 842 finished with value: 0.5919598878858062 and parameters: {'n_estimators': 73, 'max_depth': 1, 'min_samples_split': 4, 'min_samples_leaf': 8}. Best is trial 406 with value: 0.5986570551043842.
[I 2024-11-06 21:15:21,086] Trial 843 finished with value: 0.591537042769791 and parameters: {'n_estimators': 77, 'max_depth': 5, 'min_samples_split': 3, 'min_samples_leaf': 11}. Best is trial 406 with value: 0.5986570551043842.
[I 2024-11-06 21:15:25,163] Trial 844 finished with value: 0.5922612238789295 and parameters: {'n_estimators': 81, 'max_depth': 4, 'min_samples_split': 2, 'min_samples_leaf': 9}. Best is trial 406 with value: 0.5986570551043842.
[I 2024-11-06 21:15:28,260] Trial 845 finished with value: 0.5984118650789856 and parameters: {'n_estimators': 70, 'max_depth': 3, 'min_samples_split': 4, 'min_samples_leaf': 15}. Best is trial 406 with value: 0.5986570551043842.
[I 2024-11-06 21:15:52,157] Trial 846 finished with value: 0.5905323052519769 and parameters: {'n_estimators': 170, 'max_depth': 38, 'min_samples_split': 3, 'min_samples_leaf': 12}. Best is trial 406 with value: 0.5986570551043842.
[I 2024-11-06 21:15:54,757] Trial 847 finished with value: 0.592437301835236 and parameters: {'n_estimators': 74, 'max_depth': 2, 'min_samples_split': 3, 'min_samples_leaf': 10}. Best is trial 406 with value: 0.5986570551043842.
[I 2024-11-06 21:15:57,173] Trial 848 finished with value: 0.5917322325167881 and parameters: {'n_estimators': 79, 'max_depth': 1, 'min_samples_split': 4, 'min_samples_leaf': 7}. Best is trial 406 with value: 0.5986570551043842.
[I 2024-11-06 21:16:00,370] Trial 849 finished with value: 0.5929242882088591 and parameters: {'n_estimators': 63, 'max_depth': 4, 'min_samples_split': 3, 'min_samples_leaf': 8}. Best is trial 406 with value: 0.5986570551043842.
[I 2024-11-06 21:16:03,341] Trial 850 finished with value: 0.5982912402392642 and parameters: {'n_estimators': 68, 'max_depth': 3, 'min_samples_split': 2, 'min_samples_leaf': 9}. Best is trial 406 with value: 0.5986570551043842.
[I 2024-11-06 21:16:07,596] Trial 851 finished with value: 0.5912418693025275 and parameters: {'n_estimators': 74, 'max_depth': 5, 'min_samples_split': 5, 'min_samples_leaf': 12}. Best is trial 406 with value: 0.5986570551043842.
[I 2024-11-06 21:16:11,938] Trial 852 finished with value: 0.5954422192443719 and parameters: {'n_estimators': 71, 'max_depth': 6, 'min_samples_split': 3, 'min_samples_leaf': 13}. Best is trial 406 with value: 0.5986570551043842.
[I 2024-11-06 21:16:15,450] Trial 853 finished with value: 0.5986468561496567 and parameters: {'n_estimators': 82, 'max_depth': 3, 'min_samples_split': 4, 'min_samples_leaf': 8}. Best is trial 406 with value: 0.5986570551043842.
[I 2024-11-06 21:16:18,373] Trial 854 finished with value: 0.5913809716906681 and parameters: {'n_estimators': 83, 'max_depth': 2, 'min_samples_split': 4, 'min_samples_leaf': 8}. Best is trial 406 with value: 0.5986570551043842.
[I 2024-11-06 21:16:22,325] Trial 855 finished with value: 0.591990043816937 and parameters: {'n_estimators': 78, 'max_depth': 4, 'min_samples_split': 5, 'min_samples_leaf': 8}. Best is trial 406 with value: 0.5986570551043842.
[I 2024-11-06 21:16:25,456] Trial 856 finished with value: 0.5986322175714879 and parameters: {'n_estimators': 75, 'max_depth': 3, 'min_samples_split': 4, 'min_samples_leaf': 8}. Best is trial 406 with value: 0.5986570551043842.
[I 2024-11-06 21:16:28,286] Trial 857 finished with value: 0.5916134069236967 and parameters: {'n_estimators': 54, 'max_depth': 4, 'min_samples_split': 4, 'min_samples_leaf': 8}. Best is trial 406 with value: 0.5986570551043842.
[I 2024-11-06 21:16:30,756] Trial 858 finished with value: 0.5922035389665794 and parameters: {'n_estimators': 65, 'max_depth': 2, 'min_samples_split': 4, 'min_samples_leaf': 8}. Best is trial 406 with value: 0.5986570551043842.
[I 2024-11-06 21:16:32,951] Trial 859 finished with value: 0.5918548791124849 and parameters: {'n_estimators': 72, 'max_depth': 1, 'min_samples_split': 5, 'min_samples_leaf': 8}. Best is trial 406 with value: 0.5986570551043842.
[I 2024-11-06 21:16:36,477] Trial 860 finished with value: 0.5986468561496567 and parameters: {'n_estimators': 82, 'max_depth': 3, 'min_samples_split': 4, 'min_samples_leaf': 8}. Best is trial 406 with value: 0.5986570551043842.
[I 2024-11-06 21:16:40,705] Trial 861 finished with value: 0.5923332066333149 and parameters: {'n_estimators': 77, 'max_depth': 5, 'min_samples_split': 5, 'min_samples_leaf': 8}. Best is trial 406 with value: 0.5986570551043842.
[I 2024-11-06 21:16:44,100] Trial 862 finished with value: 0.5983155907309164 and parameters: {'n_estimators': 80, 'max_depth': 3, 'min_samples_split': 4, 'min_samples_leaf': 8}. Best is trial 406 with value: 0.5986570551043842.
[I 2024-11-06 21:16:46,499] Trial 863 finished with value: 0.5921656749015044 and parameters: {'n_estimators': 68, 'max_depth': 2, 'min_samples_split': 4, 'min_samples_leaf': 8}. Best is trial 406 with value: 0.5986570551043842.
[I 2024-11-06 21:16:50,194] Trial 864 finished with value: 0.592575330941276 and parameters: {'n_estimators': 75, 'max_depth': 4, 'min_samples_split': 5, 'min_samples_leaf': 8}. Best is trial 406 with value: 0.5986570551043842.
[I 2024-11-06 21:16:53,307] Trial 865 finished with value: 0.5985126884943593 and parameters: {'n_estimators': 71, 'max_depth': 3, 'min_samples_split': 4, 'min_samples_leaf': 7}. Best is trial 406 with value: 0.5986570551043842.
[I 2024-11-06 21:16:56,046] Trial 866 finished with value: 0.5918129964131911 and parameters: {'n_estimators': 77, 'max_depth': 2, 'min_samples_split': 5, 'min_samples_leaf': 8}. Best is trial 406 with value: 0.5986570551043842.
[I 2024-11-06 21:16:59,041] Trial 867 finished with value: 0.5919985551697493 and parameters: {'n_estimators': 60, 'max_depth': 4, 'min_samples_split': 4, 'min_samples_leaf': 8}. Best is trial 406 with value: 0.5986570551043842.
[I 2024-11-06 21:17:04,113] Trial 868 finished with value: 0.5943158685052696 and parameters: {'n_estimators': 82, 'max_depth': 6, 'min_samples_split': 4, 'min_samples_leaf': 7}. Best is trial 406 with value: 0.5986570551043842.
[I 2024-11-06 21:17:07,792] Trial 869 finished with value: 0.5893490402942214 and parameters: {'n_estimators': 130, 'max_depth': 1, 'min_samples_split': 5, 'min_samples_leaf': 8}. Best is trial 406 with value: 0.5986570551043842.
[I 2024-11-06 21:17:10,866] Trial 870 finished with value: 0.5986391451991558 and parameters: {'n_estimators': 73, 'max_depth': 3, 'min_samples_split': 4, 'min_samples_leaf': 7}. Best is trial 406 with value: 0.5986570551043842.
[I 2024-11-06 21:17:14,572] Trial 871 finished with value: 0.5919773340861327 and parameters: {'n_estimators': 66, 'max_depth': 5, 'min_samples_split': 4, 'min_samples_leaf': 8}. Best is trial 406 with value: 0.5986570551043842.
[I 2024-11-06 21:17:17,603] Trial 872 finished with value: 0.5983333183998816 and parameters: {'n_estimators': 70, 'max_depth': 3, 'min_samples_split': 4, 'min_samples_leaf': 7}. Best is trial 406 with value: 0.5986570551043842.
[I 2024-11-06 21:17:20,272] Trial 873 finished with value: 0.592437301835236 and parameters: {'n_estimators': 74, 'max_depth': 2, 'min_samples_split': 4, 'min_samples_leaf': 8}. Best is trial 406 with value: 0.5986570551043842.
[I 2024-11-06 21:17:24,283] Trial 874 finished with value: 0.5918896253147563 and parameters: {'n_estimators': 80, 'max_depth': 4, 'min_samples_split': 4, 'min_samples_leaf': 8}. Best is trial 406 with value: 0.5986570551043842.
[I 2024-11-06 21:17:26,731] Trial 875 finished with value: 0.5921656749015044 and parameters: {'n_estimators': 68, 'max_depth': 2, 'min_samples_split': 4, 'min_samples_leaf': 7}. Best is trial 406 with value: 0.5986570551043842.
[I 2024-11-06 21:17:29,013] Trial 876 finished with value: 0.5918513869487873 and parameters: {'n_estimators': 76, 'max_depth': 1, 'min_samples_split': 4, 'min_samples_leaf': 9}. Best is trial 406 with value: 0.5986570551043842.
[I 2024-11-06 21:17:34,523] Trial 877 finished with value: 0.5933839351624106 and parameters: {'n_estimators': 84, 'max_depth': 7, 'min_samples_split': 4, 'min_samples_leaf': 7}. Best is trial 406 with value: 0.5986570551043842.
[I 2024-11-06 21:17:38,610] Trial 878 finished with value: 0.592322748693366 and parameters: {'n_estimators': 72, 'max_depth': 5, 'min_samples_split': 4, 'min_samples_leaf': 8}. Best is trial 406 with value: 0.5986570551043842.
[I 2024-11-06 21:17:45,800] Trial 879 finished with value: 0.5932095596331812 and parameters: {'n_estimators': 79, 'max_depth': 11, 'min_samples_split': 4, 'min_samples_leaf': 9}. Best is trial 406 with value: 0.5986570551043842.
[I 2024-11-06 21:17:48,647] Trial 880 finished with value: 0.5970958711780341 and parameters: {'n_estimators': 66, 'max_depth': 3, 'min_samples_split': 4, 'min_samples_leaf': 9}. Best is trial 406 with value: 0.5986570551043842.
[I 2024-11-06 21:17:52,264] Trial 881 finished with value: 0.5928216985213677 and parameters: {'n_estimators': 72, 'max_depth': 4, 'min_samples_split': 10, 'min_samples_leaf': 8}. Best is trial 406 with value: 0.5986570551043842.
[I 2024-11-06 21:17:54,647] Trial 882 finished with value: 0.5918513869487873 and parameters: {'n_estimators': 76, 'max_depth': 1, 'min_samples_split': 4, 'min_samples_leaf': 8}. Best is trial 406 with value: 0.5986570551043842.
[I 2024-11-06 21:17:58,078] Trial 883 finished with value: 0.5986237613053552 and parameters: {'n_estimators': 83, 'max_depth': 3, 'min_samples_split': 4, 'min_samples_leaf': 7}. Best is trial 406 with value: 0.5986570551043842.
[I 2024-11-06 21:17:59,121] Trial 884 finished with value: 0.5958953570264219 and parameters: {'n_estimators': 22, 'max_depth': 2, 'min_samples_split': 4, 'min_samples_leaf': 8}. Best is trial 406 with value: 0.5986570551043842.
[I 2024-11-06 21:18:03,639] Trial 885 finished with value: 0.591499170803942 and parameters: {'n_estimators': 78, 'max_depth': 5, 'min_samples_split': 4, 'min_samples_leaf': 9}. Best is trial 406 with value: 0.5986570551043842.
[I 2024-11-06 21:18:05,953] Trial 886 finished with value: 0.5904238878070472 and parameters: {'n_estimators': 41, 'max_depth': 4, 'min_samples_split': 11, 'min_samples_leaf': 7}. Best is trial 406 with value: 0.5986570551043842.
[I 2024-11-06 21:18:08,998] Trial 887 finished with value: 0.597914310340087 and parameters: {'n_estimators': 69, 'max_depth': 3, 'min_samples_split': 4, 'min_samples_leaf': 8}. Best is trial 406 with value: 0.5986570551043842.
[I 2024-11-06 21:18:11,290] Trial 888 finished with value: 0.592162303073224 and parameters: {'n_estimators': 62, 'max_depth': 2, 'min_samples_split': 3, 'min_samples_leaf': 7}. Best is trial 406 with value: 0.5986570551043842.
[I 2024-11-06 21:18:14,955] Trial 889 finished with value: 0.5926038512407364 and parameters: {'n_estimators': 74, 'max_depth': 4, 'min_samples_split': 4, 'min_samples_leaf': 9}. Best is trial 406 with value: 0.5986570551043842.
[I 2024-11-06 21:18:18,449] Trial 890 finished with value: 0.5983996657447802 and parameters: {'n_estimators': 81, 'max_depth': 3, 'min_samples_split': 4, 'min_samples_leaf': 8}. Best is trial 406 with value: 0.5986570551043842.
[I 2024-11-06 21:18:22,870] Trial 891 finished with value: 0.5937421288350571 and parameters: {'n_estimators': 71, 'max_depth': 6, 'min_samples_split': 3, 'min_samples_leaf': 9}. Best is trial 406 with value: 0.5986570551043842.
[I 2024-11-06 21:18:26,997] Trial 892 finished with value: 0.5933362261979553 and parameters: {'n_estimators': 86, 'max_depth': 4, 'min_samples_split': 5, 'min_samples_leaf': 16}. Best is trial 406 with value: 0.5986570551043842.
[I 2024-11-06 21:18:29,283] Trial 893 finished with value: 0.5918513869487873 and parameters: {'n_estimators': 76, 'max_depth': 1, 'min_samples_split': 4, 'min_samples_leaf': 7}. Best is trial 406 with value: 0.5986570551043842.
