[I 2024-11-06 19:56:59,084] Trial 591 finished with value: 0.5944704740338647 and parameters: {'C': 0.4560109395208775, 'solver': 'liblinear'}. Best is trial 236 with value: 0.5945206794543682.
[I 2024-11-06 19:57:00,635] Trial 592 finished with value: 0.5941858415701976 and parameters: {'C': 0.20337574876737943, 'solver': 'liblinear'}. Best is trial 236 with value: 0.5945206794543682.
[I 2024-11-06 19:57:02,475] Trial 593 finished with value: 0.5943947457221496 and parameters: {'C': 1.0016367362650274, 'solver': 'liblinear'}. Best is trial 236 with value: 0.5945206794543682.
[I 2024-11-06 19:57:04,393] Trial 594 finished with value: 0.5944033476557997 and parameters: {'C': 7.781255711843656, 'solver': 'liblinear'}. Best is trial 236 with value: 0.5945206794543682.
[I 2024-11-06 19:57:06,334] Trial 595 finished with value: 0.5944564825190385 and parameters: {'C': 0.5886611563859798, 'solver': 'liblinear'}. Best is trial 236 with value: 0.5945206794543682.
[I 2024-11-06 19:57:08,172] Trial 596 finished with value: 0.5944335599525086 and parameters: {'C': 0.325617630167897, 'solver': 'liblinear'}. Best is trial 236 with value: 0.5945206794543682.
[I 2024-11-06 19:57:10,124] Trial 597 finished with value: 0.5944382255861191 and parameters: {'C': 0.8000257548341316, 'solver': 'liblinear'}. Best is trial 236 with value: 0.5945206794543682.
[I 2024-11-06 19:57:11,979] Trial 598 finished with value: 0.5944622851684469 and parameters: {'C': 0.4998998695995376, 'solver': 'liblinear'}. Best is trial 236 with value: 0.5945206794543682.
[I 2024-11-06 19:57:13,773] Trial 599 finished with value: 0.5941712936169132 and parameters: {'C': 0.1731268500080986, 'solver': 'liblinear'}. Best is trial 236 with value: 0.5945206794543682.
[I 2024-11-06 19:57:15,710] Trial 600 finished with value: 0.5944840977210006 and parameters: {'C': 0.36851017204279046, 'solver': 'liblinear'}. Best is trial 236 with value: 0.5945206794543682.
[I 2024-11-06 19:57:17,508] Trial 601 finished with value: 0.5944465036747404 and parameters: {'C': 0.7056714577761587, 'solver': 'liblinear'}. Best is trial 236 with value: 0.5945206794543682.
[I 2024-11-06 19:57:18,519] Trial 602 finished with value: 0.5571577316148695 and parameters: {'C': 0.0007156722880712896, 'solver': 'liblinear'}. Best is trial 236 with value: 0.5945206794543682.
[I 2024-11-06 19:57:20,338] Trial 603 finished with value: 0.5944761882175046 and parameters: {'C': 0.556829610306324, 'solver': 'liblinear'}. Best is trial 236 with value: 0.5945206794543682.
[I 2024-11-06 19:57:21,919] Trial 604 finished with value: 0.5944490714118467 and parameters: {'C': 0.3370055895447166, 'solver': 'liblinear'}. Best is trial 236 with value: 0.5945206794543682.
[I 2024-11-06 19:57:23,746] Trial 605 finished with value: 0.5943808274095643 and parameters: {'C': 0.9133172066072401, 'solver': 'liblinear'}. Best is trial 236 with value: 0.5945206794543682.
[I 2024-11-06 19:57:25,385] Trial 606 finished with value: 0.5942333748064208 and parameters: {'C': 0.21764234325040616, 'solver': 'liblinear'}. Best is trial 236 with value: 0.5945206794543682.
[I 2024-11-06 19:57:27,105] Trial 607 finished with value: 0.594452488013693 and parameters: {'C': 0.5444563465730191, 'solver': 'liblinear'}. Best is trial 236 with value: 0.5945206794543682.
[I 2024-11-06 19:57:28,893] Trial 608 finished with value: 0.5944341071243737 and parameters: {'C': 0.7449415373847752, 'solver': 'liblinear'}. Best is trial 236 with value: 0.5945206794543682.
[I 2024-11-06 19:57:30,197] Trial 609 finished with value: 0.5942638258328173 and parameters: {'C': 0.354275215306033, 'solver': 'lbfgs'}. Best is trial 236 with value: 0.5945206794543682.
[I 2024-11-06 19:57:31,730] Trial 610 finished with value: 0.5941900002860269 and parameters: {'C': 0.20056304901392547, 'solver': 'liblinear'}. Best is trial 236 with value: 0.5945206794543682.
[I 2024-11-06 19:57:33,562] Trial 611 finished with value: 0.5944664551671568 and parameters: {'C': 0.5127651328165241, 'solver': 'liblinear'}. Best is trial 236 with value: 0.5945206794543682.
[I 2024-11-06 19:57:35,351] Trial 612 finished with value: 0.5944507362778312 and parameters: {'C': 0.6670835261978095, 'solver': 'liblinear'}. Best is trial 236 with value: 0.5945206794543682.
[I 2024-11-06 19:57:36,669] Trial 613 finished with value: 0.5847165791744529 and parameters: {'C': 0.003119582481212191, 'solver': 'liblinear'}. Best is trial 236 with value: 0.5945206794543682.
[I 2024-11-06 19:57:38,521] Trial 614 finished with value: 0.5944004181433901 and parameters: {'C': 1.0530354397808819, 'solver': 'liblinear'}. Best is trial 236 with value: 0.5945206794543682.
[I 2024-11-06 19:57:40,303] Trial 615 finished with value: 0.5944841377451722 and parameters: {'C': 0.37914326862975145, 'solver': 'liblinear'}. Best is trial 236 with value: 0.5945206794543682.
[I 2024-11-06 19:57:41,979] Trial 616 finished with value: 0.5942081302033759 and parameters: {'C': 0.19303708467128514, 'solver': 'liblinear'}. Best is trial 236 with value: 0.5945206794543682.
[I 2024-11-06 19:57:43,725] Trial 617 finished with value: 0.5944381827960278 and parameters: {'C': 0.783545118648576, 'solver': 'liblinear'}. Best is trial 236 with value: 0.5945206794543682.
[I 2024-11-06 19:57:45,756] Trial 618 finished with value: 0.594458151416214 and parameters: {'C': 0.4925833793136149, 'solver': 'liblinear'}. Best is trial 236 with value: 0.5945206794543682.
[I 2024-11-06 19:57:47,562] Trial 619 finished with value: 0.5944939705946621 and parameters: {'C': 0.3799049735985234, 'solver': 'liblinear'}. Best is trial 236 with value: 0.5945206794543682.
[I 2024-11-06 19:57:49,333] Trial 620 finished with value: 0.5944368942992051 and parameters: {'C': 0.625197207848124, 'solver': 'liblinear'}. Best is trial 236 with value: 0.5945206794543682.
[I 2024-11-06 19:57:50,850] Trial 621 finished with value: 0.5942251005511341 and parameters: {'C': 0.24133898974273266, 'solver': 'liblinear'}. Best is trial 236 with value: 0.5945206794543682.
[I 2024-11-06 19:57:52,550] Trial 622 finished with value: 0.594400523374502 and parameters: {'C': 0.8749693916947646, 'solver': 'liblinear'}. Best is trial 236 with value: 0.5945206794543682.
[I 2024-11-06 19:57:54,321] Trial 623 finished with value: 0.594458151416214 and parameters: {'C': 0.4793694984114655, 'solver': 'liblinear'}. Best is trial 236 with value: 0.5945206794543682.
[I 2024-11-06 19:57:55,536] Trial 624 finished with value: 0.5887795732607083 and parameters: {'C': 0.005680439789696845, 'solver': 'liblinear'}. Best is trial 236 with value: 0.5945206794543682.
[I 2024-11-06 19:57:57,287] Trial 625 finished with value: 0.5944271055176585 and parameters: {'C': 0.621911275329114, 'solver': 'liblinear'}. Best is trial 236 with value: 0.5945206794543682.
[I 2024-11-06 19:57:58,886] Trial 626 finished with value: 0.5944433941781605 and parameters: {'C': 0.3287064014474099, 'solver': 'liblinear'}. Best is trial 236 with value: 0.5945206794543682.
[I 2024-11-06 19:58:00,437] Trial 627 finished with value: 0.5941572374865304 and parameters: {'C': 0.16775251022032764, 'solver': 'liblinear'}. Best is trial 236 with value: 0.5945206794543682.
[I 2024-11-06 19:58:02,276] Trial 628 finished with value: 0.5944382255861191 and parameters: {'C': 0.8002531372054438, 'solver': 'liblinear'}. Best is trial 236 with value: 0.5945206794543682.
[I 2024-11-06 19:58:04,134] Trial 629 finished with value: 0.5944538960644219 and parameters: {'C': 0.4688539031275452, 'solver': 'liblinear'}. Best is trial 236 with value: 0.5945206794543682.
[I 2024-11-06 19:58:05,339] Trial 630 finished with value: 0.5941951403840793 and parameters: {'C': 0.6575461388933616, 'solver': 'lbfgs'}. Best is trial 236 with value: 0.5945206794543682.
[I 2024-11-06 19:58:07,018] Trial 631 finished with value: 0.5943849142485327 and parameters: {'C': 1.0081003730946458, 'solver': 'liblinear'}. Best is trial 236 with value: 0.5945206794543682.
[I 2024-11-06 19:58:08,490] Trial 632 finished with value: 0.5941296159916997 and parameters: {'C': 0.18575053094308566, 'solver': 'liblinear'}. Best is trial 236 with value: 0.5945206794543682.
[I 2024-11-06 19:58:10,232] Trial 633 finished with value: 0.5945010479847608 and parameters: {'C': 0.3940156176100341, 'solver': 'liblinear'}. Best is trial 236 with value: 0.5945206794543682.
[I 2024-11-06 19:58:12,187] Trial 634 finished with value: 0.5944662864538506 and parameters: {'C': 0.5835688605558391, 'solver': 'liblinear'}. Best is trial 236 with value: 0.5945206794543682.
[I 2024-11-06 19:58:13,816] Trial 635 finished with value: 0.5944490714118467 and parameters: {'C': 0.33543998359839433, 'solver': 'liblinear'}. Best is trial 236 with value: 0.5945206794543682.
[I 2024-11-06 19:58:15,586] Trial 636 finished with value: 0.5944480137801269 and parameters: {'C': 0.7882476812207161, 'solver': 'liblinear'}. Best is trial 236 with value: 0.5945206794543682.
[I 2024-11-06 19:58:17,455] Trial 637 finished with value: 0.5943977600835995 and parameters: {'C': 4.168596684909758, 'solver': 'liblinear'}. Best is trial 236 with value: 0.5945206794543682.
[I 2024-11-06 19:58:19,220] Trial 638 finished with value: 0.5944075915572162 and parameters: {'C': 3.854514636636366, 'solver': 'liblinear'}. Best is trial 236 with value: 0.5945206794543682.
[I 2024-11-06 19:58:20,724] Trial 639 finished with value: 0.59413776668458 and parameters: {'C': 0.1577824055096546, 'solver': 'liblinear'}. Best is trial 236 with value: 0.5945206794543682.
[I 2024-11-06 19:58:22,500] Trial 640 finished with value: 0.594458151416214 and parameters: {'C': 0.4850965742842709, 'solver': 'liblinear'}. Best is trial 236 with value: 0.5945206794543682.
[I 2024-11-06 19:58:24,152] Trial 641 finished with value: 0.5943894864545646 and parameters: {'C': 9.321921417342796, 'solver': 'liblinear'}. Best is trial 236 with value: 0.5945206794543682.
[I 2024-11-06 19:58:25,749] Trial 642 finished with value: 0.589007315680484 and parameters: {'C': 0.0061738764576224625, 'solver': 'liblinear'}. Best is trial 236 with value: 0.5945206794543682.
[I 2024-11-06 19:58:27,551] Trial 643 finished with value: 0.5944507362778312 and parameters: {'C': 0.6647580303246031, 'solver': 'liblinear'}. Best is trial 236 with value: 0.5945206794543682.
[I 2024-11-06 19:58:29,257] Trial 644 finished with value: 0.5944264109351601 and parameters: {'C': 0.31538557557565294, 'solver': 'liblinear'}. Best is trial 236 with value: 0.5945206794543682.
[I 2024-11-06 19:58:30,982] Trial 645 finished with value: 0.5944033476557997 and parameters: {'C': 6.823993064185849, 'solver': 'liblinear'}. Best is trial 236 with value: 0.5945206794543682.
[I 2024-11-06 19:58:32,887] Trial 646 finished with value: 0.5943808274095643 and parameters: {'C': 0.912955964131273, 'solver': 'liblinear'}. Best is trial 236 with value: 0.5945206794543682.
[I 2024-11-06 19:58:34,628] Trial 647 finished with value: 0.5944829311442884 and parameters: {'C': 0.4464479094220175, 'solver': 'liblinear'}. Best is trial 236 with value: 0.5945206794543682.
[I 2024-11-06 19:58:36,246] Trial 648 finished with value: 0.5942039389027027 and parameters: {'C': 0.2115191064367396, 'solver': 'liblinear'}. Best is trial 236 with value: 0.5945206794543682.
[I 2024-11-06 19:58:38,182] Trial 649 finished with value: 0.5944271055176585 and parameters: {'C': 0.6227905166272129, 'solver': 'liblinear'}. Best is trial 236 with value: 0.5945206794543682.
[I 2024-11-06 19:58:40,064] Trial 650 finished with value: 0.5944743476921779 and parameters: {'C': 0.37544530187328934, 'solver': 'liblinear'}. Best is trial 236 with value: 0.5945206794543682.
[I 2024-11-06 19:58:41,369] Trial 651 finished with value: 0.5943603593661961 and parameters: {'C': 1.0580307399751265, 'solver': 'lbfgs'}. Best is trial 236 with value: 0.5945206794543682.
[I 2024-11-06 19:58:43,146] Trial 652 finished with value: 0.5944564825190385 and parameters: {'C': 0.5922292460823552, 'solver': 'liblinear'}. Best is trial 236 with value: 0.5945206794543682.
[I 2024-11-06 19:58:44,901] Trial 653 finished with value: 0.5943935986935767 and parameters: {'C': 5.676238690936372, 'solver': 'liblinear'}. Best is trial 236 with value: 0.5945206794543682.
[I 2024-11-06 19:58:46,426] Trial 654 finished with value: 0.5941306048281534 and parameters: {'C': 0.1534533940588264, 'solver': 'liblinear'}. Best is trial 236 with value: 0.5945206794543682.
[I 2024-11-06 19:58:48,123] Trial 655 finished with value: 0.5944382255861191 and parameters: {'C': 0.8080184566308826, 'solver': 'liblinear'}. Best is trial 236 with value: 0.5945206794543682.
[I 2024-11-06 19:58:49,978] Trial 656 finished with value: 0.5945165657501879 and parameters: {'C': 0.42809300605609246, 'solver': 'liblinear'}. Best is trial 236 with value: 0.5945206794543682.
[I 2024-11-06 19:58:51,713] Trial 657 finished with value: 0.594458151416214 and parameters: {'C': 0.48223048344940944, 'solver': 'liblinear'}. Best is trial 236 with value: 0.5945206794543682.
[I 2024-11-06 19:58:53,483] Trial 658 finished with value: 0.5943928145789986 and parameters: {'C': 0.3039300127803573, 'solver': 'liblinear'}. Best is trial 236 with value: 0.5945206794543682.
[I 2024-11-06 19:58:55,327] Trial 659 finished with value: 0.5944507362778312 and parameters: {'C': 0.6687896828645838, 'solver': 'liblinear'}. Best is trial 236 with value: 0.5945206794543682.
[I 2024-11-06 19:58:57,137] Trial 660 finished with value: 0.5944200192689717 and parameters: {'C': 0.8506618060022524, 'solver': 'liblinear'}. Best is trial 236 with value: 0.5945206794543682.
[I 2024-11-06 19:58:58,657] Trial 661 finished with value: 0.5941079192826118 and parameters: {'C': 0.13100341835773283, 'solver': 'liblinear'}. Best is trial 236 with value: 0.5945206794543682.
[I 2024-11-06 19:59:00,622] Trial 662 finished with value: 0.594458151416214 and parameters: {'C': 0.4869122957256915, 'solver': 'liblinear'}. Best is trial 236 with value: 0.5945206794543682.
[I 2024-11-06 19:59:02,433] Trial 663 finished with value: 0.5944264109351601 and parameters: {'C': 0.3120765207122433, 'solver': 'liblinear'}. Best is trial 236 with value: 0.5945206794543682.
[I 2024-11-06 19:59:04,485] Trial 664 finished with value: 0.5944465743982909 and parameters: {'C': 0.639527952480252, 'solver': 'liblinear'}. Best is trial 236 with value: 0.5945206794543682.
[I 2024-11-06 19:59:06,225] Trial 665 finished with value: 0.59413776668458 and parameters: {'C': 0.15778177686741007, 'solver': 'liblinear'}. Best is trial 236 with value: 0.5945206794543682.
[I 2024-11-06 19:59:07,554] Trial 666 finished with value: 0.5885652552149371 and parameters: {'C': 0.005599222393281034, 'solver': 'liblinear'}. Best is trial 236 with value: 0.5945206794543682.
[I 2024-11-06 19:59:09,347] Trial 667 finished with value: 0.5943905408566786 and parameters: {'C': 1.1075135167798467, 'solver': 'liblinear'}. Best is trial 236 with value: 0.5945206794543682.
[I 2024-11-06 19:59:11,100] Trial 668 finished with value: 0.5944704740338647 and parameters: {'C': 0.4616723303928174, 'solver': 'liblinear'}. Best is trial 236 with value: 0.5945206794543682.
[I 2024-11-06 19:59:12,784] Trial 669 finished with value: 0.5944283946020199 and parameters: {'C': 0.77924958035551, 'solver': 'liblinear'}. Best is trial 236 with value: 0.5945206794543682.
[I 2024-11-06 19:59:14,467] Trial 670 finished with value: 0.5943550128177442 and parameters: {'C': 0.29124846950654826, 'solver': 'liblinear'}. Best is trial 236 with value: 0.5945206794543682.
[I 2024-11-06 19:59:16,472] Trial 671 finished with value: 0.5944524591081727 and parameters: {'C': 0.533879037652677, 'solver': 'liblinear'}. Best is trial 236 with value: 0.5945206794543682.
[I 2024-11-06 19:59:17,707] Trial 672 finished with value: 0.59422300526517 and parameters: {'C': 6.486691826065057, 'solver': 'lbfgs'}. Best is trial 236 with value: 0.5945206794543682.
[I 2024-11-06 19:59:19,626] Trial 673 finished with value: 0.5944507362778312 and parameters: {'C': 0.671725532649213, 'solver': 'liblinear'}. Best is trial 236 with value: 0.5945206794543682.
[I 2024-11-06 19:59:21,254] Trial 674 finished with value: 0.5943550128177442 and parameters: {'C': 0.2925689072394772, 'solver': 'liblinear'}. Best is trial 236 with value: 0.5945206794543682.
[I 2024-11-06 19:59:22,962] Trial 675 finished with value: 0.5943849397349453 and parameters: {'C': 0.94467251181702, 'solver': 'liblinear'}. Best is trial 236 with value: 0.5945206794543682.
[I 2024-11-06 19:59:24,713] Trial 676 finished with value: 0.5944787694630966 and parameters: {'C': 0.44873778949402576, 'solver': 'liblinear'}. Best is trial 236 with value: 0.5945206794543682.
[I 2024-11-06 19:59:26,322] Trial 677 finished with value: 0.5942292030490468 and parameters: {'C': 0.22700403788964912, 'solver': 'liblinear'}. Best is trial 236 with value: 0.5945206794543682.
[I 2024-11-06 19:59:28,056] Trial 678 finished with value: 0.5944465743982909 and parameters: {'C': 0.64242728543136, 'solver': 'liblinear'}. Best is trial 236 with value: 0.5945206794543682.
[I 2024-11-06 19:59:29,843] Trial 679 finished with value: 0.5944746354238873 and parameters: {'C': 0.44988236042284746, 'solver': 'liblinear'}. Best is trial 236 with value: 0.5945206794543682.
[I 2024-11-06 19:59:31,594] Trial 680 finished with value: 0.5944340913413828 and parameters: {'C': 0.8039623193335954, 'solver': 'liblinear'}. Best is trial 236 with value: 0.5945206794543682.
[I 2024-11-06 19:59:33,202] Trial 681 finished with value: 0.59413776668458 and parameters: {'C': 0.1582274779178906, 'solver': 'liblinear'}. Best is trial 236 with value: 0.5945206794543682.
[I 2024-11-06 19:59:34,615] Trial 682 finished with value: 0.5895929598389451 and parameters: {'C': 0.007282283527560163, 'solver': 'liblinear'}. Best is trial 236 with value: 0.5945206794543682.
[I 2024-11-06 19:59:36,382] Trial 683 finished with value: 0.5944841377451722 and parameters: {'C': 0.3790839510878687, 'solver': 'liblinear'}. Best is trial 236 with value: 0.5945206794543682.
[I 2024-11-06 19:59:38,105] Trial 684 finished with value: 0.5944662864538506 and parameters: {'C': 0.5823454961487661, 'solver': 'liblinear'}. Best is trial 236 with value: 0.5945206794543682.
[I 2024-11-06 19:59:39,767] Trial 685 finished with value: 0.5944490714118467 and parameters: {'C': 0.3386870440386678, 'solver': 'liblinear'}. Best is trial 236 with value: 0.5945206794543682.
[I 2024-11-06 19:59:41,663] Trial 686 finished with value: 0.5944382005892241 and parameters: {'C': 0.760817383848715, 'solver': 'liblinear'}. Best is trial 236 with value: 0.5945206794543682.
[I 2024-11-06 19:59:43,384] Trial 687 finished with value: 0.5944116215722328 and parameters: {'C': 2.1867093987270803, 'solver': 'liblinear'}. Best is trial 236 with value: 0.5945206794543682.
[I 2024-11-06 19:59:45,145] Trial 688 finished with value: 0.5944623222192947 and parameters: {'C': 0.5252330212803865, 'solver': 'liblinear'}. Best is trial 236 with value: 0.5945206794543682.
[I 2024-11-06 19:59:46,730] Trial 689 finished with value: 0.5942194754657419 and parameters: {'C': 0.20928980688990217, 'solver': 'liblinear'}. Best is trial 236 with value: 0.5945206794543682.
[I 2024-11-06 19:59:48,797] Trial 690 finished with value: 0.5944045676268799 and parameters: {'C': 1.0861414798057079, 'solver': 'liblinear'}. Best is trial 236 with value: 0.5945206794543682.
[I 2024-11-06 19:59:50,864] Trial 691 finished with value: 0.594400523374502 and parameters: {'C': 0.8942780410192404, 'solver': 'liblinear'}. Best is trial 236 with value: 0.5945206794543682.
[I 2024-11-06 19:59:52,535] Trial 692 finished with value: 0.5944466779001673 and parameters: {'C': 0.59544600243069, 'solver': 'liblinear'}. Best is trial 236 with value: 0.5945206794543682.
[I 2024-11-06 19:59:54,206] Trial 693 finished with value: 0.5944840977210006 and parameters: {'C': 0.3718014359122858, 'solver': 'liblinear'}. Best is trial 236 with value: 0.5945206794543682.
[I 2024-11-06 19:59:55,444] Trial 694 finished with value: 0.5941190159437222 and parameters: {'C': 0.1467038407786881, 'solver': 'lbfgs'}. Best is trial 236 with value: 0.5945206794543682.
[I 2024-11-06 19:59:57,144] Trial 695 finished with value: 0.5944465036747404 and parameters: {'C': 0.7165798298627875, 'solver': 'liblinear'}. Best is trial 236 with value: 0.5945206794543682.
[I 2024-11-06 19:59:58,835] Trial 696 finished with value: 0.5945025209280864 and parameters: {'C': 0.4399791863926171, 'solver': 'liblinear'}. Best is trial 236 with value: 0.5945206794543682.
[I 2024-11-06 20:00:00,295] Trial 697 finished with value: 0.5941900002860269 and parameters: {'C': 0.2013098675303416, 'solver': 'liblinear'}. Best is trial 236 with value: 0.5945206794543682.
[I 2024-11-06 20:00:02,253] Trial 698 finished with value: 0.594458151416214 and parameters: {'C': 0.4861123457842972, 'solver': 'liblinear'}. Best is trial 236 with value: 0.5945206794543682.
[I 2024-11-06 20:00:03,530] Trial 699 finished with value: 0.5859108213882223 and parameters: {'C': 0.0036251037993811353, 'solver': 'liblinear'}. Best is trial 236 with value: 0.5945206794543682.
[I 2024-11-06 20:00:05,330] Trial 700 finished with value: 0.5944424214116404 and parameters: {'C': 0.6819595564252561, 'solver': 'liblinear'}. Best is trial 236 with value: 0.5945206794543682.
[I 2024-11-06 20:00:06,816] Trial 701 finished with value: 0.594374670015522 and parameters: {'C': 0.29735325872721163, 'solver': 'liblinear'}. Best is trial 236 with value: 0.5945206794543682.
[I 2024-11-06 20:00:08,610] Trial 702 finished with value: 0.594400523374502 and parameters: {'C': 0.8670550030703648, 'solver': 'liblinear'}. Best is trial 236 with value: 0.5945206794543682.
[I 2024-11-06 20:00:10,506] Trial 703 finished with value: 0.5944664551671568 and parameters: {'C': 0.5115722981626584, 'solver': 'liblinear'}. Best is trial 236 with value: 0.5945206794543682.
