[I 2024-11-06 20:00:12,293] Trial 704 finished with value: 0.5944490714118467 and parameters: {'C': 0.33925110556791793, 'solver': 'liblinear'}. Best is trial 236 with value: 0.5945206794543682.
[I 2024-11-06 20:00:14,227] Trial 705 finished with value: 0.5944507362778312 and parameters: {'C': 0.6574622907422283, 'solver': 'liblinear'}. Best is trial 236 with value: 0.5945206794543682.
[I 2024-11-06 20:00:15,136] Trial 706 finished with value: 0.5671454862007724 and parameters: {'C': 0.000992292440501752, 'solver': 'liblinear'}. Best is trial 236 with value: 0.5945206794543682.
[I 2024-11-06 20:00:16,798] Trial 707 finished with value: 0.5944433941781605 and parameters: {'C': 0.3278720610863088, 'solver': 'liblinear'}. Best is trial 236 with value: 0.5945206794543682.
[I 2024-11-06 20:00:18,683] Trial 708 finished with value: 0.5944044940076904 and parameters: {'C': 0.9974584263130719, 'solver': 'liblinear'}. Best is trial 236 with value: 0.5945206794543682.
[I 2024-11-06 20:00:20,469] Trial 709 finished with value: 0.5944719394321811 and parameters: {'C': 0.5630358522582112, 'solver': 'liblinear'}. Best is trial 236 with value: 0.5945206794543682.
[I 2024-11-06 20:00:22,120] Trial 710 finished with value: 0.5941296159916997 and parameters: {'C': 0.18492072648386296, 'solver': 'liblinear'}. Best is trial 236 with value: 0.5945206794543682.
[I 2024-11-06 20:00:23,917] Trial 711 finished with value: 0.5944381827960278 and parameters: {'C': 0.7792119851294232, 'solver': 'liblinear'}. Best is trial 236 with value: 0.5945206794543682.
[I 2024-11-06 20:00:25,766] Trial 712 finished with value: 0.594458151416214 and parameters: {'C': 0.48776228626136675, 'solver': 'liblinear'}. Best is trial 236 with value: 0.5945206794543682.
[I 2024-11-06 20:00:27,794] Trial 713 finished with value: 0.5943977600835995 and parameters: {'C': 4.680171325547012, 'solver': 'liblinear'}. Best is trial 236 with value: 0.5945206794543682.
[I 2024-11-06 20:00:29,211] Trial 714 finished with value: 0.594255397488834 and parameters: {'C': 0.30886337239959244, 'solver': 'lbfgs'}. Best is trial 236 with value: 0.5945206794543682.
[I 2024-11-06 20:00:30,927] Trial 715 finished with value: 0.5944507362778312 and parameters: {'C': 0.6591799004207246, 'solver': 'liblinear'}. Best is trial 236 with value: 0.5945206794543682.
[I 2024-11-06 20:00:32,625] Trial 716 finished with value: 0.5944033476557997 and parameters: {'C': 7.228570369288956, 'solver': 'liblinear'}. Best is trial 236 with value: 0.5945206794543682.
[I 2024-11-06 20:00:34,376] Trial 717 finished with value: 0.5945206794543682 and parameters: {'C': 0.42067942156418947, 'solver': 'liblinear'}. Best is trial 236 with value: 0.5945206794543682.
[I 2024-11-06 20:00:36,192] Trial 718 finished with value: 0.594400523374502 and parameters: {'C': 0.8661582811863222, 'solver': 'liblinear'}. Best is trial 236 with value: 0.5945206794543682.
[I 2024-11-06 20:00:38,103] Trial 719 finished with value: 0.5941572731736537 and parameters: {'C': 0.16733859259856998, 'solver': 'liblinear'}. Best is trial 236 with value: 0.5945206794543682.
[I 2024-11-06 20:00:40,149] Trial 720 finished with value: 0.5944524591081727 and parameters: {'C': 0.5400653103200291, 'solver': 'liblinear'}. Best is trial 236 with value: 0.5945206794543682.
[I 2024-11-06 20:00:42,066] Trial 721 finished with value: 0.594400328171304 and parameters: {'C': 1.174022074829239, 'solver': 'liblinear'}. Best is trial 236 with value: 0.5945206794543682.
[I 2024-11-06 20:00:43,643] Trial 722 finished with value: 0.5943158594047946 and parameters: {'C': 0.27444003965732755, 'solver': 'liblinear'}. Best is trial 236 with value: 0.5945206794543682.
[I 2024-11-06 20:00:45,429] Trial 723 finished with value: 0.5944746354238873 and parameters: {'C': 0.45055686562735875, 'solver': 'liblinear'}. Best is trial 236 with value: 0.5945206794543682.
[I 2024-11-06 20:00:47,244] Trial 724 finished with value: 0.5944465036747404 and parameters: {'C': 0.6920094585116375, 'solver': 'liblinear'}. Best is trial 236 with value: 0.5945206794543682.
[I 2024-11-06 20:00:48,765] Trial 725 finished with value: 0.5941590456937931 and parameters: {'C': 0.19174212764229862, 'solver': 'liblinear'}. Best is trial 236 with value: 0.5945206794543682.
[I 2024-11-06 20:00:50,500] Trial 726 finished with value: 0.5944490714118467 and parameters: {'C': 0.33622712373726193, 'solver': 'liblinear'}. Best is trial 236 with value: 0.5945206794543682.
[I 2024-11-06 20:00:52,262] Trial 727 finished with value: 0.5943808274095643 and parameters: {'C': 0.9136825139955247, 'solver': 'liblinear'}. Best is trial 236 with value: 0.5945206794543682.
[I 2024-11-06 20:00:54,164] Trial 728 finished with value: 0.5944564825190385 and parameters: {'C': 0.5853278565707596, 'solver': 'liblinear'}. Best is trial 236 with value: 0.5945206794543682.
[I 2024-11-06 20:00:55,742] Trial 729 finished with value: 0.5941276981185759 and parameters: {'C': 0.13822662698116428, 'solver': 'liblinear'}. Best is trial 236 with value: 0.5945206794543682.
[I 2024-11-06 20:00:57,508] Trial 730 finished with value: 0.5944746354238873 and parameters: {'C': 0.4519923657579681, 'solver': 'liblinear'}. Best is trial 236 with value: 0.5945206794543682.
[I 2024-11-06 20:00:59,122] Trial 731 finished with value: 0.5944033476557997 and parameters: {'C': 8.053275892645814, 'solver': 'liblinear'}. Best is trial 236 with value: 0.5945206794543682.
[I 2024-11-06 20:01:00,937] Trial 732 finished with value: 0.5944341071243737 and parameters: {'C': 0.7377158858840711, 'solver': 'liblinear'}. Best is trial 236 with value: 0.5945206794543682.
[I 2024-11-06 20:01:02,448] Trial 733 finished with value: 0.5874992222561068 and parameters: {'C': 0.0044680977954758005, 'solver': 'liblinear'}. Best is trial 236 with value: 0.5945206794543682.
[I 2024-11-06 20:01:04,184] Trial 734 finished with value: 0.5943158594047946 and parameters: {'C': 0.27413828693978004, 'solver': 'liblinear'}. Best is trial 236 with value: 0.5945206794543682.
[I 2024-11-06 20:01:05,945] Trial 735 finished with value: 0.5944662864538506 and parameters: {'C': 0.5840752604072178, 'solver': 'liblinear'}. Best is trial 236 with value: 0.5945206794543682.
[I 2024-11-06 20:01:07,515] Trial 736 finished with value: 0.5941797461217276 and parameters: {'C': 0.41365332281706985, 'solver': 'lbfgs'}. Best is trial 236 with value: 0.5945206794543682.
[I 2024-11-06 20:01:09,234] Trial 737 finished with value: 0.5943849142485327 and parameters: {'C': 1.0094752989889497, 'solver': 'liblinear'}. Best is trial 236 with value: 0.5945206794543682.
[I 2024-11-06 20:01:10,906] Trial 738 finished with value: 0.5944381827960278 and parameters: {'C': 0.7812538271159539, 'solver': 'liblinear'}. Best is trial 236 with value: 0.5945206794543682.
[I 2024-11-06 20:01:12,443] Trial 739 finished with value: 0.5944490714118467 and parameters: {'C': 0.3370628711792624, 'solver': 'liblinear'}. Best is trial 236 with value: 0.5945206794543682.
[I 2024-11-06 20:01:14,275] Trial 740 finished with value: 0.5944564825190385 and parameters: {'C': 0.5879720422200916, 'solver': 'liblinear'}. Best is trial 236 with value: 0.5945206794543682.
[I 2024-11-06 20:01:15,825] Trial 741 finished with value: 0.5941475702588448 and parameters: {'C': 0.17595253233305808, 'solver': 'liblinear'}. Best is trial 236 with value: 0.5945206794543682.
[I 2024-11-06 20:01:17,514] Trial 742 finished with value: 0.594458151416214 and parameters: {'C': 0.48097733305429174, 'solver': 'liblinear'}. Best is trial 236 with value: 0.5945206794543682.
[I 2024-11-06 20:01:19,171] Trial 743 finished with value: 0.5944381827960278 and parameters: {'C': 0.7832823306107407, 'solver': 'liblinear'}. Best is trial 236 with value: 0.5945206794543682.
[I 2024-11-06 20:01:20,718] Trial 744 finished with value: 0.5943853074808157 and parameters: {'C': 8.674369674621214, 'solver': 'liblinear'}. Best is trial 236 with value: 0.5945206794543682.
[I 2024-11-06 20:01:22,501] Trial 745 finished with value: 0.5944784820183935 and parameters: {'C': 0.35630327110146054, 'solver': 'liblinear'}. Best is trial 236 with value: 0.5945206794543682.
[I 2024-11-06 20:01:24,013] Trial 746 finished with value: 0.5940997641746721 and parameters: {'C': 0.13896656741793156, 'solver': 'liblinear'}. Best is trial 236 with value: 0.5945206794543682.
[I 2024-11-06 20:01:25,690] Trial 747 finished with value: 0.5944229713756195 and parameters: {'C': 0.613447589284072, 'solver': 'liblinear'}. Best is trial 236 with value: 0.5945206794543682.
[I 2024-11-06 20:01:27,242] Trial 748 finished with value: 0.5944629786163811 and parameters: {'C': 0.348327936791706, 'solver': 'liblinear'}. Best is trial 236 with value: 0.5945206794543682.
[I 2024-11-06 20:01:28,953] Trial 749 finished with value: 0.5943849397349453 and parameters: {'C': 0.9454954587994956, 'solver': 'liblinear'}. Best is trial 236 with value: 0.5945206794543682.
[I 2024-11-06 20:01:30,741] Trial 750 finished with value: 0.5944721534945667 and parameters: {'C': 0.5211818032728776, 'solver': 'liblinear'}. Best is trial 236 with value: 0.5945206794543682.
[I 2024-11-06 20:01:32,768] Trial 751 finished with value: 0.5944075915572162 and parameters: {'C': 3.103866088712874, 'solver': 'liblinear'}. Best is trial 236 with value: 0.5945206794543682.
[I 2024-11-06 20:01:34,479] Trial 752 finished with value: 0.5941614872224484 and parameters: {'C': 0.17194267032888144, 'solver': 'liblinear'}. Best is trial 236 with value: 0.5945206794543682.
[I 2024-11-06 20:01:36,375] Trial 753 finished with value: 0.5944465036747404 and parameters: {'C': 0.72016008914186, 'solver': 'liblinear'}. Best is trial 236 with value: 0.5945206794543682.
[I 2024-11-06 20:01:38,087] Trial 754 finished with value: 0.5943935986935767 and parameters: {'C': 5.162373124791704, 'solver': 'liblinear'}. Best is trial 236 with value: 0.5945206794543682.
[I 2024-11-06 20:01:39,804] Trial 755 finished with value: 0.5945010479847608 and parameters: {'C': 0.39390775571331005, 'solver': 'liblinear'}. Best is trial 236 with value: 0.5945206794543682.
[I 2024-11-06 20:01:41,595] Trial 756 finished with value: 0.5944229713756195 and parameters: {'C': 0.616332798586535, 'solver': 'liblinear'}. Best is trial 236 with value: 0.5945206794543682.
[I 2024-11-06 20:01:42,822] Trial 757 finished with value: 0.5941076416768158 and parameters: {'C': 0.20962763078992622, 'solver': 'lbfgs'}. Best is trial 236 with value: 0.5945206794543682.
[I 2024-11-06 20:01:44,273] Trial 758 finished with value: 0.5933949025565904 and parameters: {'C': 0.03231679101774915, 'solver': 'liblinear'}. Best is trial 236 with value: 0.5945206794543682.
[I 2024-11-06 20:01:45,963] Trial 759 finished with value: 0.594400328171304 and parameters: {'C': 1.17392997720209, 'solver': 'liblinear'}. Best is trial 236 with value: 0.5945206794543682.
[I 2024-11-06 20:01:47,654] Trial 760 finished with value: 0.5944241813468227 and parameters: {'C': 0.8330263165779299, 'solver': 'liblinear'}. Best is trial 236 with value: 0.5945206794543682.
[I 2024-11-06 20:01:49,436] Trial 761 finished with value: 0.5944927192421414 and parameters: {'C': 0.44474738703435357, 'solver': 'liblinear'}. Best is trial 236 with value: 0.5945206794543682.
[I 2024-11-06 20:01:51,450] Trial 762 finished with value: 0.5944229713756195 and parameters: {'C': 0.6153439603412987, 'solver': 'liblinear'}. Best is trial 236 with value: 0.5945206794543682.
[I 2024-11-06 20:01:52,924] Trial 763 finished with value: 0.5914528431384738 and parameters: {'C': 0.012895716836077098, 'solver': 'liblinear'}. Best is trial 236 with value: 0.5945206794543682.
[I 2024-11-06 20:01:54,559] Trial 764 finished with value: 0.5943844731739236 and parameters: {'C': 0.29727404600704493, 'solver': 'liblinear'}. Best is trial 236 with value: 0.5945206794543682.
[I 2024-11-06 20:01:56,284] Trial 765 finished with value: 0.594458151416214 and parameters: {'C': 0.49427089887273307, 'solver': 'liblinear'}. Best is trial 236 with value: 0.5945206794543682.
[I 2024-11-06 20:01:57,982] Trial 766 finished with value: 0.5944479887832321 and parameters: {'C': 0.7587331545534095, 'solver': 'liblinear'}. Best is trial 236 with value: 0.5945206794543682.
[I 2024-11-06 20:01:59,671] Trial 767 finished with value: 0.5944067404192159 and parameters: {'C': 0.3080635767857043, 'solver': 'liblinear'}. Best is trial 236 with value: 0.5945206794543682.
[I 2024-11-06 20:02:01,712] Trial 768 finished with value: 0.594394705325907 and parameters: {'C': 0.9952684190513763, 'solver': 'liblinear'}. Best is trial 236 with value: 0.5945206794543682.
[I 2024-11-06 20:02:03,746] Trial 769 finished with value: 0.5944704740338647 and parameters: {'C': 0.4565329254883964, 'solver': 'liblinear'}. Best is trial 236 with value: 0.5945206794543682.
[I 2024-11-06 20:02:05,653] Trial 770 finished with value: 0.5942291921090719 and parameters: {'C': 0.23576048480704054, 'solver': 'liblinear'}. Best is trial 236 with value: 0.5945206794543682.
[I 2024-11-06 20:02:07,665] Trial 771 finished with value: 0.5944466427795936 and parameters: {'C': 0.6304567198870198, 'solver': 'liblinear'}. Best is trial 236 with value: 0.5945206794543682.
[I 2024-11-06 20:02:09,509] Trial 772 finished with value: 0.5944382255861191 and parameters: {'C': 0.815815010431222, 'solver': 'liblinear'}. Best is trial 236 with value: 0.5945206794543682.
[I 2024-11-06 20:02:11,438] Trial 773 finished with value: 0.5944075915572162 and parameters: {'C': 3.457262629304323, 'solver': 'liblinear'}. Best is trial 236 with value: 0.5945206794543682.
[I 2024-11-06 20:02:13,092] Trial 774 finished with value: 0.594171355361161 and parameters: {'C': 0.17433568208758593, 'solver': 'liblinear'}. Best is trial 236 with value: 0.5945206794543682.
[I 2024-11-06 20:02:14,930] Trial 775 finished with value: 0.5944623222192947 and parameters: {'C': 0.5233180734338745, 'solver': 'liblinear'}. Best is trial 236 with value: 0.5945206794543682.
[I 2024-11-06 20:02:16,608] Trial 776 finished with value: 0.5944784820183935 and parameters: {'C': 0.35959542217862217, 'solver': 'liblinear'}. Best is trial 236 with value: 0.5945206794543682.
[I 2024-11-06 20:02:17,788] Trial 777 finished with value: 0.5942768755129453 and parameters: {'C': 0.6694940284203232, 'solver': 'lbfgs'}. Best is trial 236 with value: 0.5945206794543682.
[I 2024-11-06 20:02:19,071] Trial 778 finished with value: 0.5891495184529439 and parameters: {'C': 0.006334154562737615, 'solver': 'liblinear'}. Best is trial 236 with value: 0.5945206794543682.
[I 2024-11-06 20:02:20,821] Trial 779 finished with value: 0.594488232242145 and parameters: {'C': 0.3632206446854638, 'solver': 'liblinear'}. Best is trial 236 with value: 0.5945206794543682.
[I 2024-11-06 20:02:22,710] Trial 780 finished with value: 0.5944623420378875 and parameters: {'C': 0.5137583879258495, 'solver': 'liblinear'}. Best is trial 236 with value: 0.5945206794543682.
[I 2024-11-06 20:02:24,880] Trial 781 finished with value: 0.594400523374502 and parameters: {'C': 0.8948528674785439, 'solver': 'liblinear'}. Best is trial 236 with value: 0.5945206794543682.
[I 2024-11-06 20:02:26,467] Trial 782 finished with value: 0.5941477046269784 and parameters: {'C': 0.1820220264174504, 'solver': 'liblinear'}. Best is trial 236 with value: 0.5945206794543682.
[I 2024-11-06 20:02:28,182] Trial 783 finished with value: 0.5944075915572162 and parameters: {'C': 2.835333777591863, 'solver': 'liblinear'}. Best is trial 236 with value: 0.5945206794543682.
[I 2024-11-06 20:02:30,097] Trial 784 finished with value: 0.5944465341390418 and parameters: {'C': 0.6880977234270786, 'solver': 'liblinear'}. Best is trial 236 with value: 0.5945206794543682.
[I 2024-11-06 20:02:31,703] Trial 785 finished with value: 0.5944418926928379 and parameters: {'C': 0.3198729552996908, 'solver': 'liblinear'}. Best is trial 236 with value: 0.5945206794543682.
[I 2024-11-06 20:02:33,688] Trial 786 finished with value: 0.5943947796287112 and parameters: {'C': 1.0884002644096205, 'solver': 'liblinear'}. Best is trial 236 with value: 0.5945206794543682.
[I 2024-11-06 20:02:35,725] Trial 787 finished with value: 0.5944704740338647 and parameters: {'C': 0.45850144610755406, 'solver': 'liblinear'}. Best is trial 236 with value: 0.5945206794543682.
[I 2024-11-06 20:02:37,492] Trial 788 finished with value: 0.5944229713756195 and parameters: {'C': 0.605896210522598, 'solver': 'liblinear'}. Best is trial 236 with value: 0.5945206794543682.
[I 2024-11-06 20:02:39,088] Trial 789 finished with value: 0.594137487366344 and parameters: {'C': 0.14323689046037014, 'solver': 'liblinear'}. Best is trial 236 with value: 0.5945206794543682.
[I 2024-11-06 20:02:40,344] Trial 790 finished with value: 0.5898373749007384 and parameters: {'C': 0.007856245037308363, 'solver': 'liblinear'}. Best is trial 236 with value: 0.5945206794543682.
[I 2024-11-06 20:02:42,082] Trial 791 finished with value: 0.5944382255861191 and parameters: {'C': 0.8156448019108111, 'solver': 'liblinear'}. Best is trial 236 with value: 0.5945206794543682.
[I 2024-11-06 20:02:43,694] Trial 792 finished with value: 0.5943648159761459 and parameters: {'C': 0.2939556300255006, 'solver': 'liblinear'}. Best is trial 236 with value: 0.5945206794543682.
[I 2024-11-06 20:02:45,471] Trial 793 finished with value: 0.5943977600835995 and parameters: {'C': 2.5556054747878427, 'solver': 'liblinear'}. Best is trial 236 with value: 0.5945206794543682.
[I 2024-11-06 20:02:47,197] Trial 794 finished with value: 0.5945206794543682 and parameters: {'C': 0.4260548401707516, 'solver': 'liblinear'}. Best is trial 236 with value: 0.5945206794543682.
[I 2024-11-06 20:02:48,950] Trial 795 finished with value: 0.594458151416214 and parameters: {'C': 0.4787038939001843, 'solver': 'liblinear'}. Best is trial 236 with value: 0.5945206794543682.
[I 2024-11-06 20:02:50,687] Trial 796 finished with value: 0.5944382411743031 and parameters: {'C': 0.6832011478941458, 'solver': 'liblinear'}. Best is trial 236 with value: 0.5945206794543682.
[I 2024-11-06 20:02:52,425] Trial 797 finished with value: 0.5942152318832434 and parameters: {'C': 0.24803683001244878, 'solver': 'liblinear'}. Best is trial 236 with value: 0.5945206794543682.
[I 2024-11-06 20:02:54,486] Trial 798 finished with value: 0.5944623222192947 and parameters: {'C': 0.5231029858087636, 'solver': 'liblinear'}. Best is trial 236 with value: 0.5945206794543682.
[I 2024-11-06 20:02:55,726] Trial 799 finished with value: 0.5943102071935179 and parameters: {'C': 0.8292703426573135, 'solver': 'lbfgs'}. Best is trial 236 with value: 0.5945206794543682.
[I 2024-11-06 20:02:57,289] Trial 800 finished with value: 0.5942920060110205 and parameters: {'C': 0.2627064166900376, 'solver': 'liblinear'}. Best is trial 236 with value: 0.5945206794543682.
[I 2024-11-06 20:02:59,088] Trial 801 finished with value: 0.5943935986935767 and parameters: {'C': 5.984357667058759, 'solver': 'liblinear'}. Best is trial 236 with value: 0.5945206794543682.
[I 2024-11-06 20:03:01,109] Trial 802 finished with value: 0.5945165657501879 and parameters: {'C': 0.43025749673875074, 'solver': 'liblinear'}. Best is trial 236 with value: 0.5945206794543682.
[I 2024-11-06 20:03:02,986] Trial 803 finished with value: 0.5944044940076904 and parameters: {'C': 0.9955800966258195, 'solver': 'liblinear'}. Best is trial 236 with value: 0.5945206794543682.
[I 2024-11-06 20:03:04,903] Trial 804 finished with value: 0.5944507362778312 and parameters: {'C': 0.6554156732973704, 'solver': 'liblinear'}. Best is trial 236 with value: 0.5945206794543682.
[I 2024-11-06 20:03:06,703] Trial 805 finished with value: 0.594296140039253 and parameters: {'C': 0.26283338377419263, 'solver': 'liblinear'}. Best is trial 236 with value: 0.5945206794543682.
[I 2024-11-06 20:03:08,494] Trial 806 finished with value: 0.5944581611204107 and parameters: {'C': 0.5168605698444274, 'solver': 'liblinear'}. Best is trial 236 with value: 0.5945206794543682.
[I 2024-11-06 20:03:10,112] Trial 807 finished with value: 0.5941614872224484 and parameters: {'C': 0.1702819615759314, 'solver': 'liblinear'}. Best is trial 236 with value: 0.5945206794543682.
[I 2024-11-06 20:03:11,944] Trial 808 finished with value: 0.5944423909473389 and parameters: {'C': 0.7307090144150663, 'solver': 'liblinear'}. Best is trial 236 with value: 0.5945206794543682.
[I 2024-11-06 20:03:13,569] Trial 809 finished with value: 0.5944784820183935 and parameters: {'C': 0.35619560667573014, 'solver': 'liblinear'}. Best is trial 236 with value: 0.5945206794543682.
[I 2024-11-06 20:03:14,776] Trial 810 finished with value: 0.5871590322844048 and parameters: {'C': 0.004194452930908366, 'solver': 'liblinear'}. Best is trial 236 with value: 0.5945206794543682.
[I 2024-11-06 20:03:16,536] Trial 811 finished with value: 0.5944719394321811 and parameters: {'C': 0.5643245572727986, 'solver': 'liblinear'}. Best is trial 236 with value: 0.5945206794543682.
[I 2024-11-06 20:03:18,357] Trial 812 finished with value: 0.5943808274095643 and parameters: {'C': 0.9069086992986594, 'solver': 'liblinear'}. Best is trial 236 with value: 0.5945206794543682.
[I 2024-11-06 20:03:20,110] Trial 813 finished with value: 0.5945037726748497 and parameters: {'C': 0.38258041272922183, 'solver': 'liblinear'}. Best is trial 236 with value: 0.5945206794543682.
[I 2024-11-06 20:03:21,700] Trial 814 finished with value: 0.5941518108598246 and parameters: {'C': 0.1781606677221476, 'solver': 'liblinear'}. Best is trial 236 with value: 0.5945206794543682.
[I 2024-11-06 20:03:23,467] Trial 815 finished with value: 0.5944424619582916 and parameters: {'C': 0.6326717695879179, 'solver': 'liblinear'}. Best is trial 236 with value: 0.5945206794543682.
[I 2024-11-06 20:03:25,449] Trial 816 finished with value: 0.5945025209280864 and parameters: {'C': 0.43998666984183954, 'solver': 'liblinear'}. Best is trial 236 with value: 0.5945206794543682.
