[I 2024-11-06 20:40:09,750] Trial 323 finished with value: 0.592746258170626 and parameters: {'n_estimators': 80, 'max_depth': 6, 'min_samples_split': 2, 'min_samples_leaf': 1}. Best is trial 297 with value: 0.5986474135090558.
[I 2024-11-06 20:40:23,285] Trial 324 finished with value: 0.5783302868450593 and parameters: {'n_estimators': 70, 'max_depth': 38, 'min_samples_split': 3, 'min_samples_leaf': 2}. Best is trial 297 with value: 0.5986474135090558.
[I 2024-11-06 20:40:27,121] Trial 325 finished with value: 0.5920505329299492 and parameters: {'n_estimators': 78, 'max_depth': 4, 'min_samples_split': 2, 'min_samples_leaf': 3}. Best is trial 297 with value: 0.5986474135090558.
[I 2024-11-06 20:40:30,747] Trial 326 finished with value: 0.598517576756202 and parameters: {'n_estimators': 85, 'max_depth': 3, 'min_samples_split': 3, 'min_samples_leaf': 1}. Best is trial 297 with value: 0.5986474135090558.
[I 2024-11-06 20:40:34,799] Trial 327 finished with value: 0.5914416926601018 and parameters: {'n_estimators': 74, 'max_depth': 5, 'min_samples_split': 3, 'min_samples_leaf': 1}. Best is trial 297 with value: 0.5986474135090558.
[I 2024-11-06 20:40:37,695] Trial 328 finished with value: 0.591371237145655 and parameters: {'n_estimators': 83, 'max_depth': 2, 'min_samples_split': 3, 'min_samples_leaf': 2}. Best is trial 297 with value: 0.5986474135090558.
[I 2024-11-06 20:40:40,564] Trial 329 finished with value: 0.5970908253666275 and parameters: {'n_estimators': 64, 'max_depth': 3, 'min_samples_split': 3, 'min_samples_leaf': 1}. Best is trial 297 with value: 0.5986474135090558.
[I 2024-11-06 20:40:58,844] Trial 330 finished with value: 0.5766801239918842 and parameters: {'n_estimators': 90, 'max_depth': 50, 'min_samples_split': 3, 'min_samples_leaf': 1}. Best is trial 297 with value: 0.5986474135090558.
[I 2024-11-06 20:41:02,911] Trial 331 finished with value: 0.5922473519803659 and parameters: {'n_estimators': 78, 'max_depth': 4, 'min_samples_split': 10, 'min_samples_leaf': 1}. Best is trial 297 with value: 0.5986474135090558.
[I 2024-11-06 20:41:05,088] Trial 332 finished with value: 0.5917134222463145 and parameters: {'n_estimators': 69, 'max_depth': 1, 'min_samples_split': 3, 'min_samples_leaf': 2}. Best is trial 297 with value: 0.5986474135090558.
[I 2024-11-06 20:41:17,973] Trial 333 finished with value: 0.5891921256637721 and parameters: {'n_estimators': 86, 'max_depth': 30, 'min_samples_split': 6, 'min_samples_leaf': 10}. Best is trial 297 with value: 0.5986474135090558.
[I 2024-11-06 20:41:20,919] Trial 334 finished with value: 0.5913878577048239 and parameters: {'n_estimators': 81, 'max_depth': 2, 'min_samples_split': 3, 'min_samples_leaf': 1}. Best is trial 297 with value: 0.5986474135090558.
[I 2024-11-06 20:41:26,095] Trial 335 finished with value: 0.5936495733064296 and parameters: {'n_estimators': 74, 'max_depth': 7, 'min_samples_split': 5, 'min_samples_leaf': 1}. Best is trial 297 with value: 0.5986474135090558.
[I 2024-11-06 20:41:29,399] Trial 336 finished with value: 0.5984698599692941 and parameters: {'n_estimators': 77, 'max_depth': 3, 'min_samples_split': 3, 'min_samples_leaf': 2}. Best is trial 297 with value: 0.5986474135090558.
[I 2024-11-06 20:41:33,860] Trial 337 finished with value: 0.5911212983262044 and parameters: {'n_estimators': 83, 'max_depth': 5, 'min_samples_split': 2, 'min_samples_leaf': 1}. Best is trial 297 with value: 0.5986474135090558.
[I 2024-11-06 20:41:45,919] Trial 338 finished with value: 0.5901543911002916 and parameters: {'n_estimators': 88, 'max_depth': 18, 'min_samples_split': 3, 'min_samples_leaf': 2}. Best is trial 297 with value: 0.5986474135090558.
[I 2024-11-06 20:41:48,487] Trial 339 finished with value: 0.5922251752300065 and parameters: {'n_estimators': 73, 'max_depth': 2, 'min_samples_split': 5, 'min_samples_leaf': 1}. Best is trial 297 with value: 0.5986474135090558.
[I 2024-11-06 20:41:52,445] Trial 340 finished with value: 0.5923686030904152 and parameters: {'n_estimators': 79, 'max_depth': 4, 'min_samples_split': 2, 'min_samples_leaf': 1}. Best is trial 297 with value: 0.5986474135090558.
[I 2024-11-06 20:42:04,878] Trial 341 finished with value: 0.5790347269518065 and parameters: {'n_estimators': 67, 'max_depth': 26, 'min_samples_split': 4, 'min_samples_leaf': 1}. Best is trial 297 with value: 0.5986474135090558.
[I 2024-11-06 20:42:08,384] Trial 342 finished with value: 0.598517576756202 and parameters: {'n_estimators': 85, 'max_depth': 3, 'min_samples_split': 3, 'min_samples_leaf': 2}. Best is trial 297 with value: 0.5986474135090558.
[I 2024-11-06 20:42:10,566] Trial 343 finished with value: 0.5918349008137124 and parameters: {'n_estimators': 71, 'max_depth': 1, 'min_samples_split': 3, 'min_samples_leaf': 3}. Best is trial 297 with value: 0.5986474135090558.
[I 2024-11-06 20:42:15,590] Trial 344 finished with value: 0.592823816421283 and parameters: {'n_estimators': 82, 'max_depth': 6, 'min_samples_split': 4, 'min_samples_leaf': 2}. Best is trial 297 with value: 0.5986474135090558.
[I 2024-11-06 20:42:18,827] Trial 345 finished with value: 0.5985496647084861 and parameters: {'n_estimators': 76, 'max_depth': 3, 'min_samples_split': 3, 'min_samples_leaf': 2}. Best is trial 297 with value: 0.5986474135090558.
[I 2024-11-06 20:42:22,625] Trial 346 finished with value: 0.5925911300069718 and parameters: {'n_estimators': 77, 'max_depth': 4, 'min_samples_split': 4, 'min_samples_leaf': 3}. Best is trial 297 with value: 0.5986474135090558.
[I 2024-11-06 20:42:25,286] Trial 347 finished with value: 0.592437301835236 and parameters: {'n_estimators': 74, 'max_depth': 2, 'min_samples_split': 6, 'min_samples_leaf': 2}. Best is trial 297 with value: 0.5986474135090558.
[I 2024-11-06 20:42:29,017] Trial 348 finished with value: 0.5931890767268617 and parameters: {'n_estimators': 68, 'max_depth': 5, 'min_samples_split': 3, 'min_samples_leaf': 4}. Best is trial 297 with value: 0.5986474135090558.
[I 2024-11-06 20:42:32,164] Trial 349 finished with value: 0.5985952096898369 and parameters: {'n_estimators': 72, 'max_depth': 3, 'min_samples_split': 4, 'min_samples_leaf': 10}. Best is trial 297 with value: 0.5986474135090558.
[I 2024-11-06 20:42:35,150] Trial 350 finished with value: 0.5918086755666172 and parameters: {'n_estimators': 57, 'max_depth': 4, 'min_samples_split': 4, 'min_samples_leaf': 10}. Best is trial 297 with value: 0.5986474135090558.
[I 2024-11-06 20:42:37,565] Trial 351 finished with value: 0.5921304222459618 and parameters: {'n_estimators': 63, 'max_depth': 2, 'min_samples_split': 5, 'min_samples_leaf': 10}. Best is trial 297 with value: 0.5986474135090558.
[I 2024-11-06 20:42:39,699] Trial 352 finished with value: 0.5918349008137124 and parameters: {'n_estimators': 71, 'max_depth': 1, 'min_samples_split': 4, 'min_samples_leaf': 10}. Best is trial 297 with value: 0.5986474135090558.
[I 2024-11-06 20:42:42,922] Trial 353 finished with value: 0.5986294604395617 and parameters: {'n_estimators': 74, 'max_depth': 3, 'min_samples_split': 4, 'min_samples_leaf': 7}. Best is trial 297 with value: 0.5986474135090558.
[I 2024-11-06 20:42:46,929] Trial 354 finished with value: 0.5915892578979396 and parameters: {'n_estimators': 71, 'max_depth': 5, 'min_samples_split': 5, 'min_samples_leaf': 9}. Best is trial 297 with value: 0.5986474135090558.
[I 2024-11-06 20:42:50,688] Trial 355 finished with value: 0.5927168421318832 and parameters: {'n_estimators': 75, 'max_depth': 4, 'min_samples_split': 4, 'min_samples_leaf': 5}. Best is trial 297 with value: 0.5986474135090558.
[I 2024-11-06 20:42:53,036] Trial 356 finished with value: 0.5922035389665794 and parameters: {'n_estimators': 65, 'max_depth': 2, 'min_samples_split': 5, 'min_samples_leaf': 6}. Best is trial 297 with value: 0.5986474135090558.
[I 2024-11-06 20:42:55,987] Trial 357 finished with value: 0.5978041066304103 and parameters: {'n_estimators': 67, 'max_depth': 3, 'min_samples_split': 4, 'min_samples_leaf': 8}. Best is trial 297 with value: 0.5986474135090558.
[I 2024-11-06 20:42:59,619] Trial 358 finished with value: 0.5928774319411155 and parameters: {'n_estimators': 73, 'max_depth': 4, 'min_samples_split': 4, 'min_samples_leaf': 7}. Best is trial 297 with value: 0.5986474135090558.
[I 2024-11-06 20:43:04,600] Trial 359 finished with value: 0.593587433527587 and parameters: {'n_estimators': 77, 'max_depth': 6, 'min_samples_split': 5, 'min_samples_leaf': 11}. Best is trial 297 with value: 0.5986474135090558.
[I 2024-11-06 20:43:06,731] Trial 360 finished with value: 0.5917134222463145 and parameters: {'n_estimators': 69, 'max_depth': 1, 'min_samples_split': 4, 'min_samples_leaf': 10}. Best is trial 297 with value: 0.5986474135090558.
[I 2024-11-06 20:43:09,874] Trial 361 finished with value: 0.5985867525282405 and parameters: {'n_estimators': 75, 'max_depth': 3, 'min_samples_split': 4, 'min_samples_leaf': 7}. Best is trial 297 with value: 0.5986474135090558.
[I 2024-11-06 20:43:13,944] Trial 362 finished with value: 0.5930210769465751 and parameters: {'n_estimators': 73, 'max_depth': 5, 'min_samples_split': 5, 'min_samples_leaf': 7}. Best is trial 297 with value: 0.5986474135090558.
[I 2024-11-06 20:43:16,707] Trial 363 finished with value: 0.5921729033109402 and parameters: {'n_estimators': 76, 'max_depth': 2, 'min_samples_split': 4, 'min_samples_leaf': 8}. Best is trial 297 with value: 0.5986474135090558.
[I 2024-11-06 20:43:19,742] Trial 364 finished with value: 0.5983333183998816 and parameters: {'n_estimators': 70, 'max_depth': 3, 'min_samples_split': 4, 'min_samples_leaf': 7}. Best is trial 297 with value: 0.5986474135090558.
[I 2024-11-06 20:43:22,851] Trial 365 finished with value: 0.5926203638267137 and parameters: {'n_estimators': 62, 'max_depth': 4, 'min_samples_split': 5, 'min_samples_leaf': 6}. Best is trial 297 with value: 0.5986474135090558.
[I 2024-11-06 20:43:34,021] Trial 366 finished with value: 0.5899794397044331 and parameters: {'n_estimators': 79, 'max_depth': 20, 'min_samples_split': 4, 'min_samples_leaf': 6}. Best is trial 297 with value: 0.5986474135090558.
[I 2024-11-06 20:43:37,191] Trial 367 finished with value: 0.5986322175714879 and parameters: {'n_estimators': 75, 'max_depth': 3, 'min_samples_split': 3, 'min_samples_leaf': 9}. Best is trial 297 with value: 0.5986474135090558.
[I 2024-11-06 20:43:39,753] Trial 368 finished with value: 0.5922251752300065 and parameters: {'n_estimators': 73, 'max_depth': 2, 'min_samples_split': 4, 'min_samples_leaf': 7}. Best is trial 297 with value: 0.5986474135090558.
[I 2024-11-06 20:43:42,188] Trial 369 finished with value: 0.5922984334783765 and parameters: {'n_estimators': 67, 'max_depth': 2, 'min_samples_split': 6, 'min_samples_leaf': 20}. Best is trial 297 with value: 0.5986474135090558.
[I 2024-11-06 20:43:45,877] Trial 370 finished with value: 0.5925197384028122 and parameters: {'n_estimators': 74, 'max_depth': 4, 'min_samples_split': 5, 'min_samples_leaf': 8}. Best is trial 297 with value: 0.5986474135090558.
[I 2024-11-06 20:43:50,090] Trial 371 finished with value: 0.5920461212444488 and parameters: {'n_estimators': 76, 'max_depth': 5, 'min_samples_split': 3, 'min_samples_leaf': 9}. Best is trial 297 with value: 0.5986474135090558.
[I 2024-11-06 20:43:51,534] Trial 372 finished with value: 0.5909567904027011 and parameters: {'n_estimators': 45, 'max_depth': 1, 'min_samples_split': 2, 'min_samples_leaf': 9}. Best is trial 297 with value: 0.5986474135090558.
[I 2024-11-06 20:43:54,608] Trial 373 finished with value: 0.5979239922222841 and parameters: {'n_estimators': 69, 'max_depth': 3, 'min_samples_split': 4, 'min_samples_leaf': 5}. Best is trial 297 with value: 0.5986474135090558.
[I 2024-11-06 20:43:58,753] Trial 374 finished with value: 0.5920411579894604 and parameters: {'n_estimators': 77, 'max_depth': 5, 'min_samples_split': 3, 'min_samples_leaf': 9}. Best is trial 297 with value: 0.5986474135090558.
[I 2024-11-06 20:44:01,808] Trial 375 finished with value: 0.5985168433326811 and parameters: {'n_estimators': 71, 'max_depth': 3, 'min_samples_split': 2, 'min_samples_leaf': 10}. Best is trial 297 with value: 0.5986474135090558.
[I 2024-11-06 20:44:05,274] Trial 376 finished with value: 0.5932979990428151 and parameters: {'n_estimators': 65, 'max_depth': 4, 'min_samples_split': 4, 'min_samples_leaf': 11}. Best is trial 297 with value: 0.5986474135090558.
[I 2024-11-06 20:44:07,661] Trial 377 finished with value: 0.5917145536290467 and parameters: {'n_estimators': 78, 'max_depth': 1, 'min_samples_split': 3, 'min_samples_leaf': 9}. Best is trial 297 with value: 0.5986474135090558.
[I 2024-11-06 20:44:10,357] Trial 378 finished with value: 0.5922251752300065 and parameters: {'n_estimators': 73, 'max_depth': 2, 'min_samples_split': 5, 'min_samples_leaf': 8}. Best is trial 297 with value: 0.5986474135090558.
[I 2024-11-06 20:44:14,359] Trial 379 finished with value: 0.5922246612662412 and parameters: {'n_estimators': 80, 'max_depth': 4, 'min_samples_split': 3, 'min_samples_leaf': 10}. Best is trial 297 with value: 0.5986474135090558.
[I 2024-11-06 20:44:17,769] Trial 380 finished with value: 0.5982672842421276 and parameters: {'n_estimators': 80, 'max_depth': 3, 'min_samples_split': 2, 'min_samples_leaf': 7}. Best is trial 297 with value: 0.5986474135090558.
[I 2024-11-06 20:44:22,183] Trial 381 finished with value: 0.5930041040873378 and parameters: {'n_estimators': 70, 'max_depth': 6, 'min_samples_split': 4, 'min_samples_leaf': 10}. Best is trial 297 with value: 0.5986474135090558.
[I 2024-11-06 20:44:24,956] Trial 382 finished with value: 0.5923512189710275 and parameters: {'n_estimators': 75, 'max_depth': 2, 'min_samples_split': 5, 'min_samples_leaf': 12}. Best is trial 297 with value: 0.5986474135090558.
[I 2024-11-06 20:44:28,160] Trial 383 finished with value: 0.5932979990428151 and parameters: {'n_estimators': 65, 'max_depth': 4, 'min_samples_split': 4, 'min_samples_leaf': 11}. Best is trial 297 with value: 0.5986474135090558.
[I 2024-11-06 20:44:31,616] Trial 384 finished with value: 0.5982836657606734 and parameters: {'n_estimators': 79, 'max_depth': 3, 'min_samples_split': 3, 'min_samples_leaf': 6}. Best is trial 297 with value: 0.5986474135090558.
[I 2024-11-06 20:44:36,792] Trial 385 finished with value: 0.5936847180479228 and parameters: {'n_estimators': 75, 'max_depth': 7, 'min_samples_split': 3, 'min_samples_leaf': 8}. Best is trial 297 with value: 0.5986474135090558.
[I 2024-11-06 20:44:38,978] Trial 386 finished with value: 0.5918349008137124 and parameters: {'n_estimators': 71, 'max_depth': 1, 'min_samples_split': 2, 'min_samples_leaf': 3}. Best is trial 297 with value: 0.5986474135090558.
[I 2024-11-06 20:44:43,360] Trial 387 finished with value: 0.5927968448778895 and parameters: {'n_estimators': 79, 'max_depth': 5, 'min_samples_split': 6, 'min_samples_leaf': 7}. Best is trial 297 with value: 0.5986474135090558.
[I 2024-11-06 20:44:51,542] Trial 388 finished with value: 0.5919137705064176 and parameters: {'n_estimators': 67, 'max_depth': 16, 'min_samples_split': 4, 'min_samples_leaf': 10}. Best is trial 297 with value: 0.5986474135090558.
[I 2024-11-06 20:44:54,196] Trial 389 finished with value: 0.5923512189710275 and parameters: {'n_estimators': 75, 'max_depth': 2, 'min_samples_split': 2, 'min_samples_leaf': 9}. Best is trial 297 with value: 0.5986474135090558.
[I 2024-11-06 20:45:01,654] Trial 390 finished with value: 0.5929731214775444 and parameters: {'n_estimators': 71, 'max_depth': 13, 'min_samples_split': 5, 'min_samples_leaf': 7}. Best is trial 297 with value: 0.5986474135090558.
[I 2024-11-06 20:45:05,377] Trial 391 finished with value: 0.5983941021221584 and parameters: {'n_estimators': 81, 'max_depth': 3, 'min_samples_split': 3, 'min_samples_leaf': 9}. Best is trial 297 with value: 0.5986474135090558.
[I 2024-11-06 20:45:09,088] Trial 392 finished with value: 0.5926545333360377 and parameters: {'n_estimators': 76, 'max_depth': 4, 'min_samples_split': 10, 'min_samples_leaf': 6}. Best is trial 297 with value: 0.5986474135090558.
[I 2024-11-06 20:45:11,939] Trial 393 finished with value: 0.5913878577048239 and parameters: {'n_estimators': 81, 'max_depth': 2, 'min_samples_split': 4, 'min_samples_leaf': 11}. Best is trial 297 with value: 0.5986474135090558.
[I 2024-11-06 20:45:15,106] Trial 394 finished with value: 0.5985952096898369 and parameters: {'n_estimators': 72, 'max_depth': 3, 'min_samples_split': 2, 'min_samples_leaf': 10}. Best is trial 297 with value: 0.5986474135090558.
[I 2024-11-06 20:45:17,937] Trial 395 finished with value: 0.5982912402392642 and parameters: {'n_estimators': 68, 'max_depth': 3, 'min_samples_split': 2, 'min_samples_leaf': 10}. Best is trial 297 with value: 0.5986474135090558.
[I 2024-11-06 20:45:22,106] Trial 396 finished with value: 0.5917176791993892 and parameters: {'n_estimators': 73, 'max_depth': 5, 'min_samples_split': 2, 'min_samples_leaf': 10}. Best is trial 297 with value: 0.5986474135090558.
[I 2024-11-06 20:45:24,374] Trial 397 finished with value: 0.5921340559282825 and parameters: {'n_estimators': 64, 'max_depth': 2, 'min_samples_split': 2, 'min_samples_leaf': 16}. Best is trial 297 with value: 0.5986474135090558.
[I 2024-11-06 20:45:26,583] Trial 398 finished with value: 0.5918349008137124 and parameters: {'n_estimators': 71, 'max_depth': 1, 'min_samples_split': 2, 'min_samples_leaf': 10}. Best is trial 297 with value: 0.5986474135090558.
[I 2024-11-06 20:45:30,313] Trial 399 finished with value: 0.5924571998092588 and parameters: {'n_estimators': 76, 'max_depth': 4, 'min_samples_split': 2, 'min_samples_leaf': 11}. Best is trial 297 with value: 0.5986474135090558.
[I 2024-11-06 20:45:34,152] Trial 400 finished with value: 0.5937937677237071 and parameters: {'n_estimators': 60, 'max_depth': 6, 'min_samples_split': 5, 'min_samples_leaf': 17}. Best is trial 297 with value: 0.5986474135090558.
[I 2024-11-06 20:45:37,181] Trial 401 finished with value: 0.5979225488636988 and parameters: {'n_estimators': 69, 'max_depth': 3, 'min_samples_split': 2, 'min_samples_leaf': 9}. Best is trial 297 with value: 0.5986474135090558.
[I 2024-11-06 20:45:40,744] Trial 402 finished with value: 0.5929338755342398 and parameters: {'n_estimators': 73, 'max_depth': 4, 'min_samples_split': 9, 'min_samples_leaf': 9}. Best is trial 297 with value: 0.5986474135090558.
[I 2024-11-06 20:45:44,034] Trial 403 finished with value: 0.5984958506477717 and parameters: {'n_estimators': 77, 'max_depth': 3, 'min_samples_split': 4, 'min_samples_leaf': 11}. Best is trial 297 with value: 0.5986474135090558.
[I 2024-11-06 20:45:46,210] Trial 404 finished with value: 0.5917134222463145 and parameters: {'n_estimators': 69, 'max_depth': 1, 'min_samples_split': 3, 'min_samples_leaf': 10}. Best is trial 297 with value: 0.5986474135090558.
[I 2024-11-06 20:45:49,749] Trial 405 finished with value: 0.5915254056609262 and parameters: {'n_estimators': 64, 'max_depth': 5, 'min_samples_split': 2, 'min_samples_leaf': 10}. Best is trial 297 with value: 0.5986474135090558.
[I 2024-11-06 20:45:52,870] Trial 406 finished with value: 0.5986570551043842 and parameters: {'n_estimators': 73, 'max_depth': 3, 'min_samples_split': 5, 'min_samples_leaf': 8}. Best is trial 406 with value: 0.5986570551043842.
[I 2024-11-06 20:45:53,768] Trial 407 finished with value: 0.5936061648485123 and parameters: {'n_estimators': 17, 'max_depth': 2, 'min_samples_split': 5, 'min_samples_leaf': 8}. Best is trial 406 with value: 0.5986570551043842.
[I 2024-11-06 20:45:57,280] Trial 408 finished with value: 0.5928805034367606 and parameters: {'n_estimators': 72, 'max_depth': 4, 'min_samples_split': 6, 'min_samples_leaf': 7}. Best is trial 406 with value: 0.5986570551043842.
[I 2024-11-06 20:45:59,690] Trial 409 finished with value: 0.5923166101256573 and parameters: {'n_estimators': 67, 'max_depth': 2, 'min_samples_split': 18, 'min_samples_leaf': 9}. Best is trial 406 with value: 0.5986570551043842.
[I 2024-11-06 20:46:03,922] Trial 410 finished with value: 0.5921581753400245 and parameters: {'n_estimators': 74, 'max_depth': 5, 'min_samples_split': 6, 'min_samples_leaf': 8}. Best is trial 406 with value: 0.5986570551043842.
[I 2024-11-06 20:46:10,849] Trial 411 finished with value: 0.5928680552744213 and parameters: {'n_estimators': 78, 'max_depth': 10, 'min_samples_split': 5, 'min_samples_leaf': 8}. Best is trial 406 with value: 0.5986570551043842.
[I 2024-11-06 20:46:13,499] Trial 412 finished with value: 0.5966316159590587 and parameters: {'n_estimators': 62, 'max_depth': 3, 'min_samples_split': 5, 'min_samples_leaf': 8}. Best is trial 406 with value: 0.5986570551043842.
[I 2024-11-06 20:46:18,894] Trial 413 finished with value: 0.5939176656801861 and parameters: {'n_estimators': 72, 'max_depth': 8, 'min_samples_split': 5, 'min_samples_leaf': 7}. Best is trial 406 with value: 0.5986570551043842.
[I 2024-11-06 20:46:21,563] Trial 414 finished with value: 0.5921729033109402 and parameters: {'n_estimators': 76, 'max_depth': 2, 'min_samples_split': 4, 'min_samples_leaf': 8}. Best is trial 406 with value: 0.5986570551043842.
[I 2024-11-06 20:46:25,713] Trial 415 finished with value: 0.5934922279635422 and parameters: {'n_estimators': 68, 'max_depth': 6, 'min_samples_split': 4, 'min_samples_leaf': 9}. Best is trial 406 with value: 0.5986570551043842.
[I 2024-11-06 20:46:29,676] Trial 416 finished with value: 0.5920029522583604 and parameters: {'n_estimators': 79, 'max_depth': 4, 'min_samples_split': 11, 'min_samples_leaf': 7}. Best is trial 406 with value: 0.5986570551043842.
[I 2024-11-06 20:46:40,121] Trial 417 finished with value: 0.5890413072748536 and parameters: {'n_estimators': 72, 'max_depth': 22, 'min_samples_split': 6, 'min_samples_leaf': 9}. Best is trial 406 with value: 0.5986570551043842.
