[I 2024-11-06 21:37:20,380] Trial 153 finished with value: 0.5932131551409533 and parameters: {'n_estimators': 152, 'max_depth': 7, 'learning_rate': 0.0613703194092801, 'gamma': 4.847143698400436, 'min_child_weight': 9, 'subsample': 0.987928790345462, 'colsample_bytree': 0.5527114414409378, 'reg_alpha': 0.7881262731803679, 'reg_lambda': 0.7962888914176837}. Best is trial 135 with value: 0.5936465002093926.
[I 2024-11-06 21:37:24,264] Trial 154 finished with value: 0.5931414210358328 and parameters: {'n_estimators': 156, 'max_depth': 7, 'learning_rate': 0.0556235688050122, 'gamma': 4.997604403295804, 'min_child_weight': 9, 'subsample': 0.9994845994789346, 'colsample_bytree': 0.5571551778474791, 'reg_alpha': 0.790173424663748, 'reg_lambda': 0.7962154068875581}. Best is trial 135 with value: 0.5936465002093926.
[I 2024-11-06 21:37:27,561] Trial 155 finished with value: 0.5931861626851431 and parameters: {'n_estimators': 144, 'max_depth': 6, 'learning_rate': 0.06231518566293815, 'gamma': 4.844920569160384, 'min_child_weight': 9, 'subsample': 0.9680491238217737, 'colsample_bytree': 0.5913964245851575, 'reg_alpha': 0.8187940812590176, 'reg_lambda': 0.7343124883959482}. Best is trial 135 with value: 0.5936465002093926.
[I 2024-11-06 21:37:31,270] Trial 156 finished with value: 0.592910689884358 and parameters: {'n_estimators': 129, 'max_depth': 7, 'learning_rate': 0.056458501516225904, 'gamma': 3.790863624924522, 'min_child_weight': 10, 'subsample': 0.9820094231323553, 'colsample_bytree': 0.5702242533950661, 'reg_alpha': 0.8357949266165949, 'reg_lambda': 0.8196669731062889}. Best is trial 135 with value: 0.5936465002093926.
[I 2024-11-06 21:37:35,525] Trial 157 finished with value: 0.5930384948383253 and parameters: {'n_estimators': 149, 'max_depth': 7, 'learning_rate': 0.039237795724695296, 'gamma': 4.788142760979665, 'min_child_weight': 8, 'subsample': 0.9858278001429476, 'colsample_bytree': 0.549379344470193, 'reg_alpha': 0.8576835051409466, 'reg_lambda': 0.753019903527848}. Best is trial 135 with value: 0.5936465002093926.
[I 2024-11-06 21:37:39,748] Trial 158 finished with value: 0.5928612712249106 and parameters: {'n_estimators': 162, 'max_depth': 6, 'learning_rate': 0.04520734244317593, 'gamma': 4.887431686590233, 'min_child_weight': 7, 'subsample': 0.960037945235948, 'colsample_bytree': 0.5592614851938824, 'reg_alpha': 0.7832344624961771, 'reg_lambda': 0.7788516808990297}. Best is trial 135 with value: 0.5936465002093926.
[I 2024-11-06 21:37:44,432] Trial 159 finished with value: 0.5932913590489626 and parameters: {'n_estimators': 155, 'max_depth': 7, 'learning_rate': 0.031230186746151214, 'gamma': 4.580912241936527, 'min_child_weight': 9, 'subsample': 0.9685321875894152, 'colsample_bytree': 0.5822692305083363, 'reg_alpha': 0.9117413209851324, 'reg_lambda': 0.7015314723678436}. Best is trial 135 with value: 0.5936465002093926.
[I 2024-11-06 21:37:49,132] Trial 160 finished with value: 0.5930361076627697 and parameters: {'n_estimators': 142, 'max_depth': 7, 'learning_rate': 0.030588942660638756, 'gamma': 4.518386727059405, 'min_child_weight': 10, 'subsample': 0.9342404251533072, 'colsample_bytree': 0.6147426097202371, 'reg_alpha': 0.856480806864128, 'reg_lambda': 0.7175477465794843}. Best is trial 135 with value: 0.5936465002093926.
[I 2024-11-06 21:37:53,472] Trial 161 finished with value: 0.5933233242642932 and parameters: {'n_estimators': 153, 'max_depth': 7, 'learning_rate': 0.03335422263179625, 'gamma': 4.734482732481154, 'min_child_weight': 9, 'subsample': 0.9923022704199921, 'colsample_bytree': 0.6040235810163561, 'reg_alpha': 0.8856010250451608, 'reg_lambda': 0.7024841398065758}. Best is trial 135 with value: 0.5936465002093926.
[I 2024-11-06 21:37:58,139] Trial 162 finished with value: 0.5932343400682113 and parameters: {'n_estimators': 159, 'max_depth': 7, 'learning_rate': 0.03656417669261556, 'gamma': 4.425999400555307, 'min_child_weight': 9, 'subsample': 0.9566513265682689, 'colsample_bytree': 0.5811952616390282, 'reg_alpha': 0.912451335706854, 'reg_lambda': 0.6995635866506036}. Best is trial 135 with value: 0.5936465002093926.
[I 2024-11-06 21:38:04,697] Trial 163 finished with value: 0.593491559021808 and parameters: {'n_estimators': 158, 'max_depth': 7, 'learning_rate': 0.03588054816146343, 'gamma': 4.3475436851386275, 'min_child_weight': 9, 'subsample': 0.9734341805428501, 'colsample_bytree': 0.6052556022966734, 'reg_alpha': 0.910503664669185, 'reg_lambda': 0.6947422291042301}. Best is trial 135 with value: 0.5936465002093926.
[I 2024-11-06 21:38:09,451] Trial 164 finished with value: 0.593098670252725 and parameters: {'n_estimators': 154, 'max_depth': 7, 'learning_rate': 0.027702635040368004, 'gamma': 4.26706018009533, 'min_child_weight': 9, 'subsample': 0.971400617488135, 'colsample_bytree': 0.6052520466347852, 'reg_alpha': 0.9531239967615857, 'reg_lambda': 0.6734700457071646}. Best is trial 135 with value: 0.5936465002093926.
[I 2024-11-06 21:38:13,915] Trial 165 finished with value: 0.5926397031298928 and parameters: {'n_estimators': 148, 'max_depth': 8, 'learning_rate': 0.032779602983140296, 'gamma': 4.5479665352905805, 'min_child_weight': 9, 'subsample': 0.963472535489826, 'colsample_bytree': 0.6417902118922572, 'reg_alpha': 0.9025064007448107, 'reg_lambda': 0.6995918602440093}. Best is trial 135 with value: 0.5936465002093926.
[I 2024-11-06 21:38:19,984] Trial 166 finished with value: 0.592980644118969 and parameters: {'n_estimators': 169, 'max_depth': 7, 'learning_rate': 0.016349855145660987, 'gamma': 4.656202421778587, 'min_child_weight': 10, 'subsample': 0.9733516309119931, 'colsample_bytree': 0.5974651159304561, 'reg_alpha': 0.8890918596659054, 'reg_lambda': 0.6659508531743241}. Best is trial 135 with value: 0.5936465002093926.
[I 2024-11-06 21:38:24,922] Trial 167 finished with value: 0.5930768777896788 and parameters: {'n_estimators': 162, 'max_depth': 7, 'learning_rate': 0.02266211771317593, 'gamma': 4.729478767812113, 'min_child_weight': 8, 'subsample': 0.993028943408182, 'colsample_bytree': 0.5850733191287886, 'reg_alpha': 0.9209052236697233, 'reg_lambda': 0.7364175033888111}. Best is trial 135 with value: 0.5936465002093926.
[I 2024-11-06 21:38:29,387] Trial 168 finished with value: 0.5928853831872647 and parameters: {'n_estimators': 138, 'max_depth': 6, 'learning_rate': 0.040583454055887674, 'gamma': 4.346992050982342, 'min_child_weight': 8, 'subsample': 0.9803489580888489, 'colsample_bytree': 0.5944635249936169, 'reg_alpha': 0.870029510667967, 'reg_lambda': 0.7140039687308095}. Best is trial 135 with value: 0.5936465002093926.
[I 2024-11-06 21:38:34,215] Trial 169 finished with value: 0.5929938249712012 and parameters: {'n_estimators': 133, 'max_depth': 8, 'learning_rate': 0.027530913062631536, 'gamma': 4.561690257002531, 'min_child_weight': 9, 'subsample': 0.9445601490352759, 'colsample_bytree': 0.6244422061268577, 'reg_alpha': 0.8406163422200589, 'reg_lambda': 0.6977817255261021}. Best is trial 135 with value: 0.5936465002093926.
[I 2024-11-06 21:38:38,545] Trial 170 finished with value: 0.593048682844637 and parameters: {'n_estimators': 156, 'max_depth': 7, 'learning_rate': 0.04915948730017403, 'gamma': 4.420838082274042, 'min_child_weight': 9, 'subsample': 0.6580899441173397, 'colsample_bytree': 0.5694933514717366, 'reg_alpha': 0.5540481922688851, 'reg_lambda': 0.6653857650280441}. Best is trial 135 with value: 0.5936465002093926.
[I 2024-11-06 21:38:42,996] Trial 171 finished with value: 0.5935456545335789 and parameters: {'n_estimators': 159, 'max_depth': 7, 'learning_rate': 0.0374686908346511, 'gamma': 4.468291082644145, 'min_child_weight': 9, 'subsample': 0.9604842072722524, 'colsample_bytree': 0.5820258496645138, 'reg_alpha': 0.9046578504791418, 'reg_lambda': 0.692465823848446}. Best is trial 135 with value: 0.5936465002093926.
[I 2024-11-06 21:38:47,925] Trial 172 finished with value: 0.5927656490567387 and parameters: {'n_estimators': 166, 'max_depth': 7, 'learning_rate': 0.036402355055068926, 'gamma': 4.755494394485108, 'min_child_weight': 9, 'subsample': 0.9616468338988335, 'colsample_bytree': 0.5893235554132485, 'reg_alpha': 0.8877025846974, 'reg_lambda': 0.6843106491339195}. Best is trial 135 with value: 0.5936465002093926.
[I 2024-11-06 21:38:52,500] Trial 173 finished with value: 0.5935335611669401 and parameters: {'n_estimators': 153, 'max_depth': 7, 'learning_rate': 0.03154225144857117, 'gamma': 4.589057866102613, 'min_child_weight': 9, 'subsample': 0.973116688012458, 'colsample_bytree': 0.6063978715845768, 'reg_alpha': 0.9335711123382887, 'reg_lambda': 0.6368576688011424}. Best is trial 135 with value: 0.5936465002093926.
[I 2024-11-06 21:38:57,527] Trial 174 finished with value: 0.5932168831709601 and parameters: {'n_estimators': 160, 'max_depth': 7, 'learning_rate': 0.02968217517084384, 'gamma': 4.4812507820305845, 'min_child_weight': 9, 'subsample': 0.6214837243333282, 'colsample_bytree': 0.6072542300409194, 'reg_alpha': 0.9497615173067844, 'reg_lambda': 0.6413538922104381}. Best is trial 135 with value: 0.5936465002093926.
[I 2024-11-06 21:39:03,399] Trial 175 finished with value: 0.5930435246929225 and parameters: {'n_estimators': 152, 'max_depth': 7, 'learning_rate': 0.013463097381008642, 'gamma': 4.62270572189574, 'min_child_weight': 9, 'subsample': 0.9926913505513631, 'colsample_bytree': 0.6209845069136782, 'reg_alpha': 0.9673972994447284, 'reg_lambda': 0.6543772510590038}. Best is trial 135 with value: 0.5936465002093926.
[I 2024-11-06 21:39:08,531] Trial 176 finished with value: 0.593168642368324 and parameters: {'n_estimators': 168, 'max_depth': 7, 'learning_rate': 0.03857339487863475, 'gamma': 4.3106068533348365, 'min_child_weight': 10, 'subsample': 0.9713897040042823, 'colsample_bytree': 0.6511503116334163, 'reg_alpha': 0.9303377571850484, 'reg_lambda': 0.6196551672677727}. Best is trial 135 with value: 0.5936465002093926.
[I 2024-11-06 21:39:14,151] Trial 177 finished with value: 0.592785102963842 and parameters: {'n_estimators': 172, 'max_depth': 7, 'learning_rate': 0.02364903757580808, 'gamma': 4.558331576677083, 'min_child_weight': 9, 'subsample': 0.9747512450570303, 'colsample_bytree': 0.6032489879714397, 'reg_alpha': 0.8928921500224904, 'reg_lambda': 0.6320960120256767}. Best is trial 135 with value: 0.5936465002093926.
[I 2024-11-06 21:39:18,178] Trial 178 finished with value: 0.5927753591506487 and parameters: {'n_estimators': 145, 'max_depth': 6, 'learning_rate': 0.044350268118757884, 'gamma': 4.70177630993847, 'min_child_weight': 9, 'subsample': 0.7354273521011797, 'colsample_bytree': 0.5727688141787107, 'reg_alpha': 0.9236809441080465, 'reg_lambda': 0.558948256227535}. Best is trial 135 with value: 0.5936465002093926.
[I 2024-11-06 21:39:22,969] Trial 179 finished with value: 0.5929048624458264 and parameters: {'n_estimators': 163, 'max_depth': 7, 'learning_rate': 0.032334317034954464, 'gamma': 4.4536343728778425, 'min_child_weight': 7, 'subsample': 0.9492869702756945, 'colsample_bytree': 0.5766170445771259, 'reg_alpha': 0.9945745210549298, 'reg_lambda': 0.7263526648092488}. Best is trial 135 with value: 0.5936465002093926.
[I 2024-11-06 21:39:28,794] Trial 180 finished with value: 0.5927931671353591 and parameters: {'n_estimators': 156, 'max_depth': 8, 'learning_rate': 0.020087615037897372, 'gamma': 4.04002947689798, 'min_child_weight': 1, 'subsample': 0.9850734454403299, 'colsample_bytree': 0.6356666119297988, 'reg_alpha': 0.9059778393481382, 'reg_lambda': 0.6885735523481885}. Best is trial 135 with value: 0.5936465002093926.
[I 2024-11-06 21:39:32,462] Trial 181 finished with value: 0.5935208455480087 and parameters: {'n_estimators': 151, 'max_depth': 7, 'learning_rate': 0.0508666966543465, 'gamma': 4.93210473152156, 'min_child_weight': 8, 'subsample': 0.9648647043373295, 'colsample_bytree': 0.5858801243049334, 'reg_alpha': 0.854508385616543, 'reg_lambda': 0.7445625121384172}. Best is trial 135 with value: 0.5936465002093926.
[I 2024-11-06 21:39:36,535] Trial 182 finished with value: 0.593078068130182 and parameters: {'n_estimators': 152, 'max_depth': 7, 'learning_rate': 0.0466347757194577, 'gamma': 4.780830670663851, 'min_child_weight': 8, 'subsample': 0.965815089179211, 'colsample_bytree': 0.5976520164740392, 'reg_alpha': 0.8721795499780743, 'reg_lambda': 0.737956755679576}. Best is trial 135 with value: 0.5936465002093926.
[I 2024-11-06 21:39:41,040] Trial 183 finished with value: 0.5931592438179865 and parameters: {'n_estimators': 159, 'max_depth': 7, 'learning_rate': 0.036469075807667, 'gamma': 4.896950149437368, 'min_child_weight': 9, 'subsample': 0.9388896714683121, 'colsample_bytree': 0.6107779614215835, 'reg_alpha': 0.4267962451094557, 'reg_lambda': 0.7142353434217841}. Best is trial 135 with value: 0.5936465002093926.
[I 2024-11-06 21:39:45,131] Trial 184 finished with value: 0.5931479023051452 and parameters: {'n_estimators': 146, 'max_depth': 7, 'learning_rate': 0.042122498007920596, 'gamma': 4.599307042370047, 'min_child_weight': 8, 'subsample': 0.9996204601583809, 'colsample_bytree': 0.5884062206401506, 'reg_alpha': 0.8448116231182856, 'reg_lambda': 0.7504678547912927}. Best is trial 135 with value: 0.5936465002093926.
[I 2024-11-06 21:39:49,364] Trial 185 finished with value: 0.593237225985225 and parameters: {'n_estimators': 168, 'max_depth': 7, 'learning_rate': 0.0503839550575714, 'gamma': 4.7058769840574595, 'min_child_weight': 7, 'subsample': 0.7565286162363091, 'colsample_bytree': 0.5645172884638437, 'reg_alpha': 0.9390502092051233, 'reg_lambda': 0.660793951988172}. Best is trial 135 with value: 0.5936465002093926.
[I 2024-11-06 21:39:54,250] Trial 186 finished with value: 0.5928375088086771 and parameters: {'n_estimators': 177, 'max_depth': 7, 'learning_rate': 0.031789913830936684, 'gamma': 4.8381598890300666, 'min_child_weight': 9, 'subsample': 0.9260582989959906, 'colsample_bytree': 0.5629224574733607, 'reg_alpha': 0.897252129413592, 'reg_lambda': 0.5748608389929055}. Best is trial 135 with value: 0.5936465002093926.
[I 2024-11-06 21:39:58,186] Trial 187 finished with value: 0.5930945198107538 and parameters: {'n_estimators': 162, 'max_depth': 6, 'learning_rate': 0.05337366370733029, 'gamma': 4.21539788825752, 'min_child_weight': 8, 'subsample': 0.9816862242009509, 'colsample_bytree': 0.500748631650497, 'reg_alpha': 0.47901635968252604, 'reg_lambda': 0.5369419549728602}. Best is trial 135 with value: 0.5936465002093926.
[I 2024-11-06 21:40:04,058] Trial 188 finished with value: 0.5931198006529839 and parameters: {'n_estimators': 149, 'max_depth': 7, 'learning_rate': 0.02583321892050651, 'gamma': 4.765477816330527, 'min_child_weight': 5, 'subsample': 0.9531298016296041, 'colsample_bytree': 0.5737552540272208, 'reg_alpha': 0.8302027278598881, 'reg_lambda': 0.6911842530070427}. Best is trial 135 with value: 0.5936465002093926.
[I 2024-11-06 21:40:09,078] Trial 189 finished with value: 0.5934162240728194 and parameters: {'n_estimators': 155, 'max_depth': 7, 'learning_rate': 0.038245394167601456, 'gamma': 4.558868307847682, 'min_child_weight': 7, 'subsample': 0.8819059679718272, 'colsample_bytree': 0.5460016516177022, 'reg_alpha': 0.8015541532384687, 'reg_lambda': 0.6505575695385953}. Best is trial 135 with value: 0.5936465002093926.
[I 2024-11-06 21:40:16,512] Trial 190 finished with value: 0.5906007407865935 and parameters: {'n_estimators': 164, 'max_depth': 10, 'learning_rate': 0.04096549836397777, 'gamma': 1.2682577396739667, 'min_child_weight': 7, 'subsample': 0.8802331802305059, 'colsample_bytree': 0.5235168788183344, 'reg_alpha': 0.8100373119123402, 'reg_lambda': 0.6417747805911346}. Best is trial 135 with value: 0.5936465002093926.
[I 2024-11-06 21:40:21,436] Trial 191 finished with value: 0.5934148503109126 and parameters: {'n_estimators': 154, 'max_depth': 7, 'learning_rate': 0.033988421239398534, 'gamma': 4.530593915164012, 'min_child_weight': 7, 'subsample': 0.8944655591801773, 'colsample_bytree': 0.5454588234534001, 'reg_alpha': 0.7409200599938702, 'reg_lambda': 0.622582768914677}. Best is trial 135 with value: 0.5936465002093926.
[I 2024-11-06 21:40:26,001] Trial 192 finished with value: 0.5924766726382146 and parameters: {'n_estimators': 173, 'max_depth': 7, 'learning_rate': 0.03764876839147375, 'gamma': 4.450549142597708, 'min_child_weight': 7, 'subsample': 0.8925944199156158, 'colsample_bytree': 0.5443170596988849, 'reg_alpha': 0.7321607978034497, 'reg_lambda': 0.6001285549793108}. Best is trial 135 with value: 0.5936465002093926.
[I 2024-11-06 21:40:30,130] Trial 193 finished with value: 0.5929353848730884 and parameters: {'n_estimators': 158, 'max_depth': 7, 'learning_rate': 0.04422276296320779, 'gamma': 4.658769732455145, 'min_child_weight': 7, 'subsample': 0.9011627426747161, 'colsample_bytree': 0.5529834593995971, 'reg_alpha': 0.6976882530099059, 'reg_lambda': 0.6212781680752335}. Best is trial 135 with value: 0.5936465002093926.
[I 2024-11-06 21:40:34,270] Trial 194 finished with value: 0.593511013060539 and parameters: {'n_estimators': 149, 'max_depth': 7, 'learning_rate': 0.05188501726744846, 'gamma': 4.3363631564177, 'min_child_weight': 7, 'subsample': 0.8756629427461159, 'colsample_bytree': 0.5319352487617748, 'reg_alpha': 0.805066411016372, 'reg_lambda': 0.6484218765571386}. Best is trial 135 with value: 0.5936465002093926.
[I 2024-11-06 21:40:39,083] Trial 195 finished with value: 0.592925181173898 and parameters: {'n_estimators': 143, 'max_depth': 7, 'learning_rate': 0.026042524512386908, 'gamma': 4.3294486905658465, 'min_child_weight': 7, 'subsample': 0.8832196837069575, 'colsample_bytree': 0.5327255350940978, 'reg_alpha': 0.7623197543605911, 'reg_lambda': 0.649993943237408}. Best is trial 135 with value: 0.5936465002093926.
[I 2024-11-06 21:40:43,016] Trial 196 finished with value: 0.5924359761528505 and parameters: {'n_estimators': 152, 'max_depth': 7, 'learning_rate': 0.04694562018190436, 'gamma': 4.401957029301949, 'min_child_weight': 7, 'subsample': 0.8752472450714028, 'colsample_bytree': 0.9264612904565481, 'reg_alpha': 0.8002110170271555, 'reg_lambda': 0.6740013724958187}. Best is trial 135 with value: 0.5936465002093926.
[I 2024-11-06 21:40:47,420] Trial 197 finished with value: 0.5937894638785621 and parameters: {'n_estimators': 147, 'max_depth': 7, 'learning_rate': 0.033337989841559675, 'gamma': 4.506056675550046, 'min_child_weight': 7, 'subsample': 0.9170053374169604, 'colsample_bytree': 0.5453452643731955, 'reg_alpha': 0.7716248638145295, 'reg_lambda': 0.6312891754652565}. Best is trial 197 with value: 0.5937894638785621.
[I 2024-11-06 21:40:51,818] Trial 198 finished with value: 0.593429885009501 and parameters: {'n_estimators': 149, 'max_depth': 7, 'learning_rate': 0.034921495589975, 'gamma': 4.50957348971213, 'min_child_weight': 7, 'subsample': 0.9140616879394182, 'colsample_bytree': 0.5389825076161023, 'reg_alpha': 0.7819334218182974, 'reg_lambda': 0.618105007194838}. Best is trial 197 with value: 0.5937894638785621.
[I 2024-11-06 21:40:55,412] Trial 199 finished with value: 0.5929316152753865 and parameters: {'n_estimators': 147, 'max_depth': 7, 'learning_rate': 0.051976285868936004, 'gamma': 4.490752366688245, 'min_child_weight': 7, 'subsample': 0.9114888352090662, 'colsample_bytree': 0.5382293012846515, 'reg_alpha': 0.7466831822518621, 'reg_lambda': 0.6228556985789534}. Best is trial 197 with value: 0.5937894638785621.
[I 2024-11-06 21:40:59,815] Trial 200 finished with value: 0.5931642617792569 and parameters: {'n_estimators': 140, 'max_depth': 7, 'learning_rate': 0.03913727464463848, 'gamma': 4.357213957077458, 'min_child_weight': 7, 'subsample': 0.9215771289381651, 'colsample_bytree': 0.5297664945988111, 'reg_alpha': 0.7743646180535312, 'reg_lambda': 0.6322512358228695}. Best is trial 197 with value: 0.5937894638785621.
[I 2024-11-06 21:41:05,583] Trial 201 finished with value: 0.5932822892071586 and parameters: {'n_estimators': 150, 'max_depth': 7, 'learning_rate': 0.03299115001004393, 'gamma': 4.910565491337448, 'min_child_weight': 7, 'subsample': 0.9026740020575381, 'colsample_bytree': 0.557022752199573, 'reg_alpha': 0.7992700382377854, 'reg_lambda': 0.6493185579241868}. Best is trial 197 with value: 0.5937894638785621.
[I 2024-11-06 21:41:10,486] Trial 202 finished with value: 0.5932287084543689 and parameters: {'n_estimators': 155, 'max_depth': 7, 'learning_rate': 0.035282644330091616, 'gamma': 4.542154676094669, 'min_child_weight': 7, 'subsample': 0.9116857188682376, 'colsample_bytree': 0.543784692435432, 'reg_alpha': 0.8186016296021896, 'reg_lambda': 0.5907692030277114}. Best is trial 197 with value: 0.5937894638785621.
[I 2024-11-06 21:41:14,339] Trial 203 finished with value: 0.593526757113902 and parameters: {'n_estimators': 146, 'max_depth': 7, 'learning_rate': 0.045625857683896244, 'gamma': 4.736139995257577, 'min_child_weight': 7, 'subsample': 0.8964189631160125, 'colsample_bytree': 0.5606563586349051, 'reg_alpha': 0.7738748258918279, 'reg_lambda': 0.6611987912085308}. Best is trial 197 with value: 0.5937894638785621.
[I 2024-11-06 21:41:18,558] Trial 204 finished with value: 0.5934793667818092 and parameters: {'n_estimators': 142, 'max_depth': 7, 'learning_rate': 0.04478885862434511, 'gamma': 4.231194272930473, 'min_child_weight': 7, 'subsample': 0.8962403219864448, 'colsample_bytree': 0.5597085419144606, 'reg_alpha': 0.7553021972931965, 'reg_lambda': 0.6646394955965734}. Best is trial 197 with value: 0.5937894638785621.
[I 2024-11-06 21:41:22,729] Trial 205 finished with value: 0.5931027842364226 and parameters: {'n_estimators': 143, 'max_depth': 7, 'learning_rate': 0.04489584090314268, 'gamma': 4.3176231699710454, 'min_child_weight': 7, 'subsample': 0.8917541296761309, 'colsample_bytree': 0.5640615860746961, 'reg_alpha': 0.714202990027325, 'reg_lambda': 0.6652934310719509}. Best is trial 197 with value: 0.5937894638785621.
