[I 2024-11-06 19:50:30,392] Trial 365 finished with value: 0.5941449985036973 and parameters: {'C': 0.19131004283169198, 'solver': 'liblinear'}. Best is trial 236 with value: 0.5945206794543682.
[I 2024-11-06 19:50:32,237] Trial 366 finished with value: 0.5944927192421414 and parameters: {'C': 0.4452345175450297, 'solver': 'liblinear'}. Best is trial 236 with value: 0.5945206794543682.
[I 2024-11-06 19:50:33,955] Trial 367 finished with value: 0.5944423909473389 and parameters: {'C': 0.7254140229339325, 'solver': 'liblinear'}. Best is trial 236 with value: 0.5945206794543682.
[I 2024-11-06 19:50:35,505] Trial 368 finished with value: 0.5944264109351601 and parameters: {'C': 0.3180925355966472, 'solver': 'liblinear'}. Best is trial 236 with value: 0.5945206794543682.
[I 2024-11-06 19:50:37,544] Trial 369 finished with value: 0.594452488013693 and parameters: {'C': 0.5488506853399692, 'solver': 'liblinear'}. Best is trial 236 with value: 0.5945206794543682.
[I 2024-11-06 19:50:39,365] Trial 370 finished with value: 0.5941431146686387 and parameters: {'C': 0.14632011753249186, 'solver': 'liblinear'}. Best is trial 236 with value: 0.5945206794543682.
[I 2024-11-06 19:50:41,071] Trial 371 finished with value: 0.5944465036747404 and parameters: {'C': 0.7035388736026924, 'solver': 'liblinear'}. Best is trial 236 with value: 0.5945206794543682.
[I 2024-11-06 19:50:42,255] Trial 372 finished with value: 0.5877914131763377 and parameters: {'C': 0.004696969688399499, 'solver': 'liblinear'}. Best is trial 236 with value: 0.5945206794543682.
[I 2024-11-06 19:50:43,992] Trial 373 finished with value: 0.5945010479847608 and parameters: {'C': 0.3961194123394321, 'solver': 'liblinear'}. Best is trial 236 with value: 0.5945206794543682.
[I 2024-11-06 19:50:45,883] Trial 374 finished with value: 0.594400523374502 and parameters: {'C': 0.8648603389755622, 'solver': 'liblinear'}. Best is trial 236 with value: 0.5945206794543682.
[I 2024-11-06 19:50:47,476] Trial 375 finished with value: 0.5942863869122607 and parameters: {'C': 0.26403656846088197, 'solver': 'liblinear'}. Best is trial 236 with value: 0.5945206794543682.
[I 2024-11-06 19:50:49,041] Trial 376 finished with value: 0.5941512279401928 and parameters: {'C': 0.4964666217939195, 'solver': 'lbfgs'}. Best is trial 236 with value: 0.5945206794543682.
[I 2024-11-06 19:50:50,829] Trial 377 finished with value: 0.5944466427795936 and parameters: {'C': 0.6288705413057079, 'solver': 'liblinear'}. Best is trial 236 with value: 0.5945206794543682.
[I 2024-11-06 19:50:52,328] Trial 378 finished with value: 0.5942292030490468 and parameters: {'C': 0.22656423534248, 'solver': 'liblinear'}. Best is trial 236 with value: 0.5945206794543682.
[I 2024-11-06 19:50:54,091] Trial 379 finished with value: 0.5944746354238873 and parameters: {'C': 0.4500877381310269, 'solver': 'liblinear'}. Best is trial 236 with value: 0.5945206794543682.
[I 2024-11-06 19:50:55,790] Trial 380 finished with value: 0.5944200192689717 and parameters: {'C': 0.847371241140461, 'solver': 'liblinear'}. Best is trial 236 with value: 0.5945206794543682.
[I 2024-11-06 19:50:57,495] Trial 381 finished with value: 0.5944433941781605 and parameters: {'C': 0.33002600588717396, 'solver': 'liblinear'}. Best is trial 236 with value: 0.5945206794543682.
[I 2024-11-06 19:50:59,400] Trial 382 finished with value: 0.5943935986935767 and parameters: {'C': 5.199537560593516, 'solver': 'liblinear'}. Best is trial 236 with value: 0.5945206794543682.
[I 2024-11-06 19:51:01,293] Trial 383 finished with value: 0.5944075915572162 and parameters: {'C': 3.6272780274092296, 'solver': 'liblinear'}. Best is trial 236 with value: 0.5945206794543682.
[I 2024-11-06 19:51:03,100] Trial 384 finished with value: 0.5944368725971654 and parameters: {'C': 0.6019398899438014, 'solver': 'liblinear'}. Best is trial 236 with value: 0.5945206794543682.
[I 2024-11-06 19:51:04,895] Trial 385 finished with value: 0.5940830746716019 and parameters: {'C': 0.1144710372387196, 'solver': 'liblinear'}. Best is trial 236 with value: 0.5945206794543682.
[I 2024-11-06 19:51:06,773] Trial 386 finished with value: 0.5945165657501879 and parameters: {'C': 0.42668995705760815, 'solver': 'liblinear'}. Best is trial 236 with value: 0.5945206794543682.
[I 2024-11-06 19:51:08,500] Trial 387 finished with value: 0.5944341071243737 and parameters: {'C': 0.7486741386437328, 'solver': 'liblinear'}. Best is trial 236 with value: 0.5945206794543682.
[I 2024-11-06 19:51:10,171] Trial 388 finished with value: 0.5942962236924549 and parameters: {'C': 0.2665677024823329, 'solver': 'liblinear'}. Best is trial 236 with value: 0.5945206794543682.
[I 2024-11-06 19:51:11,864] Trial 389 finished with value: 0.5944719394321811 and parameters: {'C': 0.5733982122132081, 'solver': 'liblinear'}. Best is trial 236 with value: 0.5945206794543682.
[I 2024-11-06 19:51:13,585] Trial 390 finished with value: 0.5943906581953528 and parameters: {'C': 0.8992074124674092, 'solver': 'liblinear'}. Best is trial 236 with value: 0.5945206794543682.
[I 2024-11-06 19:51:15,022] Trial 391 finished with value: 0.5941162936597189 and parameters: {'C': 0.1316983408597468, 'solver': 'liblinear'}. Best is trial 236 with value: 0.5945206794543682.
[I 2024-11-06 19:51:16,950] Trial 392 finished with value: 0.5945206794543682 and parameters: {'C': 0.41683855916027357, 'solver': 'liblinear'}. Best is trial 236 with value: 0.5945206794543682.
[I 2024-11-06 19:51:18,750] Trial 393 finished with value: 0.5944840977210006 and parameters: {'C': 0.37223636896314977, 'solver': 'liblinear'}. Best is trial 236 with value: 0.5945206794543682.
[I 2024-11-06 19:51:20,122] Trial 394 finished with value: 0.5915881587722269 and parameters: {'C': 0.014923018163826407, 'solver': 'liblinear'}. Best is trial 236 with value: 0.5945206794543682.
[I 2024-11-06 19:51:21,395] Trial 395 finished with value: 0.5942431968237621 and parameters: {'C': 0.6898067388816111, 'solver': 'lbfgs'}. Best is trial 236 with value: 0.5945206794543682.
[I 2024-11-06 19:51:22,928] Trial 396 finished with value: 0.594374670015522 and parameters: {'C': 0.29843483401373705, 'solver': 'liblinear'}. Best is trial 236 with value: 0.5945206794543682.
[I 2024-11-06 19:51:24,620] Trial 397 finished with value: 0.5943950564430389 and parameters: {'C': 8.237633261685781, 'solver': 'liblinear'}. Best is trial 236 with value: 0.5945206794543682.
[I 2024-11-06 19:51:26,365] Trial 398 finished with value: 0.594462227065841 and parameters: {'C': 0.46437828067315645, 'solver': 'liblinear'}. Best is trial 236 with value: 0.5945206794543682.
[I 2024-11-06 19:51:28,090] Trial 399 finished with value: 0.5944465036747404 and parameters: {'C': 0.7093427380842316, 'solver': 'liblinear'}. Best is trial 236 with value: 0.5945206794543682.
[I 2024-11-06 19:51:29,723] Trial 400 finished with value: 0.5941941592929504 and parameters: {'C': 0.1946202701355822, 'solver': 'liblinear'}. Best is trial 236 with value: 0.5945206794543682.
[I 2024-11-06 19:51:31,475] Trial 401 finished with value: 0.5943977600835995 and parameters: {'C': 4.411939935949329, 'solver': 'liblinear'}. Best is trial 236 with value: 0.5945206794543682.
[I 2024-11-06 19:51:33,332] Trial 402 finished with value: 0.5944818032325733 and parameters: {'C': 0.5614855565017983, 'solver': 'liblinear'}. Best is trial 236 with value: 0.5945206794543682.
[I 2024-11-06 19:51:35,105] Trial 403 finished with value: 0.5943808274095643 and parameters: {'C': 0.9244718019524232, 'solver': 'liblinear'}. Best is trial 236 with value: 0.5945206794543682.
[I 2024-11-06 19:51:36,814] Trial 404 finished with value: 0.5943894864545646 and parameters: {'C': 9.540857077509518, 'solver': 'liblinear'}. Best is trial 236 with value: 0.5945206794543682.
[I 2024-11-06 19:51:38,753] Trial 405 finished with value: 0.5945108362784295 and parameters: {'C': 0.39770970109094933, 'solver': 'liblinear'}. Best is trial 236 with value: 0.5945206794543682.
[I 2024-11-06 19:51:40,460] Trial 406 finished with value: 0.5944524591081727 and parameters: {'C': 0.5341098244094953, 'solver': 'liblinear'}. Best is trial 236 with value: 0.5945206794543682.
[I 2024-11-06 19:51:41,939] Trial 407 finished with value: 0.5942333748064208 and parameters: {'C': 0.21690435678096806, 'solver': 'liblinear'}. Best is trial 236 with value: 0.5945206794543682.
[I 2024-11-06 19:51:43,799] Trial 408 finished with value: 0.5944465036747404 and parameters: {'C': 0.7005635218964723, 'solver': 'liblinear'}. Best is trial 236 with value: 0.5945206794543682.
[I 2024-11-06 19:51:45,498] Trial 409 finished with value: 0.5944531450788463 and parameters: {'C': 0.34576049993634744, 'solver': 'liblinear'}. Best is trial 236 with value: 0.5945206794543682.
[I 2024-11-06 19:51:47,032] Trial 410 finished with value: 0.5940098959371468 and parameters: {'C': 0.10279810075659551, 'solver': 'liblinear'}. Best is trial 236 with value: 0.5945206794543682.
[I 2024-11-06 19:51:48,773] Trial 411 finished with value: 0.594400523374502 and parameters: {'C': 0.8849218941919573, 'solver': 'liblinear'}. Best is trial 236 with value: 0.5945206794543682.
[I 2024-11-06 19:51:50,578] Trial 412 finished with value: 0.5944679401977606 and parameters: {'C': 0.4745206459723892, 'solver': 'liblinear'}. Best is trial 236 with value: 0.5945206794543682.
[I 2024-11-06 19:51:52,549] Trial 413 finished with value: 0.5944465743982909 and parameters: {'C': 0.6486239770021394, 'solver': 'liblinear'}. Best is trial 236 with value: 0.5945206794543682.
[I 2024-11-06 19:51:54,049] Trial 414 finished with value: 0.5943158594047946 and parameters: {'C': 0.27382042145295704, 'solver': 'liblinear'}. Best is trial 236 with value: 0.5945206794543682.
[I 2024-11-06 19:51:55,498] Trial 415 finished with value: 0.5898233447543826 and parameters: {'C': 0.00784253149226316, 'solver': 'liblinear'}. Best is trial 236 with value: 0.5945206794543682.
[I 2024-11-06 19:51:56,696] Trial 416 finished with value: 0.5939948180518906 and parameters: {'C': 0.48184484418004025, 'solver': 'lbfgs'}. Best is trial 236 with value: 0.5945206794543682.
[I 2024-11-06 19:51:58,336] Trial 417 finished with value: 0.5943214214697532 and parameters: {'C': 0.2817280132033768, 'solver': 'liblinear'}. Best is trial 236 with value: 0.5945206794543682.
[I 2024-11-06 19:52:00,083] Trial 418 finished with value: 0.5944507362778312 and parameters: {'C': 0.6593834642044358, 'solver': 'liblinear'}. Best is trial 236 with value: 0.5945206794543682.
[I 2024-11-06 19:52:01,921] Trial 419 finished with value: 0.5944102716600428 and parameters: {'C': 0.857443321354926, 'solver': 'liblinear'}. Best is trial 236 with value: 0.5945206794543682.
[I 2024-11-06 19:52:04,040] Trial 420 finished with value: 0.5945206794543682 and parameters: {'C': 0.425624756975946, 'solver': 'liblinear'}. Best is trial 236 with value: 0.5945206794543682.
[I 2024-11-06 19:52:05,758] Trial 421 finished with value: 0.5944679921973416 and parameters: {'C': 0.52014004935832, 'solver': 'liblinear'}. Best is trial 236 with value: 0.5945206794543682.
[I 2024-11-06 19:52:07,331] Trial 422 finished with value: 0.5941787775457797 and parameters: {'C': 0.19256782462959343, 'solver': 'liblinear'}. Best is trial 236 with value: 0.5945206794543682.
[I 2024-11-06 19:52:09,004] Trial 423 finished with value: 0.5944424214116404 and parameters: {'C': 0.6813873250729517, 'solver': 'liblinear'}. Best is trial 236 with value: 0.5945206794543682.
[I 2024-11-06 19:52:10,763] Trial 424 finished with value: 0.5945206794543682 and parameters: {'C': 0.4132430650039027, 'solver': 'liblinear'}. Best is trial 236 with value: 0.5945206794543682.
[I 2024-11-06 19:52:12,489] Trial 425 finished with value: 0.5944664551671568 and parameters: {'C': 0.512216552774313, 'solver': 'liblinear'}. Best is trial 236 with value: 0.5945206794543682.
[I 2024-11-06 19:52:14,265] Trial 426 finished with value: 0.5944241813468227 and parameters: {'C': 0.8377006577678948, 'solver': 'liblinear'}. Best is trial 236 with value: 0.5945206794543682.
[I 2024-11-06 19:52:15,963] Trial 427 finished with value: 0.5944075915572162 and parameters: {'C': 2.7652088609244005, 'solver': 'liblinear'}. Best is trial 236 with value: 0.5945206794543682.
[I 2024-11-06 19:52:17,729] Trial 428 finished with value: 0.5944075915572162 and parameters: {'C': 3.9804774577673516, 'solver': 'liblinear'}. Best is trial 236 with value: 0.5945206794543682.
[I 2024-11-06 19:52:19,567] Trial 429 finished with value: 0.5941712936169132 and parameters: {'C': 0.17291772314186998, 'solver': 'liblinear'}. Best is trial 236 with value: 0.5945206794543682.
[I 2024-11-06 19:52:21,592] Trial 430 finished with value: 0.594488232242145 and parameters: {'C': 0.36376311904331166, 'solver': 'liblinear'}. Best is trial 236 with value: 0.5945206794543682.
[I 2024-11-06 19:52:23,364] Trial 431 finished with value: 0.5944033476557997 and parameters: {'C': 6.358827026827036, 'solver': 'liblinear'}. Best is trial 236 with value: 0.5945206794543682.
[I 2024-11-06 19:52:25,071] Trial 432 finished with value: 0.5944507362778312 and parameters: {'C': 0.6517704642405839, 'solver': 'liblinear'}. Best is trial 236 with value: 0.5945206794543682.
[I 2024-11-06 19:52:26,765] Trial 433 finished with value: 0.5945010479847608 and parameters: {'C': 0.3933264795475365, 'solver': 'liblinear'}. Best is trial 236 with value: 0.5945206794543682.
[I 2024-11-06 19:52:28,434] Trial 434 finished with value: 0.5943849397349453 and parameters: {'C': 0.9298213173622725, 'solver': 'liblinear'}. Best is trial 236 with value: 0.5945206794543682.
[I 2024-11-06 19:52:29,861] Trial 435 finished with value: 0.5908081262118581 and parameters: {'C': 0.010584920924367303, 'solver': 'liblinear'}. Best is trial 236 with value: 0.5945206794543682.
[I 2024-11-06 19:52:31,477] Trial 436 finished with value: 0.5944719394321811 and parameters: {'C': 0.5705680882956589, 'solver': 'liblinear'}. Best is trial 236 with value: 0.5945206794543682.
[I 2024-11-06 19:52:33,028] Trial 437 finished with value: 0.5942193873852942 and parameters: {'C': 0.2341680114571198, 'solver': 'liblinear'}. Best is trial 236 with value: 0.5945206794543682.
[I 2024-11-06 19:52:34,359] Trial 438 finished with value: 0.5941709243973141 and parameters: {'C': 0.45533654216608427, 'solver': 'lbfgs'}. Best is trial 236 with value: 0.5945206794543682.
[I 2024-11-06 19:52:36,035] Trial 439 finished with value: 0.5944423909473389 and parameters: {'C': 0.732672482202517, 'solver': 'liblinear'}. Best is trial 236 with value: 0.5945206794543682.
[I 2024-11-06 19:52:37,615] Trial 440 finished with value: 0.5942152075478109 and parameters: {'C': 0.23493475865653948, 'solver': 'liblinear'}. Best is trial 236 with value: 0.5945206794543682.
[I 2024-11-06 19:52:39,364] Trial 441 finished with value: 0.5944581611204107 and parameters: {'C': 0.5172942841751104, 'solver': 'liblinear'}. Best is trial 236 with value: 0.5945206794543682.
[I 2024-11-06 19:52:40,925] Trial 442 finished with value: 0.5909352990651573 and parameters: {'C': 0.011167946273403673, 'solver': 'liblinear'}. Best is trial 236 with value: 0.5945206794543682.
[I 2024-11-06 19:52:42,762] Trial 443 finished with value: 0.5944382255861191 and parameters: {'C': 0.7896645636913653, 'solver': 'liblinear'}. Best is trial 236 with value: 0.5945206794543682.
[I 2024-11-06 19:52:44,616] Trial 444 finished with value: 0.5944433941781605 and parameters: {'C': 0.3283916725194678, 'solver': 'liblinear'}. Best is trial 236 with value: 0.5945206794543682.
[I 2024-11-06 19:52:46,330] Trial 445 finished with value: 0.5944327134779032 and parameters: {'C': 0.6268522928787087, 'solver': 'liblinear'}. Best is trial 236 with value: 0.5945206794543682.
[I 2024-11-06 19:52:47,910] Trial 446 finished with value: 0.5944165760213188 and parameters: {'C': 0.31080672538114146, 'solver': 'liblinear'}. Best is trial 236 with value: 0.5945206794543682.
[I 2024-11-06 19:52:49,928] Trial 447 finished with value: 0.5943808274095643 and parameters: {'C': 0.9112554582446721, 'solver': 'liblinear'}. Best is trial 236 with value: 0.5945206794543682.
[I 2024-11-06 19:52:51,621] Trial 448 finished with value: 0.594462227065841 and parameters: {'C': 0.46516250867505854, 'solver': 'liblinear'}. Best is trial 236 with value: 0.5945206794543682.
[I 2024-11-06 19:52:53,444] Trial 449 finished with value: 0.5941614364622134 and parameters: {'C': 0.16885201259876292, 'solver': 'liblinear'}. Best is trial 236 with value: 0.5945206794543682.
[I 2024-11-06 19:52:55,418] Trial 450 finished with value: 0.5944507362778312 and parameters: {'C': 0.6739059939306958, 'solver': 'liblinear'}. Best is trial 236 with value: 0.5945206794543682.
[I 2024-11-06 19:52:57,418] Trial 451 finished with value: 0.5943977600835995 and parameters: {'C': 4.591826728973385, 'solver': 'liblinear'}. Best is trial 236 with value: 0.5945206794543682.
[I 2024-11-06 19:52:59,311] Trial 452 finished with value: 0.5945037726748497 and parameters: {'C': 0.3850323676710244, 'solver': 'liblinear'}. Best is trial 236 with value: 0.5945206794543682.
[I 2024-11-06 19:53:00,873] Trial 453 finished with value: 0.5941388591937917 and parameters: {'C': 0.15237541719152597, 'solver': 'liblinear'}. Best is trial 236 with value: 0.5945206794543682.
[I 2024-11-06 19:53:02,812] Trial 454 finished with value: 0.5944524591081727 and parameters: {'C': 0.5315601227983848, 'solver': 'liblinear'}. Best is trial 236 with value: 0.5945206794543682.
[I 2024-11-06 19:53:04,866] Trial 455 finished with value: 0.5943849397349453 and parameters: {'C': 0.9739263697546722, 'solver': 'liblinear'}. Best is trial 236 with value: 0.5945206794543682.
[I 2024-11-06 19:53:07,065] Trial 456 finished with value: 0.5944341071243737 and parameters: {'C': 0.7388723628897927, 'solver': 'liblinear'}. Best is trial 236 with value: 0.5945206794543682.
[I 2024-11-06 19:53:08,806] Trial 457 finished with value: 0.5943928145789986 and parameters: {'C': 0.3059126716663075, 'solver': 'liblinear'}. Best is trial 236 with value: 0.5945206794543682.
[I 2024-11-06 19:53:10,659] Trial 458 finished with value: 0.5944859373746123 and parameters: {'C': 0.5575160040866964, 'solver': 'liblinear'}. Best is trial 236 with value: 0.5945206794543682.
[I 2024-11-06 19:53:12,182] Trial 459 finished with value: 0.5941475919992161 and parameters: {'C': 0.15965094043467332, 'solver': 'liblinear'}. Best is trial 236 with value: 0.5945206794543682.
[I 2024-11-06 19:53:13,428] Trial 460 finished with value: 0.5941203225096732 and parameters: {'C': 0.4009645427869257, 'solver': 'lbfgs'}. Best is trial 236 with value: 0.5945206794543682.
[I 2024-11-06 19:53:15,303] Trial 461 finished with value: 0.5944382568974096 and parameters: {'C': 0.7344716571280308, 'solver': 'liblinear'}. Best is trial 236 with value: 0.5945206794543682.
[I 2024-11-06 19:53:17,265] Trial 462 finished with value: 0.5944679401977606 and parameters: {'C': 0.4733318267429847, 'solver': 'liblinear'}. Best is trial 236 with value: 0.5945206794543682.
[I 2024-11-06 19:53:18,814] Trial 463 finished with value: 0.5889238160305975 and parameters: {'C': 0.006073555198302105, 'solver': 'liblinear'}. Best is trial 236 with value: 0.5945206794543682.
[I 2024-11-06 19:53:20,428] Trial 464 finished with value: 0.5942920060110205 and parameters: {'C': 0.2617464972655292, 'solver': 'liblinear'}. Best is trial 236 with value: 0.5945206794543682.
[I 2024-11-06 19:53:22,244] Trial 465 finished with value: 0.5944424619582916 and parameters: {'C': 0.6338789095059147, 'solver': 'liblinear'}. Best is trial 236 with value: 0.5945206794543682.
[I 2024-11-06 19:53:23,972] Trial 466 finished with value: 0.5943849397349453 and parameters: {'C': 0.9443956913479741, 'solver': 'liblinear'}. Best is trial 236 with value: 0.5945206794543682.
[I 2024-11-06 19:53:25,694] Trial 467 finished with value: 0.5944743476921779 and parameters: {'C': 0.37652655781261696, 'solver': 'liblinear'}. Best is trial 236 with value: 0.5945206794543682.
[I 2024-11-06 19:53:27,360] Trial 468 finished with value: 0.5941476308262215 and parameters: {'C': 0.1767576073595813, 'solver': 'liblinear'}. Best is trial 236 with value: 0.5945206794543682.
[I 2024-11-06 19:53:29,170] Trial 469 finished with value: 0.5944719394321811 and parameters: {'C': 0.5706299392493968, 'solver': 'liblinear'}. Best is trial 236 with value: 0.5945206794543682.
[I 2024-11-06 19:53:30,918] Trial 470 finished with value: 0.5944283946020199 and parameters: {'C': 0.7730193887662384, 'solver': 'liblinear'}. Best is trial 236 with value: 0.5945206794543682.
[I 2024-11-06 19:53:32,669] Trial 471 finished with value: 0.5944033476557997 and parameters: {'C': 7.49546452613603, 'solver': 'liblinear'}. Best is trial 236 with value: 0.5945206794543682.
[I 2024-11-06 19:53:34,594] Trial 472 finished with value: 0.5944840977210006 and parameters: {'C': 0.37492425544575503, 'solver': 'liblinear'}. Best is trial 236 with value: 0.5945206794543682.
[I 2024-11-06 19:53:36,100] Trial 473 finished with value: 0.5912515092583789 and parameters: {'C': 0.012115999550962875, 'solver': 'liblinear'}. Best is trial 236 with value: 0.5945206794543682.
[I 2024-11-06 19:53:37,867] Trial 474 finished with value: 0.5944818032325733 and parameters: {'C': 0.558922601028738, 'solver': 'liblinear'}. Best is trial 236 with value: 0.5945206794543682.
[I 2024-11-06 19:53:39,420] Trial 475 finished with value: 0.59427800923028 and parameters: {'C': 0.2568732776827585, 'solver': 'liblinear'}. Best is trial 236 with value: 0.5945206794543682.
[I 2024-11-06 19:53:41,429] Trial 476 finished with value: 0.5944241813468227 and parameters: {'C': 0.8383867753290648, 'solver': 'liblinear'}. Best is trial 236 with value: 0.5945206794543682.
[I 2024-11-06 19:53:43,035] Trial 477 finished with value: 0.5944075915572162 and parameters: {'C': 2.9863177202399047, 'solver': 'liblinear'}. Best is trial 236 with value: 0.5945206794543682.
