[I 2024-11-07 02:49:10,608] Trial 129 finished with value: 0.5946397457097137 and parameters: {'iterations': 979, 'learning_rate': 0.22093789801425084, 'depth': 5, 'l2_leaf_reg': 1.705597393873172}. Best is trial 56 with value: 0.5955351412315192.
/anaconda/envs/py38_default/lib/python3.9/site-packages/catboost/core.py:1102: FutureWarning: iteritems is deprecated and will be removed in a future version. Use .items instead.
  self._init_pool(data, label, cat_features, text_features, embedding_features, pairs, weight, group_id, group_weight, subgroup_id, pairs_weight, baseline, feature_names, thread_count)
/anaconda/envs/py38_default/lib/python3.9/site-packages/catboost/core.py:1102: FutureWarning: iteritems is deprecated and will be removed in a future version. Use .items instead.
  self._init_pool(data, label, cat_features, text_features, embedding_features, pairs, weight, group_id, group_weight, subgroup_id, pairs_weight, baseline, feature_names, thread_count)
/anaconda/envs/py38_default/lib/python3.9/site-packages/catboost/core.py:1102: FutureWarning: iteritems is deprecated and will be removed in a future version. Use .items instead.
  self._init_pool(data, label, cat_features, text_features, embedding_features, pairs, weight, group_id, group_weight, subgroup_id, pairs_weight, baseline, feature_names, thread_count)
/anaconda/envs/py38_default/lib/python3.9/site-packages/catboost/core.py:1102: FutureWarning: iteritems is deprecated and will be removed in a future version. Use .items instead.
  self._init_pool(data, label, cat_features, text_features, embedding_features, pairs, weight, group_id, group_weight, subgroup_id, pairs_weight, baseline, feature_names, thread_count)
/anaconda/envs/py38_default/lib/python3.9/site-packages/catboost/core.py:1102: FutureWarning: iteritems is deprecated and will be removed in a future version. Use .items instead.
  self._init_pool(data, label, cat_features, text_features, embedding_features, pairs, weight, group_id, group_weight, subgroup_id, pairs_weight, baseline, feature_names, thread_count)
[I 2024-11-07 02:51:15,863] Trial 130 finished with value: 0.594210553796867 and parameters: {'iterations': 980, 'learning_rate': 0.22989687528272568, 'depth': 5, 'l2_leaf_reg': 1.690058873184634}. Best is trial 56 with value: 0.5955351412315192.
/anaconda/envs/py38_default/lib/python3.9/site-packages/catboost/core.py:1102: FutureWarning: iteritems is deprecated and will be removed in a future version. Use .items instead.
  self._init_pool(data, label, cat_features, text_features, embedding_features, pairs, weight, group_id, group_weight, subgroup_id, pairs_weight, baseline, feature_names, thread_count)
/anaconda/envs/py38_default/lib/python3.9/site-packages/catboost/core.py:1102: FutureWarning: iteritems is deprecated and will be removed in a future version. Use .items instead.
  self._init_pool(data, label, cat_features, text_features, embedding_features, pairs, weight, group_id, group_weight, subgroup_id, pairs_weight, baseline, feature_names, thread_count)
/anaconda/envs/py38_default/lib/python3.9/site-packages/catboost/core.py:1102: FutureWarning: iteritems is deprecated and will be removed in a future version. Use .items instead.
  self._init_pool(data, label, cat_features, text_features, embedding_features, pairs, weight, group_id, group_weight, subgroup_id, pairs_weight, baseline, feature_names, thread_count)
/anaconda/envs/py38_default/lib/python3.9/site-packages/catboost/core.py:1102: FutureWarning: iteritems is deprecated and will be removed in a future version. Use .items instead.
  self._init_pool(data, label, cat_features, text_features, embedding_features, pairs, weight, group_id, group_weight, subgroup_id, pairs_weight, baseline, feature_names, thread_count)
/anaconda/envs/py38_default/lib/python3.9/site-packages/catboost/core.py:1102: FutureWarning: iteritems is deprecated and will be removed in a future version. Use .items instead.
  self._init_pool(data, label, cat_features, text_features, embedding_features, pairs, weight, group_id, group_weight, subgroup_id, pairs_weight, baseline, feature_names, thread_count)
[I 2024-11-07 02:52:36,104] Trial 131 finished with value: 0.593833507962301 and parameters: {'iterations': 626, 'learning_rate': 0.2217769084295645, 'depth': 5, 'l2_leaf_reg': 2.020338480043823}. Best is trial 56 with value: 0.5955351412315192.
/anaconda/envs/py38_default/lib/python3.9/site-packages/catboost/core.py:1102: FutureWarning: iteritems is deprecated and will be removed in a future version. Use .items instead.
  self._init_pool(data, label, cat_features, text_features, embedding_features, pairs, weight, group_id, group_weight, subgroup_id, pairs_weight, baseline, feature_names, thread_count)
/anaconda/envs/py38_default/lib/python3.9/site-packages/catboost/core.py:1102: FutureWarning: iteritems is deprecated and will be removed in a future version. Use .items instead.
  self._init_pool(data, label, cat_features, text_features, embedding_features, pairs, weight, group_id, group_weight, subgroup_id, pairs_weight, baseline, feature_names, thread_count)
/anaconda/envs/py38_default/lib/python3.9/site-packages/catboost/core.py:1102: FutureWarning: iteritems is deprecated and will be removed in a future version. Use .items instead.
  self._init_pool(data, label, cat_features, text_features, embedding_features, pairs, weight, group_id, group_weight, subgroup_id, pairs_weight, baseline, feature_names, thread_count)
/anaconda/envs/py38_default/lib/python3.9/site-packages/catboost/core.py:1102: FutureWarning: iteritems is deprecated and will be removed in a future version. Use .items instead.
  self._init_pool(data, label, cat_features, text_features, embedding_features, pairs, weight, group_id, group_weight, subgroup_id, pairs_weight, baseline, feature_names, thread_count)
/anaconda/envs/py38_default/lib/python3.9/site-packages/catboost/core.py:1102: FutureWarning: iteritems is deprecated and will be removed in a future version. Use .items instead.
  self._init_pool(data, label, cat_features, text_features, embedding_features, pairs, weight, group_id, group_weight, subgroup_id, pairs_weight, baseline, feature_names, thread_count)
[I 2024-11-07 02:54:43,741] Trial 132 finished with value: 0.594869369053703 and parameters: {'iterations': 993, 'learning_rate': 0.21508299630530597, 'depth': 5, 'l2_leaf_reg': 1.1957779653992346}. Best is trial 56 with value: 0.5955351412315192.
/anaconda/envs/py38_default/lib/python3.9/site-packages/catboost/core.py:1102: FutureWarning: iteritems is deprecated and will be removed in a future version. Use .items instead.
  self._init_pool(data, label, cat_features, text_features, embedding_features, pairs, weight, group_id, group_weight, subgroup_id, pairs_weight, baseline, feature_names, thread_count)
/anaconda/envs/py38_default/lib/python3.9/site-packages/catboost/core.py:1102: FutureWarning: iteritems is deprecated and will be removed in a future version. Use .items instead.
  self._init_pool(data, label, cat_features, text_features, embedding_features, pairs, weight, group_id, group_weight, subgroup_id, pairs_weight, baseline, feature_names, thread_count)
/anaconda/envs/py38_default/lib/python3.9/site-packages/catboost/core.py:1102: FutureWarning: iteritems is deprecated and will be removed in a future version. Use .items instead.
  self._init_pool(data, label, cat_features, text_features, embedding_features, pairs, weight, group_id, group_weight, subgroup_id, pairs_weight, baseline, feature_names, thread_count)
/anaconda/envs/py38_default/lib/python3.9/site-packages/catboost/core.py:1102: FutureWarning: iteritems is deprecated and will be removed in a future version. Use .items instead.
  self._init_pool(data, label, cat_features, text_features, embedding_features, pairs, weight, group_id, group_weight, subgroup_id, pairs_weight, baseline, feature_names, thread_count)
/anaconda/envs/py38_default/lib/python3.9/site-packages/catboost/core.py:1102: FutureWarning: iteritems is deprecated and will be removed in a future version. Use .items instead.
  self._init_pool(data, label, cat_features, text_features, embedding_features, pairs, weight, group_id, group_weight, subgroup_id, pairs_weight, baseline, feature_names, thread_count)
[I 2024-11-07 02:56:46,630] Trial 133 finished with value: 0.5946383388667783 and parameters: {'iterations': 967, 'learning_rate': 0.2049191333050794, 'depth': 5, 'l2_leaf_reg': 1.0042913997594505}. Best is trial 56 with value: 0.5955351412315192.
/anaconda/envs/py38_default/lib/python3.9/site-packages/catboost/core.py:1102: FutureWarning: iteritems is deprecated and will be removed in a future version. Use .items instead.
  self._init_pool(data, label, cat_features, text_features, embedding_features, pairs, weight, group_id, group_weight, subgroup_id, pairs_weight, baseline, feature_names, thread_count)
/anaconda/envs/py38_default/lib/python3.9/site-packages/catboost/core.py:1102: FutureWarning: iteritems is deprecated and will be removed in a future version. Use .items instead.
  self._init_pool(data, label, cat_features, text_features, embedding_features, pairs, weight, group_id, group_weight, subgroup_id, pairs_weight, baseline, feature_names, thread_count)
/anaconda/envs/py38_default/lib/python3.9/site-packages/catboost/core.py:1102: FutureWarning: iteritems is deprecated and will be removed in a future version. Use .items instead.
  self._init_pool(data, label, cat_features, text_features, embedding_features, pairs, weight, group_id, group_weight, subgroup_id, pairs_weight, baseline, feature_names, thread_count)
/anaconda/envs/py38_default/lib/python3.9/site-packages/catboost/core.py:1102: FutureWarning: iteritems is deprecated and will be removed in a future version. Use .items instead.
  self._init_pool(data, label, cat_features, text_features, embedding_features, pairs, weight, group_id, group_weight, subgroup_id, pairs_weight, baseline, feature_names, thread_count)
/anaconda/envs/py38_default/lib/python3.9/site-packages/catboost/core.py:1102: FutureWarning: iteritems is deprecated and will be removed in a future version. Use .items instead.
  self._init_pool(data, label, cat_features, text_features, embedding_features, pairs, weight, group_id, group_weight, subgroup_id, pairs_weight, baseline, feature_names, thread_count)
[I 2024-11-07 02:58:52,761] Trial 134 finished with value: 0.5943657823200001 and parameters: {'iterations': 997, 'learning_rate': 0.20169715985165754, 'depth': 5, 'l2_leaf_reg': 1.0133484044002654}. Best is trial 56 with value: 0.5955351412315192.
/anaconda/envs/py38_default/lib/python3.9/site-packages/catboost/core.py:1102: FutureWarning: iteritems is deprecated and will be removed in a future version. Use .items instead.
  self._init_pool(data, label, cat_features, text_features, embedding_features, pairs, weight, group_id, group_weight, subgroup_id, pairs_weight, baseline, feature_names, thread_count)
/anaconda/envs/py38_default/lib/python3.9/site-packages/catboost/core.py:1102: FutureWarning: iteritems is deprecated and will be removed in a future version. Use .items instead.
  self._init_pool(data, label, cat_features, text_features, embedding_features, pairs, weight, group_id, group_weight, subgroup_id, pairs_weight, baseline, feature_names, thread_count)
/anaconda/envs/py38_default/lib/python3.9/site-packages/catboost/core.py:1102: FutureWarning: iteritems is deprecated and will be removed in a future version. Use .items instead.
  self._init_pool(data, label, cat_features, text_features, embedding_features, pairs, weight, group_id, group_weight, subgroup_id, pairs_weight, baseline, feature_names, thread_count)
/anaconda/envs/py38_default/lib/python3.9/site-packages/catboost/core.py:1102: FutureWarning: iteritems is deprecated and will be removed in a future version. Use .items instead.
  self._init_pool(data, label, cat_features, text_features, embedding_features, pairs, weight, group_id, group_weight, subgroup_id, pairs_weight, baseline, feature_names, thread_count)
/anaconda/envs/py38_default/lib/python3.9/site-packages/catboost/core.py:1102: FutureWarning: iteritems is deprecated and will be removed in a future version. Use .items instead.
  self._init_pool(data, label, cat_features, text_features, embedding_features, pairs, weight, group_id, group_weight, subgroup_id, pairs_weight, baseline, feature_names, thread_count)
[I 2024-11-07 03:00:56,730] Trial 135 finished with value: 0.594599886846785 and parameters: {'iterations': 959, 'learning_rate': 0.21708223460836323, 'depth': 5, 'l2_leaf_reg': 1.1819337061565858}. Best is trial 56 with value: 0.5955351412315192.
/anaconda/envs/py38_default/lib/python3.9/site-packages/catboost/core.py:1102: FutureWarning: iteritems is deprecated and will be removed in a future version. Use .items instead.
  self._init_pool(data, label, cat_features, text_features, embedding_features, pairs, weight, group_id, group_weight, subgroup_id, pairs_weight, baseline, feature_names, thread_count)
/anaconda/envs/py38_default/lib/python3.9/site-packages/catboost/core.py:1102: FutureWarning: iteritems is deprecated and will be removed in a future version. Use .items instead.
  self._init_pool(data, label, cat_features, text_features, embedding_features, pairs, weight, group_id, group_weight, subgroup_id, pairs_weight, baseline, feature_names, thread_count)
/anaconda/envs/py38_default/lib/python3.9/site-packages/catboost/core.py:1102: FutureWarning: iteritems is deprecated and will be removed in a future version. Use .items instead.
  self._init_pool(data, label, cat_features, text_features, embedding_features, pairs, weight, group_id, group_weight, subgroup_id, pairs_weight, baseline, feature_names, thread_count)
/anaconda/envs/py38_default/lib/python3.9/site-packages/catboost/core.py:1102: FutureWarning: iteritems is deprecated and will be removed in a future version. Use .items instead.
  self._init_pool(data, label, cat_features, text_features, embedding_features, pairs, weight, group_id, group_weight, subgroup_id, pairs_weight, baseline, feature_names, thread_count)
/anaconda/envs/py38_default/lib/python3.9/site-packages/catboost/core.py:1102: FutureWarning: iteritems is deprecated and will be removed in a future version. Use .items instead.
  self._init_pool(data, label, cat_features, text_features, embedding_features, pairs, weight, group_id, group_weight, subgroup_id, pairs_weight, baseline, feature_names, thread_count)
[I 2024-11-07 03:03:03,548] Trial 136 finished with value: 0.5949126673358538 and parameters: {'iterations': 978, 'learning_rate': 0.2146573038188574, 'depth': 5, 'l2_leaf_reg': 1.4393405543653373}. Best is trial 56 with value: 0.5955351412315192.
/anaconda/envs/py38_default/lib/python3.9/site-packages/catboost/core.py:1102: FutureWarning: iteritems is deprecated and will be removed in a future version. Use .items instead.
  self._init_pool(data, label, cat_features, text_features, embedding_features, pairs, weight, group_id, group_weight, subgroup_id, pairs_weight, baseline, feature_names, thread_count)
/anaconda/envs/py38_default/lib/python3.9/site-packages/catboost/core.py:1102: FutureWarning: iteritems is deprecated and will be removed in a future version. Use .items instead.
  self._init_pool(data, label, cat_features, text_features, embedding_features, pairs, weight, group_id, group_weight, subgroup_id, pairs_weight, baseline, feature_names, thread_count)
/anaconda/envs/py38_default/lib/python3.9/site-packages/catboost/core.py:1102: FutureWarning: iteritems is deprecated and will be removed in a future version. Use .items instead.
  self._init_pool(data, label, cat_features, text_features, embedding_features, pairs, weight, group_id, group_weight, subgroup_id, pairs_weight, baseline, feature_names, thread_count)
/anaconda/envs/py38_default/lib/python3.9/site-packages/catboost/core.py:1102: FutureWarning: iteritems is deprecated and will be removed in a future version. Use .items instead.
  self._init_pool(data, label, cat_features, text_features, embedding_features, pairs, weight, group_id, group_weight, subgroup_id, pairs_weight, baseline, feature_names, thread_count)
/anaconda/envs/py38_default/lib/python3.9/site-packages/catboost/core.py:1102: FutureWarning: iteritems is deprecated and will be removed in a future version. Use .items instead.
  self._init_pool(data, label, cat_features, text_features, embedding_features, pairs, weight, group_id, group_weight, subgroup_id, pairs_weight, baseline, feature_names, thread_count)
[I 2024-11-07 03:06:39,625] Trial 137 finished with value: 0.5920923355217425 and parameters: {'iterations': 983, 'learning_rate': 0.22725601876600818, 'depth': 8, 'l2_leaf_reg': 1.4793773892642743}. Best is trial 56 with value: 0.5955351412315192.
/anaconda/envs/py38_default/lib/python3.9/site-packages/catboost/core.py:1102: FutureWarning: iteritems is deprecated and will be removed in a future version. Use .items instead.
  self._init_pool(data, label, cat_features, text_features, embedding_features, pairs, weight, group_id, group_weight, subgroup_id, pairs_weight, baseline, feature_names, thread_count)
/anaconda/envs/py38_default/lib/python3.9/site-packages/catboost/core.py:1102: FutureWarning: iteritems is deprecated and will be removed in a future version. Use .items instead.
  self._init_pool(data, label, cat_features, text_features, embedding_features, pairs, weight, group_id, group_weight, subgroup_id, pairs_weight, baseline, feature_names, thread_count)
/anaconda/envs/py38_default/lib/python3.9/site-packages/catboost/core.py:1102: FutureWarning: iteritems is deprecated and will be removed in a future version. Use .items instead.
  self._init_pool(data, label, cat_features, text_features, embedding_features, pairs, weight, group_id, group_weight, subgroup_id, pairs_weight, baseline, feature_names, thread_count)
/anaconda/envs/py38_default/lib/python3.9/site-packages/catboost/core.py:1102: FutureWarning: iteritems is deprecated and will be removed in a future version. Use .items instead.
  self._init_pool(data, label, cat_features, text_features, embedding_features, pairs, weight, group_id, group_weight, subgroup_id, pairs_weight, baseline, feature_names, thread_count)
/anaconda/envs/py38_default/lib/python3.9/site-packages/catboost/core.py:1102: FutureWarning: iteritems is deprecated and will be removed in a future version. Use .items instead.
  self._init_pool(data, label, cat_features, text_features, embedding_features, pairs, weight, group_id, group_weight, subgroup_id, pairs_weight, baseline, feature_names, thread_count)
[I 2024-11-07 03:09:02,846] Trial 138 finished with value: 0.5930761555031253 and parameters: {'iterations': 965, 'learning_rate': 0.03496028429109817, 'depth': 6, 'l2_leaf_reg': 1.4025119727695075}. Best is trial 56 with value: 0.5955351412315192.
/anaconda/envs/py38_default/lib/python3.9/site-packages/catboost/core.py:1102: FutureWarning: iteritems is deprecated and will be removed in a future version. Use .items instead.
  self._init_pool(data, label, cat_features, text_features, embedding_features, pairs, weight, group_id, group_weight, subgroup_id, pairs_weight, baseline, feature_names, thread_count)
/anaconda/envs/py38_default/lib/python3.9/site-packages/catboost/core.py:1102: FutureWarning: iteritems is deprecated and will be removed in a future version. Use .items instead.
  self._init_pool(data, label, cat_features, text_features, embedding_features, pairs, weight, group_id, group_weight, subgroup_id, pairs_weight, baseline, feature_names, thread_count)
/anaconda/envs/py38_default/lib/python3.9/site-packages/catboost/core.py:1102: FutureWarning: iteritems is deprecated and will be removed in a future version. Use .items instead.
  self._init_pool(data, label, cat_features, text_features, embedding_features, pairs, weight, group_id, group_weight, subgroup_id, pairs_weight, baseline, feature_names, thread_count)
/anaconda/envs/py38_default/lib/python3.9/site-packages/catboost/core.py:1102: FutureWarning: iteritems is deprecated and will be removed in a future version. Use .items instead.
  self._init_pool(data, label, cat_features, text_features, embedding_features, pairs, weight, group_id, group_weight, subgroup_id, pairs_weight, baseline, feature_names, thread_count)
/anaconda/envs/py38_default/lib/python3.9/site-packages/catboost/core.py:1102: FutureWarning: iteritems is deprecated and will be removed in a future version. Use .items instead.
  self._init_pool(data, label, cat_features, text_features, embedding_features, pairs, weight, group_id, group_weight, subgroup_id, pairs_weight, baseline, feature_names, thread_count)
