[I 2024-11-06 22:27:18,787] Trial 842 finished with value: 0.5938657874409872 and parameters: {'n_estimators': 175, 'max_depth': 7, 'learning_rate': 0.0757800387458784, 'gamma': 4.656621369893532, 'min_child_weight': 9, 'subsample': 0.8686987850113015, 'colsample_bytree': 0.5860569599258165, 'reg_alpha': 0.5560844937762703, 'reg_lambda': 0.7981159148216439}. Best is trial 829 with value: 0.5942795917588232.
[I 2024-11-06 22:27:22,935] Trial 843 finished with value: 0.5938891303750132 and parameters: {'n_estimators': 179, 'max_depth': 7, 'learning_rate': 0.07449820101550625, 'gamma': 4.714436708419347, 'min_child_weight': 9, 'subsample': 0.8663578274159869, 'colsample_bytree': 0.5889635540790451, 'reg_alpha': 0.5540128665435085, 'reg_lambda': 0.810223270876463}. Best is trial 829 with value: 0.5942795917588232.
[I 2024-11-06 22:27:26,386] Trial 844 finished with value: 0.592934461589014 and parameters: {'n_estimators': 180, 'max_depth': 7, 'learning_rate': 0.08340276233939806, 'gamma': 4.726145668042381, 'min_child_weight': 8, 'subsample': 0.8559590584381239, 'colsample_bytree': 0.5874799233875929, 'reg_alpha': 0.5288036197118255, 'reg_lambda': 0.8290692078357215}. Best is trial 829 with value: 0.5942795917588232.
[I 2024-11-06 22:27:30,021] Trial 845 finished with value: 0.5929512027842051 and parameters: {'n_estimators': 175, 'max_depth': 7, 'learning_rate': 0.08667839354886236, 'gamma': 4.736646309498053, 'min_child_weight': 9, 'subsample': 0.8628505794908595, 'colsample_bytree': 0.585071762808276, 'reg_alpha': 0.5409904424682118, 'reg_lambda': 0.8584600636116879}. Best is trial 829 with value: 0.5942795917588232.
[I 2024-11-06 22:27:33,671] Trial 846 finished with value: 0.5925267445285944 and parameters: {'n_estimators': 176, 'max_depth': 7, 'learning_rate': 0.09286417856386245, 'gamma': 4.65919941112221, 'min_child_weight': 10, 'subsample': 0.8460538366140222, 'colsample_bytree': 0.580756939310129, 'reg_alpha': 0.5437062370597426, 'reg_lambda': 0.7992534751605054}. Best is trial 829 with value: 0.5942795917588232.
[I 2024-11-06 22:27:37,409] Trial 847 finished with value: 0.5933238551703371 and parameters: {'n_estimators': 176, 'max_depth': 7, 'learning_rate': 0.07408222052220363, 'gamma': 4.7697733676306155, 'min_child_weight': 9, 'subsample': 0.8658379970088292, 'colsample_bytree': 0.584170041180527, 'reg_alpha': 0.5611947467501842, 'reg_lambda': 0.8016321932271709}. Best is trial 829 with value: 0.5942795917588232.
[I 2024-11-06 22:27:41,235] Trial 848 finished with value: 0.5925346977541389 and parameters: {'n_estimators': 171, 'max_depth': 7, 'learning_rate': 0.07817679211593653, 'gamma': 4.672715336547105, 'min_child_weight': 9, 'subsample': 0.8528146574526291, 'colsample_bytree': 0.5910352819952822, 'reg_alpha': 0.5476383416342734, 'reg_lambda': 0.7971948620117856}. Best is trial 829 with value: 0.5942795917588232.
[I 2024-11-06 22:27:45,060] Trial 849 finished with value: 0.5925740947081646 and parameters: {'n_estimators': 179, 'max_depth': 7, 'learning_rate': 0.08452083999958798, 'gamma': 4.711342339479308, 'min_child_weight': 9, 'subsample': 0.838454712251352, 'colsample_bytree': 0.5740673954963363, 'reg_alpha': 0.5171282577588245, 'reg_lambda': 0.843291357676779}. Best is trial 829 with value: 0.5942795917588232.
[I 2024-11-06 22:27:48,553] Trial 850 finished with value: 0.5923286559353194 and parameters: {'n_estimators': 185, 'max_depth': 7, 'learning_rate': 0.12395015586818164, 'gamma': 4.621495411602994, 'min_child_weight': 9, 'subsample': 0.869569880480336, 'colsample_bytree': 0.5899372878846227, 'reg_alpha': 0.5588838321023855, 'reg_lambda': 0.8212220290331596}. Best is trial 829 with value: 0.5942795917588232.
[I 2024-11-06 22:27:52,357] Trial 851 finished with value: 0.5927202208334649 and parameters: {'n_estimators': 187, 'max_depth': 7, 'learning_rate': 0.0733289386422735, 'gamma': 4.808396337985868, 'min_child_weight': 10, 'subsample': 0.8583139578212583, 'colsample_bytree': 0.862334270592044, 'reg_alpha': 0.5060649958898223, 'reg_lambda': 0.8031402981916722}. Best is trial 829 with value: 0.5942795917588232.
[I 2024-11-06 22:27:56,254] Trial 852 finished with value: 0.5926620561145832 and parameters: {'n_estimators': 172, 'max_depth': 7, 'learning_rate': 0.07595148226810014, 'gamma': 4.785366109937998, 'min_child_weight': 9, 'subsample': 0.8272647892076391, 'colsample_bytree': 0.5744293506420227, 'reg_alpha': 0.5389851738441159, 'reg_lambda': 0.791805046065521}. Best is trial 829 with value: 0.5942795917588232.
[I 2024-11-06 22:28:00,085] Trial 853 finished with value: 0.5928437343776036 and parameters: {'n_estimators': 178, 'max_depth': 7, 'learning_rate': 0.07490863475925784, 'gamma': 4.667065703322486, 'min_child_weight': 9, 'subsample': 0.8609020242472354, 'colsample_bytree': 0.5911453030903406, 'reg_alpha': 0.5622429844083535, 'reg_lambda': 0.8519877301915756}. Best is trial 829 with value: 0.5942795917588232.
[I 2024-11-06 22:28:04,523] Trial 854 finished with value: 0.5929982898205097 and parameters: {'n_estimators': 169, 'max_depth': 7, 'learning_rate': 0.0877034368074397, 'gamma': 4.5810144767751675, 'min_child_weight': 10, 'subsample': 0.8695463109055535, 'colsample_bytree': 0.8279001110753226, 'reg_alpha': 0.5642196499731656, 'reg_lambda': 0.05046622862553152}. Best is trial 829 with value: 0.5942795917588232.
[I 2024-11-06 22:28:08,258] Trial 855 finished with value: 0.593070235637998 and parameters: {'n_estimators': 194, 'max_depth': 7, 'learning_rate': 0.0780101682522649, 'gamma': 4.708115826317067, 'min_child_weight': 9, 'subsample': 0.8515279369394239, 'colsample_bytree': 0.5688851097009243, 'reg_alpha': 0.52329485187692, 'reg_lambda': 0.8224624907152303}. Best is trial 829 with value: 0.5942795917588232.
[I 2024-11-06 22:28:11,813] Trial 856 finished with value: 0.5934139565051919 and parameters: {'n_estimators': 170, 'max_depth': 7, 'learning_rate': 0.08334065864252357, 'gamma': 4.5553959010235685, 'min_child_weight': 9, 'subsample': 0.8693896447985571, 'colsample_bytree': 0.5864537295881523, 'reg_alpha': 0.5618134404583923, 'reg_lambda': 0.7912417239635285}. Best is trial 829 with value: 0.5942795917588232.
[I 2024-11-06 22:28:15,705] Trial 857 finished with value: 0.5930513494836124 and parameters: {'n_estimators': 174, 'max_depth': 7, 'learning_rate': 0.07131819264690668, 'gamma': 4.819828403869024, 'min_child_weight': 8, 'subsample': 0.8824756425412629, 'colsample_bytree': 0.5808739065811472, 'reg_alpha': 0.5718941014247068, 'reg_lambda': 0.8060362338350832}. Best is trial 829 with value: 0.5942795917588232.
[I 2024-11-06 22:28:19,435] Trial 858 finished with value: 0.5933341119600594 and parameters: {'n_estimators': 176, 'max_depth': 7, 'learning_rate': 0.0802070482811246, 'gamma': 4.738006588655887, 'min_child_weight': 9, 'subsample': 0.8408799567797849, 'colsample_bytree': 0.567929110446495, 'reg_alpha': 0.5840146170242199, 'reg_lambda': 0.8349720492646145}. Best is trial 829 with value: 0.5942795917588232.
[I 2024-11-06 22:28:23,100] Trial 859 finished with value: 0.593159889947279 and parameters: {'n_estimators': 186, 'max_depth': 7, 'learning_rate': 0.09080767976225597, 'gamma': 4.650041890696716, 'min_child_weight': 9, 'subsample': 0.8716838278631132, 'colsample_bytree': 0.5777406309181174, 'reg_alpha': 0.5716201479373025, 'reg_lambda': 0.7877666610708178}. Best is trial 829 with value: 0.5942795917588232.
[I 2024-11-06 22:28:26,975] Trial 860 finished with value: 0.5921124848369431 and parameters: {'n_estimators': 177, 'max_depth': 6, 'learning_rate': 0.07451645515998913, 'gamma': 4.6863961293983945, 'min_child_weight': 10, 'subsample': 0.8852913157480689, 'colsample_bytree': 0.590698755821812, 'reg_alpha': 0.5281864560559026, 'reg_lambda': 0.8070295910511901}. Best is trial 829 with value: 0.5942795917588232.
[I 2024-11-06 22:28:31,136] Trial 861 finished with value: 0.5936291381713792 and parameters: {'n_estimators': 183, 'max_depth': 7, 'learning_rate': 0.06988005245036978, 'gamma': 4.519126791543364, 'min_child_weight': 9, 'subsample': 0.8616430485881065, 'colsample_bytree': 0.565801007532941, 'reg_alpha': 0.5469454323514359, 'reg_lambda': 0.7882195963350604}. Best is trial 829 with value: 0.5942795917588232.
[I 2024-11-06 22:28:34,711] Trial 862 finished with value: 0.5931648296359089 and parameters: {'n_estimators': 170, 'max_depth': 7, 'learning_rate': 0.10493051881397729, 'gamma': 4.6069279000486745, 'min_child_weight': 9, 'subsample': 0.8523511289725312, 'colsample_bytree': 0.5803667285392177, 'reg_alpha': 0.5820390170575144, 'reg_lambda': 0.8709771300714861}. Best is trial 829 with value: 0.5942795917588232.
[I 2024-11-06 22:28:38,240] Trial 863 finished with value: 0.5932507753609583 and parameters: {'n_estimators': 167, 'max_depth': 7, 'learning_rate': 0.0743038986858244, 'gamma': 4.464329883464161, 'min_child_weight': 8, 'subsample': 0.8752886299210184, 'colsample_bytree': 0.593232075185182, 'reg_alpha': 0.5997291593417823, 'reg_lambda': 0.8304103446699882}. Best is trial 829 with value: 0.5942795917588232.
[I 2024-11-06 22:28:41,345] Trial 864 finished with value: 0.5935209422744077 and parameters: {'n_estimators': 172, 'max_depth': 7, 'learning_rate': 0.06786040190001773, 'gamma': 4.776783133663435, 'min_child_weight': 9, 'subsample': 0.8664418679924539, 'colsample_bytree': 0.5712374535303809, 'reg_alpha': 0.5507749729162496, 'reg_lambda': 0.7962665455127677}. Best is trial 829 with value: 0.5942795917588232.
[I 2024-11-06 22:28:45,157] Trial 865 finished with value: 0.5923922024433212 and parameters: {'n_estimators': 180, 'max_depth': 7, 'learning_rate': 0.08375309579614763, 'gamma': 4.599791835908364, 'min_child_weight': 10, 'subsample': 0.8495102746575612, 'colsample_bytree': 0.5089472686129781, 'reg_alpha': 0.5106855274346982, 'reg_lambda': 0.8161984876118599}. Best is trial 829 with value: 0.5942795917588232.
[I 2024-11-06 22:28:48,941] Trial 866 finished with value: 0.59317773249886 and parameters: {'n_estimators': 183, 'max_depth': 7, 'learning_rate': 0.07134685282804959, 'gamma': 4.543921495779004, 'min_child_weight': 9, 'subsample': 0.8795822272518967, 'colsample_bytree': 0.5831189818591613, 'reg_alpha': 0.5798415336645729, 'reg_lambda': 0.7879834226165983}. Best is trial 829 with value: 0.5942795917588232.
[I 2024-11-06 22:28:52,420] Trial 867 finished with value: 0.5931259590209631 and parameters: {'n_estimators': 173, 'max_depth': 7, 'learning_rate': 0.07912242811317644, 'gamma': 4.832074098685826, 'min_child_weight': 9, 'subsample': 0.8884720059701763, 'colsample_bytree': 0.5632852898265592, 'reg_alpha': 0.6130561852317227, 'reg_lambda': 0.7822995175338123}. Best is trial 829 with value: 0.5942795917588232.
[I 2024-11-06 22:28:56,264] Trial 868 finished with value: 0.5936365021668786 and parameters: {'n_estimators': 167, 'max_depth': 7, 'learning_rate': 0.07006602141358782, 'gamma': 4.83511093612802, 'min_child_weight': 9, 'subsample': 0.860085170689403, 'colsample_bytree': 0.594158056023215, 'reg_alpha': 0.5823160759831861, 'reg_lambda': 0.8609152848784647}. Best is trial 829 with value: 0.5942795917588232.
[I 2024-11-06 22:28:59,791] Trial 869 finished with value: 0.5931066538598921 and parameters: {'n_estimators': 166, 'max_depth': 7, 'learning_rate': 0.16127978612995317, 'gamma': 4.4754537779994505, 'min_child_weight': 9, 'subsample': 0.8375059770393688, 'colsample_bytree': 0.5746054297784, 'reg_alpha': 0.5423640893784808, 'reg_lambda': 0.8099330253864739}. Best is trial 829 with value: 0.5942795917588232.
[I 2024-11-06 22:29:04,453] Trial 870 finished with value: 0.5934385522750171 and parameters: {'n_estimators': 178, 'max_depth': 7, 'learning_rate': 0.06921938587779883, 'gamma': 4.363503895372054, 'min_child_weight': 8, 'subsample': 0.8744136840500422, 'colsample_bytree': 0.5842257547429509, 'reg_alpha': 0.6005394012055373, 'reg_lambda': 0.8350672556507553}. Best is trial 829 with value: 0.5942795917588232.
[I 2024-11-06 22:29:08,416] Trial 871 finished with value: 0.5937730043741931 and parameters: {'n_estimators': 172, 'max_depth': 7, 'learning_rate': 0.07964489930760739, 'gamma': 4.561103985786874, 'min_child_weight': 10, 'subsample': 0.863212669553349, 'colsample_bytree': 0.559817758453423, 'reg_alpha': 0.6146318737124985, 'reg_lambda': 0.7787568152065503}. Best is trial 829 with value: 0.5942795917588232.
[I 2024-11-06 22:29:11,992] Trial 872 finished with value: 0.5926564882962133 and parameters: {'n_estimators': 167, 'max_depth': 6, 'learning_rate': 0.08991509823791086, 'gamma': 4.711498082216351, 'min_child_weight': 9, 'subsample': 0.8947417395624416, 'colsample_bytree': 0.5952433917947281, 'reg_alpha': 0.5577191002509693, 'reg_lambda': 0.820291740487335}. Best is trial 829 with value: 0.5942795917588232.
[I 2024-11-06 22:29:16,058] Trial 873 finished with value: 0.5930369731716052 and parameters: {'n_estimators': 171, 'max_depth': 7, 'learning_rate': 0.0740870739944354, 'gamma': 4.44452163240463, 'min_child_weight': 8, 'subsample': 0.8498035070065865, 'colsample_bytree': 0.9774909809066485, 'reg_alpha': 0.5869339839826283, 'reg_lambda': 0.7904805120118403}. Best is trial 829 with value: 0.5942795917588232.
[I 2024-11-06 22:29:19,639] Trial 874 finished with value: 0.5935380686427754 and parameters: {'n_estimators': 166, 'max_depth': 7, 'learning_rate': 0.06914524570578456, 'gamma': 4.33578931024202, 'min_child_weight': 9, 'subsample': 0.8810825009036339, 'colsample_bytree': 0.5781678359544449, 'reg_alpha': 0.6164758393131409, 'reg_lambda': 0.7786722909963796}. Best is trial 829 with value: 0.5942795917588232.
[I 2024-11-06 22:29:24,093] Trial 875 finished with value: 0.593227729103025 and parameters: {'n_estimators': 191, 'max_depth': 7, 'learning_rate': 0.06771403350348457, 'gamma': 4.89694534689524, 'min_child_weight': 8, 'subsample': 0.5801900385268919, 'colsample_bytree': 0.569409564082886, 'reg_alpha': 0.5749519020914128, 'reg_lambda': 0.8090227092731465}. Best is trial 829 with value: 0.5942795917588232.
[I 2024-11-06 22:29:27,849] Trial 876 finished with value: 0.5920074335048643 and parameters: {'n_estimators': 187, 'max_depth': 7, 'learning_rate': 0.11856332689883624, 'gamma': 4.5217197644651765, 'min_child_weight': 9, 'subsample': 0.6443009104729239, 'colsample_bytree': 0.5921462954855181, 'reg_alpha': 0.6063021246531203, 'reg_lambda': 0.7979266483441466}. Best is trial 829 with value: 0.5942795917588232.
[I 2024-11-06 22:29:32,314] Trial 877 finished with value: 0.5924421746751367 and parameters: {'n_estimators': 174, 'max_depth': 7, 'learning_rate': 0.08155839571387692, 'gamma': 3.3423684248633103, 'min_child_weight': 8, 'subsample': 0.8221253948407435, 'colsample_bytree': 0.5817355766037334, 'reg_alpha': 0.5688740307758283, 'reg_lambda': 0.8487973028094962}. Best is trial 829 with value: 0.5942795917588232.
[I 2024-11-06 22:29:35,656] Trial 878 finished with value: 0.5934847728521232 and parameters: {'n_estimators': 180, 'max_depth': 6, 'learning_rate': 0.09555174994877202, 'gamma': 4.439252510072495, 'min_child_weight': 8, 'subsample': 0.8683403499598539, 'colsample_bytree': 0.5641351312375852, 'reg_alpha': 0.6322186129743385, 'reg_lambda': 0.7803975646295412}. Best is trial 829 with value: 0.5942795917588232.
[I 2024-11-06 22:29:40,090] Trial 879 finished with value: 0.592841433949341 and parameters: {'n_estimators': 165, 'max_depth': 7, 'learning_rate': 0.07238185779943611, 'gamma': 1.8468146779915824, 'min_child_weight': 8, 'subsample': 0.9038752020643018, 'colsample_bytree': 0.5739551206501519, 'reg_alpha': 0.543020334476699, 'reg_lambda': 0.7715158253312234}. Best is trial 829 with value: 0.5942795917588232.
[I 2024-11-06 22:29:43,747] Trial 880 finished with value: 0.5928761380542186 and parameters: {'n_estimators': 165, 'max_depth': 7, 'learning_rate': 0.0646429202299214, 'gamma': 4.73201769477882, 'min_child_weight': 9, 'subsample': 0.8854584455247493, 'colsample_bytree': 0.6833777442379191, 'reg_alpha': 0.5908287276309058, 'reg_lambda': 0.8290225406259976}. Best is trial 829 with value: 0.5942795917588232.
[I 2024-11-06 22:29:47,817] Trial 881 finished with value: 0.5929257618106453 and parameters: {'n_estimators': 205, 'max_depth': 7, 'learning_rate': 0.10942292623903997, 'gamma': 3.4755322162514255, 'min_child_weight': 7, 'subsample': 0.8443814493891189, 'colsample_bytree': 0.5943997958633873, 'reg_alpha': 0.5135690462876028, 'reg_lambda': 0.8048603688432779}. Best is trial 829 with value: 0.5942795917588232.
[I 2024-11-06 22:29:52,671] Trial 882 finished with value: 0.5920841970613087 and parameters: {'n_estimators': 168, 'max_depth': 7, 'learning_rate': 0.077306274842874, 'gamma': 1.509842666270953, 'min_child_weight': 10, 'subsample': 0.856766255011889, 'colsample_bytree': 0.5864562171173188, 'reg_alpha': 0.6119827314844446, 'reg_lambda': 0.7728031227259956}. Best is trial 829 with value: 0.5942795917588232.
[I 2024-11-06 22:29:56,463] Trial 883 finished with value: 0.5934216798141081 and parameters: {'n_estimators': 191, 'max_depth': 7, 'learning_rate': 0.07031902311996721, 'gamma': 4.614343191040732, 'min_child_weight': 7, 'subsample': 0.8720916304357382, 'colsample_bytree': 0.5606866015438138, 'reg_alpha': 0.7895187279545365, 'reg_lambda': 0.8186103383927279}. Best is trial 829 with value: 0.5942795917588232.
[I 2024-11-06 22:30:00,316] Trial 884 finished with value: 0.5934254653937434 and parameters: {'n_estimators': 163, 'max_depth': 7, 'learning_rate': 0.0659558158101165, 'gamma': 4.353971395262194, 'min_child_weight': 8, 'subsample': 0.8633870132125403, 'colsample_bytree': 0.5725177878324312, 'reg_alpha': 0.6409239708741256, 'reg_lambda': 0.7926886038768317}. Best is trial 829 with value: 0.5942795917588232.
[I 2024-11-06 22:30:04,496] Trial 885 finished with value: 0.5920386906196408 and parameters: {'n_estimators': 174, 'max_depth': 7, 'learning_rate': 0.08651313908238281, 'gamma': 4.641844310004792, 'min_child_weight': 7, 'subsample': 0.8900777265266612, 'colsample_bytree': 0.5834422077931516, 'reg_alpha': 0.7761674404143244, 'reg_lambda': 0.7691421120665279}. Best is trial 829 with value: 0.5942795917588232.
[I 2024-11-06 22:30:08,951] Trial 886 finished with value: 0.5935638088485881 and parameters: {'n_estimators': 179, 'max_depth': 7, 'learning_rate': 0.07562286074161874, 'gamma': 3.1316332830053426, 'min_child_weight': 7, 'subsample': 0.8767757275665515, 'colsample_bytree': 0.5524257246123073, 'reg_alpha': 0.5648753472623635, 'reg_lambda': 0.8001714887992931}. Best is trial 829 with value: 0.5942795917588232.
[I 2024-11-06 22:30:12,818] Trial 887 finished with value: 0.5933445289022742 and parameters: {'n_estimators': 171, 'max_depth': 7, 'learning_rate': 0.06450758146229096, 'gamma': 4.861079061946252, 'min_child_weight': 7, 'subsample': 0.8597490746526838, 'colsample_bytree': 0.5936465856237717, 'reg_alpha': 0.5910045787946737, 'reg_lambda': 0.769089946994551}. Best is trial 829 with value: 0.5942795917588232.
[I 2024-11-06 22:30:15,964] Trial 888 finished with value: 0.5922669747055826 and parameters: {'n_estimators': 160, 'max_depth': 5, 'learning_rate': 0.06711077032612747, 'gamma': 4.412877259510872, 'min_child_weight': 9, 'subsample': 0.9122651263719066, 'colsample_bytree': 0.5718384512987092, 'reg_alpha': 0.6406863264829601, 'reg_lambda': 0.8399191085191173}. Best is trial 829 with value: 0.5942795917588232.
[I 2024-11-06 22:30:19,451] Trial 889 finished with value: 0.593646603209922 and parameters: {'n_estimators': 163, 'max_depth': 6, 'learning_rate': 0.1497201068085009, 'gamma': 4.9927268787546275, 'min_child_weight': 7, 'subsample': 0.8364903785981284, 'colsample_bytree': 0.5599488616201771, 'reg_alpha': 0.6195032028028131, 'reg_lambda': 0.7798485458005763}. Best is trial 829 with value: 0.5942795917588232.
[I 2024-11-06 22:30:23,588] Trial 890 finished with value: 0.5933414437741888 and parameters: {'n_estimators': 181, 'max_depth': 7, 'learning_rate': 0.07312944912879112, 'gamma': 4.29242655747246, 'min_child_weight': 8, 'subsample': 0.8742936947886574, 'colsample_bytree': 0.5795735302637043, 'reg_alpha': 0.6495907363807811, 'reg_lambda': 0.8274344472089612}. Best is trial 829 with value: 0.5942795917588232.
[I 2024-11-06 22:30:27,499] Trial 891 finished with value: 0.593182898056317 and parameters: {'n_estimators': 176, 'max_depth': 7, 'learning_rate': 0.06496126892518274, 'gamma': 3.47932713711828, 'min_child_weight': 7, 'subsample': 0.8969038079800036, 'colsample_bytree': 0.5383593055394713, 'reg_alpha': 0.7564270944120156, 'reg_lambda': 0.7607292702307009}. Best is trial 829 with value: 0.5942795917588232.
[I 2024-11-06 22:30:31,868] Trial 892 finished with value: 0.5926456815029997 and parameters: {'n_estimators': 164, 'max_depth': 7, 'learning_rate': 0.07073608987278228, 'gamma': 2.7189688752143826, 'min_child_weight': 7, 'subsample': 0.8832933601405847, 'colsample_bytree': 0.597951268930041, 'reg_alpha': 0.6094792506768186, 'reg_lambda': 0.7997918796996432}. Best is trial 829 with value: 0.5942795917588232.
[I 2024-11-06 22:30:35,779] Trial 893 finished with value: 0.5929574639543916 and parameters: {'n_estimators': 170, 'max_depth': 7, 'learning_rate': 0.06460276719347005, 'gamma': 4.5144824158032035, 'min_child_weight': 7, 'subsample': 0.8475614247030778, 'colsample_bytree': 0.5150640813085213, 'reg_alpha': 0.5652568487014704, 'reg_lambda': 0.7822084490141411}. Best is trial 829 with value: 0.5942795917588232.
[I 2024-11-06 22:30:39,518] Trial 894 finished with value: 0.5941101239380286 and parameters: {'n_estimators': 160, 'max_depth': 7, 'learning_rate': 0.0789570921983561, 'gamma': 4.77739259909213, 'min_child_weight': 7, 'subsample': 0.8672102890617699, 'colsample_bytree': 0.5865066325813448, 'reg_alpha': 0.5341634585298386, 'reg_lambda': 0.8134776598641209}. Best is trial 829 with value: 0.5942795917588232.
