[I 2024-11-06 22:23:17,000] Trial 789 finished with value: 0.5932258561809155 and parameters: {'n_estimators': 137, 'max_depth': 7, 'learning_rate': 0.05814302657853143, 'gamma': 3.7281724012071558, 'min_child_weight': 5, 'subsample': 0.9051691297681563, 'colsample_bytree': 0.7730939719275359, 'reg_alpha': 0.7168398759791675, 'reg_lambda': 0.7068093859956714}. Best is trial 625 with value: 0.5940826637391339.
[I 2024-11-06 22:23:21,263] Trial 790 finished with value: 0.5937025143806027 and parameters: {'n_estimators': 150, 'max_depth': 7, 'learning_rate': 0.046152060910027284, 'gamma': 3.82314692601885, 'min_child_weight': 7, 'subsample': 0.8782803044908007, 'colsample_bytree': 0.5764567024134946, 'reg_alpha': 0.5867225106097991, 'reg_lambda': 0.7454307316916335}. Best is trial 625 with value: 0.5940826637391339.
[I 2024-11-06 22:23:25,575] Trial 791 finished with value: 0.592374879892952 and parameters: {'n_estimators': 127, 'max_depth': 10, 'learning_rate': 0.05349898551567763, 'gamma': 3.4262379303692136, 'min_child_weight': 7, 'subsample': 0.8419952041457802, 'colsample_bytree': 0.6086451405405283, 'reg_alpha': 0.7825587565794532, 'reg_lambda': 0.6677049540774328}. Best is trial 625 with value: 0.5940826637391339.
[I 2024-11-06 22:23:29,388] Trial 792 finished with value: 0.592591740644537 and parameters: {'n_estimators': 134, 'max_depth': 7, 'learning_rate': 0.06205952511211041, 'gamma': 3.6325729627025987, 'min_child_weight': 6, 'subsample': 0.8531550582753146, 'colsample_bytree': 0.5955583072786591, 'reg_alpha': 0.6665115221571268, 'reg_lambda': 0.6922621846557262}. Best is trial 625 with value: 0.5940826637391339.
[I 2024-11-06 22:23:32,656] Trial 793 finished with value: 0.5928313211554049 and parameters: {'n_estimators': 143, 'max_depth': 5, 'learning_rate': 0.09862257036325511, 'gamma': 3.9938438263336717, 'min_child_weight': 7, 'subsample': 0.8670247784809574, 'colsample_bytree': 0.5442623218841336, 'reg_alpha': 0.6928070203363119, 'reg_lambda': 0.7254002566222068}. Best is trial 625 with value: 0.5940826637391339.
[I 2024-11-06 22:23:35,438] Trial 794 finished with value: 0.5921352473211012 and parameters: {'n_estimators': 161, 'max_depth': 7, 'learning_rate': 0.19353147263993054, 'gamma': 4.12507293067531, 'min_child_weight': 7, 'subsample': 0.8869879064291537, 'colsample_bytree': 0.5821247228112659, 'reg_alpha': 0.6385375795572432, 'reg_lambda': 0.7772133096543781}. Best is trial 625 with value: 0.5940826637391339.
[I 2024-11-06 22:23:40,008] Trial 795 finished with value: 0.5930550829021441 and parameters: {'n_estimators': 154, 'max_depth': 8, 'learning_rate': 0.0375789093786109, 'gamma': 4.279507843088884, 'min_child_weight': 5, 'subsample': 0.8277915492074318, 'colsample_bytree': 0.5693456696641145, 'reg_alpha': 0.7018659793129457, 'reg_lambda': 0.7135924444777606}. Best is trial 625 with value: 0.5940826637391339.
[I 2024-11-06 22:23:45,355] Trial 796 finished with value: 0.5929039301720165 and parameters: {'n_estimators': 139, 'max_depth': 7, 'learning_rate': 0.016357368317568222, 'gamma': 4.452615012871517, 'min_child_weight': 7, 'subsample': 0.8711905088703547, 'colsample_bytree': 0.6138742012159017, 'reg_alpha': 0.7308984736906262, 'reg_lambda': 0.7566897896751478}. Best is trial 625 with value: 0.5940826637391339.
[I 2024-11-06 22:23:49,213] Trial 797 finished with value: 0.5933703678001832 and parameters: {'n_estimators': 149, 'max_depth': 6, 'learning_rate': 0.049846926976319456, 'gamma': 3.5519220279525836, 'min_child_weight': 6, 'subsample': 0.89580531503826, 'colsample_bytree': 0.5589417706449575, 'reg_alpha': 0.6200578738371354, 'reg_lambda': 0.6681768999018355}. Best is trial 625 with value: 0.5940826637391339.
[I 2024-11-06 22:23:53,320] Trial 798 finished with value: 0.593115369080221 and parameters: {'n_estimators': 132, 'max_depth': 7, 'learning_rate': 0.044461211939495676, 'gamma': 3.8649233584582525, 'min_child_weight': 7, 'subsample': 0.856243667393179, 'colsample_bytree': 0.5882419122083724, 'reg_alpha': 0.758136910169098, 'reg_lambda': 0.14239063309958933}. Best is trial 625 with value: 0.5940826637391339.
[I 2024-11-06 22:23:56,775] Trial 799 finished with value: 0.5937327435214911 and parameters: {'n_estimators': 145, 'max_depth': 7, 'learning_rate': 0.0691151667989625, 'gamma': 4.074957062554981, 'min_child_weight': 8, 'subsample': 0.8803818938038619, 'colsample_bytree': 0.5990776110929956, 'reg_alpha': 0.6530577328385152, 'reg_lambda': 0.7984322077126368}. Best is trial 625 with value: 0.5940826637391339.
[I 2024-11-06 22:24:00,777] Trial 800 finished with value: 0.5926066189535011 and parameters: {'n_estimators': 139, 'max_depth': 9, 'learning_rate': 0.0567860933732247, 'gamma': 4.384344100805059, 'min_child_weight': 7, 'subsample': 0.8717366292649342, 'colsample_bytree': 0.6929129415702426, 'reg_alpha': 0.6819976127717821, 'reg_lambda': 0.6911273960202908}. Best is trial 625 with value: 0.5940826637391339.
[I 2024-11-06 22:24:07,497] Trial 801 finished with value: 0.5924419327206378 and parameters: {'n_estimators': 211, 'max_depth': 7, 'learning_rate': 0.03040182946438689, 'gamma': 3.7186830210567625, 'min_child_weight': 6, 'subsample': 0.8478990932387866, 'colsample_bytree': 0.5782041231778678, 'reg_alpha': 0.7210132025980734, 'reg_lambda': 0.729955184620641}. Best is trial 625 with value: 0.5940826637391339.
[I 2024-11-06 22:24:11,602] Trial 802 finished with value: 0.5936548521627357 and parameters: {'n_estimators': 167, 'max_depth': 7, 'learning_rate': 0.05011224141514536, 'gamma': 4.143686520450214, 'min_child_weight': 7, 'subsample': 0.8612210668280806, 'colsample_bytree': 0.6226762534511181, 'reg_alpha': 0.7062872399712999, 'reg_lambda': 0.7470022500051028}. Best is trial 625 with value: 0.5940826637391339.
[I 2024-11-06 22:24:16,221] Trial 803 finished with value: 0.5934123133969245 and parameters: {'n_estimators': 156, 'max_depth': 8, 'learning_rate': 0.04114785273322969, 'gamma': 4.283434592546381, 'min_child_weight': 5, 'subsample': 0.884550262040979, 'colsample_bytree': 0.5689132887380782, 'reg_alpha': 0.7408542905633787, 'reg_lambda': 0.7134450656258886}. Best is trial 625 with value: 0.5940826637391339.
[I 2024-11-06 22:24:20,016] Trial 804 finished with value: 0.5931814533420171 and parameters: {'n_estimators': 149, 'max_depth': 7, 'learning_rate': 0.06154536838676878, 'gamma': 3.9119082815620523, 'min_child_weight': 7, 'subsample': 0.8757234505639762, 'colsample_bytree': 0.936994811000547, 'reg_alpha': 0.6018287011987057, 'reg_lambda': 0.25956581357075165}. Best is trial 625 with value: 0.5940826637391339.
[I 2024-11-06 22:24:24,443] Trial 805 finished with value: 0.5929047689334548 and parameters: {'n_estimators': 126, 'max_depth': 6, 'learning_rate': 0.02453606468362369, 'gamma': 3.9966658247750457, 'min_child_weight': 6, 'subsample': 0.89697560299692, 'colsample_bytree': 0.5473678441375326, 'reg_alpha': 0.670956332681915, 'reg_lambda': 0.7715285934733976}. Best is trial 625 with value: 0.5940826637391339.
[I 2024-11-06 22:24:49,042] Trial 806 finished with value: 0.5937347323197163 and parameters: {'n_estimators': 141, 'max_depth': 7, 'learning_rate': 0.05447320688021779, 'gamma': 3.8019028367308443, 'min_child_weight': 7, 'subsample': 0.8366390489645545, 'colsample_bytree': 0.5586710780557177, 'reg_alpha': 0.6415735636103954, 'reg_lambda': 0.8259511226980225}. Best is trial 625 with value: 0.5940826637391339.
[I 2024-11-06 22:24:52,795] Trial 807 finished with value: 0.5934987738808808 and parameters: {'n_estimators': 134, 'max_depth': 7, 'learning_rate': 0.044937996009276227, 'gamma': 4.207558576096196, 'min_child_weight': 5, 'subsample': 0.8673993972122545, 'colsample_bytree': 0.5995161162282854, 'reg_alpha': 0.6864962146318959, 'reg_lambda': 0.6862877876234045}. Best is trial 625 with value: 0.5940826637391339.
[I 2024-11-06 22:24:57,314] Trial 808 finished with value: 0.5929073960855489 and parameters: {'n_estimators': 154, 'max_depth': 7, 'learning_rate': 0.03488638399093868, 'gamma': 3.6672582213985883, 'min_child_weight': 7, 'subsample': 0.8525196953042525, 'colsample_bytree': 0.587044182027391, 'reg_alpha': 0.7092168700196979, 'reg_lambda': 0.7352785849162896}. Best is trial 625 with value: 0.5940826637391339.
[I 2024-11-06 22:25:00,409] Trial 809 finished with value: 0.5925154693852217 and parameters: {'n_estimators': 145, 'max_depth': 3, 'learning_rate': 0.06341463514959313, 'gamma': 3.533687702306004, 'min_child_weight': 7, 'subsample': 0.9056320449257819, 'colsample_bytree': 0.8075071092046623, 'reg_alpha': 0.7532673294369943, 'reg_lambda': 0.703634413657205}. Best is trial 625 with value: 0.5940826637391339.
[I 2024-11-06 22:25:05,349] Trial 810 finished with value: 0.5936156441180277 and parameters: {'n_estimators': 130, 'max_depth': 7, 'learning_rate': 0.048750880792593695, 'gamma': 4.410337424851098, 'min_child_weight': 6, 'subsample': 0.8865787162358295, 'colsample_bytree': 0.5762067890172778, 'reg_alpha': 0.657731203776068, 'reg_lambda': 0.6753163843338662}. Best is trial 625 with value: 0.5940826637391339.
[I 2024-11-06 22:25:09,983] Trial 811 finished with value: 0.5932450328282194 and parameters: {'n_estimators': 160, 'max_depth': 7, 'learning_rate': 0.05658624916898956, 'gamma': 3.36738280894069, 'min_child_weight': 7, 'subsample': 0.8633798205370007, 'colsample_bytree': 0.6081684412965943, 'reg_alpha': 0.7925479540377625, 'reg_lambda': 0.7879362775529014}. Best is trial 625 with value: 0.5940826637391339.
[I 2024-11-06 22:25:14,025] Trial 812 finished with value: 0.593398469070887 and parameters: {'n_estimators': 137, 'max_depth': 7, 'learning_rate': 0.04000321461742888, 'gamma': 3.9217287827775693, 'min_child_weight': 8, 'subsample': 0.8766313638854139, 'colsample_bytree': 0.5914795024970589, 'reg_alpha': 0.6231587617241389, 'reg_lambda': 0.659143174040351}. Best is trial 625 with value: 0.5940826637391339.
[I 2024-11-06 22:25:18,384] Trial 813 finished with value: 0.5936430660303291 and parameters: {'n_estimators': 149, 'max_depth': 7, 'learning_rate': 0.04930277255104152, 'gamma': 4.049068778549859, 'min_child_weight': 7, 'subsample': 0.8432469018081832, 'colsample_bytree': 0.5661196757673799, 'reg_alpha': 0.729072752406171, 'reg_lambda': 0.7559706022614672}. Best is trial 625 with value: 0.5940826637391339.
[I 2024-11-06 22:25:22,195] Trial 814 finished with value: 0.5928783531711256 and parameters: {'n_estimators': 123, 'max_depth': 8, 'learning_rate': 0.06971051018701692, 'gamma': 3.5983392528651237, 'min_child_weight': 6, 'subsample': 0.8907510718988088, 'colsample_bytree': 0.5533091504284978, 'reg_alpha': 0.5751095145154264, 'reg_lambda': 0.7058998104186247}. Best is trial 625 with value: 0.5940826637391339.
[I 2024-11-06 22:25:26,110] Trial 815 finished with value: 0.5935962306786731 and parameters: {'n_estimators': 142, 'max_depth': 7, 'learning_rate': 0.05672114048981279, 'gamma': 3.7472639336706197, 'min_child_weight': 5, 'subsample': 0.8608980896804823, 'colsample_bytree': 0.5824706301477247, 'reg_alpha': 0.6909736770883372, 'reg_lambda': 0.7283366828928834}. Best is trial 625 with value: 0.5940826637391339.
[I 2024-11-06 22:25:30,298] Trial 816 finished with value: 0.593294165056397 and parameters: {'n_estimators': 152, 'max_depth': 6, 'learning_rate': 0.04395895875946777, 'gamma': 4.281739621209046, 'min_child_weight': 7, 'subsample': 0.8757615836212324, 'colsample_bytree': 0.60057376034479, 'reg_alpha': 0.7665399256545823, 'reg_lambda': 0.7643631089219987}. Best is trial 625 with value: 0.5940826637391339.
[I 2024-11-06 22:25:33,398] Trial 817 finished with value: 0.5925014621905913 and parameters: {'n_estimators': 145, 'max_depth': 7, 'learning_rate': 0.13034554875080634, 'gamma': 4.1753833609649895, 'min_child_weight': 7, 'subsample': 0.8548770326021146, 'colsample_bytree': 0.5417524980932951, 'reg_alpha': 0.6583313665296149, 'reg_lambda': 0.7410222498691352}. Best is trial 625 with value: 0.5940826637391339.
[I 2024-11-06 22:25:38,211] Trial 818 finished with value: 0.5934808967054053 and parameters: {'n_estimators': 132, 'max_depth': 7, 'learning_rate': 0.03140287389096698, 'gamma': 3.454050048191444, 'min_child_weight': 6, 'subsample': 0.8836065109749134, 'colsample_bytree': 0.5729064183768379, 'reg_alpha': 0.7070897108033866, 'reg_lambda': 0.686521859407734}. Best is trial 625 with value: 0.5940826637391339.
[I 2024-11-06 22:25:43,745] Trial 819 finished with value: 0.5933422275769156 and parameters: {'n_estimators': 286, 'max_depth': 7, 'learning_rate': 0.050428634535406865, 'gamma': 4.51834210595523, 'min_child_weight': 5, 'subsample': 0.8698722085561305, 'colsample_bytree': 0.6151923136947611, 'reg_alpha': 0.6789946647199879, 'reg_lambda': 0.7158908277078013}. Best is trial 625 with value: 0.5940826637391339.
[I 2024-11-06 22:25:47,460] Trial 820 finished with value: 0.5923665077887539 and parameters: {'n_estimators': 138, 'max_depth': 8, 'learning_rate': 0.06391694299377247, 'gamma': 3.858100396388773, 'min_child_weight': 7, 'subsample': 0.5430396169521162, 'colsample_bytree': 0.5881821354535791, 'reg_alpha': 0.7363179302924142, 'reg_lambda': 0.6549323942851859}. Best is trial 625 with value: 0.5940826637391339.
[I 2024-11-06 22:25:52,092] Trial 821 finished with value: 0.5931771898908726 and parameters: {'n_estimators': 163, 'max_depth': 7, 'learning_rate': 0.03727278703987577, 'gamma': 4.369060367460488, 'min_child_weight': 7, 'subsample': 0.8960258477200111, 'colsample_bytree': 0.5623660841189158, 'reg_alpha': 0.5949006606741853, 'reg_lambda': 0.29506381391586733}. Best is trial 625 with value: 0.5940826637391339.
[I 2024-11-06 22:25:56,571] Trial 822 finished with value: 0.5940329680973149 and parameters: {'n_estimators': 157, 'max_depth': 7, 'learning_rate': 0.04417082503847238, 'gamma': 3.9757558632082683, 'min_child_weight': 7, 'subsample': 0.8667370753925107, 'colsample_bytree': 0.5745861237735034, 'reg_alpha': 0.6312521803265193, 'reg_lambda': 0.8073807025630507}. Best is trial 625 with value: 0.5940826637391339.
[I 2024-11-06 22:26:01,795] Trial 823 finished with value: 0.5933623013946452 and parameters: {'n_estimators': 158, 'max_depth': 7, 'learning_rate': 0.029136719140572278, 'gamma': 3.7719703841006957, 'min_child_weight': 7, 'subsample': 0.8803534890253574, 'colsample_bytree': 0.5681153064990684, 'reg_alpha': 0.628648096407442, 'reg_lambda': 0.8342966843259607}. Best is trial 625 with value: 0.5940826637391339.
[I 2024-11-06 22:26:07,587] Trial 824 finished with value: 0.5930375702290558 and parameters: {'n_estimators': 165, 'max_depth': 7, 'learning_rate': 0.03955951280844751, 'gamma': 3.6640839625195536, 'min_child_weight': 7, 'subsample': 0.9072054454367845, 'colsample_bytree': 0.555831070301706, 'reg_alpha': 0.611306414885443, 'reg_lambda': 0.8098515665889426}. Best is trial 625 with value: 0.5940826637391339.
[I 2024-11-06 22:26:12,521] Trial 825 finished with value: 0.5924192784246711 and parameters: {'n_estimators': 157, 'max_depth': 7, 'learning_rate': 0.034442753600151886, 'gamma': 3.934534472627907, 'min_child_weight': 7, 'subsample': 0.76555522476877, 'colsample_bytree': 0.5745479330511635, 'reg_alpha': 0.6102426886504099, 'reg_lambda': 0.8124676038182219}. Best is trial 625 with value: 0.5940826637391339.
[I 2024-11-06 22:26:17,220] Trial 826 finished with value: 0.5933035472389498 and parameters: {'n_estimators': 162, 'max_depth': 7, 'learning_rate': 0.044748892925611114, 'gamma': 3.8207658330603, 'min_child_weight': 8, 'subsample': 0.8668565488975899, 'colsample_bytree': 0.5621473444202519, 'reg_alpha': 0.5594895366051169, 'reg_lambda': 0.8131768360032023}. Best is trial 625 with value: 0.5940826637391339.
[I 2024-11-06 22:26:23,055] Trial 827 finished with value: 0.5926685189600679 and parameters: {'n_estimators': 166, 'max_depth': 7, 'learning_rate': 0.01016475958483476, 'gamma': 3.569296351772077, 'min_child_weight': 7, 'subsample': 0.8893621150718768, 'colsample_bytree': 0.5765526102311503, 'reg_alpha': 0.5964122727522361, 'reg_lambda': 0.8244461600413495}. Best is trial 625 with value: 0.5940826637391339.
[I 2024-11-06 22:26:28,379] Trial 828 finished with value: 0.5927673472131929 and parameters: {'n_estimators': 155, 'max_depth': 7, 'learning_rate': 0.02139609719650211, 'gamma': 3.9808321579418107, 'min_child_weight': 7, 'subsample': 0.848882757687334, 'colsample_bytree': 0.549766731999586, 'reg_alpha': 0.637868970253713, 'reg_lambda': 0.8337572762993077}. Best is trial 625 with value: 0.5940826637391339.
[I 2024-11-06 22:26:31,719] Trial 829 finished with value: 0.5942795917588232 and parameters: {'n_estimators': 169, 'max_depth': 7, 'learning_rate': 0.11258568752848912, 'gamma': 4.1447872078166945, 'min_child_weight': 7, 'subsample': 0.8765743503930746, 'colsample_bytree': 0.5817261556507062, 'reg_alpha': 0.6438782161671979, 'reg_lambda': 0.7945033961518354}. Best is trial 829 with value: 0.5942795917588232.
[I 2024-11-06 22:26:34,934] Trial 830 finished with value: 0.593171571983818 and parameters: {'n_estimators': 164, 'max_depth': 7, 'learning_rate': 0.13571786870681884, 'gamma': 3.690251786738066, 'min_child_weight': 7, 'subsample': 0.859414667899977, 'colsample_bytree': 0.5679872863503033, 'reg_alpha': 0.6262062784662112, 'reg_lambda': 0.8594326124231767}. Best is trial 829 with value: 0.5942795917588232.
[I 2024-11-06 22:26:38,260] Trial 831 finished with value: 0.593879146655812 and parameters: {'n_estimators': 166, 'max_depth': 7, 'learning_rate': 0.07526175583235446, 'gamma': 4.575715357610888, 'min_child_weight': 7, 'subsample': 0.8702214101968581, 'colsample_bytree': 0.5751174282283325, 'reg_alpha': 0.5822637330056172, 'reg_lambda': 0.8052783946328377}. Best is trial 829 with value: 0.5942795917588232.
[I 2024-11-06 22:26:41,927] Trial 832 finished with value: 0.5925124397711501 and parameters: {'n_estimators': 166, 'max_depth': 7, 'learning_rate': 0.08096150520387484, 'gamma': 4.5476457682229, 'min_child_weight': 7, 'subsample': 0.8752049123104005, 'colsample_bytree': 0.5808283779424682, 'reg_alpha': 0.5881018045579706, 'reg_lambda': 0.83921844743126}. Best is trial 829 with value: 0.5942795917588232.
[I 2024-11-06 22:26:45,696] Trial 833 finished with value: 0.5930381879029281 and parameters: {'n_estimators': 170, 'max_depth': 7, 'learning_rate': 0.08344838212390197, 'gamma': 4.545264301435006, 'min_child_weight': 7, 'subsample': 0.8711734896905847, 'colsample_bytree': 0.5740510036059189, 'reg_alpha': 0.5798588798803893, 'reg_lambda': 0.8129658151347497}. Best is trial 829 with value: 0.5942795917588232.
[I 2024-11-06 22:26:49,404] Trial 834 finished with value: 0.5934674886095006 and parameters: {'n_estimators': 174, 'max_depth': 7, 'learning_rate': 0.07559373511303791, 'gamma': 4.61397302011068, 'min_child_weight': 7, 'subsample': 0.8826742780112692, 'colsample_bytree': 0.5811054796470395, 'reg_alpha': 0.5973746228946072, 'reg_lambda': 0.8390664714513756}. Best is trial 829 with value: 0.5942795917588232.
[I 2024-11-06 22:26:53,035] Trial 835 finished with value: 0.5938934595682461 and parameters: {'n_estimators': 173, 'max_depth': 7, 'learning_rate': 0.07185308366930707, 'gamma': 4.4296857979479975, 'min_child_weight': 8, 'subsample': 0.8667489748440782, 'colsample_bytree': 0.5867794207999657, 'reg_alpha': 0.570394293648422, 'reg_lambda': 0.8011353691869451}. Best is trial 829 with value: 0.5942795917588232.
[I 2024-11-06 22:26:56,053] Trial 836 finished with value: 0.5920531092117965 and parameters: {'n_estimators': 173, 'max_depth': 7, 'learning_rate': 0.11227393829111572, 'gamma': 4.460289646611249, 'min_child_weight': 8, 'subsample': 0.8945661466760616, 'colsample_bytree': 0.5746841958382165, 'reg_alpha': 0.5937126196955245, 'reg_lambda': 0.8415881821171205}. Best is trial 829 with value: 0.5942795917588232.
[I 2024-11-06 22:26:59,615] Trial 837 finished with value: 0.5930846099729293 and parameters: {'n_estimators': 174, 'max_depth': 7, 'learning_rate': 0.094018972799607, 'gamma': 4.613072422592962, 'min_child_weight': 8, 'subsample': 0.8766854590094558, 'colsample_bytree': 0.5848364696469109, 'reg_alpha': 0.545584679998982, 'reg_lambda': 0.8176619510945534}. Best is trial 829 with value: 0.5942795917588232.
[I 2024-11-06 22:27:03,448] Trial 838 finished with value: 0.5921327700564383 and parameters: {'n_estimators': 182, 'max_depth': 7, 'learning_rate': 0.08806329972436455, 'gamma': 4.481122266016198, 'min_child_weight': 8, 'subsample': 0.8878219086324379, 'colsample_bytree': 0.5616953404385112, 'reg_alpha': 0.5700657914801575, 'reg_lambda': 0.8514777614304869}. Best is trial 829 with value: 0.5942795917588232.
[I 2024-11-06 22:27:07,753] Trial 839 finished with value: 0.5936714150658827 and parameters: {'n_estimators': 169, 'max_depth': 7, 'learning_rate': 0.07891889464926999, 'gamma': 4.4335611684897716, 'min_child_weight': 8, 'subsample': 0.8699550361266405, 'colsample_bytree': 0.5722977277678368, 'reg_alpha': 0.5270115143693659, 'reg_lambda': 0.8028163992269561}. Best is trial 829 with value: 0.5942795917588232.
[I 2024-11-06 22:27:11,089] Trial 840 finished with value: 0.5926786171564731 and parameters: {'n_estimators': 170, 'max_depth': 7, 'learning_rate': 0.10093609021866436, 'gamma': 4.567983110971547, 'min_child_weight': 8, 'subsample': 0.878213543943254, 'colsample_bytree': 0.5797234784472559, 'reg_alpha': 0.5478189367699406, 'reg_lambda': 0.8186245135928651}. Best is trial 829 with value: 0.5942795917588232.
[I 2024-11-06 22:27:14,868] Trial 841 finished with value: 0.5927820309858916 and parameters: {'n_estimators': 182, 'max_depth': 7, 'learning_rate': 0.0775057393314781, 'gamma': 4.3672215054301216, 'min_child_weight': 8, 'subsample': 0.8978646739704322, 'colsample_bytree': 0.5553541754100209, 'reg_alpha': 0.570485794598599, 'reg_lambda': 0.8226968109898037}. Best is trial 829 with value: 0.5942795917588232.
