[I 2024-11-06 22:19:16,501] Trial 736 finished with value: 0.5929114728820692 and parameters: {'n_estimators': 136, 'max_depth': 7, 'learning_rate': 0.0507965040058211, 'gamma': 2.848141690074683, 'min_child_weight': 5, 'subsample': 0.8635978764112441, 'colsample_bytree': 0.5781213583626879, 'reg_alpha': 0.720603405148968, 'reg_lambda': 0.7889547174920897}. Best is trial 625 with value: 0.5940826637391339.
[I 2024-11-06 22:19:20,901] Trial 737 finished with value: 0.5933490915021278 and parameters: {'n_estimators': 143, 'max_depth': 7, 'learning_rate': 0.03966297787991841, 'gamma': 3.7889058502025867, 'min_child_weight': 5, 'subsample': 0.8802273748486535, 'colsample_bytree': 0.5632697298960044, 'reg_alpha': 0.6344270860051604, 'reg_lambda': 0.7361583363957286}. Best is trial 625 with value: 0.5940826637391339.
[I 2024-11-06 22:19:27,122] Trial 738 finished with value: 0.5931026697734827 and parameters: {'n_estimators': 150, 'max_depth': 7, 'learning_rate': 0.022258436634223788, 'gamma': 3.4388710876314694, 'min_child_weight': 5, 'subsample': 0.8968484512494669, 'colsample_bytree': 0.5979823556928163, 'reg_alpha': 0.7108385529358512, 'reg_lambda': 0.757846550191347}. Best is trial 625 with value: 0.5940826637391339.
[I 2024-11-06 22:19:30,933] Trial 739 finished with value: 0.5933163669390963 and parameters: {'n_estimators': 144, 'max_depth': 7, 'learning_rate': 0.0571481515231317, 'gamma': 3.6155175242768967, 'min_child_weight': 6, 'subsample': 0.8541744184752781, 'colsample_bytree': 0.5514195706432716, 'reg_alpha': 0.6160376352040372, 'reg_lambda': 0.7707756794585243}. Best is trial 625 with value: 0.5940826637391339.
[I 2024-11-06 22:19:35,383] Trial 740 finished with value: 0.5927685451884581 and parameters: {'n_estimators': 133, 'max_depth': 8, 'learning_rate': 0.04710374273358372, 'gamma': 3.717578782544853, 'min_child_weight': 5, 'subsample': 0.8710368630559884, 'colsample_bytree': 0.5729927979910876, 'reg_alpha': 0.735393476637368, 'reg_lambda': 0.6896907058048987}. Best is trial 625 with value: 0.5940826637391339.
[I 2024-11-06 22:19:39,632] Trial 741 finished with value: 0.5926068545142349 and parameters: {'n_estimators': 138, 'max_depth': 5, 'learning_rate': 0.03232200009230618, 'gamma': 3.5758075334825836, 'min_child_weight': 6, 'subsample': 0.886201070043086, 'colsample_bytree': 0.6083029700684288, 'reg_alpha': 0.6981410224280356, 'reg_lambda': 0.7159169482401492}. Best is trial 625 with value: 0.5940826637391339.
[I 2024-11-06 22:19:44,442] Trial 742 finished with value: 0.5922325102398015 and parameters: {'n_estimators': 158, 'max_depth': 10, 'learning_rate': 0.05107066508155374, 'gamma': 3.816592044134778, 'min_child_weight': 5, 'subsample': 0.8336539520399384, 'colsample_bytree': 0.5929603765802482, 'reg_alpha': 0.5829031175101999, 'reg_lambda': 0.8184589790808552}. Best is trial 625 with value: 0.5940826637391339.
[I 2024-11-06 22:19:49,279] Trial 743 finished with value: 0.5931847617294848 and parameters: {'n_estimators': 153, 'max_depth': 7, 'learning_rate': 0.04122280738103899, 'gamma': 3.6560125350087453, 'min_child_weight': 6, 'subsample': 0.8639964572874442, 'colsample_bytree': 0.5800219395344416, 'reg_alpha': 0.6444695020463658, 'reg_lambda': 0.7425715900794655}. Best is trial 625 with value: 0.5940826637391339.
[I 2024-11-06 22:19:53,151] Trial 744 finished with value: 0.5936340839672007 and parameters: {'n_estimators': 146, 'max_depth': 7, 'learning_rate': 0.05809295679675188, 'gamma': 3.835985277342777, 'min_child_weight': 6, 'subsample': 0.8769999438558791, 'colsample_bytree': 0.5631707460081908, 'reg_alpha': 0.6753597577807795, 'reg_lambda': 0.6978357381070827}. Best is trial 625 with value: 0.5940826637391339.
[I 2024-11-06 22:19:57,437] Trial 745 finished with value: 0.5927516060768786 and parameters: {'n_estimators': 140, 'max_depth': 6, 'learning_rate': 0.04624034404893214, 'gamma': 3.7201206798114184, 'min_child_weight': 5, 'subsample': 0.8489214410825399, 'colsample_bytree': 0.6215354621522658, 'reg_alpha': 0.7438281995474937, 'reg_lambda': 0.724471159865955}. Best is trial 625 with value: 0.5940826637391339.
[I 2024-11-06 22:20:01,922] Trial 746 finished with value: 0.5932842606601472 and parameters: {'n_estimators': 163, 'max_depth': 7, 'learning_rate': 0.05216415285710309, 'gamma': 3.483157294718109, 'min_child_weight': 6, 'subsample': 0.8996264576640493, 'colsample_bytree': 0.6023405744584194, 'reg_alpha': 0.7668394551012868, 'reg_lambda': 0.7897736570529934}. Best is trial 625 with value: 0.5940826637391339.
[I 2024-11-06 22:20:06,521] Trial 747 finished with value: 0.5933895249188936 and parameters: {'n_estimators': 132, 'max_depth': 7, 'learning_rate': 0.059846055415702745, 'gamma': 3.831424145435192, 'min_child_weight': 5, 'subsample': 0.8601733155809358, 'colsample_bytree': 0.5889124712615091, 'reg_alpha': 0.7141333799651016, 'reg_lambda': 0.7646104772357931}. Best is trial 625 with value: 0.5940826637391339.
[I 2024-11-06 22:20:11,553] Trial 748 finished with value: 0.5931735652158154 and parameters: {'n_estimators': 150, 'max_depth': 7, 'learning_rate': 0.035786855983277556, 'gamma': 3.7314387071496276, 'min_child_weight': 6, 'subsample': 0.8869392419842682, 'colsample_bytree': 0.5484974311276749, 'reg_alpha': 0.6940863922642753, 'reg_lambda': 0.7390494967297049}. Best is trial 625 with value: 0.5940826637391339.
[I 2024-11-06 22:20:17,738] Trial 749 finished with value: 0.5916728421373053 and parameters: {'n_estimators': 143, 'max_depth': 9, 'learning_rate': 0.042293553431210065, 'gamma': 2.3515344466713017, 'min_child_weight': 5, 'subsample': 0.872706353582118, 'colsample_bytree': 0.5710484379819252, 'reg_alpha': 0.6620675601361148, 'reg_lambda': 0.7079680041284786}. Best is trial 625 with value: 0.5940826637391339.
[I 2024-11-06 22:20:22,302] Trial 750 finished with value: 0.5931992819880711 and parameters: {'n_estimators': 155, 'max_depth': 7, 'learning_rate': 0.05316121550499525, 'gamma': 3.881757873050104, 'min_child_weight': 6, 'subsample': 0.8431710180129717, 'colsample_bytree': 0.57928226277197, 'reg_alpha': 0.6025183872631229, 'reg_lambda': 0.6867505383816696}. Best is trial 625 with value: 0.5940826637391339.
[I 2024-11-06 22:20:27,641] Trial 751 finished with value: 0.5922649353696434 and parameters: {'n_estimators': 137, 'max_depth': 8, 'learning_rate': 0.0290332518619327, 'gamma': 3.5554495914014312, 'min_child_weight': 6, 'subsample': 0.8000705053477878, 'colsample_bytree': 0.5585517882468267, 'reg_alpha': 0.6326553770953385, 'reg_lambda': 0.7252024566124292}. Best is trial 625 with value: 0.5940826637391339.
[I 2024-11-06 22:20:32,240] Trial 752 finished with value: 0.5925892162490329 and parameters: {'n_estimators': 147, 'max_depth': 7, 'learning_rate': 0.0474153240512791, 'gamma': 3.6102449071340166, 'min_child_weight': 5, 'subsample': 0.7408863013060637, 'colsample_bytree': 0.6116010025357177, 'reg_alpha': 0.730394849271935, 'reg_lambda': 0.7524269621947847}. Best is trial 625 with value: 0.5940826637391339.
[I 2024-11-06 22:20:36,647] Trial 753 finished with value: 0.5926523452997841 and parameters: {'n_estimators': 132, 'max_depth': 7, 'learning_rate': 0.06106999703846471, 'gamma': 3.285707985285632, 'min_child_weight': 6, 'subsample': 0.8803454718572036, 'colsample_bytree': 0.5922057478061433, 'reg_alpha': 0.6873502161121392, 'reg_lambda': 0.6831683900487178}. Best is trial 625 with value: 0.5940826637391339.
[I 2024-11-06 22:20:39,318] Trial 754 finished with value: 0.5922926963422208 and parameters: {'n_estimators': 141, 'max_depth': 7, 'learning_rate': 0.17749869047535305, 'gamma': 3.8974250000586497, 'min_child_weight': 7, 'subsample': 0.8673022989561872, 'colsample_bytree': 0.5677133638767025, 'reg_alpha': 0.7174426191507635, 'reg_lambda': 0.7074519316241876}. Best is trial 625 with value: 0.5940826637391339.
[I 2024-11-06 22:20:43,852] Trial 755 finished with value: 0.5926596073800744 and parameters: {'n_estimators': 150, 'max_depth': 7, 'learning_rate': 0.03720534686330761, 'gamma': 3.7552704228573353, 'min_child_weight': 6, 'subsample': 0.8572408177075117, 'colsample_bytree': 0.6033300571650027, 'reg_alpha': 0.7633191638246244, 'reg_lambda': 0.7792367084543453}. Best is trial 625 with value: 0.5940826637391339.
[I 2024-11-06 22:20:47,997] Trial 756 finished with value: 0.5931958098864147 and parameters: {'n_estimators': 155, 'max_depth': 7, 'learning_rate': 0.05421785950010295, 'gamma': 3.4214444161106594, 'min_child_weight': 8, 'subsample': 0.8923769923015312, 'colsample_bytree': 0.581652666541941, 'reg_alpha': 0.6511543664838455, 'reg_lambda': 0.7216547218312448}. Best is trial 625 with value: 0.5940826637391339.
[I 2024-11-06 22:20:52,195] Trial 757 finished with value: 0.5927108126385237 and parameters: {'n_estimators': 137, 'max_depth': 8, 'learning_rate': 0.04456936173827532, 'gamma': 3.684845181451012, 'min_child_weight': 7, 'subsample': 0.8238499468871637, 'colsample_bytree': 0.5926387395857001, 'reg_alpha': 0.6673828757474751, 'reg_lambda': 0.7395386121162318}. Best is trial 625 with value: 0.5940826637391339.
[I 2024-11-06 22:20:56,606] Trial 758 finished with value: 0.5926318020664292 and parameters: {'n_estimators': 162, 'max_depth': 6, 'learning_rate': 0.04889608092269348, 'gamma': 3.9394678864815624, 'min_child_weight': 5, 'subsample': 0.7773654954304879, 'colsample_bytree': 0.5500255704761536, 'reg_alpha': 0.6240954508411359, 'reg_lambda': 0.6976920593844206}. Best is trial 625 with value: 0.5940826637391339.
[I 2024-11-06 22:21:00,122] Trial 759 finished with value: 0.5934709965382835 and parameters: {'n_estimators': 146, 'max_depth': 7, 'learning_rate': 0.059473151341974936, 'gamma': 3.808627307195271, 'min_child_weight': 7, 'subsample': 0.8749419628971824, 'colsample_bytree': 0.6380911997282238, 'reg_alpha': 0.6989602345442262, 'reg_lambda': 0.7678860554316916}. Best is trial 625 with value: 0.5940826637391339.
[I 2024-11-06 22:21:04,893] Trial 760 finished with value: 0.5931127925559401 and parameters: {'n_estimators': 129, 'max_depth': 4, 'learning_rate': 0.04050770359575293, 'gamma': 3.642691669048208, 'min_child_weight': 7, 'subsample': 0.850219630942155, 'colsample_bytree': 0.575688698687013, 'reg_alpha': 0.7462169409998989, 'reg_lambda': 0.6801581501883384}. Best is trial 625 with value: 0.5940826637391339.
[I 2024-11-06 22:21:10,461] Trial 761 finished with value: 0.5924689286677187 and parameters: {'n_estimators': 142, 'max_depth': 7, 'learning_rate': 0.022994044303392726, 'gamma': 3.5180907587189303, 'min_child_weight': 6, 'subsample': 0.8650485571470485, 'colsample_bytree': 0.5595720033986604, 'reg_alpha': 0.6777741683625961, 'reg_lambda': 0.743249264557771}. Best is trial 625 with value: 0.5940826637391339.
[I 2024-11-06 22:21:14,333] Trial 762 finished with value: 0.5935705433440244 and parameters: {'n_estimators': 152, 'max_depth': 7, 'learning_rate': 0.0536368073161881, 'gamma': 3.9699877612954166, 'min_child_weight': 7, 'subsample': 0.8907613939124781, 'colsample_bytree': 0.5865903068484707, 'reg_alpha': 0.7223959326658501, 'reg_lambda': 0.8126088238491226}. Best is trial 625 with value: 0.5940826637391339.
[I 2024-11-06 22:21:19,150] Trial 763 finished with value: 0.5927900712066303 and parameters: {'n_estimators': 135, 'max_depth': 7, 'learning_rate': 0.03494399162362988, 'gamma': 3.0246452391265093, 'min_child_weight': 5, 'subsample': 0.882073409982222, 'colsample_bytree': 0.598993867367635, 'reg_alpha': 0.6055816183449354, 'reg_lambda': 0.7187422209932924}. Best is trial 625 with value: 0.5940826637391339.
[I 2024-11-06 22:21:23,420] Trial 764 finished with value: 0.5936067025294951 and parameters: {'n_estimators': 145, 'max_depth': 7, 'learning_rate': 0.04610937575916981, 'gamma': 3.766265915433544, 'min_child_weight': 7, 'subsample': 0.8393658890462603, 'colsample_bytree': 0.5667660739887523, 'reg_alpha': 0.7015696296086315, 'reg_lambda': 0.7973100677956428}. Best is trial 625 with value: 0.5940826637391339.
[I 2024-11-06 22:21:27,672] Trial 765 finished with value: 0.5928200516999691 and parameters: {'n_estimators': 157, 'max_depth': 8, 'learning_rate': 0.060949442810956767, 'gamma': 3.568016127698451, 'min_child_weight': 7, 'subsample': 0.8567232703138317, 'colsample_bytree': 0.7226222006638487, 'reg_alpha': 0.7816236587841505, 'reg_lambda': 0.7581957545026848}. Best is trial 625 with value: 0.5940826637391339.
[I 2024-11-06 22:21:31,405] Trial 766 finished with value: 0.5930864727854531 and parameters: {'n_estimators': 139, 'max_depth': 7, 'learning_rate': 0.05284966124636614, 'gamma': 3.8909057106346125, 'min_child_weight': 6, 'subsample': 0.9013323163151321, 'colsample_bytree': 0.6135570623093202, 'reg_alpha': 0.6499280009214035, 'reg_lambda': 0.7033968833735215}. Best is trial 625 with value: 0.5940826637391339.
[I 2024-11-06 22:21:35,742] Trial 767 finished with value: 0.5937337021318323 and parameters: {'n_estimators': 150, 'max_depth': 7, 'learning_rate': 0.04232175797772061, 'gamma': 4.058606999525324, 'min_child_weight': 8, 'subsample': 0.8727662988677103, 'colsample_bytree': 0.5771889704502954, 'reg_alpha': 0.5759999403455005, 'reg_lambda': 0.726910158372515}. Best is trial 625 with value: 0.5940826637391339.
[I 2024-11-06 22:21:40,476] Trial 768 finished with value: 0.5926273731241423 and parameters: {'n_estimators': 130, 'max_depth': 7, 'learning_rate': 0.03044625389607451, 'gamma': 3.4497717360766393, 'min_child_weight': 7, 'subsample': 0.8629032650914771, 'colsample_bytree': 0.6543537068578743, 'reg_alpha': 0.7482037400756368, 'reg_lambda': 0.6824894264603188}. Best is trial 625 with value: 0.5940826637391339.
[I 2024-11-06 22:21:44,784] Trial 769 finished with value: 0.5934454696843339 and parameters: {'n_estimators': 147, 'max_depth': 7, 'learning_rate': 0.05110429557301861, 'gamma': 3.215767204287482, 'min_child_weight': 7, 'subsample': 0.8838221803697236, 'colsample_bytree': 0.5894489943669746, 'reg_alpha': 0.6813770669764901, 'reg_lambda': 0.7823769574394933}. Best is trial 625 with value: 0.5940826637391339.
[I 2024-11-06 22:21:49,579] Trial 770 finished with value: 0.5924418662152037 and parameters: {'n_estimators': 140, 'max_depth': 6, 'learning_rate': 0.018316941181229566, 'gamma': 3.9972275120955882, 'min_child_weight': 5, 'subsample': 0.8712936971759798, 'colsample_bytree': 0.549798034828733, 'reg_alpha': 0.6288377477796958, 'reg_lambda': 0.47415337094341836}. Best is trial 625 with value: 0.5940826637391339.
[I 2024-11-06 22:21:53,390] Trial 771 finished with value: 0.5933575626392242 and parameters: {'n_estimators': 134, 'max_depth': 7, 'learning_rate': 0.057561064374644325, 'gamma': 3.7535286283583322, 'min_child_weight': 6, 'subsample': 0.8491071497009836, 'colsample_bytree': 0.5996746729359076, 'reg_alpha': 0.7301373233952071, 'reg_lambda': 0.7386467440717037}. Best is trial 625 with value: 0.5940826637391339.
[I 2024-11-06 22:21:58,364] Trial 772 finished with value: 0.5930700572849645 and parameters: {'n_estimators': 158, 'max_depth': 7, 'learning_rate': 0.04785097735282938, 'gamma': 3.8688401586666283, 'min_child_weight': 7, 'subsample': 0.8925416907837999, 'colsample_bytree': 0.5651559364453361, 'reg_alpha': 0.7131636565781073, 'reg_lambda': 0.7078099779611886}. Best is trial 625 with value: 0.5940826637391339.
[I 2024-11-06 22:22:03,235] Trial 773 finished with value: 0.5935643726182022 and parameters: {'n_estimators': 143, 'max_depth': 8, 'learning_rate': 0.06309233322987176, 'gamma': 3.6443069210616574, 'min_child_weight': 7, 'subsample': 0.8793723989849312, 'colsample_bytree': 0.5814322021524083, 'reg_alpha': 0.6622290251981472, 'reg_lambda': 0.763691340807098}. Best is trial 625 with value: 0.5940826637391339.
[I 2024-11-06 22:22:08,427] Trial 774 finished with value: 0.5932961018525261 and parameters: {'n_estimators': 153, 'max_depth': 7, 'learning_rate': 0.03884144069591598, 'gamma': 4.19462761387194, 'min_child_weight': 6, 'subsample': 0.8638592457792582, 'colsample_bytree': 0.572243901612982, 'reg_alpha': 0.6880988357668927, 'reg_lambda': 0.6788801761223253}. Best is trial 625 with value: 0.5940826637391339.
[I 2024-11-06 22:22:13,388] Trial 775 finished with value: 0.592961304491784 and parameters: {'n_estimators': 223, 'max_depth': 7, 'learning_rate': 0.055595605931355714, 'gamma': 3.3354798208628758, 'min_child_weight': 7, 'subsample': 0.8344417147019251, 'colsample_bytree': 0.6197602173461311, 'reg_alpha': 0.6408443463120816, 'reg_lambda': 0.7357708774380962}. Best is trial 625 with value: 0.5940826637391339.
[I 2024-11-06 22:22:17,902] Trial 776 finished with value: 0.5927770209744467 and parameters: {'n_estimators': 164, 'max_depth': 7, 'learning_rate': 0.042745254583635775, 'gamma': 4.0716882591075185, 'min_child_weight': 8, 'subsample': 0.8548938726509844, 'colsample_bytree': 0.5561973695409858, 'reg_alpha': 0.7026112420616503, 'reg_lambda': 0.7003061721372345}. Best is trial 625 with value: 0.5940826637391339.
[I 2024-11-06 22:22:23,689] Trial 777 finished with value: 0.5931604770914889 and parameters: {'n_estimators': 239, 'max_depth': 6, 'learning_rate': 0.03465379037613386, 'gamma': 3.9631512913552083, 'min_child_weight': 5, 'subsample': 0.8766811421628681, 'colsample_bytree': 0.6037691796357039, 'reg_alpha': 0.7671516401062379, 'reg_lambda': 0.7543826579280751}. Best is trial 625 with value: 0.5940826637391339.
[I 2024-11-06 22:22:26,300] Trial 778 finished with value: 0.5916158784000857 and parameters: {'n_estimators': 147, 'max_depth': 8, 'learning_rate': 0.22660252162469854, 'gamma': 3.599252694423703, 'min_child_weight': 7, 'subsample': 0.8885221529263732, 'colsample_bytree': 0.5915496841907805, 'reg_alpha': 0.7406088998705684, 'reg_lambda': 0.7222246092017401}. Best is trial 625 with value: 0.5940826637391339.
[I 2024-11-06 22:22:30,484] Trial 779 finished with value: 0.5937591104041682 and parameters: {'n_estimators': 137, 'max_depth': 7, 'learning_rate': 0.04961724496271167, 'gamma': 3.8100655621260042, 'min_child_weight': 7, 'subsample': 0.8673512578602023, 'colsample_bytree': 0.5832506964056141, 'reg_alpha': 0.6713466656469741, 'reg_lambda': 0.8411278479698026}. Best is trial 625 with value: 0.5940826637391339.
[I 2024-11-06 22:22:34,094] Trial 780 finished with value: 0.5930624401192368 and parameters: {'n_estimators': 129, 'max_depth': 7, 'learning_rate': 0.061235344652956804, 'gamma': 4.218289855578647, 'min_child_weight': 6, 'subsample': 0.59511883986639, 'colsample_bytree': 0.5677413752303091, 'reg_alpha': 0.5520225221321637, 'reg_lambda': 0.6804076383740674}. Best is trial 625 with value: 0.5940826637391339.
[I 2024-11-06 22:22:38,407] Trial 781 finished with value: 0.5928969879156181 and parameters: {'n_estimators': 142, 'max_depth': 7, 'learning_rate': 0.05507101470920952, 'gamma': 3.7025126898877105, 'min_child_weight': 7, 'subsample': 0.8455355368179402, 'colsample_bytree': 0.5477660052736316, 'reg_alpha': 0.7194175473506788, 'reg_lambda': 0.7801590682052341}. Best is trial 625 with value: 0.5940826637391339.
[I 2024-11-06 22:22:43,630] Trial 782 finished with value: 0.59239635067914 and parameters: {'n_estimators': 151, 'max_depth': 9, 'learning_rate': 0.04305940864176934, 'gamma': 3.50281996952777, 'min_child_weight': 5, 'subsample': 0.8998285200373533, 'colsample_bytree': 0.6066402083560176, 'reg_alpha': 0.6064222161691459, 'reg_lambda': 0.8024926506984775}. Best is trial 625 with value: 0.5940826637391339.
[I 2024-11-06 22:22:48,452] Trial 783 finished with value: 0.593170692203599 and parameters: {'n_estimators': 134, 'max_depth': 7, 'learning_rate': 0.025162764869079757, 'gamma': 4.1301751710815, 'min_child_weight': 7, 'subsample': 0.8808535532126874, 'colsample_bytree': 0.5754280821476809, 'reg_alpha': 0.6950093911426024, 'reg_lambda': 0.7161836767367687}. Best is trial 625 with value: 0.5940826637391339.
[I 2024-11-06 22:22:52,683] Trial 784 finished with value: 0.5932644698643228 and parameters: {'n_estimators': 147, 'max_depth': 7, 'learning_rate': 0.04664932489666289, 'gamma': 3.920878851794421, 'min_child_weight': 6, 'subsample': 0.8575215607713788, 'colsample_bytree': 0.630200011521933, 'reg_alpha': 0.6528297654710061, 'reg_lambda': 0.6689422391702058}. Best is trial 625 with value: 0.5940826637391339.
[I 2024-11-06 22:22:56,767] Trial 785 finished with value: 0.5935596628131133 and parameters: {'n_estimators': 159, 'max_depth': 7, 'learning_rate': 0.0666723225461406, 'gamma': 4.040902097320441, 'min_child_weight': 7, 'subsample': 0.8710999748470355, 'colsample_bytree': 0.5944707021481022, 'reg_alpha': 0.7558942795341566, 'reg_lambda': 0.7464899880284288}. Best is trial 625 with value: 0.5940826637391339.
[I 2024-11-06 22:23:02,139] Trial 786 finished with value: 0.5918302095994015 and parameters: {'n_estimators': 141, 'max_depth': 8, 'learning_rate': 0.051587604702726754, 'gamma': 1.9713484939083137, 'min_child_weight': 7, 'subsample': 0.8142620240180277, 'colsample_bytree': 0.5863197736267248, 'reg_alpha': 0.6788185281220671, 'reg_lambda': 0.6959652115929907}. Best is trial 625 with value: 0.5940826637391339.
[I 2024-11-06 22:23:08,791] Trial 787 finished with value: 0.5926153295841016 and parameters: {'n_estimators': 154, 'max_depth': 7, 'learning_rate': 0.03202068554281755, 'gamma': 2.4755597897817303, 'min_child_weight': 7, 'subsample': 0.8907167368134871, 'colsample_bytree': 0.5565535563565764, 'reg_alpha': 0.6257133718590571, 'reg_lambda': 0.7653338180713376}. Best is trial 625 with value: 0.5940826637391339.
[I 2024-11-06 22:23:12,863] Trial 788 finished with value: 0.5930940597612951 and parameters: {'n_estimators': 145, 'max_depth': 7, 'learning_rate': 0.03880497254756595, 'gamma': 4.2323802712178695, 'min_child_weight': 6, 'subsample': 0.8626969467314989, 'colsample_bytree': 0.5641416541444186, 'reg_alpha': 0.7344104192019032, 'reg_lambda': 0.7316988349638823}. Best is trial 625 with value: 0.5940826637391339.
