[I 2024-11-07 01:42:06,653] Trial 99 finished with value: 0.5911277066370391 and parameters: {'iterations': 951, 'learning_rate': 0.2801308079476859, 'depth': 6, 'l2_leaf_reg': 7.529348766443235}. Best is trial 56 with value: 0.5955351412315192.
/anaconda/envs/py38_default/lib/python3.9/site-packages/catboost/core.py:1102: FutureWarning: iteritems is deprecated and will be removed in a future version. Use .items instead.
  self._init_pool(data, label, cat_features, text_features, embedding_features, pairs, weight, group_id, group_weight, subgroup_id, pairs_weight, baseline, feature_names, thread_count)
/anaconda/envs/py38_default/lib/python3.9/site-packages/catboost/core.py:1102: FutureWarning: iteritems is deprecated and will be removed in a future version. Use .items instead.
  self._init_pool(data, label, cat_features, text_features, embedding_features, pairs, weight, group_id, group_weight, subgroup_id, pairs_weight, baseline, feature_names, thread_count)
/anaconda/envs/py38_default/lib/python3.9/site-packages/catboost/core.py:1102: FutureWarning: iteritems is deprecated and will be removed in a future version. Use .items instead.
  self._init_pool(data, label, cat_features, text_features, embedding_features, pairs, weight, group_id, group_weight, subgroup_id, pairs_weight, baseline, feature_names, thread_count)
/anaconda/envs/py38_default/lib/python3.9/site-packages/catboost/core.py:1102: FutureWarning: iteritems is deprecated and will be removed in a future version. Use .items instead.
  self._init_pool(data, label, cat_features, text_features, embedding_features, pairs, weight, group_id, group_weight, subgroup_id, pairs_weight, baseline, feature_names, thread_count)
/anaconda/envs/py38_default/lib/python3.9/site-packages/catboost/core.py:1102: FutureWarning: iteritems is deprecated and will be removed in a future version. Use .items instead.
  self._init_pool(data, label, cat_features, text_features, embedding_features, pairs, weight, group_id, group_weight, subgroup_id, pairs_weight, baseline, feature_names, thread_count)
[I 2024-11-07 01:43:33,238] Trial 100 finished with value: 0.5925568494537168 and parameters: {'iterations': 791, 'learning_rate': 0.16219417328620553, 'depth': 4, 'l2_leaf_reg': 2.2385193609777203}. Best is trial 56 with value: 0.5955351412315192.
/anaconda/envs/py38_default/lib/python3.9/site-packages/catboost/core.py:1102: FutureWarning: iteritems is deprecated and will be removed in a future version. Use .items instead.
  self._init_pool(data, label, cat_features, text_features, embedding_features, pairs, weight, group_id, group_weight, subgroup_id, pairs_weight, baseline, feature_names, thread_count)
/anaconda/envs/py38_default/lib/python3.9/site-packages/catboost/core.py:1102: FutureWarning: iteritems is deprecated and will be removed in a future version. Use .items instead.
  self._init_pool(data, label, cat_features, text_features, embedding_features, pairs, weight, group_id, group_weight, subgroup_id, pairs_weight, baseline, feature_names, thread_count)
/anaconda/envs/py38_default/lib/python3.9/site-packages/catboost/core.py:1102: FutureWarning: iteritems is deprecated and will be removed in a future version. Use .items instead.
  self._init_pool(data, label, cat_features, text_features, embedding_features, pairs, weight, group_id, group_weight, subgroup_id, pairs_weight, baseline, feature_names, thread_count)
/anaconda/envs/py38_default/lib/python3.9/site-packages/catboost/core.py:1102: FutureWarning: iteritems is deprecated and will be removed in a future version. Use .items instead.
  self._init_pool(data, label, cat_features, text_features, embedding_features, pairs, weight, group_id, group_weight, subgroup_id, pairs_weight, baseline, feature_names, thread_count)
/anaconda/envs/py38_default/lib/python3.9/site-packages/catboost/core.py:1102: FutureWarning: iteritems is deprecated and will be removed in a future version. Use .items instead.
  self._init_pool(data, label, cat_features, text_features, embedding_features, pairs, weight, group_id, group_weight, subgroup_id, pairs_weight, baseline, feature_names, thread_count)
[I 2024-11-07 01:45:21,424] Trial 101 finished with value: 0.5920137930802295 and parameters: {'iterations': 859, 'learning_rate': 0.014649464136723328, 'depth': 5, 'l2_leaf_reg': 4.8292963017539305}. Best is trial 56 with value: 0.5955351412315192.
/anaconda/envs/py38_default/lib/python3.9/site-packages/catboost/core.py:1102: FutureWarning: iteritems is deprecated and will be removed in a future version. Use .items instead.
  self._init_pool(data, label, cat_features, text_features, embedding_features, pairs, weight, group_id, group_weight, subgroup_id, pairs_weight, baseline, feature_names, thread_count)
/anaconda/envs/py38_default/lib/python3.9/site-packages/catboost/core.py:1102: FutureWarning: iteritems is deprecated and will be removed in a future version. Use .items instead.
  self._init_pool(data, label, cat_features, text_features, embedding_features, pairs, weight, group_id, group_weight, subgroup_id, pairs_weight, baseline, feature_names, thread_count)
/anaconda/envs/py38_default/lib/python3.9/site-packages/catboost/core.py:1102: FutureWarning: iteritems is deprecated and will be removed in a future version. Use .items instead.
  self._init_pool(data, label, cat_features, text_features, embedding_features, pairs, weight, group_id, group_weight, subgroup_id, pairs_weight, baseline, feature_names, thread_count)
/anaconda/envs/py38_default/lib/python3.9/site-packages/catboost/core.py:1102: FutureWarning: iteritems is deprecated and will be removed in a future version. Use .items instead.
  self._init_pool(data, label, cat_features, text_features, embedding_features, pairs, weight, group_id, group_weight, subgroup_id, pairs_weight, baseline, feature_names, thread_count)
/anaconda/envs/py38_default/lib/python3.9/site-packages/catboost/core.py:1102: FutureWarning: iteritems is deprecated and will be removed in a future version. Use .items instead.
  self._init_pool(data, label, cat_features, text_features, embedding_features, pairs, weight, group_id, group_weight, subgroup_id, pairs_weight, baseline, feature_names, thread_count)
[I 2024-11-07 01:47:08,027] Trial 102 finished with value: 0.5939405079175955 and parameters: {'iterations': 842, 'learning_rate': 0.2280539135857163, 'depth': 5, 'l2_leaf_reg': 5.904651267410695}. Best is trial 56 with value: 0.5955351412315192.
/anaconda/envs/py38_default/lib/python3.9/site-packages/catboost/core.py:1102: FutureWarning: iteritems is deprecated and will be removed in a future version. Use .items instead.
  self._init_pool(data, label, cat_features, text_features, embedding_features, pairs, weight, group_id, group_weight, subgroup_id, pairs_weight, baseline, feature_names, thread_count)
/anaconda/envs/py38_default/lib/python3.9/site-packages/catboost/core.py:1102: FutureWarning: iteritems is deprecated and will be removed in a future version. Use .items instead.
  self._init_pool(data, label, cat_features, text_features, embedding_features, pairs, weight, group_id, group_weight, subgroup_id, pairs_weight, baseline, feature_names, thread_count)
/anaconda/envs/py38_default/lib/python3.9/site-packages/catboost/core.py:1102: FutureWarning: iteritems is deprecated and will be removed in a future version. Use .items instead.
  self._init_pool(data, label, cat_features, text_features, embedding_features, pairs, weight, group_id, group_weight, subgroup_id, pairs_weight, baseline, feature_names, thread_count)
/anaconda/envs/py38_default/lib/python3.9/site-packages/catboost/core.py:1102: FutureWarning: iteritems is deprecated and will be removed in a future version. Use .items instead.
  self._init_pool(data, label, cat_features, text_features, embedding_features, pairs, weight, group_id, group_weight, subgroup_id, pairs_weight, baseline, feature_names, thread_count)
/anaconda/envs/py38_default/lib/python3.9/site-packages/catboost/core.py:1102: FutureWarning: iteritems is deprecated and will be removed in a future version. Use .items instead.
  self._init_pool(data, label, cat_features, text_features, embedding_features, pairs, weight, group_id, group_weight, subgroup_id, pairs_weight, baseline, feature_names, thread_count)
[I 2024-11-07 01:48:10,223] Trial 103 finished with value: 0.5945261318600508 and parameters: {'iterations': 475, 'learning_rate': 0.23965882832645474, 'depth': 5, 'l2_leaf_reg': 5.44399637651188}. Best is trial 56 with value: 0.5955351412315192.
/anaconda/envs/py38_default/lib/python3.9/site-packages/catboost/core.py:1102: FutureWarning: iteritems is deprecated and will be removed in a future version. Use .items instead.
  self._init_pool(data, label, cat_features, text_features, embedding_features, pairs, weight, group_id, group_weight, subgroup_id, pairs_weight, baseline, feature_names, thread_count)
/anaconda/envs/py38_default/lib/python3.9/site-packages/catboost/core.py:1102: FutureWarning: iteritems is deprecated and will be removed in a future version. Use .items instead.
  self._init_pool(data, label, cat_features, text_features, embedding_features, pairs, weight, group_id, group_weight, subgroup_id, pairs_weight, baseline, feature_names, thread_count)
/anaconda/envs/py38_default/lib/python3.9/site-packages/catboost/core.py:1102: FutureWarning: iteritems is deprecated and will be removed in a future version. Use .items instead.
  self._init_pool(data, label, cat_features, text_features, embedding_features, pairs, weight, group_id, group_weight, subgroup_id, pairs_weight, baseline, feature_names, thread_count)
/anaconda/envs/py38_default/lib/python3.9/site-packages/catboost/core.py:1102: FutureWarning: iteritems is deprecated and will be removed in a future version. Use .items instead.
  self._init_pool(data, label, cat_features, text_features, embedding_features, pairs, weight, group_id, group_weight, subgroup_id, pairs_weight, baseline, feature_names, thread_count)
/anaconda/envs/py38_default/lib/python3.9/site-packages/catboost/core.py:1102: FutureWarning: iteritems is deprecated and will be removed in a future version. Use .items instead.
  self._init_pool(data, label, cat_features, text_features, embedding_features, pairs, weight, group_id, group_weight, subgroup_id, pairs_weight, baseline, feature_names, thread_count)
[I 2024-11-07 01:50:08,973] Trial 104 finished with value: 0.5935462536146873 and parameters: {'iterations': 931, 'learning_rate': 0.20964941088052508, 'depth': 5, 'l2_leaf_reg': 1.220053356867696}. Best is trial 56 with value: 0.5955351412315192.
/anaconda/envs/py38_default/lib/python3.9/site-packages/catboost/core.py:1102: FutureWarning: iteritems is deprecated and will be removed in a future version. Use .items instead.
  self._init_pool(data, label, cat_features, text_features, embedding_features, pairs, weight, group_id, group_weight, subgroup_id, pairs_weight, baseline, feature_names, thread_count)
/anaconda/envs/py38_default/lib/python3.9/site-packages/catboost/core.py:1102: FutureWarning: iteritems is deprecated and will be removed in a future version. Use .items instead.
  self._init_pool(data, label, cat_features, text_features, embedding_features, pairs, weight, group_id, group_weight, subgroup_id, pairs_weight, baseline, feature_names, thread_count)
/anaconda/envs/py38_default/lib/python3.9/site-packages/catboost/core.py:1102: FutureWarning: iteritems is deprecated and will be removed in a future version. Use .items instead.
  self._init_pool(data, label, cat_features, text_features, embedding_features, pairs, weight, group_id, group_weight, subgroup_id, pairs_weight, baseline, feature_names, thread_count)
/anaconda/envs/py38_default/lib/python3.9/site-packages/catboost/core.py:1102: FutureWarning: iteritems is deprecated and will be removed in a future version. Use .items instead.
  self._init_pool(data, label, cat_features, text_features, embedding_features, pairs, weight, group_id, group_weight, subgroup_id, pairs_weight, baseline, feature_names, thread_count)
/anaconda/envs/py38_default/lib/python3.9/site-packages/catboost/core.py:1102: FutureWarning: iteritems is deprecated and will be removed in a future version. Use .items instead.
  self._init_pool(data, label, cat_features, text_features, embedding_features, pairs, weight, group_id, group_weight, subgroup_id, pairs_weight, baseline, feature_names, thread_count)
[I 2024-11-07 01:51:20,191] Trial 105 finished with value: 0.5945444006356955 and parameters: {'iterations': 559, 'learning_rate': 0.2166270523434481, 'depth': 5, 'l2_leaf_reg': 5.708132758064151}. Best is trial 56 with value: 0.5955351412315192.
/anaconda/envs/py38_default/lib/python3.9/site-packages/catboost/core.py:1102: FutureWarning: iteritems is deprecated and will be removed in a future version. Use .items instead.
  self._init_pool(data, label, cat_features, text_features, embedding_features, pairs, weight, group_id, group_weight, subgroup_id, pairs_weight, baseline, feature_names, thread_count)
/anaconda/envs/py38_default/lib/python3.9/site-packages/catboost/core.py:1102: FutureWarning: iteritems is deprecated and will be removed in a future version. Use .items instead.
  self._init_pool(data, label, cat_features, text_features, embedding_features, pairs, weight, group_id, group_weight, subgroup_id, pairs_weight, baseline, feature_names, thread_count)
/anaconda/envs/py38_default/lib/python3.9/site-packages/catboost/core.py:1102: FutureWarning: iteritems is deprecated and will be removed in a future version. Use .items instead.
  self._init_pool(data, label, cat_features, text_features, embedding_features, pairs, weight, group_id, group_weight, subgroup_id, pairs_weight, baseline, feature_names, thread_count)
/anaconda/envs/py38_default/lib/python3.9/site-packages/catboost/core.py:1102: FutureWarning: iteritems is deprecated and will be removed in a future version. Use .items instead.
  self._init_pool(data, label, cat_features, text_features, embedding_features, pairs, weight, group_id, group_weight, subgroup_id, pairs_weight, baseline, feature_names, thread_count)
/anaconda/envs/py38_default/lib/python3.9/site-packages/catboost/core.py:1102: FutureWarning: iteritems is deprecated and will be removed in a future version. Use .items instead.
  self._init_pool(data, label, cat_features, text_features, embedding_features, pairs, weight, group_id, group_weight, subgroup_id, pairs_weight, baseline, feature_names, thread_count)
[I 2024-11-07 01:53:00,302] Trial 106 finished with value: 0.59448946370331 and parameters: {'iterations': 774, 'learning_rate': 0.2005223363647584, 'depth': 5, 'l2_leaf_reg': 4.695190166158794}. Best is trial 56 with value: 0.5955351412315192.
/anaconda/envs/py38_default/lib/python3.9/site-packages/catboost/core.py:1102: FutureWarning: iteritems is deprecated and will be removed in a future version. Use .items instead.
  self._init_pool(data, label, cat_features, text_features, embedding_features, pairs, weight, group_id, group_weight, subgroup_id, pairs_weight, baseline, feature_names, thread_count)
/anaconda/envs/py38_default/lib/python3.9/site-packages/catboost/core.py:1102: FutureWarning: iteritems is deprecated and will be removed in a future version. Use .items instead.
  self._init_pool(data, label, cat_features, text_features, embedding_features, pairs, weight, group_id, group_weight, subgroup_id, pairs_weight, baseline, feature_names, thread_count)
/anaconda/envs/py38_default/lib/python3.9/site-packages/catboost/core.py:1102: FutureWarning: iteritems is deprecated and will be removed in a future version. Use .items instead.
  self._init_pool(data, label, cat_features, text_features, embedding_features, pairs, weight, group_id, group_weight, subgroup_id, pairs_weight, baseline, feature_names, thread_count)
/anaconda/envs/py38_default/lib/python3.9/site-packages/catboost/core.py:1102: FutureWarning: iteritems is deprecated and will be removed in a future version. Use .items instead.
  self._init_pool(data, label, cat_features, text_features, embedding_features, pairs, weight, group_id, group_weight, subgroup_id, pairs_weight, baseline, feature_names, thread_count)
/anaconda/envs/py38_default/lib/python3.9/site-packages/catboost/core.py:1102: FutureWarning: iteritems is deprecated and will be removed in a future version. Use .items instead.
  self._init_pool(data, label, cat_features, text_features, embedding_features, pairs, weight, group_id, group_weight, subgroup_id, pairs_weight, baseline, feature_names, thread_count)
[I 2024-11-07 01:54:53,087] Trial 107 finished with value: 0.5939358959333502 and parameters: {'iterations': 891, 'learning_rate': 0.2225659621592927, 'depth': 5, 'l2_leaf_reg': 5.2408208138302514}. Best is trial 56 with value: 0.5955351412315192.
/anaconda/envs/py38_default/lib/python3.9/site-packages/catboost/core.py:1102: FutureWarning: iteritems is deprecated and will be removed in a future version. Use .items instead.
  self._init_pool(data, label, cat_features, text_features, embedding_features, pairs, weight, group_id, group_weight, subgroup_id, pairs_weight, baseline, feature_names, thread_count)
/anaconda/envs/py38_default/lib/python3.9/site-packages/catboost/core.py:1102: FutureWarning: iteritems is deprecated and will be removed in a future version. Use .items instead.
  self._init_pool(data, label, cat_features, text_features, embedding_features, pairs, weight, group_id, group_weight, subgroup_id, pairs_weight, baseline, feature_names, thread_count)
/anaconda/envs/py38_default/lib/python3.9/site-packages/catboost/core.py:1102: FutureWarning: iteritems is deprecated and will be removed in a future version. Use .items instead.
  self._init_pool(data, label, cat_features, text_features, embedding_features, pairs, weight, group_id, group_weight, subgroup_id, pairs_weight, baseline, feature_names, thread_count)
/anaconda/envs/py38_default/lib/python3.9/site-packages/catboost/core.py:1102: FutureWarning: iteritems is deprecated and will be removed in a future version. Use .items instead.
  self._init_pool(data, label, cat_features, text_features, embedding_features, pairs, weight, group_id, group_weight, subgroup_id, pairs_weight, baseline, feature_names, thread_count)
/anaconda/envs/py38_default/lib/python3.9/site-packages/catboost/core.py:1102: FutureWarning: iteritems is deprecated and will be removed in a future version. Use .items instead.
  self._init_pool(data, label, cat_features, text_features, embedding_features, pairs, weight, group_id, group_weight, subgroup_id, pairs_weight, baseline, feature_names, thread_count)
[I 2024-11-07 01:56:43,061] Trial 108 finished with value: 0.5917533170080045 and parameters: {'iterations': 828, 'learning_rate': 0.18405189935538233, 'depth': 4, 'l2_leaf_reg': 6.3095883905737065}. Best is trial 56 with value: 0.5955351412315192.
/anaconda/envs/py38_default/lib/python3.9/site-packages/catboost/core.py:1102: FutureWarning: iteritems is deprecated and will be removed in a future version. Use .items instead.
  self._init_pool(data, label, cat_features, text_features, embedding_features, pairs, weight, group_id, group_weight, subgroup_id, pairs_weight, baseline, feature_names, thread_count)
/anaconda/envs/py38_default/lib/python3.9/site-packages/catboost/core.py:1102: FutureWarning: iteritems is deprecated and will be removed in a future version. Use .items instead.
  self._init_pool(data, label, cat_features, text_features, embedding_features, pairs, weight, group_id, group_weight, subgroup_id, pairs_weight, baseline, feature_names, thread_count)
/anaconda/envs/py38_default/lib/python3.9/site-packages/catboost/core.py:1102: FutureWarning: iteritems is deprecated and will be removed in a future version. Use .items instead.
  self._init_pool(data, label, cat_features, text_features, embedding_features, pairs, weight, group_id, group_weight, subgroup_id, pairs_weight, baseline, feature_names, thread_count)
/anaconda/envs/py38_default/lib/python3.9/site-packages/catboost/core.py:1102: FutureWarning: iteritems is deprecated and will be removed in a future version. Use .items instead.
  self._init_pool(data, label, cat_features, text_features, embedding_features, pairs, weight, group_id, group_weight, subgroup_id, pairs_weight, baseline, feature_names, thread_count)
/anaconda/envs/py38_default/lib/python3.9/site-packages/catboost/core.py:1102: FutureWarning: iteritems is deprecated and will be removed in a future version. Use .items instead.
  self._init_pool(data, label, cat_features, text_features, embedding_features, pairs, weight, group_id, group_weight, subgroup_id, pairs_weight, baseline, feature_names, thread_count)
