[I 2024-11-06 21:33:13,472] Trial 100 finished with value: 0.5920878262219709 and parameters: {'n_estimators': 226, 'max_depth': 8, 'learning_rate': 0.048010692585303744, 'gamma': 4.489453053475244, 'min_child_weight': 5, 'subsample': 0.5760563790427368, 'colsample_bytree': 0.5276565006608663, 'reg_alpha': 0.1263896319800194, 'reg_lambda': 0.38696483992779146}. Best is trial 35 with value: 0.5936215356095056.
[I 2024-11-06 21:33:20,751] Trial 101 finished with value: 0.5931916243272198 and parameters: {'n_estimators': 229, 'max_depth': 10, 'learning_rate': 0.021750680373171537, 'gamma': 4.755803759695967, 'min_child_weight': 3, 'subsample': 0.8643354795391726, 'colsample_bytree': 0.5700141412735976, 'reg_alpha': 0.056468961415391594, 'reg_lambda': 0.5745230360909379}. Best is trial 35 with value: 0.5936215356095056.
[I 2024-11-06 21:33:29,566] Trial 102 finished with value: 0.5926330710967648 and parameters: {'n_estimators': 233, 'max_depth': 10, 'learning_rate': 0.01735064953418477, 'gamma': 4.757759745121003, 'min_child_weight': 4, 'subsample': 0.8404154116190555, 'colsample_bytree': 0.5420181326670247, 'reg_alpha': 0.05152445104797698, 'reg_lambda': 0.5441017637037506}. Best is trial 35 with value: 0.5936215356095056.
[I 2024-11-06 21:33:35,636] Trial 103 finished with value: 0.5925377419513044 and parameters: {'n_estimators': 248, 'max_depth': 10, 'learning_rate': 0.04257127863520416, 'gamma': 4.215283698205754, 'min_child_weight': 7, 'subsample': 0.8832961014946074, 'colsample_bytree': 0.6263836965773154, 'reg_alpha': 0.06518722367788675, 'reg_lambda': 0.5244806984127274}. Best is trial 35 with value: 0.5936215356095056.
[I 2024-11-06 21:33:43,251] Trial 104 finished with value: 0.5933205242731203 and parameters: {'n_estimators': 202, 'max_depth': 10, 'learning_rate': 0.023956594636104337, 'gamma': 4.5862185331316345, 'min_child_weight': 2, 'subsample': 0.865130247591354, 'colsample_bytree': 0.547641593465465, 'reg_alpha': 0.10393279572588074, 'reg_lambda': 0.7832170089186502}. Best is trial 35 with value: 0.5936215356095056.
[I 2024-11-06 21:33:49,969] Trial 105 finished with value: 0.5931128077681846 and parameters: {'n_estimators': 206, 'max_depth': 10, 'learning_rate': 0.02344295845307871, 'gamma': 4.5488399165648845, 'min_child_weight': 1, 'subsample': 0.91447622878552, 'colsample_bytree': 0.550516688470697, 'reg_alpha': 0.14852592086326474, 'reg_lambda': 0.787674724857006}. Best is trial 35 with value: 0.5936215356095056.
[I 2024-11-06 21:33:58,227] Trial 106 finished with value: 0.5923396756643096 and parameters: {'n_estimators': 215, 'max_depth': 9, 'learning_rate': 0.010460713475984353, 'gamma': 4.102392582606357, 'min_child_weight': 2, 'subsample': 0.859375705001576, 'colsample_bytree': 0.5253818472520768, 'reg_alpha': 0.10241188210896988, 'reg_lambda': 0.8666070456793924}. Best is trial 35 with value: 0.5936215356095056.
[I 2024-11-06 21:34:04,828] Trial 107 finished with value: 0.5923610548857028 and parameters: {'n_estimators': 234, 'max_depth': 6, 'learning_rate': 0.03331136515166228, 'gamma': 4.826768832847861, 'min_child_weight': 2, 'subsample': 0.8096468405174508, 'colsample_bytree': 0.5359419333607865, 'reg_alpha': 0.38923850661759385, 'reg_lambda': 0.946026472812542}. Best is trial 35 with value: 0.5936215356095056.
[I 2024-11-06 21:34:09,892] Trial 108 finished with value: 0.5926866242908146 and parameters: {'n_estimators': 221, 'max_depth': 7, 'learning_rate': 0.05875453063523853, 'gamma': 3.876738969414687, 'min_child_weight': 2, 'subsample': 0.8975315776417174, 'colsample_bytree': 0.5095487731039889, 'reg_alpha': 0.19422982411218065, 'reg_lambda': 0.8024720098228132}. Best is trial 35 with value: 0.5936215356095056.
[I 2024-11-06 21:34:16,044] Trial 109 finished with value: 0.5930292419109218 and parameters: {'n_estimators': 141, 'max_depth': 10, 'learning_rate': 0.020659891796477012, 'gamma': 4.430064797626456, 'min_child_weight': 3, 'subsample': 0.9648302877428325, 'colsample_bytree': 0.8368639295145972, 'reg_alpha': 0.11250431797058444, 'reg_lambda': 0.7757236593575887}. Best is trial 35 with value: 0.5936215356095056.
[I 2024-11-06 21:34:19,847] Trial 110 finished with value: 0.5926226478991522 and parameters: {'n_estimators': 118, 'max_depth': 9, 'learning_rate': 0.06998448032562929, 'gamma': 3.479650800369336, 'min_child_weight': 6, 'subsample': 0.8504206759506145, 'colsample_bytree': 0.5654670076132671, 'reg_alpha': 0.8594646092006115, 'reg_lambda': 0.7151913086309056}. Best is trial 35 with value: 0.5936215356095056.
[I 2024-11-06 21:34:25,691] Trial 111 finished with value: 0.5928759212876515 and parameters: {'n_estimators': 203, 'max_depth': 10, 'learning_rate': 0.03020542915344998, 'gamma': 4.724927208669731, 'min_child_weight': 5, 'subsample': 0.8621160875495861, 'colsample_bytree': 0.6063785125176153, 'reg_alpha': 0.04034518774874393, 'reg_lambda': 0.5753122711384405}. Best is trial 35 with value: 0.5936215356095056.
[I 2024-11-06 21:34:30,904] Trial 112 finished with value: 0.5929495669419053 and parameters: {'n_estimators': 166, 'max_depth': 10, 'learning_rate': 0.03641715574686427, 'gamma': 4.88947964799492, 'min_child_weight': 5, 'subsample': 0.8853695690696859, 'colsample_bytree': 0.5003044578219895, 'reg_alpha': 0.08124927539090526, 'reg_lambda': 0.6895727300837491}. Best is trial 35 with value: 0.5936215356095056.
[I 2024-11-06 21:34:36,433] Trial 113 finished with value: 0.5927452381251364 and parameters: {'n_estimators': 229, 'max_depth': 10, 'learning_rate': 0.04485447514273595, 'gamma': 4.585503800206079, 'min_child_weight': 1, 'subsample': 0.8307389451852029, 'colsample_bytree': 0.5537556315566148, 'reg_alpha': 0.06015642829164878, 'reg_lambda': 0.659235469726228}. Best is trial 35 with value: 0.5936215356095056.
[I 2024-11-06 21:34:41,093] Trial 114 finished with value: 0.5922324527310675 and parameters: {'n_estimators': 190, 'max_depth': 10, 'learning_rate': 0.05374652149593019, 'gamma': 4.282333753771942, 'min_child_weight': 6, 'subsample': 0.9271953265659126, 'colsample_bytree': 0.5930079361719744, 'reg_alpha': 0.1288249037857502, 'reg_lambda': 0.6094875278637902}. Best is trial 35 with value: 0.5936215356095056.
[I 2024-11-06 21:34:44,662] Trial 115 finished with value: 0.5925248756743688 and parameters: {'n_estimators': 158, 'max_depth': 3, 'learning_rate': 0.02861125821480877, 'gamma': 3.9804057729231874, 'min_child_weight': 3, 'subsample': 0.8702429366659102, 'colsample_bytree': 0.5174343666751662, 'reg_alpha': 0.03837895689217222, 'reg_lambda': 0.4890725256863507}. Best is trial 35 with value: 0.5936215356095056.
[I 2024-11-06 21:34:47,340] Trial 116 finished with value: 0.5915710082025909 and parameters: {'n_estimators': 96, 'max_depth': 4, 'learning_rate': 0.016737158069951203, 'gamma': 3.6696332583257454, 'min_child_weight': 7, 'subsample': 0.903968281283195, 'colsample_bytree': 0.5366930244194965, 'reg_alpha': 0.0980654811459473, 'reg_lambda': 0.8375841544780741}. Best is trial 35 with value: 0.5936215356095056.
[I 2024-11-06 21:34:52,652] Trial 117 finished with value: 0.5929555090032361 and parameters: {'n_estimators': 171, 'max_depth': 10, 'learning_rate': 0.03660347858929744, 'gamma': 4.394902501456867, 'min_child_weight': 9, 'subsample': 0.9171006436780798, 'colsample_bytree': 0.5830865480452828, 'reg_alpha': 0.964363870181311, 'reg_lambda': 0.7456471135693618}. Best is trial 35 with value: 0.5936215356095056.
[I 2024-11-06 21:34:58,235] Trial 118 finished with value: 0.5924969893472435 and parameters: {'n_estimators': 198, 'max_depth': 5, 'learning_rate': 0.022313816155503624, 'gamma': 2.611435927647874, 'min_child_weight': 4, 'subsample': 0.8654148777527714, 'colsample_bytree': 0.6172895816516432, 'reg_alpha': 0.01887417084081132, 'reg_lambda': 0.6260732667278224}. Best is trial 35 with value: 0.5936215356095056.
[I 2024-11-06 21:35:01,571] Trial 119 finished with value: 0.5929939952081325 and parameters: {'n_estimators': 177, 'max_depth': 7, 'learning_rate': 0.08721951078713434, 'gamma': 4.650611092831946, 'min_child_weight': 5, 'subsample': 0.9430384408888689, 'colsample_bytree': 0.5490363338125329, 'reg_alpha': 0.07862429114661018, 'reg_lambda': 0.5541595412230602}. Best is trial 35 with value: 0.5936215356095056.
[I 2024-11-06 21:35:05,590] Trial 120 finished with value: 0.5915291770257226 and parameters: {'n_estimators': 151, 'max_depth': 10, 'learning_rate': 0.17299166063563517, 'gamma': 4.141106491043492, 'min_child_weight': 7, 'subsample': 0.8929774841226685, 'colsample_bytree': 0.56513872444372, 'reg_alpha': 0.16093661606792942, 'reg_lambda': 0.8998146461329343}. Best is trial 35 with value: 0.5936215356095056.
[I 2024-11-06 21:35:12,122] Trial 121 finished with value: 0.5933687854850178 and parameters: {'n_estimators': 186, 'max_depth': 10, 'learning_rate': 0.026727267795731886, 'gamma': 4.7620996527132045, 'min_child_weight': 3, 'subsample': 0.8785963116292554, 'colsample_bytree': 0.5772432778106823, 'reg_alpha': 0.020359523069969965, 'reg_lambda': 0.5777731280123672}. Best is trial 35 with value: 0.5936215356095056.
[I 2024-11-06 21:35:16,911] Trial 122 finished with value: 0.5928421381448252 and parameters: {'n_estimators': 165, 'max_depth': 10, 'learning_rate': 0.04214088738195948, 'gamma': 4.734724048572721, 'min_child_weight': 3, 'subsample': 0.8782688321142683, 'colsample_bytree': 0.5735640015800726, 'reg_alpha': 0.058690674813750204, 'reg_lambda': 0.7729226083755959}. Best is trial 35 with value: 0.5936215356095056.
[I 2024-11-06 21:35:23,434] Trial 123 finished with value: 0.5919902059685296 and parameters: {'n_estimators': 193, 'max_depth': 10, 'learning_rate': 0.026071022828304848, 'gamma': 4.910179727593306, 'min_child_weight': 3, 'subsample': 0.838283782708201, 'colsample_bytree': 0.5241454343933493, 'reg_alpha': 0.0012238130281680075, 'reg_lambda': 0.5426371897236336}. Best is trial 35 with value: 0.5936215356095056.
[I 2024-11-06 21:35:29,518] Trial 124 finished with value: 0.592990453458514 and parameters: {'n_estimators': 241, 'max_depth': 9, 'learning_rate': 0.03405088204182177, 'gamma': 4.998735203962368, 'min_child_weight': 2, 'subsample': 0.8562167791929155, 'colsample_bytree': 0.5454387588438642, 'reg_alpha': 0.6715841134575168, 'reg_lambda': 0.6343066143555466}. Best is trial 35 with value: 0.5936215356095056.
[I 2024-11-06 21:35:32,016] Trial 125 finished with value: 0.5906906660229482 and parameters: {'n_estimators': 103, 'max_depth': 10, 'learning_rate': 0.2188178571301859, 'gamma': 4.525258984601176, 'min_child_weight': 4, 'subsample': 0.907719153675325, 'colsample_bytree': 0.598745395671018, 'reg_alpha': 0.03470332983787571, 'reg_lambda': 0.727774514537721}. Best is trial 35 with value: 0.5936215356095056.
[I 2024-11-06 21:35:36,871] Trial 126 finished with value: 0.5931954959178941 and parameters: {'n_estimators': 187, 'max_depth': 10, 'learning_rate': 0.04903322138991869, 'gamma': 4.79132699385373, 'min_child_weight': 5, 'subsample': 0.8868195301486075, 'colsample_bytree': 0.5124799171161007, 'reg_alpha': 0.06933351401676892, 'reg_lambda': 0.6041783953284764}. Best is trial 35 with value: 0.5936215356095056.
[I 2024-11-06 21:35:40,092] Trial 127 finished with value: 0.5930748480532686 and parameters: {'n_estimators': 77, 'max_depth': 10, 'learning_rate': 0.05119214160974951, 'gamma': 4.799863483829444, 'min_child_weight': 5, 'subsample': 0.9309687858061745, 'colsample_bytree': 0.5093741113725998, 'reg_alpha': 0.10893922281618496, 'reg_lambda': 0.44010212364542833}. Best is trial 35 with value: 0.5936215356095056.
[I 2024-11-06 21:35:44,180] Trial 128 finished with value: 0.5934247728281437 and parameters: {'n_estimators': 174, 'max_depth': 10, 'learning_rate': 0.06228056320141967, 'gamma': 4.4498532476975905, 'min_child_weight': 6, 'subsample': 0.8888641847464299, 'colsample_bytree': 0.532619216755941, 'reg_alpha': 0.7344961642908103, 'reg_lambda': 0.6503990729120216}. Best is trial 35 with value: 0.5936215356095056.
[I 2024-11-06 21:35:48,258] Trial 129 finished with value: 0.5931821136178442 and parameters: {'n_estimators': 173, 'max_depth': 8, 'learning_rate': 0.06560241246730655, 'gamma': 4.6001729256015365, 'min_child_weight': 6, 'subsample': 0.8894472384238402, 'colsample_bytree': 0.5286585167718836, 'reg_alpha': 0.9393897956088744, 'reg_lambda': 0.6835362686798453}. Best is trial 35 with value: 0.5936215356095056.
[I 2024-11-06 21:35:52,065] Trial 130 finished with value: 0.5931010251666182 and parameters: {'n_estimators': 176, 'max_depth': 6, 'learning_rate': 0.06593838801556018, 'gamma': 4.60174911999787, 'min_child_weight': 6, 'subsample': 0.8888756135629428, 'colsample_bytree': 0.5326470662799768, 'reg_alpha': 0.6182298515917968, 'reg_lambda': 0.7099473155277116}. Best is trial 35 with value: 0.5936215356095056.
[I 2024-11-06 21:35:55,804] Trial 131 finished with value: 0.5923561038473945 and parameters: {'n_estimators': 171, 'max_depth': 8, 'learning_rate': 0.07950832731447886, 'gamma': 4.791465925003615, 'min_child_weight': 6, 'subsample': 0.8988992218876314, 'colsample_bytree': 0.515704466415089, 'reg_alpha': 0.9282758161352475, 'reg_lambda': 0.6554582422644212}. Best is trial 35 with value: 0.5936215356095056.
[I 2024-11-06 21:35:59,831] Trial 132 finished with value: 0.5930634336593743 and parameters: {'n_estimators': 159, 'max_depth': 8, 'learning_rate': 0.05962554518281715, 'gamma': 4.489590787248358, 'min_child_weight': 6, 'subsample': 0.8776555487055638, 'colsample_bytree': 0.5266681707903885, 'reg_alpha': 0.9828371376607247, 'reg_lambda': 0.6796287156220859}. Best is trial 35 with value: 0.5936215356095056.
[I 2024-11-06 21:36:04,031] Trial 133 finished with value: 0.5931974283653669 and parameters: {'n_estimators': 180, 'max_depth': 7, 'learning_rate': 0.06927866553995915, 'gamma': 4.673525583752402, 'min_child_weight': 6, 'subsample': 0.9197389302573012, 'colsample_bytree': 0.5406903571854647, 'reg_alpha': 0.7542672382933534, 'reg_lambda': 0.6056411766567764}. Best is trial 35 with value: 0.5936215356095056.
[I 2024-11-06 21:36:08,177] Trial 134 finished with value: 0.5928516965613012 and parameters: {'n_estimators': 188, 'max_depth': 7, 'learning_rate': 0.0661264988245834, 'gamma': 4.719837720235351, 'min_child_weight': 6, 'subsample': 0.9201103311164318, 'colsample_bytree': 0.5405451221141019, 'reg_alpha': 0.7341208974221645, 'reg_lambda': 0.6468418714481906}. Best is trial 35 with value: 0.5936215356095056.
[I 2024-11-06 21:36:12,471] Trial 135 finished with value: 0.5936465002093926 and parameters: {'n_estimators': 178, 'max_depth': 7, 'learning_rate': 0.04894195085816719, 'gamma': 4.912936005302571, 'min_child_weight': 7, 'subsample': 0.9099668341308383, 'colsample_bytree': 0.5541744692997482, 'reg_alpha': 0.889099072758891, 'reg_lambda': 0.60648416084017}. Best is trial 135 with value: 0.5936465002093926.
[I 2024-11-06 21:36:16,843] Trial 136 finished with value: 0.5928589973071159 and parameters: {'n_estimators': 180, 'max_depth': 7, 'learning_rate': 0.05095116877609211, 'gamma': 4.888418425810355, 'min_child_weight': 7, 'subsample': 0.9338826232959961, 'colsample_bytree': 0.5536557480964205, 'reg_alpha': 0.7724467183378882, 'reg_lambda': 0.6060987103499883}. Best is trial 135 with value: 0.5936465002093926.
[I 2024-11-06 21:36:20,753] Trial 137 finished with value: 0.593547977362094 and parameters: {'n_estimators': 166, 'max_depth': 7, 'learning_rate': 0.044447310966023834, 'gamma': 4.903376176218265, 'min_child_weight': 8, 'subsample': 0.912027383164226, 'colsample_bytree': 0.5625564054332584, 'reg_alpha': 0.8083339245838552, 'reg_lambda': 0.5835101130810791}. Best is trial 135 with value: 0.5936465002093926.
[I 2024-11-06 21:36:24,983] Trial 138 finished with value: 0.5926938429170918 and parameters: {'n_estimators': 165, 'max_depth': 7, 'learning_rate': 0.04597553286036368, 'gamma': 4.984635633692574, 'min_child_weight': 8, 'subsample': 0.9503897981865079, 'colsample_bytree': 0.560980604347666, 'reg_alpha': 0.837499011785117, 'reg_lambda': 0.5948042362184537}. Best is trial 135 with value: 0.5936465002093926.
[I 2024-11-06 21:36:28,697] Trial 139 finished with value: 0.5925635120901678 and parameters: {'n_estimators': 152, 'max_depth': 7, 'learning_rate': 0.05510491182579056, 'gamma': 4.838192607604194, 'min_child_weight': 8, 'subsample': 0.9110499591716357, 'colsample_bytree': 0.5433012993406213, 'reg_alpha': 0.809690278885186, 'reg_lambda': 0.6226066639751388}. Best is trial 135 with value: 0.5936465002093926.
[I 2024-11-06 21:36:32,398] Trial 140 finished with value: 0.5923277755543283 and parameters: {'n_estimators': 181, 'max_depth': 6, 'learning_rate': 0.09661380520919102, 'gamma': 4.363175457997383, 'min_child_weight': 9, 'subsample': 0.7076171863211104, 'colsample_bytree': 0.5131244511270772, 'reg_alpha': 0.8132196458675087, 'reg_lambda': 0.7985202087131822}. Best is trial 135 with value: 0.5936465002093926.
[I 2024-11-06 21:36:36,895] Trial 141 finished with value: 0.5928786727426194 and parameters: {'n_estimators': 187, 'max_depth': 7, 'learning_rate': 0.04308061931795387, 'gamma': 4.726915461928453, 'min_child_weight': 7, 'subsample': 0.9043894821278832, 'colsample_bytree': 0.5531163639958687, 'reg_alpha': 0.6927900546770875, 'reg_lambda': 0.5647880282561965}. Best is trial 135 with value: 0.5936465002093926.
[I 2024-11-06 21:36:40,623] Trial 142 finished with value: 0.5933611958533163 and parameters: {'n_estimators': 167, 'max_depth': 7, 'learning_rate': 0.06025712463953804, 'gamma': 4.90683383148227, 'min_child_weight': 8, 'subsample': 0.9152025810838246, 'colsample_bytree': 0.5715714919245776, 'reg_alpha': 0.7981001571073841, 'reg_lambda': 0.5806828222628917}. Best is trial 135 with value: 0.5936465002093926.
[I 2024-11-06 21:36:44,615] Trial 143 finished with value: 0.5931223357825235 and parameters: {'n_estimators': 168, 'max_depth': 7, 'learning_rate': 0.05942338012165842, 'gamma': 4.8996320368498045, 'min_child_weight': 8, 'subsample': 0.9180152703782684, 'colsample_bytree': 0.5330448251480613, 'reg_alpha': 0.8818372023248878, 'reg_lambda': 0.6029903230416258}. Best is trial 135 with value: 0.5936465002093926.
[I 2024-11-06 21:36:48,602] Trial 144 finished with value: 0.5928104130441386 and parameters: {'n_estimators': 157, 'max_depth': 7, 'learning_rate': 0.04962561233037431, 'gamma': 4.619389215058945, 'min_child_weight': 9, 'subsample': 0.9407593676470816, 'colsample_bytree': 0.5202410524317211, 'reg_alpha': 0.7498662668784492, 'reg_lambda': 0.5198674905804861}. Best is trial 135 with value: 0.5936465002093926.
[I 2024-11-06 21:36:51,942] Trial 145 finished with value: 0.5928170229544276 and parameters: {'n_estimators': 164, 'max_depth': 6, 'learning_rate': 0.0747187779390286, 'gamma': 4.913625512745128, 'min_child_weight': 8, 'subsample': 0.9295485094867516, 'colsample_bytree': 0.5626176928056301, 'reg_alpha': 0.7226688909710164, 'reg_lambda': 0.8563949912703164}. Best is trial 135 with value: 0.5936465002093926.
[I 2024-11-06 21:36:55,940] Trial 146 finished with value: 0.5929955434031551 and parameters: {'n_estimators': 176, 'max_depth': 7, 'learning_rate': 0.07084655277272368, 'gamma': 4.4794747905633825, 'min_child_weight': 7, 'subsample': 0.8981350021131294, 'colsample_bytree': 0.5385222809461241, 'reg_alpha': 0.8017326717464448, 'reg_lambda': 0.5852443845815748}. Best is trial 135 with value: 0.5936465002093926.
[I 2024-11-06 21:37:00,310] Trial 147 finished with value: 0.5925410117926251 and parameters: {'n_estimators': 173, 'max_depth': 7, 'learning_rate': 0.041727005099421115, 'gamma': 4.679050430317846, 'min_child_weight': 8, 'subsample': 0.9084319716105103, 'colsample_bytree': 0.7749012542796229, 'reg_alpha': 0.7766022095203454, 'reg_lambda': 0.6383428354771563}. Best is trial 135 with value: 0.5936465002093926.
[I 2024-11-06 21:37:04,667] Trial 148 finished with value: 0.59349338619086 and parameters: {'n_estimators': 146, 'max_depth': 7, 'learning_rate': 0.0618965102331974, 'gamma': 4.838160742683198, 'min_child_weight': 8, 'subsample': 0.9596448385808964, 'colsample_bytree': 0.5757601069268264, 'reg_alpha': 0.7937228212637746, 'reg_lambda': 0.7587851272718726}. Best is trial 135 with value: 0.5936465002093926.
[I 2024-11-06 21:37:08,103] Trial 149 finished with value: 0.5932757175410625 and parameters: {'n_estimators': 139, 'max_depth': 7, 'learning_rate': 0.059308254546672746, 'gamma': 4.9895688729799845, 'min_child_weight': 8, 'subsample': 0.9579093601776736, 'colsample_bytree': 0.5836560702015219, 'reg_alpha': 0.8587457478264782, 'reg_lambda': 0.7668681750517369}. Best is trial 135 with value: 0.5936465002093926.
[I 2024-11-06 21:37:10,586] Trial 150 finished with value: 0.5921851484299259 and parameters: {'n_estimators': 146, 'max_depth': 7, 'learning_rate': 0.2772661095215754, 'gamma': 4.982375706679302, 'min_child_weight': 8, 'subsample': 0.9767752811093307, 'colsample_bytree': 0.5780547972960485, 'reg_alpha': 0.8723554324775364, 'reg_lambda': 0.7543515005890118}. Best is trial 135 with value: 0.5936465002093926.
[I 2024-11-06 21:37:13,876] Trial 151 finished with value: 0.5926319230347892 and parameters: {'n_estimators': 138, 'max_depth': 7, 'learning_rate': 0.061089065729381165, 'gamma': 4.845291339654125, 'min_child_weight': 8, 'subsample': 0.9546604025966975, 'colsample_bytree': 0.5822086683975739, 'reg_alpha': 0.9031241562977963, 'reg_lambda': 0.8201123428071795}. Best is trial 135 with value: 0.5936465002093926.
[I 2024-11-06 21:37:17,018] Trial 152 finished with value: 0.5928086188634103 and parameters: {'n_estimators': 124, 'max_depth': 7, 'learning_rate': 0.07836391513696805, 'gamma': 4.65531149416345, 'min_child_weight': 8, 'subsample': 0.9458633931292331, 'colsample_bytree': 0.5708100991277414, 'reg_alpha': 0.8255083157857293, 'reg_lambda': 0.7712184112308939}. Best is trial 135 with value: 0.5936465002093926.
