[I 2024-11-06 21:41:26,768] Trial 206 finished with value: 0.5930884595599626 and parameters: {'n_estimators': 136, 'max_depth': 7, 'learning_rate': 0.04037240507844997, 'gamma': 4.224697402856787, 'min_child_weight': 7, 'subsample': 0.8992177134544025, 'colsample_bytree': 0.5496323865232413, 'reg_alpha': 0.740170076589847, 'reg_lambda': 0.6162061970573666}. Best is trial 197 with value: 0.5937894638785621.
[I 2024-11-06 21:41:30,390] Trial 207 finished with value: 0.5928496420170861 and parameters: {'n_estimators': 144, 'max_depth': 7, 'learning_rate': 0.05373221370942574, 'gamma': 4.449445099170679, 'min_child_weight': 7, 'subsample': 0.9188356531929898, 'colsample_bytree': 0.5639787062371034, 'reg_alpha': 0.7614924967974462, 'reg_lambda': 0.6544896165142977}. Best is trial 197 with value: 0.5937894638785621.
[I 2024-11-06 21:41:34,435] Trial 208 finished with value: 0.5931432330279071 and parameters: {'n_estimators': 147, 'max_depth': 7, 'learning_rate': 0.04711024646288504, 'gamma': 4.136905317920497, 'min_child_weight': 8, 'subsample': 0.9277447496469996, 'colsample_bytree': 0.5542748479025887, 'reg_alpha': 0.7887532058348868, 'reg_lambda': 0.636932018621598}. Best is trial 197 with value: 0.5937894638785621.
[I 2024-11-06 21:41:39,382] Trial 209 finished with value: 0.5933691447867337 and parameters: {'n_estimators': 160, 'max_depth': 8, 'learning_rate': 0.0286595490469211, 'gamma': 4.5929974677576855, 'min_child_weight': 7, 'subsample': 0.8951258868548685, 'colsample_bytree': 0.5731022499173793, 'reg_alpha': 0.772728108156423, 'reg_lambda': 0.6750846629866024}. Best is trial 197 with value: 0.5937894638785621.
[I 2024-11-06 21:41:44,787] Trial 210 finished with value: 0.5932383832214579 and parameters: {'n_estimators': 159, 'max_depth': 8, 'learning_rate': 0.020010012548842944, 'gamma': 4.553134218014967, 'min_child_weight': 7, 'subsample': 0.8963074595334697, 'colsample_bytree': 0.5364245639236922, 'reg_alpha': 0.770652383752158, 'reg_lambda': 0.6500574017332817}. Best is trial 197 with value: 0.5937894638785621.
[I 2024-11-06 21:41:49,913] Trial 211 finished with value: 0.5928049862325547 and parameters: {'n_estimators': 166, 'max_depth': 7, 'learning_rate': 0.02870515353855314, 'gamma': 4.699798180708667, 'min_child_weight': 7, 'subsample': 0.9091048941578361, 'colsample_bytree': 0.5722958193691297, 'reg_alpha': 0.7796662831895063, 'reg_lambda': 0.6708471756482337}. Best is trial 197 with value: 0.5937894638785621.
[I 2024-11-06 21:41:54,401] Trial 212 finished with value: 0.5932647740635147 and parameters: {'n_estimators': 151, 'max_depth': 7, 'learning_rate': 0.03863137036660693, 'gamma': 4.632075338510063, 'min_child_weight': 7, 'subsample': 0.8830592715989258, 'colsample_bytree': 0.5596785140719936, 'reg_alpha': 0.74715002330899, 'reg_lambda': 0.6120290444975613}. Best is trial 197 with value: 0.5937894638785621.
[I 2024-11-06 21:41:58,827] Trial 213 finished with value: 0.5936169539983369 and parameters: {'n_estimators': 159, 'max_depth': 7, 'learning_rate': 0.03506163124139249, 'gamma': 4.786363022911339, 'min_child_weight': 7, 'subsample': 0.8730448651828181, 'colsample_bytree': 0.5798073154872355, 'reg_alpha': 0.8047889055402256, 'reg_lambda': 0.6772495314192537}. Best is trial 197 with value: 0.5937894638785621.
[I 2024-11-06 21:42:24,816] Trial 214 finished with value: 0.5935357941047578 and parameters: {'n_estimators': 158, 'max_depth': 7, 'learning_rate': 0.03421288737708462, 'gamma': 4.41878831872983, 'min_child_weight': 7, 'subsample': 0.8723874616049456, 'colsample_bytree': 0.5795212674019327, 'reg_alpha': 0.7609344352288498, 'reg_lambda': 0.6823847947570565}. Best is trial 197 with value: 0.5937894638785621.
[I 2024-11-06 21:42:29,766] Trial 215 finished with value: 0.5937396699562666 and parameters: {'n_estimators': 157, 'max_depth': 7, 'learning_rate': 0.03410715982886384, 'gamma': 4.387742589519529, 'min_child_weight': 7, 'subsample': 0.8693048033655207, 'colsample_bytree': 0.5457445711355102, 'reg_alpha': 0.7181632511368483, 'reg_lambda': 0.6716253483838516}. Best is trial 197 with value: 0.5937894638785621.
[I 2024-11-06 21:42:34,471] Trial 216 finished with value: 0.5935751213755527 and parameters: {'n_estimators': 155, 'max_depth': 7, 'learning_rate': 0.03505251575460969, 'gamma': 4.369150477416796, 'min_child_weight': 7, 'subsample': 0.8747509044129735, 'colsample_bytree': 0.5446428237836899, 'reg_alpha': 0.727155352915608, 'reg_lambda': 0.6794166855498625}. Best is trial 197 with value: 0.5937894638785621.
[I 2024-11-06 21:42:38,433] Trial 217 finished with value: 0.5936223336121511 and parameters: {'n_estimators': 148, 'max_depth': 7, 'learning_rate': 0.04239143435594332, 'gamma': 4.283661780500657, 'min_child_weight': 7, 'subsample': 0.8675019855616343, 'colsample_bytree': 0.5249042093551525, 'reg_alpha': 0.7188774730390391, 'reg_lambda': 0.6837814872883141}. Best is trial 197 with value: 0.5937894638785621.
[I 2024-11-06 21:42:42,600] Trial 218 finished with value: 0.592872042314896 and parameters: {'n_estimators': 134, 'max_depth': 7, 'learning_rate': 0.04351150229542126, 'gamma': 4.184239506370325, 'min_child_weight': 5, 'subsample': 0.8629559840000413, 'colsample_bytree': 0.5266131777227729, 'reg_alpha': 0.6665942697228147, 'reg_lambda': 0.6924674276293052}. Best is trial 197 with value: 0.5937894638785621.
[I 2024-11-06 21:42:45,187] Trial 219 finished with value: 0.5918900271567444 and parameters: {'n_estimators': 148, 'max_depth': 7, 'learning_rate': 0.14043463215573082, 'gamma': 4.306812673676568, 'min_child_weight': 7, 'subsample': 0.8792778999479142, 'colsample_bytree': 0.5209653613457184, 'reg_alpha': 0.708244962361807, 'reg_lambda': 0.6736886675429631}. Best is trial 197 with value: 0.5937894638785621.
[I 2024-11-06 21:42:48,951] Trial 220 finished with value: 0.5929395065058375 and parameters: {'n_estimators': 140, 'max_depth': 7, 'learning_rate': 0.04807408322970836, 'gamma': 4.3851627329367435, 'min_child_weight': 7, 'subsample': 0.8904232038155676, 'colsample_bytree': 0.5384171438381836, 'reg_alpha': 0.6938063108737936, 'reg_lambda': 0.6880564197610267}. Best is trial 197 with value: 0.5937894638785621.
[I 2024-11-06 21:42:53,569] Trial 221 finished with value: 0.5936386310600974 and parameters: {'n_estimators': 157, 'max_depth': 7, 'learning_rate': 0.03900560767892188, 'gamma': 4.273186307758511, 'min_child_weight': 7, 'subsample': 0.8720228178172796, 'colsample_bytree': 0.5476698815943356, 'reg_alpha': 0.7622686133596626, 'reg_lambda': 0.6554874516320658}. Best is trial 197 with value: 0.5937894638785621.
[I 2024-11-06 21:42:57,807] Trial 222 finished with value: 0.593569060542615 and parameters: {'n_estimators': 160, 'max_depth': 7, 'learning_rate': 0.04203055172228578, 'gamma': 4.246898607969628, 'min_child_weight': 7, 'subsample': 0.8675059662005903, 'colsample_bytree': 0.5310022840683172, 'reg_alpha': 0.7273015267394558, 'reg_lambda': 0.6745454414663843}. Best is trial 197 with value: 0.5937894638785621.
[I 2024-11-06 21:43:02,351] Trial 223 finished with value: 0.593463936778829 and parameters: {'n_estimators': 160, 'max_depth': 7, 'learning_rate': 0.04296737003117301, 'gamma': 4.188317361225352, 'min_child_weight': 7, 'subsample': 0.855963636619534, 'colsample_bytree': 0.5572990790529301, 'reg_alpha': 0.7160954403500654, 'reg_lambda': 0.6777817056645739}. Best is trial 197 with value: 0.5937894638785621.
[I 2024-11-06 21:43:07,534] Trial 224 finished with value: 0.592536429457258 and parameters: {'n_estimators': 160, 'max_depth': 7, 'learning_rate': 0.04183786760725645, 'gamma': 4.130190511298814, 'min_child_weight': 7, 'subsample': 0.8529486168856886, 'colsample_bytree': 0.5550362992345472, 'reg_alpha': 0.7176764163221584, 'reg_lambda': 0.682199794699595}. Best is trial 197 with value: 0.5937894638785621.
[I 2024-11-06 21:43:11,697] Trial 225 finished with value: 0.5934507760081406 and parameters: {'n_estimators': 162, 'max_depth': 7, 'learning_rate': 0.044602016646309854, 'gamma': 4.254264742378105, 'min_child_weight': 7, 'subsample': 0.8701351409653892, 'colsample_bytree': 0.5853869228741706, 'reg_alpha': 0.6894167844524272, 'reg_lambda': 0.7034830023987493}. Best is trial 197 with value: 0.5937894638785621.
[I 2024-11-06 21:43:16,189] Trial 226 finished with value: 0.5936176089937206 and parameters: {'n_estimators': 156, 'max_depth': 7, 'learning_rate': 0.03921776427649567, 'gamma': 4.080118903964029, 'min_child_weight': 7, 'subsample': 0.8565764904079514, 'colsample_bytree': 0.5634958113662489, 'reg_alpha': 0.6791585463007712, 'reg_lambda': 0.7200745699563809}. Best is trial 197 with value: 0.5937894638785621.
[I 2024-11-06 21:43:20,585] Trial 227 finished with value: 0.5932148498587312 and parameters: {'n_estimators': 157, 'max_depth': 7, 'learning_rate': 0.0494397466134054, 'gamma': 4.019131724675497, 'min_child_weight': 7, 'subsample': 0.8557732216842705, 'colsample_bytree': 0.5625665621776639, 'reg_alpha': 0.7265169082220535, 'reg_lambda': 0.7330234354851433}. Best is trial 197 with value: 0.5937894638785621.
[I 2024-11-06 21:43:25,163] Trial 228 finished with value: 0.5932133332757719 and parameters: {'n_estimators': 153, 'max_depth': 7, 'learning_rate': 0.03890913995551883, 'gamma': 4.137368650908745, 'min_child_weight': 7, 'subsample': 0.867536590643126, 'colsample_bytree': 0.719983096930172, 'reg_alpha': 0.6730436221608016, 'reg_lambda': 0.7050950047159916}. Best is trial 197 with value: 0.5937894638785621.
[I 2024-11-06 21:43:29,791] Trial 229 finished with value: 0.5933311987952745 and parameters: {'n_estimators': 144, 'max_depth': 7, 'learning_rate': 0.03425691966118514, 'gamma': 4.246412434363234, 'min_child_weight': 7, 'subsample': 0.8502494530133896, 'colsample_bytree': 0.5791285771678949, 'reg_alpha': 0.754088562610013, 'reg_lambda': 0.7226005934665624}. Best is trial 197 with value: 0.5937894638785621.
[I 2024-11-06 21:43:32,774] Trial 230 finished with value: 0.5934622707163817 and parameters: {'n_estimators': 157, 'max_depth': 7, 'learning_rate': 0.12082512425183894, 'gamma': 4.069784423405127, 'min_child_weight': 7, 'subsample': 0.871189088127634, 'colsample_bytree': 0.5589133366064469, 'reg_alpha': 0.6274631578702872, 'reg_lambda': 0.6766127723791922}. Best is trial 197 with value: 0.5937894638785621.
[I 2024-11-06 21:43:36,838] Trial 231 finished with value: 0.593009968232472 and parameters: {'n_estimators': 163, 'max_depth': 7, 'learning_rate': 0.0411547209639729, 'gamma': 4.257306264762651, 'min_child_weight': 5, 'subsample': 0.8612939689310232, 'colsample_bytree': 0.5517959871326997, 'reg_alpha': 0.7228484786305882, 'reg_lambda': 0.6657325157858576}. Best is trial 197 with value: 0.5937894638785621.
[I 2024-11-06 21:43:41,449] Trial 232 finished with value: 0.5934894689853105 and parameters: {'n_estimators': 150, 'max_depth': 7, 'learning_rate': 0.031705308160515866, 'gamma': 4.303606211040684, 'min_child_weight': 7, 'subsample': 0.8668306463456946, 'colsample_bytree': 0.5676445910363178, 'reg_alpha': 0.7072467181749772, 'reg_lambda': 0.6889057828785071}. Best is trial 197 with value: 0.5937894638785621.
[I 2024-11-06 21:43:46,152] Trial 233 finished with value: 0.5934352906065146 and parameters: {'n_estimators': 151, 'max_depth': 7, 'learning_rate': 0.03138925634993001, 'gamma': 4.312241496769549, 'min_child_weight': 7, 'subsample': 0.8687411890902987, 'colsample_bytree': 0.5670526806050662, 'reg_alpha': 0.5836559754165683, 'reg_lambda': 0.6876327106160671}. Best is trial 197 with value: 0.5937894638785621.
[I 2024-11-06 21:43:50,327] Trial 234 finished with value: 0.5936860513641209 and parameters: {'n_estimators': 147, 'max_depth': 7, 'learning_rate': 0.04512132837985036, 'gamma': 4.190900004287424, 'min_child_weight': 7, 'subsample': 0.8468614293158294, 'colsample_bytree': 0.5859033259660772, 'reg_alpha': 0.6825084305764656, 'reg_lambda': 0.7171653783388677}. Best is trial 197 with value: 0.5937894638785621.
[I 2024-11-06 21:43:54,329] Trial 235 finished with value: 0.5939497703971185 and parameters: {'n_estimators': 147, 'max_depth': 7, 'learning_rate': 0.0497719933773194, 'gamma': 4.396412447328437, 'min_child_weight': 7, 'subsample': 0.8424577454981823, 'colsample_bytree': 0.5941418130731396, 'reg_alpha': 0.6869060156732797, 'reg_lambda': 0.716269931109465}. Best is trial 235 with value: 0.5939497703971185.
[I 2024-11-06 21:43:58,199] Trial 236 finished with value: 0.5930637759890441 and parameters: {'n_estimators': 148, 'max_depth': 7, 'learning_rate': 0.052255802556896026, 'gamma': 4.371650209916803, 'min_child_weight': 7, 'subsample': 0.8507563399140738, 'colsample_bytree': 0.5894822491532548, 'reg_alpha': 0.6898375514912534, 'reg_lambda': 0.7188976007162945}. Best is trial 235 with value: 0.5939497703971185.
[I 2024-11-06 21:44:03,525] Trial 237 finished with value: 0.5930590859308008 and parameters: {'n_estimators': 154, 'max_depth': 7, 'learning_rate': 0.029234309767611964, 'gamma': 4.37760888663251, 'min_child_weight': 7, 'subsample': 0.8361338598712732, 'colsample_bytree': 0.594683989975441, 'reg_alpha': 0.6805340706886134, 'reg_lambda': 0.71564239872191}. Best is trial 235 with value: 0.5939497703971185.
[I 2024-11-06 21:44:08,284] Trial 238 finished with value: 0.5934438384220485 and parameters: {'n_estimators': 147, 'max_depth': 7, 'learning_rate': 0.036328340140259846, 'gamma': 4.1148043011510484, 'min_child_weight': 7, 'subsample': 0.8697234497753314, 'colsample_bytree': 0.5870494565077904, 'reg_alpha': 0.6670771953311919, 'reg_lambda': 0.7446148330410831}. Best is trial 235 with value: 0.5939497703971185.
[I 2024-11-06 21:44:12,229] Trial 239 finished with value: 0.5929025564425963 and parameters: {'n_estimators': 151, 'max_depth': 7, 'learning_rate': 0.054422903477879904, 'gamma': 3.941131274441168, 'min_child_weight': 7, 'subsample': 0.847515120254102, 'colsample_bytree': 0.5988635003449917, 'reg_alpha': 0.710971716727639, 'reg_lambda': 0.7058122387016863}. Best is trial 235 with value: 0.5939497703971185.
[I 2024-11-06 21:44:17,543] Trial 240 finished with value: 0.5935977450691203 and parameters: {'n_estimators': 157, 'max_depth': 7, 'learning_rate': 0.024624599002555363, 'gamma': 4.30794704211305, 'min_child_weight': 7, 'subsample': 0.8761993868712505, 'colsample_bytree': 0.5783482407934679, 'reg_alpha': 0.733367106912037, 'reg_lambda': 0.7230163842341392}. Best is trial 235 with value: 0.5939497703971185.
[I 2024-11-06 21:44:22,543] Trial 241 finished with value: 0.593929259776975 and parameters: {'n_estimators': 157, 'max_depth': 7, 'learning_rate': 0.024796490180701816, 'gamma': 4.302108155484522, 'min_child_weight': 7, 'subsample': 0.8747507284286244, 'colsample_bytree': 0.5738099927186037, 'reg_alpha': 0.7042269161585907, 'reg_lambda': 0.7206798194728585}. Best is trial 235 with value: 0.5939497703971185.
[I 2024-11-06 21:44:27,591] Trial 242 finished with value: 0.593386514719584 and parameters: {'n_estimators': 157, 'max_depth': 7, 'learning_rate': 0.02218490329956583, 'gamma': 4.370907929677798, 'min_child_weight': 7, 'subsample': 0.8758177937292967, 'colsample_bytree': 0.579319559735775, 'reg_alpha': 0.7307046952637194, 'reg_lambda': 0.7308046425514246}. Best is trial 235 with value: 0.5939497703971185.
[I 2024-11-06 21:44:32,177] Trial 243 finished with value: 0.5934722899524851 and parameters: {'n_estimators': 155, 'max_depth': 7, 'learning_rate': 0.02779048733625906, 'gamma': 4.4320670485290625, 'min_child_weight': 7, 'subsample': 0.863133278361293, 'colsample_bytree': 0.5802342499571561, 'reg_alpha': 0.6531123174714932, 'reg_lambda': 0.7546173617456624}. Best is trial 235 with value: 0.5939497703971185.
[I 2024-11-06 21:44:37,789] Trial 244 finished with value: 0.5939527867949647 and parameters: {'n_estimators': 163, 'max_depth': 7, 'learning_rate': 0.02347674230979366, 'gamma': 4.210706073851886, 'min_child_weight': 7, 'subsample': 0.8762999482419238, 'colsample_bytree': 0.5883161258576214, 'reg_alpha': 0.639940125559969, 'reg_lambda': 0.7268754879206876}. Best is trial 244 with value: 0.5939527867949647.
[I 2024-11-06 21:44:43,782] Trial 245 finished with value: 0.5929858329115896 and parameters: {'n_estimators': 164, 'max_depth': 7, 'learning_rate': 0.01626443464354759, 'gamma': 4.199080005435643, 'min_child_weight': 7, 'subsample': 0.8734217598236298, 'colsample_bytree': 0.5944349865737142, 'reg_alpha': 0.6925664610421653, 'reg_lambda': 0.742993491259933}. Best is trial 244 with value: 0.5939527867949647.
[I 2024-11-06 21:44:49,189] Trial 246 finished with value: 0.5926439842583398 and parameters: {'n_estimators': 164, 'max_depth': 7, 'learning_rate': 0.022701120285650755, 'gamma': 4.060604858965612, 'min_child_weight': 7, 'subsample': 0.8591232126162407, 'colsample_bytree': 0.5848660521104769, 'reg_alpha': 0.6415628950258869, 'reg_lambda': 0.7277033798212879}. Best is trial 244 with value: 0.5939527867949647.
[I 2024-11-06 21:44:53,883] Trial 247 finished with value: 0.5929602403365412 and parameters: {'n_estimators': 145, 'max_depth': 7, 'learning_rate': 0.025745505017295837, 'gamma': 4.2732397223537335, 'min_child_weight': 7, 'subsample': 0.8784318230769319, 'colsample_bytree': 0.5728241200628869, 'reg_alpha': 0.737988536522499, 'reg_lambda': 0.7161792915120369}. Best is trial 244 with value: 0.5939527867949647.
[I 2024-11-06 21:44:58,316] Trial 248 finished with value: 0.5926617758325572 and parameters: {'n_estimators': 169, 'max_depth': 7, 'learning_rate': 0.04836343099048167, 'gamma': 4.186030012388025, 'min_child_weight': 7, 'subsample': 0.8829992660210979, 'colsample_bytree': 0.5775997680166071, 'reg_alpha': 0.6484013777881452, 'reg_lambda': 0.7623597127753451}. Best is trial 244 with value: 0.5939527867949647.
[I 2024-11-06 21:45:05,329] Trial 249 finished with value: 0.5934149453676044 and parameters: {'n_estimators': 155, 'max_depth': 7, 'learning_rate': 0.018861707750816727, 'gamma': 4.418490361162462, 'min_child_weight': 7, 'subsample': 0.8250580724506822, 'colsample_bytree': 0.5890796437261624, 'reg_alpha': 0.5540861503948, 'reg_lambda': 0.7175765456420293}. Best is trial 244 with value: 0.5939527867949647.
[I 2024-11-06 21:45:10,183] Trial 250 finished with value: 0.5934322662235862 and parameters: {'n_estimators': 160, 'max_depth': 7, 'learning_rate': 0.03877866605193088, 'gamma': 4.289622666290826, 'min_child_weight': 7, 'subsample': 0.8596759473930523, 'colsample_bytree': 0.5737359510759309, 'reg_alpha': 0.5176131966935521, 'reg_lambda': 0.7043646326668885}. Best is trial 244 with value: 0.5939527867949647.
[I 2024-11-06 21:45:14,826] Trial 251 finished with value: 0.5929283988253802 and parameters: {'n_estimators': 140, 'max_depth': 7, 'learning_rate': 0.03197271441206916, 'gamma': 4.10234531428442, 'min_child_weight': 7, 'subsample': 0.8415425496197094, 'colsample_bytree': 0.5466739113006391, 'reg_alpha': 0.6690320040420051, 'reg_lambda': 0.6440341535140078}. Best is trial 244 with value: 0.5939527867949647.
[I 2024-11-06 21:45:19,752] Trial 252 finished with value: 0.5928531959044318 and parameters: {'n_estimators': 150, 'max_depth': 7, 'learning_rate': 0.04078335250731943, 'gamma': 2.1435624342749073, 'min_child_weight': 7, 'subsample': 0.87341039980936, 'colsample_bytree': 0.5900613422481172, 'reg_alpha': 0.7551984246692357, 'reg_lambda': 0.7393894248403013}. Best is trial 244 with value: 0.5939527867949647.
[I 2024-11-06 21:45:24,988] Trial 253 finished with value: 0.5924230725095034 and parameters: {'n_estimators': 154, 'max_depth': 7, 'learning_rate': 0.02529207517639792, 'gamma': 4.450836166009494, 'min_child_weight': 8, 'subsample': 0.8817708838596017, 'colsample_bytree': 0.8320787254816356, 'reg_alpha': 0.7137988046352848, 'reg_lambda': 0.922552904496537}. Best is trial 244 with value: 0.5939527867949647.
[I 2024-11-06 21:45:29,482] Trial 254 finished with value: 0.592854101059505 and parameters: {'n_estimators': 168, 'max_depth': 7, 'learning_rate': 0.04839926801459509, 'gamma': 3.9978609138934993, 'min_child_weight': 7, 'subsample': 0.8463361103574369, 'colsample_bytree': 0.5680331493095266, 'reg_alpha': 0.6301768166739934, 'reg_lambda': 0.6907188893842438}. Best is trial 244 with value: 0.5939527867949647.
[I 2024-11-06 21:45:32,464] Trial 255 finished with value: 0.5925853701095097 and parameters: {'n_estimators': 145, 'max_depth': 7, 'learning_rate': 0.2015451459751356, 'gamma': 4.3260439104148265, 'min_child_weight': 7, 'subsample': 0.8687564310143886, 'colsample_bytree': 0.5813324074732846, 'reg_alpha': 0.7011986442248493, 'reg_lambda': 0.7628553241661984}. Best is trial 244 with value: 0.5939527867949647.
[I 2024-11-06 21:45:37,494] Trial 256 finished with value: 0.5925019714630423 and parameters: {'n_estimators': 160, 'max_depth': 7, 'learning_rate': 0.03390855338936644, 'gamma': 4.159237817822363, 'min_child_weight': 7, 'subsample': 0.860698270497162, 'colsample_bytree': 0.5977900755232249, 'reg_alpha': 0.6023378044445349, 'reg_lambda': 0.657785000675341}. Best is trial 244 with value: 0.5939527867949647.
[I 2024-11-06 21:45:42,760] Trial 257 finished with value: 0.5932238684008606 and parameters: {'n_estimators': 152, 'max_depth': 7, 'learning_rate': 0.013491844472866069, 'gamma': 4.480781537152614, 'min_child_weight': 7, 'subsample': 0.8871637029699998, 'colsample_bytree': 0.6778623318000122, 'reg_alpha': 0.7639354203097337, 'reg_lambda': 0.1989973211003151}. Best is trial 244 with value: 0.5939527867949647.
[I 2024-11-06 21:45:47,066] Trial 258 finished with value: 0.5928796400380713 and parameters: {'n_estimators': 164, 'max_depth': 7, 'learning_rate': 0.05454545719497751, 'gamma': 4.245064186646538, 'min_child_weight': 8, 'subsample': 0.8752116404540811, 'colsample_bytree': 0.5494857578642135, 'reg_alpha': 0.736372981095866, 'reg_lambda': 0.7212562036005121}. Best is trial 244 with value: 0.5939527867949647.
