[I 2024-11-06 22:04:48,067] Trial 524 finished with value: 0.5930876787834847 and parameters: {'n_estimators': 59, 'max_depth': 8, 'learning_rate': 0.04335323004982287, 'gamma': 4.12399421705884, 'min_child_weight': 6, 'subsample': 0.8865722186979794, 'colsample_bytree': 0.6011456921278966, 'reg_alpha': 0.6574920936574011, 'reg_lambda': 0.7788831733173792}. Best is trial 520 with value: 0.5940488308041952.
[I 2024-11-06 22:04:51,671] Trial 525 finished with value: 0.5929314863651598 and parameters: {'n_estimators': 94, 'max_depth': 8, 'learning_rate': 0.0526234653108564, 'gamma': 3.9343261120863273, 'min_child_weight': 6, 'subsample': 0.8660760582536211, 'colsample_bytree': 0.6228203038077234, 'reg_alpha': 0.6749712517305756, 'reg_lambda': 0.7548087292848984}. Best is trial 520 with value: 0.5940488308041952.
[I 2024-11-06 22:04:55,005] Trial 526 finished with value: 0.5928187341373496 and parameters: {'n_estimators': 74, 'max_depth': 8, 'learning_rate': 0.0389564463531196, 'gamma': 4.186486005019056, 'min_child_weight': 6, 'subsample': 0.8938802120547381, 'colsample_bytree': 0.6089712703660073, 'reg_alpha': 0.6344856152786515, 'reg_lambda': 0.7576631097085528}. Best is trial 520 with value: 0.5940488308041952.
[I 2024-11-06 22:04:59,573] Trial 527 finished with value: 0.5933083986983552 and parameters: {'n_estimators': 153, 'max_depth': 8, 'learning_rate': 0.04825562445647004, 'gamma': 4.053053477881551, 'min_child_weight': 6, 'subsample': 0.8775399600328454, 'colsample_bytree': 0.6282465244932363, 'reg_alpha': 0.6665654997963674, 'reg_lambda': 0.7709073122264785}. Best is trial 520 with value: 0.5940488308041952.
[I 2024-11-06 22:05:06,444] Trial 528 finished with value: 0.5930908097672993 and parameters: {'n_estimators': 289, 'max_depth': 8, 'learning_rate': 0.05484765691289754, 'gamma': 3.8572489188363903, 'min_child_weight': 6, 'subsample': 0.8561610828294792, 'colsample_bytree': 0.645329421586194, 'reg_alpha': 0.6875448087294487, 'reg_lambda': 0.7452489889068485}. Best is trial 520 with value: 0.5940488308041952.
[I 2024-11-06 22:05:09,954] Trial 529 finished with value: 0.5921698317662962 and parameters: {'n_estimators': 63, 'max_depth': 8, 'learning_rate': 0.031358544894858294, 'gamma': 1.8429854447919947, 'min_child_weight': 6, 'subsample': 0.8678930240012592, 'colsample_bytree': 0.6029401864617766, 'reg_alpha': 0.6149604061283611, 'reg_lambda': 0.7412754145223232}. Best is trial 520 with value: 0.5940488308041952.
[I 2024-11-06 22:05:14,047] Trial 530 finished with value: 0.5932519272536283 and parameters: {'n_estimators': 117, 'max_depth': 8, 'learning_rate': 0.04438568408920289, 'gamma': 4.217350185187345, 'min_child_weight': 6, 'subsample': 0.8802952812845899, 'colsample_bytree': 0.6370754107674365, 'reg_alpha': 0.6538249545523538, 'reg_lambda': 0.7871159480776292}. Best is trial 520 with value: 0.5940488308041952.
[I 2024-11-06 22:05:16,780] Trial 531 finished with value: 0.5928081317469891 and parameters: {'n_estimators': 55, 'max_depth': 8, 'learning_rate': 0.036769179846589485, 'gamma': 4.298887230605638, 'min_child_weight': 6, 'subsample': 0.855106327592934, 'colsample_bytree': 0.6141453621071375, 'reg_alpha': 0.3060947145013836, 'reg_lambda': 0.8105412129099931}. Best is trial 520 with value: 0.5940488308041952.
[I 2024-11-06 22:05:20,821] Trial 532 finished with value: 0.5932746746845613 and parameters: {'n_estimators': 102, 'max_depth': 8, 'learning_rate': 0.05217039362484082, 'gamma': 4.111359985144462, 'min_child_weight': 5, 'subsample': 0.8971905218754949, 'colsample_bytree': 0.6067693585857242, 'reg_alpha': 0.6949746668242616, 'reg_lambda': 0.7897914685369292}. Best is trial 520 with value: 0.5940488308041952.
[I 2024-11-06 22:05:23,788] Trial 533 finished with value: 0.5930537227145376 and parameters: {'n_estimators': 68, 'max_depth': 8, 'learning_rate': 0.047330094721377565, 'gamma': 3.998678488232382, 'min_child_weight': 6, 'subsample': 0.8631190161637033, 'colsample_bytree': 0.5893562996284797, 'reg_alpha': 0.671451893420363, 'reg_lambda': 0.7082339124110791}. Best is trial 520 with value: 0.5940488308041952.
[I 2024-11-06 22:05:27,969] Trial 534 finished with value: 0.592789161152747 and parameters: {'n_estimators': 162, 'max_depth': 8, 'learning_rate': 0.05546413699830782, 'gamma': 3.8633889719826073, 'min_child_weight': 6, 'subsample': 0.8750693018014248, 'colsample_bytree': 0.7208632847408634, 'reg_alpha': 0.694066477932126, 'reg_lambda': 0.7345284335158385}. Best is trial 520 with value: 0.5940488308041952.
[I 2024-11-06 22:05:34,025] Trial 535 finished with value: 0.5934825517570829 and parameters: {'n_estimators': 264, 'max_depth': 8, 'learning_rate': 0.04180277376884936, 'gamma': 4.271701847918084, 'min_child_weight': 5, 'subsample': 0.8869625908815134, 'colsample_bytree': 0.5815737589029816, 'reg_alpha': 0.6401755485101313, 'reg_lambda': 0.7590400416371028}. Best is trial 520 with value: 0.5940488308041952.
[I 2024-11-06 22:05:39,010] Trial 536 finished with value: 0.5932535577164071 and parameters: {'n_estimators': 150, 'max_depth': 8, 'learning_rate': 0.03203072769902342, 'gamma': 3.9516756804339055, 'min_child_weight': 6, 'subsample': 0.8689554963254473, 'colsample_bytree': 0.5697011656413771, 'reg_alpha': 0.6972184109599949, 'reg_lambda': 0.813220163439119}. Best is trial 520 with value: 0.5940488308041952.
[I 2024-11-06 22:05:42,261] Trial 537 finished with value: 0.5934401076349157 and parameters: {'n_estimators': 83, 'max_depth': 8, 'learning_rate': 0.046784425402099185, 'gamma': 4.356920420540083, 'min_child_weight': 6, 'subsample': 0.8541945755818263, 'colsample_bytree': 0.6004992007167257, 'reg_alpha': 0.6691996756094158, 'reg_lambda': 0.7151970139577605}. Best is trial 520 with value: 0.5940488308041952.
[I 2024-11-06 22:05:46,507] Trial 538 finished with value: 0.593108767147527 and parameters: {'n_estimators': 157, 'max_depth': 8, 'learning_rate': 0.05794036262402325, 'gamma': 4.118630386566158, 'min_child_weight': 6, 'subsample': 0.8802367956323734, 'colsample_bytree': 0.631218963348123, 'reg_alpha': 0.7115828810611471, 'reg_lambda': 0.8049319774437861}. Best is trial 520 with value: 0.5940488308041952.
[I 2024-11-06 22:05:51,754] Trial 539 finished with value: 0.5929808867826573 and parameters: {'n_estimators': 154, 'max_depth': 8, 'learning_rate': 0.036023198467399306, 'gamma': 3.781554909447618, 'min_child_weight': 5, 'subsample': 0.8622997861656606, 'colsample_bytree': 0.5780402016992809, 'reg_alpha': 0.6214815754430046, 'reg_lambda': 0.703114847812994}. Best is trial 520 with value: 0.5940488308041952.
[I 2024-11-06 22:05:55,332] Trial 540 finished with value: 0.5926656025699396 and parameters: {'n_estimators': 88, 'max_depth': 8, 'learning_rate': 0.051906898604694954, 'gamma': 4.223391550954463, 'min_child_weight': 6, 'subsample': 0.8919383416946856, 'colsample_bytree': 0.5639048115755879, 'reg_alpha': 0.6460700021736935, 'reg_lambda': 0.731571551102223}. Best is trial 520 with value: 0.5940488308041952.
[I 2024-11-06 22:05:59,233] Trial 541 finished with value: 0.5936137431111935 and parameters: {'n_estimators': 148, 'max_depth': 8, 'learning_rate': 0.06474481781254823, 'gamma': 4.4742967446883455, 'min_child_weight': 5, 'subsample': 0.8520111522540751, 'colsample_bytree': 0.5923103008670775, 'reg_alpha': 0.35459008584789226, 'reg_lambda': 0.8004218026313292}. Best is trial 520 with value: 0.5940488308041952.
[I 2024-11-06 22:06:05,827] Trial 542 finished with value: 0.5925898645099569 and parameters: {'n_estimators': 160, 'max_depth': 8, 'learning_rate': 0.04141924728960035, 'gamma': 2.5521857824696026, 'min_child_weight': 6, 'subsample': 0.8726011377412525, 'colsample_bytree': 0.5324547372043532, 'reg_alpha': 0.6803146161748411, 'reg_lambda': 0.6883305336548615}. Best is trial 520 with value: 0.5940488308041952.
[I 2024-11-06 22:06:09,819] Trial 543 finished with value: 0.5932248334748893 and parameters: {'n_estimators': 110, 'max_depth': 8, 'learning_rate': 0.04725945599820828, 'gamma': 4.034931735659476, 'min_child_weight': 6, 'subsample': 0.9014840383634868, 'colsample_bytree': 0.6081087887390788, 'reg_alpha': 0.7021726919848463, 'reg_lambda': 0.9471602924070489}. Best is trial 520 with value: 0.5940488308041952.
[I 2024-11-06 22:06:14,241] Trial 544 finished with value: 0.593132938304096 and parameters: {'n_estimators': 146, 'max_depth': 8, 'learning_rate': 0.057548620782018, 'gamma': 3.8987020388337963, 'min_child_weight': 6, 'subsample': 0.7714901725819439, 'colsample_bytree': 0.6147632518585271, 'reg_alpha': 0.6577913918082309, 'reg_lambda': 0.7105795750431291}. Best is trial 520 with value: 0.5940488308041952.
[I 2024-11-06 22:06:19,824] Trial 545 finished with value: 0.5931272123173686 and parameters: {'n_estimators': 152, 'max_depth': 9, 'learning_rate': 0.033500275483330955, 'gamma': 4.33733155384391, 'min_child_weight': 6, 'subsample': 0.8595322584258029, 'colsample_bytree': 0.5763051813940527, 'reg_alpha': 0.5996470320239283, 'reg_lambda': 0.7610813498690063}. Best is trial 520 with value: 0.5940488308041952.
[I 2024-11-06 22:06:23,819] Trial 546 finished with value: 0.5928238770467742 and parameters: {'n_estimators': 251, 'max_depth': 8, 'learning_rate': 0.16393400156570279, 'gamma': 4.15096629147693, 'min_child_weight': 5, 'subsample': 0.8841309612990892, 'colsample_bytree': 0.5528502823234063, 'reg_alpha': 0.7059878618250155, 'reg_lambda': 0.6860031947392824}. Best is trial 520 with value: 0.5940488308041952.
[I 2024-11-06 22:06:28,408] Trial 547 finished with value: 0.5927703139393565 and parameters: {'n_estimators': 143, 'max_depth': 8, 'learning_rate': 0.051846296881205504, 'gamma': 3.8239887332979423, 'min_child_weight': 6, 'subsample': 0.8679053214721456, 'colsample_bytree': 0.5643683595321313, 'reg_alpha': 0.6735268689044382, 'reg_lambda': 0.729388135550814}. Best is trial 520 with value: 0.5940488308041952.
[I 2024-11-06 22:06:34,569] Trial 548 finished with value: 0.5928128402720491 and parameters: {'n_estimators': 270, 'max_depth': 8, 'learning_rate': 0.042702156957923815, 'gamma': 3.755150458364192, 'min_child_weight': 6, 'subsample': 0.8516768777107104, 'colsample_bytree': 0.5896586069888909, 'reg_alpha': 0.4126806697292492, 'reg_lambda': 0.6882531665481812}. Best is trial 520 with value: 0.5940488308041952.
[I 2024-11-06 22:06:37,485] Trial 549 finished with value: 0.5928192253412462 and parameters: {'n_estimators': 164, 'max_depth': 8, 'learning_rate': 0.25770836525874496, 'gamma': 4.4289690712770104, 'min_child_weight': 5, 'subsample': 0.8789388311534599, 'colsample_bytree': 0.5415194770248912, 'reg_alpha': 0.6938677741806493, 'reg_lambda': 0.7038291993442208}. Best is trial 520 with value: 0.5940488308041952.
[I 2024-11-06 22:06:40,927] Trial 550 finished with value: 0.5932258810540356 and parameters: {'n_estimators': 149, 'max_depth': 6, 'learning_rate': 0.06708482199163456, 'gamma': 4.062501660196906, 'min_child_weight': 6, 'subsample': 0.8639010315030846, 'colsample_bytree': 0.5976684122615967, 'reg_alpha': 0.632706221132295, 'reg_lambda': 0.6639716210893954}. Best is trial 520 with value: 0.5940488308041952.
[I 2024-11-06 22:06:47,144] Trial 551 finished with value: 0.5933795669683091 and parameters: {'n_estimators': 159, 'max_depth': 8, 'learning_rate': 0.015070554502780501, 'gamma': 4.2506832684499685, 'min_child_weight': 6, 'subsample': 0.8920092751163693, 'colsample_bytree': 0.6195873374309746, 'reg_alpha': 0.721944897721445, 'reg_lambda': 0.7389331458153516}. Best is trial 520 with value: 0.5940488308041952.
[I 2024-11-06 22:06:51,241] Trial 552 finished with value: 0.5926931394202217 and parameters: {'n_estimators': 154, 'max_depth': 8, 'learning_rate': 0.0594994398854939, 'gamma': 4.134159890329493, 'min_child_weight': 6, 'subsample': 0.8492553373048591, 'colsample_bytree': 0.584445176901514, 'reg_alpha': 0.5891557448332334, 'reg_lambda': 0.7537080413784609}. Best is trial 520 with value: 0.5940488308041952.
[I 2024-11-06 22:06:54,475] Trial 553 finished with value: 0.5931818210802594 and parameters: {'n_estimators': 137, 'max_depth': 8, 'learning_rate': 0.1208336407134655, 'gamma': 3.9650016246629622, 'min_child_weight': 5, 'subsample': 0.8723470092335825, 'colsample_bytree': 0.568545547721476, 'reg_alpha': 0.6592507568908104, 'reg_lambda': 0.7183872588768062}. Best is trial 520 with value: 0.5940488308041952.
[I 2024-11-06 22:06:59,152] Trial 554 finished with value: 0.5932633024715996 and parameters: {'n_estimators': 147, 'max_depth': 8, 'learning_rate': 0.0394068154610743, 'gamma': 4.344111200275044, 'min_child_weight': 6, 'subsample': 0.8599917892647401, 'colsample_bytree': 0.5302988802364532, 'reg_alpha': 0.7153236393572157, 'reg_lambda': 0.6724933960457933}. Best is trial 520 with value: 0.5940488308041952.
[I 2024-11-06 22:07:03,593] Trial 555 finished with value: 0.5937367954493956 and parameters: {'n_estimators': 142, 'max_depth': 6, 'learning_rate': 0.04860449449163257, 'gamma': 4.516962323894844, 'min_child_weight': 2, 'subsample': 0.8808321252554676, 'colsample_bytree': 0.5510667723770748, 'reg_alpha': 0.6828649664894607, 'reg_lambda': 0.7769814454266237}. Best is trial 520 with value: 0.5940488308041952.
[I 2024-11-06 22:07:07,454] Trial 556 finished with value: 0.5932920377536457 and parameters: {'n_estimators': 127, 'max_depth': 7, 'learning_rate': 0.05234798188064917, 'gamma': 4.548706872262594, 'min_child_weight': 5, 'subsample': 0.8972080629363309, 'colsample_bytree': 0.5529486547781547, 'reg_alpha': 0.7120980547211807, 'reg_lambda': 0.7014821687569113}. Best is trial 520 with value: 0.5940488308041952.
[I 2024-11-06 22:07:11,751] Trial 557 finished with value: 0.5934892520483728 and parameters: {'n_estimators': 131, 'max_depth': 6, 'learning_rate': 0.02883590137560955, 'gamma': 4.501999698475894, 'min_child_weight': 8, 'subsample': 0.8875742401734763, 'colsample_bytree': 0.5416028412978319, 'reg_alpha': 0.6836875985269918, 'reg_lambda': 0.6616087727941458}. Best is trial 520 with value: 0.5940488308041952.
[I 2024-11-06 22:07:15,452] Trial 558 finished with value: 0.5927260768006114 and parameters: {'n_estimators': 136, 'max_depth': 6, 'learning_rate': 0.0619864075977283, 'gamma': 4.578127460021419, 'min_child_weight': 5, 'subsample': 0.8812559695904929, 'colsample_bytree': 0.5556375296755816, 'reg_alpha': 0.6973820398876952, 'reg_lambda': 0.6948774613859161}. Best is trial 520 with value: 0.5940488308041952.
[I 2024-11-06 22:07:19,073] Trial 559 finished with value: 0.5927471850207665 and parameters: {'n_estimators': 140, 'max_depth': 6, 'learning_rate': 0.05591408114469358, 'gamma': 4.44975747388247, 'min_child_weight': 3, 'subsample': 0.9017923742533809, 'colsample_bytree': 0.5384977182956295, 'reg_alpha': 0.7273721043369326, 'reg_lambda': 0.7171811394667265}. Best is trial 520 with value: 0.5940488308041952.
[I 2024-11-06 22:07:22,780] Trial 560 finished with value: 0.5932701262979823 and parameters: {'n_estimators': 133, 'max_depth': 6, 'learning_rate': 0.04909658542355537, 'gamma': 4.39647511031344, 'min_child_weight': 1, 'subsample': 0.8760552536764861, 'colsample_bytree': 0.561686110899954, 'reg_alpha': 0.6958129134582113, 'reg_lambda': 0.7389844757574976}. Best is trial 520 with value: 0.5940488308041952.
[I 2024-11-06 22:07:27,122] Trial 561 finished with value: 0.5931303185043845 and parameters: {'n_estimators': 142, 'max_depth': 6, 'learning_rate': 0.03657008846560087, 'gamma': 4.605025807905333, 'min_child_weight': 1, 'subsample': 0.8897170333330798, 'colsample_bytree': 0.5478392096278094, 'reg_alpha': 0.6796413080467476, 'reg_lambda': 0.6806911928807525}. Best is trial 520 with value: 0.5940488308041952.
[I 2024-11-06 22:07:31,442] Trial 562 finished with value: 0.5927924735102552 and parameters: {'n_estimators': 137, 'max_depth': 6, 'learning_rate': 0.043746829106955695, 'gamma': 3.6974170452837245, 'min_child_weight': 2, 'subsample': 0.9101940934911802, 'colsample_bytree': 0.5297595992875596, 'reg_alpha': 0.8047366523702977, 'reg_lambda': 0.6521376347052786}. Best is trial 520 with value: 0.5940488308041952.
[I 2024-11-06 22:07:34,466] Trial 563 finished with value: 0.5935878314633929 and parameters: {'n_estimators': 122, 'max_depth': 6, 'learning_rate': 0.06818900618995168, 'gamma': 4.485155978724087, 'min_child_weight': 3, 'subsample': 0.8728997063918, 'colsample_bytree': 0.5741921570641236, 'reg_alpha': 0.7190559710412477, 'reg_lambda': 0.9997808938058871}. Best is trial 520 with value: 0.5940488308041952.
[I 2024-11-06 22:07:39,143] Trial 564 finished with value: 0.5926408610160256 and parameters: {'n_estimators': 145, 'max_depth': 6, 'learning_rate': 0.019895367487736064, 'gamma': 4.318821526252949, 'min_child_weight': 2, 'subsample': 0.8856522069745576, 'colsample_bytree': 0.5631053896502043, 'reg_alpha': 0.6391997071558753, 'reg_lambda': 0.7652436589413392}. Best is trial 520 with value: 0.5940488308041952.
[I 2024-11-06 22:07:42,506] Trial 565 finished with value: 0.5932328836726002 and parameters: {'n_estimators': 129, 'max_depth': 7, 'learning_rate': 0.05269316174181287, 'gamma': 4.623463611779447, 'min_child_weight': 4, 'subsample': 0.8690409200116428, 'colsample_bytree': 0.5496406262832193, 'reg_alpha': 0.735712686441705, 'reg_lambda': 0.7287847400579011}. Best is trial 520 with value: 0.5940488308041952.
[I 2024-11-06 22:07:45,523] Trial 566 finished with value: 0.5927926156101166 and parameters: {'n_estimators': 142, 'max_depth': 6, 'learning_rate': 0.10228435499248797, 'gamma': 4.400443477556961, 'min_child_weight': 1, 'subsample': 0.8801098424135614, 'colsample_bytree': 0.5430776204955992, 'reg_alpha': 0.38128416185062103, 'reg_lambda': 0.6848567949475108}. Best is trial 520 with value: 0.5940488308041952.
[I 2024-11-06 22:07:49,189] Trial 567 finished with value: 0.5929314673776636 and parameters: {'n_estimators': 151, 'max_depth': 6, 'learning_rate': 0.05884229263298077, 'gamma': 4.265505597290818, 'min_child_weight': 5, 'subsample': 0.8961594933576948, 'colsample_bytree': 0.5580698661556911, 'reg_alpha': 0.6746143441350432, 'reg_lambda': 0.6986892941619793}. Best is trial 520 with value: 0.5940488308041952.
[I 2024-11-06 22:07:53,834] Trial 568 finished with value: 0.59254959817523 and parameters: {'n_estimators': 137, 'max_depth': 6, 'learning_rate': 0.07617791493413338, 'gamma': 0.3326841816933963, 'min_child_weight': 2, 'subsample': 0.8659919693731198, 'colsample_bytree': 0.5751619684964554, 'reg_alpha': 0.7044836907691486, 'reg_lambda': 0.6657674058699062}. Best is trial 520 with value: 0.5940488308041952.
[I 2024-11-06 22:07:58,368] Trial 569 finished with value: 0.592635684871225 and parameters: {'n_estimators': 145, 'max_depth': 9, 'learning_rate': 0.04761005479353584, 'gamma': 3.7701507561105863, 'min_child_weight': 3, 'subsample': 0.8790352630382322, 'colsample_bytree': 0.5354495625309327, 'reg_alpha': 0.7880650191885908, 'reg_lambda': 0.6302744504848418}. Best is trial 520 with value: 0.5940488308041952.
[I 2024-11-06 22:08:03,457] Trial 570 finished with value: 0.5928401765593423 and parameters: {'n_estimators': 133, 'max_depth': 7, 'learning_rate': 0.039733320448050294, 'gamma': 3.660346214265548, 'min_child_weight': 2, 'subsample': 0.5002531139929106, 'colsample_bytree': 0.5660353334006275, 'reg_alpha': 0.6165058093541824, 'reg_lambda': 0.7492926688406005}. Best is trial 520 with value: 0.5940488308041952.
[I 2024-11-06 22:08:08,019] Trial 571 finished with value: 0.5927507275333764 and parameters: {'n_estimators': 156, 'max_depth': 4, 'learning_rate': 0.02587979724987236, 'gamma': 2.9943738315156665, 'min_child_weight': 7, 'subsample': 0.847300244600712, 'colsample_bytree': 0.5231994281301605, 'reg_alpha': 0.6893537935879867, 'reg_lambda': 0.7169208208750936}. Best is trial 520 with value: 0.5940488308041952.
[I 2024-11-06 22:08:12,122] Trial 572 finished with value: 0.5927718992401012 and parameters: {'n_estimators': 151, 'max_depth': 5, 'learning_rate': 0.033336965654330766, 'gamma': 4.517767784137414, 'min_child_weight': 7, 'subsample': 0.8710648247277433, 'colsample_bytree': 0.8456079670186145, 'reg_alpha': 0.7469580829614747, 'reg_lambda': 0.6556669818307962}. Best is trial 520 with value: 0.5940488308041952.
[I 2024-11-06 22:08:15,688] Trial 573 finished with value: 0.5931347230540615 and parameters: {'n_estimators': 141, 'max_depth': 6, 'learning_rate': 0.05621998213754642, 'gamma': 4.207275720863609, 'min_child_weight': 8, 'subsample': 0.9048405983972233, 'colsample_bytree': 0.5525628862473307, 'reg_alpha': 0.721716585384101, 'reg_lambda': 0.6778566201743029}. Best is trial 520 with value: 0.5940488308041952.
[I 2024-11-06 22:08:19,513] Trial 574 finished with value: 0.5937780179867038 and parameters: {'n_estimators': 148, 'max_depth': 7, 'learning_rate': 0.05010799289405779, 'gamma': 3.8610671177664084, 'min_child_weight': 7, 'subsample': 0.8906988732530827, 'colsample_bytree': 0.5821342552540477, 'reg_alpha': 0.669456839370964, 'reg_lambda': 0.7939391138379315}. Best is trial 520 with value: 0.5940488308041952.
[I 2024-11-06 22:08:23,955] Trial 575 finished with value: 0.5928999416963612 and parameters: {'n_estimators': 155, 'max_depth': 7, 'learning_rate': 0.041266743947496715, 'gamma': 3.870031561855872, 'min_child_weight': 2, 'subsample': 0.8936121557472413, 'colsample_bytree': 0.5837179531444483, 'reg_alpha': 0.6513776484550714, 'reg_lambda': 0.8488252187724492}. Best is trial 520 with value: 0.5940488308041952.
[I 2024-11-06 22:08:27,651] Trial 576 finished with value: 0.5929531570047633 and parameters: {'n_estimators': 148, 'max_depth': 5, 'learning_rate': 0.048028762207531626, 'gamma': 3.9875369162126595, 'min_child_weight': 6, 'subsample': 0.9145463132035468, 'colsample_bytree': 0.5940103236995323, 'reg_alpha': 0.6735032867950554, 'reg_lambda': 0.3989181750938908}. Best is trial 520 with value: 0.5940488308041952.
