[I 2024-11-07 01:58:58,094] Trial 109 finished with value: 0.5938533249875018 and parameters: {'iterations': 915, 'learning_rate': 0.2065761486962596, 'depth': 6, 'l2_leaf_reg': 2.034569414450077}. Best is trial 56 with value: 0.5955351412315192.
/anaconda/envs/py38_default/lib/python3.9/site-packages/catboost/core.py:1102: FutureWarning: iteritems is deprecated and will be removed in a future version. Use .items instead.
  self._init_pool(data, label, cat_features, text_features, embedding_features, pairs, weight, group_id, group_weight, subgroup_id, pairs_weight, baseline, feature_names, thread_count)
/anaconda/envs/py38_default/lib/python3.9/site-packages/catboost/core.py:1102: FutureWarning: iteritems is deprecated and will be removed in a future version. Use .items instead.
  self._init_pool(data, label, cat_features, text_features, embedding_features, pairs, weight, group_id, group_weight, subgroup_id, pairs_weight, baseline, feature_names, thread_count)
/anaconda/envs/py38_default/lib/python3.9/site-packages/catboost/core.py:1102: FutureWarning: iteritems is deprecated and will be removed in a future version. Use .items instead.
  self._init_pool(data, label, cat_features, text_features, embedding_features, pairs, weight, group_id, group_weight, subgroup_id, pairs_weight, baseline, feature_names, thread_count)
/anaconda/envs/py38_default/lib/python3.9/site-packages/catboost/core.py:1102: FutureWarning: iteritems is deprecated and will be removed in a future version. Use .items instead.
  self._init_pool(data, label, cat_features, text_features, embedding_features, pairs, weight, group_id, group_weight, subgroup_id, pairs_weight, baseline, feature_names, thread_count)
/anaconda/envs/py38_default/lib/python3.9/site-packages/catboost/core.py:1102: FutureWarning: iteritems is deprecated and will be removed in a future version. Use .items instead.
  self._init_pool(data, label, cat_features, text_features, embedding_features, pairs, weight, group_id, group_weight, subgroup_id, pairs_weight, baseline, feature_names, thread_count)
[I 2024-11-07 02:00:41,298] Trial 110 finished with value: 0.5944283350439179 and parameters: {'iterations': 803, 'learning_rate': 0.23177890556296382, 'depth': 5, 'l2_leaf_reg': 5.164288308263591}. Best is trial 56 with value: 0.5955351412315192.
/anaconda/envs/py38_default/lib/python3.9/site-packages/catboost/core.py:1102: FutureWarning: iteritems is deprecated and will be removed in a future version. Use .items instead.
  self._init_pool(data, label, cat_features, text_features, embedding_features, pairs, weight, group_id, group_weight, subgroup_id, pairs_weight, baseline, feature_names, thread_count)
/anaconda/envs/py38_default/lib/python3.9/site-packages/catboost/core.py:1102: FutureWarning: iteritems is deprecated and will be removed in a future version. Use .items instead.
  self._init_pool(data, label, cat_features, text_features, embedding_features, pairs, weight, group_id, group_weight, subgroup_id, pairs_weight, baseline, feature_names, thread_count)
/anaconda/envs/py38_default/lib/python3.9/site-packages/catboost/core.py:1102: FutureWarning: iteritems is deprecated and will be removed in a future version. Use .items instead.
  self._init_pool(data, label, cat_features, text_features, embedding_features, pairs, weight, group_id, group_weight, subgroup_id, pairs_weight, baseline, feature_names, thread_count)
/anaconda/envs/py38_default/lib/python3.9/site-packages/catboost/core.py:1102: FutureWarning: iteritems is deprecated and will be removed in a future version. Use .items instead.
  self._init_pool(data, label, cat_features, text_features, embedding_features, pairs, weight, group_id, group_weight, subgroup_id, pairs_weight, baseline, feature_names, thread_count)
/anaconda/envs/py38_default/lib/python3.9/site-packages/catboost/core.py:1102: FutureWarning: iteritems is deprecated and will be removed in a future version. Use .items instead.
  self._init_pool(data, label, cat_features, text_features, embedding_features, pairs, weight, group_id, group_weight, subgroup_id, pairs_weight, baseline, feature_names, thread_count)
[I 2024-11-07 02:02:34,254] Trial 111 finished with value: 0.5920399310859668 and parameters: {'iterations': 878, 'learning_rate': 0.1922868460991871, 'depth': 5, 'l2_leaf_reg': 1.3806570509882505}. Best is trial 56 with value: 0.5955351412315192.
/anaconda/envs/py38_default/lib/python3.9/site-packages/catboost/core.py:1102: FutureWarning: iteritems is deprecated and will be removed in a future version. Use .items instead.
  self._init_pool(data, label, cat_features, text_features, embedding_features, pairs, weight, group_id, group_weight, subgroup_id, pairs_weight, baseline, feature_names, thread_count)
/anaconda/envs/py38_default/lib/python3.9/site-packages/catboost/core.py:1102: FutureWarning: iteritems is deprecated and will be removed in a future version. Use .items instead.
  self._init_pool(data, label, cat_features, text_features, embedding_features, pairs, weight, group_id, group_weight, subgroup_id, pairs_weight, baseline, feature_names, thread_count)
/anaconda/envs/py38_default/lib/python3.9/site-packages/catboost/core.py:1102: FutureWarning: iteritems is deprecated and will be removed in a future version. Use .items instead.
  self._init_pool(data, label, cat_features, text_features, embedding_features, pairs, weight, group_id, group_weight, subgroup_id, pairs_weight, baseline, feature_names, thread_count)
/anaconda/envs/py38_default/lib/python3.9/site-packages/catboost/core.py:1102: FutureWarning: iteritems is deprecated and will be removed in a future version. Use .items instead.
  self._init_pool(data, label, cat_features, text_features, embedding_features, pairs, weight, group_id, group_weight, subgroup_id, pairs_weight, baseline, feature_names, thread_count)
/anaconda/envs/py38_default/lib/python3.9/site-packages/catboost/core.py:1102: FutureWarning: iteritems is deprecated and will be removed in a future version. Use .items instead.
  self._init_pool(data, label, cat_features, text_features, embedding_features, pairs, weight, group_id, group_weight, subgroup_id, pairs_weight, baseline, feature_names, thread_count)
[I 2024-11-07 02:04:27,656] Trial 112 finished with value: 0.5942996106949505 and parameters: {'iterations': 887, 'learning_rate': 0.17625394517775525, 'depth': 5, 'l2_leaf_reg': 1.7632108010867387}. Best is trial 56 with value: 0.5955351412315192.
/anaconda/envs/py38_default/lib/python3.9/site-packages/catboost/core.py:1102: FutureWarning: iteritems is deprecated and will be removed in a future version. Use .items instead.
  self._init_pool(data, label, cat_features, text_features, embedding_features, pairs, weight, group_id, group_weight, subgroup_id, pairs_weight, baseline, feature_names, thread_count)
/anaconda/envs/py38_default/lib/python3.9/site-packages/catboost/core.py:1102: FutureWarning: iteritems is deprecated and will be removed in a future version. Use .items instead.
  self._init_pool(data, label, cat_features, text_features, embedding_features, pairs, weight, group_id, group_weight, subgroup_id, pairs_weight, baseline, feature_names, thread_count)
/anaconda/envs/py38_default/lib/python3.9/site-packages/catboost/core.py:1102: FutureWarning: iteritems is deprecated and will be removed in a future version. Use .items instead.
  self._init_pool(data, label, cat_features, text_features, embedding_features, pairs, weight, group_id, group_weight, subgroup_id, pairs_weight, baseline, feature_names, thread_count)
/anaconda/envs/py38_default/lib/python3.9/site-packages/catboost/core.py:1102: FutureWarning: iteritems is deprecated and will be removed in a future version. Use .items instead.
  self._init_pool(data, label, cat_features, text_features, embedding_features, pairs, weight, group_id, group_weight, subgroup_id, pairs_weight, baseline, feature_names, thread_count)
/anaconda/envs/py38_default/lib/python3.9/site-packages/catboost/core.py:1102: FutureWarning: iteritems is deprecated and will be removed in a future version. Use .items instead.
  self._init_pool(data, label, cat_features, text_features, embedding_features, pairs, weight, group_id, group_weight, subgroup_id, pairs_weight, baseline, feature_names, thread_count)
[I 2024-11-07 02:06:17,084] Trial 113 finished with value: 0.5945985783634662 and parameters: {'iterations': 861, 'learning_rate': 0.19400756341637254, 'depth': 5, 'l2_leaf_reg': 1.2620207391554712}. Best is trial 56 with value: 0.5955351412315192.
/anaconda/envs/py38_default/lib/python3.9/site-packages/catboost/core.py:1102: FutureWarning: iteritems is deprecated and will be removed in a future version. Use .items instead.
  self._init_pool(data, label, cat_features, text_features, embedding_features, pairs, weight, group_id, group_weight, subgroup_id, pairs_weight, baseline, feature_names, thread_count)
/anaconda/envs/py38_default/lib/python3.9/site-packages/catboost/core.py:1102: FutureWarning: iteritems is deprecated and will be removed in a future version. Use .items instead.
  self._init_pool(data, label, cat_features, text_features, embedding_features, pairs, weight, group_id, group_weight, subgroup_id, pairs_weight, baseline, feature_names, thread_count)
/anaconda/envs/py38_default/lib/python3.9/site-packages/catboost/core.py:1102: FutureWarning: iteritems is deprecated and will be removed in a future version. Use .items instead.
  self._init_pool(data, label, cat_features, text_features, embedding_features, pairs, weight, group_id, group_weight, subgroup_id, pairs_weight, baseline, feature_names, thread_count)
/anaconda/envs/py38_default/lib/python3.9/site-packages/catboost/core.py:1102: FutureWarning: iteritems is deprecated and will be removed in a future version. Use .items instead.
  self._init_pool(data, label, cat_features, text_features, embedding_features, pairs, weight, group_id, group_weight, subgroup_id, pairs_weight, baseline, feature_names, thread_count)
/anaconda/envs/py38_default/lib/python3.9/site-packages/catboost/core.py:1102: FutureWarning: iteritems is deprecated and will be removed in a future version. Use .items instead.
  self._init_pool(data, label, cat_features, text_features, embedding_features, pairs, weight, group_id, group_weight, subgroup_id, pairs_weight, baseline, feature_names, thread_count)
[I 2024-11-07 02:08:07,342] Trial 114 finished with value: 0.5943374642298542 and parameters: {'iterations': 862, 'learning_rate': 0.19971269312197173, 'depth': 5, 'l2_leaf_reg': 1.523761661498387}. Best is trial 56 with value: 0.5955351412315192.
/anaconda/envs/py38_default/lib/python3.9/site-packages/catboost/core.py:1102: FutureWarning: iteritems is deprecated and will be removed in a future version. Use .items instead.
  self._init_pool(data, label, cat_features, text_features, embedding_features, pairs, weight, group_id, group_weight, subgroup_id, pairs_weight, baseline, feature_names, thread_count)
/anaconda/envs/py38_default/lib/python3.9/site-packages/catboost/core.py:1102: FutureWarning: iteritems is deprecated and will be removed in a future version. Use .items instead.
  self._init_pool(data, label, cat_features, text_features, embedding_features, pairs, weight, group_id, group_weight, subgroup_id, pairs_weight, baseline, feature_names, thread_count)
/anaconda/envs/py38_default/lib/python3.9/site-packages/catboost/core.py:1102: FutureWarning: iteritems is deprecated and will be removed in a future version. Use .items instead.
  self._init_pool(data, label, cat_features, text_features, embedding_features, pairs, weight, group_id, group_weight, subgroup_id, pairs_weight, baseline, feature_names, thread_count)
/anaconda/envs/py38_default/lib/python3.9/site-packages/catboost/core.py:1102: FutureWarning: iteritems is deprecated and will be removed in a future version. Use .items instead.
  self._init_pool(data, label, cat_features, text_features, embedding_features, pairs, weight, group_id, group_weight, subgroup_id, pairs_weight, baseline, feature_names, thread_count)
/anaconda/envs/py38_default/lib/python3.9/site-packages/catboost/core.py:1102: FutureWarning: iteritems is deprecated and will be removed in a future version. Use .items instead.
  self._init_pool(data, label, cat_features, text_features, embedding_features, pairs, weight, group_id, group_weight, subgroup_id, pairs_weight, baseline, feature_names, thread_count)
[I 2024-11-07 02:10:03,806] Trial 115 finished with value: 0.593687673004714 and parameters: {'iterations': 903, 'learning_rate': 0.24554856357167323, 'depth': 5, 'l2_leaf_reg': 1.003841052484232}. Best is trial 56 with value: 0.5955351412315192.
/anaconda/envs/py38_default/lib/python3.9/site-packages/catboost/core.py:1102: FutureWarning: iteritems is deprecated and will be removed in a future version. Use .items instead.
  self._init_pool(data, label, cat_features, text_features, embedding_features, pairs, weight, group_id, group_weight, subgroup_id, pairs_weight, baseline, feature_names, thread_count)
/anaconda/envs/py38_default/lib/python3.9/site-packages/catboost/core.py:1102: FutureWarning: iteritems is deprecated and will be removed in a future version. Use .items instead.
  self._init_pool(data, label, cat_features, text_features, embedding_features, pairs, weight, group_id, group_weight, subgroup_id, pairs_weight, baseline, feature_names, thread_count)
/anaconda/envs/py38_default/lib/python3.9/site-packages/catboost/core.py:1102: FutureWarning: iteritems is deprecated and will be removed in a future version. Use .items instead.
  self._init_pool(data, label, cat_features, text_features, embedding_features, pairs, weight, group_id, group_weight, subgroup_id, pairs_weight, baseline, feature_names, thread_count)
/anaconda/envs/py38_default/lib/python3.9/site-packages/catboost/core.py:1102: FutureWarning: iteritems is deprecated and will be removed in a future version. Use .items instead.
  self._init_pool(data, label, cat_features, text_features, embedding_features, pairs, weight, group_id, group_weight, subgroup_id, pairs_weight, baseline, feature_names, thread_count)
/anaconda/envs/py38_default/lib/python3.9/site-packages/catboost/core.py:1102: FutureWarning: iteritems is deprecated and will be removed in a future version. Use .items instead.
  self._init_pool(data, label, cat_features, text_features, embedding_features, pairs, weight, group_id, group_weight, subgroup_id, pairs_weight, baseline, feature_names, thread_count)
[I 2024-11-07 02:12:47,462] Trial 116 finished with value: 0.5950077058302785 and parameters: {'iterations': 753, 'learning_rate': 0.2156870703389021, 'depth': 8, 'l2_leaf_reg': 1.246683588619926}. Best is trial 56 with value: 0.5955351412315192.
/anaconda/envs/py38_default/lib/python3.9/site-packages/catboost/core.py:1102: FutureWarning: iteritems is deprecated and will be removed in a future version. Use .items instead.
  self._init_pool(data, label, cat_features, text_features, embedding_features, pairs, weight, group_id, group_weight, subgroup_id, pairs_weight, baseline, feature_names, thread_count)
/anaconda/envs/py38_default/lib/python3.9/site-packages/catboost/core.py:1102: FutureWarning: iteritems is deprecated and will be removed in a future version. Use .items instead.
  self._init_pool(data, label, cat_features, text_features, embedding_features, pairs, weight, group_id, group_weight, subgroup_id, pairs_weight, baseline, feature_names, thread_count)
/anaconda/envs/py38_default/lib/python3.9/site-packages/catboost/core.py:1102: FutureWarning: iteritems is deprecated and will be removed in a future version. Use .items instead.
  self._init_pool(data, label, cat_features, text_features, embedding_features, pairs, weight, group_id, group_weight, subgroup_id, pairs_weight, baseline, feature_names, thread_count)
/anaconda/envs/py38_default/lib/python3.9/site-packages/catboost/core.py:1102: FutureWarning: iteritems is deprecated and will be removed in a future version. Use .items instead.
  self._init_pool(data, label, cat_features, text_features, embedding_features, pairs, weight, group_id, group_weight, subgroup_id, pairs_weight, baseline, feature_names, thread_count)
/anaconda/envs/py38_default/lib/python3.9/site-packages/catboost/core.py:1102: FutureWarning: iteritems is deprecated and will be removed in a future version. Use .items instead.
  self._init_pool(data, label, cat_features, text_features, embedding_features, pairs, weight, group_id, group_weight, subgroup_id, pairs_weight, baseline, feature_names, thread_count)
[I 2024-11-07 02:17:06,540] Trial 117 finished with value: 0.5910767025342774 and parameters: {'iterations': 849, 'learning_rate': 0.20940478925673806, 'depth': 9, 'l2_leaf_reg': 1.7190159305358041}. Best is trial 56 with value: 0.5955351412315192.
/anaconda/envs/py38_default/lib/python3.9/site-packages/catboost/core.py:1102: FutureWarning: iteritems is deprecated and will be removed in a future version. Use .items instead.
  self._init_pool(data, label, cat_features, text_features, embedding_features, pairs, weight, group_id, group_weight, subgroup_id, pairs_weight, baseline, feature_names, thread_count)
/anaconda/envs/py38_default/lib/python3.9/site-packages/catboost/core.py:1102: FutureWarning: iteritems is deprecated and will be removed in a future version. Use .items instead.
  self._init_pool(data, label, cat_features, text_features, embedding_features, pairs, weight, group_id, group_weight, subgroup_id, pairs_weight, baseline, feature_names, thread_count)
/anaconda/envs/py38_default/lib/python3.9/site-packages/catboost/core.py:1102: FutureWarning: iteritems is deprecated and will be removed in a future version. Use .items instead.
  self._init_pool(data, label, cat_features, text_features, embedding_features, pairs, weight, group_id, group_weight, subgroup_id, pairs_weight, baseline, feature_names, thread_count)
/anaconda/envs/py38_default/lib/python3.9/site-packages/catboost/core.py:1102: FutureWarning: iteritems is deprecated and will be removed in a future version. Use .items instead.
  self._init_pool(data, label, cat_features, text_features, embedding_features, pairs, weight, group_id, group_weight, subgroup_id, pairs_weight, baseline, feature_names, thread_count)
/anaconda/envs/py38_default/lib/python3.9/site-packages/catboost/core.py:1102: FutureWarning: iteritems is deprecated and will be removed in a future version. Use .items instead.
  self._init_pool(data, label, cat_features, text_features, embedding_features, pairs, weight, group_id, group_weight, subgroup_id, pairs_weight, baseline, feature_names, thread_count)
[I 2024-11-07 02:19:52,077] Trial 118 finished with value: 0.5913325549217359 and parameters: {'iterations': 941, 'learning_rate': 0.1843243600760285, 'depth': 7, 'l2_leaf_reg': 1.3256221357669364}. Best is trial 56 with value: 0.5955351412315192.
/anaconda/envs/py38_default/lib/python3.9/site-packages/catboost/core.py:1102: FutureWarning: iteritems is deprecated and will be removed in a future version. Use .items instead.
  self._init_pool(data, label, cat_features, text_features, embedding_features, pairs, weight, group_id, group_weight, subgroup_id, pairs_weight, baseline, feature_names, thread_count)
/anaconda/envs/py38_default/lib/python3.9/site-packages/catboost/core.py:1102: FutureWarning: iteritems is deprecated and will be removed in a future version. Use .items instead.
  self._init_pool(data, label, cat_features, text_features, embedding_features, pairs, weight, group_id, group_weight, subgroup_id, pairs_weight, baseline, feature_names, thread_count)
/anaconda/envs/py38_default/lib/python3.9/site-packages/catboost/core.py:1102: FutureWarning: iteritems is deprecated and will be removed in a future version. Use .items instead.
  self._init_pool(data, label, cat_features, text_features, embedding_features, pairs, weight, group_id, group_weight, subgroup_id, pairs_weight, baseline, feature_names, thread_count)
/anaconda/envs/py38_default/lib/python3.9/site-packages/catboost/core.py:1102: FutureWarning: iteritems is deprecated and will be removed in a future version. Use .items instead.
  self._init_pool(data, label, cat_features, text_features, embedding_features, pairs, weight, group_id, group_weight, subgroup_id, pairs_weight, baseline, feature_names, thread_count)
/anaconda/envs/py38_default/lib/python3.9/site-packages/catboost/core.py:1102: FutureWarning: iteritems is deprecated and will be removed in a future version. Use .items instead.
  self._init_pool(data, label, cat_features, text_features, embedding_features, pairs, weight, group_id, group_weight, subgroup_id, pairs_weight, baseline, feature_names, thread_count)
