[I 2024-11-06 19:10:58,403] A new study created in memory with name: no-name-cfff71cd-9db7-4e41-8153-ef24ce909387
[I 2024-11-06 19:11:00,615] Trial 0 finished with value: 0.5944622851684469 and parameters: {'C': 0.5006937698074431, 'solver': 'liblinear'}. Best is trial 0 with value: 0.5944622851684469.
[I 2024-11-06 19:11:02,420] Trial 1 finished with value: 0.5944033476557997 and parameters: {'C': 6.954183293128747, 'solver': 'liblinear'}. Best is trial 0 with value: 0.5944622851684469.
[I 2024-11-06 19:11:04,311] Trial 2 finished with value: 0.5943946693874348 and parameters: {'C': 1.408773924947963, 'solver': 'liblinear'}. Best is trial 0 with value: 0.5944622851684469.
[I 2024-11-06 19:11:06,001] Trial 3 finished with value: 0.5944033476557997 and parameters: {'C': 7.882318915711127, 'solver': 'liblinear'}. Best is trial 0 with value: 0.5944622851684469.
/anaconda/envs/py38_default/lib/python3.9/site-packages/sklearn/linear_model/_sag.py:350: ConvergenceWarning: The max_iter was reached which means the coef_ did not converge
  warnings.warn(
/anaconda/envs/py38_default/lib/python3.9/site-packages/sklearn/linear_model/_sag.py:350: ConvergenceWarning: The max_iter was reached which means the coef_ did not converge
  warnings.warn(
/anaconda/envs/py38_default/lib/python3.9/site-packages/sklearn/linear_model/_sag.py:350: ConvergenceWarning: The max_iter was reached which means the coef_ did not converge
  warnings.warn(
/anaconda/envs/py38_default/lib/python3.9/site-packages/sklearn/linear_model/_sag.py:350: ConvergenceWarning: The max_iter was reached which means the coef_ did not converge
  warnings.warn(
/anaconda/envs/py38_default/lib/python3.9/site-packages/sklearn/linear_model/_sag.py:350: ConvergenceWarning: The max_iter was reached which means the coef_ did not converge
  warnings.warn(
[I 2024-11-06 19:11:24,803] Trial 4 finished with value: 0.5944106490062745 and parameters: {'C': 2.533530263869936, 'solver': 'saga'}. Best is trial 0 with value: 0.5944622851684469.
/anaconda/envs/py38_default/lib/python3.9/site-packages/sklearn/linear_model/_sag.py:350: ConvergenceWarning: The max_iter was reached which means the coef_ did not converge
  warnings.warn(
/anaconda/envs/py38_default/lib/python3.9/site-packages/sklearn/linear_model/_sag.py:350: ConvergenceWarning: The max_iter was reached which means the coef_ did not converge
  warnings.warn(
/anaconda/envs/py38_default/lib/python3.9/site-packages/sklearn/linear_model/_sag.py:350: ConvergenceWarning: The max_iter was reached which means the coef_ did not converge
  warnings.warn(
/anaconda/envs/py38_default/lib/python3.9/site-packages/sklearn/linear_model/_sag.py:350: ConvergenceWarning: The max_iter was reached which means the coef_ did not converge
  warnings.warn(
/anaconda/envs/py38_default/lib/python3.9/site-packages/sklearn/linear_model/_sag.py:350: ConvergenceWarning: The max_iter was reached which means the coef_ did not converge
  warnings.warn(
[I 2024-11-06 19:11:43,735] Trial 5 finished with value: 0.59437139022617 and parameters: {'C': 8.337497777999394, 'solver': 'saga'}. Best is trial 0 with value: 0.5944622851684469.
[I 2024-11-06 19:11:45,556] Trial 6 finished with value: 0.5943894864545646 and parameters: {'C': 8.344678253488139, 'solver': 'liblinear'}. Best is trial 0 with value: 0.5944622851684469.
/anaconda/envs/py38_default/lib/python3.9/site-packages/sklearn/linear_model/_sag.py:350: ConvergenceWarning: The max_iter was reached which means the coef_ did not converge
  warnings.warn(
/anaconda/envs/py38_default/lib/python3.9/site-packages/sklearn/linear_model/_sag.py:350: ConvergenceWarning: The max_iter was reached which means the coef_ did not converge
  warnings.warn(
/anaconda/envs/py38_default/lib/python3.9/site-packages/sklearn/linear_model/_sag.py:350: ConvergenceWarning: The max_iter was reached which means the coef_ did not converge
  warnings.warn(
/anaconda/envs/py38_default/lib/python3.9/site-packages/sklearn/linear_model/_sag.py:350: ConvergenceWarning: The max_iter was reached which means the coef_ did not converge
  warnings.warn(
/anaconda/envs/py38_default/lib/python3.9/site-packages/sklearn/linear_model/_sag.py:350: ConvergenceWarning: The max_iter was reached which means the coef_ did not converge
  warnings.warn(
[I 2024-11-06 19:12:04,098] Trial 7 finished with value: 0.5944008179293435 and parameters: {'C': 4.184579204014375, 'solver': 'saga'}. Best is trial 0 with value: 0.5944622851684469.
[I 2024-11-06 19:12:05,740] Trial 8 finished with value: 0.594370588000453 and parameters: {'C': 5.463476768307729, 'solver': 'lbfgs'}. Best is trial 0 with value: 0.5944622851684469.
/anaconda/envs/py38_default/lib/python3.9/site-packages/sklearn/linear_model/_sag.py:350: ConvergenceWarning: The max_iter was reached which means the coef_ did not converge
  warnings.warn(
/anaconda/envs/py38_default/lib/python3.9/site-packages/sklearn/linear_model/_sag.py:350: ConvergenceWarning: The max_iter was reached which means the coef_ did not converge
  warnings.warn(
/anaconda/envs/py38_default/lib/python3.9/site-packages/sklearn/linear_model/_sag.py:350: ConvergenceWarning: The max_iter was reached which means the coef_ did not converge
  warnings.warn(
/anaconda/envs/py38_default/lib/python3.9/site-packages/sklearn/linear_model/_sag.py:350: ConvergenceWarning: The max_iter was reached which means the coef_ did not converge
  warnings.warn(
/anaconda/envs/py38_default/lib/python3.9/site-packages/sklearn/linear_model/_sag.py:350: ConvergenceWarning: The max_iter was reached which means the coef_ did not converge
  warnings.warn(
[I 2024-11-06 19:12:24,307] Trial 9 finished with value: 0.5943812543139344 and parameters: {'C': 7.903073412894296, 'solver': 'saga'}. Best is trial 0 with value: 0.5944622851684469.
[I 2024-11-06 19:12:25,624] Trial 10 finished with value: 0.5940304816525617 and parameters: {'C': 0.16145708158763972, 'solver': 'lbfgs'}. Best is trial 0 with value: 0.5944622851684469.
/anaconda/envs/py38_default/lib/python3.9/site-packages/sklearn/linear_model/_sag.py:350: ConvergenceWarning: The max_iter was reached which means the coef_ did not converge
  warnings.warn(
/anaconda/envs/py38_default/lib/python3.9/site-packages/sklearn/linear_model/_sag.py:350: ConvergenceWarning: The max_iter was reached which means the coef_ did not converge
  warnings.warn(
/anaconda/envs/py38_default/lib/python3.9/site-packages/sklearn/linear_model/_sag.py:350: ConvergenceWarning: The max_iter was reached which means the coef_ did not converge
  warnings.warn(
/anaconda/envs/py38_default/lib/python3.9/site-packages/sklearn/linear_model/_sag.py:350: ConvergenceWarning: The max_iter was reached which means the coef_ did not converge
  warnings.warn(
/anaconda/envs/py38_default/lib/python3.9/site-packages/sklearn/linear_model/_sag.py:350: ConvergenceWarning: The max_iter was reached which means the coef_ did not converge
  warnings.warn(
[I 2024-11-06 19:12:45,083] Trial 11 finished with value: 0.5944106490062745 and parameters: {'C': 2.502685241914804, 'solver': 'saga'}. Best is trial 0 with value: 0.5944622851684469.
/anaconda/envs/py38_default/lib/python3.9/site-packages/sklearn/linear_model/_sag.py:350: ConvergenceWarning: The max_iter was reached which means the coef_ did not converge
  warnings.warn(
/anaconda/envs/py38_default/lib/python3.9/site-packages/sklearn/linear_model/_sag.py:350: ConvergenceWarning: The max_iter was reached which means the coef_ did not converge
  warnings.warn(
/anaconda/envs/py38_default/lib/python3.9/site-packages/sklearn/linear_model/_sag.py:350: ConvergenceWarning: The max_iter was reached which means the coef_ did not converge
  warnings.warn(
/anaconda/envs/py38_default/lib/python3.9/site-packages/sklearn/linear_model/_sag.py:350: ConvergenceWarning: The max_iter was reached which means the coef_ did not converge
  warnings.warn(
/anaconda/envs/py38_default/lib/python3.9/site-packages/sklearn/linear_model/_sag.py:350: ConvergenceWarning: The max_iter was reached which means the coef_ did not converge
  warnings.warn(
[I 2024-11-06 19:13:04,068] Trial 12 finished with value: 0.5944106490062745 and parameters: {'C': 2.9327248051980814, 'solver': 'saga'}. Best is trial 0 with value: 0.5944622851684469.
[I 2024-11-06 19:13:05,999] Trial 13 finished with value: 0.5944524591081727 and parameters: {'C': 0.5333081225160831, 'solver': 'liblinear'}. Best is trial 0 with value: 0.5944622851684469.
[I 2024-11-06 19:13:07,678] Trial 14 finished with value: 0.5936646130204315 and parameters: {'C': 0.04491527897607411, 'solver': 'liblinear'}. Best is trial 0 with value: 0.5944622851684469.
[I 2024-11-06 19:13:09,529] Trial 15 finished with value: 0.594400328171304 and parameters: {'C': 1.2369521721570378, 'solver': 'liblinear'}. Best is trial 0 with value: 0.5944622851684469.
[I 2024-11-06 19:13:11,240] Trial 16 finished with value: 0.5943977600835995 and parameters: {'C': 4.767465150308516, 'solver': 'liblinear'}. Best is trial 0 with value: 0.5944622851684469.
[I 2024-11-06 19:13:13,009] Trial 17 finished with value: 0.5944075915572162 and parameters: {'C': 3.6332284785565556, 'solver': 'liblinear'}. Best is trial 0 with value: 0.5944622851684469.
[I 2024-11-06 19:13:14,598] Trial 18 finished with value: 0.5944233203638192 and parameters: {'C': 1.1575080890332843, 'solver': 'lbfgs'}. Best is trial 0 with value: 0.5944622851684469.
[I 2024-11-06 19:13:16,510] Trial 19 finished with value: 0.5944033476557997 and parameters: {'C': 6.148415706437767, 'solver': 'liblinear'}. Best is trial 0 with value: 0.5944622851684469.
[I 2024-11-06 19:13:18,557] Trial 20 finished with value: 0.5943894864545646 and parameters: {'C': 9.854046375169709, 'solver': 'liblinear'}. Best is trial 0 with value: 0.5944622851684469.
[I 2024-11-06 19:13:19,833] Trial 21 finished with value: 0.5943774515942485 and parameters: {'C': 0.8955385475311541, 'solver': 'lbfgs'}. Best is trial 0 with value: 0.5944622851684469.
[I 2024-11-06 19:13:21,179] Trial 22 finished with value: 0.5941773745684557 and parameters: {'C': 1.840297413746271, 'solver': 'lbfgs'}. Best is trial 0 with value: 0.5944622851684469.
[I 2024-11-06 19:13:22,443] Trial 23 finished with value: 0.5942462615783268 and parameters: {'C': 0.666192674346253, 'solver': 'lbfgs'}. Best is trial 0 with value: 0.5944622851684469.
[I 2024-11-06 19:13:23,667] Trial 24 finished with value: 0.5942568060061586 and parameters: {'C': 2.1287009616356567, 'solver': 'lbfgs'}. Best is trial 0 with value: 0.5944622851684469.
[I 2024-11-06 19:13:24,952] Trial 25 finished with value: 0.5943540817770238 and parameters: {'C': 3.2455709138111213, 'solver': 'lbfgs'}. Best is trial 0 with value: 0.5944622851684469.
[I 2024-11-06 19:13:26,873] Trial 26 finished with value: 0.5944003098086169 and parameters: {'C': 1.6206942728844522, 'solver': 'liblinear'}. Best is trial 0 with value: 0.5944622851684469.
[I 2024-11-06 19:13:28,121] Trial 27 finished with value: 0.5944024144178129 and parameters: {'C': 0.9489412094752021, 'solver': 'lbfgs'}. Best is trial 0 with value: 0.5944622851684469.
[I 2024-11-06 19:13:29,793] Trial 28 finished with value: 0.5940042181815441 and parameters: {'C': 0.10570205734177296, 'solver': 'liblinear'}. Best is trial 0 with value: 0.5944622851684469.
[I 2024-11-06 19:13:31,669] Trial 29 finished with value: 0.5944075915572162 and parameters: {'C': 4.119955207768469, 'solver': 'liblinear'}. Best is trial 0 with value: 0.5944622851684469.
[I 2024-11-06 19:13:32,995] Trial 30 finished with value: 0.5942333195478913 and parameters: {'C': 1.8637046038814522, 'solver': 'lbfgs'}. Best is trial 0 with value: 0.5944622851684469.
/anaconda/envs/py38_default/lib/python3.9/site-packages/sklearn/linear_model/_sag.py:350: ConvergenceWarning: The max_iter was reached which means the coef_ did not converge
  warnings.warn(
/anaconda/envs/py38_default/lib/python3.9/site-packages/sklearn/linear_model/_sag.py:350: ConvergenceWarning: The max_iter was reached which means the coef_ did not converge
  warnings.warn(
/anaconda/envs/py38_default/lib/python3.9/site-packages/sklearn/linear_model/_sag.py:350: ConvergenceWarning: The max_iter was reached which means the coef_ did not converge
  warnings.warn(
/anaconda/envs/py38_default/lib/python3.9/site-packages/sklearn/linear_model/_sag.py:350: ConvergenceWarning: The max_iter was reached which means the coef_ did not converge
  warnings.warn(
/anaconda/envs/py38_default/lib/python3.9/site-packages/sklearn/linear_model/_sag.py:350: ConvergenceWarning: The max_iter was reached which means the coef_ did not converge
  warnings.warn(
[I 2024-11-06 19:13:51,847] Trial 31 finished with value: 0.5944106490062745 and parameters: {'C': 2.5756200024015325, 'solver': 'saga'}. Best is trial 0 with value: 0.5944622851684469.
[I 2024-11-06 19:14:00,688] Trial 32 finished with value: 0.5944133968162141 and parameters: {'C': 0.7048481237234617, 'solver': 'saga'}. Best is trial 0 with value: 0.5944622851684469.
[I 2024-11-06 19:14:13,005] Trial 33 finished with value: 0.5944231726540832 and parameters: {'C': 1.0662763031585643, 'solver': 'saga'}. Best is trial 0 with value: 0.5944622851684469.
[I 2024-11-06 19:14:14,844] Trial 34 finished with value: 0.5943905567746292 and parameters: {'C': 1.3863653978505863, 'solver': 'liblinear'}. Best is trial 0 with value: 0.5944622851684469.
[I 2024-11-06 19:14:21,609] Trial 35 finished with value: 0.5944133968162141 and parameters: {'C': 0.4852324320785819, 'solver': 'saga'}. Best is trial 0 with value: 0.5944622851684469.
[I 2024-11-06 19:14:23,387] Trial 36 finished with value: 0.5943905567746292 and parameters: {'C': 1.2928239616727946, 'solver': 'liblinear'}. Best is trial 0 with value: 0.5944622851684469.
[I 2024-11-06 19:14:41,286] Trial 37 finished with value: 0.5944147831483135 and parameters: {'C': 2.209407271003702, 'solver': 'saga'}. Best is trial 0 with value: 0.5944622851684469.
[I 2024-11-06 19:14:43,132] Trial 38 finished with value: 0.5944075915572162 and parameters: {'C': 3.4778326514139417, 'solver': 'liblinear'}. Best is trial 0 with value: 0.5944622851684469.
/anaconda/envs/py38_default/lib/python3.9/site-packages/sklearn/linear_model/_sag.py:350: ConvergenceWarning: The max_iter was reached which means the coef_ did not converge
  warnings.warn(
/anaconda/envs/py38_default/lib/python3.9/site-packages/sklearn/linear_model/_sag.py:350: ConvergenceWarning: The max_iter was reached which means the coef_ did not converge
  warnings.warn(
/anaconda/envs/py38_default/lib/python3.9/site-packages/sklearn/linear_model/_sag.py:350: ConvergenceWarning: The max_iter was reached which means the coef_ did not converge
  warnings.warn(
/anaconda/envs/py38_default/lib/python3.9/site-packages/sklearn/linear_model/_sag.py:350: ConvergenceWarning: The max_iter was reached which means the coef_ did not converge
  warnings.warn(
/anaconda/envs/py38_default/lib/python3.9/site-packages/sklearn/linear_model/_sag.py:350: ConvergenceWarning: The max_iter was reached which means the coef_ did not converge
  warnings.warn(
[I 2024-11-06 19:15:02,274] Trial 39 finished with value: 0.5943812543139344 and parameters: {'C': 6.9412441496315775, 'solver': 'saga'}. Best is trial 0 with value: 0.5944622851684469.
[I 2024-11-06 19:15:03,742] Trial 40 finished with value: 0.5940796056414455 and parameters: {'C': 0.5197469127708872, 'solver': 'lbfgs'}. Best is trial 0 with value: 0.5944622851684469.
[I 2024-11-06 19:15:22,034] Trial 41 finished with value: 0.5944106490062745 and parameters: {'C': 2.264105704003574, 'solver': 'saga'}. Best is trial 0 with value: 0.5944622851684469.
[I 2024-11-06 19:15:34,337] Trial 42 finished with value: 0.5944329368196948 and parameters: {'C': 1.1538070875428224, 'solver': 'saga'}. Best is trial 0 with value: 0.5944622851684469.
[I 2024-11-06 19:15:46,757] Trial 43 finished with value: 0.5944329368196948 and parameters: {'C': 1.1846506074859067, 'solver': 'saga'}. Best is trial 0 with value: 0.5944622851684469.
/anaconda/envs/py38_default/lib/python3.9/site-packages/sklearn/linear_model/_sag.py:350: ConvergenceWarning: The max_iter was reached which means the coef_ did not converge
  warnings.warn(
/anaconda/envs/py38_default/lib/python3.9/site-packages/sklearn/linear_model/_sag.py:350: ConvergenceWarning: The max_iter was reached which means the coef_ did not converge
  warnings.warn(
/anaconda/envs/py38_default/lib/python3.9/site-packages/sklearn/linear_model/_sag.py:350: ConvergenceWarning: The max_iter was reached which means the coef_ did not converge
  warnings.warn(
/anaconda/envs/py38_default/lib/python3.9/site-packages/sklearn/linear_model/_sag.py:350: ConvergenceWarning: The max_iter was reached which means the coef_ did not converge
  warnings.warn(
/anaconda/envs/py38_default/lib/python3.9/site-packages/sklearn/linear_model/_sag.py:350: ConvergenceWarning: The max_iter was reached which means the coef_ did not converge
  warnings.warn(
[I 2024-11-06 19:16:05,589] Trial 44 finished with value: 0.5944106490062745 and parameters: {'C': 2.8418299300093683, 'solver': 'saga'}. Best is trial 0 with value: 0.5944622851684469.
[I 2024-11-06 19:16:20,543] Trial 45 finished with value: 0.5944147831483135 and parameters: {'C': 1.659611630776486, 'solver': 'saga'}. Best is trial 0 with value: 0.5944622851684469.
[I 2024-11-06 19:16:24,974] Trial 46 finished with value: 0.5943184257885834 and parameters: {'C': 0.2911582314096923, 'solver': 'saga'}. Best is trial 0 with value: 0.5944622851684469.
[I 2024-11-06 19:16:26,800] Trial 47 finished with value: 0.5943961943162187 and parameters: {'C': 1.2669528953625608, 'solver': 'liblinear'}. Best is trial 0 with value: 0.5944622851684469.
[I 2024-11-06 19:16:30,211] Trial 48 finished with value: 0.5938048624219602 and parameters: {'C': 0.026977665855645427, 'solver': 'saga'}. Best is trial 0 with value: 0.5944622851684469.
[I 2024-11-06 19:16:32,137] Trial 49 finished with value: 0.5944102716600428 and parameters: {'C': 0.8550473531604561, 'solver': 'liblinear'}. Best is trial 0 with value: 0.5944622851684469.
[I 2024-11-06 19:16:33,694] Trial 50 finished with value: 0.5943922312767731 and parameters: {'C': 5.347531483066444, 'solver': 'lbfgs'}. Best is trial 0 with value: 0.5944622851684469.
[I 2024-11-06 19:16:45,472] Trial 51 finished with value: 0.5944371157934436 and parameters: {'C': 1.1022310585676873, 'solver': 'saga'}. Best is trial 0 with value: 0.5944622851684469.
[I 2024-11-06 19:16:51,665] Trial 52 finished with value: 0.5944133968162141 and parameters: {'C': 0.4653554251218277, 'solver': 'saga'}. Best is trial 0 with value: 0.5944622851684469.
[I 2024-11-06 19:17:06,524] Trial 53 finished with value: 0.5944147831483135 and parameters: {'C': 1.688238817805369, 'solver': 'saga'}. Best is trial 0 with value: 0.5944622851684469.
[I 2024-11-06 19:17:18,292] Trial 54 finished with value: 0.5944371157934436 and parameters: {'C': 1.0870038358039436, 'solver': 'saga'}. Best is trial 0 with value: 0.5944622851684469.
[I 2024-11-06 19:17:34,891] Trial 55 finished with value: 0.5944106336648237 and parameters: {'C': 1.9978390542098667, 'solver': 'saga'}. Best is trial 0 with value: 0.5944622851684469.
/anaconda/envs/py38_default/lib/python3.9/site-packages/sklearn/linear_model/_sag.py:350: ConvergenceWarning: The max_iter was reached which means the coef_ did not converge
  warnings.warn(
/anaconda/envs/py38_default/lib/python3.9/site-packages/sklearn/linear_model/_sag.py:350: ConvergenceWarning: The max_iter was reached which means the coef_ did not converge
  warnings.warn(
/anaconda/envs/py38_default/lib/python3.9/site-packages/sklearn/linear_model/_sag.py:350: ConvergenceWarning: The max_iter was reached which means the coef_ did not converge
  warnings.warn(
/anaconda/envs/py38_default/lib/python3.9/site-packages/sklearn/linear_model/_sag.py:350: ConvergenceWarning: The max_iter was reached which means the coef_ did not converge
  warnings.warn(
/anaconda/envs/py38_default/lib/python3.9/site-packages/sklearn/linear_model/_sag.py:350: ConvergenceWarning: The max_iter was reached which means the coef_ did not converge
  warnings.warn(
[I 2024-11-06 19:17:53,373] Trial 56 finished with value: 0.5944106490062745 and parameters: {'C': 2.5772187169367506, 'solver': 'saga'}. Best is trial 0 with value: 0.5944622851684469.
[I 2024-11-06 19:18:07,547] Trial 57 finished with value: 0.5944246135374919 and parameters: {'C': 1.4540418449751398, 'solver': 'saga'}. Best is trial 0 with value: 0.5944622851684469.
[I 2024-11-06 19:18:16,540] Trial 58 finished with value: 0.5944133968162141 and parameters: {'C': 0.7087936075745541, 'solver': 'saga'}. Best is trial 0 with value: 0.5944622851684469.
[I 2024-11-06 19:18:22,088] Trial 59 finished with value: 0.5943911294669993 and parameters: {'C': 0.38355061559714876, 'solver': 'saga'}. Best is trial 0 with value: 0.5944622851684469.
[I 2024-11-06 19:18:23,862] Trial 60 finished with value: 0.5943751255667493 and parameters: {'C': 1.016793513147701, 'solver': 'liblinear'}. Best is trial 0 with value: 0.5944622851684469.
[I 2024-11-06 19:18:37,941] Trial 61 finished with value: 0.5944246135374919 and parameters: {'C': 1.4914359331711573, 'solver': 'saga'}. Best is trial 0 with value: 0.5944622851684469.
[I 2024-11-06 19:18:51,204] Trial 62 finished with value: 0.5944329368196948 and parameters: {'C': 1.3487281928672203, 'solver': 'saga'}. Best is trial 0 with value: 0.5944622851684469.
[I 2024-11-06 19:19:02,868] Trial 63 finished with value: 0.5944231726540832 and parameters: {'C': 1.0305512112731048, 'solver': 'saga'}. Best is trial 0 with value: 0.5944622851684469.
[I 2024-11-06 19:19:06,545] Trial 64 finished with value: 0.5934028978936524 and parameters: {'C': 0.015069100666234014, 'solver': 'saga'}. Best is trial 0 with value: 0.5944622851684469.
