[I 2024-11-07 00:07:55,441] Trial 49 finished with value: 0.5928402420687886 and parameters: {'iterations': 688, 'learning_rate': 0.16412046119058962, 'depth': 8, 'l2_leaf_reg': 4.212061272979279}. Best is trial 31 with value: 0.5952026483766575.
/anaconda/envs/py38_default/lib/python3.9/site-packages/catboost/core.py:1102: FutureWarning: iteritems is deprecated and will be removed in a future version. Use .items instead.
  self._init_pool(data, label, cat_features, text_features, embedding_features, pairs, weight, group_id, group_weight, subgroup_id, pairs_weight, baseline, feature_names, thread_count)
/anaconda/envs/py38_default/lib/python3.9/site-packages/catboost/core.py:1102: FutureWarning: iteritems is deprecated and will be removed in a future version. Use .items instead.
  self._init_pool(data, label, cat_features, text_features, embedding_features, pairs, weight, group_id, group_weight, subgroup_id, pairs_weight, baseline, feature_names, thread_count)
/anaconda/envs/py38_default/lib/python3.9/site-packages/catboost/core.py:1102: FutureWarning: iteritems is deprecated and will be removed in a future version. Use .items instead.
  self._init_pool(data, label, cat_features, text_features, embedding_features, pairs, weight, group_id, group_weight, subgroup_id, pairs_weight, baseline, feature_names, thread_count)
/anaconda/envs/py38_default/lib/python3.9/site-packages/catboost/core.py:1102: FutureWarning: iteritems is deprecated and will be removed in a future version. Use .items instead.
  self._init_pool(data, label, cat_features, text_features, embedding_features, pairs, weight, group_id, group_weight, subgroup_id, pairs_weight, baseline, feature_names, thread_count)
/anaconda/envs/py38_default/lib/python3.9/site-packages/catboost/core.py:1102: FutureWarning: iteritems is deprecated and will be removed in a future version. Use .items instead.
  self._init_pool(data, label, cat_features, text_features, embedding_features, pairs, weight, group_id, group_weight, subgroup_id, pairs_weight, baseline, feature_names, thread_count)
[I 2024-11-07 00:09:48,830] Trial 50 finished with value: 0.5926007594656054 and parameters: {'iterations': 739, 'learning_rate': 0.2819210834081014, 'depth': 6, 'l2_leaf_reg': 1.504050343654332}. Best is trial 31 with value: 0.5952026483766575.
/anaconda/envs/py38_default/lib/python3.9/site-packages/catboost/core.py:1102: FutureWarning: iteritems is deprecated and will be removed in a future version. Use .items instead.
  self._init_pool(data, label, cat_features, text_features, embedding_features, pairs, weight, group_id, group_weight, subgroup_id, pairs_weight, baseline, feature_names, thread_count)
/anaconda/envs/py38_default/lib/python3.9/site-packages/catboost/core.py:1102: FutureWarning: iteritems is deprecated and will be removed in a future version. Use .items instead.
  self._init_pool(data, label, cat_features, text_features, embedding_features, pairs, weight, group_id, group_weight, subgroup_id, pairs_weight, baseline, feature_names, thread_count)
/anaconda/envs/py38_default/lib/python3.9/site-packages/catboost/core.py:1102: FutureWarning: iteritems is deprecated and will be removed in a future version. Use .items instead.
  self._init_pool(data, label, cat_features, text_features, embedding_features, pairs, weight, group_id, group_weight, subgroup_id, pairs_weight, baseline, feature_names, thread_count)
/anaconda/envs/py38_default/lib/python3.9/site-packages/catboost/core.py:1102: FutureWarning: iteritems is deprecated and will be removed in a future version. Use .items instead.
  self._init_pool(data, label, cat_features, text_features, embedding_features, pairs, weight, group_id, group_weight, subgroup_id, pairs_weight, baseline, feature_names, thread_count)
/anaconda/envs/py38_default/lib/python3.9/site-packages/catboost/core.py:1102: FutureWarning: iteritems is deprecated and will be removed in a future version. Use .items instead.
  self._init_pool(data, label, cat_features, text_features, embedding_features, pairs, weight, group_id, group_weight, subgroup_id, pairs_weight, baseline, feature_names, thread_count)
[I 2024-11-07 00:11:43,984] Trial 51 finished with value: 0.5945591619569889 and parameters: {'iterations': 886, 'learning_rate': 0.19473830212795443, 'depth': 5, 'l2_leaf_reg': 1.3206188958847394}. Best is trial 31 with value: 0.5952026483766575.
/anaconda/envs/py38_default/lib/python3.9/site-packages/catboost/core.py:1102: FutureWarning: iteritems is deprecated and will be removed in a future version. Use .items instead.
  self._init_pool(data, label, cat_features, text_features, embedding_features, pairs, weight, group_id, group_weight, subgroup_id, pairs_weight, baseline, feature_names, thread_count)
/anaconda/envs/py38_default/lib/python3.9/site-packages/catboost/core.py:1102: FutureWarning: iteritems is deprecated and will be removed in a future version. Use .items instead.
  self._init_pool(data, label, cat_features, text_features, embedding_features, pairs, weight, group_id, group_weight, subgroup_id, pairs_weight, baseline, feature_names, thread_count)
/anaconda/envs/py38_default/lib/python3.9/site-packages/catboost/core.py:1102: FutureWarning: iteritems is deprecated and will be removed in a future version. Use .items instead.
  self._init_pool(data, label, cat_features, text_features, embedding_features, pairs, weight, group_id, group_weight, subgroup_id, pairs_weight, baseline, feature_names, thread_count)
/anaconda/envs/py38_default/lib/python3.9/site-packages/catboost/core.py:1102: FutureWarning: iteritems is deprecated and will be removed in a future version. Use .items instead.
  self._init_pool(data, label, cat_features, text_features, embedding_features, pairs, weight, group_id, group_weight, subgroup_id, pairs_weight, baseline, feature_names, thread_count)
/anaconda/envs/py38_default/lib/python3.9/site-packages/catboost/core.py:1102: FutureWarning: iteritems is deprecated and will be removed in a future version. Use .items instead.
  self._init_pool(data, label, cat_features, text_features, embedding_features, pairs, weight, group_id, group_weight, subgroup_id, pairs_weight, baseline, feature_names, thread_count)
[I 2024-11-07 00:12:01,261] Trial 52 finished with value: 0.5927900763859559 and parameters: {'iterations': 171, 'learning_rate': 0.22375910050196943, 'depth': 5, 'l2_leaf_reg': 1.0098072078672702}. Best is trial 31 with value: 0.5952026483766575.
/anaconda/envs/py38_default/lib/python3.9/site-packages/catboost/core.py:1102: FutureWarning: iteritems is deprecated and will be removed in a future version. Use .items instead.
  self._init_pool(data, label, cat_features, text_features, embedding_features, pairs, weight, group_id, group_weight, subgroup_id, pairs_weight, baseline, feature_names, thread_count)
/anaconda/envs/py38_default/lib/python3.9/site-packages/catboost/core.py:1102: FutureWarning: iteritems is deprecated and will be removed in a future version. Use .items instead.
  self._init_pool(data, label, cat_features, text_features, embedding_features, pairs, weight, group_id, group_weight, subgroup_id, pairs_weight, baseline, feature_names, thread_count)
/anaconda/envs/py38_default/lib/python3.9/site-packages/catboost/core.py:1102: FutureWarning: iteritems is deprecated and will be removed in a future version. Use .items instead.
  self._init_pool(data, label, cat_features, text_features, embedding_features, pairs, weight, group_id, group_weight, subgroup_id, pairs_weight, baseline, feature_names, thread_count)
/anaconda/envs/py38_default/lib/python3.9/site-packages/catboost/core.py:1102: FutureWarning: iteritems is deprecated and will be removed in a future version. Use .items instead.
  self._init_pool(data, label, cat_features, text_features, embedding_features, pairs, weight, group_id, group_weight, subgroup_id, pairs_weight, baseline, feature_names, thread_count)
/anaconda/envs/py38_default/lib/python3.9/site-packages/catboost/core.py:1102: FutureWarning: iteritems is deprecated and will be removed in a future version. Use .items instead.
  self._init_pool(data, label, cat_features, text_features, embedding_features, pairs, weight, group_id, group_weight, subgroup_id, pairs_weight, baseline, feature_names, thread_count)
[I 2024-11-07 00:13:55,082] Trial 53 finished with value: 0.5941397678196997 and parameters: {'iterations': 872, 'learning_rate': 0.1949682958884815, 'depth': 5, 'l2_leaf_reg': 2.001801435110446}. Best is trial 31 with value: 0.5952026483766575.
/anaconda/envs/py38_default/lib/python3.9/site-packages/catboost/core.py:1102: FutureWarning: iteritems is deprecated and will be removed in a future version. Use .items instead.
  self._init_pool(data, label, cat_features, text_features, embedding_features, pairs, weight, group_id, group_weight, subgroup_id, pairs_weight, baseline, feature_names, thread_count)
/anaconda/envs/py38_default/lib/python3.9/site-packages/catboost/core.py:1102: FutureWarning: iteritems is deprecated and will be removed in a future version. Use .items instead.
  self._init_pool(data, label, cat_features, text_features, embedding_features, pairs, weight, group_id, group_weight, subgroup_id, pairs_weight, baseline, feature_names, thread_count)
/anaconda/envs/py38_default/lib/python3.9/site-packages/catboost/core.py:1102: FutureWarning: iteritems is deprecated and will be removed in a future version. Use .items instead.
  self._init_pool(data, label, cat_features, text_features, embedding_features, pairs, weight, group_id, group_weight, subgroup_id, pairs_weight, baseline, feature_names, thread_count)
/anaconda/envs/py38_default/lib/python3.9/site-packages/catboost/core.py:1102: FutureWarning: iteritems is deprecated and will be removed in a future version. Use .items instead.
  self._init_pool(data, label, cat_features, text_features, embedding_features, pairs, weight, group_id, group_weight, subgroup_id, pairs_weight, baseline, feature_names, thread_count)
/anaconda/envs/py38_default/lib/python3.9/site-packages/catboost/core.py:1102: FutureWarning: iteritems is deprecated and will be removed in a future version. Use .items instead.
  self._init_pool(data, label, cat_features, text_features, embedding_features, pairs, weight, group_id, group_weight, subgroup_id, pairs_weight, baseline, feature_names, thread_count)
[I 2024-11-07 00:15:25,237] Trial 54 finished with value: 0.5937608783214529 and parameters: {'iterations': 811, 'learning_rate': 0.21346705119900714, 'depth': 4, 'l2_leaf_reg': 1.3573361643810817}. Best is trial 31 with value: 0.5952026483766575.
/anaconda/envs/py38_default/lib/python3.9/site-packages/catboost/core.py:1102: FutureWarning: iteritems is deprecated and will be removed in a future version. Use .items instead.
  self._init_pool(data, label, cat_features, text_features, embedding_features, pairs, weight, group_id, group_weight, subgroup_id, pairs_weight, baseline, feature_names, thread_count)
/anaconda/envs/py38_default/lib/python3.9/site-packages/catboost/core.py:1102: FutureWarning: iteritems is deprecated and will be removed in a future version. Use .items instead.
  self._init_pool(data, label, cat_features, text_features, embedding_features, pairs, weight, group_id, group_weight, subgroup_id, pairs_weight, baseline, feature_names, thread_count)
/anaconda/envs/py38_default/lib/python3.9/site-packages/catboost/core.py:1102: FutureWarning: iteritems is deprecated and will be removed in a future version. Use .items instead.
  self._init_pool(data, label, cat_features, text_features, embedding_features, pairs, weight, group_id, group_weight, subgroup_id, pairs_weight, baseline, feature_names, thread_count)
/anaconda/envs/py38_default/lib/python3.9/site-packages/catboost/core.py:1102: FutureWarning: iteritems is deprecated and will be removed in a future version. Use .items instead.
  self._init_pool(data, label, cat_features, text_features, embedding_features, pairs, weight, group_id, group_weight, subgroup_id, pairs_weight, baseline, feature_names, thread_count)
/anaconda/envs/py38_default/lib/python3.9/site-packages/catboost/core.py:1102: FutureWarning: iteritems is deprecated and will be removed in a future version. Use .items instead.
  self._init_pool(data, label, cat_features, text_features, embedding_features, pairs, weight, group_id, group_weight, subgroup_id, pairs_weight, baseline, feature_names, thread_count)
[I 2024-11-07 00:17:51,096] Trial 55 finished with value: 0.5929182934330075 and parameters: {'iterations': 960, 'learning_rate': 0.18909985961508086, 'depth': 6, 'l2_leaf_reg': 2.4461385656242687}. Best is trial 31 with value: 0.5952026483766575.
/anaconda/envs/py38_default/lib/python3.9/site-packages/catboost/core.py:1102: FutureWarning: iteritems is deprecated and will be removed in a future version. Use .items instead.
  self._init_pool(data, label, cat_features, text_features, embedding_features, pairs, weight, group_id, group_weight, subgroup_id, pairs_weight, baseline, feature_names, thread_count)
/anaconda/envs/py38_default/lib/python3.9/site-packages/catboost/core.py:1102: FutureWarning: iteritems is deprecated and will be removed in a future version. Use .items instead.
  self._init_pool(data, label, cat_features, text_features, embedding_features, pairs, weight, group_id, group_weight, subgroup_id, pairs_weight, baseline, feature_names, thread_count)
/anaconda/envs/py38_default/lib/python3.9/site-packages/catboost/core.py:1102: FutureWarning: iteritems is deprecated and will be removed in a future version. Use .items instead.
  self._init_pool(data, label, cat_features, text_features, embedding_features, pairs, weight, group_id, group_weight, subgroup_id, pairs_weight, baseline, feature_names, thread_count)
/anaconda/envs/py38_default/lib/python3.9/site-packages/catboost/core.py:1102: FutureWarning: iteritems is deprecated and will be removed in a future version. Use .items instead.
  self._init_pool(data, label, cat_features, text_features, embedding_features, pairs, weight, group_id, group_weight, subgroup_id, pairs_weight, baseline, feature_names, thread_count)
/anaconda/envs/py38_default/lib/python3.9/site-packages/catboost/core.py:1102: FutureWarning: iteritems is deprecated and will be removed in a future version. Use .items instead.
  self._init_pool(data, label, cat_features, text_features, embedding_features, pairs, weight, group_id, group_weight, subgroup_id, pairs_weight, baseline, feature_names, thread_count)
[I 2024-11-07 00:19:52,275] Trial 56 finished with value: 0.5955351412315192 and parameters: {'iterations': 921, 'learning_rate': 0.236581676530928, 'depth': 5, 'l2_leaf_reg': 1.4017483269379527}. Best is trial 56 with value: 0.5955351412315192.
/anaconda/envs/py38_default/lib/python3.9/site-packages/catboost/core.py:1102: FutureWarning: iteritems is deprecated and will be removed in a future version. Use .items instead.
  self._init_pool(data, label, cat_features, text_features, embedding_features, pairs, weight, group_id, group_weight, subgroup_id, pairs_weight, baseline, feature_names, thread_count)
/anaconda/envs/py38_default/lib/python3.9/site-packages/catboost/core.py:1102: FutureWarning: iteritems is deprecated and will be removed in a future version. Use .items instead.
  self._init_pool(data, label, cat_features, text_features, embedding_features, pairs, weight, group_id, group_weight, subgroup_id, pairs_weight, baseline, feature_names, thread_count)
/anaconda/envs/py38_default/lib/python3.9/site-packages/catboost/core.py:1102: FutureWarning: iteritems is deprecated and will be removed in a future version. Use .items instead.
  self._init_pool(data, label, cat_features, text_features, embedding_features, pairs, weight, group_id, group_weight, subgroup_id, pairs_weight, baseline, feature_names, thread_count)
/anaconda/envs/py38_default/lib/python3.9/site-packages/catboost/core.py:1102: FutureWarning: iteritems is deprecated and will be removed in a future version. Use .items instead.
  self._init_pool(data, label, cat_features, text_features, embedding_features, pairs, weight, group_id, group_weight, subgroup_id, pairs_weight, baseline, feature_names, thread_count)
/anaconda/envs/py38_default/lib/python3.9/site-packages/catboost/core.py:1102: FutureWarning: iteritems is deprecated and will be removed in a future version. Use .items instead.
  self._init_pool(data, label, cat_features, text_features, embedding_features, pairs, weight, group_id, group_weight, subgroup_id, pairs_weight, baseline, feature_names, thread_count)
[I 2024-11-07 00:24:28,790] Trial 57 finished with value: 0.5913372811745905 and parameters: {'iterations': 900, 'learning_rate': 0.1802648822734358, 'depth': 9, 'l2_leaf_reg': 8.356306822183942}. Best is trial 56 with value: 0.5955351412315192.
/anaconda/envs/py38_default/lib/python3.9/site-packages/catboost/core.py:1102: FutureWarning: iteritems is deprecated and will be removed in a future version. Use .items instead.
  self._init_pool(data, label, cat_features, text_features, embedding_features, pairs, weight, group_id, group_weight, subgroup_id, pairs_weight, baseline, feature_names, thread_count)
/anaconda/envs/py38_default/lib/python3.9/site-packages/catboost/core.py:1102: FutureWarning: iteritems is deprecated and will be removed in a future version. Use .items instead.
  self._init_pool(data, label, cat_features, text_features, embedding_features, pairs, weight, group_id, group_weight, subgroup_id, pairs_weight, baseline, feature_names, thread_count)
/anaconda/envs/py38_default/lib/python3.9/site-packages/catboost/core.py:1102: FutureWarning: iteritems is deprecated and will be removed in a future version. Use .items instead.
  self._init_pool(data, label, cat_features, text_features, embedding_features, pairs, weight, group_id, group_weight, subgroup_id, pairs_weight, baseline, feature_names, thread_count)
/anaconda/envs/py38_default/lib/python3.9/site-packages/catboost/core.py:1102: FutureWarning: iteritems is deprecated and will be removed in a future version. Use .items instead.
  self._init_pool(data, label, cat_features, text_features, embedding_features, pairs, weight, group_id, group_weight, subgroup_id, pairs_weight, baseline, feature_names, thread_count)
/anaconda/envs/py38_default/lib/python3.9/site-packages/catboost/core.py:1102: FutureWarning: iteritems is deprecated and will be removed in a future version. Use .items instead.
  self._init_pool(data, label, cat_features, text_features, embedding_features, pairs, weight, group_id, group_weight, subgroup_id, pairs_weight, baseline, feature_names, thread_count)
[I 2024-11-07 00:26:30,754] Trial 58 finished with value: 0.5938619385984196 and parameters: {'iterations': 939, 'learning_rate': 0.15077344256885192, 'depth': 5, 'l2_leaf_reg': 1.3713273869927245}. Best is trial 56 with value: 0.5955351412315192.
/anaconda/envs/py38_default/lib/python3.9/site-packages/catboost/core.py:1102: FutureWarning: iteritems is deprecated and will be removed in a future version. Use .items instead.
  self._init_pool(data, label, cat_features, text_features, embedding_features, pairs, weight, group_id, group_weight, subgroup_id, pairs_weight, baseline, feature_names, thread_count)
/anaconda/envs/py38_default/lib/python3.9/site-packages/catboost/core.py:1102: FutureWarning: iteritems is deprecated and will be removed in a future version. Use .items instead.
  self._init_pool(data, label, cat_features, text_features, embedding_features, pairs, weight, group_id, group_weight, subgroup_id, pairs_weight, baseline, feature_names, thread_count)
/anaconda/envs/py38_default/lib/python3.9/site-packages/catboost/core.py:1102: FutureWarning: iteritems is deprecated and will be removed in a future version. Use .items instead.
  self._init_pool(data, label, cat_features, text_features, embedding_features, pairs, weight, group_id, group_weight, subgroup_id, pairs_weight, baseline, feature_names, thread_count)
/anaconda/envs/py38_default/lib/python3.9/site-packages/catboost/core.py:1102: FutureWarning: iteritems is deprecated and will be removed in a future version. Use .items instead.
  self._init_pool(data, label, cat_features, text_features, embedding_features, pairs, weight, group_id, group_weight, subgroup_id, pairs_weight, baseline, feature_names, thread_count)
/anaconda/envs/py38_default/lib/python3.9/site-packages/catboost/core.py:1102: FutureWarning: iteritems is deprecated and will be removed in a future version. Use .items instead.
  self._init_pool(data, label, cat_features, text_features, embedding_features, pairs, weight, group_id, group_weight, subgroup_id, pairs_weight, baseline, feature_names, thread_count)
