[I 2024-11-06 22:34:27,491] Trial 948 finished with value: 0.5932775626444103 and parameters: {'n_estimators': 167, 'max_depth': 7, 'learning_rate': 0.08606109059528992, 'gamma': 4.744018318471378, 'min_child_weight': 8, 'subsample': 0.8733799147044541, 'colsample_bytree': 0.5678444713410064, 'reg_alpha': 0.6197992659624137, 'reg_lambda': 0.3522608592545439}. Best is trial 829 with value: 0.5942795917588232.
[I 2024-11-06 22:34:31,338] Trial 949 finished with value: 0.59233052165019 and parameters: {'n_estimators': 174, 'max_depth': 7, 'learning_rate': 0.09574366593134809, 'gamma': 4.359437860520382, 'min_child_weight': 8, 'subsample': 0.6293481898390446, 'colsample_bytree': 0.5779047958065542, 'reg_alpha': 0.5343502923785983, 'reg_lambda': 0.8460297111343636}. Best is trial 829 with value: 0.5942795917588232.
[I 2024-11-06 22:34:36,828] Trial 950 finished with value: 0.5928794725344527 and parameters: {'n_estimators': 155, 'max_depth': 7, 'learning_rate': 0.014032021773037652, 'gamma': 4.865864238139744, 'min_child_weight': 9, 'subsample': 0.8591441887112145, 'colsample_bytree': 0.5934551412746764, 'reg_alpha': 0.587077133435863, 'reg_lambda': 0.7547204132304451}. Best is trial 829 with value: 0.5942795917588232.
[I 2024-11-06 22:34:41,751] Trial 951 finished with value: 0.593064395672521 and parameters: {'n_estimators': 162, 'max_depth': 7, 'learning_rate': 0.030719983060247064, 'gamma': 4.5178817100636754, 'min_child_weight': 5, 'subsample': 0.8665707023524222, 'colsample_bytree': 0.585855540986712, 'reg_alpha': 0.6455072033256682, 'reg_lambda': 0.809246723190467}. Best is trial 829 with value: 0.5942795917588232.
[I 2024-11-06 22:34:45,886] Trial 952 finished with value: 0.5932017445536107 and parameters: {'n_estimators': 157, 'max_depth': 6, 'learning_rate': 0.07971671267159856, 'gamma': 2.8900005175201, 'min_child_weight': 7, 'subsample': 0.8328251729379414, 'colsample_bytree': 0.564613174514495, 'reg_alpha': 0.5665363982114128, 'reg_lambda': 0.7865843880662988}. Best is trial 829 with value: 0.5942795917588232.
[I 2024-11-06 22:34:51,113] Trial 953 finished with value: 0.5928368355167006 and parameters: {'n_estimators': 170, 'max_depth': 7, 'learning_rate': 0.03264503802635326, 'gamma': 4.400907286131729, 'min_child_weight': 10, 'subsample': 0.8520203427421204, 'colsample_bytree': 0.6031847366918078, 'reg_alpha': 0.6260868527681055, 'reg_lambda': 0.41073484977745645}. Best is trial 829 with value: 0.5942795917588232.
[I 2024-11-06 22:34:54,954] Trial 954 finished with value: 0.5928911343544666 and parameters: {'n_estimators': 184, 'max_depth': 7, 'learning_rate': 0.10318705524936472, 'gamma': 4.998684390316654, 'min_child_weight': 4, 'subsample': 0.8808484150362348, 'colsample_bytree': 0.5740340534713776, 'reg_alpha': 0.5980408254963114, 'reg_lambda': 0.8283086326129444}. Best is trial 829 with value: 0.5942795917588232.
[I 2024-11-06 22:34:58,699] Trial 955 finished with value: 0.5928184528744415 and parameters: {'n_estimators': 180, 'max_depth': 7, 'learning_rate': 0.07623951897481826, 'gamma': 4.735105404493605, 'min_child_weight': 9, 'subsample': 0.8729340881945654, 'colsample_bytree': 0.5926339934214198, 'reg_alpha': 0.5522081560987325, 'reg_lambda': 0.7487310122489468}. Best is trial 829 with value: 0.5942795917588232.
[I 2024-11-06 22:35:03,332] Trial 956 finished with value: 0.593840968118214 and parameters: {'n_estimators': 163, 'max_depth': 7, 'learning_rate': 0.07200128872534609, 'gamma': 4.607100390106329, 'min_child_weight': 7, 'subsample': 0.8633801278337246, 'colsample_bytree': 0.5827459949057121, 'reg_alpha': 0.6484261341626366, 'reg_lambda': 0.4487019221267777}. Best is trial 829 with value: 0.5942795917588232.
[I 2024-11-06 22:35:08,842] Trial 957 finished with value: 0.5923308900848359 and parameters: {'n_estimators': 155, 'max_depth': 7, 'learning_rate': 0.020702401597467432, 'gamma': 4.302575201747477, 'min_child_weight': 8, 'subsample': 0.8193603848613706, 'colsample_bytree': 0.5605378672123498, 'reg_alpha': 0.4886057160989286, 'reg_lambda': 0.7687081295550897}. Best is trial 829 with value: 0.5942795917588232.
[I 2024-11-06 22:35:14,333] Trial 958 finished with value: 0.592498793528762 and parameters: {'n_estimators': 174, 'max_depth': 7, 'learning_rate': 0.029216844108631516, 'gamma': 4.513982826417173, 'min_child_weight': 5, 'subsample': 0.8480322595815794, 'colsample_bytree': 0.5720273517451787, 'reg_alpha': 0.5271220948660894, 'reg_lambda': 0.8037790538179501}. Best is trial 829 with value: 0.5942795917588232.
[I 2024-11-06 22:35:17,899] Trial 959 finished with value: 0.5924335558803947 and parameters: {'n_estimators': 166, 'max_depth': 7, 'learning_rate': 0.09091031401848886, 'gamma': 4.258272229198027, 'min_child_weight': 7, 'subsample': 0.875720060848798, 'colsample_bytree': 0.5973579701226757, 'reg_alpha': 0.6077222241643292, 'reg_lambda': 0.7833225692440509}. Best is trial 829 with value: 0.5942795917588232.
[I 2024-11-06 22:35:22,688] Trial 960 finished with value: 0.5928102678796929 and parameters: {'n_estimators': 159, 'max_depth': 7, 'learning_rate': 0.03646652550850318, 'gamma': 4.837976285986888, 'min_child_weight': 7, 'subsample': 0.8555685831298455, 'colsample_bytree': 0.5867636981109388, 'reg_alpha': 0.6311707546479054, 'reg_lambda': 0.7457635995958422}. Best is trial 829 with value: 0.5942795917588232.
[I 2024-11-06 22:35:25,526] Trial 961 finished with value: 0.5918676376329333 and parameters: {'n_estimators': 154, 'max_depth': 7, 'learning_rate': 0.20395763164678504, 'gamma': 4.67270078543215, 'min_child_weight': 9, 'subsample': 0.8828446218598611, 'colsample_bytree': 0.5765664015250848, 'reg_alpha': 0.5793234093428855, 'reg_lambda': 0.8490296021540875}. Best is trial 829 with value: 0.5942795917588232.
[I 2024-11-06 22:35:29,174] Trial 962 finished with value: 0.5936098888127787 and parameters: {'n_estimators': 160, 'max_depth': 7, 'learning_rate': 0.08268245291704017, 'gamma': 4.414407035579142, 'min_child_weight': 7, 'subsample': 0.8679853477815772, 'colsample_bytree': 0.562504486762335, 'reg_alpha': 0.6569266794737629, 'reg_lambda': 0.8161880093250072}. Best is trial 829 with value: 0.5942795917588232.
[I 2024-11-06 22:35:32,619] Trial 963 finished with value: 0.5929627168157559 and parameters: {'n_estimators': 166, 'max_depth': 7, 'learning_rate': 0.0694106592564031, 'gamma': 4.872170154758276, 'min_child_weight': 7, 'subsample': 0.8774026662019004, 'colsample_bytree': 0.6027320331437184, 'reg_alpha': 0.5476634084282064, 'reg_lambda': 0.7608816923981426}. Best is trial 829 with value: 0.5942795917588232.
[I 2024-11-06 22:35:36,650] Trial 964 finished with value: 0.5930733193499191 and parameters: {'n_estimators': 177, 'max_depth': 6, 'learning_rate': 0.06198197223781883, 'gamma': 4.335487505335622, 'min_child_weight': 5, 'subsample': 0.838704844818473, 'colsample_bytree': 0.584707462672027, 'reg_alpha': 0.5092052690541156, 'reg_lambda': 0.37808196908454517}. Best is trial 829 with value: 0.5942795917588232.
[I 2024-11-06 22:35:42,243] Trial 965 finished with value: 0.5931886920490769 and parameters: {'n_estimators': 190, 'max_depth': 7, 'learning_rate': 0.026586426190531545, 'gamma': 4.595935492368586, 'min_child_weight': 7, 'subsample': 0.8618995638344282, 'colsample_bytree': 0.5699801792670903, 'reg_alpha': 0.611365917311788, 'reg_lambda': 0.793138365982649}. Best is trial 829 with value: 0.5942795917588232.
[I 2024-11-06 22:35:46,110] Trial 966 finished with value: 0.5930817458848258 and parameters: {'n_estimators': 153, 'max_depth': 7, 'learning_rate': 0.07754087001262867, 'gamma': 4.453405566107889, 'min_child_weight': 7, 'subsample': 0.5327028754500763, 'colsample_bytree': 0.5552596556449733, 'reg_alpha': 0.6507888151150748, 'reg_lambda': 0.47890509983651486}. Best is trial 829 with value: 0.5942795917588232.
[I 2024-11-06 22:35:50,904] Trial 967 finished with value: 0.5927130604779134 and parameters: {'n_estimators': 171, 'max_depth': 7, 'learning_rate': 0.03436725251453174, 'gamma': 4.764230103133175, 'min_child_weight': 6, 'subsample': 0.8910244447734971, 'colsample_bytree': 0.6080943895949313, 'reg_alpha': 0.5818430680604593, 'reg_lambda': 0.8249784407737147}. Best is trial 829 with value: 0.5942795917588232.
[I 2024-11-06 22:35:56,490] Trial 968 finished with value: 0.5930252866863962 and parameters: {'n_estimators': 161, 'max_depth': 7, 'learning_rate': 0.016280835423346622, 'gamma': 4.638868214465221, 'min_child_weight': 8, 'subsample': 0.868967764396123, 'colsample_bytree': 0.5927061592053107, 'reg_alpha': 0.5676678340763694, 'reg_lambda': 0.7424390907445014}. Best is trial 829 with value: 0.5942795917588232.
[I 2024-11-06 22:36:00,429] Trial 969 finished with value: 0.5936400438793037 and parameters: {'n_estimators': 153, 'max_depth': 7, 'learning_rate': 0.06703230345441906, 'gamma': 4.264731836971978, 'min_child_weight': 7, 'subsample': 0.8535628422201805, 'colsample_bytree': 0.5784114771075829, 'reg_alpha': 0.6382122781103592, 'reg_lambda': 0.7690518236903838}. Best is trial 829 with value: 0.5942795917588232.
[I 2024-11-06 22:36:05,446] Trial 970 finished with value: 0.5931163204387918 and parameters: {'n_estimators': 168, 'max_depth': 7, 'learning_rate': 0.061504015955323274, 'gamma': 4.547783380473803, 'min_child_weight': 7, 'subsample': 0.8828400820668648, 'colsample_bytree': 0.5680726691964452, 'reg_alpha': 0.5957154588536847, 'reg_lambda': 0.800897241955813}. Best is trial 829 with value: 0.5942795917588232.
[I 2024-11-06 22:36:10,502] Trial 971 finished with value: 0.5935455325712202 and parameters: {'n_estimators': 153, 'max_depth': 7, 'learning_rate': 0.038536799981343274, 'gamma': 4.798629591560404, 'min_child_weight': 5, 'subsample': 0.8753465251432934, 'colsample_bytree': 0.5873080301980342, 'reg_alpha': 0.6640019227187168, 'reg_lambda': 0.7794040066966578}. Best is trial 829 with value: 0.5942795917588232.
[I 2024-11-06 22:36:13,474] Trial 972 finished with value: 0.5944482580513826 and parameters: {'n_estimators': 158, 'max_depth': 7, 'learning_rate': 0.2717592966085866, 'gamma': 4.999680910679529, 'min_child_weight': 6, 'subsample': 0.8451248976096803, 'colsample_bytree': 0.5774188799033887, 'reg_alpha': 0.5379472719971006, 'reg_lambda': 0.7416224323690531}. Best is trial 972 with value: 0.5944482580513826.
[I 2024-11-06 22:36:16,759] Trial 973 finished with value: 0.5929802794577256 and parameters: {'n_estimators': 158, 'max_depth': 6, 'learning_rate': 0.15321462381296955, 'gamma': 4.927752611407886, 'min_child_weight': 6, 'subsample': 0.8374435384755143, 'colsample_bytree': 0.5526439276827436, 'reg_alpha': 0.525614489649729, 'reg_lambda': 0.7400621870094839}. Best is trial 972 with value: 0.5944482580513826.
[I 2024-11-06 22:36:21,159] Trial 974 finished with value: 0.5927180429485516 and parameters: {'n_estimators': 155, 'max_depth': 7, 'learning_rate': 0.03543851373942302, 'gamma': 4.999331494045755, 'min_child_weight': 6, 'subsample': 0.8266848615059819, 'colsample_bytree': 0.5618560869205178, 'reg_alpha': 0.4727932477091308, 'reg_lambda': 0.7417259784537531}. Best is trial 972 with value: 0.5944482580513826.
[I 2024-11-06 22:36:24,252] Trial 975 finished with value: 0.5929162882470828 and parameters: {'n_estimators': 162, 'max_depth': 5, 'learning_rate': 0.10914266044086908, 'gamma': 4.9166028172212375, 'min_child_weight': 6, 'subsample': 0.8376625154042603, 'colsample_bytree': 0.5741049040645744, 'reg_alpha': 0.5103508379481825, 'reg_lambda': 0.04039735033256642}. Best is trial 972 with value: 0.5944482580513826.
[I 2024-11-06 22:36:27,099] Trial 976 finished with value: 0.5929669918280057 and parameters: {'n_estimators': 157, 'max_depth': 7, 'learning_rate': 0.26426578088607966, 'gamma': 4.8887124948656115, 'min_child_weight': 6, 'subsample': 0.8194491743252492, 'colsample_bytree': 0.5626086530236534, 'reg_alpha': 0.6609959337611129, 'reg_lambda': 0.7322070703650443}. Best is trial 972 with value: 0.5944482580513826.
[I 2024-11-06 22:36:30,294] Trial 977 finished with value: 0.592416238551613 and parameters: {'n_estimators': 151, 'max_depth': 7, 'learning_rate': 0.14392448528483925, 'gamma': 4.9247837970222275, 'min_child_weight': 6, 'subsample': 0.6695651863378893, 'colsample_bytree': 0.7076640790118808, 'reg_alpha': 0.5331089052950335, 'reg_lambda': 0.7560605170084095}. Best is trial 972 with value: 0.5944482580513826.
[I 2024-11-06 22:36:33,037] Trial 978 finished with value: 0.593589627814137 and parameters: {'n_estimators': 159, 'max_depth': 7, 'learning_rate': 0.25508164769163594, 'gamma': 4.938646042588874, 'min_child_weight': 6, 'subsample': 0.8255311796520506, 'colsample_bytree': 0.5745775018756801, 'reg_alpha': 0.4980903432138108, 'reg_lambda': 0.7387427491095843}. Best is trial 972 with value: 0.5944482580513826.
[I 2024-11-06 22:36:35,678] Trial 979 finished with value: 0.5937924578704454 and parameters: {'n_estimators': 151, 'max_depth': 7, 'learning_rate': 0.2769672856736588, 'gamma': 4.860422302686299, 'min_child_weight': 6, 'subsample': 0.8393473227486575, 'colsample_bytree': 0.5501740269981866, 'reg_alpha': 0.6365582152479101, 'reg_lambda': 0.7586608553558808}. Best is trial 972 with value: 0.5944482580513826.
[I 2024-11-06 22:36:40,015] Trial 980 finished with value: 0.5930882093397155 and parameters: {'n_estimators': 151, 'max_depth': 7, 'learning_rate': 0.040745001088644796, 'gamma': 4.906946577608149, 'min_child_weight': 6, 'subsample': 0.8477092465698998, 'colsample_bytree': 0.5784244335562855, 'reg_alpha': 0.6182701518623319, 'reg_lambda': 0.7326011337177172}. Best is trial 972 with value: 0.5944482580513826.
[I 2024-11-06 22:36:45,455] Trial 981 finished with value: 0.5924884709839957 and parameters: {'n_estimators': 163, 'max_depth': 7, 'learning_rate': 0.025270088667070558, 'gamma': 4.968107329919415, 'min_child_weight': 6, 'subsample': 0.8459394833493805, 'colsample_bytree': 0.5679991044577246, 'reg_alpha': 0.6664577044676949, 'reg_lambda': 0.7517092654089309}. Best is trial 972 with value: 0.5944482580513826.
[I 2024-11-06 22:36:48,056] Trial 982 finished with value: 0.5930180106192006 and parameters: {'n_estimators': 157, 'max_depth': 7, 'learning_rate': 0.2397238422130789, 'gamma': 4.816597560798269, 'min_child_weight': 6, 'subsample': 0.8303438856410306, 'colsample_bytree': 0.5970699680992969, 'reg_alpha': 0.6206789758679326, 'reg_lambda': 0.7689989417894124}. Best is trial 972 with value: 0.5944482580513826.
[I 2024-11-06 22:36:51,507] Trial 983 finished with value: 0.5914706815865662 and parameters: {'n_estimators': 162, 'max_depth': 7, 'learning_rate': 0.21952239867278117, 'gamma': 2.2357729627361254, 'min_child_weight': 6, 'subsample': 0.848666248006068, 'colsample_bytree': 0.5566976330741978, 'reg_alpha': 0.5442834473164763, 'reg_lambda': 0.7313161385010336}. Best is trial 972 with value: 0.5944482580513826.
[I 2024-11-06 22:36:54,182] Trial 984 finished with value: 0.5928407570241963 and parameters: {'n_estimators': 153, 'max_depth': 7, 'learning_rate': 0.2656362859172493, 'gamma': 4.978735632975984, 'min_child_weight': 6, 'subsample': 0.854127278632711, 'colsample_bytree': 0.5804318221776017, 'reg_alpha': 0.652873717184915, 'reg_lambda': 0.7577419951623613}. Best is trial 972 with value: 0.5944482580513826.
[I 2024-11-06 22:36:56,929] Trial 985 finished with value: 0.5913085164981785 and parameters: {'n_estimators': 149, 'max_depth': 7, 'learning_rate': 0.1813906277726563, 'gamma': 4.295621487933328, 'min_child_weight': 6, 'subsample': 0.857385063960964, 'colsample_bytree': 0.7872841406426294, 'reg_alpha': 0.45686139064516235, 'reg_lambda': 0.719503917769362}. Best is trial 972 with value: 0.5944482580513826.
[I 2024-11-06 22:36:59,999] Trial 986 finished with value: 0.5920946726117515 and parameters: {'n_estimators': 158, 'max_depth': 7, 'learning_rate': 0.16905808545015566, 'gamma': 4.227551011420198, 'min_child_weight': 6, 'subsample': 0.8431779996536782, 'colsample_bytree': 0.9508019578074717, 'reg_alpha': 0.6304125319653839, 'reg_lambda': 0.7353653251624571}. Best is trial 972 with value: 0.5944482580513826.
[I 2024-11-06 22:37:03,864] Trial 987 finished with value: 0.5934963756858076 and parameters: {'n_estimators': 164, 'max_depth': 6, 'learning_rate': 0.13731174195602913, 'gamma': 4.983377330945936, 'min_child_weight': 6, 'subsample': 0.8576199650311898, 'colsample_bytree': 0.5645154258854808, 'reg_alpha': 0.5991922232687286, 'reg_lambda': 0.7701815697661692}. Best is trial 972 with value: 0.5944482580513826.
[I 2024-11-06 22:37:06,758] Trial 988 finished with value: 0.5927334003584442 and parameters: {'n_estimators': 153, 'max_depth': 7, 'learning_rate': 0.270324577521503, 'gamma': 4.8053899230506225, 'min_child_weight': 5, 'subsample': 0.8330425730542323, 'colsample_bytree': 0.5913285870857089, 'reg_alpha': 0.4825837355605286, 'reg_lambda': 0.7474291407341666}. Best is trial 972 with value: 0.5944482580513826.
[I 2024-11-06 22:37:10,988] Trial 989 finished with value: 0.5937396823651481 and parameters: {'n_estimators': 149, 'max_depth': 7, 'learning_rate': 0.057270229826597276, 'gamma': 4.379712538104803, 'min_child_weight': 7, 'subsample': 0.8627131829789795, 'colsample_bytree': 0.5719973746721018, 'reg_alpha': 0.6711050289087067, 'reg_lambda': 0.7846632239559238}. Best is trial 972 with value: 0.5944482580513826.
[I 2024-11-06 22:37:16,386] Trial 990 finished with value: 0.5928442936089431 and parameters: {'n_estimators': 157, 'max_depth': 7, 'learning_rate': 0.02099022926746609, 'gamma': 4.802177209197141, 'min_child_weight': 7, 'subsample': 0.887728878737569, 'colsample_bytree': 0.5847278070093953, 'reg_alpha': 0.5070212990160583, 'reg_lambda': 0.5302818462285777}. Best is trial 972 with value: 0.5944482580513826.
[I 2024-11-06 22:37:19,059] Trial 991 finished with value: 0.592616650984964 and parameters: {'n_estimators': 165, 'max_depth': 7, 'learning_rate': 0.2892168032833425, 'gamma': 4.272933158666248, 'min_child_weight': 7, 'subsample': 0.8461587803121174, 'colsample_bytree': 0.6100379350933921, 'reg_alpha': 0.5746552183212084, 'reg_lambda': 0.7204623440925674}. Best is trial 972 with value: 0.5944482580513826.
[I 2024-11-06 22:37:23,764] Trial 992 finished with value: 0.5932245503484733 and parameters: {'n_estimators': 149, 'max_depth': 7, 'learning_rate': 0.03351534279735127, 'gamma': 4.892121744505543, 'min_child_weight': 6, 'subsample': 0.8118664400369089, 'colsample_bytree': 0.5978549929066788, 'reg_alpha': 0.644420093155418, 'reg_lambda': 0.7692665225445114}. Best is trial 972 with value: 0.5944482580513826.
[I 2024-11-06 22:37:27,345] Trial 993 finished with value: 0.59398716916129 and parameters: {'n_estimators': 117, 'max_depth': 7, 'learning_rate': 0.043958361227807156, 'gamma': 4.397645139630973, 'min_child_weight': 7, 'subsample': 0.8658677759246453, 'colsample_bytree': 0.5489253262656388, 'reg_alpha': 0.6895338218734839, 'reg_lambda': 0.8864707131913129}. Best is trial 972 with value: 0.5944482580513826.
[I 2024-11-06 22:37:30,473] Trial 994 finished with value: 0.5920279598111553 and parameters: {'n_estimators': 127, 'max_depth': 7, 'learning_rate': 0.1319953724720514, 'gamma': 4.213760898783201, 'min_child_weight': 6, 'subsample': 0.8581891220428501, 'colsample_bytree': 0.5374299023398003, 'reg_alpha': 0.6915815955084045, 'reg_lambda': 0.8723811224928427}. Best is trial 972 with value: 0.5944482580513826.
[I 2024-11-06 22:37:34,614] Trial 995 finished with value: 0.5935294512865807 and parameters: {'n_estimators': 115, 'max_depth': 7, 'learning_rate': 0.04029932120017925, 'gamma': 4.366509100383303, 'min_child_weight': 7, 'subsample': 0.8441783159364615, 'colsample_bytree': 0.5501065047055229, 'reg_alpha': 0.6795217442329716, 'reg_lambda': 0.9189959678226574}. Best is trial 972 with value: 0.5944482580513826.
[I 2024-11-06 22:37:38,842] Trial 996 finished with value: 0.5928773455928102 and parameters: {'n_estimators': 148, 'max_depth': 7, 'learning_rate': 0.04393883492427266, 'gamma': 4.3723436664425845, 'min_child_weight': 7, 'subsample': 0.8326307414069779, 'colsample_bytree': 0.5460286529876327, 'reg_alpha': 0.6995453556549166, 'reg_lambda': 0.7146553329412059}. Best is trial 972 with value: 0.5944482580513826.
[I 2024-11-06 22:37:40,978] Trial 997 finished with value: 0.592139528083147 and parameters: {'n_estimators': 110, 'max_depth': 7, 'learning_rate': 0.24701933787184654, 'gamma': 4.24387736275832, 'min_child_weight': 5, 'subsample': 0.863628092133122, 'colsample_bytree': 0.5504958848154309, 'reg_alpha': 0.7195134393029634, 'reg_lambda': 0.9377204531000165}. Best is trial 972 with value: 0.5944482580513826.
[I 2024-11-06 22:37:43,489] Trial 998 finished with value: 0.5918851908415591 and parameters: {'n_estimators': 109, 'max_depth': 7, 'learning_rate': 0.1996083966966246, 'gamma': 4.293297947804729, 'min_child_weight': 7, 'subsample': 0.8519254790832604, 'colsample_bytree': 0.5456452901811908, 'reg_alpha': 0.6926229009393183, 'reg_lambda': 0.9058521292329254}. Best is trial 972 with value: 0.5944482580513826.
