[I 2024-11-06 21:18:32,014] Trial 894 finished with value: 0.5970398086565927 and parameters: {'n_estimators': 65, 'max_depth': 3, 'min_samples_split': 9, 'min_samples_leaf': 8}. Best is trial 406 with value: 0.5986570551043842.
[I 2024-11-06 21:18:38,373] Trial 895 finished with value: 0.5922769558412645 and parameters: {'n_estimators': 80, 'max_depth': 9, 'min_samples_split': 3, 'min_samples_leaf': 9}. Best is trial 406 with value: 0.5986570551043842.
[I 2024-11-06 21:18:48,628] Trial 896 finished with value: 0.5893024425510676 and parameters: {'n_estimators': 73, 'max_depth': 21, 'min_samples_split': 2, 'min_samples_leaf': 8}. Best is trial 406 with value: 0.5986570551043842.
[I 2024-11-06 21:19:00,760] Trial 897 finished with value: 0.5880667843535683 and parameters: {'n_estimators': 84, 'max_depth': 23, 'min_samples_split': 4, 'min_samples_leaf': 8}. Best is trial 406 with value: 0.5986570551043842.
[I 2024-11-06 21:19:04,800] Trial 898 finished with value: 0.5926369311315918 and parameters: {'n_estimators': 69, 'max_depth': 5, 'min_samples_split': 3, 'min_samples_leaf': 7}. Best is trial 406 with value: 0.5986570551043842.
[I 2024-11-06 21:19:07,574] Trial 899 finished with value: 0.5918129964131911 and parameters: {'n_estimators': 77, 'max_depth': 2, 'min_samples_split': 5, 'min_samples_leaf': 9}. Best is trial 406 with value: 0.5986570551043842.
[I 2024-11-06 21:19:11,079] Trial 900 finished with value: 0.5982672842421276 and parameters: {'n_estimators': 80, 'max_depth': 3, 'min_samples_split': 2, 'min_samples_leaf': 7}. Best is trial 406 with value: 0.5986570551043842.
[I 2024-11-06 21:19:13,734] Trial 901 finished with value: 0.592437301835236 and parameters: {'n_estimators': 74, 'max_depth': 2, 'min_samples_split': 3, 'min_samples_leaf': 8}. Best is trial 406 with value: 0.5986570551043842.
[I 2024-11-06 21:19:17,202] Trial 902 finished with value: 0.5925940133487139 and parameters: {'n_estimators': 70, 'max_depth': 4, 'min_samples_split': 3, 'min_samples_leaf': 9}. Best is trial 406 with value: 0.5986570551043842.
[I 2024-11-06 21:19:21,457] Trial 903 finished with value: 0.5913338742271412 and parameters: {'n_estimators': 78, 'max_depth': 5, 'min_samples_split': 5, 'min_samples_leaf': 12}. Best is trial 406 with value: 0.5986570551043842.
[I 2024-11-06 21:19:23,908] Trial 904 finished with value: 0.5917627460404729 and parameters: {'n_estimators': 84, 'max_depth': 1, 'min_samples_split': 4, 'min_samples_leaf': 13}. Best is trial 406 with value: 0.5986570551043842.
[I 2024-11-06 21:19:28,126] Trial 905 finished with value: 0.5937069850425958 and parameters: {'n_estimators': 67, 'max_depth': 6, 'min_samples_split': 4, 'min_samples_leaf': 8}. Best is trial 406 with value: 0.5986570551043842.
[I 2024-11-06 21:19:37,111] Trial 906 finished with value: 0.5873215001481927 and parameters: {'n_estimators': 59, 'max_depth': 27, 'min_samples_split': 2, 'min_samples_leaf': 9}. Best is trial 406 with value: 0.5986570551043842.
[I 2024-11-06 21:19:40,320] Trial 907 finished with value: 0.5986500599336075 and parameters: {'n_estimators': 74, 'max_depth': 3, 'min_samples_split': 4, 'min_samples_leaf': 8}. Best is trial 406 with value: 0.5986570551043842.
[I 2024-11-06 21:19:42,873] Trial 908 finished with value: 0.5921668994755558 and parameters: {'n_estimators': 72, 'max_depth': 2, 'min_samples_split': 4, 'min_samples_leaf': 8}. Best is trial 406 with value: 0.5986570551043842.
[I 2024-11-06 21:19:46,073] Trial 909 finished with value: 0.5930995038885465 and parameters: {'n_estimators': 64, 'max_depth': 4, 'min_samples_split': 4, 'min_samples_leaf': 9}. Best is trial 406 with value: 0.5986570551043842.
[I 2024-11-06 21:19:49,560] Trial 910 finished with value: 0.5983996657447802 and parameters: {'n_estimators': 81, 'max_depth': 3, 'min_samples_split': 4, 'min_samples_leaf': 8}. Best is trial 406 with value: 0.5986570551043842.
[I 2024-11-06 21:19:53,205] Trial 911 finished with value: 0.5924644591100414 and parameters: {'n_estimators': 76, 'max_depth': 4, 'min_samples_split': 5, 'min_samples_leaf': 8}. Best is trial 406 with value: 0.5986570551043842.
[I 2024-11-06 21:19:55,789] Trial 912 finished with value: 0.5917232621615163 and parameters: {'n_estimators': 88, 'max_depth': 1, 'min_samples_split': 4, 'min_samples_leaf': 9}. Best is trial 406 with value: 0.5986570551043842.
[I 2024-11-06 21:19:58,906] Trial 913 finished with value: 0.59836501910812 and parameters: {'n_estimators': 70, 'max_depth': 3, 'min_samples_split': 5, 'min_samples_leaf': 8}. Best is trial 406 with value: 0.5986570551043842.
[I 2024-11-06 21:20:03,128] Trial 914 finished with value: 0.5917014915859481 and parameters: {'n_estimators': 75, 'max_depth': 5, 'min_samples_split': 4, 'min_samples_leaf': 9}. Best is trial 406 with value: 0.5986570551043842.
[I 2024-11-06 21:20:06,108] Trial 915 finished with value: 0.5909627079043318 and parameters: {'n_estimators': 79, 'max_depth': 2, 'min_samples_split': 4, 'min_samples_leaf': 8}. Best is trial 406 with value: 0.5986570551043842.
[I 2024-11-06 21:20:09,587] Trial 916 finished with value: 0.5986894683732882 and parameters: {'n_estimators': 83, 'max_depth': 3, 'min_samples_split': 5, 'min_samples_leaf': 12}. Best is trial 916 with value: 0.5986894683732882.
[I 2024-11-06 21:20:12,699] Trial 917 finished with value: 0.5914249400857393 and parameters: {'n_estimators': 89, 'max_depth': 2, 'min_samples_split': 5, 'min_samples_leaf': 12}. Best is trial 916 with value: 0.5986894683732882.
[I 2024-11-06 21:20:17,284] Trial 918 finished with value: 0.5905014238009235 and parameters: {'n_estimators': 86, 'max_depth': 5, 'min_samples_split': 5, 'min_samples_leaf': 12}. Best is trial 916 with value: 0.5986894683732882.
[I 2024-11-06 21:20:21,091] Trial 919 finished with value: 0.5984788704693658 and parameters: {'n_estimators': 93, 'max_depth': 3, 'min_samples_split': 5, 'min_samples_leaf': 12}. Best is trial 916 with value: 0.5986894683732882.
[I 2024-11-06 21:20:25,091] Trial 920 finished with value: 0.593213112546527 and parameters: {'n_estimators': 84, 'max_depth': 4, 'min_samples_split': 5, 'min_samples_leaf': 13}. Best is trial 916 with value: 0.5986894683732882.
[I 2024-11-06 21:20:30,323] Trial 921 finished with value: 0.5938401671355393 and parameters: {'n_estimators': 86, 'max_depth': 6, 'min_samples_split': 5, 'min_samples_leaf': 12}. Best is trial 916 with value: 0.5986894683732882.
[I 2024-11-06 21:20:32,795] Trial 922 finished with value: 0.5917571992963908 and parameters: {'n_estimators': 83, 'max_depth': 1, 'min_samples_split': 6, 'min_samples_leaf': 12}. Best is trial 916 with value: 0.5986894683732882.
[I 2024-11-06 21:20:36,893] Trial 923 finished with value: 0.5978632367896586 and parameters: {'n_estimators': 102, 'max_depth': 3, 'min_samples_split': 5, 'min_samples_leaf': 13}. Best is trial 916 with value: 0.5986894683732882.
[I 2024-11-06 21:20:41,085] Trial 924 finished with value: 0.5937320028583633 and parameters: {'n_estimators': 89, 'max_depth': 4, 'min_samples_split': 15, 'min_samples_leaf': 12}. Best is trial 916 with value: 0.5986894683732882.
[I 2024-11-06 21:20:43,983] Trial 925 finished with value: 0.5912775839902931 and parameters: {'n_estimators': 82, 'max_depth': 2, 'min_samples_split': 5, 'min_samples_leaf': 12}. Best is trial 916 with value: 0.5986894683732882.
[I 2024-11-06 21:20:47,378] Trial 926 finished with value: 0.5983250697326877 and parameters: {'n_estimators': 79, 'max_depth': 3, 'min_samples_split': 7, 'min_samples_leaf': 11}. Best is trial 916 with value: 0.5986894683732882.
[I 2024-11-06 21:20:51,355] Trial 927 finished with value: 0.5928900988275729 and parameters: {'n_estimators': 83, 'max_depth': 4, 'min_samples_split': 6, 'min_samples_leaf': 13}. Best is trial 916 with value: 0.5986894683732882.
[I 2024-11-06 21:20:54,563] Trial 928 finished with value: 0.5903277534613821 and parameters: {'n_estimators': 92, 'max_depth': 2, 'min_samples_split': 5, 'min_samples_leaf': 12}. Best is trial 916 with value: 0.5986894683732882.
[I 2024-11-06 21:20:59,139] Trial 929 finished with value: 0.5904421553042433 and parameters: {'n_estimators': 86, 'max_depth': 5, 'min_samples_split': 6, 'min_samples_leaf': 11}. Best is trial 916 with value: 0.5986894683732882.
[I 2024-11-06 21:21:01,535] Trial 930 finished with value: 0.5917322325167881 and parameters: {'n_estimators': 79, 'max_depth': 1, 'min_samples_split': 5, 'min_samples_leaf': 13}. Best is trial 916 with value: 0.5986894683732882.
[I 2024-11-06 21:21:05,178] Trial 931 finished with value: 0.5983969939015764 and parameters: {'n_estimators': 81, 'max_depth': 3, 'min_samples_split': 4, 'min_samples_leaf': 11}. Best is trial 916 with value: 0.5986894683732882.
[I 2024-11-06 21:21:10,280] Trial 932 finished with value: 0.5934438520092646 and parameters: {'n_estimators': 77, 'max_depth': 7, 'min_samples_split': 5, 'min_samples_leaf': 12}. Best is trial 916 with value: 0.5986894683732882.
[I 2024-11-06 21:21:13,928] Trial 933 finished with value: 0.5926038512407364 and parameters: {'n_estimators': 74, 'max_depth': 4, 'min_samples_split': 4, 'min_samples_leaf': 9}. Best is trial 916 with value: 0.5986894683732882.
[I 2024-11-06 21:21:17,019] Trial 934 finished with value: 0.5905877610539826 and parameters: {'n_estimators': 88, 'max_depth': 2, 'min_samples_split': 3, 'min_samples_leaf': 9}. Best is trial 916 with value: 0.5986894683732882.
[I 2024-11-06 21:21:21,558] Trial 935 finished with value: 0.5911305115107979 and parameters: {'n_estimators': 82, 'max_depth': 5, 'min_samples_split': 4, 'min_samples_leaf': 11}. Best is trial 916 with value: 0.5986894683732882.
[I 2024-11-06 21:21:32,869] Trial 936 finished with value: 0.5895732265370731 and parameters: {'n_estimators': 78, 'max_depth': 43, 'min_samples_split': 3, 'min_samples_leaf': 12}. Best is trial 916 with value: 0.5986894683732882.
[I 2024-11-06 21:21:36,822] Trial 937 finished with value: 0.5982035221184013 and parameters: {'n_estimators': 97, 'max_depth': 3, 'min_samples_split': 5, 'min_samples_leaf': 14}. Best is trial 916 with value: 0.5986894683732882.
[I 2024-11-06 21:21:38,912] Trial 938 finished with value: 0.5918286372124043 and parameters: {'n_estimators': 68, 'max_depth': 1, 'min_samples_split': 4, 'min_samples_leaf': 12}. Best is trial 916 with value: 0.5986894683732882.
[I 2024-11-06 21:21:42,400] Trial 939 finished with value: 0.5928216985213677 and parameters: {'n_estimators': 72, 'max_depth': 4, 'min_samples_split': 4, 'min_samples_leaf': 8}. Best is trial 916 with value: 0.5986894683732882.
[I 2024-11-06 21:21:45,184] Trial 940 finished with value: 0.5921729033109402 and parameters: {'n_estimators': 76, 'max_depth': 2, 'min_samples_split': 3, 'min_samples_leaf': 13}. Best is trial 916 with value: 0.5986894683732882.
[I 2024-11-06 21:21:48,987] Trial 941 finished with value: 0.5985903302578077 and parameters: {'n_estimators': 85, 'max_depth': 3, 'min_samples_split': 5, 'min_samples_leaf': 9}. Best is trial 916 with value: 0.5986894683732882.
[I 2024-11-06 21:21:52,878] Trial 942 finished with value: 0.5919397398944188 and parameters: {'n_estimators': 80, 'max_depth': 4, 'min_samples_split': 18, 'min_samples_leaf': 8}. Best is trial 916 with value: 0.5986894683732882.
[I 2024-11-06 21:21:57,383] Trial 943 finished with value: 0.5935657554518909 and parameters: {'n_estimators': 72, 'max_depth': 6, 'min_samples_split': 4, 'min_samples_leaf': 9}. Best is trial 916 with value: 0.5986894683732882.
[I 2024-11-06 21:22:04,983] Trial 944 finished with value: 0.5910329445459361 and parameters: {'n_estimators': 64, 'max_depth': 15, 'min_samples_split': 3, 'min_samples_leaf': 12}. Best is trial 916 with value: 0.5986894683732882.
[I 2024-11-06 21:22:07,728] Trial 945 finished with value: 0.5921729033109402 and parameters: {'n_estimators': 76, 'max_depth': 2, 'min_samples_split': 5, 'min_samples_leaf': 11}. Best is trial 916 with value: 0.5986894683732882.
[I 2024-11-06 21:22:10,741] Trial 946 finished with value: 0.597914310340087 and parameters: {'n_estimators': 69, 'max_depth': 3, 'min_samples_split': 3, 'min_samples_leaf': 8}. Best is trial 916 with value: 0.5986894683732882.
[I 2024-11-06 21:22:15,199] Trial 947 finished with value: 0.5929700817304316 and parameters: {'n_estimators': 82, 'max_depth': 5, 'min_samples_split': 4, 'min_samples_leaf': 4}. Best is trial 916 with value: 0.5986894683732882.
[I 2024-11-06 21:22:18,331] Trial 948 finished with value: 0.5913311118386629 and parameters: {'n_estimators': 91, 'max_depth': 2, 'min_samples_split': 4, 'min_samples_leaf': 9}. Best is trial 916 with value: 0.5986894683732882.
[I 2024-11-06 21:22:21,901] Trial 949 finished with value: 0.5930398176259397 and parameters: {'n_estimators': 73, 'max_depth': 4, 'min_samples_split': 3, 'min_samples_leaf': 11}. Best is trial 916 with value: 0.5986894683732882.
[I 2024-11-06 21:22:24,247] Trial 950 finished with value: 0.5917145536290467 and parameters: {'n_estimators': 78, 'max_depth': 1, 'min_samples_split': 14, 'min_samples_leaf': 13}. Best is trial 916 with value: 0.5986894683732882.
[I 2024-11-06 21:22:27,084] Trial 951 finished with value: 0.5978041066304103 and parameters: {'n_estimators': 67, 'max_depth': 3, 'min_samples_split': 4, 'min_samples_leaf': 8}. Best is trial 916 with value: 0.5986894683732882.
[I 2024-11-06 21:22:31,719] Trial 952 finished with value: 0.5907593576093204 and parameters: {'n_estimators': 86, 'max_depth': 5, 'min_samples_split': 6, 'min_samples_leaf': 9}. Best is trial 916 with value: 0.5986894683732882.
[I 2024-11-06 21:22:35,084] Trial 953 finished with value: 0.5986322175714879 and parameters: {'n_estimators': 75, 'max_depth': 3, 'min_samples_split': 3, 'min_samples_leaf': 8}. Best is trial 916 with value: 0.5986894683732882.
[I 2024-11-06 21:22:37,976] Trial 954 finished with value: 0.5913878577048239 and parameters: {'n_estimators': 81, 'max_depth': 2, 'min_samples_split': 5, 'min_samples_leaf': 12}. Best is trial 916 with value: 0.5986894683732882.
[I 2024-11-06 21:22:41,466] Trial 955 finished with value: 0.5925940133487139 and parameters: {'n_estimators': 70, 'max_depth': 4, 'min_samples_split': 4, 'min_samples_leaf': 9}. Best is trial 916 with value: 0.5986894683732882.
[I 2024-11-06 21:22:43,762] Trial 956 finished with value: 0.5918772194346223 and parameters: {'n_estimators': 77, 'max_depth': 1, 'min_samples_split': 3, 'min_samples_leaf': 11}. Best is trial 916 with value: 0.5986894683732882.
[I 2024-11-06 21:22:54,429] Trial 957 finished with value: 0.5911139689229838 and parameters: {'n_estimators': 84, 'max_depth': 19, 'min_samples_split': 5, 'min_samples_leaf': 12}. Best is trial 916 with value: 0.5986894683732882.
[I 2024-11-06 21:22:58,408] Trial 958 finished with value: 0.592948059700192 and parameters: {'n_estimators': 63, 'max_depth': 6, 'min_samples_split': 4, 'min_samples_leaf': 10}. Best is trial 916 with value: 0.5986894683732882.
[I 2024-11-06 21:23:01,551] Trial 959 finished with value: 0.5985250773600217 and parameters: {'n_estimators': 71, 'max_depth': 3, 'min_samples_split': 6, 'min_samples_leaf': 8}. Best is trial 916 with value: 0.5986894683732882.
[I 2024-11-06 21:23:05,661] Trial 960 finished with value: 0.5926038512407364 and parameters: {'n_estimators': 74, 'max_depth': 4, 'min_samples_split': 7, 'min_samples_leaf': 9}. Best is trial 916 with value: 0.5986894683732882.
[I 2024-11-06 21:23:08,530] Trial 961 finished with value: 0.5910571071304002 and parameters: {'n_estimators': 80, 'max_depth': 2, 'min_samples_split': 3, 'min_samples_leaf': 8}. Best is trial 916 with value: 0.5986894683732882.
[I 2024-11-06 21:23:11,452] Trial 962 finished with value: 0.5971150928903365 and parameters: {'n_estimators': 66, 'max_depth': 3, 'min_samples_split': 4, 'min_samples_leaf': 13}. Best is trial 916 with value: 0.5986894683732882.
[I 2024-11-06 21:23:16,237] Trial 963 finished with value: 0.59047331681365 and parameters: {'n_estimators': 89, 'max_depth': 5, 'min_samples_split': 3, 'min_samples_leaf': 10}. Best is trial 916 with value: 0.5986894683732882.
[I 2024-11-06 21:23:20,046] Trial 964 finished with value: 0.5924571998092588 and parameters: {'n_estimators': 76, 'max_depth': 4, 'min_samples_split': 4, 'min_samples_leaf': 11}. Best is trial 916 with value: 0.5986894683732882.
[I 2024-11-06 21:23:22,612] Trial 965 finished with value: 0.5921668994755558 and parameters: {'n_estimators': 72, 'max_depth': 2, 'min_samples_split': 5, 'min_samples_leaf': 8}. Best is trial 916 with value: 0.5986894683732882.
[I 2024-11-06 21:23:26,088] Trial 966 finished with value: 0.5985945875604136 and parameters: {'n_estimators': 83, 'max_depth': 3, 'min_samples_split': 5, 'min_samples_leaf': 17}. Best is trial 916 with value: 0.5986894683732882.
[I 2024-11-06 21:23:28,404] Trial 967 finished with value: 0.5917145536290467 and parameters: {'n_estimators': 78, 'max_depth': 1, 'min_samples_split': 3, 'min_samples_leaf': 12}. Best is trial 916 with value: 0.5986894683732882.
[I 2024-11-06 21:23:32,256] Trial 968 finished with value: 0.5914942315029725 and parameters: {'n_estimators': 68, 'max_depth': 5, 'min_samples_split': 4, 'min_samples_leaf': 9}. Best is trial 916 with value: 0.5986894683732882.
[I 2024-11-06 21:23:35,861] Trial 969 finished with value: 0.5929338755342398 and parameters: {'n_estimators': 73, 'max_depth': 4, 'min_samples_split': 3, 'min_samples_leaf': 9}. Best is trial 916 with value: 0.5986894683732882.
[I 2024-11-06 21:23:40,443] Trial 970 finished with value: 0.5927093965204365 and parameters: {'n_estimators': 61, 'max_depth': 8, 'min_samples_split': 5, 'min_samples_leaf': 8}. Best is trial 916 with value: 0.5986894683732882.
[I 2024-11-06 21:23:43,477] Trial 971 finished with value: 0.5912614524222075 and parameters: {'n_estimators': 86, 'max_depth': 2, 'min_samples_split': 4, 'min_samples_leaf': 13}. Best is trial 916 with value: 0.5986894683732882.
[I 2024-11-06 21:23:47,385] Trial 972 finished with value: 0.5921945046293562 and parameters: {'n_estimators': 80, 'max_depth': 4, 'min_samples_split': 3, 'min_samples_leaf': 12}. Best is trial 916 with value: 0.5986894683732882.
[I 2024-11-06 21:23:50,161] Trial 973 finished with value: 0.5921729033109402 and parameters: {'n_estimators': 76, 'max_depth': 2, 'min_samples_split': 4, 'min_samples_leaf': 8}. Best is trial 916 with value: 0.5986894683732882.
[I 2024-11-06 21:23:53,180] Trial 974 finished with value: 0.5983430707667774 and parameters: {'n_estimators': 70, 'max_depth': 3, 'min_samples_split': 3, 'min_samples_leaf': 10}. Best is trial 916 with value: 0.5986894683732882.
[I 2024-11-06 21:23:58,540] Trial 975 finished with value: 0.5929960038712154 and parameters: {'n_estimators': 81, 'max_depth': 7, 'min_samples_split': 4, 'min_samples_leaf': 14}. Best is trial 916 with value: 0.5986894683732882.
[I 2024-11-06 21:24:03,228] Trial 976 finished with value: 0.5933812303739974 and parameters: {'n_estimators': 74, 'max_depth': 6, 'min_samples_split': 13, 'min_samples_leaf': 9}. Best is trial 916 with value: 0.5986894683732882.
[I 2024-11-06 21:24:05,715] Trial 977 finished with value: 0.5917145536290467 and parameters: {'n_estimators': 78, 'max_depth': 1, 'min_samples_split': 8, 'min_samples_leaf': 11}. Best is trial 916 with value: 0.5986894683732882.
[I 2024-11-06 21:24:19,435] Trial 978 finished with value: 0.5868675077437169 and parameters: {'n_estimators': 94, 'max_depth': 25, 'min_samples_split': 9, 'min_samples_leaf': 8}. Best is trial 916 with value: 0.5986894683732882.
[I 2024-11-06 21:24:22,265] Trial 979 finished with value: 0.5971150928903365 and parameters: {'n_estimators': 66, 'max_depth': 3, 'min_samples_split': 5, 'min_samples_leaf': 12}. Best is trial 916 with value: 0.5986894683732882.
[I 2024-11-06 21:24:26,313] Trial 980 finished with value: 0.5924399176038516 and parameters: {'n_estimators': 84, 'max_depth': 4, 'min_samples_split': 6, 'min_samples_leaf': 8}. Best is trial 916 with value: 0.5986894683732882.
[I 2024-11-06 21:24:31,218] Trial 981 finished with value: 0.5904226306156992 and parameters: {'n_estimators': 89, 'max_depth': 5, 'min_samples_split': 3, 'min_samples_leaf': 11}. Best is trial 916 with value: 0.5986894683732882.
[I 2024-11-06 21:24:33,863] Trial 982 finished with value: 0.5921026234911293 and parameters: {'n_estimators': 71, 'max_depth': 2, 'min_samples_split': 12, 'min_samples_leaf': 13}. Best is trial 916 with value: 0.5986894683732882.
[I 2024-11-06 21:24:37,185] Trial 983 finished with value: 0.5984890156785799 and parameters: {'n_estimators': 77, 'max_depth': 3, 'min_samples_split': 4, 'min_samples_leaf': 9}. Best is trial 916 with value: 0.5986894683732882.
[I 2024-11-06 21:24:39,805] Trial 984 finished with value: 0.592437301835236 and parameters: {'n_estimators': 74, 'max_depth': 2, 'min_samples_split': 3, 'min_samples_leaf': 10}. Best is trial 916 with value: 0.5986894683732882.
[I 2024-11-06 21:24:43,178] Trial 985 finished with value: 0.592836049582918 and parameters: {'n_estimators': 68, 'max_depth': 4, 'min_samples_split': 5, 'min_samples_leaf': 12}. Best is trial 916 with value: 0.5986894683732882.
[I 2024-11-06 21:24:55,954] Trial 986 finished with value: 0.5874752320778088 and parameters: {'n_estimators': 83, 'max_depth': 30, 'min_samples_split': 4, 'min_samples_leaf': 8}. Best is trial 916 with value: 0.5986894683732882.
[I 2024-11-06 21:24:58,166] Trial 987 finished with value: 0.5919598878858062 and parameters: {'n_estimators': 73, 'max_depth': 1, 'min_samples_split': 3, 'min_samples_leaf': 8}. Best is trial 916 with value: 0.5986894683732882.
[I 2024-11-06 21:25:02,596] Trial 988 finished with value: 0.5914583949991084 and parameters: {'n_estimators': 79, 'max_depth': 5, 'min_samples_split': 4, 'min_samples_leaf': 9}. Best is trial 916 with value: 0.5986894683732882.
