[I 2024-11-06 22:11:59,366] Trial 630 finished with value: 0.5937368905055284 and parameters: {'n_estimators': 156, 'max_depth': 7, 'learning_rate': 0.06368161300512594, 'gamma': 4.384245341436475, 'min_child_weight': 8, 'subsample': 0.8706256017403928, 'colsample_bytree': 0.5902881210119576, 'reg_alpha': 0.6531323044981632, 'reg_lambda': 0.7239540647277525}. Best is trial 625 with value: 0.5940826637391339.
[I 2024-11-06 22:12:03,467] Trial 631 finished with value: 0.5935768154973083 and parameters: {'n_estimators': 147, 'max_depth': 7, 'learning_rate': 0.059751765258349965, 'gamma': 4.199942417916127, 'min_child_weight': 7, 'subsample': 0.8877786006764509, 'colsample_bytree': 0.584932590560971, 'reg_alpha': 0.7505437866833078, 'reg_lambda': 0.7307223597568131}. Best is trial 625 with value: 0.5940826637391339.
[I 2024-11-06 22:12:07,831] Trial 632 finished with value: 0.5934612360358248 and parameters: {'n_estimators': 154, 'max_depth': 8, 'learning_rate': 0.0697292513195066, 'gamma': 4.253862053965661, 'min_child_weight': 7, 'subsample': 0.854248967270338, 'colsample_bytree': 0.5741123030212585, 'reg_alpha': 0.694077759639603, 'reg_lambda': 0.7495292302201901}. Best is trial 625 with value: 0.5940826637391339.
[I 2024-11-06 22:12:11,577] Trial 633 finished with value: 0.5938520969268282 and parameters: {'n_estimators': 145, 'max_depth': 7, 'learning_rate': 0.06276685346272375, 'gamma': 4.088615442199981, 'min_child_weight': 7, 'subsample': 0.8634091095460769, 'colsample_bytree': 0.5940350713014604, 'reg_alpha': 0.6673254325921572, 'reg_lambda': 0.7259509084272149}. Best is trial 625 with value: 0.5940826637391339.
[I 2024-11-06 22:12:15,075] Trial 634 finished with value: 0.5923195641617978 and parameters: {'n_estimators': 140, 'max_depth': 7, 'learning_rate': 0.07281014222828061, 'gamma': 4.055795343487805, 'min_child_weight': 7, 'subsample': 0.8381594110088545, 'colsample_bytree': 0.59503573632813, 'reg_alpha': 0.6609777981667637, 'reg_lambda': 0.743345711272548}. Best is trial 625 with value: 0.5940826637391339.
[I 2024-11-06 22:12:20,360] Trial 635 finished with value: 0.5918968344955113 and parameters: {'n_estimators': 149, 'max_depth': 7, 'learning_rate': 0.06606433888507925, 'gamma': 0.7616188595316153, 'min_child_weight': 7, 'subsample': 0.8792367450016566, 'colsample_bytree': 0.597144515870533, 'reg_alpha': 0.6717013954837939, 'reg_lambda': 0.7197393204611048}. Best is trial 625 with value: 0.5940826637391339.
[I 2024-11-06 22:12:24,368] Trial 636 finished with value: 0.5932835999791808 and parameters: {'n_estimators': 153, 'max_depth': 7, 'learning_rate': 0.05889522688167499, 'gamma': 4.0927338821897195, 'min_child_weight': 8, 'subsample': 0.8923776951643337, 'colsample_bytree': 0.5941326796255171, 'reg_alpha': 0.6391642425850815, 'reg_lambda': 0.7620596082329832}. Best is trial 625 with value: 0.5940826637391339.
[I 2024-11-06 22:12:28,531] Trial 637 finished with value: 0.5924576627630037 and parameters: {'n_estimators': 160, 'max_depth': 8, 'learning_rate': 0.05824289375398742, 'gamma': 4.134673637398102, 'min_child_weight': 7, 'subsample': 0.9080675271598126, 'colsample_bytree': 0.5800274309988205, 'reg_alpha': 0.6405096919597683, 'reg_lambda': 0.7401184180329212}. Best is trial 625 with value: 0.5940826637391339.
[I 2024-11-06 22:12:31,949] Trial 638 finished with value: 0.5934983639818744 and parameters: {'n_estimators': 144, 'max_depth': 7, 'learning_rate': 0.06844265067369408, 'gamma': 4.015564792145841, 'min_child_weight': 7, 'subsample': 0.8719324575696912, 'colsample_bytree': 0.5694220353990632, 'reg_alpha': 0.6709914398535394, 'reg_lambda': 0.7282805753876509}. Best is trial 625 with value: 0.5940826637391339.
[I 2024-11-06 22:12:36,372] Trial 639 finished with value: 0.59383981428676 and parameters: {'n_estimators': 149, 'max_depth': 9, 'learning_rate': 0.05622034363093921, 'gamma': 3.972145661580491, 'min_child_weight': 7, 'subsample': 0.8567015479426858, 'colsample_bytree': 0.6023825312072163, 'reg_alpha': 0.6266817065424556, 'reg_lambda': 0.77662926915998}. Best is trial 625 with value: 0.5940826637391339.
[I 2024-11-06 22:12:39,655] Trial 640 finished with value: 0.5924675823799641 and parameters: {'n_estimators': 140, 'max_depth': 9, 'learning_rate': 0.09185990393068864, 'gamma': 3.9640904610127463, 'min_child_weight': 7, 'subsample': 0.8643783492647078, 'colsample_bytree': 0.604265231348349, 'reg_alpha': 0.6127934219076444, 'reg_lambda': 0.8138264254343468}. Best is trial 625 with value: 0.5940826637391339.
[I 2024-11-06 22:12:43,302] Trial 641 finished with value: 0.5931902894797634 and parameters: {'n_estimators': 147, 'max_depth': 9, 'learning_rate': 0.07729176902147555, 'gamma': 4.0455598085438105, 'min_child_weight': 7, 'subsample': 0.8820665539756996, 'colsample_bytree': 0.60848832521934, 'reg_alpha': 0.5969790864903363, 'reg_lambda': 0.765694371827963}. Best is trial 625 with value: 0.5940826637391339.
[I 2024-11-06 22:12:47,378] Trial 642 finished with value: 0.5930843040884944 and parameters: {'n_estimators': 135, 'max_depth': 9, 'learning_rate': 0.06292899878325678, 'gamma': 3.935771955647027, 'min_child_weight': 7, 'subsample': 0.8580477943589353, 'colsample_bytree': 0.5981472906764469, 'reg_alpha': 0.6187113762110569, 'reg_lambda': 0.7843274321009321}. Best is trial 625 with value: 0.5940826637391339.
[I 2024-11-06 22:12:51,212] Trial 643 finished with value: 0.5931847535049698 and parameters: {'n_estimators': 145, 'max_depth': 7, 'learning_rate': 0.05519784158008, 'gamma': 4.091402167670453, 'min_child_weight': 7, 'subsample': 0.8721506000395978, 'colsample_bytree': 0.5912261349652894, 'reg_alpha': 0.6323330482166906, 'reg_lambda': 0.7970493084997241}. Best is trial 625 with value: 0.5940826637391339.
[I 2024-11-06 22:12:55,495] Trial 644 finished with value: 0.5924182455816267 and parameters: {'n_estimators': 151, 'max_depth': 9, 'learning_rate': 0.06295374230249916, 'gamma': 3.974024134169023, 'min_child_weight': 7, 'subsample': 0.8904687463561208, 'colsample_bytree': 0.5896444557999269, 'reg_alpha': 0.6547212716215477, 'reg_lambda': 0.7512187857117032}. Best is trial 625 with value: 0.5940826637391339.
[I 2024-11-06 22:12:59,083] Trial 645 finished with value: 0.5933913811179726 and parameters: {'n_estimators': 140, 'max_depth': 7, 'learning_rate': 0.055601470018595854, 'gamma': 4.173208117913146, 'min_child_weight': 7, 'subsample': 0.8552412175856033, 'colsample_bytree': 0.6077722385064763, 'reg_alpha': 0.6300971341776501, 'reg_lambda': 0.7629027979136451}. Best is trial 625 with value: 0.5940826637391339.
[I 2024-11-06 22:13:03,971] Trial 646 finished with value: 0.5930015241661919 and parameters: {'n_estimators': 149, 'max_depth': 9, 'learning_rate': 0.0682462923201103, 'gamma': 4.1440046406563855, 'min_child_weight': 8, 'subsample': 0.8782416379481567, 'colsample_bytree': 0.6040710711428054, 'reg_alpha': 0.5948889573767123, 'reg_lambda': 0.7719959182421907}. Best is trial 625 with value: 0.5940826637391339.
[I 2024-11-06 22:13:08,335] Trial 647 finished with value: 0.5927104986148939 and parameters: {'n_estimators': 143, 'max_depth': 9, 'learning_rate': 0.051650890710956285, 'gamma': 3.919618554012666, 'min_child_weight': 7, 'subsample': 0.9223850240059586, 'colsample_bytree': 0.5841521788505907, 'reg_alpha': 0.6578005678071337, 'reg_lambda': 0.7944884925175444}. Best is trial 625 with value: 0.5940826637391339.
[I 2024-11-06 22:13:11,864] Trial 648 finished with value: 0.5932015756725252 and parameters: {'n_estimators': 135, 'max_depth': 5, 'learning_rate': 0.05987348453561071, 'gamma': 4.060001609187018, 'min_child_weight': 7, 'subsample': 0.9014435755924476, 'colsample_bytree': 0.6165531729563175, 'reg_alpha': 0.6441885091221768, 'reg_lambda': 0.734434986699504}. Best is trial 625 with value: 0.5940826637391339.
[I 2024-11-06 22:13:16,084] Trial 649 finished with value: 0.5932758521726209 and parameters: {'n_estimators': 123, 'max_depth': 9, 'learning_rate': 0.04969906922759142, 'gamma': 3.862629673278776, 'min_child_weight': 7, 'subsample': 0.8652379622970745, 'colsample_bytree': 0.5988835393406702, 'reg_alpha': 0.6125451894411434, 'reg_lambda': 0.7734409520831678}. Best is trial 625 with value: 0.5940826637391339.
[I 2024-11-06 22:13:19,843] Trial 650 finished with value: 0.5929439071761904 and parameters: {'n_estimators': 154, 'max_depth': 7, 'learning_rate': 0.05689863716059665, 'gamma': 4.228251481350038, 'min_child_weight': 7, 'subsample': 0.8838902758711689, 'colsample_bytree': 0.5771093039288453, 'reg_alpha': 0.6891376367062991, 'reg_lambda': 0.7531957460021576}. Best is trial 625 with value: 0.5940826637391339.
[I 2024-11-06 22:13:23,951] Trial 651 finished with value: 0.5932019577998039 and parameters: {'n_estimators': 147, 'max_depth': 9, 'learning_rate': 0.06401116768342284, 'gamma': 4.014025612704235, 'min_child_weight': 7, 'subsample': 0.8513547480700722, 'colsample_bytree': 0.5891978599906973, 'reg_alpha': 0.6709151074861996, 'reg_lambda': 0.71816572287753}. Best is trial 625 with value: 0.5940826637391339.
[I 2024-11-06 22:13:27,373] Trial 652 finished with value: 0.5936782074124788 and parameters: {'n_estimators': 130, 'max_depth': 7, 'learning_rate': 0.07316151376013184, 'gamma': 4.161371053811382, 'min_child_weight': 7, 'subsample': 0.8689385105736369, 'colsample_bytree': 0.573648327443595, 'reg_alpha': 0.5785469713008978, 'reg_lambda': 0.7403069523070581}. Best is trial 625 with value: 0.5940826637391339.
[I 2024-11-06 22:13:31,728] Trial 653 finished with value: 0.5919006657944577 and parameters: {'n_estimators': 140, 'max_depth': 9, 'learning_rate': 0.04968010438899381, 'gamma': 3.8641293828820635, 'min_child_weight': 7, 'subsample': 0.8937461003877181, 'colsample_bytree': 0.6129710205223409, 'reg_alpha': 0.6470823590991439, 'reg_lambda': 0.710448704674596}. Best is trial 625 with value: 0.5940826637391339.
[I 2024-11-06 22:13:36,047] Trial 654 finished with value: 0.5931169009274636 and parameters: {'n_estimators': 150, 'max_depth': 7, 'learning_rate': 0.056404272178142686, 'gamma': 2.637607259519352, 'min_child_weight': 7, 'subsample': 0.8739055882015669, 'colsample_bytree': 0.5927768258404004, 'reg_alpha': 0.6946144119862958, 'reg_lambda': 0.43973966637643186}. Best is trial 625 with value: 0.5940826637391339.
[I 2024-11-06 22:13:39,630] Trial 655 finished with value: 0.5936822628730173 and parameters: {'n_estimators': 144, 'max_depth': 7, 'learning_rate': 0.06286371185272824, 'gamma': 3.9789365353578203, 'min_child_weight': 7, 'subsample': 0.8599937901318917, 'colsample_bytree': 0.5822291088101581, 'reg_alpha': 0.6231860988987873, 'reg_lambda': 0.8119848528847246}. Best is trial 625 with value: 0.5940826637391339.
[I 2024-11-06 22:13:43,663] Trial 656 finished with value: 0.5938197775784426 and parameters: {'n_estimators': 137, 'max_depth': 7, 'learning_rate': 0.048234324147015444, 'gamma': 4.14684109148455, 'min_child_weight': 7, 'subsample': 0.8821397082834633, 'colsample_bytree': 0.6008873401792733, 'reg_alpha': 0.6779219482385253, 'reg_lambda': 0.7183308590849663}. Best is trial 625 with value: 0.5940826637391339.
[I 2024-11-06 22:13:47,506] Trial 657 finished with value: 0.5934614754773828 and parameters: {'n_estimators': 133, 'max_depth': 7, 'learning_rate': 0.04592627266396491, 'gamma': 4.224200515186616, 'min_child_weight': 8, 'subsample': 0.8882914214947214, 'colsample_bytree': 0.5690480778457544, 'reg_alpha': 0.6841873732902708, 'reg_lambda': 0.7781099728179964}. Best is trial 625 with value: 0.5940826637391339.
[I 2024-11-06 22:13:51,113] Trial 658 finished with value: 0.5934497833146615 and parameters: {'n_estimators': 117, 'max_depth': 7, 'learning_rate': 0.04787170809371473, 'gamma': 4.347455771447294, 'min_child_weight': 7, 'subsample': 0.9040002431372617, 'colsample_bytree': 0.596862756965029, 'reg_alpha': 0.7101062406162074, 'reg_lambda': 0.7456000658834255}. Best is trial 625 with value: 0.5940826637391339.
[I 2024-11-06 22:13:55,007] Trial 659 finished with value: 0.5938140019992275 and parameters: {'n_estimators': 126, 'max_depth': 7, 'learning_rate': 0.045192325650763185, 'gamma': 4.132153888843316, 'min_child_weight': 7, 'subsample': 0.8825121227049721, 'colsample_bytree': 0.5837249346197368, 'reg_alpha': 0.6539969028469274, 'reg_lambda': 0.7243834504360507}. Best is trial 625 with value: 0.5940826637391339.
[I 2024-11-06 22:13:57,526] Trial 660 finished with value: 0.5921453312437907 and parameters: {'n_estimators': 119, 'max_depth': 7, 'learning_rate': 0.1521680300849946, 'gamma': 4.233362224283875, 'min_child_weight': 7, 'subsample': 0.8805284343284504, 'colsample_bytree': 0.5693043140105437, 'reg_alpha': 0.632273958437258, 'reg_lambda': 0.72339572596217}. Best is trial 625 with value: 0.5940826637391339.
[I 2024-11-06 22:14:01,336] Trial 661 finished with value: 0.5935837190838823 and parameters: {'n_estimators': 123, 'max_depth': 7, 'learning_rate': 0.04346234628920408, 'gamma': 4.155759731325553, 'min_child_weight': 7, 'subsample': 0.8785474480163851, 'colsample_bytree': 0.5885771223350407, 'reg_alpha': 0.5998794478810665, 'reg_lambda': 0.7253492709302327}. Best is trial 625 with value: 0.5940826637391339.
[I 2024-11-06 22:14:04,767] Trial 662 finished with value: 0.5911678846682076 and parameters: {'n_estimators': 125, 'max_depth': 7, 'learning_rate': 0.2110690401715743, 'gamma': 4.34340295804943, 'min_child_weight': 7, 'subsample': 0.8744328780471309, 'colsample_bytree': 0.8091219635665445, 'reg_alpha': 0.6543248149502753, 'reg_lambda': 0.6955816128912039}. Best is trial 625 with value: 0.5940826637391339.
[I 2024-11-06 22:14:08,367] Trial 663 finished with value: 0.5924585678820851 and parameters: {'n_estimators': 131, 'max_depth': 7, 'learning_rate': 0.0808961613359015, 'gamma': 4.117585098177196, 'min_child_weight': 7, 'subsample': 0.656023863389763, 'colsample_bytree': 0.608078344148862, 'reg_alpha': 0.6135306585288871, 'reg_lambda': 0.7321721940880018}. Best is trial 625 with value: 0.5940826637391339.
[I 2024-11-06 22:14:12,403] Trial 664 finished with value: 0.5930483172890211 and parameters: {'n_estimators': 126, 'max_depth': 7, 'learning_rate': 0.0450218045135818, 'gamma': 4.230927136387682, 'min_child_weight': 7, 'subsample': 0.8839286882678618, 'colsample_bytree': 0.5977626931680659, 'reg_alpha': 0.7059386648567361, 'reg_lambda': 0.7090566610010269}. Best is trial 625 with value: 0.5940826637391339.
[I 2024-11-06 22:14:15,364] Trial 665 finished with value: 0.592171290924258 and parameters: {'n_estimators': 131, 'max_depth': 7, 'learning_rate': 0.08550749888781672, 'gamma': 4.333896807422985, 'min_child_weight': 7, 'subsample': 0.8980093757191772, 'colsample_bytree': 0.5808618530564807, 'reg_alpha': 0.6484383249447383, 'reg_lambda': 0.7458554412754912}. Best is trial 625 with value: 0.5940826637391339.
[I 2024-11-06 22:14:19,924] Trial 666 finished with value: 0.5931554194832699 and parameters: {'n_estimators': 120, 'max_depth': 7, 'learning_rate': 0.012421028315426415, 'gamma': 4.143862922783666, 'min_child_weight': 8, 'subsample': 0.870395308405147, 'colsample_bytree': 0.5680266583520471, 'reg_alpha': 0.6864780253890905, 'reg_lambda': 0.6966037990708956}. Best is trial 625 with value: 0.5940826637391339.
[I 2024-11-06 22:14:23,395] Trial 667 finished with value: 0.5931831567421371 and parameters: {'n_estimators': 127, 'max_depth': 7, 'learning_rate': 0.05392853502290868, 'gamma': 4.4049336621736055, 'min_child_weight': 7, 'subsample': 0.9145379063573637, 'colsample_bytree': 0.6142133460904626, 'reg_alpha': 0.7121847031549868, 'reg_lambda': 0.7233673517913507}. Best is trial 625 with value: 0.5940826637391339.
[I 2024-11-06 22:14:26,755] Trial 668 finished with value: 0.5929229362726641 and parameters: {'n_estimators': 136, 'max_depth': 7, 'learning_rate': 0.06858448176155095, 'gamma': 4.2281727992631755, 'min_child_weight': 7, 'subsample': 0.8871786099724531, 'colsample_bytree': 0.5889014564727589, 'reg_alpha': 0.6333812069401733, 'reg_lambda': 0.6994582514918346}. Best is trial 625 with value: 0.5940826637391339.
[I 2024-11-06 22:14:31,376] Trial 669 finished with value: 0.5930134295457752 and parameters: {'n_estimators': 129, 'max_depth': 7, 'learning_rate': 0.04112903428541671, 'gamma': 4.06308782483598, 'min_child_weight': 7, 'subsample': 0.8665164566999296, 'colsample_bytree': 0.6022018429261408, 'reg_alpha': 0.6600787619032878, 'reg_lambda': 0.7533350611906693}. Best is trial 625 with value: 0.5940826637391339.
[I 2024-11-06 22:14:35,382] Trial 670 finished with value: 0.5934600461639261 and parameters: {'n_estimators': 136, 'max_depth': 7, 'learning_rate': 0.048054020669235496, 'gamma': 4.2848357306342315, 'min_child_weight': 7, 'subsample': 0.8462301620792795, 'colsample_bytree': 0.5787217192032077, 'reg_alpha': 0.7297198763666132, 'reg_lambda': 0.7143801410782781}. Best is trial 625 with value: 0.5940826637391339.
[I 2024-11-06 22:14:38,854] Trial 671 finished with value: 0.5928394382162606 and parameters: {'n_estimators': 114, 'max_depth': 7, 'learning_rate': 0.05896541736017, 'gamma': 4.436189538865411, 'min_child_weight': 7, 'subsample': 0.6804186422285348, 'colsample_bytree': 0.5686234801037428, 'reg_alpha': 0.6915180997883799, 'reg_lambda': 0.7370250947116158}. Best is trial 625 with value: 0.5940826637391339.
[I 2024-11-06 22:14:42,797] Trial 672 finished with value: 0.5930306628446497 and parameters: {'n_estimators': 136, 'max_depth': 7, 'learning_rate': 0.053205486468480265, 'gamma': 4.066921237369975, 'min_child_weight': 7, 'subsample': 0.8791678214818224, 'colsample_bytree': 0.5959184442155232, 'reg_alpha': 0.6795557552926141, 'reg_lambda': 0.6952635882009879}. Best is trial 625 with value: 0.5940826637391339.
[I 2024-11-06 22:14:47,215] Trial 673 finished with value: 0.5931877840793172 and parameters: {'n_estimators': 139, 'max_depth': 7, 'learning_rate': 0.04340149665667517, 'gamma': 4.163943186305903, 'min_child_weight': 7, 'subsample': 0.8968761898618848, 'colsample_bytree': 0.621799728465229, 'reg_alpha': 0.7565152649082472, 'reg_lambda': 0.7607012057397922}. Best is trial 625 with value: 0.5940826637391339.
[I 2024-11-06 22:14:50,939] Trial 674 finished with value: 0.5927091882488695 and parameters: {'n_estimators': 122, 'max_depth': 7, 'learning_rate': 0.06441705472705028, 'gamma': 4.332070147409534, 'min_child_weight': 7, 'subsample': 0.6190186056230041, 'colsample_bytree': 0.5850182086083882, 'reg_alpha': 0.7090470214018963, 'reg_lambda': 0.6871152634234694}. Best is trial 625 with value: 0.5940826637391339.
[I 2024-11-06 22:14:54,453] Trial 675 finished with value: 0.5932060693158988 and parameters: {'n_estimators': 130, 'max_depth': 7, 'learning_rate': 0.07373106514581178, 'gamma': 3.1462097401252325, 'min_child_weight': 7, 'subsample': 0.85835122118959, 'colsample_bytree': 0.5746745442717638, 'reg_alpha': 0.5876975286913004, 'reg_lambda': 0.726345966917471}. Best is trial 625 with value: 0.5940826637391339.
[I 2024-11-06 22:14:58,335] Trial 676 finished with value: 0.5931852270055049 and parameters: {'n_estimators': 139, 'max_depth': 7, 'learning_rate': 0.04832083237569269, 'gamma': 4.221375001147446, 'min_child_weight': 7, 'subsample': 0.8725484100062696, 'colsample_bytree': 0.6049518439174678, 'reg_alpha': 0.6403992055883146, 'reg_lambda': 0.7106671543123679}. Best is trial 625 with value: 0.5940826637391339.
[I 2024-11-06 22:15:04,172] Trial 677 finished with value: 0.592516295312703 and parameters: {'n_estimators': 155, 'max_depth': 7, 'learning_rate': 0.05816196336141555, 'gamma': 2.1397370190511404, 'min_child_weight': 8, 'subsample': 0.8871153797576992, 'colsample_bytree': 0.5640755076549433, 'reg_alpha': 0.6152979385169071, 'reg_lambda': 0.6894261025318016}. Best is trial 625 with value: 0.5940826637391339.
[I 2024-11-06 22:15:08,005] Trial 678 finished with value: 0.5930391888454446 and parameters: {'n_estimators': 132, 'max_depth': 7, 'learning_rate': 0.03668757744132071, 'gamma': 4.415457244139104, 'min_child_weight': 7, 'subsample': 0.907253074501333, 'colsample_bytree': 0.5936952890844899, 'reg_alpha': 0.6617247644728651, 'reg_lambda': 0.7399325499693067}. Best is trial 625 with value: 0.5940826637391339.
[I 2024-11-06 22:15:10,746] Trial 679 finished with value: 0.5916474730435068 and parameters: {'n_estimators': 143, 'max_depth': 7, 'learning_rate': 0.29445876446627484, 'gamma': 4.095620097321016, 'min_child_weight': 8, 'subsample': 0.8533019508428665, 'colsample_bytree': 0.5800622480655087, 'reg_alpha': 0.7316792638317595, 'reg_lambda': 0.767442822591044}. Best is trial 625 with value: 0.5940826637391339.
[I 2024-11-06 22:15:15,261] Trial 680 finished with value: 0.593180029505591 and parameters: {'n_estimators': 153, 'max_depth': 7, 'learning_rate': 0.051299914002779834, 'gamma': 4.247299691065548, 'min_child_weight': 7, 'subsample': 0.8656289217186374, 'colsample_bytree': 0.6152649039825886, 'reg_alpha': 0.6982304037437417, 'reg_lambda': 0.7183496156757164}. Best is trial 625 with value: 0.5940826637391339.
[I 2024-11-06 22:15:19,863] Trial 681 finished with value: 0.5935085880387906 and parameters: {'n_estimators': 139, 'max_depth': 7, 'learning_rate': 0.03983386757557763, 'gamma': 4.001993345838881, 'min_child_weight': 7, 'subsample': 0.8793103060007524, 'colsample_bytree': 0.5884803686998787, 'reg_alpha': 0.6783094071237162, 'reg_lambda': 0.6802811199655573}. Best is trial 625 with value: 0.5940826637391339.
[I 2024-11-06 22:15:23,584] Trial 682 finished with value: 0.5934706959839249 and parameters: {'n_estimators': 125, 'max_depth': 7, 'learning_rate': 0.059391497082454656, 'gamma': 4.151733219634572, 'min_child_weight': 7, 'subsample': 0.8403335319583873, 'colsample_bytree': 0.6009984761702467, 'reg_alpha': 0.714069751191573, 'reg_lambda': 0.7480151435685037}. Best is trial 625 with value: 0.5940826637391339.
