[I 2024-11-06 22:01:12,219] Trial 471 finished with value: 0.5931496770139798 and parameters: {'n_estimators': 119, 'max_depth': 7, 'learning_rate': 0.06360986414836628, 'gamma': 4.819017002038485, 'min_child_weight': 7, 'subsample': 0.8696939145774805, 'colsample_bytree': 0.570118814765937, 'reg_alpha': 0.46595733770810144, 'reg_lambda': 0.5504928078726039}. Best is trial 434 with value: 0.5939689980626236.
[I 2024-11-06 22:01:16,357] Trial 472 finished with value: 0.5934874740515392 and parameters: {'n_estimators': 141, 'max_depth': 7, 'learning_rate': 0.05043248542520503, 'gamma': 4.99622586688338, 'min_child_weight': 7, 'subsample': 0.8775450402360268, 'colsample_bytree': 0.5956038761034677, 'reg_alpha': 0.6660166183855871, 'reg_lambda': 0.6760257006298933}. Best is trial 434 with value: 0.5939689980626236.
[I 2024-11-06 22:01:21,754] Trial 473 finished with value: 0.5929245694165691 and parameters: {'n_estimators': 279, 'max_depth': 6, 'learning_rate': 0.05719062042256932, 'gamma': 4.8713833032437845, 'min_child_weight': 7, 'subsample': 0.8547550606752498, 'colsample_bytree': 0.6784810803052453, 'reg_alpha': 0.7638855450083027, 'reg_lambda': 0.5721500765107576}. Best is trial 434 with value: 0.5939689980626236.
[I 2024-11-06 22:01:26,279] Trial 474 finished with value: 0.5933616535716579 and parameters: {'n_estimators': 133, 'max_depth': 7, 'learning_rate': 0.046136908503919785, 'gamma': 3.507111837628145, 'min_child_weight': 7, 'subsample': 0.8418601962208498, 'colsample_bytree': 0.5680421493750991, 'reg_alpha': 0.597473975053521, 'reg_lambda': 0.6887042616030444}. Best is trial 434 with value: 0.5939689980626236.
[I 2024-11-06 22:01:30,806] Trial 475 finished with value: 0.5931102774911565 and parameters: {'n_estimators': 152, 'max_depth': 7, 'learning_rate': 0.06614296699112966, 'gamma': 3.373333922331588, 'min_child_weight': 7, 'subsample': 0.5922512390935722, 'colsample_bytree': 0.6066545186257271, 'reg_alpha': 0.7253430629165387, 'reg_lambda': 0.6624119697625726}. Best is trial 434 with value: 0.5939689980626236.
[I 2024-11-06 22:01:34,459] Trial 476 finished with value: 0.5926034153461801 and parameters: {'n_estimators': 140, 'max_depth': 7, 'learning_rate': 0.05358595759260619, 'gamma': 4.70122951290121, 'min_child_weight': 7, 'subsample': 0.8259933939056047, 'colsample_bytree': 0.9143672267674667, 'reg_alpha': 0.42862499493019435, 'reg_lambda': 0.6282097347107437}. Best is trial 434 with value: 0.5939689980626236.
[I 2024-11-06 22:01:38,171] Trial 477 finished with value: 0.5936372454858578 and parameters: {'n_estimators': 145, 'max_depth': 7, 'learning_rate': 0.05987964214378489, 'gamma': 4.902548843854924, 'min_child_weight': 7, 'subsample': 0.8582233141632803, 'colsample_bytree': 0.5794414519856276, 'reg_alpha': 0.7046930422963511, 'reg_lambda': 0.5962189611191736}. Best is trial 434 with value: 0.5939689980626236.
[I 2024-11-06 22:01:42,386] Trial 478 finished with value: 0.5932012238347857 and parameters: {'n_estimators': 150, 'max_depth': 7, 'learning_rate': 0.04651120312352597, 'gamma': 3.61349912096772, 'min_child_weight': 8, 'subsample': 0.8789705438648138, 'colsample_bytree': 0.585068245372423, 'reg_alpha': 0.751744622685399, 'reg_lambda': 0.5156618103623105}. Best is trial 434 with value: 0.5939689980626236.
[I 2024-11-06 22:01:46,109] Trial 479 finished with value: 0.5931676449001566 and parameters: {'n_estimators': 128, 'max_depth': 7, 'learning_rate': 0.052167517790349255, 'gamma': 3.7965270272880542, 'min_child_weight': 7, 'subsample': 0.8670582473008881, 'colsample_bytree': 0.5602944442744611, 'reg_alpha': 0.7914389079668622, 'reg_lambda': 0.691190190210761}. Best is trial 434 with value: 0.5939689980626236.
[I 2024-11-06 22:01:50,019] Trial 480 finished with value: 0.5934640933387021 and parameters: {'n_estimators': 136, 'max_depth': 7, 'learning_rate': 0.07345028079771138, 'gamma': 2.7636451055195987, 'min_child_weight': 7, 'subsample': 0.8475904552999506, 'colsample_bytree': 0.6000345437823775, 'reg_alpha': 0.7308083706583974, 'reg_lambda': 0.6687359403476192}. Best is trial 434 with value: 0.5939689980626236.
[I 2024-11-06 22:01:54,176] Trial 481 finished with value: 0.5933963941645353 and parameters: {'n_estimators': 146, 'max_depth': 7, 'learning_rate': 0.04588515918915417, 'gamma': 4.5755848968466415, 'min_child_weight': 7, 'subsample': 0.8382679642640526, 'colsample_bytree': 0.7800751781141105, 'reg_alpha': 0.6860947276201166, 'reg_lambda': 0.6500058185164168}. Best is trial 434 with value: 0.5939689980626236.
[I 2024-11-06 22:01:58,142] Trial 482 finished with value: 0.5931538344663608 and parameters: {'n_estimators': 152, 'max_depth': 7, 'learning_rate': 0.05879816595789107, 'gamma': 4.759913727181333, 'min_child_weight': 7, 'subsample': 0.8120881586309403, 'colsample_bytree': 0.5713239361792166, 'reg_alpha': 0.767293294893441, 'reg_lambda': 0.6221705276071214}. Best is trial 434 with value: 0.5939689980626236.
[I 2024-11-06 22:02:02,623] Trial 483 finished with value: 0.592401259057889 and parameters: {'n_estimators': 142, 'max_depth': 7, 'learning_rate': 0.04463837610465809, 'gamma': 3.7155828603887975, 'min_child_weight': 7, 'subsample': 0.729568541462374, 'colsample_bytree': 0.5601910919503318, 'reg_alpha': 0.7115845572447366, 'reg_lambda': 0.6969598572129194}. Best is trial 434 with value: 0.5939689980626236.
[I 2024-11-06 22:02:06,937] Trial 484 finished with value: 0.5938081862404421 and parameters: {'n_estimators': 133, 'max_depth': 7, 'learning_rate': 0.05237212555199404, 'gamma': 4.924424312642108, 'min_child_weight': 7, 'subsample': 0.8882027779709151, 'colsample_bytree': 0.587226858539822, 'reg_alpha': 0.6658258201151821, 'reg_lambda': 0.5824470801920053}. Best is trial 434 with value: 0.5939689980626236.
[I 2024-11-06 22:02:10,130] Trial 485 finished with value: 0.5927505872121179 and parameters: {'n_estimators': 124, 'max_depth': 6, 'learning_rate': 0.06554825920915694, 'gamma': 4.992924132386255, 'min_child_weight': 8, 'subsample': 0.8958904369219345, 'colsample_bytree': 0.5937055363043463, 'reg_alpha': 0.6288063303226168, 'reg_lambda': 0.5643448148592651}. Best is trial 434 with value: 0.5939689980626236.
[I 2024-11-06 22:02:13,708] Trial 486 finished with value: 0.592991410998656 and parameters: {'n_estimators': 129, 'max_depth': 8, 'learning_rate': 0.05591596766919598, 'gamma': 4.924928111284803, 'min_child_weight': 7, 'subsample': 0.8897152513475399, 'colsample_bytree': 0.6044210555634311, 'reg_alpha': 0.6550777657633556, 'reg_lambda': 0.5214510041931989}. Best is trial 434 with value: 0.5939689980626236.
[I 2024-11-06 22:02:17,436] Trial 487 finished with value: 0.5930549711777788 and parameters: {'n_estimators': 133, 'max_depth': 7, 'learning_rate': 0.061037316284480864, 'gamma': 4.900363827179793, 'min_child_weight': 7, 'subsample': 0.8834540217073333, 'colsample_bytree': 0.5875108892969289, 'reg_alpha': 0.6452115584755934, 'reg_lambda': 0.48690948859402594}. Best is trial 434 with value: 0.5939689980626236.
[I 2024-11-06 22:02:21,755] Trial 488 finished with value: 0.5926169771999967 and parameters: {'n_estimators': 137, 'max_depth': 7, 'learning_rate': 0.05223994091651976, 'gamma': 3.5654154923403523, 'min_child_weight': 7, 'subsample': 0.8793599389939699, 'colsample_bytree': 0.6543441474574283, 'reg_alpha': 0.6762675955047532, 'reg_lambda': 0.5328781733952999}. Best is trial 434 with value: 0.5939689980626236.
[I 2024-11-06 22:02:25,169] Trial 489 finished with value: 0.5925435831651459 and parameters: {'n_estimators': 130, 'max_depth': 7, 'learning_rate': 0.07139308909246186, 'gamma': 3.849087291912765, 'min_child_weight': 7, 'subsample': 0.8989559083499145, 'colsample_bytree': 0.6170268622328925, 'reg_alpha': 0.6614193471948282, 'reg_lambda': 0.5806103580732473}. Best is trial 434 with value: 0.5939689980626236.
[I 2024-11-06 22:02:29,700] Trial 490 finished with value: 0.5926096621250402 and parameters: {'n_estimators': 122, 'max_depth': 7, 'learning_rate': 0.05035647598406157, 'gamma': 1.3974287560590128, 'min_child_weight': 6, 'subsample': 0.8723022541604355, 'colsample_bytree': 0.5786998329136667, 'reg_alpha': 0.6185218446930071, 'reg_lambda': 0.5504307784570892}. Best is trial 434 with value: 0.5939689980626236.
[I 2024-11-06 22:02:33,045] Trial 491 finished with value: 0.593392553863169 and parameters: {'n_estimators': 135, 'max_depth': 7, 'learning_rate': 0.061827173464939086, 'gamma': 4.642395365940767, 'min_child_weight': 7, 'subsample': 0.8650831683722959, 'colsample_bytree': 0.5928006505338278, 'reg_alpha': 0.6935751281164422, 'reg_lambda': 0.5902599965893225}. Best is trial 434 with value: 0.5939689980626236.
[I 2024-11-06 22:02:36,682] Trial 492 finished with value: 0.593326735052832 and parameters: {'n_estimators': 140, 'max_depth': 7, 'learning_rate': 0.05582645225678186, 'gamma': 4.912465582178609, 'min_child_weight': 3, 'subsample': 0.892011069507979, 'colsample_bytree': 0.6033018143538926, 'reg_alpha': 0.6796101901619673, 'reg_lambda': 0.6016412698235482}. Best is trial 434 with value: 0.5939689980626236.
[I 2024-11-06 22:02:40,374] Trial 493 finished with value: 0.5929992926346733 and parameters: {'n_estimators': 139, 'max_depth': 7, 'learning_rate': 0.06572908327581965, 'gamma': 3.697010020006249, 'min_child_weight': 7, 'subsample': 0.8863164312116922, 'colsample_bytree': 0.5814628799409213, 'reg_alpha': 0.6696605386212845, 'reg_lambda': 0.5669827466988013}. Best is trial 434 with value: 0.5939689980626236.
[I 2024-11-06 22:02:43,440] Trial 494 finished with value: 0.5926395717827404 and parameters: {'n_estimators': 133, 'max_depth': 7, 'learning_rate': 0.09495421188079287, 'gamma': 4.992698250023802, 'min_child_weight': 7, 'subsample': 0.9067558184639293, 'colsample_bytree': 0.5751373033116406, 'reg_alpha': 0.7036169513608613, 'reg_lambda': 0.6097797095945382}. Best is trial 434 with value: 0.5939689980626236.
[I 2024-11-06 22:02:48,394] Trial 495 finished with value: 0.5926699973132245 and parameters: {'n_estimators': 127, 'max_depth': 7, 'learning_rate': 0.04133586040276689, 'gamma': 0.575894182002461, 'min_child_weight': 7, 'subsample': 0.8793110994488109, 'colsample_bytree': 0.5911361724480448, 'reg_alpha': 0.7199524044389574, 'reg_lambda': 0.5813765584439197}. Best is trial 434 with value: 0.5939689980626236.
[I 2024-11-06 22:02:52,651] Trial 496 finished with value: 0.5939756268855019 and parameters: {'n_estimators': 144, 'max_depth': 7, 'learning_rate': 0.04976228820474709, 'gamma': 4.480069268867638, 'min_child_weight': 6, 'subsample': 0.8699742877256008, 'colsample_bytree': 0.5692980035514532, 'reg_alpha': 0.6435159870203055, 'reg_lambda': 0.6767869473678737}. Best is trial 496 with value: 0.5939756268855019.
[I 2024-11-06 22:02:56,664] Trial 497 finished with value: 0.5931964289809016 and parameters: {'n_estimators': 144, 'max_depth': 7, 'learning_rate': 0.05790608858343352, 'gamma': 4.388623149028312, 'min_child_weight': 6, 'subsample': 0.8689123805530649, 'colsample_bytree': 0.5839538067508339, 'reg_alpha': 0.6502231813251749, 'reg_lambda': 0.7060563510205423}. Best is trial 496 with value: 0.5939756268855019.
[I 2024-11-06 22:02:59,951] Trial 498 finished with value: 0.5927861074232936 and parameters: {'n_estimators': 138, 'max_depth': 7, 'learning_rate': 0.10907121616324625, 'gamma': 4.536829121642519, 'min_child_weight': 6, 'subsample': 0.8563568090926527, 'colsample_bytree': 0.6159793320871668, 'reg_alpha': 0.6183058654896739, 'reg_lambda': 0.6787458234076305}. Best is trial 496 with value: 0.5939756268855019.
[I 2024-11-06 22:03:04,342] Trial 499 finished with value: 0.5929900919324584 and parameters: {'n_estimators': 145, 'max_depth': 5, 'learning_rate': 0.05170462016722132, 'gamma': 4.481997578770631, 'min_child_weight': 6, 'subsample': 0.8655588907468493, 'colsample_bytree': 0.5723863665287294, 'reg_alpha': 0.6411163602821682, 'reg_lambda': 0.6777455662693466}. Best is trial 496 with value: 0.5939756268855019.
[I 2024-11-06 22:03:09,094] Trial 500 finished with value: 0.5938505617865222 and parameters: {'n_estimators': 152, 'max_depth': 8, 'learning_rate': 0.04463584344240133, 'gamma': 4.440803969456933, 'min_child_weight': 6, 'subsample': 0.875418889345238, 'colsample_bytree': 0.6034543324979424, 'reg_alpha': 0.5942523925391803, 'reg_lambda': 0.6970411056826107}. Best is trial 496 with value: 0.5939756268855019.
[I 2024-11-06 22:03:13,502] Trial 501 finished with value: 0.5930717974370603 and parameters: {'n_estimators': 151, 'max_depth': 8, 'learning_rate': 0.04324387148994636, 'gamma': 4.430372527689909, 'min_child_weight': 6, 'subsample': 0.8753619880712366, 'colsample_bytree': 0.604144966403281, 'reg_alpha': 0.601049456420981, 'reg_lambda': 0.7013488354985096}. Best is trial 496 with value: 0.5939756268855019.
[I 2024-11-06 22:03:18,002] Trial 502 finished with value: 0.5925426147627815 and parameters: {'n_estimators': 153, 'max_depth': 8, 'learning_rate': 0.04232125966569984, 'gamma': 4.437542971079904, 'min_child_weight': 6, 'subsample': 0.8836670552386985, 'colsample_bytree': 0.6270665976346586, 'reg_alpha': 0.6100674070210098, 'reg_lambda': 0.7222169584908741}. Best is trial 496 with value: 0.5939756268855019.
[I 2024-11-06 22:03:21,394] Trial 503 finished with value: 0.5922677997188115 and parameters: {'n_estimators': 154, 'max_depth': 8, 'learning_rate': 0.14511657680245693, 'gamma': 4.47849467446771, 'min_child_weight': 6, 'subsample': 0.8724682617226451, 'colsample_bytree': 0.6008050572317318, 'reg_alpha': 0.5834589072545301, 'reg_lambda': 0.6937070722645968}. Best is trial 496 with value: 0.5939756268855019.
[I 2024-11-06 22:03:26,003] Trial 504 finished with value: 0.5932265294102502 and parameters: {'n_estimators': 146, 'max_depth': 8, 'learning_rate': 0.03874893585595789, 'gamma': 4.388450388596569, 'min_child_weight': 6, 'subsample': 0.861004557144276, 'colsample_bytree': 0.5936055905410214, 'reg_alpha': 0.6372237806448473, 'reg_lambda': 0.6698697431807367}. Best is trial 496 with value: 0.5939756268855019.
[I 2024-11-06 22:03:30,213] Trial 505 finished with value: 0.5928993017835895 and parameters: {'n_estimators': 151, 'max_depth': 6, 'learning_rate': 0.047094105359003394, 'gamma': 4.344359501385728, 'min_child_weight': 6, 'subsample': 0.8798743374551022, 'colsample_bytree': 0.6118868746980938, 'reg_alpha': 0.573979467104759, 'reg_lambda': 0.7363181526197223}. Best is trial 496 with value: 0.5939756268855019.
[I 2024-11-06 22:03:34,282] Trial 506 finished with value: 0.5936354571992728 and parameters: {'n_estimators': 155, 'max_depth': 6, 'learning_rate': 0.05053865129138941, 'gamma': 4.149312172492034, 'min_child_weight': 6, 'subsample': 0.8694457614682991, 'colsample_bytree': 0.6126486521713713, 'reg_alpha': 0.6600276132418001, 'reg_lambda': 0.7119623220200487}. Best is trial 496 with value: 0.5939756268855019.
[I 2024-11-06 22:03:38,635] Trial 507 finished with value: 0.593060314568181 and parameters: {'n_estimators': 160, 'max_depth': 8, 'learning_rate': 0.03938532545777482, 'gamma': 4.539068378433502, 'min_child_weight': 6, 'subsample': 0.8871276963307887, 'colsample_bytree': 0.6273068727418402, 'reg_alpha': 0.500089568011782, 'reg_lambda': 0.6796832401739024}. Best is trial 496 with value: 0.5939756268855019.
[I 2024-11-06 22:03:42,559] Trial 508 finished with value: 0.5933644860153683 and parameters: {'n_estimators': 147, 'max_depth': 6, 'learning_rate': 0.04669994864298649, 'gamma': 4.611590687649771, 'min_child_weight': 6, 'subsample': 0.8574822720883772, 'colsample_bytree': 0.5963199405644339, 'reg_alpha': 0.6294359382915155, 'reg_lambda': 0.6987218615847572}. Best is trial 496 with value: 0.5939756268855019.
[I 2024-11-06 22:03:46,483] Trial 509 finished with value: 0.5934942132350944 and parameters: {'n_estimators': 150, 'max_depth': 8, 'learning_rate': 0.06086623908751021, 'gamma': 3.818831801116014, 'min_child_weight': 6, 'subsample': 0.8728476470950703, 'colsample_bytree': 0.5857503922976084, 'reg_alpha': 0.6023126396175584, 'reg_lambda': 0.666745235359978}. Best is trial 496 with value: 0.5939756268855019.
[I 2024-11-06 22:03:50,479] Trial 510 finished with value: 0.5937732446411523 and parameters: {'n_estimators': 143, 'max_depth': 8, 'learning_rate': 0.05469920623099988, 'gamma': 4.035690713694038, 'min_child_weight': 6, 'subsample': 0.862816860111091, 'colsample_bytree': 0.6023527867614659, 'reg_alpha': 0.6742974849171504, 'reg_lambda': 0.7105153147788276}. Best is trial 496 with value: 0.5939756268855019.
[I 2024-11-06 22:03:55,263] Trial 511 finished with value: 0.5936290908220123 and parameters: {'n_estimators': 142, 'max_depth': 8, 'learning_rate': 0.03634342607011866, 'gamma': 4.056158880328666, 'min_child_weight': 6, 'subsample': 0.8792723787578858, 'colsample_bytree': 0.6101834524370608, 'reg_alpha': 0.666488915772966, 'reg_lambda': 0.7284244996673125}. Best is trial 496 with value: 0.5939756268855019.
[I 2024-11-06 22:03:59,271] Trial 512 finished with value: 0.5938155763415365 and parameters: {'n_estimators': 132, 'max_depth': 8, 'learning_rate': 0.04833137866693281, 'gamma': 4.031497890596317, 'min_child_weight': 6, 'subsample': 0.8635572316218856, 'colsample_bytree': 0.6189998792192117, 'reg_alpha': 0.6823604737417293, 'reg_lambda': 0.7600947027625994}. Best is trial 496 with value: 0.5939756268855019.
[I 2024-11-06 22:04:04,691] Trial 513 finished with value: 0.5932816839172504 and parameters: {'n_estimators': 138, 'max_depth': 8, 'learning_rate': 0.04358348343915595, 'gamma': 3.9760251736771304, 'min_child_weight': 5, 'subsample': 0.8673006311134265, 'colsample_bytree': 0.6020090816164215, 'reg_alpha': 0.6771320855464013, 'reg_lambda': 0.7462292389750463}. Best is trial 496 with value: 0.5939756268855019.
[I 2024-11-06 22:04:08,968] Trial 514 finished with value: 0.5934352696998724 and parameters: {'n_estimators': 144, 'max_depth': 8, 'learning_rate': 0.04931088151286293, 'gamma': 3.997973874168319, 'min_child_weight': 6, 'subsample': 0.8879958644753664, 'colsample_bytree': 0.622130124956671, 'reg_alpha': 0.6428907366656553, 'reg_lambda': 0.7418083299477995}. Best is trial 496 with value: 0.5939756268855019.
[I 2024-11-06 22:04:13,834] Trial 515 finished with value: 0.5932527164367002 and parameters: {'n_estimators': 134, 'max_depth': 8, 'learning_rate': 0.0370072575080136, 'gamma': 4.1058837995636255, 'min_child_weight': 6, 'subsample': 0.8621367511635302, 'colsample_bytree': 0.597121364806273, 'reg_alpha': 0.6653572661651233, 'reg_lambda': 0.7818639895914954}. Best is trial 496 with value: 0.5939756268855019.
[I 2024-11-06 22:04:18,675] Trial 516 finished with value: 0.5936664795619981 and parameters: {'n_estimators': 141, 'max_depth': 8, 'learning_rate': 0.04412708065352211, 'gamma': 3.9045877139161282, 'min_child_weight': 6, 'subsample': 0.8765350865706136, 'colsample_bytree': 0.6187584021686365, 'reg_alpha': 0.6888919540871552, 'reg_lambda': 0.7584392351662985}. Best is trial 496 with value: 0.5939756268855019.
[I 2024-11-06 22:04:22,970] Trial 517 finished with value: 0.5933634929185937 and parameters: {'n_estimators': 147, 'max_depth': 8, 'learning_rate': 0.04939065719386249, 'gamma': 4.0381864577258835, 'min_child_weight': 6, 'subsample': 0.8705868317222101, 'colsample_bytree': 0.5916017867585344, 'reg_alpha': 0.6516718646345273, 'reg_lambda': 0.7192782880837995}. Best is trial 496 with value: 0.5939756268855019.
[I 2024-11-06 22:04:27,356] Trial 518 finished with value: 0.5927309368843214 and parameters: {'n_estimators': 135, 'max_depth': 8, 'learning_rate': 0.04027964792933313, 'gamma': 4.183756503755184, 'min_child_weight': 6, 'subsample': 0.8952272729578643, 'colsample_bytree': 0.5844827907150271, 'reg_alpha': 0.6839848321195439, 'reg_lambda': 0.7161401771070569}. Best is trial 496 with value: 0.5939756268855019.
[I 2024-11-06 22:04:32,407] Trial 519 finished with value: 0.5931418885011572 and parameters: {'n_estimators': 143, 'max_depth': 8, 'learning_rate': 0.035062694287993176, 'gamma': 3.9232335986593108, 'min_child_weight': 6, 'subsample': 0.8826073630931887, 'colsample_bytree': 0.6377983984651858, 'reg_alpha': 0.6241256384370922, 'reg_lambda': 0.7329070234750714}. Best is trial 496 with value: 0.5939756268855019.
[I 2024-11-06 22:04:36,463] Trial 520 finished with value: 0.5940488308041952 and parameters: {'n_estimators': 149, 'max_depth': 8, 'learning_rate': 0.05303604153733227, 'gamma': 4.099861015895292, 'min_child_weight': 6, 'subsample': 0.8614372125552535, 'colsample_bytree': 0.6027594818561302, 'reg_alpha': 0.6706497044116053, 'reg_lambda': 0.7647824397960443}. Best is trial 520 with value: 0.5940488308041952.
[I 2024-11-06 22:04:39,560] Trial 521 finished with value: 0.5936921406691024 and parameters: {'n_estimators': 71, 'max_depth': 8, 'learning_rate': 0.04615071400133483, 'gamma': 4.098405307823719, 'min_child_weight': 6, 'subsample': 0.8578193785153334, 'colsample_bytree': 0.6052063860037825, 'reg_alpha': 0.6590899807913696, 'reg_lambda': 0.7814304751470874}. Best is trial 520 with value: 0.5940488308041952.
[I 2024-11-06 22:04:41,771] Trial 522 finished with value: 0.5928666351494318 and parameters: {'n_estimators': 72, 'max_depth': 8, 'learning_rate': 0.13343603734332732, 'gamma': 4.065232050733588, 'min_child_weight': 6, 'subsample': 0.8725795416549004, 'colsample_bytree': 0.6116275433270006, 'reg_alpha': 0.6344924878776147, 'reg_lambda': 0.7711411696637657}. Best is trial 520 with value: 0.5940488308041952.
[I 2024-11-06 22:04:45,537] Trial 523 finished with value: 0.5932265108860809 and parameters: {'n_estimators': 106, 'max_depth': 8, 'learning_rate': 0.05002485793195491, 'gamma': 4.0007073738206875, 'min_child_weight': 6, 'subsample': 0.8583304181027107, 'colsample_bytree': 0.6209403939565176, 'reg_alpha': 0.6536666668155668, 'reg_lambda': 0.7718257728356657}. Best is trial 520 with value: 0.5940488308041952.
