[I 2024-11-06 20:59:28,651] Trial 608 finished with value: 0.5983155907309164 and parameters: {'n_estimators': 80, 'max_depth': 3, 'min_samples_split': 3, 'min_samples_leaf': 8}. Best is trial 406 with value: 0.5986570551043842.
[I 2024-11-06 20:59:31,313] Trial 609 finished with value: 0.596591397944859 and parameters: {'n_estimators': 60, 'max_depth': 3, 'min_samples_split': 2, 'min_samples_leaf': 5}. Best is trial 406 with value: 0.5986570551043842.
[I 2024-11-06 20:59:33,965] Trial 610 finished with value: 0.5921668994755558 and parameters: {'n_estimators': 72, 'max_depth': 2, 'min_samples_split': 3, 'min_samples_leaf': 1}. Best is trial 406 with value: 0.5986570551043842.
[I 2024-11-06 20:59:38,228] Trial 611 finished with value: 0.5933095121541334 and parameters: {'n_estimators': 89, 'max_depth': 4, 'min_samples_split': 4, 'min_samples_leaf': 10}. Best is trial 406 with value: 0.5986570551043842.
[I 2024-11-06 20:59:41,951] Trial 612 finished with value: 0.5923091656307674 and parameters: {'n_estimators': 77, 'max_depth': 4, 'min_samples_split': 2, 'min_samples_leaf': 7}. Best is trial 406 with value: 0.5986570551043842.
[I 2024-11-06 20:59:44,976] Trial 613 finished with value: 0.5913809716906681 and parameters: {'n_estimators': 83, 'max_depth': 2, 'min_samples_split': 4, 'min_samples_leaf': 9}. Best is trial 406 with value: 0.5986570551043842.
[I 2024-11-06 20:59:51,778] Trial 614 finished with value: 0.5910257389192919 and parameters: {'n_estimators': 65, 'max_depth': 12, 'min_samples_split': 3, 'min_samples_leaf': 2}. Best is trial 406 with value: 0.5986570551043842.
[I 2024-11-06 20:59:58,724] Trial 615 finished with value: 0.5946095597466833 and parameters: {'n_estimators': 177, 'max_depth': 3, 'min_samples_split': 2, 'min_samples_leaf': 10}. Best is trial 406 with value: 0.5986570551043842.
[I 2024-11-06 21:00:04,545] Trial 616 finished with value: 0.5927103836319644 and parameters: {'n_estimators': 95, 'max_depth': 6, 'min_samples_split': 16, 'min_samples_leaf': 11}. Best is trial 406 with value: 0.5986570551043842.
[I 2024-11-06 21:00:06,864] Trial 617 finished with value: 0.5918361125730843 and parameters: {'n_estimators': 74, 'max_depth': 1, 'min_samples_split': 3, 'min_samples_leaf': 1}. Best is trial 406 with value: 0.5986570551043842.
[I 2024-11-06 21:00:10,299] Trial 618 finished with value: 0.5922239071417763 and parameters: {'n_estimators': 69, 'max_depth': 4, 'min_samples_split': 8, 'min_samples_leaf': 13}. Best is trial 406 with value: 0.5986570551043842.
[I 2024-11-06 21:00:13,098] Trial 619 finished with value: 0.5909627079043318 and parameters: {'n_estimators': 79, 'max_depth': 2, 'min_samples_split': 6, 'min_samples_leaf': 9}. Best is trial 406 with value: 0.5986570551043842.
[I 2024-11-06 21:00:29,906] Trial 620 finished with value: 0.5765825277935221 and parameters: {'n_estimators': 86, 'max_depth': 31, 'min_samples_split': 2, 'min_samples_leaf': 1}. Best is trial 406 with value: 0.5986570551043842.
[I 2024-11-06 21:00:34,457] Trial 621 finished with value: 0.5911865260561184 and parameters: {'n_estimators': 82, 'max_depth': 5, 'min_samples_split': 4, 'min_samples_leaf': 2}. Best is trial 406 with value: 0.5986570551043842.
[I 2024-11-06 21:00:37,618] Trial 622 finished with value: 0.5985250773600217 and parameters: {'n_estimators': 71, 'max_depth': 3, 'min_samples_split': 3, 'min_samples_leaf': 8}. Best is trial 406 with value: 0.5986570551043842.
[I 2024-11-06 21:00:39,882] Trial 623 finished with value: 0.5918772194346223 and parameters: {'n_estimators': 77, 'max_depth': 1, 'min_samples_split': 2, 'min_samples_leaf': 14}. Best is trial 406 with value: 0.5986570551043842.
[I 2024-11-06 21:00:44,425] Trial 624 finished with value: 0.5935737524307377 and parameters: {'n_estimators': 91, 'max_depth': 4, 'min_samples_split': 5, 'min_samples_leaf': 12}. Best is trial 406 with value: 0.5986570551043842.
[I 2024-11-06 21:00:49,194] Trial 625 finished with value: 0.5974021459869818 and parameters: {'n_estimators': 105, 'max_depth': 3, 'min_samples_split': 7, 'min_samples_leaf': 10}. Best is trial 406 with value: 0.5986570551043842.
[I 2024-11-06 21:00:53,272] Trial 626 finished with value: 0.5917014915859481 and parameters: {'n_estimators': 75, 'max_depth': 5, 'min_samples_split': 4, 'min_samples_leaf': 9}. Best is trial 406 with value: 0.5986570551043842.
[I 2024-11-06 21:00:55,746] Trial 627 finished with value: 0.5921656749015044 and parameters: {'n_estimators': 68, 'max_depth': 2, 'min_samples_split': 14, 'min_samples_leaf': 8}. Best is trial 406 with value: 0.5986570551043842.
[I 2024-11-06 21:01:01,196] Trial 628 finished with value: 0.592391557499441 and parameters: {'n_estimators': 82, 'max_depth': 7, 'min_samples_split': 2, 'min_samples_leaf': 11}. Best is trial 406 with value: 0.5986570551043842.
[I 2024-11-06 21:01:04,214] Trial 629 finished with value: 0.5970908253666275 and parameters: {'n_estimators': 64, 'max_depth': 3, 'min_samples_split': 3, 'min_samples_leaf': 1}. Best is trial 406 with value: 0.5986570551043842.
[I 2024-11-06 21:01:08,676] Trial 630 finished with value: 0.5932251018048105 and parameters: {'n_estimators': 72, 'max_depth': 6, 'min_samples_split': 9, 'min_samples_leaf': 10}. Best is trial 406 with value: 0.5986570551043842.
[I 2024-11-06 21:01:11,683] Trial 631 finished with value: 0.5912475779858564 and parameters: {'n_estimators': 86, 'max_depth': 2, 'min_samples_split': 4, 'min_samples_leaf': 2}. Best is trial 406 with value: 0.5986570551043842.
[I 2024-11-06 21:01:15,538] Trial 632 finished with value: 0.5924867885817214 and parameters: {'n_estimators': 78, 'max_depth': 4, 'min_samples_split': 3, 'min_samples_leaf': 1}. Best is trial 406 with value: 0.5986570551043842.
[I 2024-11-06 21:01:18,835] Trial 633 finished with value: 0.5986294604395617 and parameters: {'n_estimators': 74, 'max_depth': 3, 'min_samples_split': 5, 'min_samples_leaf': 7}. Best is trial 406 with value: 0.5986570551043842.
[I 2024-11-06 21:01:21,272] Trial 634 finished with value: 0.5917128890235319 and parameters: {'n_estimators': 80, 'max_depth': 1, 'min_samples_split': 5, 'min_samples_leaf': 7}. Best is trial 406 with value: 0.5986570551043842.
[I 2024-11-06 21:01:25,518] Trial 635 finished with value: 0.5933612095418294 and parameters: {'n_estimators': 76, 'max_depth': 5, 'min_samples_split': 5, 'min_samples_leaf': 7}. Best is trial 406 with value: 0.5986570551043842.
[I 2024-11-06 21:01:49,662] Trial 636 finished with value: 0.5985038133949871 and parameters: {'n_estimators': 84, 'max_depth': 3, 'min_samples_split': 6, 'min_samples_leaf': 6}. Best is trial 406 with value: 0.5986570551043842.
[I 2024-11-06 21:01:53,982] Trial 637 finished with value: 0.5932103376581116 and parameters: {'n_estimators': 89, 'max_depth': 4, 'min_samples_split': 5, 'min_samples_leaf': 7}. Best is trial 406 with value: 0.5986570551043842.
[I 2024-11-06 21:01:56,752] Trial 638 finished with value: 0.592437301835236 and parameters: {'n_estimators': 74, 'max_depth': 2, 'min_samples_split': 5, 'min_samples_leaf': 7}. Best is trial 406 with value: 0.5986570551043842.
[I 2024-11-06 21:02:08,981] Trial 639 finished with value: 0.5879214402497063 and parameters: {'n_estimators': 79, 'max_depth': 24, 'min_samples_split': 6, 'min_samples_leaf': 7}. Best is trial 406 with value: 0.5986570551043842.
[I 2024-11-06 21:02:12,553] Trial 640 finished with value: 0.5986153128337834 and parameters: {'n_estimators': 82, 'max_depth': 3, 'min_samples_split': 5, 'min_samples_leaf': 6}. Best is trial 406 with value: 0.5986570551043842.
[I 2024-11-06 21:02:16,716] Trial 641 finished with value: 0.5926332455634757 and parameters: {'n_estimators': 86, 'max_depth': 4, 'min_samples_split': 6, 'min_samples_leaf': 6}. Best is trial 406 with value: 0.5986570551043842.
[I 2024-11-06 21:02:19,877] Trial 642 finished with value: 0.5915489421103184 and parameters: {'n_estimators': 90, 'max_depth': 2, 'min_samples_split': 5, 'min_samples_leaf': 6}. Best is trial 406 with value: 0.5986570551043842.
[I 2024-11-06 21:02:24,390] Trial 643 finished with value: 0.5926091135958492 and parameters: {'n_estimators': 83, 'max_depth': 5, 'min_samples_split': 5, 'min_samples_leaf': 7}. Best is trial 406 with value: 0.5986570551043842.
[I 2024-11-06 21:02:26,844] Trial 644 finished with value: 0.5917386691253739 and parameters: {'n_estimators': 82, 'max_depth': 1, 'min_samples_split': 5, 'min_samples_leaf': 7}. Best is trial 406 with value: 0.5986570551043842.
[I 2024-11-06 21:02:30,525] Trial 645 finished with value: 0.5986055757626267 and parameters: {'n_estimators': 85, 'max_depth': 3, 'min_samples_split': 6, 'min_samples_leaf': 8}. Best is trial 406 with value: 0.5986570551043842.
[I 2024-11-06 21:02:34,964] Trial 646 finished with value: 0.5932149080139671 and parameters: {'n_estimators': 94, 'max_depth': 4, 'min_samples_split': 6, 'min_samples_leaf': 8}. Best is trial 406 with value: 0.5986570551043842.
[I 2024-11-06 21:02:37,873] Trial 647 finished with value: 0.5910571071304002 and parameters: {'n_estimators': 80, 'max_depth': 2, 'min_samples_split': 7, 'min_samples_leaf': 8}. Best is trial 406 with value: 0.5986570551043842.
[I 2024-11-06 21:02:41,215] Trial 648 finished with value: 0.5983308117958347 and parameters: {'n_estimators': 78, 'max_depth': 3, 'min_samples_split': 5, 'min_samples_leaf': 7}. Best is trial 406 with value: 0.5986570551043842.
[I 2024-11-06 21:02:46,011] Trial 649 finished with value: 0.5911365833966171 and parameters: {'n_estimators': 88, 'max_depth': 5, 'min_samples_split': 6, 'min_samples_leaf': 8}. Best is trial 406 with value: 0.5986570551043842.
[I 2024-11-06 21:02:50,062] Trial 650 finished with value: 0.5923179984596144 and parameters: {'n_estimators': 83, 'max_depth': 4, 'min_samples_split': 5, 'min_samples_leaf': 7}. Best is trial 406 with value: 0.5986570551043842.
[I 2024-11-06 21:02:52,769] Trial 651 finished with value: 0.5918129964131911 and parameters: {'n_estimators': 77, 'max_depth': 2, 'min_samples_split': 6, 'min_samples_leaf': 8}. Best is trial 406 with value: 0.5986570551043842.
[I 2024-11-06 21:02:55,219] Trial 652 finished with value: 0.5917386691253739 and parameters: {'n_estimators': 82, 'max_depth': 1, 'min_samples_split': 5, 'min_samples_leaf': 5}. Best is trial 406 with value: 0.5986570551043842.
[I 2024-11-06 21:02:58,741] Trial 653 finished with value: 0.5985312310368918 and parameters: {'n_estimators': 86, 'max_depth': 3, 'min_samples_split': 5, 'min_samples_leaf': 7}. Best is trial 406 with value: 0.5986570551043842.
[I 2024-11-06 21:03:01,996] Trial 654 finished with value: 0.5986005513415427 and parameters: {'n_estimators': 75, 'max_depth': 3, 'min_samples_split': 5, 'min_samples_leaf': 6}. Best is trial 406 with value: 0.5986570551043842.
[I 2024-11-06 21:03:06,620] Trial 655 finished with value: 0.5941819134192902 and parameters: {'n_estimators': 73, 'max_depth': 6, 'min_samples_split': 6, 'min_samples_leaf': 6}. Best is trial 406 with value: 0.5986570551043842.
[I 2024-11-06 21:03:10,282] Trial 656 finished with value: 0.5927467231361386 and parameters: {'n_estimators': 75, 'max_depth': 4, 'min_samples_split': 5, 'min_samples_leaf': 6}. Best is trial 406 with value: 0.5986570551043842.
[I 2024-11-06 21:03:21,223] Trial 657 finished with value: 0.5859011777048472 and parameters: {'n_estimators': 69, 'max_depth': 26, 'min_samples_split': 5, 'min_samples_leaf': 6}. Best is trial 406 with value: 0.5986570551043842.
[I 2024-11-06 21:03:24,503] Trial 658 finished with value: 0.5985399479723581 and parameters: {'n_estimators': 76, 'max_depth': 3, 'min_samples_split': 5, 'min_samples_leaf': 5}. Best is trial 406 with value: 0.5986570551043842.
[I 2024-11-06 21:03:27,064] Trial 659 finished with value: 0.5921026234911293 and parameters: {'n_estimators': 71, 'max_depth': 2, 'min_samples_split': 6, 'min_samples_leaf': 6}. Best is trial 406 with value: 0.5986570551043842.
[I 2024-11-06 21:03:29,711] Trial 660 finished with value: 0.5917128890235319 and parameters: {'n_estimators': 80, 'max_depth': 1, 'min_samples_split': 4, 'min_samples_leaf': 7}. Best is trial 406 with value: 0.5986570551043842.
[I 2024-11-06 21:03:33,913] Trial 661 finished with value: 0.5924951728875295 and parameters: {'n_estimators': 75, 'max_depth': 5, 'min_samples_split': 5, 'min_samples_leaf': 6}. Best is trial 406 with value: 0.5986570551043842.
[I 2024-11-06 21:03:36,738] Trial 662 finished with value: 0.5979239922222841 and parameters: {'n_estimators': 69, 'max_depth': 3, 'min_samples_split': 8, 'min_samples_leaf': 5}. Best is trial 406 with value: 0.5986570551043842.
[I 2024-11-06 21:03:40,505] Trial 663 finished with value: 0.591990043816937 and parameters: {'n_estimators': 78, 'max_depth': 4, 'min_samples_split': 6, 'min_samples_leaf': 8}. Best is trial 406 with value: 0.5986570551043842.
[I 2024-11-06 21:03:44,488] Trial 664 finished with value: 0.5912060412736547 and parameters: {'n_estimators': 119, 'max_depth': 2, 'min_samples_split': 4, 'min_samples_leaf': 8}. Best is trial 406 with value: 0.5986570551043842.
[I 2024-11-06 21:03:47,285] Trial 665 finished with value: 0.5971028532284699 and parameters: {'n_estimators': 66, 'max_depth': 3, 'min_samples_split': 4, 'min_samples_leaf': 7}. Best is trial 406 with value: 0.5986570551043842.
[I 2024-11-06 21:03:50,429] Trial 666 finished with value: 0.5986391451991558 and parameters: {'n_estimators': 73, 'max_depth': 3, 'min_samples_split': 5, 'min_samples_leaf': 7}. Best is trial 406 with value: 0.5986570551043842.
[I 2024-11-06 21:03:54,796] Trial 667 finished with value: 0.5927968448778895 and parameters: {'n_estimators': 79, 'max_depth': 5, 'min_samples_split': 5, 'min_samples_leaf': 7}. Best is trial 406 with value: 0.5986570551043842.
[I 2024-11-06 21:03:57,396] Trial 668 finished with value: 0.592437301835236 and parameters: {'n_estimators': 74, 'max_depth': 2, 'min_samples_split': 5, 'min_samples_leaf': 7}. Best is trial 406 with value: 0.5986570551043842.
[I 2024-11-06 21:04:01,127] Trial 669 finished with value: 0.5926545333360377 and parameters: {'n_estimators': 76, 'max_depth': 4, 'min_samples_split': 6, 'min_samples_leaf': 6}. Best is trial 406 with value: 0.5986570551043842.
[I 2024-11-06 21:04:06,378] Trial 670 finished with value: 0.593774707581812 and parameters: {'n_estimators': 81, 'max_depth': 6, 'min_samples_split': 5, 'min_samples_leaf': 6}. Best is trial 406 with value: 0.5986570551043842.
[I 2024-11-06 21:04:14,651] Trial 671 finished with value: 0.5923300548584588 and parameters: {'n_estimators': 71, 'max_depth': 15, 'min_samples_split': 5, 'min_samples_leaf': 7}. Best is trial 406 with value: 0.5986570551043842.
[I 2024-11-06 21:04:17,085] Trial 672 finished with value: 0.5917145536290467 and parameters: {'n_estimators': 78, 'max_depth': 1, 'min_samples_split': 7, 'min_samples_leaf': 8}. Best is trial 406 with value: 0.5986570551043842.
[I 2024-11-06 21:04:18,694] Trial 673 finished with value: 0.5910875289131285 and parameters: {'n_estimators': 26, 'max_depth': 4, 'min_samples_split': 6, 'min_samples_leaf': 4}. Best is trial 406 with value: 0.5986570551043842.
[I 2024-11-06 21:04:20,975] Trial 674 finished with value: 0.592162303073224 and parameters: {'n_estimators': 62, 'max_depth': 2, 'min_samples_split': 5, 'min_samples_leaf': 7}. Best is trial 406 with value: 0.5986570551043842.
[I 2024-11-06 21:04:24,220] Trial 675 finished with value: 0.5986570551043842 and parameters: {'n_estimators': 73, 'max_depth': 3, 'min_samples_split': 5, 'min_samples_leaf': 8}. Best is trial 406 with value: 0.5986570551043842.
[I 2024-11-06 21:04:29,632] Trial 676 finished with value: 0.5934556750807619 and parameters: {'n_estimators': 81, 'max_depth': 7, 'min_samples_split': 5, 'min_samples_leaf': 8}. Best is trial 406 with value: 0.5986570551043842.
[I 2024-11-06 21:04:37,083] Trial 677 finished with value: 0.594148515082341 and parameters: {'n_estimators': 188, 'max_depth': 3, 'min_samples_split': 5, 'min_samples_leaf': 8}. Best is trial 406 with value: 0.5986570551043842.
[I 2024-11-06 21:04:41,138] Trial 678 finished with value: 0.5923128757783447 and parameters: {'n_estimators': 75, 'max_depth': 5, 'min_samples_split': 5, 'min_samples_leaf': 8}. Best is trial 406 with value: 0.5986570551043842.
[I 2024-11-06 21:04:44,110] Trial 679 finished with value: 0.5912720910547785 and parameters: {'n_estimators': 84, 'max_depth': 2, 'min_samples_split': 6, 'min_samples_leaf': 7}. Best is trial 406 with value: 0.5986570551043842.
[I 2024-11-06 21:04:47,092] Trial 680 finished with value: 0.5978041066304103 and parameters: {'n_estimators': 67, 'max_depth': 3, 'min_samples_split': 5, 'min_samples_leaf': 8}. Best is trial 406 with value: 0.5986570551043842.
[I 2024-11-06 21:04:50,668] Trial 681 finished with value: 0.5928774319411155 and parameters: {'n_estimators': 73, 'max_depth': 4, 'min_samples_split': 5, 'min_samples_leaf': 7}. Best is trial 406 with value: 0.5986570551043842.
[I 2024-11-06 21:04:53,054] Trial 682 finished with value: 0.5917145536290467 and parameters: {'n_estimators': 78, 'max_depth': 1, 'min_samples_split': 6, 'min_samples_leaf': 8}. Best is trial 406 with value: 0.5986570551043842.
[I 2024-11-06 21:04:55,562] Trial 683 finished with value: 0.5965067503417015 and parameters: {'n_estimators': 54, 'max_depth': 3, 'min_samples_split': 4, 'min_samples_leaf': 8}. Best is trial 406 with value: 0.5986570551043842.
[I 2024-11-06 21:05:00,003] Trial 684 finished with value: 0.5926091135958492 and parameters: {'n_estimators': 83, 'max_depth': 5, 'min_samples_split': 5, 'min_samples_leaf': 7}. Best is trial 406 with value: 0.5986570551043842.
[I 2024-11-06 21:05:03,852] Trial 685 finished with value: 0.592575330941276 and parameters: {'n_estimators': 75, 'max_depth': 4, 'min_samples_split': 4, 'min_samples_leaf': 8}. Best is trial 406 with value: 0.5986570551043842.
[I 2024-11-06 21:05:06,506] Trial 686 finished with value: 0.5918067507377837 and parameters: {'n_estimators': 70, 'max_depth': 2, 'min_samples_split': 5, 'min_samples_leaf': 6}. Best is trial 406 with value: 0.5986570551043842.
[I 2024-11-06 21:05:10,353] Trial 687 finished with value: 0.5920029522583604 and parameters: {'n_estimators': 79, 'max_depth': 4, 'min_samples_split': 6, 'min_samples_leaf': 7}. Best is trial 406 with value: 0.5986570551043842.
[I 2024-11-06 21:05:12,767] Trial 688 finished with value: 0.5923166101256573 and parameters: {'n_estimators': 67, 'max_depth': 2, 'min_samples_split': 4, 'min_samples_leaf': 8}. Best is trial 406 with value: 0.5986570551043842.
[I 2024-11-06 21:05:15,255] Trial 689 finished with value: 0.5917455597271795 and parameters: {'n_estimators': 85, 'max_depth': 1, 'min_samples_split': 4, 'min_samples_leaf': 7}. Best is trial 406 with value: 0.5986570551043842.
[I 2024-11-06 21:05:18,438] Trial 690 finished with value: 0.5985993443281663 and parameters: {'n_estimators': 72, 'max_depth': 3, 'min_samples_split': 4, 'min_samples_leaf': 6}. Best is trial 406 with value: 0.5986570551043842.
[I 2024-11-06 21:05:30,303] Trial 691 finished with value: 0.588660213631216 and parameters: {'n_estimators': 81, 'max_depth': 22, 'min_samples_split': 5, 'min_samples_leaf': 7}. Best is trial 406 with value: 0.5986570551043842.
[I 2024-11-06 21:05:34,512] Trial 692 finished with value: 0.5933612095418294 and parameters: {'n_estimators': 76, 'max_depth': 5, 'min_samples_split': 5, 'min_samples_leaf': 7}. Best is trial 406 with value: 0.5986570551043842.
[I 2024-11-06 21:05:40,913] Trial 693 finished with value: 0.5930434721937445 and parameters: {'n_estimators': 88, 'max_depth': 8, 'min_samples_split': 4, 'min_samples_leaf': 8}. Best is trial 406 with value: 0.5986570551043842.
[I 2024-11-06 21:05:51,675] Trial 694 finished with value: 0.5900858762441474 and parameters: {'n_estimators': 79, 'max_depth': 19, 'min_samples_split': 4, 'min_samples_leaf': 8}. Best is trial 406 with value: 0.5986570551043842.
[I 2024-11-06 21:05:54,704] Trial 695 finished with value: 0.5979239922222841 and parameters: {'n_estimators': 69, 'max_depth': 3, 'min_samples_split': 5, 'min_samples_leaf': 6}. Best is trial 406 with value: 0.5986570551043842.
[I 2024-11-06 21:05:59,420] Trial 696 finished with value: 0.5938203794735368 and parameters: {'n_estimators': 74, 'max_depth': 6, 'min_samples_split': 5, 'min_samples_leaf': 7}. Best is trial 406 with value: 0.5986570551043842.
[I 2024-11-06 21:06:02,463] Trial 697 finished with value: 0.591371237145655 and parameters: {'n_estimators': 83, 'max_depth': 2, 'min_samples_split': 7, 'min_samples_leaf': 4}. Best is trial 406 with value: 0.5986570551043842.
[I 2024-11-06 21:06:06,431] Trial 698 finished with value: 0.5922069860985504 and parameters: {'n_estimators': 77, 'max_depth': 4, 'min_samples_split': 6, 'min_samples_leaf': 8}. Best is trial 406 with value: 0.5986570551043842.
[I 2024-11-06 21:06:09,494] Trial 699 finished with value: 0.5923725768554996 and parameters: {'n_estimators': 62, 'max_depth': 4, 'min_samples_split': 4, 'min_samples_leaf': 8}. Best is trial 406 with value: 0.5986570551043842.
[I 2024-11-06 21:06:12,183] Trial 700 finished with value: 0.590167584910588 and parameters: {'n_estimators': 91, 'max_depth': 1, 'min_samples_split': 4, 'min_samples_leaf': 5}. Best is trial 406 with value: 0.5986570551043842.
[I 2024-11-06 21:06:15,290] Trial 701 finished with value: 0.5985855526514433 and parameters: {'n_estimators': 72, 'max_depth': 3, 'min_samples_split': 5, 'min_samples_leaf': 7}. Best is trial 406 with value: 0.5986570551043842.
[I 2024-11-06 21:06:17,712] Trial 702 finished with value: 0.5923708604952941 and parameters: {'n_estimators': 66, 'max_depth': 2, 'min_samples_split': 6, 'min_samples_leaf': 8}. Best is trial 406 with value: 0.5986570551043842.
[I 2024-11-06 21:06:22,105] Trial 703 finished with value: 0.5922546174537378 and parameters: {'n_estimators': 81, 'max_depth': 5, 'min_samples_split': 4, 'min_samples_leaf': 6}. Best is trial 406 with value: 0.5986570551043842.
