[I 2024-11-06 20:52:52,172] Trial 513 finished with value: 0.5922331438537377 and parameters: {'n_estimators': 61, 'max_depth': 2, 'min_samples_split': 3, 'min_samples_leaf': 9}. Best is trial 406 with value: 0.5986570551043842.
[I 2024-11-06 20:52:56,611] Trial 514 finished with value: 0.5937667013356747 and parameters: {'n_estimators': 94, 'max_depth': 4, 'min_samples_split': 3, 'min_samples_leaf': 12}. Best is trial 406 with value: 0.5986570551043842.
[I 2024-11-06 20:53:09,695] Trial 515 finished with value: 0.5886870338246277 and parameters: {'n_estimators': 83, 'max_depth': 37, 'min_samples_split': 2, 'min_samples_leaf': 10}. Best is trial 406 with value: 0.5986570551043842.
[I 2024-11-06 20:53:11,894] Trial 516 finished with value: 0.5919598878858062 and parameters: {'n_estimators': 73, 'max_depth': 1, 'min_samples_split': 3, 'min_samples_leaf': 11}. Best is trial 406 with value: 0.5986570551043842.
[I 2024-11-06 20:53:17,352] Trial 517 finished with value: 0.592376168085028 and parameters: {'n_estimators': 64, 'max_depth': 9, 'min_samples_split': 2, 'min_samples_leaf': 9}. Best is trial 406 with value: 0.5986570551043842.
[I 2024-11-06 20:53:24,698] Trial 518 finished with value: 0.5936065793973502 and parameters: {'n_estimators': 79, 'max_depth': 11, 'min_samples_split': 4, 'min_samples_leaf': 8}. Best is trial 406 with value: 0.5986570551043842.
[I 2024-11-06 20:53:28,378] Trial 519 finished with value: 0.5984967361840647 and parameters: {'n_estimators': 87, 'max_depth': 3, 'min_samples_split': 3, 'min_samples_leaf': 10}. Best is trial 406 with value: 0.5986570551043842.
[I 2024-11-06 20:53:33,117] Trial 520 finished with value: 0.5931681367211566 and parameters: {'n_estimators': 69, 'max_depth': 7, 'min_samples_split': 2, 'min_samples_leaf': 9}. Best is trial 406 with value: 0.5986570551043842.
[I 2024-11-06 20:53:35,893] Trial 521 finished with value: 0.5918129964131911 and parameters: {'n_estimators': 77, 'max_depth': 2, 'min_samples_split': 4, 'min_samples_leaf': 10}. Best is trial 406 with value: 0.5986570551043842.
[I 2024-11-06 20:53:39,015] Trial 522 finished with value: 0.5986570551043842 and parameters: {'n_estimators': 73, 'max_depth': 3, 'min_samples_split': 3, 'min_samples_leaf': 8}. Best is trial 406 with value: 0.5986570551043842.
[I 2024-11-06 20:53:42,659] Trial 523 finished with value: 0.5919447834606373 and parameters: {'n_estimators': 65, 'max_depth': 5, 'min_samples_split': 7, 'min_samples_leaf': 8}. Best is trial 406 with value: 0.5986570551043842.
[I 2024-11-06 20:53:46,209] Trial 524 finished with value: 0.5931149841128034 and parameters: {'n_estimators': 71, 'max_depth': 4, 'min_samples_split': 3, 'min_samples_leaf': 9}. Best is trial 406 with value: 0.5986570551043842.
[I 2024-11-06 20:53:48,661] Trial 525 finished with value: 0.5917571992963908 and parameters: {'n_estimators': 83, 'max_depth': 1, 'min_samples_split': 3, 'min_samples_leaf': 11}. Best is trial 406 with value: 0.5986570551043842.
[I 2024-11-06 20:53:59,954] Trial 526 finished with value: 0.5881942080545617 and parameters: {'n_estimators': 72, 'max_depth': 46, 'min_samples_split': 2, 'min_samples_leaf': 9}. Best is trial 406 with value: 0.5986570551043842.
[I 2024-11-06 20:54:02,926] Trial 527 finished with value: 0.5982912402392642 and parameters: {'n_estimators': 68, 'max_depth': 3, 'min_samples_split': 3, 'min_samples_leaf': 10}. Best is trial 406 with value: 0.5986570551043842.
[I 2024-11-06 20:54:14,320] Trial 528 finished with value: 0.591135576923981 and parameters: {'n_estimators': 91, 'max_depth': 17, 'min_samples_split': 2, 'min_samples_leaf': 10}. Best is trial 406 with value: 0.5986570551043842.
[I 2024-11-06 20:54:17,152] Trial 529 finished with value: 0.5909627079043318 and parameters: {'n_estimators': 79, 'max_depth': 2, 'min_samples_split': 3, 'min_samples_leaf': 8}. Best is trial 406 with value: 0.5986570551043842.
[I 2024-11-06 20:54:20,913] Trial 530 finished with value: 0.5927071253668071 and parameters: {'n_estimators': 75, 'max_depth': 4, 'min_samples_split': 3, 'min_samples_leaf': 12}. Best is trial 406 with value: 0.5986570551043842.
[I 2024-11-06 20:54:24,458] Trial 531 finished with value: 0.5985916681517705 and parameters: {'n_estimators': 86, 'max_depth': 3, 'min_samples_split': 2, 'min_samples_leaf': 8}. Best is trial 406 with value: 0.5986570551043842.
[I 2024-11-06 20:54:29,689] Trial 532 finished with value: 0.5939914515467063 and parameters: {'n_estimators': 87, 'max_depth': 6, 'min_samples_split': 2, 'min_samples_leaf': 8}. Best is trial 406 with value: 0.5986570551043842.
[I 2024-11-06 20:54:33,463] Trial 533 finished with value: 0.5981847572448793 and parameters: {'n_estimators': 92, 'max_depth': 3, 'min_samples_split': 2, 'min_samples_leaf': 9}. Best is trial 406 with value: 0.5986570551043842.
[I 2024-11-06 20:54:38,183] Trial 534 finished with value: 0.591018755061257 and parameters: {'n_estimators': 87, 'max_depth': 5, 'min_samples_split': 2, 'min_samples_leaf': 8}. Best is trial 406 with value: 0.5986570551043842.
[I 2024-11-06 20:54:48,731] Trial 535 finished with value: 0.592710135922108 and parameters: {'n_estimators': 97, 'max_depth': 14, 'min_samples_split': 2, 'min_samples_leaf': 8}. Best is trial 406 with value: 0.5986570551043842.
[I 2024-11-06 20:54:51,770] Trial 536 finished with value: 0.5913809716906681 and parameters: {'n_estimators': 83, 'max_depth': 2, 'min_samples_split': 2, 'min_samples_leaf': 9}. Best is trial 406 with value: 0.5986570551043842.
[I 2024-11-06 20:54:55,175] Trial 537 finished with value: 0.5896826898387867 and parameters: {'n_estimators': 115, 'max_depth': 1, 'min_samples_split': 2, 'min_samples_leaf': 8}. Best is trial 406 with value: 0.5986570551043842.
[I 2024-11-06 20:54:59,544] Trial 538 finished with value: 0.5932730409866108 and parameters: {'n_estimators': 90, 'max_depth': 4, 'min_samples_split': 2, 'min_samples_leaf': 9}. Best is trial 406 with value: 0.5986570551043842.
[I 2024-11-06 20:55:03,306] Trial 539 finished with value: 0.5985531048468313 and parameters: {'n_estimators': 84, 'max_depth': 3, 'min_samples_split': 2, 'min_samples_leaf': 8}. Best is trial 406 with value: 0.5986570551043842.
[I 2024-11-06 20:55:06,238] Trial 540 finished with value: 0.5913878577048239 and parameters: {'n_estimators': 81, 'max_depth': 2, 'min_samples_split': 3, 'min_samples_leaf': 11}. Best is trial 406 with value: 0.5986570551043842.
[I 2024-11-06 20:55:10,782] Trial 541 finished with value: 0.5933021271909292 and parameters: {'n_estimators': 93, 'max_depth': 4, 'min_samples_split': 2, 'min_samples_leaf': 10}. Best is trial 406 with value: 0.5986570551043842.
[I 2024-11-06 20:55:14,263] Trial 542 finished with value: 0.5985764226469514 and parameters: {'n_estimators': 86, 'max_depth': 3, 'min_samples_split': 3, 'min_samples_leaf': 9}. Best is trial 406 with value: 0.5986570551043842.
[I 2024-11-06 20:55:16,746] Trial 543 finished with value: 0.5917128890235319 and parameters: {'n_estimators': 80, 'max_depth': 1, 'min_samples_split': 2, 'min_samples_leaf': 11}. Best is trial 406 with value: 0.5986570551043842.
[I 2024-11-06 20:55:20,979] Trial 544 finished with value: 0.5933638915690638 and parameters: {'n_estimators': 77, 'max_depth': 5, 'min_samples_split': 3, 'min_samples_leaf': 7}. Best is trial 406 with value: 0.5986570551043842.
[I 2024-11-06 20:55:25,335] Trial 545 finished with value: 0.592948406397856 and parameters: {'n_estimators': 88, 'max_depth': 4, 'min_samples_split': 8, 'min_samples_leaf': 10}. Best is trial 406 with value: 0.5986570551043842.
[I 2024-11-06 20:55:28,239] Trial 546 finished with value: 0.5912818339088736 and parameters: {'n_estimators': 84, 'max_depth': 2, 'min_samples_split': 3, 'min_samples_leaf': 10}. Best is trial 406 with value: 0.5986570551043842.
[I 2024-11-06 20:55:31,206] Trial 547 finished with value: 0.5982912402392642 and parameters: {'n_estimators': 68, 'max_depth': 3, 'min_samples_split': 2, 'min_samples_leaf': 8}. Best is trial 406 with value: 0.5986570551043842.
[I 2024-11-06 20:55:34,541] Trial 548 finished with value: 0.5910613627681549 and parameters: {'n_estimators': 59, 'max_depth': 5, 'min_samples_split': 10, 'min_samples_leaf': 12}. Best is trial 406 with value: 0.5986570551043842.
[I 2024-11-06 20:55:37,164] Trial 549 finished with value: 0.5921668994755558 and parameters: {'n_estimators': 72, 'max_depth': 2, 'min_samples_split': 3, 'min_samples_leaf': 11}. Best is trial 406 with value: 0.5986570551043842.
[I 2024-11-06 20:55:40,604] Trial 550 finished with value: 0.5983100279683935 and parameters: {'n_estimators': 80, 'max_depth': 3, 'min_samples_split': 2, 'min_samples_leaf': 9}. Best is trial 406 with value: 0.5986570551043842.
[I 2024-11-06 20:55:44,337] Trial 551 finished with value: 0.5926383739342372 and parameters: {'n_estimators': 75, 'max_depth': 4, 'min_samples_split': 3, 'min_samples_leaf': 10}. Best is trial 406 with value: 0.5986570551043842.
[I 2024-11-06 20:55:50,254] Trial 552 finished with value: 0.5941497209971102 and parameters: {'n_estimators': 98, 'max_depth': 6, 'min_samples_split': 3, 'min_samples_leaf': 8}. Best is trial 406 with value: 0.5986570551043842.
[I 2024-11-06 20:55:52,709] Trial 553 finished with value: 0.5917322325167881 and parameters: {'n_estimators': 79, 'max_depth': 1, 'min_samples_split': 2, 'min_samples_leaf': 10}. Best is trial 406 with value: 0.5986570551043842.
[I 2024-11-06 20:56:02,867] Trial 554 finished with value: 0.5873593795310658 and parameters: {'n_estimators': 64, 'max_depth': 40, 'min_samples_split': 2, 'min_samples_leaf': 9}. Best is trial 406 with value: 0.5986570551043842.
[I 2024-11-06 20:56:07,086] Trial 555 finished with value: 0.5928964292314218 and parameters: {'n_estimators': 84, 'max_depth': 4, 'min_samples_split': 3, 'min_samples_leaf': 10}. Best is trial 406 with value: 0.5986570551043842.
[I 2024-11-06 20:56:10,268] Trial 556 finished with value: 0.5986570551043842 and parameters: {'n_estimators': 73, 'max_depth': 3, 'min_samples_split': 3, 'min_samples_leaf': 8}. Best is trial 406 with value: 0.5986570551043842.
[I 2024-11-06 20:56:12,723] Trial 557 finished with value: 0.5923166101256573 and parameters: {'n_estimators': 67, 'max_depth': 2, 'min_samples_split': 3, 'min_samples_leaf': 7}. Best is trial 406 with value: 0.5986570551043842.
[I 2024-11-06 20:56:24,030] Trial 558 finished with value: 0.5867254025024918 and parameters: {'n_estimators': 72, 'max_depth': 34, 'min_samples_split': 13, 'min_samples_leaf': 8}. Best is trial 406 with value: 0.5986570551043842.
[I 2024-11-06 20:56:27,858] Trial 559 finished with value: 0.5981806380329132 and parameters: {'n_estimators': 92, 'max_depth': 3, 'min_samples_split': 7, 'min_samples_leaf': 8}. Best is trial 406 with value: 0.5986570551043842.
[I 2024-11-06 20:56:32,288] Trial 560 finished with value: 0.5939576315773947 and parameters: {'n_estimators': 70, 'max_depth': 6, 'min_samples_split': 2, 'min_samples_leaf': 8}. Best is trial 406 with value: 0.5986570551043842.
[I 2024-11-06 20:56:33,685] Trial 561 finished with value: 0.5914424688929223 and parameters: {'n_estimators': 38, 'max_depth': 1, 'min_samples_split': 3, 'min_samples_leaf': 7}. Best is trial 406 with value: 0.5986570551043842.
[I 2024-11-06 20:56:37,867] Trial 562 finished with value: 0.5923332066333149 and parameters: {'n_estimators': 77, 'max_depth': 5, 'min_samples_split': 2, 'min_samples_leaf': 8}. Best is trial 406 with value: 0.5986570551043842.
[I 2024-11-06 20:56:40,932] Trial 563 finished with value: 0.5909050615045738 and parameters: {'n_estimators': 87, 'max_depth': 2, 'min_samples_split': 3, 'min_samples_leaf': 9}. Best is trial 406 with value: 0.5986570551043842.
[I 2024-11-06 20:56:45,015] Trial 564 finished with value: 0.5923678011910821 and parameters: {'n_estimators': 82, 'max_depth': 4, 'min_samples_split': 17, 'min_samples_leaf': 9}. Best is trial 406 with value: 0.5986570551043842.
[I 2024-11-06 20:56:48,224] Trial 565 finished with value: 0.5986294604395617 and parameters: {'n_estimators': 74, 'max_depth': 3, 'min_samples_split': 2, 'min_samples_leaf': 7}. Best is trial 406 with value: 0.5986570551043842.
[I 2024-11-06 20:56:50,834] Trial 566 finished with value: 0.5922251752300065 and parameters: {'n_estimators': 73, 'max_depth': 2, 'min_samples_split': 3, 'min_samples_leaf': 6}. Best is trial 406 with value: 0.5986570551043842.
[I 2024-11-06 20:56:53,620] Trial 567 finished with value: 0.5969620574965937 and parameters: {'n_estimators': 63, 'max_depth': 3, 'min_samples_split': 3, 'min_samples_leaf': 7}. Best is trial 406 with value: 0.5986570551043842.
[I 2024-11-06 20:56:57,028] Trial 568 finished with value: 0.5923247991027789 and parameters: {'n_estimators': 68, 'max_depth': 4, 'min_samples_split': 2, 'min_samples_leaf': 6}. Best is trial 406 with value: 0.5986570551043842.
[I 2024-11-06 20:57:01,168] Trial 569 finished with value: 0.5930210769465751 and parameters: {'n_estimators': 73, 'max_depth': 5, 'min_samples_split': 3, 'min_samples_leaf': 7}. Best is trial 406 with value: 0.5986570551043842.
[I 2024-11-06 20:57:04,412] Trial 570 finished with value: 0.597923905053735 and parameters: {'n_estimators': 69, 'max_depth': 3, 'min_samples_split': 2, 'min_samples_leaf': 11}. Best is trial 406 with value: 0.5986570551043842.
[I 2024-11-06 20:57:06,745] Trial 571 finished with value: 0.5918513869487873 and parameters: {'n_estimators': 76, 'max_depth': 1, 'min_samples_split': 11, 'min_samples_leaf': 5}. Best is trial 406 with value: 0.5986570551043842.
[I 2024-11-06 20:57:09,974] Trial 572 finished with value: 0.5933087320740462 and parameters: {'n_estimators': 65, 'max_depth': 4, 'min_samples_split': 15, 'min_samples_leaf': 10}. Best is trial 406 with value: 0.5986570551043842.
[I 2024-11-06 20:57:12,628] Trial 573 finished with value: 0.5921668994755558 and parameters: {'n_estimators': 72, 'max_depth': 2, 'min_samples_split': 3, 'min_samples_leaf': 11}. Best is trial 406 with value: 0.5986570551043842.
[I 2024-11-06 20:57:15,340] Trial 574 finished with value: 0.5918129964131911 and parameters: {'n_estimators': 77, 'max_depth': 2, 'min_samples_split': 2, 'min_samples_leaf': 12}. Best is trial 406 with value: 0.5986570551043842.
[I 2024-11-06 20:57:19,614] Trial 575 finished with value: 0.5914493246376789 and parameters: {'n_estimators': 78, 'max_depth': 5, 'min_samples_split': 3, 'min_samples_leaf': 10}. Best is trial 406 with value: 0.5986570551043842.
[I 2024-11-06 20:57:22,123] Trial 576 finished with value: 0.5964535931305515 and parameters: {'n_estimators': 57, 'max_depth': 3, 'min_samples_split': 2, 'min_samples_leaf': 7}. Best is trial 406 with value: 0.5986570551043842.
[I 2024-11-06 20:57:27,161] Trial 577 finished with value: 0.5937538725464002 and parameters: {'n_estimators': 73, 'max_depth': 7, 'min_samples_split': 3, 'min_samples_leaf': 6}. Best is trial 406 with value: 0.5986570551043842.
[I 2024-11-06 20:57:30,177] Trial 578 finished with value: 0.5979225488636988 and parameters: {'n_estimators': 69, 'max_depth': 3, 'min_samples_split': 2, 'min_samples_leaf': 9}. Best is trial 406 with value: 0.5986570551043842.
[I 2024-11-06 20:57:34,110] Trial 579 finished with value: 0.5921776684534088 and parameters: {'n_estimators': 80, 'max_depth': 4, 'min_samples_split': 4, 'min_samples_leaf': 11}. Best is trial 406 with value: 0.5986570551043842.
[I 2024-11-06 20:57:44,242] Trial 580 finished with value: 0.5905844732667089 and parameters: {'n_estimators': 75, 'max_depth': 20, 'min_samples_split': 3, 'min_samples_leaf': 10}. Best is trial 406 with value: 0.5986570551043842.
[I 2024-11-06 20:57:46,400] Trial 581 finished with value: 0.5916950430541796 and parameters: {'n_estimators': 70, 'max_depth': 1, 'min_samples_split': 2, 'min_samples_leaf': 7}. Best is trial 406 with value: 0.5986570551043842.
[I 2024-11-06 20:57:51,319] Trial 582 finished with value: 0.5934416232115762 and parameters: {'n_estimators': 65, 'max_depth': 8, 'min_samples_split': 4, 'min_samples_leaf': 10}. Best is trial 406 with value: 0.5986570551043842.
[I 2024-11-06 20:57:54,118] Trial 583 finished with value: 0.5909627079043318 and parameters: {'n_estimators': 79, 'max_depth': 2, 'min_samples_split': 3, 'min_samples_leaf': 9}. Best is trial 406 with value: 0.5986570551043842.
[I 2024-11-06 20:57:58,186] Trial 584 finished with value: 0.5912418693025275 and parameters: {'n_estimators': 74, 'max_depth': 5, 'min_samples_split': 2, 'min_samples_leaf': 12}. Best is trial 406 with value: 0.5986570551043842.
[I 2024-11-06 20:58:02,215] Trial 585 finished with value: 0.5923557268104178 and parameters: {'n_estimators': 82, 'max_depth': 4, 'min_samples_split': 3, 'min_samples_leaf': 10}. Best is trial 406 with value: 0.5986570551043842.
[I 2024-11-06 20:58:04,725] Trial 586 finished with value: 0.5963889727146027 and parameters: {'n_estimators': 51, 'max_depth': 3, 'min_samples_split': 4, 'min_samples_leaf': 11}. Best is trial 406 with value: 0.5986570551043842.
[I 2024-11-06 20:58:08,453] Trial 587 finished with value: 0.5923000353801575 and parameters: {'n_estimators': 77, 'max_depth': 4, 'min_samples_split': 3, 'min_samples_leaf': 9}. Best is trial 406 with value: 0.5986570551043842.
[I 2024-11-06 20:58:10,852] Trial 588 finished with value: 0.5922984334783765 and parameters: {'n_estimators': 67, 'max_depth': 2, 'min_samples_split': 2, 'min_samples_leaf': 16}. Best is trial 406 with value: 0.5986570551043842.
[I 2024-11-06 20:58:15,482] Trial 589 finished with value: 0.5934980012125435 and parameters: {'n_estimators': 73, 'max_depth': 6, 'min_samples_split': 4, 'min_samples_leaf': 9}. Best is trial 406 with value: 0.5986570551043842.
[I 2024-11-06 20:58:18,937] Trial 590 finished with value: 0.5983996657447802 and parameters: {'n_estimators': 81, 'max_depth': 3, 'min_samples_split': 3, 'min_samples_leaf': 8}. Best is trial 406 with value: 0.5986570551043842.
[I 2024-11-06 20:58:21,128] Trial 591 finished with value: 0.5918548791124849 and parameters: {'n_estimators': 72, 'max_depth': 1, 'min_samples_split': 2, 'min_samples_leaf': 10}. Best is trial 406 with value: 0.5986570551043842.
[I 2024-11-06 20:58:24,223] Trial 592 finished with value: 0.5927391840518887 and parameters: {'n_estimators': 62, 'max_depth': 4, 'min_samples_split': 3, 'min_samples_leaf': 11}. Best is trial 406 with value: 0.5986570551043842.
[I 2024-11-06 20:58:27,598] Trial 593 finished with value: 0.5984657232469455 and parameters: {'n_estimators': 77, 'max_depth': 3, 'min_samples_split': 2, 'min_samples_leaf': 7}. Best is trial 406 with value: 0.5986570551043842.
[I 2024-11-06 20:58:40,315] Trial 594 finished with value: 0.5879267721876424 and parameters: {'n_estimators': 83, 'max_depth': 48, 'min_samples_split': 4, 'min_samples_leaf': 10}. Best is trial 406 with value: 0.5986570551043842.
[I 2024-11-06 20:58:44,225] Trial 595 finished with value: 0.5928944010435476 and parameters: {'n_estimators': 69, 'max_depth': 5, 'min_samples_split': 6, 'min_samples_leaf': 4}. Best is trial 406 with value: 0.5986570551043842.
[I 2024-11-06 20:58:47,019] Trial 596 finished with value: 0.5921729033109402 and parameters: {'n_estimators': 76, 'max_depth': 2, 'min_samples_split': 12, 'min_samples_leaf': 8}. Best is trial 406 with value: 0.5986570551043842.
[I 2024-11-06 20:58:49,956] Trial 597 finished with value: 0.5910571071304002 and parameters: {'n_estimators': 80, 'max_depth': 2, 'min_samples_split': 3, 'min_samples_leaf': 12}. Best is trial 406 with value: 0.5986570551043842.
[I 2024-11-06 20:58:53,474] Trial 598 finished with value: 0.5940138189425656 and parameters: {'n_estimators': 71, 'max_depth': 4, 'min_samples_split': 4, 'min_samples_leaf': 1}. Best is trial 406 with value: 0.5986570551043842.
[I 2024-11-06 20:58:57,140] Trial 599 finished with value: 0.5982962564436771 and parameters: {'n_estimators': 89, 'max_depth': 3, 'min_samples_split': 2, 'min_samples_leaf': 2}. Best is trial 406 with value: 0.5986570551043842.
[I 2024-11-06 20:59:00,072] Trial 600 finished with value: 0.5918030263982164 and parameters: {'n_estimators': 101, 'max_depth': 1, 'min_samples_split': 3, 'min_samples_leaf': 9}. Best is trial 406 with value: 0.5986570551043842.
[I 2024-11-06 20:59:03,905] Trial 601 finished with value: 0.5915475450816914 and parameters: {'n_estimators': 66, 'max_depth': 5, 'min_samples_split': 2, 'min_samples_leaf': 10}. Best is trial 406 with value: 0.5986570551043842.
[I 2024-11-06 20:59:07,606] Trial 602 finished with value: 0.5984691491282776 and parameters: {'n_estimators': 84, 'max_depth': 3, 'min_samples_split': 11, 'min_samples_leaf': 1}. Best is trial 406 with value: 0.5986570551043842.
[I 2024-11-06 20:59:10,336] Trial 603 finished with value: 0.592437301835236 and parameters: {'n_estimators': 74, 'max_depth': 2, 'min_samples_split': 4, 'min_samples_leaf': 10}. Best is trial 406 with value: 0.5986570551043842.
[I 2024-11-06 20:59:14,625] Trial 604 finished with value: 0.5914583949991084 and parameters: {'n_estimators': 79, 'max_depth': 5, 'min_samples_split': 3, 'min_samples_leaf': 9}. Best is trial 406 with value: 0.5986570551043842.
[I 2024-11-06 20:59:18,187] Trial 605 finished with value: 0.5917881928801274 and parameters: {'n_estimators': 69, 'max_depth': 4, 'min_samples_split': 2, 'min_samples_leaf': 6}. Best is trial 406 with value: 0.5986570551043842.
[I 2024-11-06 20:59:22,734] Trial 606 finished with value: 0.593056192011892 and parameters: {'n_estimators': 75, 'max_depth': 6, 'min_samples_split': 3, 'min_samples_leaf': 1}. Best is trial 406 with value: 0.5986570551043842.
[I 2024-11-06 20:59:25,236] Trial 607 finished with value: 0.5917455597271795 and parameters: {'n_estimators': 85, 'max_depth': 1, 'min_samples_split': 4, 'min_samples_leaf': 11}. Best is trial 406 with value: 0.5986570551043842.
