[I 2024-11-06 20:15:11,378] Trial 36 finished with value: 0.5897245288796198 and parameters: {'n_estimators': 138, 'max_depth': 42, 'min_samples_split': 4, 'min_samples_leaf': 13}. Best is trial 29 with value: 0.5953366017224067.
[I 2024-11-06 20:15:18,518] Trial 37 finished with value: 0.5940946444413933 and parameters: {'n_estimators': 183, 'max_depth': 3, 'min_samples_split': 3, 'min_samples_leaf': 11}. Best is trial 29 with value: 0.5953366017224067.
[I 2024-11-06 20:15:30,152] Trial 38 finished with value: 0.5919658630174025 and parameters: {'n_estimators': 181, 'max_depth': 7, 'min_samples_split': 3, 'min_samples_leaf': 11}. Best is trial 29 with value: 0.5953366017224067.
[I 2024-11-06 20:15:36,602] Trial 39 finished with value: 0.5897714585534299 and parameters: {'n_estimators': 200, 'max_depth': 2, 'min_samples_split': 5, 'min_samples_leaf': 9}. Best is trial 29 with value: 0.5953366017224067.
[I 2024-11-06 20:15:59,857] Trial 40 finished with value: 0.5903535458851243 and parameters: {'n_estimators': 169, 'max_depth': 49, 'min_samples_split': 2, 'min_samples_leaf': 14}. Best is trial 29 with value: 0.5953366017224067.
[I 2024-11-06 20:16:07,501] Trial 41 finished with value: 0.5937018024004905 and parameters: {'n_estimators': 158, 'max_depth': 4, 'min_samples_split': 3, 'min_samples_leaf': 14}. Best is trial 29 with value: 0.5953366017224067.
[I 2024-11-06 20:16:16,144] Trial 42 finished with value: 0.5925074232723186 and parameters: {'n_estimators': 148, 'max_depth': 6, 'min_samples_split': 5, 'min_samples_leaf': 12}. Best is trial 29 with value: 0.5953366017224067.
[I 2024-11-06 20:16:21,446] Trial 43 finished with value: 0.5950512731613216 and parameters: {'n_estimators': 132, 'max_depth': 3, 'min_samples_split': 3, 'min_samples_leaf': 9}. Best is trial 29 with value: 0.5953366017224067.
[I 2024-11-06 20:16:28,738] Trial 44 finished with value: 0.5929254950877532 and parameters: {'n_estimators': 110, 'max_depth': 7, 'min_samples_split': 3, 'min_samples_leaf': 9}. Best is trial 29 with value: 0.5953366017224067.
[I 2024-11-06 20:16:33,999] Trial 45 finished with value: 0.5949870054274958 and parameters: {'n_estimators': 131, 'max_depth': 3, 'min_samples_split': 6, 'min_samples_leaf': 8}. Best is trial 29 with value: 0.5953366017224067.
[I 2024-11-06 20:16:44,039] Trial 46 finished with value: 0.5925496298414131 and parameters: {'n_estimators': 130, 'max_depth': 9, 'min_samples_split': 6, 'min_samples_leaf': 8}. Best is trial 29 with value: 0.5953366017224067.
[I 2024-11-06 20:16:47,860] Trial 47 finished with value: 0.5910472343401413 and parameters: {'n_estimators': 113, 'max_depth': 2, 'min_samples_split': 8, 'min_samples_leaf': 7}. Best is trial 29 with value: 0.5953366017224067.
[I 2024-11-06 20:17:00,691] Trial 48 finished with value: 0.5928097212258037 and parameters: {'n_estimators': 135, 'max_depth': 12, 'min_samples_split': 6, 'min_samples_leaf': 10}. Best is trial 29 with value: 0.5953366017224067.
[I 2024-11-06 20:17:18,996] Trial 49 finished with value: 0.5804585582378909 and parameters: {'n_estimators': 99, 'max_depth': 29, 'min_samples_split': 3, 'min_samples_leaf': 2}. Best is trial 29 with value: 0.5953366017224067.
[I 2024-11-06 20:17:33,210] Trial 50 finished with value: 0.5921585341344174 and parameters: {'n_estimators': 119, 'max_depth': 16, 'min_samples_split': 2, 'min_samples_leaf': 8}. Best is trial 29 with value: 0.5953366017224067.
[I 2024-11-06 20:17:41,723] Trial 51 finished with value: 0.5906843995559031 and parameters: {'n_estimators': 165, 'max_depth': 5, 'min_samples_split': 5, 'min_samples_leaf': 11}. Best is trial 29 with value: 0.5953366017224067.
[I 2024-11-06 20:17:47,570] Trial 52 finished with value: 0.5899210304016123 and parameters: {'n_estimators': 181, 'max_depth': 2, 'min_samples_split': 4, 'min_samples_leaf': 13}. Best is trial 29 with value: 0.5953366017224067.
[I 2024-11-06 20:17:56,857] Trial 53 finished with value: 0.5927493048400522 and parameters: {'n_estimators': 131, 'max_depth': 8, 'min_samples_split': 3, 'min_samples_leaf': 10}. Best is trial 29 with value: 0.5953366017224067.
[I 2024-11-06 20:18:00,929] Trial 54 finished with value: 0.5893152735967122 and parameters: {'n_estimators': 144, 'max_depth': 1, 'min_samples_split': 6, 'min_samples_leaf': 15}. Best is trial 29 with value: 0.5953366017224067.
[I 2024-11-06 20:18:05,549] Trial 55 finished with value: 0.5974007765527598 and parameters: {'n_estimators': 105, 'max_depth': 3, 'min_samples_split': 8, 'min_samples_leaf': 9}. Best is trial 55 with value: 0.5974007765527598.
[I 2024-11-06 20:18:21,934] Trial 56 finished with value: 0.5864003578253729 and parameters: {'n_estimators': 103, 'max_depth': 39, 'min_samples_split': 8, 'min_samples_leaf': 7}. Best is trial 55 with value: 0.5974007765527598.
[I 2024-11-06 20:18:28,828] Trial 57 finished with value: 0.5927436307807075 and parameters: {'n_estimators': 114, 'max_depth': 6, 'min_samples_split': 8, 'min_samples_leaf': 6}. Best is trial 55 with value: 0.5974007765527598.
[I 2024-11-06 20:18:33,843] Trial 58 finished with value: 0.5954286722390074 and parameters: {'n_estimators': 126, 'max_depth': 3, 'min_samples_split': 7, 'min_samples_leaf': 9}. Best is trial 55 with value: 0.5974007765527598.
[I 2024-11-06 20:18:48,140] Trial 59 finished with value: 0.5924067021632361 and parameters: {'n_estimators': 176, 'max_depth': 10, 'min_samples_split': 10, 'min_samples_leaf': 9}. Best is trial 55 with value: 0.5974007765527598.
[I 2024-11-06 20:18:53,042] Trial 60 finished with value: 0.5954784903625793 and parameters: {'n_estimators': 123, 'max_depth': 3, 'min_samples_split': 7, 'min_samples_leaf': 9}. Best is trial 55 with value: 0.5974007765527598.
[I 2024-11-06 20:18:57,222] Trial 61 finished with value: 0.590949335343693 and parameters: {'n_estimators': 123, 'max_depth': 2, 'min_samples_split': 7, 'min_samples_leaf': 9}. Best is trial 55 with value: 0.5974007765527598.
[I 2024-11-06 20:19:04,925] Trial 62 finished with value: 0.5921560132957655 and parameters: {'n_estimators': 126, 'max_depth': 6, 'min_samples_split': 8, 'min_samples_leaf': 10}. Best is trial 55 with value: 0.5974007765527598.
[I 2024-11-06 20:19:10,574] Trial 63 finished with value: 0.5954081374076325 and parameters: {'n_estimators': 141, 'max_depth': 3, 'min_samples_split': 9, 'min_samples_leaf': 8}. Best is trial 55 with value: 0.5974007765527598.
[I 2024-11-06 20:19:20,650] Trial 64 finished with value: 0.5928886816327299 and parameters: {'n_estimators': 143, 'max_depth': 8, 'min_samples_split': 9, 'min_samples_leaf': 8}. Best is trial 55 with value: 0.5974007765527598.
[I 2024-11-06 20:19:24,403] Trial 65 finished with value: 0.5892325236890482 and parameters: {'n_estimators': 135, 'max_depth': 1, 'min_samples_split': 9, 'min_samples_leaf': 7}. Best is trial 55 with value: 0.5974007765527598.
[I 2024-11-06 20:19:30,706] Trial 66 finished with value: 0.5910537869348513 and parameters: {'n_estimators': 117, 'max_depth': 5, 'min_samples_split': 10, 'min_samples_leaf': 6}. Best is trial 55 with value: 0.5974007765527598.
[I 2024-11-06 20:19:32,191] Trial 67 finished with value: 0.5930074804552411 and parameters: {'n_estimators': 30, 'max_depth': 3, 'min_samples_split': 7, 'min_samples_leaf': 9}. Best is trial 55 with value: 0.5974007765527598.
[I 2024-11-06 20:19:45,912] Trial 68 finished with value: 0.5927457925695222 and parameters: {'n_estimators': 147, 'max_depth': 12, 'min_samples_split': 9, 'min_samples_leaf': 8}. Best is trial 55 with value: 0.5974007765527598.
[I 2024-11-06 20:19:57,898] Trial 69 finished with value: 0.5894374937674705 and parameters: {'n_estimators': 82, 'max_depth': 24, 'min_samples_split': 8, 'min_samples_leaf': 9}. Best is trial 55 with value: 0.5974007765527598.
[I 2024-11-06 20:20:08,967] Trial 70 finished with value: 0.592146719554915 and parameters: {'n_estimators': 139, 'max_depth': 9, 'min_samples_split': 10, 'min_samples_leaf': 7}. Best is trial 55 with value: 0.5974007765527598.
[I 2024-11-06 20:20:15,402] Trial 71 finished with value: 0.5954789352802106 and parameters: {'n_estimators': 163, 'max_depth': 3, 'min_samples_split': 7, 'min_samples_leaf': 11}. Best is trial 55 with value: 0.5974007765527598.
[I 2024-11-06 20:20:42,354] Trial 72 finished with value: 0.5954478184413459 and parameters: {'n_estimators': 162, 'max_depth': 3, 'min_samples_split': 7, 'min_samples_leaf': 11}. Best is trial 55 with value: 0.5974007765527598.
[I 2024-11-06 20:20:50,633] Trial 73 finished with value: 0.5906314503718489 and parameters: {'n_estimators': 159, 'max_depth': 5, 'min_samples_split': 8, 'min_samples_leaf': 11}. Best is trial 55 with value: 0.5974007765527598.
[I 2024-11-06 20:20:55,041] Trial 74 finished with value: 0.5893406781599095 and parameters: {'n_estimators': 163, 'max_depth': 1, 'min_samples_split': 7, 'min_samples_leaf': 10}. Best is trial 55 with value: 0.5974007765527598.
[I 2024-11-06 20:21:06,196] Trial 75 finished with value: 0.5925660260499426 and parameters: {'n_estimators': 172, 'max_depth': 7, 'min_samples_split': 7, 'min_samples_leaf': 10}. Best is trial 55 with value: 0.5974007765527598.
[I 2024-11-06 20:21:14,130] Trial 76 finished with value: 0.5902887659520523 and parameters: {'n_estimators': 152, 'max_depth': 5, 'min_samples_split': 14, 'min_samples_leaf': 11}. Best is trial 55 with value: 0.5974007765527598.
[I 2024-11-06 20:21:20,187] Trial 77 finished with value: 0.5953714512542575 and parameters: {'n_estimators': 150, 'max_depth': 3, 'min_samples_split': 5, 'min_samples_leaf': 11}. Best is trial 55 with value: 0.5974007765527598.
[I 2024-11-06 20:21:29,719] Trial 78 finished with value: 0.592291761524332 and parameters: {'n_estimators': 163, 'max_depth': 6, 'min_samples_split': 5, 'min_samples_leaf': 12}. Best is trial 55 with value: 0.5974007765527598.
[I 2024-11-06 20:21:35,348] Trial 79 finished with value: 0.5951754046639645 and parameters: {'n_estimators': 141, 'max_depth': 3, 'min_samples_split': 6, 'min_samples_leaf': 13}. Best is trial 55 with value: 0.5974007765527598.
[I 2024-11-06 20:21:48,517] Trial 80 finished with value: 0.5919014895560538 and parameters: {'n_estimators': 149, 'max_depth': 11, 'min_samples_split': 7, 'min_samples_leaf': 10}. Best is trial 55 with value: 0.5974007765527598.
[I 2024-11-06 20:21:54,134] Trial 81 finished with value: 0.5951833865162979 and parameters: {'n_estimators': 140, 'max_depth': 3, 'min_samples_split': 6, 'min_samples_leaf': 13}. Best is trial 55 with value: 0.5974007765527598.
[I 2024-11-06 20:21:59,182] Trial 82 finished with value: 0.5902042722701655 and parameters: {'n_estimators': 150, 'max_depth': 2, 'min_samples_split': 8, 'min_samples_leaf': 13}. Best is trial 55 with value: 0.5974007765527598.
[I 2024-11-06 20:22:05,923] Trial 83 finished with value: 0.5902659876580707 and parameters: {'n_estimators': 123, 'max_depth': 5, 'min_samples_split': 9, 'min_samples_leaf': 11}. Best is trial 55 with value: 0.5974007765527598.
[I 2024-11-06 20:22:10,667] Trial 84 finished with value: 0.5892485829826496 and parameters: {'n_estimators': 173, 'max_depth': 1, 'min_samples_split': 6, 'min_samples_leaf': 14}. Best is trial 55 with value: 0.5974007765527598.
[I 2024-11-06 20:22:16,077] Trial 85 finished with value: 0.5952146818298806 and parameters: {'n_estimators': 137, 'max_depth': 3, 'min_samples_split': 5, 'min_samples_leaf': 12}. Best is trial 55 with value: 0.5974007765527598.
[I 2024-11-06 20:22:26,348] Trial 86 finished with value: 0.5928417231647478 and parameters: {'n_estimators': 161, 'max_depth': 7, 'min_samples_split': 5, 'min_samples_leaf': 12}. Best is trial 55 with value: 0.5974007765527598.
[I 2024-11-06 20:22:45,725] Trial 87 finished with value: 0.5907002077047652 and parameters: {'n_estimators': 135, 'max_depth': 46, 'min_samples_split': 7, 'min_samples_leaf': 12}. Best is trial 55 with value: 0.5974007765527598.
[I 2024-11-06 20:22:49,837] Trial 88 finished with value: 0.5981215791759867 and parameters: {'n_estimators': 99, 'max_depth': 3, 'min_samples_split': 5, 'min_samples_leaf': 11}. Best is trial 88 with value: 0.5981215791759867.
[I 2024-11-06 20:22:57,102] Trial 89 finished with value: 0.5930109325114156 and parameters: {'n_estimators': 92, 'max_depth': 9, 'min_samples_split': 9, 'min_samples_leaf': 11}. Best is trial 88 with value: 0.5981215791759867.
[I 2024-11-06 20:23:02,608] Trial 90 finished with value: 0.5902040858130648 and parameters: {'n_estimators': 102, 'max_depth': 5, 'min_samples_split': 7, 'min_samples_leaf': 10}. Best is trial 88 with value: 0.5981215791759867.
[I 2024-11-06 20:23:03,496] Trial 91 finished with value: 0.5952525597981315 and parameters: {'n_estimators': 10, 'max_depth': 3, 'min_samples_split': 5, 'min_samples_leaf': 12}. Best is trial 88 with value: 0.5981215791759867.
[I 2024-11-06 20:23:13,043] Trial 92 finished with value: 0.5876989566709317 and parameters: {'n_estimators': 61, 'max_depth': 34, 'min_samples_split': 4, 'min_samples_leaf': 11}. Best is trial 88 with value: 0.5981215791759867.
[I 2024-11-06 20:23:14,465] Trial 93 finished with value: 0.5928127622940823 and parameters: {'n_estimators': 35, 'max_depth': 2, 'min_samples_split': 5, 'min_samples_leaf': 10}. Best is trial 88 with value: 0.5981215791759867.
[I 2024-11-06 20:23:15,940] Trial 94 finished with value: 0.5898895432038623 and parameters: {'n_estimators': 24, 'max_depth': 4, 'min_samples_split': 8, 'min_samples_leaf': 8}. Best is trial 88 with value: 0.5981215791759867.
[I 2024-11-06 20:23:16,588] Trial 95 finished with value: 0.5925451533016417 and parameters: {'n_estimators': 11, 'max_depth': 1, 'min_samples_split': 6, 'min_samples_leaf': 9}. Best is trial 88 with value: 0.5981215791759867.
[I 2024-11-06 20:23:25,459] Trial 96 finished with value: 0.5920153300401162 and parameters: {'n_estimators': 126, 'max_depth': 8, 'min_samples_split': 10, 'min_samples_leaf': 12}. Best is trial 88 with value: 0.5981215791759867.
[I 2024-11-06 20:23:26,750] Trial 97 finished with value: 0.5907610648353914 and parameters: {'n_estimators': 20, 'max_depth': 4, 'min_samples_split': 4, 'min_samples_leaf': 11}. Best is trial 88 with value: 0.5981215791759867.
[I 2024-11-06 20:23:36,702] Trial 98 finished with value: 0.5930975381147536 and parameters: {'n_estimators': 168, 'max_depth': 6, 'min_samples_split': 6, 'min_samples_leaf': 9}. Best is trial 88 with value: 0.5981215791759867.
[I 2024-11-06 20:23:38,369] Trial 99 finished with value: 0.5923765371750669 and parameters: {'n_estimators': 41, 'max_depth': 2, 'min_samples_split': 7, 'min_samples_leaf': 14}. Best is trial 88 with value: 0.5981215791759867.
[I 2024-11-06 20:23:41,997] Trial 100 finished with value: 0.5930881059641926 and parameters: {'n_estimators': 72, 'max_depth': 4, 'min_samples_split': 8, 'min_samples_leaf': 11}. Best is trial 88 with value: 0.5981215791759867.
[I 2024-11-06 20:23:47,950] Trial 101 finished with value: 0.5955636901006325 and parameters: {'n_estimators': 146, 'max_depth': 3, 'min_samples_split': 5, 'min_samples_leaf': 12}. Best is trial 88 with value: 0.5981215791759867.
[I 2024-11-06 20:23:53,983] Trial 102 finished with value: 0.5955183539620367 and parameters: {'n_estimators': 147, 'max_depth': 3, 'min_samples_split': 5, 'min_samples_leaf': 12}. Best is trial 88 with value: 0.5981215791759867.
[I 2024-11-06 20:24:02,545] Trial 103 finished with value: 0.5927033831584726 and parameters: {'n_estimators': 145, 'max_depth': 6, 'min_samples_split': 20, 'min_samples_leaf': 19}. Best is trial 88 with value: 0.5981215791759867.
[I 2024-11-06 20:24:06,419] Trial 104 finished with value: 0.5914517910396297 and parameters: {'n_estimators': 106, 'max_depth': 2, 'min_samples_split': 2, 'min_samples_leaf': 10}. Best is trial 88 with value: 0.5981215791759867.
[I 2024-11-06 20:24:16,482] Trial 105 finished with value: 0.5915510882950266 and parameters: {'n_estimators': 156, 'max_depth': 7, 'min_samples_split': 4, 'min_samples_leaf': 13}. Best is trial 88 with value: 0.5981215791759867.
[I 2024-11-06 20:24:21,729] Trial 106 finished with value: 0.5908618859578437 and parameters: {'n_estimators': 98, 'max_depth': 5, 'min_samples_split': 6, 'min_samples_leaf': 8}. Best is trial 88 with value: 0.5981215791759867.
[I 2024-11-06 20:24:24,845] Trial 107 finished with value: 0.5915699346442324 and parameters: {'n_estimators': 110, 'max_depth': 1, 'min_samples_split': 13, 'min_samples_leaf': 15}. Best is trial 88 with value: 0.5981215791759867.
[I 2024-11-06 20:24:30,944] Trial 108 finished with value: 0.5953829977372304 and parameters: {'n_estimators': 152, 'max_depth': 3, 'min_samples_split': 5, 'min_samples_leaf': 11}. Best is trial 88 with value: 0.5981215791759867.
[I 2024-11-06 20:24:36,302] Trial 109 finished with value: 0.5939136624181213 and parameters: {'n_estimators': 114, 'max_depth': 4, 'min_samples_split': 5, 'min_samples_leaf': 10}. Best is trial 88 with value: 0.5981215791759867.
[I 2024-11-06 20:24:44,150] Trial 110 finished with value: 0.5903455071656174 and parameters: {'n_estimators': 154, 'max_depth': 5, 'min_samples_split': 7, 'min_samples_leaf': 11}. Best is trial 88 with value: 0.5981215791759867.
[I 2024-11-06 20:24:50,227] Trial 111 finished with value: 0.5952361662354555 and parameters: {'n_estimators': 151, 'max_depth': 3, 'min_samples_split': 5, 'min_samples_leaf': 12}. Best is trial 88 with value: 0.5981215791759867.
[I 2024-11-06 20:24:55,198] Trial 112 finished with value: 0.5903329216648879 and parameters: {'n_estimators': 147, 'max_depth': 2, 'min_samples_split': 6, 'min_samples_leaf': 9}. Best is trial 88 with value: 0.5981215791759867.
[I 2024-11-06 20:24:58,694] Trial 113 finished with value: 0.5986452919600942 and parameters: {'n_estimators': 85, 'max_depth': 3, 'min_samples_split': 8, 'min_samples_leaf': 12}. Best is trial 113 with value: 0.5986452919600942.
[I 2024-11-06 20:25:01,231] Trial 114 finished with value: 0.5917638218633813 and parameters: {'n_estimators': 86, 'max_depth': 1, 'min_samples_split': 8, 'min_samples_leaf': 11}. Best is trial 113 with value: 0.5986452919600942.
[I 2024-11-06 20:25:05,468] Trial 115 finished with value: 0.5920844656538389 and parameters: {'n_estimators': 80, 'max_depth': 4, 'min_samples_split': 9, 'min_samples_leaf': 13}. Best is trial 113 with value: 0.5986452919600942.
[I 2024-11-06 20:25:18,852] Trial 116 finished with value: 0.5901108024852453 and parameters: {'n_estimators': 98, 'max_depth': 20, 'min_samples_split': 16, 'min_samples_leaf': 8}. Best is trial 113 with value: 0.5986452919600942.
[I 2024-11-06 20:25:24,787] Trial 117 finished with value: 0.5928753594609102 and parameters: {'n_estimators': 89, 'max_depth': 7, 'min_samples_split': 4, 'min_samples_leaf': 10}. Best is trial 113 with value: 0.5986452919600942.
[I 2024-11-06 20:25:31,443] Trial 118 finished with value: 0.5952828687071698 and parameters: {'n_estimators': 166, 'max_depth': 3, 'min_samples_split': 7, 'min_samples_leaf': 9}. Best is trial 113 with value: 0.5986452919600942.
[I 2024-11-06 20:25:38,890] Trial 119 finished with value: 0.5928410460507675 and parameters: {'n_estimators': 127, 'max_depth': 6, 'min_samples_split': 6, 'min_samples_leaf': 12}. Best is trial 113 with value: 0.5986452919600942.
[I 2024-11-06 20:25:42,885] Trial 120 finished with value: 0.5912060412736547 and parameters: {'n_estimators': 119, 'max_depth': 2, 'min_samples_split': 8, 'min_samples_leaf': 11}. Best is trial 113 with value: 0.5986452919600942.
[I 2024-11-06 20:25:50,175] Trial 121 finished with value: 0.5933875010216456 and parameters: {'n_estimators': 158, 'max_depth': 4, 'min_samples_split': 7, 'min_samples_leaf': 12}. Best is trial 113 with value: 0.5986452919600942.
[I 2024-11-06 20:25:55,824] Trial 122 finished with value: 0.5957103265094614 and parameters: {'n_estimators': 144, 'max_depth': 3, 'min_samples_split': 4, 'min_samples_leaf': 11}. Best is trial 113 with value: 0.5986452919600942.
[I 2024-11-06 20:26:03,422] Trial 123 finished with value: 0.5906951531731964 and parameters: {'n_estimators': 142, 'max_depth': 5, 'min_samples_split': 4, 'min_samples_leaf': 11}. Best is trial 113 with value: 0.5986452919600942.
[I 2024-11-06 20:26:07,284] Trial 124 finished with value: 0.5892626429737922 and parameters: {'n_estimators': 134, 'max_depth': 1, 'min_samples_split': 5, 'min_samples_leaf': 10}. Best is trial 113 with value: 0.5986452919600942.
[I 2024-11-06 20:26:13,118] Trial 125 finished with value: 0.5957773408016124 and parameters: {'n_estimators': 146, 'max_depth': 3, 'min_samples_split': 5, 'min_samples_leaf': 10}. Best is trial 113 with value: 0.5986452919600942.
[I 2024-11-06 20:26:16,965] Trial 126 finished with value: 0.5985396790626554 and parameters: {'n_estimators': 94, 'max_depth': 3, 'min_samples_split': 5, 'min_samples_leaf': 10}. Best is trial 113 with value: 0.5986452919600942.
[I 2024-11-06 20:26:20,123] Trial 127 finished with value: 0.5915530718363051 and parameters: {'n_estimators': 90, 'max_depth': 2, 'min_samples_split': 6, 'min_samples_leaf': 10}. Best is trial 113 with value: 0.5986452919600942.
[I 2024-11-06 20:26:26,157] Trial 128 finished with value: 0.5939676477578855 and parameters: {'n_estimators': 102, 'max_depth': 6, 'min_samples_split': 8, 'min_samples_leaf': 8}. Best is trial 113 with value: 0.5986452919600942.
[I 2024-11-06 20:26:32,913] Trial 129 finished with value: 0.5927669281476383 and parameters: {'n_estimators': 94, 'max_depth': 8, 'min_samples_split': 4, 'min_samples_leaf': 9}. Best is trial 113 with value: 0.5986452919600942.
[I 2024-11-06 20:26:37,084] Trial 130 finished with value: 0.5917014915859481 and parameters: {'n_estimators': 75, 'max_depth': 5, 'min_samples_split': 3, 'min_samples_leaf': 9}. Best is trial 113 with value: 0.5986452919600942.
[I 2024-11-06 20:26:42,830] Trial 131 finished with value: 0.5957773408016124 and parameters: {'n_estimators': 146, 'max_depth': 3, 'min_samples_split': 5, 'min_samples_leaf': 10}. Best is trial 113 with value: 0.5986452919600942.
