[I 2024-11-06 22:08:32,927] Trial 577 finished with value: 0.5926545676429769 and parameters: {'n_estimators': 163, 'max_depth': 7, 'learning_rate': 0.03239381854375057, 'gamma': 3.9779296347499953, 'min_child_weight': 7, 'subsample': 0.9025994600571537, 'colsample_bytree': 0.7622928705791787, 'reg_alpha': 0.6331510211488879, 'reg_lambda': 0.7990513547911059}. Best is trial 520 with value: 0.5940488308041952.
[I 2024-11-06 22:08:36,815] Trial 578 finished with value: 0.5936505855827799 and parameters: {'n_estimators': 149, 'max_depth': 7, 'learning_rate': 0.04723663711790542, 'gamma': 4.402064141402833, 'min_child_weight': 6, 'subsample': 0.8874681911834095, 'colsample_bytree': 0.5824306688890204, 'reg_alpha': 0.66189294420229, 'reg_lambda': 0.7760031371479603}. Best is trial 520 with value: 0.5940488308041952.
[I 2024-11-06 22:08:40,911] Trial 579 finished with value: 0.5928780166518217 and parameters: {'n_estimators': 160, 'max_depth': 7, 'learning_rate': 0.06297656595700324, 'gamma': 3.897248495611999, 'min_child_weight': 5, 'subsample': 0.8928657303099796, 'colsample_bytree': 0.5385847784499798, 'reg_alpha': 0.6843581174630915, 'reg_lambda': 0.8182644763847448}. Best is trial 520 with value: 0.5940488308041952.
[I 2024-11-06 22:08:45,106] Trial 580 finished with value: 0.5927830933573078 and parameters: {'n_estimators': 156, 'max_depth': 7, 'learning_rate': 0.04062446448541107, 'gamma': 4.272986904534344, 'min_child_weight': 7, 'subsample': 0.8809826595628447, 'colsample_bytree': 0.6962990612496169, 'reg_alpha': 0.7029021764973582, 'reg_lambda': 0.7548994657753071}. Best is trial 520 with value: 0.5940488308041952.
[I 2024-11-06 22:08:49,007] Trial 581 finished with value: 0.5932931726604239 and parameters: {'n_estimators': 145, 'max_depth': 7, 'learning_rate': 0.05083597713623754, 'gamma': 4.62137132957179, 'min_child_weight': 7, 'subsample': 0.8995349892024964, 'colsample_bytree': 0.5952479514835428, 'reg_alpha': 0.6450098849753901, 'reg_lambda': 0.7945762202671868}. Best is trial 520 with value: 0.5940488308041952.
[I 2024-11-06 22:08:53,161] Trial 582 finished with value: 0.5931968506669768 and parameters: {'n_estimators': 151, 'max_depth': 6, 'learning_rate': 0.03611556731481658, 'gamma': 4.171884405280013, 'min_child_weight': 1, 'subsample': 0.8856533485069666, 'colsample_bytree': 0.5270836216662426, 'reg_alpha': 0.6690922513604315, 'reg_lambda': 0.7588948210722705}. Best is trial 520 with value: 0.5940488308041952.
[I 2024-11-06 22:08:55,700] Trial 583 finished with value: 0.5911683965912724 and parameters: {'n_estimators': 127, 'max_depth': 7, 'learning_rate': 0.19204868805510972, 'gamma': 3.8052758156129536, 'min_child_weight': 7, 'subsample': 0.8758785726252357, 'colsample_bytree': 0.5760026617413164, 'reg_alpha': 0.6046848668468255, 'reg_lambda': 0.784674578224178}. Best is trial 520 with value: 0.5940488308041952.
[I 2024-11-06 22:09:00,517] Trial 584 finished with value: 0.592713694129297 and parameters: {'n_estimators': 138, 'max_depth': 7, 'learning_rate': 0.026650496324928906, 'gamma': 4.0299399947421914, 'min_child_weight': 6, 'subsample': 0.9079661177195976, 'colsample_bytree': 0.5612462111715413, 'reg_alpha': 0.6918024702850225, 'reg_lambda': 0.7719653001628799}. Best is trial 520 with value: 0.5940488308041952.
[I 2024-11-06 22:09:05,996] Trial 585 finished with value: 0.5935279946598561 and parameters: {'n_estimators': 147, 'max_depth': 7, 'learning_rate': 0.044163588723202515, 'gamma': 4.443234930553454, 'min_child_weight': 6, 'subsample': 0.8876427265981901, 'colsample_bytree': 0.587210550768859, 'reg_alpha': 0.7135000053413704, 'reg_lambda': 0.8274264087553885}. Best is trial 520 with value: 0.5940488308041952.
[I 2024-11-06 22:09:10,187] Trial 586 finished with value: 0.5935209880165047 and parameters: {'n_estimators': 155, 'max_depth': 7, 'learning_rate': 0.05217388379869834, 'gamma': 3.903841313296396, 'min_child_weight': 7, 'subsample': 0.8667476403647296, 'colsample_bytree': 0.8185340577691622, 'reg_alpha': 0.6584289859372652, 'reg_lambda': 0.7348404899617081}. Best is trial 520 with value: 0.5940488308041952.
[I 2024-11-06 22:09:14,739] Trial 587 finished with value: 0.5936974110276576 and parameters: {'n_estimators': 167, 'max_depth': 7, 'learning_rate': 0.04456463950997918, 'gamma': 4.332169766851984, 'min_child_weight': 7, 'subsample': 0.876798853863532, 'colsample_bytree': 0.5661226414649948, 'reg_alpha': 0.6296700207548598, 'reg_lambda': 0.7004578517899965}. Best is trial 520 with value: 0.5940488308041952.
[I 2024-11-06 22:09:18,587] Trial 588 finished with value: 0.5932382224622035 and parameters: {'n_estimators': 135, 'max_depth': 7, 'learning_rate': 0.05923756216219016, 'gamma': 4.56038172657908, 'min_child_weight': 6, 'subsample': 0.895410725800474, 'colsample_bytree': 0.545257307467298, 'reg_alpha': 0.68364032172561, 'reg_lambda': 0.7276493702174643}. Best is trial 520 with value: 0.5940488308041952.
[I 2024-11-06 22:09:22,986] Trial 589 finished with value: 0.5933294963358487 and parameters: {'n_estimators': 142, 'max_depth': 6, 'learning_rate': 0.031732517952880145, 'gamma': 4.682104237115173, 'min_child_weight': 5, 'subsample': 0.8639375867275652, 'colsample_bytree': 0.5172093451698029, 'reg_alpha': 0.43014050196437315, 'reg_lambda': 0.7086962492776737}. Best is trial 520 with value: 0.5940488308041952.
[I 2024-11-06 22:09:28,526] Trial 590 finished with value: 0.5930877176890332 and parameters: {'n_estimators': 152, 'max_depth': 7, 'learning_rate': 0.02075037583805253, 'gamma': 4.108945598066784, 'min_child_weight': 7, 'subsample': 0.8831034214912564, 'colsample_bytree': 0.6022311693585942, 'reg_alpha': 0.7052618575091426, 'reg_lambda': 0.7490723516035457}. Best is trial 520 with value: 0.5940488308041952.
[I 2024-11-06 22:09:32,944] Trial 591 finished with value: 0.5934564885611101 and parameters: {'n_estimators': 131, 'max_depth': 7, 'learning_rate': 0.038416494017526795, 'gamma': 4.484833128724304, 'min_child_weight': 7, 'subsample': 0.8725783201008869, 'colsample_bytree': 0.5542182721481301, 'reg_alpha': 0.6734481662122588, 'reg_lambda': 0.7992963976074525}. Best is trial 520 with value: 0.5940488308041952.
[I 2024-11-06 22:09:37,176] Trial 592 finished with value: 0.5932929422494049 and parameters: {'n_estimators': 161, 'max_depth': 7, 'learning_rate': 0.05345430229528446, 'gamma': 4.193467292030683, 'min_child_weight': 4, 'subsample': 0.8611905048735995, 'colsample_bytree': 0.5839443121486397, 'reg_alpha': 0.5655055745838057, 'reg_lambda': 0.6845498422695727}. Best is trial 520 with value: 0.5940488308041952.
[I 2024-11-06 22:09:40,884] Trial 593 finished with value: 0.5937907280892547 and parameters: {'n_estimators': 146, 'max_depth': 7, 'learning_rate': 0.06568186916198392, 'gamma': 4.333658534992216, 'min_child_weight': 3, 'subsample': 0.8909597571303295, 'colsample_bytree': 0.5313000101716536, 'reg_alpha': 0.27084303205582727, 'reg_lambda': 0.654492478642358}. Best is trial 520 with value: 0.5940488308041952.
[I 2024-11-06 22:09:44,637] Trial 594 finished with value: 0.592900223409875 and parameters: {'n_estimators': 144, 'max_depth': 7, 'learning_rate': 0.06533237252639869, 'gamma': 4.417376043042041, 'min_child_weight': 2, 'subsample': 0.9170170221549747, 'colsample_bytree': 0.5448515196173154, 'reg_alpha': 0.14198693752860425, 'reg_lambda': 0.641692368815226}. Best is trial 520 with value: 0.5940488308041952.
[I 2024-11-06 22:09:48,165] Trial 595 finished with value: 0.5937307510426486 and parameters: {'n_estimators': 147, 'max_depth': 7, 'learning_rate': 0.0818734051172609, 'gamma': 4.550445868678701, 'min_child_weight': 1, 'subsample': 0.5220193358009754, 'colsample_bytree': 0.5732951743569193, 'reg_alpha': 0.6500122851208077, 'reg_lambda': 0.6585006786996579}. Best is trial 520 with value: 0.5940488308041952.
[I 2024-11-06 22:09:51,659] Trial 596 finished with value: 0.5932078998288439 and parameters: {'n_estimators': 138, 'max_depth': 7, 'learning_rate': 0.07076844460625392, 'gamma': 4.318163990011967, 'min_child_weight': 3, 'subsample': 0.9096455377742072, 'colsample_bytree': 0.5374496835303746, 'reg_alpha': 0.19847997428939668, 'reg_lambda': 0.7765035053097321}. Best is trial 520 with value: 0.5940488308041952.
[I 2024-11-06 22:09:55,140] Trial 597 finished with value: 0.592417417702795 and parameters: {'n_estimators': 140, 'max_depth': 9, 'learning_rate': 0.07261816244878973, 'gamma': 3.8303973722283384, 'min_child_weight': 8, 'subsample': 0.9035069265346422, 'colsample_bytree': 0.5540056509181249, 'reg_alpha': 0.5878971530110669, 'reg_lambda': 0.6747722720094518}. Best is trial 520 with value: 0.5940488308041952.
[I 2024-11-06 22:09:58,768] Trial 598 finished with value: 0.5930080997904754 and parameters: {'n_estimators': 148, 'max_depth': 7, 'learning_rate': 0.061150857733997456, 'gamma': 4.653136011618071, 'min_child_weight': 3, 'subsample': 0.8879543233932105, 'colsample_bytree': 0.597337413214737, 'reg_alpha': 0.2641055004336051, 'reg_lambda': 0.6364861076341541}. Best is trial 520 with value: 0.5940488308041952.
[I 2024-11-06 22:10:02,179] Trial 599 finished with value: 0.5929633559556489 and parameters: {'n_estimators': 144, 'max_depth': 3, 'learning_rate': 0.06843271988962121, 'gamma': 4.368735433929087, 'min_child_weight': 2, 'subsample': 0.893942733173558, 'colsample_bytree': 0.5614306321833719, 'reg_alpha': 0.6145688141044426, 'reg_lambda': 0.6509149085256127}. Best is trial 520 with value: 0.5940488308041952.
[I 2024-11-06 22:10:06,803] Trial 600 finished with value: 0.5932286238312805 and parameters: {'n_estimators': 152, 'max_depth': 6, 'learning_rate': 0.06292027830048362, 'gamma': 4.001436599017595, 'min_child_weight': 2, 'subsample': 0.8981956683563794, 'colsample_bytree': 0.6122547812072627, 'reg_alpha': 0.3370221960894092, 'reg_lambda': 0.6679664546056001}. Best is trial 520 with value: 0.5940488308041952.
[I 2024-11-06 22:10:10,551] Trial 601 finished with value: 0.592355813293228 and parameters: {'n_estimators': 137, 'max_depth': 7, 'learning_rate': 0.05666813480054605, 'gamma': 4.473925665442249, 'min_child_weight': 7, 'subsample': 0.9339654143362396, 'colsample_bytree': 0.5332475409135127, 'reg_alpha': 0.7186430568410909, 'reg_lambda': 0.7888583981727179}. Best is trial 520 with value: 0.5940488308041952.
[I 2024-11-06 22:10:14,278] Trial 602 finished with value: 0.5931793260479286 and parameters: {'n_estimators': 133, 'max_depth': 7, 'learning_rate': 0.0777892372999309, 'gamma': 3.747736362083856, 'min_child_weight': 8, 'subsample': 0.9227428167663879, 'colsample_bytree': 0.5797662175008046, 'reg_alpha': 0.24663648921769862, 'reg_lambda': 0.7079203134858173}. Best is trial 520 with value: 0.5940488308041952.
[I 2024-11-06 22:10:18,294] Trial 603 finished with value: 0.5937974265126006 and parameters: {'n_estimators': 149, 'max_depth': 7, 'learning_rate': 0.06552527095299723, 'gamma': 3.902369566175296, 'min_child_weight': 7, 'subsample': 0.8816114929355149, 'colsample_bytree': 0.5882372382895625, 'reg_alpha': 0.6929675632609684, 'reg_lambda': 0.6913042336311038}. Best is trial 520 with value: 0.5940488308041952.
[I 2024-11-06 22:10:22,135] Trial 604 finished with value: 0.5931009183543827 and parameters: {'n_estimators': 151, 'max_depth': 7, 'learning_rate': 0.0708157259219636, 'gamma': 3.9753609880068597, 'min_child_weight': 7, 'subsample': 0.8867272934616459, 'colsample_bytree': 0.5990450262440796, 'reg_alpha': 0.2119124947404123, 'reg_lambda': 0.6873423646212923}. Best is trial 520 with value: 0.5940488308041952.
[I 2024-11-06 22:10:25,797] Trial 605 finished with value: 0.5927975227878157 and parameters: {'n_estimators': 156, 'max_depth': 7, 'learning_rate': 0.0758973700518582, 'gamma': 3.852239966531591, 'min_child_weight': 7, 'subsample': 0.8950013136894109, 'colsample_bytree': 0.5907078914003694, 'reg_alpha': 0.7304348138675002, 'reg_lambda': 0.6970076409275026}. Best is trial 520 with value: 0.5940488308041952.
[I 2024-11-06 22:10:29,465] Trial 606 finished with value: 0.5930389116218813 and parameters: {'n_estimators': 148, 'max_depth': 7, 'learning_rate': 0.0646468777908139, 'gamma': 3.7869993749737167, 'min_child_weight': 7, 'subsample': 0.8761482024607264, 'colsample_bytree': 0.6061202607563506, 'reg_alpha': 0.7002344547256281, 'reg_lambda': 0.6655176767740305}. Best is trial 520 with value: 0.5940488308041952.
[I 2024-11-06 22:10:33,085] Trial 607 finished with value: 0.5930549741288769 and parameters: {'n_estimators': 154, 'max_depth': 7, 'learning_rate': 0.06801425311820031, 'gamma': 3.9171757484298393, 'min_child_weight': 7, 'subsample': 0.8472357787134283, 'colsample_bytree': 0.5766829454717526, 'reg_alpha': 0.4811571251948988, 'reg_lambda': 0.6320019051841442}. Best is trial 520 with value: 0.5940488308041952.
[I 2024-11-06 22:10:37,315] Trial 608 finished with value: 0.593506643075906 and parameters: {'n_estimators': 147, 'max_depth': 7, 'learning_rate': 0.06300026877606295, 'gamma': 4.021027471883661, 'min_child_weight': 7, 'subsample': 0.6973659105447713, 'colsample_bytree': 0.5886000793914227, 'reg_alpha': 0.701070522250075, 'reg_lambda': 0.6740624003256211}. Best is trial 520 with value: 0.5940488308041952.
[I 2024-11-06 22:10:40,879] Trial 609 finished with value: 0.5926837197667321 and parameters: {'n_estimators': 151, 'max_depth': 7, 'learning_rate': 0.07319350861001817, 'gamma': 3.8880598160167312, 'min_child_weight': 7, 'subsample': 0.9024969532481275, 'colsample_bytree': 0.6196411392460088, 'reg_alpha': 0.16349804432238263, 'reg_lambda': 0.721202012981047}. Best is trial 520 with value: 0.5940488308041952.
[I 2024-11-06 22:10:44,337] Trial 610 finished with value: 0.5930712888212126 and parameters: {'n_estimators': 126, 'max_depth': 7, 'learning_rate': 0.0587394465954714, 'gamma': 4.079422584722068, 'min_child_weight': 7, 'subsample': 0.8667635674023161, 'colsample_bytree': 0.5890870898722692, 'reg_alpha': 0.2880783420991502, 'reg_lambda': 0.6963009842777172}. Best is trial 520 with value: 0.5940488308041952.
[I 2024-11-06 22:10:47,598] Trial 611 finished with value: 0.5931492060926301 and parameters: {'n_estimators': 144, 'max_depth': 7, 'learning_rate': 0.08657241588502348, 'gamma': 3.6275990452721647, 'min_child_weight': 7, 'subsample': 0.9423245169724569, 'colsample_bytree': 0.5987534708659235, 'reg_alpha': 0.2232618222477106, 'reg_lambda': 0.6519852979979406}. Best is trial 520 with value: 0.5940488308041952.
[I 2024-11-06 22:10:51,349] Trial 612 finished with value: 0.5930577940007199 and parameters: {'n_estimators': 156, 'max_depth': 7, 'learning_rate': 0.06652432637445096, 'gamma': 3.7797980932856063, 'min_child_weight': 7, 'subsample': 0.8841167306391535, 'colsample_bytree': 0.5794409389826598, 'reg_alpha': 0.6656806277573465, 'reg_lambda': 0.6837767631415962}. Best is trial 520 with value: 0.5940488308041952.
[I 2024-11-06 22:10:54,999] Trial 613 finished with value: 0.5922796960535306 and parameters: {'n_estimators': 139, 'max_depth': 7, 'learning_rate': 0.05975644009717214, 'gamma': 4.149169579228798, 'min_child_weight': 8, 'subsample': 0.8532022994293074, 'colsample_bytree': 0.9675787588969851, 'reg_alpha': 0.3236096383689467, 'reg_lambda': 0.713011247780547}. Best is trial 520 with value: 0.5940488308041952.
[I 2024-11-06 22:10:58,950] Trial 614 finished with value: 0.593187832295923 and parameters: {'n_estimators': 147, 'max_depth': 7, 'learning_rate': 0.05420533208607705, 'gamma': 3.898835884282461, 'min_child_weight': 6, 'subsample': 0.8741861252765656, 'colsample_bytree': 0.6094622166555519, 'reg_alpha': 0.2871892116995269, 'reg_lambda': 0.6570845647859518}. Best is trial 520 with value: 0.5940488308041952.
[I 2024-11-06 22:11:03,678] Trial 615 finished with value: 0.5923411105068203 and parameters: {'n_estimators': 131, 'max_depth': 7, 'learning_rate': 0.05308462754474278, 'gamma': 3.7289856770022864, 'min_child_weight': 7, 'subsample': 0.8586537048213446, 'colsample_bytree': 0.9030182797035133, 'reg_alpha': 0.7272178223496993, 'reg_lambda': 0.6255213047696969}. Best is trial 520 with value: 0.5940488308041952.
[I 2024-11-06 22:11:07,924] Trial 616 finished with value: 0.5931219210594263 and parameters: {'n_estimators': 158, 'max_depth': 7, 'learning_rate': 0.05939979992205428, 'gamma': 4.062243519341857, 'min_child_weight': 7, 'subsample': 0.9127512054744398, 'colsample_bytree': 0.6283189266673419, 'reg_alpha': 0.6238660105642518, 'reg_lambda': 0.6893554477014344}. Best is trial 520 with value: 0.5940488308041952.
[I 2024-11-06 22:11:11,267] Trial 617 finished with value: 0.5934922841021237 and parameters: {'n_estimators': 151, 'max_depth': 7, 'learning_rate': 0.06729671288379264, 'gamma': 4.180880571986528, 'min_child_weight': 6, 'subsample': 0.8931381135677721, 'colsample_bytree': 0.5715965265569832, 'reg_alpha': 0.6854386125105401, 'reg_lambda': 0.733577309538231}. Best is trial 520 with value: 0.5940488308041952.
[I 2024-11-06 22:11:15,405] Trial 618 finished with value: 0.5934208893576791 and parameters: {'n_estimators': 142, 'max_depth': 7, 'learning_rate': 0.05062764226251972, 'gamma': 3.6195015809097737, 'min_child_weight': 7, 'subsample': 0.8454913878590739, 'colsample_bytree': 0.8788297953175568, 'reg_alpha': 0.17861835175614266, 'reg_lambda': 0.6731020785772965}. Best is trial 520 with value: 0.5940488308041952.
[I 2024-11-06 22:11:19,200] Trial 619 finished with value: 0.5936519492946634 and parameters: {'n_estimators': 136, 'max_depth': 7, 'learning_rate': 0.05547987034928792, 'gamma': 3.9460450284904094, 'min_child_weight': 7, 'subsample': 0.8763929427052835, 'colsample_bytree': 0.590263565867608, 'reg_alpha': 0.6429868583276447, 'reg_lambda': 0.6450725607364316}. Best is trial 520 with value: 0.5940488308041952.
[I 2024-11-06 22:11:23,099] Trial 620 finished with value: 0.5937556120706058 and parameters: {'n_estimators': 145, 'max_depth': 7, 'learning_rate': 0.06214894699057781, 'gamma': 4.286901683376251, 'min_child_weight': 7, 'subsample': 0.8641827490545653, 'colsample_bytree': 0.5831411226669181, 'reg_alpha': 0.7333446689014945, 'reg_lambda': 0.7041755440356567}. Best is trial 520 with value: 0.5940488308041952.
[I 2024-11-06 22:11:26,598] Trial 621 finished with value: 0.5935516065665729 and parameters: {'n_estimators': 152, 'max_depth': 7, 'learning_rate': 0.0799522953908308, 'gamma': 4.322491577869004, 'min_child_weight': 7, 'subsample': 0.8673124724679527, 'colsample_bytree': 0.6017412334041635, 'reg_alpha': 0.7387379610825968, 'reg_lambda': 0.725710782303756}. Best is trial 520 with value: 0.5940488308041952.
[I 2024-11-06 22:11:30,261] Trial 622 finished with value: 0.5932620277277506 and parameters: {'n_estimators': 148, 'max_depth': 8, 'learning_rate': 0.0720677561867938, 'gamma': 4.258523462403046, 'min_child_weight': 7, 'subsample': 0.5625250797419683, 'colsample_bytree': 0.5858570241295302, 'reg_alpha': 0.7176006279829844, 'reg_lambda': 0.71092363902087}. Best is trial 520 with value: 0.5940488308041952.
[I 2024-11-06 22:11:34,009] Trial 623 finished with value: 0.5926558948506196 and parameters: {'n_estimators': 159, 'max_depth': 7, 'learning_rate': 0.06406429297931227, 'gamma': 3.6934434629907407, 'min_child_weight': 7, 'subsample': 0.8853621656097648, 'colsample_bytree': 0.5920298038322577, 'reg_alpha': 0.743144356153354, 'reg_lambda': 0.7412712341374431}. Best is trial 520 with value: 0.5940488308041952.
[I 2024-11-06 22:11:37,598] Trial 624 finished with value: 0.5931397492405117 and parameters: {'n_estimators': 143, 'max_depth': 7, 'learning_rate': 0.07399219284848095, 'gamma': 3.8378126518410878, 'min_child_weight': 7, 'subsample': 0.8782996523019353, 'colsample_bytree': 0.6040239189862147, 'reg_alpha': 0.7207034160586532, 'reg_lambda': 0.7026064672232609}. Best is trial 520 with value: 0.5940488308041952.
[I 2024-11-06 22:11:41,040] Trial 625 finished with value: 0.5940826637391339 and parameters: {'n_estimators': 152, 'max_depth': 7, 'learning_rate': 0.06326163537882099, 'gamma': 4.372919253630059, 'min_child_weight': 7, 'subsample': 0.8641722777339179, 'colsample_bytree': 0.582298821536166, 'reg_alpha': 0.7070579570308172, 'reg_lambda': 0.7223317002952654}. Best is trial 625 with value: 0.5940826637391339.
[I 2024-11-06 22:11:44,724] Trial 626 finished with value: 0.5939427377638516 and parameters: {'n_estimators': 146, 'max_depth': 7, 'learning_rate': 0.07013125129019374, 'gamma': 4.2552703346281735, 'min_child_weight': 7, 'subsample': 0.8606628544459135, 'colsample_bytree': 0.5808882872597606, 'reg_alpha': 0.6945383959317454, 'reg_lambda': 0.7467347370222766}. Best is trial 625 with value: 0.5940826637391339.
[I 2024-11-06 22:11:49,266] Trial 627 finished with value: 0.5919198344842165 and parameters: {'n_estimators': 150, 'max_depth': 7, 'learning_rate': 0.0698747294532663, 'gamma': 1.6260592385124923, 'min_child_weight': 7, 'subsample': 0.7868209659350346, 'colsample_bytree': 0.5806712567332486, 'reg_alpha': 0.6691039277862278, 'reg_lambda': 0.7599744811529892}. Best is trial 625 with value: 0.5940826637391339.
[I 2024-11-06 22:11:52,994] Trial 628 finished with value: 0.5936115319492765 and parameters: {'n_estimators': 152, 'max_depth': 8, 'learning_rate': 0.07913038107650813, 'gamma': 4.295199470921727, 'min_child_weight': 7, 'subsample': 0.8590872192624502, 'colsample_bytree': 0.5819954298203193, 'reg_alpha': 0.6967281638354926, 'reg_lambda': 0.7567391519656465}. Best is trial 625 with value: 0.5940826637391339.
[I 2024-11-06 22:11:55,710] Trial 629 finished with value: 0.5928889938132595 and parameters: {'n_estimators': 146, 'max_depth': 7, 'learning_rate': 0.2728514137422718, 'gamma': 4.281176842132466, 'min_child_weight': 7, 'subsample': 0.9008465849746442, 'colsample_bytree': 0.5737280220341311, 'reg_alpha': 0.6811177464299494, 'reg_lambda': 0.7408064542120956}. Best is trial 625 with value: 0.5940826637391339.
