[I 2024-11-06 19:47:19,786] Trial 252 finished with value: 0.5944629786163811 and parameters: {'C': 0.34802111679805703, 'solver': 'liblinear'}. Best is trial 236 with value: 0.5945206794543682.
[I 2024-11-06 19:47:21,489] Trial 253 finished with value: 0.5943844731739236 and parameters: {'C': 0.3008282188689651, 'solver': 'liblinear'}. Best is trial 236 with value: 0.5945206794543682.
[I 2024-11-06 19:47:22,970] Trial 254 finished with value: 0.5940761043823458 and parameters: {'C': 0.1119078463823367, 'solver': 'liblinear'}. Best is trial 236 with value: 0.5945206794543682.
[I 2024-11-06 19:47:24,529] Trial 255 finished with value: 0.5944686183045149 and parameters: {'C': 0.3538032922999095, 'solver': 'liblinear'}. Best is trial 236 with value: 0.5945206794543682.
[I 2024-11-06 19:47:26,158] Trial 256 finished with value: 0.5943550128177442 and parameters: {'C': 0.292270591325504, 'solver': 'liblinear'}. Best is trial 236 with value: 0.5945206794543682.
[I 2024-11-06 19:47:27,809] Trial 257 finished with value: 0.5934587568620293 and parameters: {'C': 0.03989417499352932, 'solver': 'liblinear'}. Best is trial 236 with value: 0.5945206794543682.
[I 2024-11-06 19:47:29,539] Trial 258 finished with value: 0.5944840977210006 and parameters: {'C': 0.37540467119146587, 'solver': 'liblinear'}. Best is trial 236 with value: 0.5945206794543682.
[I 2024-11-06 19:47:31,188] Trial 259 finished with value: 0.5944996217185112 and parameters: {'C': 0.38785320202456147, 'solver': 'liblinear'}. Best is trial 236 with value: 0.5945206794543682.
[I 2024-11-06 19:47:33,063] Trial 260 finished with value: 0.5945165657501879 and parameters: {'C': 0.42781219312346186, 'solver': 'liblinear'}. Best is trial 236 with value: 0.5945206794543682.
[I 2024-11-06 19:47:34,541] Trial 261 finished with value: 0.5941336681272803 and parameters: {'C': 0.18955232737652505, 'solver': 'liblinear'}. Best is trial 236 with value: 0.5945206794543682.
[I 2024-11-06 19:47:35,731] Trial 262 finished with value: 0.5859467333857552 and parameters: {'C': 0.0036333122418432118, 'solver': 'liblinear'}. Best is trial 236 with value: 0.5945206794543682.
[I 2024-11-06 19:47:37,671] Trial 263 finished with value: 0.594458151416214 and parameters: {'C': 0.48568020048789534, 'solver': 'liblinear'}. Best is trial 236 with value: 0.5945206794543682.
[I 2024-11-06 19:47:39,406] Trial 264 finished with value: 0.5945206794543682 and parameters: {'C': 0.422153683352301, 'solver': 'liblinear'}. Best is trial 236 with value: 0.5945206794543682.
[I 2024-11-06 19:47:41,072] Trial 265 finished with value: 0.5944704740338647 and parameters: {'C': 0.45470298409523113, 'solver': 'liblinear'}. Best is trial 236 with value: 0.5945206794543682.
[I 2024-11-06 19:47:42,525] Trial 266 finished with value: 0.594161515627971 and parameters: {'C': 0.1746800404138044, 'solver': 'liblinear'}. Best is trial 236 with value: 0.5945206794543682.
[I 2024-11-06 19:47:44,257] Trial 267 finished with value: 0.594452488013693 and parameters: {'C': 0.550161302912515, 'solver': 'liblinear'}. Best is trial 236 with value: 0.5945206794543682.
[I 2024-11-06 19:47:45,776] Trial 268 finished with value: 0.5941435350876908 and parameters: {'C': 0.18842669683870752, 'solver': 'liblinear'}. Best is trial 236 with value: 0.5945206794543682.
[I 2024-11-06 19:47:47,476] Trial 269 finished with value: 0.594458151416214 and parameters: {'C': 0.4940688825517564, 'solver': 'liblinear'}. Best is trial 236 with value: 0.5945206794543682.
[I 2024-11-06 19:47:49,113] Trial 270 finished with value: 0.5944840977210006 and parameters: {'C': 0.3694523387699452, 'solver': 'liblinear'}. Best is trial 236 with value: 0.5945206794543682.
[I 2024-11-06 19:47:50,767] Trial 271 finished with value: 0.5944621363785512 and parameters: {'C': 0.5791373923619978, 'solver': 'liblinear'}. Best is trial 236 with value: 0.5945206794543682.
[I 2024-11-06 19:47:52,219] Trial 272 finished with value: 0.5940923468002819 and parameters: {'C': 0.1281788377594812, 'solver': 'liblinear'}. Best is trial 236 with value: 0.5945206794543682.
[I 2024-11-06 19:47:53,950] Trial 273 finished with value: 0.5945037726748497 and parameters: {'C': 0.3852424480072325, 'solver': 'liblinear'}. Best is trial 236 with value: 0.5945206794543682.
[I 2024-11-06 19:47:55,720] Trial 274 finished with value: 0.5944465743982909 and parameters: {'C': 0.6352092108568927, 'solver': 'liblinear'}. Best is trial 236 with value: 0.5945206794543682.
[I 2024-11-06 19:47:57,283] Trial 275 finished with value: 0.59427800923028 and parameters: {'C': 0.2571408968068063, 'solver': 'liblinear'}. Best is trial 236 with value: 0.5945206794543682.
[I 2024-11-06 19:47:58,744] Trial 276 finished with value: 0.5896447990856865 and parameters: {'C': 0.007347715238739283, 'solver': 'liblinear'}. Best is trial 236 with value: 0.5945206794543682.
[I 2024-11-06 19:48:00,447] Trial 277 finished with value: 0.5944939705946621 and parameters: {'C': 0.3798439650795644, 'solver': 'liblinear'}. Best is trial 236 with value: 0.5945206794543682.
[I 2024-11-06 19:48:02,276] Trial 278 finished with value: 0.5944818032325733 and parameters: {'C': 0.5609199521916536, 'solver': 'liblinear'}. Best is trial 236 with value: 0.5945206794543682.
[I 2024-11-06 19:48:04,144] Trial 279 finished with value: 0.5941900002860269 and parameters: {'C': 0.19965459709441172, 'solver': 'liblinear'}. Best is trial 236 with value: 0.5945206794543682.
[I 2024-11-06 19:48:05,872] Trial 280 finished with value: 0.5945206794543682 and parameters: {'C': 0.4073160008700051, 'solver': 'liblinear'}. Best is trial 236 with value: 0.5945206794543682.
[I 2024-11-06 19:48:07,884] Trial 281 finished with value: 0.5944271055176585 and parameters: {'C': 0.6224868370668409, 'solver': 'liblinear'}. Best is trial 236 with value: 0.5945206794543682.
[I 2024-11-06 19:48:09,646] Trial 282 finished with value: 0.5945025209280864 and parameters: {'C': 0.43931737964244116, 'solver': 'liblinear'}. Best is trial 236 with value: 0.5945206794543682.
[I 2024-11-06 19:48:11,307] Trial 283 finished with value: 0.5944507362778312 and parameters: {'C': 0.6661819587294733, 'solver': 'liblinear'}. Best is trial 236 with value: 0.5945206794543682.
[I 2024-11-06 19:48:12,788] Trial 284 finished with value: 0.5941956469781848 and parameters: {'C': 0.20304014656690864, 'solver': 'liblinear'}. Best is trial 236 with value: 0.5945206794543682.
[I 2024-11-06 19:48:13,932] Trial 285 finished with value: 0.5840593669397449 and parameters: {'C': 0.0028603205162287537, 'solver': 'liblinear'}. Best is trial 236 with value: 0.5945206794543682.
[I 2024-11-06 19:48:15,936] Trial 286 finished with value: 0.594458151416214 and parameters: {'C': 0.4820709626723134, 'solver': 'liblinear'}. Best is trial 236 with value: 0.5945206794543682.
[I 2024-11-06 19:48:17,897] Trial 287 finished with value: 0.5944564825190385 and parameters: {'C': 0.58973474548988, 'solver': 'liblinear'}. Best is trial 236 with value: 0.5945206794543682.
[I 2024-11-06 19:48:19,698] Trial 288 finished with value: 0.5943353947807293 and parameters: {'C': 0.28414551513656694, 'solver': 'liblinear'}. Best is trial 236 with value: 0.5945206794543682.
[I 2024-11-06 19:48:21,344] Trial 289 finished with value: 0.5944507362778312 and parameters: {'C': 0.668314794749822, 'solver': 'liblinear'}. Best is trial 236 with value: 0.5945206794543682.
[I 2024-11-06 19:48:23,092] Trial 290 finished with value: 0.5945067022372321 and parameters: {'C': 0.43585607025967726, 'solver': 'liblinear'}. Best is trial 236 with value: 0.5945206794543682.
[I 2024-11-06 19:48:24,603] Trial 291 finished with value: 0.5941476308262215 and parameters: {'C': 0.17686372547155899, 'solver': 'liblinear'}. Best is trial 236 with value: 0.5945206794543682.
[I 2024-11-06 19:48:26,291] Trial 292 finished with value: 0.5945067022372321 and parameters: {'C': 0.43607511143249394, 'solver': 'liblinear'}. Best is trial 236 with value: 0.5945206794543682.
[I 2024-11-06 19:48:27,989] Trial 293 finished with value: 0.5944507362778312 and parameters: {'C': 0.6634145757882055, 'solver': 'liblinear'}. Best is trial 236 with value: 0.5945206794543682.
[I 2024-11-06 19:48:29,785] Trial 294 finished with value: 0.5944679401977606 and parameters: {'C': 0.4753622082372827, 'solver': 'liblinear'}. Best is trial 236 with value: 0.5945206794543682.
[I 2024-11-06 19:48:31,295] Trial 295 finished with value: 0.5941518108598246 and parameters: {'C': 0.1791546837855798, 'solver': 'liblinear'}. Best is trial 236 with value: 0.5945206794543682.
[I 2024-11-06 19:48:33,052] Trial 296 finished with value: 0.5944423909473389 and parameters: {'C': 0.7277824296569294, 'solver': 'liblinear'}. Best is trial 236 with value: 0.5945206794543682.
[I 2024-11-06 19:48:34,833] Trial 297 finished with value: 0.5944538960644219 and parameters: {'C': 0.46757621330629073, 'solver': 'liblinear'}. Best is trial 236 with value: 0.5945206794543682.
[I 2024-11-06 19:48:35,866] Trial 298 finished with value: 0.5753614085348392 and parameters: {'C': 0.0014505929330639877, 'solver': 'liblinear'}. Best is trial 236 with value: 0.5945206794543682.
[I 2024-11-06 19:48:37,607] Trial 299 finished with value: 0.5944623049870396 and parameters: {'C': 0.5066735177011432, 'solver': 'liblinear'}. Best is trial 236 with value: 0.5945206794543682.
[I 2024-11-06 19:48:39,062] Trial 300 finished with value: 0.5943312140629275 and parameters: {'C': 0.2832251544191783, 'solver': 'liblinear'}. Best is trial 236 with value: 0.5945206794543682.
[I 2024-11-06 19:48:40,956] Trial 301 finished with value: 0.5944341071243737 and parameters: {'C': 0.7410353409296984, 'solver': 'liblinear'}. Best is trial 236 with value: 0.5945206794543682.
[I 2024-11-06 19:48:42,765] Trial 302 finished with value: 0.5943894864545646 and parameters: {'C': 8.620041173093043, 'solver': 'liblinear'}. Best is trial 236 with value: 0.5945206794543682.
[I 2024-11-06 19:48:44,519] Trial 303 finished with value: 0.5945206794543682 and parameters: {'C': 0.4128040647002602, 'solver': 'liblinear'}. Best is trial 236 with value: 0.5945206794543682.
[I 2024-11-06 19:48:46,104] Trial 304 finished with value: 0.5942920060110205 and parameters: {'C': 0.26204776306601546, 'solver': 'liblinear'}. Best is trial 236 with value: 0.5945206794543682.
[I 2024-11-06 19:48:47,841] Trial 305 finished with value: 0.5944465341390418 and parameters: {'C': 0.6880095500305422, 'solver': 'liblinear'}. Best is trial 236 with value: 0.5945206794543682.
[I 2024-11-06 19:48:49,549] Trial 306 finished with value: 0.594458151416214 and parameters: {'C': 0.48667608611249147, 'solver': 'liblinear'}. Best is trial 236 with value: 0.5945206794543682.
[I 2024-11-06 19:48:51,065] Trial 307 finished with value: 0.5942194088912802 and parameters: {'C': 0.22887547263433253, 'solver': 'liblinear'}. Best is trial 236 with value: 0.5945206794543682.
[I 2024-11-06 19:48:52,738] Trial 308 finished with value: 0.5944564825190385 and parameters: {'C': 0.5936538831241175, 'solver': 'liblinear'}. Best is trial 236 with value: 0.5945206794543682.
[I 2024-11-06 19:48:54,333] Trial 309 finished with value: 0.5941613849819449 and parameters: {'C': 0.16592098368113278, 'solver': 'liblinear'}. Best is trial 236 with value: 0.5945206794543682.
[I 2024-11-06 19:48:55,965] Trial 310 finished with value: 0.5944784820183935 and parameters: {'C': 0.35607318097369756, 'solver': 'liblinear'}. Best is trial 236 with value: 0.5945206794543682.
[I 2024-11-06 19:48:57,077] Trial 311 finished with value: 0.5748397531578224 and parameters: {'C': 0.0014131094040606973, 'solver': 'liblinear'}. Best is trial 236 with value: 0.5945206794543682.
[I 2024-11-06 19:48:59,022] Trial 312 finished with value: 0.5944382005892241 and parameters: {'C': 0.7598285781769794, 'solver': 'liblinear'}. Best is trial 236 with value: 0.5945206794543682.
[I 2024-11-06 19:49:00,770] Trial 313 finished with value: 0.5945108470944644 and parameters: {'C': 0.4057610227851648, 'solver': 'liblinear'}. Best is trial 236 with value: 0.5945206794543682.
[I 2024-11-06 19:49:02,648] Trial 314 finished with value: 0.5944662864538506 and parameters: {'C': 0.584330116893571, 'solver': 'liblinear'}. Best is trial 236 with value: 0.5945206794543682.
[I 2024-11-06 19:49:04,490] Trial 315 finished with value: 0.5944075915572162 and parameters: {'C': 3.2129610951379393, 'solver': 'liblinear'}. Best is trial 236 with value: 0.5945206794543682.
[I 2024-11-06 19:49:06,387] Trial 316 finished with value: 0.5944479887832321 and parameters: {'C': 0.7565898406945627, 'solver': 'liblinear'}. Best is trial 236 with value: 0.5945206794543682.
[I 2024-11-06 19:49:08,260] Trial 317 finished with value: 0.5945108470944644 and parameters: {'C': 0.40593994449287063, 'solver': 'liblinear'}. Best is trial 236 with value: 0.5945206794543682.
[I 2024-11-06 19:49:09,870] Trial 318 finished with value: 0.5941435085492379 and parameters: {'C': 0.1900798895943047, 'solver': 'liblinear'}. Best is trial 236 with value: 0.5945206794543682.
[I 2024-11-06 19:49:11,535] Trial 319 finished with value: 0.5944623420378875 and parameters: {'C': 0.5138601058221863, 'solver': 'liblinear'}. Best is trial 236 with value: 0.5945206794543682.
[I 2024-11-06 19:49:13,397] Trial 320 finished with value: 0.5944479887832321 and parameters: {'C': 0.7601786079219552, 'solver': 'liblinear'}. Best is trial 236 with value: 0.5945206794543682.
[I 2024-11-06 19:49:14,956] Trial 321 finished with value: 0.5944589349248024 and parameters: {'C': 0.33989550788628226, 'solver': 'liblinear'}. Best is trial 236 with value: 0.5945206794543682.
[I 2024-11-06 19:49:16,664] Trial 322 finished with value: 0.5944719394321811 and parameters: {'C': 0.5650903987328578, 'solver': 'liblinear'}. Best is trial 236 with value: 0.5945206794543682.
[I 2024-11-06 19:49:18,162] Trial 323 finished with value: 0.5941234085478782 and parameters: {'C': 0.1470372302856346, 'solver': 'liblinear'}. Best is trial 236 with value: 0.5945206794543682.
[I 2024-11-06 19:49:20,146] Trial 324 finished with value: 0.5945206794543682 and parameters: {'C': 0.42246021141286627, 'solver': 'liblinear'}. Best is trial 236 with value: 0.5945206794543682.
[I 2024-11-06 19:49:22,051] Trial 325 finished with value: 0.5944033476557997 and parameters: {'C': 7.134214570267907, 'solver': 'liblinear'}. Best is trial 236 with value: 0.5945206794543682.
[I 2024-11-06 19:49:23,876] Trial 326 finished with value: 0.5944271055176585 and parameters: {'C': 0.6230727661921542, 'solver': 'liblinear'}. Best is trial 236 with value: 0.5945206794543682.
[I 2024-11-06 19:49:25,328] Trial 327 finished with value: 0.5941475702588448 and parameters: {'C': 0.1761307017355373, 'solver': 'liblinear'}. Best is trial 236 with value: 0.5945206794543682.
[I 2024-11-06 19:49:27,056] Trial 328 finished with value: 0.5945206794543682 and parameters: {'C': 0.40684275584177737, 'solver': 'liblinear'}. Best is trial 236 with value: 0.5945206794543682.
[I 2024-11-06 19:49:28,792] Trial 329 finished with value: 0.5944382005892241 and parameters: {'C': 0.7671563721183519, 'solver': 'liblinear'}. Best is trial 236 with value: 0.5945206794543682.
[I 2024-11-06 19:49:30,549] Trial 330 finished with value: 0.5944623049870396 and parameters: {'C': 0.5070792395633676, 'solver': 'liblinear'}. Best is trial 236 with value: 0.5945206794543682.
[I 2024-11-06 19:49:31,743] Trial 331 finished with value: 0.5941601106520807 and parameters: {'C': 0.285922434886301, 'solver': 'lbfgs'}. Best is trial 236 with value: 0.5945206794543682.
[I 2024-11-06 19:49:33,222] Trial 332 finished with value: 0.5917117074163831 and parameters: {'C': 0.015807303314938403, 'solver': 'liblinear'}. Best is trial 236 with value: 0.5945206794543682.
[I 2024-11-06 19:49:34,905] Trial 333 finished with value: 0.5944719394321811 and parameters: {'C': 0.566763012482496, 'solver': 'liblinear'}. Best is trial 236 with value: 0.5945206794543682.
[I 2024-11-06 19:49:36,770] Trial 334 finished with value: 0.5944241813468227 and parameters: {'C': 0.8378245273284968, 'solver': 'liblinear'}. Best is trial 236 with value: 0.5945206794543682.
[I 2024-11-06 19:49:38,403] Trial 335 finished with value: 0.5944629786163811 and parameters: {'C': 0.34829930370471385, 'solver': 'liblinear'}. Best is trial 236 with value: 0.5945206794543682.
[I 2024-11-06 19:49:39,972] Trial 336 finished with value: 0.5941475919992161 and parameters: {'C': 0.15999298496379272, 'solver': 'liblinear'}. Best is trial 236 with value: 0.5945206794543682.
[I 2024-11-06 19:49:41,733] Trial 337 finished with value: 0.5943935986935767 and parameters: {'C': 5.920447205360686, 'solver': 'liblinear'}. Best is trial 236 with value: 0.5945206794543682.
[I 2024-11-06 19:49:43,493] Trial 338 finished with value: 0.5944623049870396 and parameters: {'C': 0.5047484937973711, 'solver': 'liblinear'}. Best is trial 236 with value: 0.5945206794543682.
[I 2024-11-06 19:49:45,182] Trial 339 finished with value: 0.5944341071243737 and parameters: {'C': 0.750475070961251, 'solver': 'liblinear'}. Best is trial 236 with value: 0.5945206794543682.
[I 2024-11-06 19:49:46,919] Trial 340 finished with value: 0.5944840977210006 and parameters: {'C': 0.36746640138859743, 'solver': 'liblinear'}. Best is trial 236 with value: 0.5945206794543682.
[I 2024-11-06 19:49:48,646] Trial 341 finished with value: 0.5944229713756195 and parameters: {'C': 0.6121437486471749, 'solver': 'liblinear'}. Best is trial 236 with value: 0.5945206794543682.
[I 2024-11-06 19:49:50,304] Trial 342 finished with value: 0.5942863869122607 and parameters: {'C': 0.2636545755107119, 'solver': 'liblinear'}. Best is trial 236 with value: 0.5945206794543682.
[I 2024-11-06 19:49:52,200] Trial 343 finished with value: 0.5944704740338647 and parameters: {'C': 0.4629794391636679, 'solver': 'liblinear'}. Best is trial 236 with value: 0.5945206794543682.
[I 2024-11-06 19:49:54,035] Trial 344 finished with value: 0.594103915093395 and parameters: {'C': 0.13872278013987357, 'solver': 'liblinear'}. Best is trial 236 with value: 0.5945206794543682.
[I 2024-11-06 19:49:55,798] Trial 345 finished with value: 0.5944382005892241 and parameters: {'C': 0.7595210593407018, 'solver': 'liblinear'}. Best is trial 236 with value: 0.5945206794543682.
[I 2024-11-06 19:49:57,531] Trial 346 finished with value: 0.5945025209280864 and parameters: {'C': 0.43742636383268413, 'solver': 'liblinear'}. Best is trial 236 with value: 0.5945206794543682.
[I 2024-11-06 19:49:59,329] Trial 347 finished with value: 0.5944621363785512 and parameters: {'C': 0.5814142602527106, 'solver': 'liblinear'}. Best is trial 236 with value: 0.5945206794543682.
[I 2024-11-06 19:50:00,829] Trial 348 finished with value: 0.5941941592929504 and parameters: {'C': 0.19884408292400205, 'solver': 'liblinear'}. Best is trial 236 with value: 0.5945206794543682.
[I 2024-11-06 19:50:02,363] Trial 349 finished with value: 0.5890311405343114 and parameters: {'C': 0.006230732419106988, 'solver': 'liblinear'}. Best is trial 236 with value: 0.5945206794543682.
[I 2024-11-06 19:50:04,382] Trial 350 finished with value: 0.5944200192689717 and parameters: {'C': 0.8471181672731061, 'solver': 'liblinear'}. Best is trial 236 with value: 0.5945206794543682.
[I 2024-11-06 19:50:06,127] Trial 351 finished with value: 0.5944538960644219 and parameters: {'C': 0.47084676453367136, 'solver': 'liblinear'}. Best is trial 236 with value: 0.5945206794543682.
[I 2024-11-06 19:50:07,665] Trial 352 finished with value: 0.5943648779104642 and parameters: {'C': 0.29622173719616357, 'solver': 'liblinear'}. Best is trial 236 with value: 0.5945206794543682.
[I 2024-11-06 19:50:08,951] Trial 353 finished with value: 0.5941374821440141 and parameters: {'C': 0.6244730173472316, 'solver': 'lbfgs'}. Best is trial 236 with value: 0.5945206794543682.
[I 2024-11-06 19:50:10,690] Trial 354 finished with value: 0.5944840977210006 and parameters: {'C': 0.3750317437011502, 'solver': 'liblinear'}. Best is trial 236 with value: 0.5945206794543682.
[I 2024-11-06 19:50:12,424] Trial 355 finished with value: 0.5944200192689717 and parameters: {'C': 0.8443478013941699, 'solver': 'liblinear'}. Best is trial 236 with value: 0.5945206794543682.
[I 2024-11-06 19:50:14,442] Trial 356 finished with value: 0.5944465743982909 and parameters: {'C': 0.6406342354804312, 'solver': 'liblinear'}. Best is trial 236 with value: 0.5945206794543682.
[I 2024-11-06 19:50:15,713] Trial 357 finished with value: 0.5846808309963285 and parameters: {'C': 0.003102474092494645, 'solver': 'liblinear'}. Best is trial 236 with value: 0.5945206794543682.
[I 2024-11-06 19:50:17,327] Trial 358 finished with value: 0.5943158594047946 and parameters: {'C': 0.27216572652810206, 'solver': 'liblinear'}. Best is trial 236 with value: 0.5945206794543682.
[I 2024-11-06 19:50:19,104] Trial 359 finished with value: 0.5944538960644219 and parameters: {'C': 0.4663223295123931, 'solver': 'liblinear'}. Best is trial 236 with value: 0.5945206794543682.
[I 2024-11-06 19:50:20,863] Trial 360 finished with value: 0.5944465743982909 and parameters: {'C': 0.6435396228441912, 'solver': 'liblinear'}. Best is trial 236 with value: 0.5945206794543682.
[I 2024-11-06 19:50:22,572] Trial 361 finished with value: 0.5941435245933754 and parameters: {'C': 0.18377628055956502, 'solver': 'liblinear'}. Best is trial 236 with value: 0.5945206794543682.
[I 2024-11-06 19:50:24,621] Trial 362 finished with value: 0.5944743476921779 and parameters: {'C': 0.3767489993992587, 'solver': 'liblinear'}. Best is trial 236 with value: 0.5945206794543682.
[I 2024-11-06 19:50:26,683] Trial 363 finished with value: 0.5944241813468227 and parameters: {'C': 0.8363581548317502, 'solver': 'liblinear'}. Best is trial 236 with value: 0.5945206794543682.
[I 2024-11-06 19:50:28,582] Trial 364 finished with value: 0.594452488013693 and parameters: {'C': 0.5491897126107289, 'solver': 'liblinear'}. Best is trial 236 with value: 0.5945206794543682.
