[I 2024-11-06 19:32:59,072] Trial 146 finished with value: 0.5944008179293435 and parameters: {'C': 3.8565895644530936, 'solver': 'saga'}. Best is trial 0 with value: 0.5944622851684469.
[I 2024-11-06 19:33:10,557] Trial 147 finished with value: 0.5944231726540832 and parameters: {'C': 1.0715512989734497, 'solver': 'saga'}. Best is trial 0 with value: 0.5944622851684469.
[I 2024-11-06 19:33:12,620] Trial 148 finished with value: 0.5943961423558287 and parameters: {'C': 1.745000408206982, 'solver': 'liblinear'}. Best is trial 0 with value: 0.5944622851684469.
[I 2024-11-06 19:33:21,980] Trial 149 finished with value: 0.5944035662287324 and parameters: {'C': 0.8131850175102677, 'solver': 'saga'}. Best is trial 0 with value: 0.5944622851684469.
[I 2024-11-06 19:33:34,427] Trial 150 finished with value: 0.5944329368196948 and parameters: {'C': 1.2581801334252936, 'solver': 'saga'}. Best is trial 0 with value: 0.5944622851684469.
[I 2024-11-06 19:33:46,118] Trial 151 finished with value: 0.5944329368196948 and parameters: {'C': 1.184657353545724, 'solver': 'saga'}. Best is trial 0 with value: 0.5944622851684469.
[I 2024-11-06 19:33:59,137] Trial 152 finished with value: 0.5944246135374919 and parameters: {'C': 1.4799738207711062, 'solver': 'saga'}. Best is trial 0 with value: 0.5944622851684469.
[I 2024-11-06 19:34:09,131] Trial 153 finished with value: 0.5944133151909555 and parameters: {'C': 0.8955775049118908, 'solver': 'saga'}. Best is trial 0 with value: 0.5944622851684469.
[I 2024-11-06 19:34:16,370] Trial 154 finished with value: 0.5944190447951545 and parameters: {'C': 0.5851202091271765, 'solver': 'saga'}. Best is trial 0 with value: 0.5944622851684469.
[I 2024-11-06 19:34:27,736] Trial 155 finished with value: 0.5944371157934436 and parameters: {'C': 1.0974108798921525, 'solver': 'saga'}. Best is trial 0 with value: 0.5944622851684469.
[I 2024-11-06 19:34:36,587] Trial 156 finished with value: 0.5944035662287324 and parameters: {'C': 0.7210884913685882, 'solver': 'saga'}. Best is trial 0 with value: 0.5944622851684469.
[I 2024-11-06 19:34:48,006] Trial 157 finished with value: 0.5944231726540832 and parameters: {'C': 1.0629755263429403, 'solver': 'saga'}. Best is trial 0 with value: 0.5944622851684469.
[I 2024-11-06 19:34:49,950] Trial 158 finished with value: 0.594394623589025 and parameters: {'C': 1.5575406357185795, 'solver': 'liblinear'}. Best is trial 0 with value: 0.5944622851684469.
[I 2024-11-06 19:35:07,366] Trial 159 finished with value: 0.5944106490062745 and parameters: {'C': 2.337026003538499, 'solver': 'saga'}. Best is trial 0 with value: 0.5944622851684469.
[I 2024-11-06 19:35:19,755] Trial 160 finished with value: 0.5944329368196948 and parameters: {'C': 1.341085850042853, 'solver': 'saga'}. Best is trial 0 with value: 0.5944622851684469.
[I 2024-11-06 19:35:30,220] Trial 161 finished with value: 0.5944050901964355 and parameters: {'C': 0.9375708197772273, 'solver': 'saga'}. Best is trial 0 with value: 0.5944622851684469.
[I 2024-11-06 19:35:42,135] Trial 162 finished with value: 0.5944329368196948 and parameters: {'C': 1.1751742181563716, 'solver': 'saga'}. Best is trial 0 with value: 0.5944622851684469.
[I 2024-11-06 19:35:56,341] Trial 163 finished with value: 0.5944147831483135 and parameters: {'C': 1.66307590584508, 'solver': 'saga'}. Best is trial 0 with value: 0.5944622851684469.
[I 2024-11-06 19:36:02,054] Trial 164 finished with value: 0.5944107420059561 and parameters: {'C': 0.43431444343325454, 'solver': 'saga'}. Best is trial 0 with value: 0.5944622851684469.
[I 2024-11-06 19:36:18,440] Trial 165 finished with value: 0.5944106336648237 and parameters: {'C': 2.0491673981444003, 'solver': 'saga'}. Best is trial 0 with value: 0.5944622851684469.
[I 2024-11-06 19:36:31,016] Trial 166 finished with value: 0.5944329368196948 and parameters: {'C': 1.3475590135332898, 'solver': 'saga'}. Best is trial 0 with value: 0.5944622851684469.
[I 2024-11-06 19:36:32,362] Trial 167 finished with value: 0.5942666869321116 and parameters: {'C': 0.9096311372312014, 'solver': 'lbfgs'}. Best is trial 0 with value: 0.5944622851684469.
/anaconda/envs/py38_default/lib/python3.9/site-packages/sklearn/linear_model/_sag.py:350: ConvergenceWarning: The max_iter was reached which means the coef_ did not converge
  warnings.warn(
/anaconda/envs/py38_default/lib/python3.9/site-packages/sklearn/linear_model/_sag.py:350: ConvergenceWarning: The max_iter was reached which means the coef_ did not converge
  warnings.warn(
/anaconda/envs/py38_default/lib/python3.9/site-packages/sklearn/linear_model/_sag.py:350: ConvergenceWarning: The max_iter was reached which means the coef_ did not converge
  warnings.warn(
/anaconda/envs/py38_default/lib/python3.9/site-packages/sklearn/linear_model/_sag.py:350: ConvergenceWarning: The max_iter was reached which means the coef_ did not converge
  warnings.warn(
/anaconda/envs/py38_default/lib/python3.9/site-packages/sklearn/linear_model/_sag.py:350: ConvergenceWarning: The max_iter was reached which means the coef_ did not converge
  warnings.warn(
[I 2024-11-06 19:36:50,083] Trial 168 finished with value: 0.5943812543139344 and parameters: {'C': 6.33849015728659, 'solver': 'saga'}. Best is trial 0 with value: 0.5944622851684469.
[I 2024-11-06 19:37:01,579] Trial 169 finished with value: 0.5944329368196948 and parameters: {'C': 1.1249891041075668, 'solver': 'saga'}. Best is trial 0 with value: 0.5944622851684469.
[I 2024-11-06 19:37:03,536] Trial 170 finished with value: 0.5943961423558287 and parameters: {'C': 1.818832388506257, 'solver': 'liblinear'}. Best is trial 0 with value: 0.5944622851684469.
[I 2024-11-06 19:37:16,617] Trial 171 finished with value: 0.5944329368196948 and parameters: {'C': 1.3696453224700826, 'solver': 'saga'}. Best is trial 0 with value: 0.5944622851684469.
[I 2024-11-06 19:37:30,152] Trial 172 finished with value: 0.5944147831483135 and parameters: {'C': 1.5232314637049376, 'solver': 'saga'}. Best is trial 0 with value: 0.5944622851684469.
[I 2024-11-06 19:37:42,291] Trial 173 finished with value: 0.5944329368196948 and parameters: {'C': 1.2251879723700263, 'solver': 'saga'}. Best is trial 0 with value: 0.5944622851684469.
[I 2024-11-06 19:37:50,817] Trial 174 finished with value: 0.5944035662287324 and parameters: {'C': 0.7352832151417766, 'solver': 'saga'}. Best is trial 0 with value: 0.5944622851684469.
[I 2024-11-06 19:38:01,728] Trial 175 finished with value: 0.5944231726540832 and parameters: {'C': 1.0013929029265767, 'solver': 'saga'}. Best is trial 0 with value: 0.5944622851684469.
[I 2024-11-06 19:38:14,177] Trial 176 finished with value: 0.5944329368196948 and parameters: {'C': 1.2808876817107102, 'solver': 'saga'}. Best is trial 0 with value: 0.5944622851684469.
[I 2024-11-06 19:38:21,998] Trial 177 finished with value: 0.5944133968162141 and parameters: {'C': 0.6580648264118081, 'solver': 'saga'}. Best is trial 0 with value: 0.5944622851684469.
[I 2024-11-06 19:38:25,498] Trial 178 finished with value: 0.5943619651934242 and parameters: {'C': 0.2172947532716049, 'solver': 'saga'}. Best is trial 0 with value: 0.5944622851684469.
[I 2024-11-06 19:38:39,500] Trial 179 finished with value: 0.5944147831483135 and parameters: {'C': 1.6599331805121433, 'solver': 'saga'}. Best is trial 0 with value: 0.5944622851684469.
[I 2024-11-06 19:38:41,504] Trial 180 finished with value: 0.5944045676268799 and parameters: {'C': 1.0810907344805725, 'solver': 'liblinear'}. Best is trial 0 with value: 0.5944622851684469.
[I 2024-11-06 19:38:54,023] Trial 181 finished with value: 0.5944329368196948 and parameters: {'C': 1.3092352156601486, 'solver': 'saga'}. Best is trial 0 with value: 0.5944622851684469.
[I 2024-11-06 19:39:07,532] Trial 182 finished with value: 0.5944246135374919 and parameters: {'C': 1.4845248218550118, 'solver': 'saga'}. Best is trial 0 with value: 0.5944622851684469.
[I 2024-11-06 19:39:17,789] Trial 183 finished with value: 0.5944133151909555 and parameters: {'C': 0.9170540472132591, 'solver': 'saga'}. Best is trial 0 with value: 0.5944622851684469.
[I 2024-11-06 19:39:50,507] Trial 184 finished with value: 0.5944329368196948 and parameters: {'C': 1.1940795178021353, 'solver': 'saga'}. Best is trial 0 with value: 0.5944622851684469.
[I 2024-11-06 19:40:05,419] Trial 185 finished with value: 0.5944106336648237 and parameters: {'C': 1.8039453267847476, 'solver': 'saga'}. Best is trial 0 with value: 0.5944622851684469.
[I 2024-11-06 19:40:18,517] Trial 186 finished with value: 0.5944287750330204 and parameters: {'C': 1.4072756148588121, 'solver': 'saga'}. Best is trial 0 with value: 0.5944622851684469.
[I 2024-11-06 19:40:27,831] Trial 187 finished with value: 0.5944035662287324 and parameters: {'C': 0.7964079548840017, 'solver': 'saga'}. Best is trial 0 with value: 0.5944622851684469.
[I 2024-11-06 19:40:39,400] Trial 188 finished with value: 0.5944329368196948 and parameters: {'C': 1.1109706441757796, 'solver': 'saga'}. Best is trial 0 with value: 0.5944622851684469.
[I 2024-11-06 19:40:49,332] Trial 189 finished with value: 0.5944133151909555 and parameters: {'C': 0.8980442467908714, 'solver': 'saga'}. Best is trial 0 with value: 0.5944622851684469.
[I 2024-11-06 19:40:56,652] Trial 190 finished with value: 0.5944133636911626 and parameters: {'C': 0.6052005029034907, 'solver': 'saga'}. Best is trial 0 with value: 0.5944622851684469.
[I 2024-11-06 19:41:09,199] Trial 191 finished with value: 0.5944329368196948 and parameters: {'C': 1.2770273612936707, 'solver': 'saga'}. Best is trial 0 with value: 0.5944622851684469.
[I 2024-11-06 19:41:21,165] Trial 192 finished with value: 0.5944329368196948 and parameters: {'C': 1.1389450747014882, 'solver': 'saga'}. Best is trial 0 with value: 0.5944622851684469.
[I 2024-11-06 19:41:35,177] Trial 193 finished with value: 0.5944147831483135 and parameters: {'C': 1.5820006969370204, 'solver': 'saga'}. Best is trial 0 with value: 0.5944622851684469.
[I 2024-11-06 19:41:47,575] Trial 194 finished with value: 0.5944329368196948 and parameters: {'C': 1.2719257740257222, 'solver': 'saga'}. Best is trial 0 with value: 0.5944622851684469.
[I 2024-11-06 19:41:58,486] Trial 195 finished with value: 0.5944231726540832 and parameters: {'C': 1.0108912471978786, 'solver': 'saga'}. Best is trial 0 with value: 0.5944622851684469.
[I 2024-11-06 19:42:00,475] Trial 196 finished with value: 0.5943977600835995 and parameters: {'C': 4.3916307413220865, 'solver': 'liblinear'}. Best is trial 0 with value: 0.5944622851684469.
[I 2024-11-06 19:42:14,267] Trial 197 finished with value: 0.5944246135374919 and parameters: {'C': 1.4911887899975658, 'solver': 'saga'}. Best is trial 0 with value: 0.5944622851684469.
[I 2024-11-06 19:42:24,059] Trial 198 finished with value: 0.5944133151909555 and parameters: {'C': 0.8487710064482117, 'solver': 'saga'}. Best is trial 0 with value: 0.5944622851684469.
[I 2024-11-06 19:42:25,475] Trial 199 finished with value: 0.5941529984607138 and parameters: {'C': 0.5047388535252725, 'solver': 'lbfgs'}. Best is trial 0 with value: 0.5944622851684469.
[I 2024-11-06 19:42:37,673] Trial 200 finished with value: 0.5944329368196948 and parameters: {'C': 1.1729654403586454, 'solver': 'saga'}. Best is trial 0 with value: 0.5944622851684469.
[I 2024-11-06 19:42:50,658] Trial 201 finished with value: 0.5944329368196948 and parameters: {'C': 1.362296895284304, 'solver': 'saga'}. Best is trial 0 with value: 0.5944622851684469.
[I 2024-11-06 19:43:03,497] Trial 202 finished with value: 0.5944329368196948 and parameters: {'C': 1.2814513067464683, 'solver': 'saga'}. Best is trial 0 with value: 0.5944622851684469.
[I 2024-11-06 19:43:18,004] Trial 203 finished with value: 0.5944106336648237 and parameters: {'C': 1.6972355457961705, 'solver': 'saga'}. Best is trial 0 with value: 0.5944622851684469.
[I 2024-11-06 19:43:29,689] Trial 204 finished with value: 0.5944329368196948 and parameters: {'C': 1.1145432904059749, 'solver': 'saga'}. Best is trial 0 with value: 0.5944622851684469.
[I 2024-11-06 19:43:42,837] Trial 205 finished with value: 0.5944246135374919 and parameters: {'C': 1.473569094341402, 'solver': 'saga'}. Best is trial 0 with value: 0.5944622851684469.
[I 2024-11-06 19:43:53,737] Trial 206 finished with value: 0.5944231726540832 and parameters: {'C': 1.038280430695429, 'solver': 'saga'}. Best is trial 0 with value: 0.5944622851684469.
[I 2024-11-06 19:44:03,504] Trial 207 finished with value: 0.5944133151909555 and parameters: {'C': 0.8666806533287266, 'solver': 'saga'}. Best is trial 0 with value: 0.5944622851684469.
[I 2024-11-06 19:44:05,329] Trial 208 finished with value: 0.5943905567746292 and parameters: {'C': 1.3229397340289086, 'solver': 'liblinear'}. Best is trial 0 with value: 0.5944622851684469.
[I 2024-11-06 19:44:13,922] Trial 209 finished with value: 0.5944035662287324 and parameters: {'C': 0.7208749367694948, 'solver': 'saga'}. Best is trial 0 with value: 0.5944622851684469.
[I 2024-11-06 19:44:27,871] Trial 210 finished with value: 0.5944147831483135 and parameters: {'C': 1.6027570191983576, 'solver': 'saga'}. Best is trial 0 with value: 0.5944622851684469.
[I 2024-11-06 19:44:39,306] Trial 211 finished with value: 0.5944329368196948 and parameters: {'C': 1.1034232580628882, 'solver': 'saga'}. Best is trial 0 with value: 0.5944622851684469.
[I 2024-11-06 19:44:51,214] Trial 212 finished with value: 0.5944329368196948 and parameters: {'C': 1.18960832208774, 'solver': 'saga'}. Best is trial 0 with value: 0.5944622851684469.
[I 2024-11-06 19:45:01,831] Trial 213 finished with value: 0.5944231726540832 and parameters: {'C': 0.9826797112194243, 'solver': 'saga'}. Best is trial 0 with value: 0.5944622851684469.
[I 2024-11-06 19:45:15,117] Trial 214 finished with value: 0.5944287750330204 and parameters: {'C': 1.4091736426908552, 'solver': 'saga'}. Best is trial 0 with value: 0.5944622851684469.
[I 2024-11-06 19:45:27,085] Trial 215 finished with value: 0.5944329368196948 and parameters: {'C': 1.2132176068543084, 'solver': 'saga'}. Best is trial 0 with value: 0.5944622851684469.
/anaconda/envs/py38_default/lib/python3.9/site-packages/sklearn/linear_model/_sag.py:350: ConvergenceWarning: The max_iter was reached which means the coef_ did not converge
  warnings.warn(
/anaconda/envs/py38_default/lib/python3.9/site-packages/sklearn/linear_model/_sag.py:350: ConvergenceWarning: The max_iter was reached which means the coef_ did not converge
  warnings.warn(
/anaconda/envs/py38_default/lib/python3.9/site-packages/sklearn/linear_model/_sag.py:350: ConvergenceWarning: The max_iter was reached which means the coef_ did not converge
  warnings.warn(
/anaconda/envs/py38_default/lib/python3.9/site-packages/sklearn/linear_model/_sag.py:350: ConvergenceWarning: The max_iter was reached which means the coef_ did not converge
  warnings.warn(
/anaconda/envs/py38_default/lib/python3.9/site-packages/sklearn/linear_model/_sag.py:350: ConvergenceWarning: The max_iter was reached which means the coef_ did not converge
  warnings.warn(
[I 2024-11-06 19:45:44,459] Trial 216 finished with value: 0.5943951154287845 and parameters: {'C': 5.41238345154151, 'solver': 'saga'}. Best is trial 0 with value: 0.5944622851684469.
[I 2024-11-06 19:45:59,716] Trial 217 finished with value: 0.5944106336648237 and parameters: {'C': 1.9193291797811507, 'solver': 'saga'}. Best is trial 0 with value: 0.5944622851684469.
[I 2024-11-06 19:46:09,953] Trial 218 finished with value: 0.5944133151909555 and parameters: {'C': 0.9136793478438715, 'solver': 'saga'}. Best is trial 0 with value: 0.5944622851684469.
[I 2024-11-06 19:46:23,001] Trial 219 finished with value: 0.5944246135374919 and parameters: {'C': 1.4767534200119952, 'solver': 'saga'}. Best is trial 0 with value: 0.5944622851684469.
[I 2024-11-06 19:46:24,696] Trial 220 finished with value: 0.5944465036747404 and parameters: {'C': 0.6923439808964423, 'solver': 'liblinear'}. Best is trial 0 with value: 0.5944622851684469.
[I 2024-11-06 19:46:26,457] Trial 221 finished with value: 0.5945010479847608 and parameters: {'C': 0.39216383247584996, 'solver': 'liblinear'}. Best is trial 221 with value: 0.5945010479847608.
[I 2024-11-06 19:46:28,188] Trial 222 finished with value: 0.59446293581579 and parameters: {'C': 0.3442388323444094, 'solver': 'liblinear'}. Best is trial 221 with value: 0.5945010479847608.
[I 2024-11-06 19:46:29,879] Trial 223 finished with value: 0.5944264109351601 and parameters: {'C': 0.3139252085346795, 'solver': 'liblinear'}. Best is trial 221 with value: 0.5945010479847608.
[I 2024-11-06 19:46:31,246] Trial 224 finished with value: 0.5918872734385865 and parameters: {'C': 0.017014872182842866, 'solver': 'liblinear'}. Best is trial 221 with value: 0.5945010479847608.
[I 2024-11-06 19:46:33,075] Trial 225 finished with value: 0.5945165657501879 and parameters: {'C': 0.43198510874065693, 'solver': 'liblinear'}. Best is trial 225 with value: 0.5945165657501879.
[I 2024-11-06 19:46:35,003] Trial 226 finished with value: 0.5945165657501879 and parameters: {'C': 0.426802626943957, 'solver': 'liblinear'}. Best is trial 225 with value: 0.5945165657501879.
[I 2024-11-06 19:46:36,659] Trial 227 finished with value: 0.5942081302033759 and parameters: {'C': 0.19365924542190444, 'solver': 'liblinear'}. Best is trial 225 with value: 0.5945165657501879.
[I 2024-11-06 19:46:38,172] Trial 228 finished with value: 0.5944686183045149 and parameters: {'C': 0.35332580281523607, 'solver': 'liblinear'}. Best is trial 225 with value: 0.5945165657501879.
[I 2024-11-06 19:46:39,638] Trial 229 finished with value: 0.5943214214697532 and parameters: {'C': 0.28172879697087994, 'solver': 'liblinear'}. Best is trial 225 with value: 0.5945165657501879.
[I 2024-11-06 19:46:41,282] Trial 230 finished with value: 0.5944746354238873 and parameters: {'C': 0.45139624508416043, 'solver': 'liblinear'}. Best is trial 225 with value: 0.5945165657501879.
[I 2024-11-06 19:46:43,000] Trial 231 finished with value: 0.5945165657501879 and parameters: {'C': 0.43306793011031, 'solver': 'liblinear'}. Best is trial 225 with value: 0.5945165657501879.
[I 2024-11-06 19:46:44,687] Trial 232 finished with value: 0.594458151416214 and parameters: {'C': 0.4875701529544585, 'solver': 'liblinear'}. Best is trial 225 with value: 0.5945165657501879.
[I 2024-11-06 19:46:46,350] Trial 233 finished with value: 0.5944927192421414 and parameters: {'C': 0.4429487528671881, 'solver': 'liblinear'}. Best is trial 225 with value: 0.5945165657501879.
[I 2024-11-06 19:46:48,115] Trial 234 finished with value: 0.594452488013693 and parameters: {'C': 0.5492451462443669, 'solver': 'liblinear'}. Best is trial 225 with value: 0.5945165657501879.
[I 2024-11-06 19:46:49,919] Trial 235 finished with value: 0.5944840977210006 and parameters: {'C': 0.37295171317530046, 'solver': 'liblinear'}. Best is trial 225 with value: 0.5945165657501879.
[I 2024-11-06 19:46:51,620] Trial 236 finished with value: 0.5945206794543682 and parameters: {'C': 0.41602855047688075, 'solver': 'liblinear'}. Best is trial 236 with value: 0.5945206794543682.
[I 2024-11-06 19:46:53,373] Trial 237 finished with value: 0.5945067022372321 and parameters: {'C': 0.4364870331301376, 'solver': 'liblinear'}. Best is trial 236 with value: 0.5945206794543682.
[I 2024-11-06 19:46:55,299] Trial 238 finished with value: 0.594506685611659 and parameters: {'C': 0.40010579667681134, 'solver': 'liblinear'}. Best is trial 236 with value: 0.5945206794543682.
[I 2024-11-06 19:46:57,130] Trial 239 finished with value: 0.5945037726748497 and parameters: {'C': 0.3839014352914241, 'solver': 'liblinear'}. Best is trial 236 with value: 0.5945206794543682.
[I 2024-11-06 19:46:58,987] Trial 240 finished with value: 0.5945206794543682 and parameters: {'C': 0.41263310885862925, 'solver': 'liblinear'}. Best is trial 236 with value: 0.5945206794543682.
[I 2024-11-06 19:47:00,750] Trial 241 finished with value: 0.5944538960644219 and parameters: {'C': 0.46774755493846526, 'solver': 'liblinear'}. Best is trial 236 with value: 0.5945206794543682.
[I 2024-11-06 19:47:02,469] Trial 242 finished with value: 0.5945206794543682 and parameters: {'C': 0.4091470897119577, 'solver': 'liblinear'}. Best is trial 236 with value: 0.5945206794543682.
[I 2024-11-06 19:47:04,253] Trial 243 finished with value: 0.5944840977210006 and parameters: {'C': 0.3677098033310331, 'solver': 'liblinear'}. Best is trial 236 with value: 0.5945206794543682.
[I 2024-11-06 19:47:06,060] Trial 244 finished with value: 0.5945010479847608 and parameters: {'C': 0.3932672621477842, 'solver': 'liblinear'}. Best is trial 236 with value: 0.5945206794543682.
[I 2024-11-06 19:47:07,742] Trial 245 finished with value: 0.594506685611659 and parameters: {'C': 0.39869444969655926, 'solver': 'liblinear'}. Best is trial 236 with value: 0.5945206794543682.
[I 2024-11-06 19:47:09,538] Trial 246 finished with value: 0.5944727693533249 and parameters: {'C': 0.3496913019399503, 'solver': 'liblinear'}. Best is trial 236 with value: 0.5945206794543682.
[I 2024-11-06 19:47:11,411] Trial 247 finished with value: 0.5945206794543682 and parameters: {'C': 0.4248329172036144, 'solver': 'liblinear'}. Best is trial 236 with value: 0.5945206794543682.
[I 2024-11-06 19:47:12,930] Trial 248 finished with value: 0.5941260426765125 and parameters: {'C': 0.13282923025882853, 'solver': 'liblinear'}. Best is trial 236 with value: 0.5945206794543682.
[I 2024-11-06 19:47:14,635] Trial 249 finished with value: 0.5944996217185112 and parameters: {'C': 0.3888220587935264, 'solver': 'liblinear'}. Best is trial 236 with value: 0.5945206794543682.
[I 2024-11-06 19:47:16,404] Trial 250 finished with value: 0.5945037726748497 and parameters: {'C': 0.3832221082086169, 'solver': 'liblinear'}. Best is trial 236 with value: 0.5945206794543682.
[I 2024-11-06 19:47:18,103] Trial 251 finished with value: 0.5944840977210006 and parameters: {'C': 0.3717686604756856, 'solver': 'liblinear'}. Best is trial 236 with value: 0.5945206794543682.
