[I 2024-11-06 19:53:44,926] Trial 478 finished with value: 0.5944679401977606 and parameters: {'C': 0.4760636382485884, 'solver': 'liblinear'}. Best is trial 236 with value: 0.5945206794543682.
[I 2024-11-06 19:53:46,523] Trial 479 finished with value: 0.5942152287617354 and parameters: {'C': 0.2302326635946928, 'solver': 'liblinear'}. Best is trial 236 with value: 0.5945206794543682.
[I 2024-11-06 19:53:48,239] Trial 480 finished with value: 0.5944465036747404 and parameters: {'C': 0.6953459663357728, 'solver': 'liblinear'}. Best is trial 236 with value: 0.5945206794543682.
[I 2024-11-06 19:53:50,162] Trial 481 finished with value: 0.5945206794543682 and parameters: {'C': 0.4097495332570982, 'solver': 'liblinear'}. Best is trial 236 with value: 0.5945206794543682.
[I 2024-11-06 19:53:51,494] Trial 482 finished with value: 0.5943195029201827 and parameters: {'C': 0.9845876878843276, 'solver': 'lbfgs'}. Best is trial 236 with value: 0.5945206794543682.
[I 2024-11-06 19:53:53,325] Trial 483 finished with value: 0.594452488013693 and parameters: {'C': 0.5437516466500387, 'solver': 'liblinear'}. Best is trial 236 with value: 0.5945206794543682.
[I 2024-11-06 19:53:54,871] Trial 484 finished with value: 0.594161515627971 and parameters: {'C': 0.17442244187404513, 'solver': 'liblinear'}. Best is trial 236 with value: 0.5945206794543682.
[I 2024-11-06 19:53:56,556] Trial 485 finished with value: 0.594506685611659 and parameters: {'C': 0.3984513077122784, 'solver': 'liblinear'}. Best is trial 236 with value: 0.5945206794543682.
[I 2024-11-06 19:53:58,330] Trial 486 finished with value: 0.5944341071243737 and parameters: {'C': 0.7467724684884531, 'solver': 'liblinear'}. Best is trial 236 with value: 0.5945206794543682.
[I 2024-11-06 19:53:59,989] Trial 487 finished with value: 0.5944531450788463 and parameters: {'C': 0.3457184413638806, 'solver': 'liblinear'}. Best is trial 236 with value: 0.5945206794543682.
[I 2024-11-06 19:54:01,841] Trial 488 finished with value: 0.5944564825190385 and parameters: {'C': 0.5897450230565507, 'solver': 'liblinear'}. Best is trial 236 with value: 0.5945206794543682.
[I 2024-11-06 19:54:03,887] Trial 489 finished with value: 0.5943935986935767 and parameters: {'C': 5.712846685764332, 'solver': 'liblinear'}. Best is trial 236 with value: 0.5945206794543682.
[I 2024-11-06 19:54:05,401] Trial 490 finished with value: 0.5940804043349754 and parameters: {'C': 0.11720116619565696, 'solver': 'liblinear'}. Best is trial 236 with value: 0.5945206794543682.
[I 2024-11-06 19:54:07,136] Trial 491 finished with value: 0.5944075915572162 and parameters: {'C': 3.317618114961122, 'solver': 'liblinear'}. Best is trial 236 with value: 0.5945206794543682.
[I 2024-11-06 19:54:08,875] Trial 492 finished with value: 0.5943849397349453 and parameters: {'C': 0.9457452694686431, 'solver': 'liblinear'}. Best is trial 236 with value: 0.5945206794543682.
[I 2024-11-06 19:54:10,834] Trial 493 finished with value: 0.5944743476921779 and parameters: {'C': 0.3770190983766563, 'solver': 'liblinear'}. Best is trial 236 with value: 0.5945206794543682.
[I 2024-11-06 19:54:12,569] Trial 494 finished with value: 0.5944465036747404 and parameters: {'C': 0.7110716632923526, 'solver': 'liblinear'}. Best is trial 236 with value: 0.5945206794543682.
[I 2024-11-06 19:54:14,385] Trial 495 finished with value: 0.5944581045429947 and parameters: {'C': 0.502567863759059, 'solver': 'liblinear'}. Best is trial 236 with value: 0.5945206794543682.
[I 2024-11-06 19:54:15,904] Trial 496 finished with value: 0.5942292030490468 and parameters: {'C': 0.2273318928264923, 'solver': 'liblinear'}. Best is trial 236 with value: 0.5945206794543682.
[I 2024-11-06 19:54:17,396] Trial 497 finished with value: 0.5920740333160489 and parameters: {'C': 0.018002729257641237, 'solver': 'liblinear'}. Best is trial 236 with value: 0.5945206794543682.
[I 2024-11-06 19:54:19,102] Trial 498 finished with value: 0.5944662864538506 and parameters: {'C': 0.584429744600999, 'solver': 'liblinear'}. Best is trial 236 with value: 0.5945206794543682.
[I 2024-11-06 19:54:20,678] Trial 499 finished with value: 0.5944067404192159 and parameters: {'C': 0.30870160387274026, 'solver': 'liblinear'}. Best is trial 236 with value: 0.5945206794543682.
[I 2024-11-06 19:54:22,393] Trial 500 finished with value: 0.5944033476557997 and parameters: {'C': 6.758088152383866, 'solver': 'liblinear'}. Best is trial 236 with value: 0.5945206794543682.
[I 2024-11-06 19:54:23,703] Trial 501 finished with value: 0.5941606173723274 and parameters: {'C': 0.7834845392030882, 'solver': 'lbfgs'}. Best is trial 236 with value: 0.5945206794543682.
[I 2024-11-06 19:54:25,673] Trial 502 finished with value: 0.5944538960644219 and parameters: {'C': 0.4686333593883011, 'solver': 'liblinear'}. Best is trial 236 with value: 0.5945206794543682.
[I 2024-11-06 19:54:27,195] Trial 503 finished with value: 0.5942152287617354 and parameters: {'C': 0.2301128089127444, 'solver': 'liblinear'}. Best is trial 236 with value: 0.5945206794543682.
[I 2024-11-06 19:54:28,894] Trial 504 finished with value: 0.5944271055176585 and parameters: {'C': 0.6185950649840828, 'solver': 'liblinear'}. Best is trial 236 with value: 0.5945206794543682.
[I 2024-11-06 19:54:30,654] Trial 505 finished with value: 0.5945010479847608 and parameters: {'C': 0.39124605066139995, 'solver': 'liblinear'}. Best is trial 236 with value: 0.5945206794543682.
[I 2024-11-06 19:54:32,458] Trial 506 finished with value: 0.5943808274095643 and parameters: {'C': 0.9132973413194887, 'solver': 'liblinear'}. Best is trial 236 with value: 0.5945206794543682.
[I 2024-11-06 19:54:33,950] Trial 507 finished with value: 0.5941306048281534 and parameters: {'C': 0.15276057016529765, 'solver': 'liblinear'}. Best is trial 236 with value: 0.5945206794543682.
[I 2024-11-06 19:54:35,630] Trial 508 finished with value: 0.5944719394321811 and parameters: {'C': 0.570607483251408, 'solver': 'liblinear'}. Best is trial 236 with value: 0.5945206794543682.
[I 2024-11-06 19:54:37,320] Trial 509 finished with value: 0.5944996217185112 and parameters: {'C': 0.3871122998342273, 'solver': 'liblinear'}. Best is trial 236 with value: 0.5945206794543682.
[I 2024-11-06 19:54:39,050] Trial 510 finished with value: 0.5943977600835995 and parameters: {'C': 2.488738585071494, 'solver': 'liblinear'}. Best is trial 236 with value: 0.5945206794543682.
[I 2024-11-06 19:54:40,481] Trial 511 finished with value: 0.5916993777772651 and parameters: {'C': 0.015909459168470863, 'solver': 'liblinear'}. Best is trial 236 with value: 0.5945206794543682.
[I 2024-11-06 19:54:42,206] Trial 512 finished with value: 0.5944423909473389 and parameters: {'C': 0.7220161154543747, 'solver': 'liblinear'}. Best is trial 236 with value: 0.5945206794543682.
[I 2024-11-06 19:54:43,781] Trial 513 finished with value: 0.5943928145789986 and parameters: {'C': 0.3058179064309914, 'solver': 'liblinear'}. Best is trial 236 with value: 0.5945206794543682.
[I 2024-11-06 19:54:45,712] Trial 514 finished with value: 0.5944664551671568 and parameters: {'C': 0.5128049178930397, 'solver': 'liblinear'}. Best is trial 236 with value: 0.5945206794543682.
[I 2024-11-06 19:54:47,714] Trial 515 finished with value: 0.5943946880204862 and parameters: {'C': 0.9879485216728682, 'solver': 'liblinear'}. Best is trial 236 with value: 0.5945206794543682.
[I 2024-11-06 19:54:49,556] Trial 516 finished with value: 0.5944381827960278 and parameters: {'C': 0.7849625569507921, 'solver': 'liblinear'}. Best is trial 236 with value: 0.5945206794543682.
[I 2024-11-06 19:54:51,074] Trial 517 finished with value: 0.5942081302033759 and parameters: {'C': 0.19369633183862994, 'solver': 'liblinear'}. Best is trial 236 with value: 0.5945206794543682.
[I 2024-11-06 19:54:52,886] Trial 518 finished with value: 0.5944623049870396 and parameters: {'C': 0.5045207054165387, 'solver': 'liblinear'}. Best is trial 236 with value: 0.5945206794543682.
[I 2024-11-06 19:54:54,603] Trial 519 finished with value: 0.5944840977210006 and parameters: {'C': 0.3722965539396843, 'solver': 'liblinear'}. Best is trial 236 with value: 0.5945206794543682.
[I 2024-11-06 19:54:56,285] Trial 520 finished with value: 0.5944507362778312 and parameters: {'C': 0.6701497918250625, 'solver': 'liblinear'}. Best is trial 236 with value: 0.5945206794543682.
[I 2024-11-06 19:54:57,947] Trial 521 finished with value: 0.5941434756212238 and parameters: {'C': 0.15716091064693494, 'solver': 'liblinear'}. Best is trial 236 with value: 0.5945206794543682.
[I 2024-11-06 19:54:59,690] Trial 522 finished with value: 0.5944589349248024 and parameters: {'C': 0.34109502720215257, 'solver': 'liblinear'}. Best is trial 236 with value: 0.5945206794543682.
[I 2024-11-06 19:55:01,587] Trial 523 finished with value: 0.5938112812653784 and parameters: {'C': 0.017855968760444596, 'solver': 'lbfgs'}. Best is trial 236 with value: 0.5945206794543682.
[I 2024-11-06 19:55:03,678] Trial 524 finished with value: 0.5944200192689717 and parameters: {'C': 0.8456909914207194, 'solver': 'liblinear'}. Best is trial 236 with value: 0.5945206794543682.
[I 2024-11-06 19:55:05,737] Trial 525 finished with value: 0.5944564825190385 and parameters: {'C': 0.5893836563507819, 'solver': 'liblinear'}. Best is trial 236 with value: 0.5945206794543682.
[I 2024-11-06 19:55:07,641] Trial 526 finished with value: 0.5944679401977606 and parameters: {'C': 0.475931569199971, 'solver': 'liblinear'}. Best is trial 236 with value: 0.5945206794543682.
[I 2024-11-06 19:55:09,180] Trial 527 finished with value: 0.5943550128177442 and parameters: {'C': 0.29349847731362066, 'solver': 'liblinear'}. Best is trial 236 with value: 0.5945206794543682.
[I 2024-11-06 19:55:10,738] Trial 528 finished with value: 0.5943894864545646 and parameters: {'C': 9.931065814329209, 'solver': 'liblinear'}. Best is trial 236 with value: 0.5945206794543682.
[I 2024-11-06 19:55:12,493] Trial 529 finished with value: 0.5944465036747404 and parameters: {'C': 0.7137534704895561, 'solver': 'liblinear'}. Best is trial 236 with value: 0.5945206794543682.
[I 2024-11-06 19:55:14,220] Trial 530 finished with value: 0.5943947796287112 and parameters: {'C': 1.02742909235159, 'solver': 'liblinear'}. Best is trial 236 with value: 0.5945206794543682.
[I 2024-11-06 19:55:16,003] Trial 531 finished with value: 0.5941613849819449 and parameters: {'C': 0.16641812976101966, 'solver': 'liblinear'}. Best is trial 236 with value: 0.5945206794543682.
[I 2024-11-06 19:55:17,077] Trial 532 finished with value: 0.5017495834699104 and parameters: {'C': 0.0002785225766704924, 'solver': 'liblinear'}. Best is trial 236 with value: 0.5945206794543682.
[I 2024-11-06 19:55:19,001] Trial 533 finished with value: 0.594458151416214 and parameters: {'C': 0.49028925553703584, 'solver': 'liblinear'}. Best is trial 236 with value: 0.5945206794543682.
[I 2024-11-06 19:55:20,731] Trial 534 finished with value: 0.5944229713756195 and parameters: {'C': 0.616314671778719, 'solver': 'liblinear'}. Best is trial 236 with value: 0.5945206794543682.
[I 2024-11-06 19:55:22,470] Trial 535 finished with value: 0.5944433941781605 and parameters: {'C': 0.327922656332069, 'solver': 'liblinear'}. Best is trial 236 with value: 0.5945206794543682.
[I 2024-11-06 19:55:24,240] Trial 536 finished with value: 0.5944479887832321 and parameters: {'C': 0.7546564660038005, 'solver': 'liblinear'}. Best is trial 236 with value: 0.5945206794543682.
[I 2024-11-06 19:55:25,914] Trial 537 finished with value: 0.5945206794543682 and parameters: {'C': 0.4265280479213424, 'solver': 'liblinear'}. Best is trial 236 with value: 0.5945206794543682.
[I 2024-11-06 19:55:27,464] Trial 538 finished with value: 0.5942292030490468 and parameters: {'C': 0.22616041888109598, 'solver': 'liblinear'}. Best is trial 236 with value: 0.5945206794543682.
[I 2024-11-06 19:55:29,269] Trial 539 finished with value: 0.594452488013693 and parameters: {'C': 0.5507033801931147, 'solver': 'liblinear'}. Best is trial 236 with value: 0.5945206794543682.
[I 2024-11-06 19:55:30,935] Trial 540 finished with value: 0.5943935986935767 and parameters: {'C': 5.004937622795549, 'solver': 'liblinear'}. Best is trial 236 with value: 0.5945206794543682.
[I 2024-11-06 19:55:32,745] Trial 541 finished with value: 0.594400523374502 and parameters: {'C': 0.8907420622877604, 'solver': 'liblinear'}. Best is trial 236 with value: 0.5945206794543682.
[I 2024-11-06 19:55:34,702] Trial 542 finished with value: 0.5945206794543682 and parameters: {'C': 0.42025383341193107, 'solver': 'liblinear'}. Best is trial 236 with value: 0.5945206794543682.
[I 2024-11-06 19:55:36,244] Trial 543 finished with value: 0.5943550128177442 and parameters: {'C': 0.29267586542398805, 'solver': 'liblinear'}. Best is trial 236 with value: 0.5945206794543682.
[I 2024-11-06 19:55:37,477] Trial 544 finished with value: 0.5941592700151108 and parameters: {'C': 0.6460582859893439, 'solver': 'lbfgs'}. Best is trial 236 with value: 0.5945206794543682.
[I 2024-11-06 19:55:39,193] Trial 545 finished with value: 0.5945206794543682 and parameters: {'C': 0.4252467243234875, 'solver': 'liblinear'}. Best is trial 236 with value: 0.5945206794543682.
[I 2024-11-06 19:55:40,847] Trial 546 finished with value: 0.5941614872224484 and parameters: {'C': 0.17036380995079517, 'solver': 'liblinear'}. Best is trial 236 with value: 0.5945206794543682.
[I 2024-11-06 19:55:42,731] Trial 547 finished with value: 0.5944538960644219 and parameters: {'C': 0.46869383325439956, 'solver': 'liblinear'}. Best is trial 236 with value: 0.5945206794543682.
[I 2024-11-06 19:55:44,614] Trial 548 finished with value: 0.5944381827960278 and parameters: {'C': 0.7687621277900547, 'solver': 'liblinear'}. Best is trial 236 with value: 0.5945206794543682.
[I 2024-11-06 19:55:46,182] Trial 549 finished with value: 0.5944531849151042 and parameters: {'C': 0.3334860957686443, 'solver': 'liblinear'}. Best is trial 236 with value: 0.5945206794543682.
[I 2024-11-06 19:55:47,843] Trial 550 finished with value: 0.5943894864545646 and parameters: {'C': 8.746343600637239, 'solver': 'liblinear'}. Best is trial 236 with value: 0.5945206794543682.
[I 2024-11-06 19:55:49,620] Trial 551 finished with value: 0.5944368725971654 and parameters: {'C': 0.5997769189553287, 'solver': 'liblinear'}. Best is trial 236 with value: 0.5945206794543682.
[I 2024-11-06 19:55:51,284] Trial 552 finished with value: 0.5943849397349453 and parameters: {'C': 0.9554541362416946, 'solver': 'liblinear'}. Best is trial 236 with value: 0.5945206794543682.
[I 2024-11-06 19:55:52,751] Trial 553 finished with value: 0.5941941592929504 and parameters: {'C': 0.19694383057024215, 'solver': 'liblinear'}. Best is trial 236 with value: 0.5945206794543682.
[I 2024-11-06 19:55:54,118] Trial 554 finished with value: 0.5917277430348514 and parameters: {'C': 0.015372945146470196, 'solver': 'liblinear'}. Best is trial 236 with value: 0.5945206794543682.
[I 2024-11-06 19:55:55,929] Trial 555 finished with value: 0.5944538960644219 and parameters: {'C': 0.4713676117660747, 'solver': 'liblinear'}. Best is trial 236 with value: 0.5945206794543682.
[I 2024-11-06 19:55:57,880] Trial 556 finished with value: 0.5944465036747404 and parameters: {'C': 0.7124601907367843, 'solver': 'liblinear'}. Best is trial 236 with value: 0.5945206794543682.
[I 2024-11-06 19:55:59,453] Trial 557 finished with value: 0.5944433941781605 and parameters: {'C': 0.3319977577048586, 'solver': 'liblinear'}. Best is trial 236 with value: 0.5945206794543682.
[I 2024-11-06 19:56:01,549] Trial 558 finished with value: 0.5944524591081727 and parameters: {'C': 0.5363110945969307, 'solver': 'liblinear'}. Best is trial 236 with value: 0.5945206794543682.
[I 2024-11-06 19:56:03,575] Trial 559 finished with value: 0.5944200192689717 and parameters: {'C': 0.8468795220407235, 'solver': 'liblinear'}. Best is trial 236 with value: 0.5945206794543682.
[I 2024-11-06 19:56:05,342] Trial 560 finished with value: 0.5942039389027027 and parameters: {'C': 0.2119765464356275, 'solver': 'liblinear'}. Best is trial 236 with value: 0.5945206794543682.
[I 2024-11-06 19:56:07,232] Trial 561 finished with value: 0.594488232242145 and parameters: {'C': 0.364112830943859, 'solver': 'liblinear'}. Best is trial 236 with value: 0.5945206794543682.
[I 2024-11-06 19:56:09,162] Trial 562 finished with value: 0.5943947796287112 and parameters: {'C': 1.0271060238649967, 'solver': 'liblinear'}. Best is trial 236 with value: 0.5945206794543682.
[I 2024-11-06 19:56:11,236] Trial 563 finished with value: 0.5944564825190385 and parameters: {'C': 0.5886830859378791, 'solver': 'liblinear'}. Best is trial 236 with value: 0.5945206794543682.
[I 2024-11-06 19:56:12,923] Trial 564 finished with value: 0.5941248712028839 and parameters: {'C': 0.1518647527575181, 'solver': 'liblinear'}. Best is trial 236 with value: 0.5945206794543682.
[I 2024-11-06 19:56:15,077] Trial 565 finished with value: 0.5944829311442884 and parameters: {'C': 0.4449254266605435, 'solver': 'liblinear'}. Best is trial 236 with value: 0.5945206794543682.
[I 2024-11-06 19:56:16,845] Trial 566 finished with value: 0.5944341071243737 and parameters: {'C': 0.7475415368411242, 'solver': 'liblinear'}. Best is trial 236 with value: 0.5945206794543682.
[I 2024-11-06 19:56:18,444] Trial 567 finished with value: 0.5944686858254882 and parameters: {'C': 0.3425060190469467, 'solver': 'liblinear'}. Best is trial 236 with value: 0.5945206794543682.
[I 2024-11-06 19:56:19,409] Trial 568 finished with value: 0.5910974834998963 and parameters: {'C': 0.004163887902810526, 'solver': 'lbfgs'}. Best is trial 236 with value: 0.5945206794543682.
[I 2024-11-06 19:56:21,143] Trial 569 finished with value: 0.5944271055176585 and parameters: {'C': 0.618023875565525, 'solver': 'liblinear'}. Best is trial 236 with value: 0.5945206794543682.
[I 2024-11-06 19:56:22,681] Trial 570 finished with value: 0.5941435245933754 and parameters: {'C': 0.183067408130932, 'solver': 'liblinear'}. Best is trial 236 with value: 0.5945206794543682.
[I 2024-11-06 19:56:24,488] Trial 571 finished with value: 0.5945206794543682 and parameters: {'C': 0.41355499095501347, 'solver': 'liblinear'}. Best is trial 236 with value: 0.5945206794543682.
[I 2024-11-06 19:56:26,292] Trial 572 finished with value: 0.5944538960644219 and parameters: {'C': 0.4661499154917189, 'solver': 'liblinear'}. Best is trial 236 with value: 0.5945206794543682.
[I 2024-11-06 19:56:28,321] Trial 573 finished with value: 0.5944200192689717 and parameters: {'C': 0.8523402572006171, 'solver': 'liblinear'}. Best is trial 236 with value: 0.5945206794543682.
[I 2024-11-06 19:56:30,389] Trial 574 finished with value: 0.5944424619582916 and parameters: {'C': 0.6336393064332343, 'solver': 'liblinear'}. Best is trial 236 with value: 0.5945206794543682.
[I 2024-11-06 19:56:31,957] Trial 575 finished with value: 0.59427800923028 and parameters: {'C': 0.2567504356444331, 'solver': 'liblinear'}. Best is trial 236 with value: 0.5945206794543682.
[I 2024-11-06 19:56:33,800] Trial 576 finished with value: 0.5945206794543682 and parameters: {'C': 0.40947964625174227, 'solver': 'liblinear'}. Best is trial 236 with value: 0.5945206794543682.
[I 2024-11-06 19:56:35,605] Trial 577 finished with value: 0.5944004181433901 and parameters: {'C': 1.061464919271078, 'solver': 'liblinear'}. Best is trial 236 with value: 0.5945206794543682.
[I 2024-11-06 19:56:37,478] Trial 578 finished with value: 0.5944423539017045 and parameters: {'C': 0.6843405171447113, 'solver': 'liblinear'}. Best is trial 236 with value: 0.5945206794543682.
[I 2024-11-06 19:56:39,045] Trial 579 finished with value: 0.5941306048281534 and parameters: {'C': 0.1527428961648381, 'solver': 'liblinear'}. Best is trial 236 with value: 0.5945206794543682.
[I 2024-11-06 19:56:40,797] Trial 580 finished with value: 0.5944746354238873 and parameters: {'C': 0.45183571495016506, 'solver': 'liblinear'}. Best is trial 236 with value: 0.5945206794543682.
[I 2024-11-06 19:56:42,623] Trial 581 finished with value: 0.5944381827960278 and parameters: {'C': 0.7756688141825303, 'solver': 'liblinear'}. Best is trial 236 with value: 0.5945206794543682.
[I 2024-11-06 19:56:44,443] Trial 582 finished with value: 0.5944165760213188 and parameters: {'C': 0.3095811497222196, 'solver': 'liblinear'}. Best is trial 236 with value: 0.5945206794543682.
[I 2024-11-06 19:56:46,150] Trial 583 finished with value: 0.5944663994359581 and parameters: {'C': 0.554125264545404, 'solver': 'liblinear'}. Best is trial 236 with value: 0.5945206794543682.
[I 2024-11-06 19:56:47,620] Trial 584 finished with value: 0.5941711976229498 and parameters: {'C': 0.16245545936479378, 'solver': 'liblinear'}. Best is trial 236 with value: 0.5945206794543682.
[I 2024-11-06 19:56:49,376] Trial 585 finished with value: 0.5945206794543682 and parameters: {'C': 0.41655889392647866, 'solver': 'liblinear'}. Best is trial 236 with value: 0.5945206794543682.
[I 2024-11-06 19:56:51,096] Trial 586 finished with value: 0.594400523374502 and parameters: {'C': 0.8780648172943541, 'solver': 'liblinear'}. Best is trial 236 with value: 0.5945206794543682.
[I 2024-11-06 19:56:52,450] Trial 587 finished with value: 0.5910913326358876 and parameters: {'C': 0.011696715334470753, 'solver': 'liblinear'}. Best is trial 236 with value: 0.5945206794543682.
[I 2024-11-06 19:56:53,659] Trial 588 finished with value: 0.594160443146153 and parameters: {'C': 0.5688644057693732, 'solver': 'lbfgs'}. Best is trial 236 with value: 0.5945206794543682.
[I 2024-11-06 19:56:55,285] Trial 589 finished with value: 0.5944433941781605 and parameters: {'C': 0.33013199418191974, 'solver': 'liblinear'}. Best is trial 236 with value: 0.5945206794543682.
[I 2024-11-06 19:56:57,178] Trial 590 finished with value: 0.5944465036747404 and parameters: {'C': 0.7106087532374141, 'solver': 'liblinear'}. Best is trial 236 with value: 0.5945206794543682.
