[I 2024-11-06 20:06:44,155] Trial 930 finished with value: 0.594452488013693 and parameters: {'C': 0.5483290131681511, 'solver': 'liblinear'}. Best is trial 236 with value: 0.5945206794543682.
[I 2024-11-06 20:06:45,739] Trial 931 finished with value: 0.5942333748064208 and parameters: {'C': 0.21920388419355807, 'solver': 'liblinear'}. Best is trial 236 with value: 0.5945206794543682.
[I 2024-11-06 20:06:47,521] Trial 932 finished with value: 0.5944341071243737 and parameters: {'C': 0.7437463710658853, 'solver': 'liblinear'}. Best is trial 236 with value: 0.5945206794543682.
[I 2024-11-06 20:06:48,681] Trial 933 finished with value: 0.5664459791549634 and parameters: {'C': 0.0009664001946028122, 'solver': 'liblinear'}. Best is trial 236 with value: 0.5945206794543682.
[I 2024-11-06 20:06:50,588] Trial 934 finished with value: 0.5945165657501879 and parameters: {'C': 0.4336101826083248, 'solver': 'liblinear'}. Best is trial 236 with value: 0.5945206794543682.
[I 2024-11-06 20:06:52,342] Trial 935 finished with value: 0.5943849397349453 and parameters: {'C': 0.945850324224196, 'solver': 'liblinear'}. Best is trial 236 with value: 0.5945206794543682.
[I 2024-11-06 20:06:53,994] Trial 936 finished with value: 0.5944818032325733 and parameters: {'C': 0.5587318252541642, 'solver': 'liblinear'}. Best is trial 236 with value: 0.5945206794543682.
[I 2024-11-06 20:06:55,588] Trial 937 finished with value: 0.5944686183045149 and parameters: {'C': 0.35460733948875595, 'solver': 'liblinear'}. Best is trial 236 with value: 0.5945206794543682.
[I 2024-11-06 20:06:57,111] Trial 938 finished with value: 0.5941477046269784 and parameters: {'C': 0.18268064477208362, 'solver': 'liblinear'}. Best is trial 236 with value: 0.5945206794543682.
[I 2024-11-06 20:06:58,980] Trial 939 finished with value: 0.5944465036747404 and parameters: {'C': 0.7157397848589907, 'solver': 'liblinear'}. Best is trial 236 with value: 0.5945206794543682.
[I 2024-11-06 20:07:00,721] Trial 940 finished with value: 0.5945206794543682 and parameters: {'C': 0.42551309031143725, 'solver': 'liblinear'}. Best is trial 236 with value: 0.5945206794543682.
[I 2024-11-06 20:07:02,525] Trial 941 finished with value: 0.5945206794543682 and parameters: {'C': 0.41991590066361134, 'solver': 'liblinear'}. Best is trial 236 with value: 0.5945206794543682.
[I 2024-11-06 20:07:04,237] Trial 942 finished with value: 0.59440260619594 and parameters: {'C': 0.3041425156432535, 'solver': 'liblinear'}. Best is trial 236 with value: 0.5945206794543682.
[I 2024-11-06 20:07:06,157] Trial 943 finished with value: 0.5944719394321811 and parameters: {'C': 0.5635438877264188, 'solver': 'liblinear'}. Best is trial 236 with value: 0.5945206794543682.
[I 2024-11-06 20:07:07,984] Trial 944 finished with value: 0.5941336681272803 and parameters: {'C': 0.18922253574691883, 'solver': 'liblinear'}. Best is trial 236 with value: 0.5945206794543682.
[I 2024-11-06 20:07:09,753] Trial 945 finished with value: 0.5944382255861191 and parameters: {'C': 0.7968169844137254, 'solver': 'liblinear'}. Best is trial 236 with value: 0.5945206794543682.
[I 2024-11-06 20:07:11,518] Trial 946 finished with value: 0.5945165657501879 and parameters: {'C': 0.4316811900932271, 'solver': 'liblinear'}. Best is trial 236 with value: 0.5945206794543682.
[I 2024-11-06 20:07:12,894] Trial 947 finished with value: 0.5942797121586281 and parameters: {'C': 0.9996518875661318, 'solver': 'lbfgs'}. Best is trial 236 with value: 0.5945206794543682.
[I 2024-11-06 20:07:14,886] Trial 948 finished with value: 0.5944564825190385 and parameters: {'C': 0.5946961534956159, 'solver': 'liblinear'}. Best is trial 236 with value: 0.5945206794543682.
[I 2024-11-06 20:07:16,581] Trial 949 finished with value: 0.5941667285718086 and parameters: {'C': 0.1496233432405894, 'solver': 'liblinear'}. Best is trial 236 with value: 0.5945206794543682.
[I 2024-11-06 20:07:18,486] Trial 950 finished with value: 0.5945108362784295 and parameters: {'C': 0.39693689486305006, 'solver': 'liblinear'}. Best is trial 236 with value: 0.5945206794543682.
[I 2024-11-06 20:07:20,439] Trial 951 finished with value: 0.5944507362778312 and parameters: {'C': 0.6732605947438087, 'solver': 'liblinear'}. Best is trial 236 with value: 0.5945206794543682.
[I 2024-11-06 20:07:22,285] Trial 952 finished with value: 0.5944841377451722 and parameters: {'C': 0.37695279481176425, 'solver': 'liblinear'}. Best is trial 236 with value: 0.5945206794543682.
[I 2024-11-06 20:07:24,247] Trial 953 finished with value: 0.594400328171304 and parameters: {'C': 1.1930420309876277, 'solver': 'liblinear'}. Best is trial 236 with value: 0.5945206794543682.
[I 2024-11-06 20:07:25,856] Trial 954 finished with value: 0.594137487366344 and parameters: {'C': 0.14321514599096002, 'solver': 'liblinear'}. Best is trial 236 with value: 0.5945206794543682.
[I 2024-11-06 20:07:27,835] Trial 955 finished with value: 0.5944382255861191 and parameters: {'C': 0.8031133125171194, 'solver': 'liblinear'}. Best is trial 236 with value: 0.5945206794543682.
[I 2024-11-06 20:07:29,907] Trial 956 finished with value: 0.5944524591081727 and parameters: {'C': 0.5326224430216644, 'solver': 'liblinear'}. Best is trial 236 with value: 0.5945206794543682.
[I 2024-11-06 20:07:31,276] Trial 957 finished with value: 0.5844273216370898 and parameters: {'C': 0.003014660977661121, 'solver': 'liblinear'}. Best is trial 236 with value: 0.5945206794543682.
[I 2024-11-06 20:07:33,053] Trial 958 finished with value: 0.5944067404192159 and parameters: {'C': 0.30899422133793364, 'solver': 'liblinear'}. Best is trial 236 with value: 0.5945206794543682.
[I 2024-11-06 20:07:34,899] Trial 959 finished with value: 0.5944229713756195 and parameters: {'C': 0.6132127962491114, 'solver': 'liblinear'}. Best is trial 236 with value: 0.5945206794543682.
[I 2024-11-06 20:07:36,545] Trial 960 finished with value: 0.5944784820183935 and parameters: {'C': 0.3561266718489213, 'solver': 'liblinear'}. Best is trial 236 with value: 0.5945206794543682.
[I 2024-11-06 20:07:38,319] Trial 961 finished with value: 0.5944241813468227 and parameters: {'C': 0.8388301685961889, 'solver': 'liblinear'}. Best is trial 236 with value: 0.5945206794543682.
[I 2024-11-06 20:07:40,049] Trial 962 finished with value: 0.594458151416214 and parameters: {'C': 0.4927850547118498, 'solver': 'liblinear'}. Best is trial 236 with value: 0.5945206794543682.
[I 2024-11-06 20:07:41,587] Trial 963 finished with value: 0.5941475702588448 and parameters: {'C': 0.1762862332061943, 'solver': 'liblinear'}. Best is trial 236 with value: 0.5945206794543682.
[I 2024-11-06 20:07:43,310] Trial 964 finished with value: 0.5944507362778312 and parameters: {'C': 0.6698456620966393, 'solver': 'liblinear'}. Best is trial 236 with value: 0.5945206794543682.
[I 2024-11-06 20:07:44,898] Trial 965 finished with value: 0.5944434236663871 and parameters: {'C': 0.32350064194074524, 'solver': 'liblinear'}. Best is trial 236 with value: 0.5945206794543682.
[I 2024-11-06 20:07:46,778] Trial 966 finished with value: 0.5944045676268799 and parameters: {'C': 1.077824759948132, 'solver': 'liblinear'}. Best is trial 236 with value: 0.5945206794543682.
[I 2024-11-06 20:07:48,609] Trial 967 finished with value: 0.594458151416214 and parameters: {'C': 0.4778467326639947, 'solver': 'liblinear'}. Best is trial 236 with value: 0.5945206794543682.
[I 2024-11-06 20:07:50,115] Trial 968 finished with value: 0.5941296159916997 and parameters: {'C': 0.1855631861784027, 'solver': 'liblinear'}. Best is trial 236 with value: 0.5945206794543682.
[I 2024-11-06 20:07:50,864] Trial 969 finished with value: 0.27971440622817345 and parameters: {'C': 6.916042597193695e-05, 'solver': 'liblinear'}. Best is trial 236 with value: 0.5945206794543682.
[I 2024-11-06 20:07:52,129] Trial 970 finished with value: 0.5943312248177104 and parameters: {'C': 0.7216573993426997, 'solver': 'lbfgs'}. Best is trial 236 with value: 0.5945206794543682.
[I 2024-11-06 20:07:53,974] Trial 971 finished with value: 0.5943808274095643 and parameters: {'C': 0.925554082913511, 'solver': 'liblinear'}. Best is trial 236 with value: 0.5945206794543682.
[I 2024-11-06 20:07:55,853] Trial 972 finished with value: 0.5944664551671568 and parameters: {'C': 0.5102805597551185, 'solver': 'liblinear'}. Best is trial 236 with value: 0.5945206794543682.
[I 2024-11-06 20:07:57,585] Trial 973 finished with value: 0.5944165760213188 and parameters: {'C': 0.310922032079989, 'solver': 'liblinear'}. Best is trial 236 with value: 0.5945206794543682.
[I 2024-11-06 20:07:59,476] Trial 974 finished with value: 0.5944524591081727 and parameters: {'C': 0.5420793136809792, 'solver': 'liblinear'}. Best is trial 236 with value: 0.5945206794543682.
[I 2024-11-06 20:08:01,372] Trial 975 finished with value: 0.5941435245933754 and parameters: {'C': 0.18302321027045285, 'solver': 'liblinear'}. Best is trial 236 with value: 0.5945206794543682.
[I 2024-11-06 20:08:03,459] Trial 976 finished with value: 0.5944423909473389 and parameters: {'C': 0.7214217927016493, 'solver': 'liblinear'}. Best is trial 236 with value: 0.5945206794543682.
[I 2024-11-06 20:08:05,562] Trial 977 finished with value: 0.5945108362784295 and parameters: {'C': 0.3960622878132787, 'solver': 'liblinear'}. Best is trial 236 with value: 0.5945206794543682.
[I 2024-11-06 20:08:07,461] Trial 978 finished with value: 0.5944229713756195 and parameters: {'C': 0.6128848477776113, 'solver': 'liblinear'}. Best is trial 236 with value: 0.5945206794543682.
[I 2024-11-06 20:08:09,190] Trial 979 finished with value: 0.5944433941781605 and parameters: {'C': 0.32810608684613807, 'solver': 'liblinear'}. Best is trial 236 with value: 0.5945206794543682.
[I 2024-11-06 20:08:11,049] Trial 980 finished with value: 0.5944241813468227 and parameters: {'C': 0.8299668803384865, 'solver': 'liblinear'}. Best is trial 236 with value: 0.5945206794543682.
[I 2024-11-06 20:08:12,763] Trial 981 finished with value: 0.5941290511405313 and parameters: {'C': 0.15190590232400386, 'solver': 'liblinear'}. Best is trial 236 with value: 0.5945206794543682.
[I 2024-11-06 20:08:14,592] Trial 982 finished with value: 0.5944927192421414 and parameters: {'C': 0.44307250904547624, 'solver': 'liblinear'}. Best is trial 236 with value: 0.5945206794543682.
[I 2024-11-06 20:08:16,351] Trial 983 finished with value: 0.5943849397349453 and parameters: {'C': 0.9734383608539948, 'solver': 'liblinear'}. Best is trial 236 with value: 0.5945206794543682.
[I 2024-11-06 20:08:18,052] Trial 984 finished with value: 0.5944424619582916 and parameters: {'C': 0.6335801352249602, 'solver': 'liblinear'}. Best is trial 236 with value: 0.5945206794543682.
[I 2024-11-06 20:08:19,581] Trial 985 finished with value: 0.5941941592929504 and parameters: {'C': 0.19476423626960684, 'solver': 'liblinear'}. Best is trial 236 with value: 0.5945206794543682.
[I 2024-11-06 20:08:21,375] Trial 986 finished with value: 0.5943905567746292 and parameters: {'C': 1.3313964939621492, 'solver': 'liblinear'}. Best is trial 236 with value: 0.5945206794543682.
[I 2024-11-06 20:08:27,411] Trial 987 finished with value: 0.594409218038253 and parameters: {'C': 0.4509985681867953, 'solver': 'saga'}. Best is trial 236 with value: 0.5945206794543682.
[I 2024-11-06 20:08:28,919] Trial 988 finished with value: 0.5943550128177442 and parameters: {'C': 0.29510090535176614, 'solver': 'liblinear'}. Best is trial 236 with value: 0.5945206794543682.
[I 2024-11-06 20:08:30,242] Trial 989 finished with value: 0.5898486145656152 and parameters: {'C': 0.008018371789392187, 'solver': 'liblinear'}. Best is trial 236 with value: 0.5945206794543682.
[I 2024-11-06 20:08:32,054] Trial 990 finished with value: 0.5944341071243737 and parameters: {'C': 0.749965757190098, 'solver': 'liblinear'}. Best is trial 236 with value: 0.5945206794543682.
[I 2024-11-06 20:08:33,252] Trial 991 finished with value: 0.5941822277187949 and parameters: {'C': 0.581491053134279, 'solver': 'lbfgs'}. Best is trial 236 with value: 0.5945206794543682.
[I 2024-11-06 20:08:34,947] Trial 992 finished with value: 0.5944377413544031 and parameters: {'C': 0.32183816394401155, 'solver': 'liblinear'}. Best is trial 236 with value: 0.5945206794543682.
[I 2024-11-06 20:08:36,835] Trial 993 finished with value: 0.594458151416214 and parameters: {'C': 0.4866357708803969, 'solver': 'liblinear'}. Best is trial 236 with value: 0.5945206794543682.
[I 2024-11-06 20:08:38,826] Trial 994 finished with value: 0.594400523374502 and parameters: {'C': 0.8927889728130902, 'solver': 'liblinear'}. Best is trial 236 with value: 0.5945206794543682.
[I 2024-11-06 20:08:40,465] Trial 995 finished with value: 0.5941477046269784 and parameters: {'C': 0.1817673610637738, 'solver': 'liblinear'}. Best is trial 236 with value: 0.5945206794543682.
[I 2024-11-06 20:08:42,327] Trial 996 finished with value: 0.5944507362778312 and parameters: {'C': 0.6622487815521949, 'solver': 'liblinear'}. Best is trial 236 with value: 0.5945206794543682.
[I 2024-11-06 20:08:44,388] Trial 997 finished with value: 0.5945206794543682 and parameters: {'C': 0.4178160608537988, 'solver': 'liblinear'}. Best is trial 236 with value: 0.5945206794543682.
[I 2024-11-06 20:08:46,114] Trial 998 finished with value: 0.5944629786163811 and parameters: {'C': 0.3490106234856368, 'solver': 'liblinear'}. Best is trial 236 with value: 0.5945206794543682.
[I 2024-11-06 20:08:47,275] Trial 999 finished with value: 0.5809263663019435 and parameters: {'C': 0.0021082191439254494, 'solver': 'liblinear'}. Best is trial 236 with value: 0.5945206794543682.
[I 2024-11-06 20:08:47,757] A new study created in memory with name: no-name-553afb4a-d6d3-4c5a-9384-09f87df56e70
[I 2024-11-06 20:08:52,283] Trial 0 finished with value: 0.5882239724487766 and parameters: {'n_estimators': 28, 'max_depth': 21, 'min_samples_split': 15, 'min_samples_leaf': 12}. Best is trial 0 with value: 0.5882239724487766.
[I 2024-11-06 20:09:00,789] Trial 1 finished with value: 0.5928446960330208 and parameters: {'n_estimators': 75, 'max_depth': 15, 'min_samples_split': 13, 'min_samples_leaf': 13}. Best is trial 1 with value: 0.5928446960330208.
[I 2024-11-06 20:09:29,773] Trial 2 finished with value: 0.5852151476999148 and parameters: {'n_estimators': 170, 'max_depth': 34, 'min_samples_split': 14, 'min_samples_leaf': 3}. Best is trial 1 with value: 0.5928446960330208.
[I 2024-11-06 20:09:46,171] Trial 3 finished with value: 0.5896594916398531 and parameters: {'n_estimators': 117, 'max_depth': 49, 'min_samples_split': 3, 'min_samples_leaf': 15}. Best is trial 1 with value: 0.5928446960330208.
[I 2024-11-06 20:09:53,840] Trial 4 finished with value: 0.5865342576616637 and parameters: {'n_estimators': 48, 'max_depth': 27, 'min_samples_split': 15, 'min_samples_leaf': 8}. Best is trial 1 with value: 0.5928446960330208.
[I 2024-11-06 20:09:58,934] Trial 5 finished with value: 0.5927437109182503 and parameters: {'n_estimators': 107, 'max_depth': 4, 'min_samples_split': 4, 'min_samples_leaf': 5}. Best is trial 1 with value: 0.5928446960330208.
[I 2024-11-06 20:10:09,452] Trial 6 finished with value: 0.5928903708017548 and parameters: {'n_estimators': 176, 'max_depth': 6, 'min_samples_split': 15, 'min_samples_leaf': 7}. Best is trial 6 with value: 0.5928903708017548.
[I 2024-11-06 20:10:14,771] Trial 7 finished with value: 0.5862320180722669 and parameters: {'n_estimators': 35, 'max_depth': 26, 'min_samples_split': 18, 'min_samples_leaf': 14}. Best is trial 6 with value: 0.5928903708017548.
[I 2024-11-06 20:10:15,993] Trial 8 finished with value: 0.5908999611633943 and parameters: {'n_estimators': 11, 'max_depth': 9, 'min_samples_split': 15, 'min_samples_leaf': 15}. Best is trial 6 with value: 0.5928903708017548.
[I 2024-11-06 20:10:24,126] Trial 9 finished with value: 0.592487297963479 and parameters: {'n_estimators': 139, 'max_depth': 6, 'min_samples_split': 14, 'min_samples_leaf': 1}. Best is trial 6 with value: 0.5928903708017548.
[I 2024-11-06 20:10:49,453] Trial 10 finished with value: 0.5914019158017365 and parameters: {'n_estimators': 194, 'max_depth': 40, 'min_samples_split': 9, 'min_samples_leaf': 20}. Best is trial 6 with value: 0.5928903708017548.
[I 2024-11-06 20:10:57,436] Trial 11 finished with value: 0.5926044268210958 and parameters: {'n_estimators': 68, 'max_depth': 15, 'min_samples_split': 9, 'min_samples_leaf': 8}. Best is trial 6 with value: 0.5928903708017548.
[I 2024-11-06 20:11:06,972] Trial 12 finished with value: 0.592004517882509 and parameters: {'n_estimators': 77, 'max_depth': 16, 'min_samples_split': 20, 'min_samples_leaf': 9}. Best is trial 6 with value: 0.5928903708017548.
[I 2024-11-06 20:11:11,088] Trial 13 finished with value: 0.5893152735967122 and parameters: {'n_estimators': 144, 'max_depth': 1, 'min_samples_split': 11, 'min_samples_leaf': 19}. Best is trial 6 with value: 0.5928903708017548.
[I 2024-11-06 20:11:18,783] Trial 14 finished with value: 0.5930827661521045 and parameters: {'n_estimators': 77, 'max_depth': 12, 'min_samples_split': 11, 'min_samples_leaf': 6}. Best is trial 14 with value: 0.5930827661521045.
[I 2024-11-06 20:11:34,861] Trial 15 finished with value: 0.5922210758626025 and parameters: {'n_estimators': 183, 'max_depth': 11, 'min_samples_split': 7, 'min_samples_leaf': 5}. Best is trial 14 with value: 0.5930827661521045.
[I 2024-11-06 20:11:54,889] Trial 16 finished with value: 0.5900956257514309 and parameters: {'n_estimators': 144, 'max_depth': 21, 'min_samples_split': 18, 'min_samples_leaf': 6}. Best is trial 14 with value: 0.5930827661521045.
[I 2024-11-06 20:11:57,521] Trial 17 finished with value: 0.590167584910588 and parameters: {'n_estimators': 91, 'max_depth': 1, 'min_samples_split': 12, 'min_samples_leaf': 10}. Best is trial 14 with value: 0.5930827661521045.
[I 2024-11-06 20:12:08,070] Trial 18 finished with value: 0.59199227573837 and parameters: {'n_estimators': 123, 'max_depth': 10, 'min_samples_split': 6, 'min_samples_leaf': 1}. Best is trial 14 with value: 0.5930827661521045.
[I 2024-11-06 20:12:33,802] Trial 19 finished with value: 0.587385181300568 and parameters: {'n_estimators': 167, 'max_depth': 31, 'min_samples_split': 9, 'min_samples_leaf': 7}. Best is trial 14 with value: 0.5930827661521045.
[I 2024-11-06 20:12:41,544] Trial 20 finished with value: 0.5896239135291086 and parameters: {'n_estimators': 55, 'max_depth': 19, 'min_samples_split': 17, 'min_samples_leaf': 3}. Best is trial 14 with value: 0.5930827661521045.
[I 2024-11-06 20:12:50,838] Trial 21 finished with value: 0.5934490574491821 and parameters: {'n_estimators': 84, 'max_depth': 14, 'min_samples_split': 11, 'min_samples_leaf': 12}. Best is trial 21 with value: 0.5934490574491821.
[I 2024-11-06 20:12:57,033] Trial 22 finished with value: 0.5922198953138054 and parameters: {'n_estimators': 95, 'max_depth': 7, 'min_samples_split': 11, 'min_samples_leaf': 11}. Best is trial 21 with value: 0.5934490574491821.
[I 2024-11-06 20:13:06,446] Trial 23 finished with value: 0.59269317987671 and parameters: {'n_estimators': 91, 'max_depth': 13, 'min_samples_split': 10, 'min_samples_leaf': 17}. Best is trial 21 with value: 0.5934490574491821.
[I 2024-11-06 20:13:14,337] Trial 24 finished with value: 0.5911100080888716 and parameters: {'n_estimators': 60, 'max_depth': 18, 'min_samples_split': 7, 'min_samples_leaf': 10}. Best is trial 21 with value: 0.5934490574491821.
[I 2024-11-06 20:13:19,970] Trial 25 finished with value: 0.5934702752513573 and parameters: {'n_estimators': 121, 'max_depth': 4, 'min_samples_split': 12, 'min_samples_leaf': 4}. Best is trial 25 with value: 0.5934702752513573.
[I 2024-11-06 20:13:39,826] Trial 26 finished with value: 0.5877456215346821 and parameters: {'n_estimators': 129, 'max_depth': 23, 'min_samples_split': 12, 'min_samples_leaf': 3}. Best is trial 25 with value: 0.5934702752513573.
[I 2024-11-06 20:13:45,198] Trial 27 finished with value: 0.5931769867655217 and parameters: {'n_estimators': 105, 'max_depth': 4, 'min_samples_split': 7, 'min_samples_leaf': 5}. Best is trial 25 with value: 0.5934702752513573.
[I 2024-11-06 20:13:50,891] Trial 28 finished with value: 0.5938062391538603 and parameters: {'n_estimators': 109, 'max_depth': 4, 'min_samples_split': 6, 'min_samples_leaf': 3}. Best is trial 28 with value: 0.5938062391538603.
[I 2024-11-06 20:13:56,980] Trial 29 finished with value: 0.5953366017224067 and parameters: {'n_estimators': 152, 'max_depth': 3, 'min_samples_split': 2, 'min_samples_leaf': 12}. Best is trial 29 with value: 0.5953366017224067.
[I 2024-11-06 20:14:01,963] Trial 30 finished with value: 0.5891626306904001 and parameters: {'n_estimators': 158, 'max_depth': 1, 'min_samples_split': 2, 'min_samples_leaf': 3}. Best is trial 29 with value: 0.5953366017224067.
[I 2024-11-06 20:14:09,868] Trial 31 finished with value: 0.5937512529561233 and parameters: {'n_estimators': 154, 'max_depth': 4, 'min_samples_split': 4, 'min_samples_leaf': 12}. Best is trial 29 with value: 0.5953366017224067.
[I 2024-11-06 20:14:16,840] Trial 32 finished with value: 0.5937347300348715 and parameters: {'n_estimators': 153, 'max_depth': 4, 'min_samples_split': 4, 'min_samples_leaf': 12}. Best is trial 29 with value: 0.5953366017224067.
[I 2024-11-06 20:14:28,042] Trial 33 finished with value: 0.5922707263519006 and parameters: {'n_estimators': 156, 'max_depth': 8, 'min_samples_split': 5, 'min_samples_leaf': 12}. Best is trial 29 with value: 0.5953366017224067.
[I 2024-11-06 20:14:35,351] Trial 34 finished with value: 0.5937159716479914 and parameters: {'n_estimators': 156, 'max_depth': 4, 'min_samples_split': 2, 'min_samples_leaf': 13}. Best is trial 29 with value: 0.5953366017224067.
[I 2024-11-06 20:14:51,186] Trial 35 finished with value: 0.5919199533637987 and parameters: {'n_estimators': 194, 'max_depth': 10, 'min_samples_split': 4, 'min_samples_leaf': 16}. Best is trial 29 with value: 0.5953366017224067.
